src_text,tgt_text,cosine_score
"Molaokakanywa wo o thadilwego o ka hwetšwa go WEBTOKESengwalwa sa Molaokakanywa wa Phetošo ya Melao ya Bohlodi ya Kakaretšo (GILAB) wa 2023.
","vusulusa tshumelo dza zwa vhusevhi u itela u ṋetshedza mbonalo ya tshiimiswa tshine tsha ita uri hu vhe na mashumele avhuḓi nahone o khwaṱhaho nga u vhumba zhendedzi ḽa zwa vhusevhi ha ngomu hayani khathihi na tshumelo dza zwa vhusevhi ha mashango a nnḓa
",0.46881336
"Kabinete e dumeletše sengwalwa sa GILAB sa 2023 gore se romelwe Palamenteng.
","u khakhulula vhukhakhi vhune ha vha hone kha Mashumele a Vhusevhi ha Vhurathisi sa zwe zwa khwaṱhisedzwa nga Khothe ya Ndayotewa
",0.48995513
"GILAB e šišinya diphetošo go Molao wa Bosetšhaba wa Bohlodi bja Togamaano, 1994 (Molao wa 39 wa 1994).
","u tandulula thaidzo dza vhuṱudzeṱudze he ha ṱaluswa nga maitele a vha Tshigwada tsha u Shuma tsha Mishumo ya zwa Masheleni, hu tshi katelwa na maga a u fhelisa zwiito zwa u tshimbidzwa ha masheleni nga nḓila i siho mulayoni khathihi na zwa u ṋetshedzwa ha masheleni kha zwiito zwa vhutherorisi nga u maanḓafhadza zwiimiswa zwa vhutsireledzi ha lushaka u itela uri zwi kone u ita ṱhoḓisiso na u ita tsenguluso ya zwa vhusevhi arali muthu kana tshiimiswa itsho tshi tsha ndeme kha lushaka
",0.5251541
"Molaokakanywa wo o dira gore ditšhišinyo tša sehlopha sa Tshekatsheko ya Maemo a Godimo sa Mopresidente ka ga Etšentshi ya Tšhireletšo ya Mmušo (SSA) gammogo le leano la phethagatšo la ditšhišinyo tša Khomišene ya Boahlodi ya Dinyakišišo ka ga Ditatofatšo tša go Thopša ga Mmušo, Bomenetša le Boradia ka Lekaleng la Setšhaba go akaretšwa Makala a Mmušo.
","U khwaṱhisa maga a u langa na u tshimbidza nḓowetshumo ya zwa vhutsireledzi ha phuraivethe sa tshipiḓa tsha maitele a tsireledzo ya lushaka nga u angaredza na
",0.6104268
"Magareng ga tše dingwe Molaokakanywa wo o nyaka:
","u vhea maga a u langa vhuḓifari ha miraḓo ya kale ya tshumelo khathihi na vhaṅwe vhane vha vha na tswikelo kha mafhungo a zwa vhusevhi.
",0.23442979
"go beakanyaleswa ditirelo tša bohlodi go aba sebopego sa setheo seo se kgontšhago go šoma gabotse le ka tshwanelo ka go hloma etšentshi ya bohlodi bja ka nageng le tirelo ya bohlodi bja dinaga tša ka ntle
","Hoyu Mulayotibe u ḓo dovha hafhu wa vhona uri tshumelo dza SSA a dzi khou shumiswa nga nḓila i songo teaho hu tshi itelwa u vhuedza kana u bveledza ndivho dza vhaṅwe vhathu.
",0.5471574
"go lokiša diphošo tša go šoma ga Bokgoni bja Bohlodi bja Ditšhupetšo bjalo ka ge go tiišeditšwe ke Kgorotsheko ya Molaotheo
","Khwiniso dzi ḓo dovha hafhu dza khwaṱhisa mushumo wa zwa vhulavhelesi ha mazhendedzi a zwa vhusevhi nga zwiimiswa zwi fanaho na Muṱolimuhulwane wa zwa Vhusevhi, Komiti ya Phalamennde yo Ṱanganelaho na Muṱolambalelano wa Afrika Tshipembe.
",0.5698802
"go šogana le mafokodi ao a hlaotšwego ka tshepetšo ya Sehlophatšhomo sa Tšhomišo ya Ditšhelete, go akaretšwa magato a go lwantšha tshepetšo ya tšhelete ye e sego molaong le thušo ya ditšhelete ya botšhošetši ka go matlafatša dibopego tša tšhireletšo ya bosetšhaba go nyakišiša le go dira tekolo ya tšhireletšo ge motho goba setheo se na le kgahlego ya tšhireletšo ya bosetšhaba
","Mulayotibe uyu u khou wanala kha webusaithi ya WEBTOKEN..Mvetamveto ya Mulayotibe wa Khomishimi ya Tshumelo dza Muvhuso (PSC) ya ṅwaha wa 2023 Khabinethe yo ṱanganedza u anḓadzwa ha mvetamveto ya Mulayotibe wa PSC wa ṅwaha wa 2023 u itela vhupfiwa ha nnyi na nnyi.
",0.63108236
"Go matlafatša magato a go laola le go beakanya intasteri ya tšhireletšo ya poraebete bjalo ka karolo ya mokgwa wo o nabilego wa tšhireletšo ya bosetšhaba le
","Mulayotibe uyu u phumula Mulayo wa PSC, wa ṅwaha wa 1997 (Mulayo 46 wa 1997) wa Ndayotewa ya Riphabuḽiki ya Afrika Tshipembe, wa 1996.
",0.5645856
"go bea magato a go laola maitshwaro a maloko a peleng a tirelo le ba bangwe bao ba kgona go fihlelela tshedimošo ya bohlodi.
","Mulayotibe u ṋetshedza tshikhala tsha u thomiwa ha khethekanyo ya vhuṅwaleli ho ḓiimisaho ha PSC hu tshi itelwa u khwaṱhisa zwa u ḓiimisa nga ndoṱhe na u sa dzhia sia ha dzangano.
",0.5780047
"Molaokakanywa wo o tla kgonthiša gape gore ditirelo tša SSA ga di šomišwe gampe go šomela dikgahlego goba kgopolo ya batho ba itšego.
","Musi Mulayotibe wo no phasiswa uri u vhe mulayo, mushumo wa PSC u vho ḓo engedzwa u ya na kha mimasipala khathihi na zwiimiswa zwa muvhuso.
",0.5497835
"Diphetošo tše di tla matlafatša tlhokomelo ya dietšentshi tša bohlodi ka mekgatlo ya go swana le Mohlahlobipharephare wa Bohlodi, Komiti ya Mohlakanelwa ya ka Mehla ya Bohlodi le Mohlakišipharephare wa Dipuku wa Afrika Borwa.
","Khwinifhadzo iyi i ḓo ṋea PSC tshikhala tsha u kona u tou lavhelesa lwa tshoṱhe kha zwa u shela mulenzhe hu pfadzaho ho livhiswaho kha u fhaṱa tshumelo ya muvhuso i sedzaho zwililo zwa vhathu, i re na mikhwa yavhuḓi nahone i langwaho nga maitele a tshumelo dzavhuḓi dza muvhuso.
",0.5820403
"Molaokakanywa o hwetšagala mo go WEBTOKEN..Sengwalwa sa Molaokakanywa wa Khomišene ya Tirelo ya Setšhaba (PSC) wa 2023.
","Mulayotibe uyu u khou wanala kha webusaithi ya WEBTOKEN.
",0.59158796
"Kabinete e dumeletše phatlalatšo ya sengwalwa sa Molaokakanywa wa PSC wa 2023 gore setšhaba se dire ditshwayotshwayo.
","Mvetamveto ya Mulayotibe wa Mulavhelesi wa Nyukilia ya Lushaka ya ṅwaha wa 2023.
",0.72148716
"Molaokakanywa wo o phumola Molao wa PSC, 1997 (Molao wa 46 wa 1997) wa Molaotheo wa Repabliki ya Afrika Borwa wa 1996.
","Khabinethe yo ṱanganedza Mvetamveto ya Mulayotibe wa Mulavhelesi wa Nyukilia ya Lushaka uri u kone u rumelwa Phalamenndeni.
",0.5357467
"Molaokakanywa o hlagiša go hlongwa ga bongwaledi bjo bo ikemetšego bja PSC go matlafatša boipušo le go se tšeye lehlakore ga mokgatlo.
","Mulayotibe uyu u khwinisa Mulayo wa Mulavhelesi wa Nyukilia ya Lushaka (NNR), wa ṅwaha wa 1999 (Mulayo 47 wa 1999).
",0.5920161
"Ge Molaokakanywa wo o šetše o dirilwe molao, taelo ya PSC e tla katološetšwa go mebasepala le ditheo tša setšhaba.
","Mulayotibe u khou lingedza u fhelisa tshikhala tshine tsha vha hone zwazwino kha Mulayo wa NNR wa 1999.
",0.51499903
"Phetošo ye e tla fa PSC mokgwa wo o tsepeletšego kudu mo go beng le seabe sa mohola go ya kagong ya tirelo ya setšhaba ye e arabelago, ye e nago le maitshwaro le ye e laolwago ke mekgwa.
","Mulayo uyu kha tshivhumbeo tshawo tsha zwino, a u elani na maitele a mashumele avhuḓi a dzitshaka kha sia ḽa milayo ya tsireledzo ya nyukilia ngauri a u ambi tshithu nga ha u sa tsireledzea mishumoni ha vhashumi kha muhasaladzo wa tshikhalani.
",0.6045289
"Molaokakanywa wo o hwetšagala go www.
","Mulayotibe uyu wo dovha hafhu wa dzudzanyelwa uri u tshimbilelane na Mulayo wa NNR wa 1999 khathihi na milayo na maitele avhuḓi a Zhendedzi ḽa Fulufulu ḽa Athomiki ḽa Dzitshaka (IAEA).
",0.40772533
"dpsa.
","Afrika Tshipembe ndi muraḓo wa IAEA.
",0.43433392
"gov.
","Vhuṱambo vhune ha khou ḓa.
",0.45376635
"za.
","U Dzheniswa Tshiduloni ha Phresidennde wa Riphabuḽiki ya Federala ya Nigeria
",0.21070945
"Sengwalwa sa Molaokakanywa wa Phetošo ya Molaodi wa Bosetšhaba wa Nyutleliya wa 2023.
","Nga Musumbuluwo, wa ḽa 29 Shundunthule 2023, Phresidennde Vho Ramaphosa vha ḓo ṱanganedza thambo ya u dzhenela vhuṱambo ha u Dzheniswa Tshiduloni ha Phresidennde Vho Bola Ahmed Tinubu vha Riphabuḽiki ya Federala ya Nigeria vhane vha kha ḓi tou bva u nangiwa.
",0.57013595
"Kabinete e amogetše sengwalwa sa Molaokakanywaphetošo wa Molaodi wa Nyutleliya gore o romelwe Palamenteng.
","U shela mulenzhe ha Phresidennde hu ḓo sumbedza u bvela phanḓa ha vhushaka ha ndeme vhu re hone vhukati ha shango ḽa Afrika Tshipembe na ḽa Nigeria.
",0.55569106
"Molaokakanywa o fetoša Molao wa Molaodi wa Bosetšhaba wa Nyutleliya (NNR) wa 1999 (Molao wa 47 wa 1999).
","Sango ḽa Nigeria ndi muvhambadzelani muhulwane vhukuma na shango ḽa Afrika Tshipembe kha tshipiḓa tsha mashango a re Vhukovhela ha dzhango ḽa Afrika.
",0.56673884
"Molaokakanywa o nyaka go šogana le diphapano tše di lego gona ka Molaong wa bjale wa NNR wa 1999.
","Mamaga manzhi o fhambanaho a ḽa Afrika Tshipembe a khou bindudza fhaḽa kha ḽa Nigeria, ngeno khamphani dza ḽa Nigeria na dzone dzi tshi khou thoma u vhonala fhano kha ḽa Afrika Tshipembe.
",0.55690306
"Molao wo ka sebopego sa wona sa bjale ga o sepelelane le mekgwa ye mekaone ya boditšhabatšhaba ka lekaleng la melawana ya polokego ya nyutliya gobane ga o šogane le go lebana ga bašomi ba difofane le mahlasedi a kedišo mošomong.
","Vhege ya Tsireledzo ya Vhana Afrika Tshipembe ḽi ḓo vha ḽi tshi khou fhululedza Vhege ya Tsireledzo ya Vhana u bva nga ḽa 28 Shundunthule u swika ḽa 4 Fulwi 2023 nga fhasi ha thero ine ya ri: “Kha ri Tsireledze Vhana nga Tshifhinga tsha Dwadze ḽa COVID-19 na u Fhira”.
",0.53695935
"Molaokakanywa o hlamilwe gape go sepelelana le Molao wa NNR wa 1999 le ditaelo tša Etšentshi ya Boditšhabatšhaba ya Enetši ya Athomo (IAEA) le mokgwa wa wona wo mokaone.
","Fulo iḽi ḽi kuvhanganya sekhithara dzoṱhe na zwitshavha uri zwi aluse, zwi ṱhogomele na u tsireledza vhana.2 Houno ṅwaha, fulo iḽi ḽi ḓo sedzesa kha RISIHA, ine ya vha mbekanyamushumo ya u thivhela na u dzhenelela nga u ṱavhanya i wanalaho ngomu kha tshitshavha, ine muhumbulo wayo ha vha u bvisa vhana kha tshiimo tshine a vho ngo tsireledzea ya vha isa kha tshiimo tsha u kona u konḓelela.
",0.53275067
"Afrika Borwa ke leloko la IAEA.
","Madalo a Vhulavhelesi ha DDM ngei Kapa Vhubvaḓuvha.1 Muthusaphresidennde Vho, Mr Paul Mashatile vha ḓo fara Madalo a Vhulavhelesi ha DDM ngei Kapa Vhubvaḓuvha nga ḽa 26 na 27 Shundunthule 2023 kha Tshiṱiriki tsha OR Tambo na Buffalo City Metro, ngei Kapa Vhubvaḓuvha.2 Madalo aya ndi tshipiḓa tsha maga a muvhuso a u vhona uri hu khou vha na u bveledzwa ha zwitshavha nga nḓila ine ya ṱuṱuwedzwa nga maitele a DDPhalamennde ya vhurathi ya Pan-African Parliament (PAP)4.1 Vharangaphanḓa u bva kha dzhango ḽoṱhe ḽa Afrika vho ṱangana u bva nga Musumbuluwo, wa ḽa 15 Shundunthule 2023 ngei Midrand, Afrika Tshipembe, kha muṱangano wa Vhurathi wa Phalamennde ya PADzulo iḽi ḽi ḓo khunyeledzwa nga ḽa 02 Fulwi 20 2 PAP i khou lingedza u tandulula khaedu dzi fanaho kha dzhango ḽa Afrika nahone yo imelwa nga vharangaphanḓa vha Afrika u bva kha dzhango ḽoṱhe nga u angaredza.
",0.34679562
"Ditiragalo tše di Tlago.
","Khomishini ya Vhukati ha Mivhuso ya nga ha zwa Lwanzheni (IOC)5.1 Shango ḽa Afrika Tshipembe ḽi ḓo shela mulenzhe kha dzulo ḽa vhu56 ḽa khorotshitumbe ḽine ḽa ḓo farelwa fhaḽa ḓoroboni ya Paris, kha ḽa France u bva ḽa 16 u swika ḽa 30 Fulwi 20 2 IOC ya Dzangano ḽa zwa Pfunzo, Saintsi na Mvelele ḽa UN (IOC-UNESCO), ndi tshiimiswa tsha UN tshine tsha vha na vhuḓifhinduleli ha u tikedza saintsi na tshumelo dza lwanzheni dza ḽifhasi.3 Shango ḽa Afrika Tshipembe ḽi khou dzhiela nṱha ndeme ya ṱhoḓisiso na ndangulo ya maḓanzhe aḽo khathihi na vhupo ha khunzikhunzini hu tshi itelwa mveledziso ya tshifhinga tshilapfu.
",-0.007876761
"Tlhomamišo ya Mopresidente wa Repabliki ya Federale ya Nigeria
","Ṱhoḓisiso dza zwa lwanzheni dzi thusa kha u ṋetshedza ngafhadzo nga tshifhinga dza nga ha malugana na zwizwo zwa lwanzheni u itela u thusa mivhuso uri i kone u dzhia tsheo dzo teaho..Shango ḽa Afrika Tshipembe ḽi khou fara mitambo mihulwane ya vhugweṋa.1 Vhafuni vha mitambo u mona na ḽifhasi ḽoṱhe vha nga lavhelela u ṱanganedzwa nga muya wa Ubuntu khathihi na u farwa nga nḓila ya maimo a nṱha musi vha tshi dzhenela mitambo ya Tshiphuga tsha Ḽifhasi tsha Netibolo khathihi na Vhugwena ha Ḽifhasi ha Karati ya Kimura Shukokai International (KSI) fhano kha ḽa Afrika Tshipembe.
",0.3307584
"Ka Mošupologo, 29 Mopitlo 2023, Mopresidente Ramaphosa o tla hlompha taletšo ya go tsenela tlhomamišo ya Mopresidente yo a Kgethilwego Morena Bola Ahmed Tinubu wa Repabliki ya Federale ya Nigeria.
","Shango ḽa Afrika Tshipembe ḽi na rekhodo yavhuḓi ya u kona u fara vhuṱambo vhuhulwane ha ḽifhasi nga nḓila yavhuḓi.2 U nyanyuwa hu khou engedzea musi ho tou sala fhedzi maḓuvha a furathi (60) phanḓa ha musi mitambo ya Tshiphuga tsha Netibolo ya Ḽifhasi i tshi thoma fhaḽa Ḓoroboni ya Kapa u bva nga ḽa 28 Fulwana u swika ḽa 6 Ṱhangule 2023.
",0.5880575
"Go kgatha tema ga Mopresidente go tla laetša tšwelopele mo kamanong ya maano gare ga Afrika Borwa le Nigeria.
","Hezwi zwi ḓo vha lwa u tou thoma musi mitambo ya maimo a nṱha ngaurali i tshi farelwa fhano kha mavu a dzhango ḽa Afrika,6.3 Khabinethe i khou ita khuwelelo kha muthu muṅwe na muṅwe ya uri a tikedze fulo ḽa Netball Fridays, nga u ambara zwikhipha zwa vhatikedzi kana u ambara zwikhipha zwa mivhala ya thimu ya lushaka u itela u tikedza thimu ya Netibolo ya Lushaka ya Afrika Tshipembe.4 KSI Afrika Tshipembe na yone i khou ḓo fara mitambo ya vhu20 ya KSI ya Vhugwena ha Karati ha Ḽifhasi ngei Ḓoroboni ya Kapa u bva nga ḽa 10 u swika ḽa 15 Fulwana 2023, nahone ri khou tamela mashudu Team SA musi vha tshi khou ḓilugisela vhuṱambo uvhu ha mitambo iyi ya ḽifhasi ya maimo a nṱha ngaurali.5 Shango ḽa Afrika Tshipembe ḽi khou ḓihudza nga u fara mitambo ya Makhaulatshele a Vhugweṋa ha mitambo ya Table Tennis ya ṅwaha wa 2023 ine ya ḓo farelwa fhaḽa Sentharani ya zwa Miṱangano ya Dzitshaka ya Durban.
",0.4536289
"Nigeria ke modirišani yo mogologolo wa kgwebo wa Afrika Borwa ka Afrika Bodikela.
","Vhatambi vha swikaho 600 u bva kha mashango o fhambanaho ndi vhane zwazwino vha kati nahone mitambo iyi i ṋetshedza vhatambi vhashu tshikhala tsha u sumbedza vhukoni havho.
",0.4737994
"Mehutahuta ya difeme tša Afrika Borwa e beeleditše ka Nigeria, mola dikhamphani tša Nigeria le tšona di oketša kgolo ya tšona ka Afrika Borwa.
","Mitambo iyi yo thoma nga ḽa 20 Shundunthule 2023 nahone i ḓo bvela phanḓa u vhuya u swikela nga ḽa 28 Shundunthule 2023.Milaedza.
",0.5599575
"Beke ya Tšhireletšo ya Bana Afrika-Borwa e tla keteka Beke ya Tšhireletšo ya Bana go tloga ka la 28 Mopitlo go fihla ka la 4 Phupu 2023 ka fase ga kgwekgwe ye: “A re šireletšeng Bana nakong ya COVID-19 le ka Morago ga moo”.
","U fhululedzaKhabinethe yo rumela milaedza yayo ya u fhululedza na u tamela mashudu kha: Minisṱa wa Gwama, Vho Enoch Godongwana, vhe vha ṋewa pfufho ya maimo a nṱha ya African Banker 2023, Pfufho ya u vha Minisṱa wa Gwama wa Ṅwaha ngei Sharm El Sheikh, kha ḽa Egypt nga Ḽavhuraru, ḽa 24 Shundunthule 2023 kha ndingedzo dzavho kha tshifhinga tsha miṅwaha mivhili yo fhelaho dza u langa ikonomi ya shango ḽa Afrika Tshipembe kha nyimele i konḓaho ya ḽifhasi na ya ngomu hayani.
",0.66495544
"Lesolo le le kgoboketša makala ka moka le ditšhaba go ya tlhabollong, tlhokomelong, le tšhireletšong ya bana.2 Ngwaga wo lesolo le tla lebiša tlhokomelo go RISIHA, lenaneo la thibelo le kgato ya ka pela le thibelo ye e theilwego setšhabeng, leo le lebišitšwego go šuthiša bana go tšwa kotsing go ya kgotlelelong.
","Pfufho iyi i dzhiele nṱha nḓila ye Minisṱa vha shumisa ngayo mbekanyamaitele ya zwa masheleni u itela u enegedza vhubindudzi kha sekhithara ya fulufulu ḽi vusuluseaho.
",0.64263594
"Ketelo ya Tlhokomedišo ya DDM ya Kapa Bohlabela.1 Motlatšamopresidente, Morena Paul Mashatile ka la 26 le la 27 Mopitlo 2023 o tla dira Ketelo ya Tekolo ya DDM Seleteng sa OR Tambo le Toropo ya Metropholithene ya Buffalo, Kapa Bohlabela.2 Ketelo ye ke karolo ya maitapišo a mmušo a go kgonthiša gore tlhabollo ya ditšhaba e direga ka tsela ye e kopantšwego yeo e thekgwago ke mokgwa wa DDPalamente ya Botshelela ya Palamente ya Dinaga tša Afrika (PAP)4.1 Baetapele go tšwa go ralala le kontinente ba kgobokane go tloga ka Mošupologo, 15 Mopitlo 2023 go la Midrand, Afrika Borwa bakeng sa Palamente ya Botshelela ya PAKopano e tla fela ka la 02 Phupu 20 2 PAP e nyaka go šogana le ditlhohlo tše di swanago go ralala le kontinente gomme e emetšwe ke baetapele ba Afrika go tšwa kontinenteng ka bophara.
","Hana Gammon, muṅwali wa ḽa Afrika Tshipembe wa miṅwaha ya 20 nge a wina Pfufho ya Nganeapfufhi ya Mashango a Muṱanganelano ya ṅwaha wa 2023, kha dzingu ḽa Afrika khathihi na u vha ene muthu muṱukusa u wina kha ḓivhazwakale ya pfufho iyi.
",0.7769028
"Khomišene ya Mawatle ya Magareng ga Mebušo (IOC)5.1 Afrika Borwa e tla kgatha tema kopanong ya bo56 ya lekgotlaphethiši yeo e tlago swarelwa Paris, France go tloga ka la 16 go fihla ka la 30 Phupu 20 2 IOC ya Mokgatlo wa Thuto, Mahlale le Setšo wa UN (IOC-UNESCO) ke mokgatlo wa UN wo o nago le maikarabelo a go thekga saense le ditirelo tša mawatle a lefase ka bophara.3 Afrika Borwa e amogela bohlokwa bja dinyakišišo le taolo ya mawatle a yona le ditikologo tša lebopong tša tlhabollo ya go ya go ile.
","Thimu ya mutambo wa Ragibii ya The Stormers nge ya kona u swikela makhaulatshele a miṱaṱisano ya United Rugby Championship.
",0.66645825
"Dinyakišišo tša mawatle gape di thuša go fa ditemošo tša ka pela malebana le dikotsi tšeo di theilwego lewatleng le go thuša mebušo go dira diphetho tše di nago le tsebo.
","Thimu iyi ya The Stormers i ḓo vha i tshi khou tamba na thimu ya The Irish Musters fhaḽa Ḓoroboni ya Kapa nga Mugivhela, wa ḽa 27 Shundunthule 2023.
",0.559892
"Afrika Borwa ke Monggae wa Dipapadi tše Kgolo tša Diphadišano.1 Barati ba dipapadi go tšwa lefaseng ka bophara ba ka letela kamogelo ye borutho ya Ubuntu le kamogelo ya baeng ya maemo a godimo ge ba e tla go bona Sebjana sa Lefase sa Kgwele ya Diatla le Phadišano ya Lefase ya Karate ba Kimura Shukokai International (KSI) ka Afrika Borwa.
","Vho Zakes Mda, muṅwali wa nganea wa shango ḽa Afrika Tshipembe na Phrof Vho Tshilidzi Marwala, Ṱhoho na Muthusa Tshantseḽara wa kale wa Yunivesithi ya Johannesburg, vhe vhuvhili havho vha nangwa kha Pfufho dza African Genius dza ṅwaha wa 2023.
",0.721166
"Afrika Borwa e na le rekoto ye e hlatselegago ya go beakanya ditiragalo tše kgolo ka katlego.2 Lethabo le tšwela pele go oketšega ka matšatši a go fetanyana a masometshela (60) go ya go thomeng ga Sebjana sa Lefase sa Kgwele ya Diatla ka Motse Kapa go tloga ka la 28 Mosegamanye go fihla ka la 6 Phato 2023.
","Vho Mda na Phrof Vho Marwala vho nangwa vhukati ha maṅwe mazhakanḓila a dzhango ḽa Afrika a swikaho 19 vhe vha shuma zwavhuḓi vhukuma kha masia o fhambanaho.
",0.6433643
"Le ke lekga la mathomo phadišano ye ya maemo a godimo e swarwa mmung wa Afrika.3 Kabinete e dira boipiletšo go bohle go thekga lesolo la Labohlano la Kgwele ya Diatla, ka go apara diaparo tša bathekgi goba go apara mebala ya bosetšhaba go thekga sehlopha sa Bosetšhaba sa Kgwele ya Diatla sa Afrika Borwa.4 KSI South Africa gape ke monggae wa Diphadišano tša Lefase tša Karati ya KSI ya bo20 ka Motse Kapa go tloga ka la 10 go fihla ka la 15 Mosegamanye 2023, gomme dikganyogo tša rena tše botse di romelwa go Team SA ge ba itokišeletša tiragalo ye ya maemo a godimo ya lefase ka bophara.5 Afrika Borwa e swere ka boikgantšho Diphadišano tša Makgaolakgang tša Phadišano ya Thenese ya Tafola tša 2023 ka Senthareng ya Dikopano ya Boditšhabatšhaba ya Durban.
","Ndiliso Khabinethe yo ṱahisa maipfi ayo a ndiliso kha vha miṱa na dzikhonani dza: Muambasada wa ḽa Afrika Tshipembe kha shango ḽa Riphabuḽiki ya Algeria, Vho Billy Masetlha, vhe vha shumela shango ḽa Afrika Tshipemebe kha vhuimo ho fhambanaho kha muvhuso, hu tshi katelwa na u vha Mulangi Muhulwane wa tshumelo dza zwa vhusevhi.
",0.75307614
"Dibapadi tše di ka bago 600 go tšwa dinageng tše di fapanego lefaseng ka bophara ka se sebaka di a bapala gomme phadišano ye e fa dibapadi tša rena sebaka sa go bontšha talente ya tšona.
","Vho vha vho ḓidzhenisa tshoṱhe kha nndwa ya mbofholowo ya shango ḽa Afrika Tshipembe, hu tshi katelwa na u vha muraḓo wa mmbi ya Umkhonto we Sizwe.
",0.5391266
"Phadišano ye e thomile ka la 20 Mopitlo 2023 gomme e tla tšwela pele go fihla ka la 28 Mopitlo 2023.Melaetša.
","Vho Murthi Naidoo, vhe vha kumedzela vhutshilo havho kha zwa nndwa ya u lwela mbofholowo.
",0.39621753
"DitebogišoKabinete e rometše ditebogišo le melaetša ya yona ya takaletšo ya mahlatse go: Tona ya Ditšhelete, Morena Enoch Godongwana, yo a filwego Sefoka sa Tona ya Ditšhelete ya Ngwaga sa African Banker sa 2023 sa maemo a godimo go la Sharm El Sheikh, Egepeta ka Laboraro, la 24 Mopitlo 2023 ka maitapišo a gagwe mo ngwageng wo o fetilego go laola ikonomi ya Afrika Borwa ka tikologo ye e nago le mathata ya lefase ka bophara le ya ka mo nageng.
","Vho swika he vha farwa nga mapholisa a zwa vhutsireledzi u bva nga ṅwedzi wa Lara 1965 u swika Lambamai 1966 hu songo vha na mulandu we vha hweswa wone nahone vho shela mulenzhe zwihulwane vhukuma nga tshifhinga tsha musi tshiimo tsha shishi tshi kati henengei kha miṅwaha ya 1980.Vho Barry Dwolatzky, vhe vha vha vhe ḽizhakanḓila kha sekhithara ya thekhinoḽodzi ya zwa vhudavhidzani na mafhungo ya ḽino shango.
",0.6761859
"Sefoka se lebogile tšhomišo ya Tona ya pholisi ya ikonomi go akgofiša dipeeletšo ka lekaleng la enetši ye mpshafatšegago.
","Vho vha vhe Phrofesa (Emeritus) kha Muhasho wa Vhuinzhiniere ha zwa Mafhungo na Muḓagasi kha Fakhaḽithi ya Vhuinzhiniere na Zwifhaṱo fhaḽa kha Yunivesithi ya Wits.
",0.5754993
"Hana Gammon, mongwadi wa mengwaga ye 20 wa Afrika Borwa ka lebaka la go thopa Sefoka sa Dikanegelokopana sa Kgweranaditšhaba sa 2023, seleteng sa Afrika le go ba yo monnyane mo historing ya sefoka.
","Vhathu vha 15 vhe vha lovha nga mulandu wa tshiwo tsha dwadze ḽa khoḽera fhaḽa Hammanskraal kha vhupo ha Ḓorobo khulwane ya Tshwane.
",0.65538853
"Cholera outbreak Management
","Cholera outbreak Management
",0.8821105
"Cabinet welcomed President Cyril Ramaphosa’s planned visit to and interaction with residents of Hammanskraal.
","Cabinet welcomed President Cyril Ramaphosa’s planned visit to and interaction with residents of Hammanskraal.
",0.9282733
"The visit did take place today, Thursday, 08 June, 2023, and this engagement gave the President the opportunity to hear directly from residents about the challenges they face.
","The visit did take place today, Thursday, 08 June, 2023, and this engagement gave the President the opportunity to hear directly from residents about the challenges they face.
",0.96057814
"The President, the Minister of Water and Sanitation and the Executive Mayor of Tshwane were able to assess government interventions in the area and provide relevant feedback to residents.
","The President, the Minister of Water and Sanitation and the Executive Mayor of Tshwane were able to assess government interventions in the area and provide relevant feedback to residents.
",0.9552373
"Government interventions include the field hospital operational in Kanana, Hammanskraal, and a multi-disciplinary team of experts to arrest the spread which has successfully treated hundreds of people.
","Government interventions include the field hospital operational in Kanana, Hammanskraal, and a multi-disciplinary team of experts to arrest the spread which has successfully treated hundreds of people.
",0.9575197
"Work is also underway to ensure that local councils use their water infrastructure grants effectively.
","Work is also underway to ensure that local councils use their water infrastructure grants effectively.
",0.9423926
"For the current financial year, over R14 billion has been set aside for municipalities to address water infrastructure backlogs.
","For the current financial year, over R14 billion has been set aside for municipalities to address water infrastructure backlogs.
",0.9444734
"Cabinet welcomes the cooperation between the City of Tshwane and Department of Water and Sanitation on the planned upgrade of the Rooiwal Water Treatment plant, which will be undertaken over three phases at a cost of R4 billion.
","Cabinet welcomes the cooperation between the City of Tshwane and Department of Water and Sanitation on the planned upgrade of the Rooiwal Water Treatment plant, which will be undertaken over three phases at a cost of R4 billion.
",0.9491971
"Cabinet calls on the affected communities to remain vigilant and to take special care of children.
","Cabinet calls on the affected communities to remain vigilant and to take special care of children.
",0.93795985
"Cholera can be prevented by using safe water.
","Cholera can be prevented by using safe water.
",0.9086974
"Treat the water first by boiling it for at least 1 minute and always wash your hands with clean water and soap.
","Treat the water first by boiling it for at least 1 minute and always wash your hands with clean water and soap.
",0.9575646
"For more information on prevention tips WEBTOKEN Government thanks those volunteer organisations and individuals who have stepped forward to lend a hand.
","For more information on prevention tips WEBTOKEN Government thanks those volunteer organisations and individuals who have stepped forward to lend a hand.
",0.94701207
"Water Quality Report
","Water Quality Report
",0.91472733
"Cabinet welcomed the reintroduction of the Blue, Green and No Drop Watch which were last conducted in 2013 and 2015 respectively.
","Cabinet welcomed the reintroduction of the Blue, Green and No Drop Watch which were last conducted in 2013 and 2015 respectively.
",0.93653953
