src_text,tgt_text,cosine_score
"10 May – 29th Anniversary of the Inauguration of first democratically elected president
","Mhla ti-10 kuya mhla tinge-29 Inkhwekhweti Sigubha Umkhosi weLusuku Lekubeka Esikhundleni Mengameli Wekucala Lowakhetfwa Ngentsandvo yelinyenti
",0.7712573
"This Cabinet meeting took place exactly 29 years to the day when President Nelson Mandela was inaugurated as the first President of a democratic South Africa on 10th May 1994.
","Lomhlangano weKhabinethi ubanjwe ngesikhatsi lesiminyaka lenge-29 lesifana ngco nalelinga lekwabekwa ngalo Mengameli Nelson Mandela esihlalweni waba nguMengameli wekucala weNingizimu Afrika yentsandvo yelinyenti mhla ti-10 Inkhwekhweti 1994.
",0.87442136
"After three and a half centuries of colonialism and separate development where one’s ability to have access to basic services were on the basis of one’s skin colour, a democratic South Africa set inclusive development goals to achieve a prosperous, non-racial, non-sexist and equal society.
","Emva kwesikhatsi lesiminyaka lengemakhulumnyaka lamatsatfu nesigamu sekubuswa betive kanye nekutfutfukiswa ngalokwehlukile lapho khona bekubukwa umbala wakho kute ukhone kufinyelela kutfola tinsita letisisekelo, iNingizimu Afrika yentsandvo yelinyenti yabeka imigomo yentfutfuko lefaka wonkhe umuntfu kute kube nemmango lonemphumelelo, longabandlululi ngekwelibala nangebulili futsi lonekulingana
",0.8922839
"While many gains have been made since 1994, much more still needs to be done to realise the country’s development goals.
","Nanoma kube nalokunyenti lesikuzuzile kusukela ngemnyaka we-1994, kunyenti lekusafuneka sikwente kute sifinyelele kulemigomo yentfutfuko yalelive.
",0.87437296
"The South African Reserve Bank has released an upgraded series of banknotes and coins, which celebrate our constitutional democracy and pay tribute to our beloved Madiba.
","Libhangengodla laseNingizimu Afrika likhiphe luchungechunge lwemali yemaphepha, neyeluhlavumali, legubha umkhosi wahulumende wetfu wentsandvo yelinyenti yemtsetfosisekelo futsi lindlulisa kubonga kuMadiba lesimtsandza kakhulu.
",0.850611
"Presidential Health Summit
","Ingcungcutsela Yetemphilo YaMengameli IngcungcutselaYetemphilo YaMengameli wesibili lobanjwe mhla ti-4–5 Inkhwekhweti 2023 bewugcile kumaphuzu latinsika layimfica eSivumelwano SaMengameli Setemphilo Semnyaka We-2019: tindzaba tebasebenti kufinyelela kutfola imitsini, imitsi yekugoma nemikhicito yetemphilo kusakhiwonchanti ekucocisaneni nemikhakha letimele kutfola kunakekelwa kwetemphilo lokusezingeni lelisetulu kutfutfukisa umkhakha wahulumende wekulawula timali kutekuphatsa netebuholi kucocisana nemmango kutinhlelo telwatiso kanye nekuhlala sitilungiselele kubukana netifo letilubhubhane.
",0.39579993
"The second Presidential Health Summit held on 4-5 May 2023 focussed on nine pillars of the 2019 Presidential Health Compact: human resources access to medicine, vaccines and health products infrastructure private sector engagement quality healthcare public sector financial management improvements governance and leadership community engagements information systems and pandemic preparedness.
","Lomunye umphumela waleNgcungcutsela kwaba kutibophelela kabusha ekusebentiseni Umshwalense Wavelonkhe Wetemphilo (NHI).
",0.57455313
"One of the outcomes of the Summit was the renewed commitment to implement the National Health Insurance (NHI).
","Loku kuyincenye yeluhlelo lwekunciphisa kungafinyeleli ngalokulinganako kutinsita tekunakekelwa ngekwetemphilo ngekunciphisa umtfwalo wetindleko tekufinyelela kutinsita tekunakekelwa ngekwetemphilo.
",0.66412055
"This is part of a programme to reduce disparities in accessing health care services by alleviating the financial burden for accessing healthcare services.
","Ikhabinethi iyavumelana ngekulandzela tindlela letidzingekako tekuvuselela kabusha luhlelo lwetemphilo nekuphutfumisa tingucuko teNHLoku kwenta luhlelo lwetfu lwetemphilo lukhone kusebentela kancono bantfu baseNingizimu Afrika.
",0.71016157
"Cabinet welcomes the adoption of measures that are needed to recalibrate the health system and accelerate the NHI reforms.
","Temandla
",0.213
"These move our health systems closer to better serve South Africans.
","Hulumende usebentisana ne-Eskom kute kuphutfunyiswe kulungiswa kwemayunithi labange kutsi kube neSigaba se-6 sekucima gezi ngenhloso yekumonga kulamalanga lasandza kwengca futsi lokukhinyabete inchubekela embili kuloluhlelo lwekutfutfukisa kutfolakala kwemandla kulelive.
",0.61431664
"Energy
","Umsebenti lomkhulu uyachubeka e-Eskom wekukhulisa Timo Talesikhungo Tekutfolakala Kwemandla ngekuhlala njalo kwentiwa umsebenti wekunakekela, ngekukhulisa kusetjentiswa kweluhlelo lolubitwa ngekutsi yi-Open Gas Cycle Turbines, kutfola emandla ekuphehla lavela kubatjalitimali labatimele labasebentisa emandla lovusetelelwako futsi bakhulise lwatiso lwekucaphelisa Incenye Yekulawula Sidzingo lesibangwa ngulabo labasebentisa gezi kakhulu kanye nalamanye emakhaya.
",0.25297105
"Government is working closely with Eskom to fast-track the repair of units that have resulted in Stage 6 load shedding in recent days and frustrated progress in the programme to improve energy security in the country.
","Tigameko tekucekela phasi sakhiwonchanti tiyachubeka e-Eskom ngako-ke siyachubeka nekutfumela emalunga e-SANDF lange-880 njengendlela yekuvikela titeshi taka-Eskom letinyeti letiphehla gezi tkuyincenye yesinyatselo sekuvikela kuwa kwegridi yagezi yavelonkhe.
",0.7290658
"Intense work is underway at Eskom to increase the Utility’s Energy Availability Factor through substantial maintenance, maximising the use of Open Cycle Gas Turbines, securing additional generation capacity from private investment in renewables and scaling up awareness to improve Demand Side Management from large electricity users and from households.
","Ikhabhinethi iyasamukela sincumo sekufaka sicelosikhalo kulesehlulelo seNkantolo Lephakeme yasePitoli lesiyala i-Eskom kutsi kungacishwa gezi ngenhloso yekuwonga etikhungweni tahulumende, letifaka ekhatsi tikolo, imitfolamphilo, tibhedlela netiteshi temaphoyisa ngekubuka umtselela walesehlulelo.
",0.73908496
"Acts of sabotage continue to plague the Eskom’s infrastructure and therefore the continued deployment of 880 SANDF members to safeguard a number of Eskom power stations is part of measures to prevent attempts to collapse the national grid.
","Ikhabhinethi ifisa kukhumbuta bantfu baseNingizimu Afrika kutsi bachubeke konga gezi kute ufinyelelwe kulomgomo wavelonkhe wekonga lobekiwe we-1000MW..Kutfutfukiswa Kwesakhiwonchanti Umtamo weNingizimu Afrika wekuvuselela sakhiwonchanti kute kuvuseleleke umnotfo nekuvula ematfuba emsebenti uyachubeka kutfola emandla.
",0.7222085
"Cabinet welcomed the decision to appeal the recent Pretoria High Court ruling that instructed Eskom to exempt public institutions, including schools, clinics, hospitals, and police stations, from load shedding based on the implications of this judgement.
","Ngenca yaloku, Indvuna Yetetigitjelwa, Mk Sindi Chikunga uhole umcimbi wekucala kwakhiwa kwemklamo lobitwa ngekutsi yi-Ashburton Interchange Project (umklamo Wase-Ashburton lapho tigitjelwa tintjiselana khona ngebagibeli/umtfwalo) lobita emabhiliyoni la-2,4 kuMasipala iMsunduzi KwaZulu-Natali, lotawutfutfikisa lokuhamba lokungenamkhawulo kwemphahla lesuka eLugwini laseThekwini iye ngekhatsi kwalelive nakusigodzi se-SADIndvuna Yetemisebenti Yahulumende Nesakhiwonchanti, uMnu Sihle Zikalala unikele ngematheku emikhumbi lamancane la-13 lavuselelwe kabusha ngaloluhlelo lwahulumende lwemali letigidzi leti-R501 yeLuhlelo Lekunakekela Nekulungisa Ematheku Emikhumbi Lamancane.
",0.72987175
"Cabinet wishes to remind South Africans to continue to save electricity towards the national target to save 1000MInfrastructure Development
","Lokuvuselelwa kabusha kwalamatibuko kutawenta kutsi kukhule kusebenta kahle kwawo nekutsi asebentele kahle umkhakha wendzawo wetekudoba kanye naleminye imikhakha yeteminotfo yendzawo.
",0.61877346
"South Africa’s infrastructure drive to revitalise the economy and create employment continues to gain momentum.
","Luvakasho Lwekwengamela umsebenti whulumende lwekuaya eJagersfontein
",0.6040753
"In this regard, the Minister of Transport, Ms Sindi Chikunga broke ground for the Ashburton Interchange Project worth R.4-billion in Msunduzi Municipality in KwaZulu-Natal, which will improve the seamless movement of cargo from the Port of Durban into the country and the SADC region.
","Lisekelamengameli, Paul Mashatile, uvakashele eJagersfontein, kuMasipala Wendzawo i-Kopanong Esigodzini saseFreyistata i-Xhariep kuyowenta umsebenti wakhe wekuhlola.
",0.75810933
"Minister of Public Works and Infrastructure, Mr. Sihle Zikalala has handed over 13 small harbours refurbished through the R501 million government’s Small Harbours Repairs and Maintenance Programme.
","Ufuna kutfola imphendvulo ngekuphakelwa kahle nangalokulinganako kwemanti, kanye nangekuhlaliswa kabusha kwemmango lowatsintseka kulenhlekelele yelokuchuma kwelidamu.
",0.639877
"The refurbishment of these harbours will increase their efficiency and better serve the local fishing sector and other sectors in local economies.
","Ikhabhinethi icela tonkhe tinkampani tetimayini kutsi tibhalise emadamu ato ekungcola noma emadamu ekungcola kwasetimayini kudathabheyisi yeLitiko Letemanti Nekuhanjiswa Kwendle Nekungcola kute kucinisekiswe kutsi tiyahambisana nemitsetfo yetekuphepha kwemadamu.
",0.6837232
"Oversight visit to Jagersfontein
","Litiko Letemanti Nehuanjiswa Kwendle Nekungcolanyalo lisabuyeketa idathabheyisi yawo onkhe emadamu ekungcola noma ekungcola kwasetimayini lakulelive lahambisana nesidzingo lesenta kutsi ahlukaniswe abitwe “Njengemadamu Lanebungoti Bekungaphephi”.
",0.52392936
"Deputy President, Paul Mashatile conducted an oversight visit Jagersfontein, Kopanong Local Municipality in the Xhariep District of the Free State.
","Kutfola lwatiso lolubanti mayelana nemadamu noma timayini letigcina kungcola imeyilela EMAILTOKEN.
",0.6396737
"Feedback on the efficient and equitable supply of water, and the resettlement of community members who were affected by the disaster caused when the dam wall burst.
","Umhlangano We-Africa Travel IndabaUmhlangano We-Afrika Travel Indaba wemnyaka we-2023 ubanjelwe e-Inkosi Albert Luthuli International Convention Centre eThekwini, lapho khona kunebantfu labahlukahlukene labamelele imboni yetekuvakasha yase-Afrika, lapho khona kumelelwe emave ase-Afrika ladlala inzima langetulu ku-20 nalenta umbukiso ngemikhicito yetekuvalasha lengetulu kwe-350.
",0.6371495
"Cabinet called on all mining houses to register their tailing dams or mine residue deposit dams on the Department of Water and Sanitation database in order to ensure compliance with dam safety regulations.
","Lomcimbi usebenta njengenkhundla lemcoka yabochwephesha balemboni yekutsi bakhone kuhlangana ndzawonye, babelane ngemicondvo nekutsi bakhe budlelwane lobutawenta kutsi kube nekukhula kwemnotfo.
",0.66906315
"The department if Water and Sanitation is currently updating the database of all tailing dams or mine residue deposit dams in the country that meet the requirements to be classified as” Dams with Safety Risk”.
","INingizimu Afrika iyatichenya ngalokwesekela hulumende lakunika emabhizinisi lasafufusa, lasemkhatsini, lamancane, laphetfwe bomake nalaphetfwe lusha lakulomkhakha wetekuvakasha newekuphatsa kahle tivakashi..Emavoti Esabelomali Ematiko Ahulumende sacalile kwetfula emavoti awo esabelomali, lapho akhombisa khona ummango imisebenti leyentiwa litiko ngesikhatsi salo semnyakatimali.
",0.7155937
"For additional information on tailing/ mine residue deposit dams email EMAILTOKEN Africa Travel Indaba
","Luhlelo lwePhalamende Lwemavoti Elwabiwamali lungatfolakala kuwebhusayithi: WEBTOKEN Ishejuli Yetinkhulumomphikiswano Temavoti Esabelomali (Emakomiti Emmango Laluliwe (EPC)) kusuka mhla ti-16 Inkhwekhweti kuya ku-19 Inkhwekhweti 2023.
",0.6899938
"The 2023 Africa’s Travel Indaba is underway at the Inkosi Albert Luthuli International Convention Centre in Durban, with a diverse representation of Africa’s tourism industry, accounting for over 20 African countries participating and displaying over 350 tourism products.
","I-EPC Yetemandla Netimbiwa EPC(Umhlangano Webetindzaba 13:00 (Kucinisekisiwe)16 Inkhwekhweti 2023Good Hope Chamber 10:00 kuya ku-15:15I-EPC Yetemanti Nekutfutfwa Kwendle(Umhlangano Webetindzaba 08:30-09:30 Kusetawucunisekiswa)16 Inkhwekhweti 2023M46 10:00 kuya ku-12:15I-EPC Yetemisebenti Yahulumende Nekuphatsa ( Sikolo Savelonkhe Sahulumende Nekhomishini Yetemisebenti Yasive)(Umhlangano Webetetindzaba 10:00-11:00 Kusetawucinisekiswa)16 Inkhwekhweti 2023Good Hope Chamber 14:00 kuya ku-16:15I-EPC Yetemisebenti Yekucchumana Neyelwatiso Lwahulumende( Umhlangano Webetindzaba 12:00-13:00 Kusetawucinisekiswa)16 Inkhwekhweti 2023M46 14:00 kuya ku-16:15I-EPC Yekutfutfukiswa Kwemabhizinisi Lasafufusa(Umhlangano Webetindzaba 14:00-15:00 Kusetawucunisekiswa )16 Inkhwekhweti 2023eGunjini eGood Hope 16:30 kuya ku-18:15I-EPC Yemgcinimafa Wavelonkhe EPC(Umhlangano Webetindzaba 15:00-16:00 Kusetawucunisekiswa )16 Inkhwekhweti 2023 M46 16:30 kuya ku-18:15I-EPC Yetetigitjelwa(Umhlangano webetetindzaba 12:00-13:00 Kusetawucunisekiswa )17 Inkhwekhweti 2023eGunjini eGood Hope 15:00 kuya ku-17:15I-EPC Yetekuchumana Neyethekhinoloji Ledijithali(Umhlangano Webetindzaba 11:00-12:00 Kusetawucunisekiswa )17 Inkhwekhweti 2023M46 15:00 kuya ku-17:15I-EPC Yetasekhaya( Umhlangano Webetindzaba 09:00-10:00 Kusetawucunisekiswa )17 Inkhwekhweti 2023eGunjini eGood Hope 17:30 kuya ku-19:00I-EPC Yetemfundvo Lesisekelo(Umhlangano Webetindzaba 09:00-10:00 Kusetawucunisekiswa )18 Inkhwekhweti 2023eGunjini eGood Hope 14:00 kuya ku 16:15I-EPC Yetekucondziswa Kwesimilo( Umhlangano Webetindzaba 11:00-12:00)18 Inkhwekhweti 2023eGunjini eGood Hope 16:30 kuya ku-18:15I-EPC Yekuhlela, Kucaphela Nekulinganisa(Umhlangao Webetindzaba 10:00-11:00 Usetawucinisekiswa)18 Inkhwekhweti 2023 M46 16:30 kuya ku-18:15Temahlatsi, Tetinhlanti Netesimondzawo(Umhlangano Webetindzaba 08:30-09:30 Ucinisekisiwe)19 Inkhwekhweti 2023eGunjini eGood Hope 10:00 kuya ku-12:15Yetekuvikeleka Kwembuso( Umhlangano Webetindzaba 13:00 -14:00 )19 Inkhwekhweti 2023 M46 10:00 kuya ku-12:158.
",0.6435025
"The event serves as a crucial platform for industry professionals to come together, share insights and forge partnerships that will drive growth.
","Iphakheji Yekuhhamuleka Esikweletini Sakamasipala Indvuna yetetimali yetfule iphakheji yekuhhamuleka kwesikweleti sakamasipala lotawenta kutsi kucishwe sonkhe sikweleti samasipala sesikhatsi lesengcile ku-Eskom kute kutfolakale imalingena kubomasipala kute bakhone kubonelela kuphakelwa kwetinsita letisisekelo.
",0.69866586
"South Africa is proud of the support government gives to small, medium, micro, women-owned and youth-owned enterprises in the tourism and hospitality sector.
","Bomasipala kutawudzingeka kutsi bahambisane netidzingo letilukhuni letifana nemibandzela le-33 yelizinga lelisetulu kute batfole lolusito.
",0.5648362
"Budget Votes
","Lemibandzela ifaka kwenta kutsi kuhlale kugcogcwa njalo imalingena lemkhawulo lomncane lobekiwe lekuhloswe ngayo kukhokhela igezi netinsita temanti kubekelwe eceleni yonkhe imalingena legcogciwe yegezi, yemanti, neyekutfutfwa kwendle bese bacala ngekukhokhela sikweleti sanyalo se-Eskom bese kulandzela sikweleti lesikhona nyalo semanti ngebunyenti ngembi kwekutsi kukhokhelwe letinye tikweleti tenyanga..I-Ajenda Ye-Afrika Mengameli Cyril Ramaphosa ube yincenye Yesigaba Lesisezingeni Lelisetulu Se-11 Senchubomgomo Yendlela Yalesigodzi Yekugadza Kuthula, Kuvikeleka Nekusebentisana (PSC) YeDemocratic Republic of Congo NeyeSigodzi seGreat Lakes, eBurundi, njengencenye yekuchubekisela embili i-Ajenda yase-Afrika yekucedza imisindvo yetibhamu ngemnyaka we-2030.
",0.21467817
"Government departments have begun presenting their budget votes, which are a public account of the work a department has undertaken over the financial year.
","Mengameli Cyril Ramaphosa uphindze wahambela eNambia Kumhlangano Weligatja Le-Troika Lelingetiwe Lelivame Kakhulu.
",0.6022565
"Parliament’s Budget Vote programme can be found on the website: WEBTOKEN
","Lomhlangano watfola umbiko lobuya kulabo Labenta Umsebenti We-SADC Wekuhlola Indzawo encenyeni Lesemphumalanga yeDemocratic Republic of Congo futsi kwabukwa imphendvulo yalesigodzi yekucinisa tekuphepha netimo tebuntfu.
",0.6014092
"Budget Vote Debates (Extended Public Committees) Schedule from 16 May 2023 to 19 May 2023.Mineral Resources and Energy EPC(Media Briefing 13h00pm Confirmed)16-May-23Good Hope Chamber10h00am to 15h15pmWater and Sanitation EPC(Media Briefing 08h30-09h30 TBC)16-May-23M4610h00am to 12h15pmPublic Service and Administration (National School of Government and Public Service Commission EPC(Media Briefing 10h00-11h00 TBC)16-May-23Good Hope Chamber14h00pm to 16h15pmGovernment Communications and Information Services EPC(Media Briefing 12h00-13h00 TBC)16-May-23M4614h00pm to 16h15pmSmall Business Development EPC(Media Briefing 14h00-15h00 TBC)16-May-23Good Hope Chamber16h30pm to 18h15pmNational Treasury EPC(Media briefing 15h00-16h00 TBC)16-May-23M4616h30pm to 18h15pmTransport EPC(Media Briefing 12h00-13h00 TBC)17-May-23Good Hope Chamber15h00pm to 17h15pmCommunications and Digital Technologies EPC(Media Briefing 11h00-12h00 TBC)17-May-23M4615h00pm to 17h15pmHome Affairs EPC(Media Briefing 09h00-10h00 TBC)17-May-23Good Hope Chamber17h30pm to 19h00pmBasic Education EPC(Media Briefing 09h00-10h00 TBC)18-May-23Good Hope Chamber14h00pm to 16h15pmCorrectional Services EPC(Media Briefing 11h00-12h00)18-May-23Good Hope Chamber16h30pm to 18h15pmPlanning, Monitoring and Evaluation EPC(Media Briefing 10h00-11h00 TBC)18-May-23 M4616h30pm to 18h15pmForestry, Fisheries and the Environment(Media Briefing 08h30-09h30 Confirmed)19-May-23Good Hope Chamber10h00am to 12h15pmState Security(Media Briefing 13h00 -14h00TBC)19-May-23 M4610h00am to 12h15pm.
","Lomhlangano wavumelana kutsi i-AU kufuneka ichumanise lemitamo leyehlukahlukene yekutfutfukisa tekuphepha kulencenye lengaseMphumalanga ye-DRIkhabhinethi iyavumelana ngalokucala kwetinhlelo tekucala kwetingcoco tangembi kwekucocisana emkhatsini kwembutfo waseSudan kanye nembutfo wema-Rapid Response Forces, lokucale kwenteka eJeddah, eSaudi Arabia, mhla ti-6 Inkhwekhweti 2023.
",0.6025932
"Municipal Debt Relief Package
","I-Sudan lenekuthula, leholwa nguhulumende webantfu, ayisimcoka ebantfwini baseSudan kuphela kodvwa kuso sonkhe sigodzi nakulelivekati.
",0.46801108
"The Minister of Finance has introduced a debt relief package that writes off historic municipal debt to Eskom to help free up revenue at municipalities to provide reliable basic services.
","Ngako-ke ikhabhinethi icela omabili emacembu kutsi acocisane ente nesivumelwane sekucedza lokungcubutana bese kuphela lokuhlupheka kwebantfu baseSudan.
",0.66752595
"Municipalities will be required to meet strict requirements in the form of 33 conditions to qualify.
","Ikhabhinethi iyakutfokotela kutsi bonkhe bantfu baseNingizimu Afrika labavakalise kutsi bafuna kubuya emuva ekhaya basuke kulokungcubutana kwaseSudan nyalo sebabuyile ekhaya futsi lolusito loluchamuke neNingizimu Afrika lusite emave lesakhelene nawo..Tindzaba Tekuhwebelana Ikhabhinethi ichazelwe mayelana nalokwentekako etindzabeni tekutsengiselana futsi ibonile kutsi enyangeni yeNdlovulenkhulu 2023, linani selilonkhe letintfo letitfunyelwe emaveni angaphandle belime kumabhiliyoni la-R184.
",0.5980778
"These conditions include maintaining a minimum average revenue collection targets for electricity and water services ring fencing all electricity, water and sanitation revenue collected and paying the Eskom current account first and the bulk water current account second before any other monthly payments..African Agenda
","Umkhakha Wekukhicita ngiwo losebente kahle kakhulu lowente imali lengetulu kwemabhiliyoni la-R85 ngalomkhakha wetfu wetekukhicita, kantsi Umkhakha Wetetimbiwa wona wente emabhiliyoni la-Wetekulima wona wenta emabhiliyoni la-Lamanani lawa lamcoka, nanoma amancane kakhulu kunalawo angeNdlovulenkhulu 2022, akhomba kutsi usacine kangakanani umnotfo waseNingizimu Afrika nanoma kusikhatsi sekukhula kancane kwemnotfo.
",0.7164396
"President Cyril Ramaphosa participated in the 11th High Level Segment of the Regional Oversight Mechanism of the Peace, Security and Cooperation (PSC) Framework for the Democratic Republic of the Congo and the Great Lakes Region, in Burundi, as part of advancing the African Agenda of silencing the guns by 2030.
","Linani selilonkhe lelimabhiliyoni la-R41 letintfo letitfunyelwe kulamanye emave ase-Afrika lokukhombisa libanga leselihanjiwe timboni taseNingizimu Afrika ekukhuliseni timakethe tato kulo lonkhe lelivekati.
",0.6795614
"President Cyril Ramaphosa also attended the Extraordinary Organ Troika Summit Plus in Namibia.
","Timakethe lapho kukhule khona kutsengiselana tifaka ekhatsi iChina, iBelgium, i-Italy ne-United Arab Emirates lokukhomba tinzuzo leticondzile tebudlelwane betemnotfo neNingizimu Afrika.
",0.6031989
"The Summit received a report from the SADC Field Assessment Mission in the Eastern Democratic Republic of Congo and considered the regional response to the escalating security and humanitarian situation.
","Tincumo Tekhabhinethi.
",0.28117043
"The Summit agreed that the AU must coordinate the various peace keeping and security improvement efforts on the Eastern DRCabinet welcomed the start of pre-negotiation talks between the Sudanese army and the Rapid Support Forces, which commenced in Jeddah, Saudi Arabia, on 6 May 2023.
","Lisubuciko Lavelonkhe Lelihlanganisiwe Lekulwa Nekushushumbisa Imphilo Tilwane Netihlahla Tasendle (NISCWT)
",0.60404277
"A peaceful Sudan, led by a civilian government, is essential not only for Sudan but also for the broader region and the continent.
","Ikhabhinethi ivumelene ngaleLisubuciko Lavelonkhe Lehlanganisiwe Lekulwa Nekushushumbisa Tilwane Netihlahla Tasendle (NISCWT).
",0.5897792
"Cabinet therefore calls on both parties to negotiate an agreement to end the conflict and alleviate the suffering of the Sudanese people.
","LeLisubuciko lekucala eNingizimu Afrika.
",0.39924365
"Cabinet is pleased that all South Africans that had indicated that they wish to return home from conflict-stricken Sudan are now back home and the assistance the South African initiative afforded our neighbouring countries.
","Inhloso yalo lesisekelo kuniketa tikhungo temtsetfo emandla ngekutinika emathulusi ekunciphisa nekuvikela kwenyuka kwalomkhuba lomubi wekushushumbisa tilwane netihlahla tasendle kulelive lesekunebungoti kulokuvikeleka kwembuso.
",0.645802
"Trade Matters
","LeLisubuciko lite netiphakamiso letibambekako tekukhulisa emandla ekusebentisa umtsetfo kulelive, kufaka ekhatsi kugcila kakhulu ekuphenyeni nasekushushiseni emacembu lashushumbisa tilwane netihlahla tasendle.
",0.2640808
"Cabinet received a briefing on developments on trade matters and noted that for the month of March 2023, South Africa’s total exports stood at R184 billion.
","I-NISCWT ishicilelwe kuLitiko Letemahlatsi, TekudobaNemvelo ku: WEBTOKELilunga laseNingizimu Afrika Lelikhetfwe Kuba Lijaji Lenkantolo Yemave Emhlaba Yetebulungiswa (ICJ)
",0.615142
"The Manufacturing Sector was the best performing contributing over R85 billion through our manufactured products, and the Mining Sector contributing R84 billion and Agriculture R11 billion.
","Ikhabhinethi ivumelene kutsi kuphakanyiswe Solwati Dire Tladi abe lilunga lelimelele iNingizimu Afrika kute akhetfwe abe Lijaji Lenkantolo Yemave Emhlaba Yetebulungiswa (ICJ) kulolukhetfo langeLweti 2023 lwaloluphiko.
",0.6198003
"These significant amounts, although marginally lower than in March 2022, demonstrate how robust the South African economy remains even in the period of low economic growth.
","Dire Tladi unguSolwati Kutemtsetfo eYunivesithi yasePitoli futsi uphindze abe nguMengameli weLigatja LeNhlangano YaseNingizimu Afrika Yetemitsetfo Yemave Emhlaba futsi uliLunga Lesigungu Lesikhulu SeNhlangano Yetemitsetfo Yemave Emhlaba.
",0.58575606
"A total of R41 billion of these exports are to other African countries indicating the strides South African industries are making in broadening their markets across the continent.
","Wake waba nguSihlalo WeKhomishini Yemitsetfo Yemave Emhlaba, lekuligatja le-UN jikelele lelitsatfwa njengemtimba losebentisana ne-ICNgaphambilini use waba nguMeluleki weTemtsetfo weMishini yaseNingizimu Afrika eNew York futsi waba nguMeluleki Lokhetsekile WeTindvuna TaseNingizimu Afrika Temave Emhlaba..Kubekwa EtikhundleniKutawucinisekiswa ticu tetemfundvo nekuhlola kufaneleka kwabo bonkhe lababekwe etikhundleni.
",0.65745646
"The markets where trade has increased include China, Belgium, Italy and the United Arab Emirates indicating the direct benefits from South Africa’s economic diplomacy.
","Labasha lababekwe etikhundleni kuBhodi Lelawula Ibhodi Yebahloli Mabhuku Labatimele.
",0.5756819
"Cabinet decisions.
","Mk Precious Nompumelelo Sibiya ne Mnu Mojalefa Mosala Labakhetfwe Kuba Ngemalunga Esikhashana Ebhodi Yetemanti i-Umngeni.
",0.4412725
"National Integrated Strategy to Combat Wildlife Trafficking (NISCWT)
","Mk Khulekelwe Glynnis Mbonambi UMnu Mzimkulu Msiwa Mk Sylvia Thandazile Mhlongo Mk Hlengiwe Patricia Majozi Mnu Mfanveli James Ndlovu Mnu Sibusiso Wycliff Mkize ne Ummeli Lavan GopaulImitsetfosivivinyo.
",0.58379805
