src_text,tgt_text,cosine_score
"Ba-Eskom bacinisekise hulumende ngekutsi kunemasu lakhona lagadze kuvikela kucisha kwagezi eveni lonkhe.
","Eskom yi tshembise mfumo hi makungu lama nga kona yo hlayisa sisiteme no sivela ku timiwa ka gezi ra makumu etikweni hinkwaro.
",0.8856364
"Ikhabhinethi iyaphindza icela bonkhe bantfu baseNingizimu Afrika kutsi bonge gezi.
","Khabinete yi vuyelela xikombelo eka vanhu hinkwavo va Afrika-Dzonga xo ya emahlweni no hlayisa gezi.
",0.911951
"Injongo kutsi kongiwe lokungenani 1 000 MW onkhe malanga, lokuyintfo lelingana nekonga sigaba sinye sekucisha gezi ngenhloso yekuwonga lela nalelo langa.
","Thagete i ku hlayisa kwalomu ka 1 000 MW masiku hinkwawo, leswi ringana na ku hlayisa xiteji xinwe xa ku timiwa ka gezi hi ku siyerisana siku ri n’wana na rin’wana.
",0.937319
"Indvuna Yetegezi, Dkt.
","Holobye wa Gezi, Dr Kgosientsho Ramokgopa, u ta tivisa tiko hi ku tirhisiwa ka Kungu ra Matirhelo ra Eneji hi Ravuntlahnu, 26 Mudyaxihi 2023, hi nhlengeletano yo tivisa vuhangalasi va mahungu.
",0.63138574
"Kgosientsho Ramokgopa, utakwatisa live ngalokusha lokumayelana nekufezekisa Lisu Lemsebenti Wetemandla ngaLesihlanu, mhla tinge-26 Inkhwekhweti 2023, emhlanganweni latawubamba nebetindzaba.
","Rihanyo
",0.112327635
"Temphilo
","Mfumo wu tumbuluxile komiti yo tsundzuxa hi matirhelo, leyi rhangeriweke hi Ndzawulo ya Rihanyo ya Rixaka, ku hlamula eka ku tumbuluka ka kholera eHammanskraal eka City of Tshwane, leyi se yi nga koxa vutomi bya 15 ku fikela hi ti 24 Mudyaxihi 2023.
",0.16427043
"Hulumende usungule likomidi lemsebenti tsite leliholwa Litiko Lavelonkhe Letemphilo, macondzana nekuphendvula kulokubhedvuka kwesifo semsheko eHammanskraal edolobheni laseTshwane, lesevele sesendlule netimphilo tebantfu laba-15 ngesikhatsi kukhulunywa mhla tinge-24 Inkhwekhweti 2023.
","Ku le ku endliweni ka ntirho lowukulu wo kambela swilo hinkwaswo leswi nga vaka swivangelo swa nthyakiso, ku nga va ku ri ku suka eka mati, mathangi lama phakelaka mati, tipompi na Mitirho yo Basisa Mati ya Soreji ya le Rooiwal (WWTW).
",0.71333635
"Kwentiwa umsebenti ngalokubanti kuhlola yonkhe imitfombo lengaba khona yekungcolisa emanti, kungaba yimitfombo yemanti, emaloli emathangi latfutsa emanti, timpompi kanye ne-Rooiwal Wastewater Treatment Works (i-WWTW).
","Ku fikela sweswi a ku se kumeka vumbhoni bya bakitheriya ya kholera eka tindhawu leti hinkwato, leswi nyikaka ku tshemba leswaku swi nga endleka leswaku ku hangalaka ka kholera swi nga va swi suka eka xivangelo xa nthyakiso xa ntirho wa siku rin’we, laha timhangu ta sweswi ti nga vaka ti vangiwa hi nthyakiso wa vumbirhi kumbe wa vunharhu.
",0.757154
"Kute kube ngulamuhle, kusete ligciwane lesifo semsheko lelitfolakele kulemitfombolusito, lokuyintfo lenika sibindzi sekutsi kungenteka lokubhedvuka kwalesifo semsheko kubangwe sehlakalo lesenteke nje kanye sendlula, ngaletehlakalo letikhona tingaba kutsi tibangwa kutselelana ngeligciwane kwebantfu.
","Loko ku nghenelela loku ku ri karhi ku endliwa, vaaki va le Hammanskraal va khutaziwa ku virisa mati ya le tipompini na ku chela munyu wuntsongo loko va nga se ma nwa.
",0.7467205
"Njengaloku tonkhe letingenelelo tivela, bahlali baseHammanskraal bayakhutsatwa kutsi bawabilise emanti laphuma etimpompini futsi bafake kancane sawoti ngembikwekutsi bawanatse.
","Ku engetela eka leswi, munhu un’wana na un’wana loyi a nga na nchuluko, ku hlamba timbilu kumbe ku vava ka le khwirini u fanele ku ya eka dokodela wa yena kumbe tliniki hi xihatla.
",0.7234248
"Kwengeta kuloko, nanome ngubani lonetimphawu tekuhanjiswa sisu, kugonyuluka kufanele bavakashele ngekushesha dokotela nome umtfolamphilo wabo wendzawo.
","Holobye wa mati na Mbhasiso, Tatana Senzo Mchunu, u ta hlangana na Meyara wa City of Tshwane, Cllr Cilliers Brink, hi Ravuntlhanu 26 Mudyaxihi 2023 ku ri matshalatshala yo hluvukisa kungu ro hlanganeriwa ra ku pfuxetiwa ka Rooiwal WWTW leswi a swi fanele swi endliwe khale.
",0.6273658
"Indvuna Yetemanti Nekuhanjiswa Kwendle, Mnu Senzo Mchunu, utawubamba umhlangano naSodolobha waseDolobhenikati laseTshwane, Cllr Cilliers Brink, ngaLesihlanu mhla tinge-26 Inkhwekhweti 2023 ngemitamo yekubopha lisu ngekuhlanganyela lekuvusetela kabusha kwe-Rooiwal WWTW losekukudzala kwengcelwa sikhatsi kutsi kwentiwe.
","Ku kuma mahungu hi xitalo u nga fonela nomboro ya 24 wa tiawara leyi vekeriweke Nhlangano wa Mavabyi yo Tlulela wa Rixaka (NICD) eka 082 883 9920.
",0.6977418
"Kute utfole lwatiso lolwengetiwe ungashaya lucingo kulenombolo lesebenta busuku nemini yeSikhungo Savelonkhe Setetifo Letitsatselanako (i-NICD) ku: 082 883 9920.
","Swiletelo swa vutshunguri bya Kholera swi kumeka eka inthanete eka WEBTOKENkambisiso wa Vatirhi wa Kotara (QLFS)
",0.64868575
"Tinkhombandlela tekwelashwa kwesifo semsheko tiyatfolakala nge-inthanethi ku: WEBTOKELuklayo Lwekota Lwebantfu Labasebentako (i-QLFS)
","Khabinete yi na matimba hi leswi QLFS ya kotara yo sungula ya 2023 yi nga komba ku tlakuka eka tikotara ta tsevu hi ku landzelelana eka nhlayo ya mitirho na leswaku ku thoriwa ka vanhu vo ringana wa timiliyoni swi le ku tshuneleleni eka vanhu va wa timiliyoni lava a va thoriwile loko ku nga se va na Khoronavhayirasi (COVID)-19.
",0.6925957
"Ikhabhinethi iyagcugcuteleka nayibona i-QLFS yekota yekucala ya-2023 lekhombisa kwenyuka emahlanhla lasitfupha ngekulandzelana mayelana ngelinani lemisebenti nekucashwa kwetigidzi leti-16.2 tebantfu kusondzela kancane kutigidzi leti-16.4 tebantfu labacashwe ngembikwetinsuku letendvulela i-COVID-19.
","Leswi swi veka erivaleni leswaku ikhonomi ya Afrika-Dzonga yi le ku vuyeleleni ku suka eka ntshikelelo wa ntungu wolowo.
",0.5803137
"Lena yinkhomba lecacile kutsi umnotfo waseNingizimu Afrika uyavuka uyacina ngemva kwemtselela walolo lubhubhane.
","Tinhlayo ta matholelo ta kotara yo sungula ti komba leswaku ku tumbuluxiwile mitirho ya 209 000 eka sikitara ya ximfumo na 107 000 eka sekitara yo ka yi nga ri ya ximfumo eka kotara yo sungula ya lembe.
",0.6332728
"Tinombolo tekucashwa tekota yekucala tikhomba kutsi kudalwe imisebenti le-209 000 kumkhakha lohlelekile kanye nemisebenti le-107 000 kumkhakha longakahleleki ngesikhatsi sekota yekucala yemnyaka.
","Vuxaka bya Afrika-Dzonga – United States (US) Khabinete yi tiyisisile leswaku vuxaka exikarhi ka Afrika-Dzonga na US bya ha ri kahle, byi tiyile no vuyerisa matiko hinkwawo ku landza ku hlangana ka Holobye wa Vuxaka bya Matiko ya Misava na Ntirhisano, Dr Naledi Pandor na Muyimeri wa US eAfrika-Dzonga, Tatana Reuben E Brigety, mayelana na mavonelo ya yena lama hehlaka leswaku Afrika-Dzonga yi nyike Rhaxiya matlhari.
",0.62818223
"Budlelwane emkhatsini weNingizimu Afrika neMelika (i-US) Ikhabhinethi ibucinisekisile budlelwano emkhatsini weNingizimu Afrika neMelika kutsi busasebuhle, busacinile futsi bunenzuzo emva kwemhlangano weNdvuna Yetebudlelwane Bemave Emhlaba Nekubambisana, Dkt.
","Khabinete yi tlhele yi vula leswaku tindlela leti tshamisekeke ta vuxaka bya matiko ti kona eka tinxaka hinkwato, ku katsa US, ku boxa timhaka loko ti tshuka ti va kona eka mafambiselo ya vuxaka bya matiko mambirhi.
",0.73550767
"Naledi Pandor neLincusa laseNingizimu Afrika eMelika, Mnu Reuben E Brigety, mayelana nekuphawula lokutsiwa ukwentile watsi live laseNingizimu Afrika litfumelele live laseRashiya tikhali.
","Khabinete yi amukerile xitiviso xa President Cyril Ramaphosa xa ku tumbuluxiwa ka ndzavisiso lowu tiyimeleke ku lavisisa swihehlo swa ku nyikiwa ka Rhaxiya matlhari yo suka eAfrika-Dzonga.
",0.84415126
"Ikhabhinethi iphindze yakusho kutsi kunetindlela tebuncusa letimisiwe kuto tonkhe tive, lokufaka ekhatsi iMelika, tekuvakalisa tingcinamba nativuka elulawulweni kwebudlelwane emkhatsini wemave lamabili.
","Vuxoxkoxoko bya ndzavisiso byi ta tivisiwa hi nkarhi lowu faneleke.
",0.5161219
"Ikhabhinethi isemukele simemetelo lesentiwe nguMengameli Cyril Ramaphosa sekusungula luphenyo lolutimele lwekuphenya letinsolo tekuphakela ngetikhali live laseRashiya yiNingizimu Afrika.
","Vuxaka bya Afrika-Dzonga – Singapore Presidente Ramaphosa u rhurhele Holobyenkulu Lee Hsien Loong wa Rhiphabliki ra Singapore hi Ravumbirhi, 16 Mudyaxihi 2023.
",0.70409876
"Imininingwane yaloluphenyo itawumenyetelwa khona madvute nje..Budlelwane beNingizimu Afrika neSingapore
","Singapore i muvekisi wa nkoka laha Afrika-Dzonga, hi vuvekisi bya ntsengo wo hundza R5 wa tibiliyoni eka tisekitara to fana na vumaki, vukorhokeri bya timali na tinhundzu ta tindlu na misava.
",0.6411034
"Mengameli Ramaphosa usingatse Ndvunankhulu Lee Hsien Loong waseRiphabhliki yaseSingapore ngaLesibili, mhla ti-16 Inkhwekhweti 2023.
","Mitwanano leyi sayiniweke exikarhi ka matiko lamambirhi ti lava ku tiyisa bindzu, vuvekisi, dyondzo na ntirhisano wa vusirheleri..Imbizo ya Presidente ya Xikombiso xa Nhluvukiso ya le ka Xifundza xa Kapavupeladyambu (DDM) Presidente Ramaphosa u yisile DDM ya Imbizo ya Presidente ya vutsevu eKapavupeladyambu, eka Masipala wa Muganga wa Drakenstein, eka Xifundza xa Cape Winelands, hi Ravuntlhanu, 19 Mudyaxihi 2023.
",0.7539358
"Live laseSingapore lingumtjalitimali lomcoka lapha eNingizimu Afrika, litjale timali letingetulu kwetigidzigidzi le-R5 emikhakheni lefananako neyekwakha imphahla, yetetimali neyemhlaba netakhiwo.
","Presidente u rhangele vurhumiwa ku suka eka swiyenge hinkwaswo swa mfumo ehansi ka Nhlokomhaka leyi nge: “Ku nga Siyiwi Munhu Ehandle”.
",0.59330034
"Tivumelwane letisayiniwe emkhatsini walamave lamabili kuhloswe ngato kucinisa kuhwebelana, lutjalomali, temfundvo kanye nekubambisana kutekuvikela..Imbizo yaMengameli eNshonalanga Kapa YeLuhlelo Lwekutfutfukiswa kweTigodzi (i-DDM) Mengameli Ramaphosa utsatse Imbizo yaMengameli i-DDM yesitfupha wayisa eNshonalanga Kapa, kuMasipala Wendzawo waseDrakenstein eSigodzini saseCape Winelands ngaLesihlanu, mhla ti-19 Inkhwekhweti 2023.
","Imbizo yi rhangeriwile hi rendzo ra Presidente ro ya eka Nhluvukiso wa Matshameloo ya Vanhu hi Xihatla bya le ka ndhawu ya le kusuhi eVlakkeland, lowu nga nhluvukiso lowukulu wa tindlu ta mfumo ku fikela sweswi eka Masipala wa Muganga wa Drakenstein.
",0.74817514
"Mengameli uhole litsimba lelivela kuyo yonkhe imikhakha lemitsatfu yahulumende ngaphasi kwengcikitsi letsi: “Ungashiyi Namunye Ngemuva”.
","Nhluvukiso lowu wu sunguleke hi 2017 loko wu hela wu ta nyika vavuyeriwa lava fikelelaka tindlu ta 2 556.
",0.52976054
"LeMbizo yendulelwe kuvakashela kwaMengameli e-Vlakkeland Catalytic Human Settlement Development lesedvute, lokuyintfutfuko yetindlu yemmango lenkhulukati kute kube ngulamuhla lekuMasipala weNdzawo waseDrakenstein.
","Ku akiwa ka tindlu ta 942 eka Xiphemu xo Sungula swi le ku yeni emahlweni, laha 454 ti nga hela na 301 ti nga eku akiweni.
",0.66657716
"Lentfutfuko leyacala ngemnyaka wa-2017 kutawutsi naseyiphotfuliwe inikete tindlu le-2 556 kulabo bazuzi labafanele.
","Nkoka wa phurojeke leyi hi leswaku yi nyika swilangwa swo hlaya swa tindlu ku suka eka lava holaka R0 kufika R3 500 (ehansi ka ku Endla swa Kahle ro Sungula), ku ya eka Nongoloko wa Mpfuneto wa Vanhu lowu Fambelanaka na Mali eka lava holaka exikarhi ka R3,501 na R22 000 hi lembe.
",0.71170646
"Kwakhiwa kwetindlu letinge-942 eSigabeni Sekucala kuyachubeka, kodvwa letinge-454 setiphotfuliwe kwatsi letinge-301 tisakhiwa.
","Swivandlanene haswimbirhi swa Tindlu ta Vaaki xikan’we na Swivandlanene swa Khale ka Tinhenha ta Nyimpi swa kumeka eka phurojeke leyi.
",0.70285034
"Lokumcoka ngalomklamo kutsi unakekela tinhlobo letahlukahlukene tebantfu kusukela kulabo labahola R0 kuya ku-R3 500 (ngaphasi kweLuhlelo Lekuhlaliswa Kwebantfu), kusita ngeTetimali Luhlelo Lwelusitomali Loluchumene Nalowo Nalowo, kulabo labahola emkhatsini wa-R3 501 ne-R22 000 ngenyanga.
","Rendzo ra Vulanguteri ro ya eka Masipala wa Dorobankulu ra eThekwini na Masipala wa Xifundza xa uMgungundlovu hi ti 18 na ti 19 Mudyaxihi 2023.
",0.71689063
"Omabili ematfuba eTindlu Tesibonelelo kanye nematfuba etindlu teTigayigayi Temphi akhona kulomklamo.
","Xandla xa Presidente Paul Mashatile u tihlanganisile na vatekaxiave va le ka dyondzo na vuleteri, vurimi, mabindzu na vumaki hi nkarhi wa rendzo ra vulanguteri ro ya eka Masipala wa Dorobankulu ra eThekwini na Masipala wa Xifundza xa uMgungundlovu tanihi xiphemu xa marendzo ya vulanguteri ya DDYin’wana ya tiphurojeke ta nkoka leti endzeriweke i ndhawu ya Phurojeke ya Xihatla ya le Ntshongweni, laha ku nga eku akiweni ka Doroba ra Manyunyu exikarhi ka Durban na Pietermaritzburg.
",0.7318372
"Luvakasho lwekuhlola umsebenti wahulumende lwekuya kuMasipala Wasedolobheni laseThekwini nakuMasipala weSigodzi saseMgungundlovu mhla ti-18 nangemhla ti-19 Inkhwekhweti 2023.
","Phurojeke yi ta pfuxelela migingirko ya ikhonomi ya ndhawu leyi, leyi nyikaka kwalomu ka R15 wa tibiliyoni ta vuvekisi eka malembe lama taka ya 10 ku ya eka Swipfuno swa mati
",0.659932
"Lisekelamengameli Paul Mashatile ucocisane nalabatsintsekako kutemfundvo nekucecesha, kutekulima, kutemabhizinisi nakutetimboni ngesikhatsi saloluvakasho lwekuya kuMasipala waseDolobheni laseThekwini nakuMasipala weSigodzi saseMgungundlovu njengencenye yeluvakasho lwekuhlola umsebenti wahulumende weluhlelo lwe-DDYinye yemiklamo lemcoka levakashelwe kube yindzawo yase-Ntshongweni Catalytic Project, lapho kwakhiwa khona Lidolobhakati Lesimanjemanje emkhatsini weDurban nePietermaritzburg.
","Presidente Ramaphosa u endzerile Lesotho Highlands Water Project hi Ravumbirhi, 23 Mudyaxihi 2023 laha a nga nghenelela eka ntirho wo sungula ku aka wa Xiyenge xa 2 xa phurojeke.
",0.76773804
"Lomklamo utawuvusetela imisebenti yetemnotfo kulendzawo ufake ligalelo lelilinganiselwa kutigidzigidzi leti-R15 telutjalomali eminyakeni lelishumi nale-15 letako..Sakhiwonchanti semanti
","Yi sayiniweke eka malembe lama nga hundza no va yi hlwerile ku hela, ntirho lowu wu kombisa ku hatlisisiwa ka migingiriko leyi ya nkoka ya matiko mambirhi.
",0.67421794
"Mengameli Ramaphosa uvakashele i-Lesotho Highlands Water Project ngaLesibili, mhla tinge-23 Inkhwekhweti 2023 kulokuvakasha ubese utimbandzakanya emcimbini wekugala umhlaba lapho kutawucala kwakhiwe khona umklamo weSigaba.
","Lesotho Highlands Water Project yi na nkoka eka ku tiyisisa ku hlayisiwa ka mphakelo wa mati eGauteng, Free State, Mpumalanga, North West na Northern Cape.
",0.7171519
"Kwasayinwa iminyaka leminyenti leyengca futsi kwahlangabetana nekubambeleleka, ngako-ke lomcimbi ukhombise kuphutfunyiswa kwalomtamo lomcoka emkhatsini waletive letimbili.
","Vuvekisi eka switirhisiwa swa mati ku antswisa vutomi bya MaAfrika-Dzonga swi ya emahlweni hi ku averiwa ka ku tlula R14 wa mabiliyoni eka timasipala ku lulamisa ku salela endzhaku ka switirhisia swa mati, hi ku tirhisa Nyiko ya Switirhisiwankulu swa Xifundza (RBIG) na Nyiko ya Switirhisiwa swa Vukorhokeri bya Mati (WSIG).
",0.63246983
"I-Lesotho Highlands Water Project imcoka ekucinisekiseni kutsi kuba nekuphakelwa kwemanti eGauteng, eFreystata, eMpumalanga, eNyakatfo Nshonalanga naseNyakatfo Kapa.
","RBIG yi ta tirhisiwa eka tiphurojeke ta 130 kasi WSIG yi ta averiwa tiphurojeke to tlula 400 etikweni hinkwaro.
",0.69624025
"Lutjalomali lolwentiwa kusakhiwonchanti semanti lwekuphakamisa timphilo tebantfu baseNingizimu Afrika luyachubeka nekwabiwa kwetigidzigidzi letingetulu kwe-R14 kubomasipala kute kulungiswe kusilela emuva kwesakhiwonchanti semanti, ngekusebentisa i-Regional Bulk Infrastructure Grant (i-RBIG) kanye ne-Water Services Infrastructure Grant (i-WSIG).
","Khabinete yi tlhela yi tsakisiwa hi leswi Ndzawulo ya Mati na Mbhasiso (DWS) yi endlaka matsahalatshala yo lwisana na vukungundzwana laha ku lava ku ringana R600 wa timiliyoni yi hakeriweke hi tikhamphani leti vuyeriweke hi ku kuma tithenda to ka ti nga tshamisekanga.
",0.8196466
"I-RBIG itawusetjentiselwa kumiklamo le-130 bese kutsi i-WSIG yona yabelwe imiklamo lengetulu kwe-400 eveni lonkhana.
","Khabinete yi tlhele yi amukela magoza yo lawula no sivela lama vekiweke hi ndzawulo ku herisa matirhiselo ya timali yo ka ya nga ri kahle, yo pfumala mbuyelo no tlangisa mali.
",0.6135215
"Ikhabhinethi iphindze futsi yajabula kutsi Litiko Letemanti Nekuhanjiswa Kwendle selichubekele embili kakhulu ekulweni nenkhohlakalo ngobe tinkampani setibuyise cishe tigidzi leti-R600 lebetizuze ngekutfola emathenda langekho emtsetfweni.
","Sagwadi ra Vuhlayiseki bya Vaaki
",0.35846043
"Ikhabhinethi iphindze futsi yatinaka netinyatselo tekulawula kuvikela litiko lelitibekile kute kucedvwe lusebentisomali lolungekho emtsetfweni, lolute inzuzo nalolusaphata timali.
","Afrika-Dzonga yi kumile Sagwadi ra ndhuma ra Matirhelo ya Kahle ra Nhlangano wa Vuhlayiseki bya Vaaki ra Matiko ya Tinxaka (ISSA) ra Afrika ra 2023, leri tekelaka enhlokweni vuvekisi bya mfumo eka vutomi bya vana va hina, ngopfu lava humaka eka mindyangu ya vusweti no ka yi nga sirhelelekanga.
",0.71926534
"Umklomelo Wesibonelelomali Sembuso
","Ku nghena ka Afrika-Dzonga eka sagwadi leri ra ndhuma a ku nyikiwile nhlokomhaka leyi nge: “Ku Engeteleka hi Swintsongontsongo ka ku khavhara ku sirheleriwa ka vaaki eka vana lava nga sirhelelekangiki: Mhaka ya Nyiko ya Mpfuneto wa Vana, Afrika-Dzonga”.
",0.41921157
"Live laseNingizimu Afrika liklonyeliswe ngeMkomela lohlonishwako Wekwenta Kahle Wenhlangano Yesibonelelomali Sembuso Yemave Emhlaba (i-SSA) kuSibonelelomali Sembuso lapha e-Afrika nga-2023, lokungumklomelo lonaka lutjalomali lolwentiwa nguhulumende etimphilweni tebantfwana, ikakhulu kulabo labavela emakhaya laphuyile nalahlaseleka lula.
","Ntsengo wo ringana 138 wa lava ngheneleke wu amukeriwile kusuka eka 48 wa mavandla lama nga swirho eka matiko yo tlula 30 eAfrika.
",0.6735227
"Umngenela weNingizimu Afrika kulomklomelo lohlonishwako bewunesihloko lesitsi: “Kwendlulisela kancane kancane sibonelelomali sembuso kubantfwana labahlaseleka lula: Indzaba Yesibonelelomali Semntfwana, eNingizimu Afrika.” Imingenela seyiyonkhe letfoliwe ibe 138 letfunyelwe ngemalunga lange-48 etikhungo temave ase-Afrika langetulu kwalange-30.
","Mpfuneto wa hina wa vaaki i wa nkoka eka nongonoloko wa mfumo wo herisa vusweti no va exivindzini xo vuyisela ndzhuti wa vanhu va ka hina.
",0.6424482
"Lusito lwetfu kutenhlalo lusenhlitiyweni yeluhlelo lwahulumende lwekunciphisa buphuya futsi lumcoka kakhulu ekubuyiseni sitfunti sebantfu bakitsi.
","Sisteme ya Afrika-Dzonga ya nsirhelelo wa vaaki hi yin’wana ya letikulu emisaveni, yi na vavuyeriwa vo tlula 18 wa timiliyoni..Tivhoti ta Mipimanyeto
",0.64813495
"Luhlelo lwekuvikela kutenhlalakahle lusemkhatsini waletinye tinhlelo letinkhulukati emhlabeni, lolunebazuzi labangetulu kwetigidzi leti-
","Khabinete ya tsaka hileswi Tivhoti ta Mipimanyeto ta tindzawulo ta mfumo ti nga eku fambeni kahle.
",0.63442993
"Emavoti eSabelomali
","Xedulu ya Tivhoti ta Mipimanyeto leti taka na tinhlengeletano to tivisa vahangalasi va mahungu leti ti seketelaka tivhoti:.Ravuntlhanu 26 Mudyaxihi 2023 hi 13:00, Holobye wa Mafumele ya Ntirhisano na Timhaka ta Ndhavuko (CoGTA), Manana Thembi Nkadimeng, u ta khoma nhlengelatano yo tivisa vahangalasi va mahungu hi Vhoti ya Mpimanyeto ya CoGTA leyi nga ta andlala magoza lama kongomisiweke eka ku tiyisa matirhelo ya timasipala..Hi Ravumbirhi, 30 Mudyaxihi 2023, Holobye wa Nhluvukiso wa Vaaki, Manana Lindiwe Zulu, na Holobye wa Vululami na Vukorhokeri bya Makhotso, Tatana Ronald Lamola, va ta khoma Tivhoti ta Mipimanyeto naswona vuxokoxoko bya tinhlengeletano to tivisa vahangalasi va mahungu ti ta tivisiwa hi nkarhi lowu faneleke.
",0.30550104
"Ikhabhinethi ijabulile kutsi Emavoti eSabelomali ematiko ahulumende achubeka kahle kakhulu.
","Vhoti ya Mpimanyeto ya Hofisi ya Presidente yi ta andlariwa hi Ravunharhu, 31 Mudyaxihi 2023 naswona nhlengeletano yo tivisa vahangalasi va mahungu hi ku humelela ka ku Cinca ka Matshamelo ya swilo na Matshalatshala ya Mitirho lama hlanganisiweke hi Operation Vulindlela yi ta khomiwa hi Ravumbirhi, 30 Mudyaxihi 20
",0.58238345
"Ishejuli yeMavoti eSabelomali letako nemihlangano nebetindzaba:10.
","Ku tlangela Siku ra Afrika na 20 wa Malembe ya Endlelo ro Kambisisa Tintangha ra Afrika (APRM)
",0.59914076
"NgaLesihlanu mhla tinge-26 Inkhwekhweti 2023 ngensimbi ye-13:00, Indvuna Yetekubusa Ngekubambisana Netendzabuko (i-CoGTA), Mk Thembi Nkadimeng, utawubamba umhlangano nebetindzaba lomayelana neVoti yeSabelomali se-CoGTA lapho atawuchaza khona ngetinyatselo lokuhloswe ngato kucinisa kusebenta kwabomasipala..NgaLesibili, mhla tinge-30 Inkhwekhweti 2023, Indvuna Yetekutfutfukisa Tenhlalakahle, Mk Lindiwe Zulu, kanye neNdvuna Yetebulungiswa Nekulungiswa Kwesimilo, MnuRonald Lamola, batawubamba inkhulumomphikiswano yeMavoti eSabelomali kantsi imininingwane yemhlangano wabo nebetindzaba itawukhishwa khona madvute.
","Khabinete na MaAfrika-Dzonga hinkwavo va joyina tikonkulu ra Afrika na misava hinkwayo ku tlangela Siku ra Afrika hi Ravumune, 25 Mudyaxihi.
",0.77602774
"Ivoti yeSabelomali saseHhovisi laMengameli itakwetfulwa ngaLesitsatfu, mhla tinge-31 Inkhwekhweti 2023 kantsi umhlangano nebetindzaba lomayelana neNchubekelembili neTingucuko Temumo neTichamkelo Tekucashwa letichumaniswe ngekusebentisa i-Operation Vulindlela itawubanjwa ngaLesibili, mhla tinge-30 Inkhwekhweti 20
","Lembe leri i lembe ra nkoka tanihileswi ri funghaka ku tlangeriwa ka vu60 ka ku sayiniwa ka chata yo sungula ya Nhlangano wa Vun’we bya Afrika, musunguri wa Nhlangano wa Afrika.
",0.67778033
"Lusuku Lwe-Afrika nemgubho weminyaka lenge-20 yeNchubo Yekubuyeketana Kwabalingani YaseAfrika (i-APRM) Ikhabhinethi kanye nabo bonkhe bantfu baseNingizimu Afrika bahlanganyela nelivekati lase-Afrika nemhlaba wonkhe kugubha Lusuku Lwase-Afrika ngaLesine, mhla tinge-25 Inkhwekhweti.
","Nhlokomhaka ya ku tlangela ka 2023 – “Ku Hatlisisa ku tirhisiwa ka Ndhawu ya Mabindzu Lama Ntshuxekeke ya Tikonkulu ra Afrika” – yi amukela matshalatshala lama endliwaka ku tirhisa ndhawu leyikulu ya mabindzu lama ntshuxekeke emisaveni hinkwayo.
",0.7588593
"Lomnyaka ubaluleke ngalokukhetsekile ngobe ngumnyaka wemgubho weminyaka lenge-60 wekusayina kwemculu wekusungulwa kweNhlangano Yelubumbano Lwe-Afrika, lihambambili leLubumbano Lwe-Afrika.
","Ku tsundzuka N’hweti ya Afrika ka lembe leri swi fambisana na ku tlangeriwa ka APRM ka vu20, leswi xikongomelo xa swona ku nga ku sindzisa mafumele lamanene eka tikonkulu hi ku tirhisa ku dyondza eka tintangha na ku tikambela hi wexe.
",0.76240903
"Ingcikitsi yemigubho ya-2023 – “Kufezekisa Ngekushesha Kwendzawo Yekuhweba Ngekukhululeka kuleLivekati lase-Afrika” – kwatisa tinyatselo lesetihanjiwe ekuchubeleni embili kusebenta kwendzawo yemhlaba lenkhulu yekuhweba ngekukhululeka.
","Swiboho swa Khabinete.
",0.36832583
"Kugujwa kweNyanga yase-Afrika lonyaka kwenteka ngesikhatsi sinye nemgubho weminyaka lenge-20 ye-APRM, lokuhloswe ngayo kukhutsata kubusa lokuhle kulelivekati ngekusebentisa kufundza kulamanye emave ngalokuhlelekile nangekutihlola tsine njengesive matfupha.
","Ndhawu ya Ikhonomi yo Hlawuelka (SEZ) ya le Namakwa
",0.4999802
"Tincumo Tekhabhinethi.
","Khabinete yi pasisile ku thyiwa ka Namakwa SEZ eAggeneys eNorthern Cape.
",0.4101486
"Indzawo Yomnotfo Lokhetsekile (i-SEZ) yaseNamakwa
","Ku thyiwa loku ringanyetiweke swi endliwa hi ku ya hi Nawu wa Tindhawu ta Ikhonomi yo Hlawuleka, 2014 (Nawu wa 16 wa 2014) naswona SEZ leyi ringanyetiweke i xiphemu xa Nsusumeto wa Presidente wa Vuvekisi.
",0.5954647
"Ikhabhinethi ikuvumile kucokwa kwe-Namakwa SEZ e-Aggeneys eNyakatfo Kapa.
","SEZ ya Namakwa yi ta pfula ku vuyeriwa eka migodi, ku kumiwa ka hayidrojeni leyi pfuxetekaka, Nhluvukiso wa switirhisiwa, eneji leyi pfuxetekaka na ku luamisiwa ka swikumiwa swa vurimi.
",0.7240392
"Lokucokwa kwentiwa ngekulandzela Umtsetfo Wetindzawo Teminotfo Lekhetsekile, wanga-2014 (Umtsetfo Nombolo 16 wanga-2014) kantsi le-SEZ lephakanyisiwe iyincenye yeMkankhaso WaMengameli Welutjalomali.
","Tisekitara leti ti na nkoka eka ku tumbuluxa mitirho na nhluvukiso wa ikhonomi eNorthern Cape na tiko hinkwaro.
",0.6497463
"Le-Namakwa SEZ itawuvula inzuzo kutemnotfo letawukhicitwa ngulemayini, kukhicitwa kwehayidrojini leluhlata, kutfutfukiswa kwesakhiwonchanti, emandla lavusetelelwako nemikhicito yetekulima lesetjentiwe.
","Ku tlula R29 wa tibiliyoni ya vuvekisi se yi tiyisisiwile eka xiyenge xa n’we xa SELeswi swi katsa ku tiyimisela ku suka eka Vedanta Zinc (R16 wa tibiliyoni), Frontier Rare Earth (R13 wa tibiliyoni), Hive Energy (R200 wa timiliyoni) na RRS Trade and Investment (R100 wa timiliyoni)..Nkandziyiso wa Vunharhu wa Qhinga ra Xipfuno xa Mati ra Rixaka (NWRS-3) 2023.
",0.7669605
"Lemikhakha imcoka ekudaleni imisebenti nekutfutfukisa temnotfo eNyakatfo Kapa naseveni lonkhana.
","Khabinete yi pasisile NWRS-3 2023 ku va ri tirhisiwa naswona qhinga ri boheka ku tirhisiwa eka vulawuri honkwabyo na le ka mavandla lama tirhisaka Nawu wa Mati wa Rixaka, 1998 (Nawu wa 36 wa 1998).
",0.6438345
"Lutjalomali lolungetulu kwetigidzigidzi letinge-R29 seluvele lubekelwe eceleni kutsi lusetjentiselwe sigaba sekucala se-SELoku kufaka ekhatsi iminikelo levela ku-Vedanta Zinc (tigidzigidzi le-R16), kubaka-Frontier Rare Earth (tigidzigidzi le-R13), kubaka-Hive Energy (tigidzi letinge-R200) nakubaka-RRS Trade and Investment (tigidzi leti-R100).
","Qingha leri ri landzela nkambisiso wa malembe manharhu wa NWRS-2, lowu nga kuma tindhawu ta ku humelela na tindhawu leti ta ha riki ntlhontlho.
",0.69883376
"Lushicilelo Lwesitsatfu lweLisubuciko Lavelonkhe Letemitfombolusito Yemanti (i-NWRS-3) langa-2023.
","NWRS-3 yi vumbiwa hi swikongomelo swinharhu, leswaku mati na mbhasiso swi fanele ku seketela nhluvukiso, ku herisiwa ka vusweti na ku pfumaleka ka ndzingano, ku hoxa xandla eka ikhonomi na ku tumbuluxiwa ka mitirho, naswona mati ma fanele ku sirheleriwa, ku tirhisiwa, ku hluvukisiwa, ku fambisiwa no lawuriwa hi ndlela leyi tiyiselaka nkarhi wo leha na hi ku ringana.
",0.67034113
