src_text,tgt_text,cosine_score
"The Bill amends Section 6 of the Constitution of the Republic of South Africa of 1996 to recognise South African Sign Language as one of the official languages.
","Letsholo leno le kopanya batsofe go tswa mo diporofenseng tsotlhe di le robongwe mme maitlhomo lona ke go dira gore batsofe ba tshele botshelo jo ba ikatisang gore ba kgone go nna le seabe mo metseng ba tswang mo go yona..  Letsholo la Naga la go Thibela Botsofe le tla bula ka dipuisano ka go letlelela batsofe gore ba thube seo se leng mo dipelong tsa bona ka go bua ka matsapa ao ba kopanang le ona mo matshelong bona.
",0.6585951
"In May 2022, Cabinet approved the publication and giving of notice to this Bill, which together with the notice were subsequently gazetted in July.
","Seno se tla latelwa ke Metshameko e Monate mo batsofe ba tla ntshang bokgoni jwa bona mo metshamekong ya diatleletiki..  Molao wa Batsofe wa Ngwaga wa 2006 (Molao wa bo 13 wa 2006) gatelela botlhokwa jwa go tlhokomela le go tsholetsa ditshwanelo tsa batsofe, tlotlo ya bona, maemo bona, seriti sa bona, pabalesego ya bona, tlhokomelo ya bona le boitekanelo jwa bona.
",0.60463
"Criminal Law (Sexual Offences and Related Matters) Amendment Bill of.
","Ka mafoko ano, Kabinete ikuela mo baaging botlhe mo setšhabeng go tlhokomela batsofe, go ba tlotla le go ba ema nokeng, segolo jang fa le gore ba boga, ba tshwarwa makgwakgwa, ga ba tlhokomelwe bile ba itemogela ditiragalo tsa GBV  MelaetsaMelaetsa ya go Akgola.
",0.5458381
"Cabinet approved the publishing of this Bill for public comments.
","Kabinete romela melaetsa ya yona ya go akgola le go eletsa masego kwa go: • Bafenyi ba Dikabo tsa Bobegakgang tsa SADC.
",0.6042331
"It repeals the Sexual Offences Act (previously Immorality Act), 1957 (Act 23 of 1957).
","Rre Sandile Stevenson Ndlovu wa Lekwalodikgang la Sunday Times jaaka fentse maemo ntlha jaaka motsei wa ditshwantsho wa maemo a kwa godimo, Mme Zinhle Makhosazane Mugabe wa lekgotlakaso la SABC jaaka fentse maemo bobedi mo kgasong ya dithelebišene mmogo le Mme Melinda Shaw wa Makasine wa Dikgang tsa Dikgogo jaaka fentse maemo boraro mo makwalong a gatisiwang.Melaetsa ya Matshediso.
",0.60335046
"It also repeals Section 11 of the Criminal Law (Sexual Offenses and Related Matters) Amendment Act, 2007 (Act 32 of 2007) to decriminalise the sale and purchase of adult sexual services.
","Kabinete romela matshediso yona kwa ba lelapa le ditsala tsa:• Rre John Henry Ernstzen, yo neng na le dingwaga di le 82, yo neng le segatlhamelamasisi mo mererong ya mekgatlho ya badiri le ya dipolotiki yo gape dirileng le mo pusong jaaka moeletsi wa Tona ya Tirelo le Tsamaiso ya Puso, Ngaka Zola Skweyiya ne gape direla Khomišene ya Tirelo ya Puso le Motlatsamonnasetulo mmogo le go direla Khomišene ya Ditirelo tsa Baatlhodi ba Dikgotlatshekelo.• Vho-Rashaka Frank Ratshitanga, yo neng na le dingwaga di le 89, yo neng le segatlhamelamasisi mo mererong ya go lwantshana le puso ya tlhaolele yo neng bogisiwa thata ke Mapodisi Puso ya Tlhaolele.
",0.66785884
"The proposals of this Bill respond to the list of interventions proposed in Pillar 3 (Protection, Safety and Justice) of the National Strategic Plan on GBVF, which enjoins the criminal justice system to provide protection, safety and justice for survivors of GBVF, and to effectively hold perpetrators accountable for their actions.
","Jaaka le mokwadi yo dibuka tsa gagwe di phasaladitsweng, tse dingwe tsa dibuka tse dintsi tsa dipoko tse di phasaladitseng di ne tsa tseewa gore di dirisiwe kwa dikolong go ruta baithuti ba dikolo tse di godimo.
",0.61166215
"Once passed into law, it will amongst others protect sex workers against abuse and exploitation.
","Morago ga ngwaga wa 1994 ne direla Ntlo ya Limpopo ya Theomolao ne neelwa Kabo ya Tlotla ya Baobab e betlilweng ka boronse mo leboga “go ikentsha setlhabelo ga gagwe ka go dira ka boineelo mo go emeng kgatlhanong le ditiro tse di busula tsa tsa tlhaolele mmogo le go nneng le seabe ga gagwe mo go ageng Aforika Borwa”  Go ThapiwaPele batho botlhe ba thapiwa go tla tlhatlhobiwa makwalo bona dithuto le ditlankana dingwe tse di tlhokagalang.
",0.6434877
"South African Post Office (SAPO) Amendment Bill.
","Mme Funani Josephine Malatsi yo thapilweng go nna Motlhankedimogolo wa Matlole kwa Lefapheng la Pusotshwaraganelo..  Ngaka Marcia Mabel Socikwa thapilwe go nna Motlatsamokaedikakaretso (DDG): mo lekaleng la Thuto le Katiso kwa Diyunibesiti mo Lefapheng la Ditheo tse Dikgolwane tsa Thuto le Katiso..  Ngaka Lisolomzi Assaph Fikizolo thapilwe go nna DDG: mo lekaleng la Mawatle le Mabopo Mawatle mo Lefapheng la Merero ya Dikgwa, ya Botshwaro jwa Ditlhapi le ya Tikologo..  Mme Boipuso Mmasediba Modise thapilwe go nna DDG: mo lekaleng la Dipholisi tsa Ikonomi mo Lefapheng la Matlotlo Naga..  Ngaka Kefiloe Doris Masiteng thapilwe go nna Mokwaledi mo lekaleng la Togo ya Maano mo Lefapheng la Tiromaano, Tekolo le Tshekatsheko ya Tiro..  Mme Jodi-Lynne Scholtz thapilwe go nna Mokhomišenara wa Khomišene ya Naga ya Dilotho..  Ngaka Phakamani Buthelezi thapilwe go nna Mokaedikhuduthamagamogolo (CEO) mo Botong ya Metsi ya Overberg (Konteraka ya gagwe ntšhwafaditswe)..  Ngaka Bongani Andy Mabaso thapilwe go nna CEO mo Setheong sa Puso sa Thekenoloji ya Tshedimosetso.
",0.5697036
"Cabinet approved the submission of the SAPO Amendment Bill to Parliament for further processing.
","Ngaka Gibson Mashilo Simon Boloka thapilwe go nna CEO mo Botong ya Ditshwantsho tsa Difilimi le tsa Makwalokgatiso (FPB).
",0.6467432
"The Bill, which was approved for public consultation early this year, amends the SAPO Act, 2011 (Act 22 of 2011).
","Rre Mandisi Nkuhlu thapilwe go nna CEO mo Koporasing ya Inšorense ya Dikoloto tsa Diromelwantle.
",0.53337353
"The proposed amendments seek to enable the SAPO to adapt to the technological developments in the courier-service space and expand its mandate.
","Kabinete dumelane le ditshwetso tsa go thapa batho ba ba latelang:.
",0.37719697
"The changes are in line with the National Integrated Information and Communications Technology Policy White Paper of  Upcoming events.
","Setheo sa Melao ya go Laola Dithulaganyo tsa go Agela Setšhaba Dintlo  Rre Sandile Luthuli thapilwe go nna Mokaedikhuduthamagamogolo).
",0.61869395
"2022 World Science Forum (WSF).
","Boto ya Setlamo sa Setheo sa Ditsela tsa Naga ya Aforika Borwa  Rre Themba Barrange Mhambi thapilwe sešwa go nna Monnasetulo)  Rre Robert Alderman Haswell thapilwe sešwa)  Rre Thamsanqa Piet Matosa thapilwe sešwa)  Mme Refilwe Buthelezi; mmogo lee.
",0.5677145
"South Africa will, through the DSI, host the WSF at the Cape Town International Convention Centre Cape from 6 to 9 December 2022 under the theme: “Science for Social Justice”.
","Mme Noluphumzo Leonora Noxaka.
",0.45833135
"The forum is one of the leading global platforms that encourage dialogue on the role science should play in society.
","Bakaedi bao seng ba khuduthamaga kwa Setheong sa Ditirelo tsa Taolo le Phofiso ya Difofane  Rre Zola Majavu thapilwe go nna Monnasetulo)  Rre Khulile Sympathy Boqwana  Mme Nomathemba Kubheka thapilwe sešwa)  Mogeneralemogolo Nhlanhla Lucky Ngema thapilwe sešwa)  Rre Christiaan Rudolph Burger thapilwe sešwa)  Ngaka Malindi Joy Neluheni  Rre Muhammed Ameen Ebrahim Amod  Rre Siyabonga Gcina Kudumela  Mme Precious Nompumelelo Sibiya; mmogo lej.
",0.6045099
"It is an initiative of global science organisations that also include the UN Educational, Scientific and Cultural Organisation.
","Mme Princess Mngoma.
",0.33629346
"Renowned thought leaders will be debating various topics that include science for human dignity; science for climate justice, science diplomacy for multilateralism, and science for Africa and the world number of side and satellite events will take place concurrently, and some of them will be hosted by the General Assembly of the African Academy of Sciences Pan-African organisation whose vision is to transform lives on the African continent through science.
","Boto ya Koporasi ya Motlakase wa Nyutlelia ya Aforika Borwa  Rre David Nicholls thapilwe sešwa go nna Monnasetulo)  Rre Leshoene Joseph Shayi thapilwe sešwa)  Mme Senamile Masango thapilwe sešwa)  Mme Elsie Monale thapilwe sešwa)  Rre Charles Leornad Mavuso  Rre Hilton Darryl Lazarus  Rre Ashley Latchu  Ngaka Mosidi Makgae  Rre Suren Maharaj; mmogo lej.
",0.7246553
"World AIDS Day.
","Mme Bessie Makgopa thapilwe sešwa go nna tokololo e tsenang mo legatong la yo mongwe fa se teng).
",0.4438484
"South Africa will join the world in observing and participating in activities to mark the annual World AIDS Day on 1 December 2022 under the theme: “Equalise and Integrate to End AIDS”.
","Boto ya Setheo sa Matlole go Tshegetsa Maano Merero ya Leokwane  Rre Sipho Mkhize thapilwe go nna Monnasetulo)  Rre Mmete Petrus Fusi  Mme Nosizwe Nokwe-Macamo  Mme Mary-Jane Morifi  Mme Samela Titus-Nabe thapilwe sešwa); mmogo lef.
",0.6617113
"The national commemoration event that will be held at the Dr Petrus Molemela Stadium in Bloemfontein in the Free State will be used to remind everyone to be responsible by getting to know their health status so as to make informed life decisions.
","Rre Sechaba Thole thapilwe sešwa).
",0.40197358
"The commemoration comes as South Africa prepares to begin piloting the injectable pre-exposure prophylaxis (PrEP) early next year, which is recommended by the World Health Organisation.
","Boto ya Setheo sa Isimangaliso Wetland Park  Rre Israel Mabhudu Tembe thapilwe sešwa go nna Monnasetulo)  Mme Thulile Memory Sosibo thapilwe go nna Motlatsamonnasetulo)  Rre Peter Christopher Small thapilwe sešwa)  Rre Gonesagren Ganesh Nair thapilwe sešwa)  Mme Maureen Sibusisiwe Ngcobo  Mme Nombuso Mlambo  Rre Boy Daniel Ngobeni; mmogo leh.
",0.65396464
"The PrEP injection, to be taken every other month, could prevent as many as 52 000 new HIV infections.
","Rre Bongani Mzwakhe Mhlongo.
",0.32189375
"Reconciliation Day.
","Ditokololo tsa Lekgotla la Madirelo Dikago  Mme Holovisa Amelia Mtshali thapilwe sešwa go nna Monnasetulo)b. Mme Vangile Petronella Nene  Rre Anele Mahlawe  Mme Elizabeth Faith Nyaka  Mme Tinyiko Laurel Palesa Shipalana  Mme Mandisa Princess Pepeta-Daki  Ngaka Sitsabo Dlamini thapilwe sešwa)  Rre Thembinkosi Cedric Madikane  Mme Molefi Kubuzie  Rre Christopher Kobla Gavor  Rre Ngwako Edward Hutamo thapilwe sešwa)  Rre Chris Steynberg  Rre Ashley Latchu thapilwe sešwa)  Mme Ditaba Maraka thapilwe sešwa)  Mme Sinehlanhla Mthembu thapilwe sešwa)  Mme Salome Mabilane  Mme Snowy Makhudu  Ngaka Khangwelo Desmond Musetsho  Mme Modiehi Elisa Molebatsi  Rre Craig Silva  Rre Tshepo Albia Monakedi; mmogo lev.
",0.30507112
"On Friday, 16 December 2022, the nation will celebrate Reconciliation Day to reaffirm our commitment to unity and nation-building.
","Mme Seemole Angela Mohopo.
",0.417615
"Each year we have an opportunity to reach out to one another to deal with our past, reconcile and build new nation going forward.
","Boto ya Setheo sa Metsi sa Magalies  Ngaka Keneilwe Sebego thapilwe sešwa go nna Monnasetulo)  Mme Yvonne Malebo Motolong thapilwe go nna Motlatsamonnasetulo)  Rre Stanley Ngobeni  Mme Yongama Pamla  Mme Priscilla Nomsa Mashaba  Ngaka Mosidi Makgae  Rre Muzuvukile Wiseman Mkhize  Mme Tebogo Magogodi Elizabeth Malaka thapilwe sešwa)  Rre Rudolph Martin Le Roux; mmogo lej.
",0.59428275
"Our journey since the advent of freedom and democracy in 1994 has decisively shown that we are stronger as nation when we are united.
","Rre Itumeleng Mosala.
",0.20911178
"Our goal as South Africans should be to promote inclusive nation-building and social cohesion.
","Bakomišenara ba Khomišene ya Taolo ya Melao ya Metsia.
",0.41174605
"Together we can build better tomorrow for all by striving to ensure nation that encourages dialogue, fosters social cohesion, embraces nation-building and celebrates its diverse culture.
","Mme Davishinee Padayachee  Mme Mampiti Matsabu  Mme Nolubabalo Sondlo  Mme Karen van der Merwe  Rre Rolfe Eberhard  Ngaka Binganidzo Muchara  Rre John Alexander Conolly  Mme Karen Breytenbach  Rre Junior Potloane  Rre Itumeleng Brian Modiba; mmogo lek.
",0.67061925
"Cabinet calls on everyone to work together as nation, and harness our collective strengths to build united and prosperous South Africa.
","Mme Ntombokuqala Nokulunga Mnqeta.
",0.18880878
"National Active Ageing Programme.
","Bakaedi bao Seng ba Khuduthamaga mo Botong ya Bankatlhabololo ya Dinaga tsa Borwa jwa Aforika  Mme Martie Jansen van Rensburg thapilwe sešwa)  Mme Dinao Lerutla  Mme Tasneem Essop  Rre Kenneth Brown; mmogo lee.
",0.47758234
"The Department of Social Development will host the National Active Ageing Programme in Germiston, Gauteng from 5 to 7 December.
","Rre Ebrahim Rasool.
",-0.056044567
"The programme brings all nine provinces together and is aimed at promoting the independent and healthy lifestyle of older persons to ensure that they actively participate in their communities.
","Boto ya Setheo sa Aforika Borwa sa Pabalesego ya kwa Mawatleng (SAMSA)  Rre Tau Morwe thapilwe go nna Motlatsamonnasetulo).
",0.5656135
"The National Active Ageing Programme will open with national dialogue to allow older persons to engage on pertinent matters affecting them.
","Ditokololo tsa Setheo sa Banamedi ba Diterene sa Aforika Borwa (Prasa)  Mme Sibongile Luthuli; mmogo leb.
",0.5939128
"This will be followed by the Golden Games where older persons will showcase their athletic abilities.
","Moatefokate Johnny Motlogelwa.
",0.44691116
"The Older Persons Act, 2006 (Act 13 of 2006) emphasises the importance of the protection and promotion of the rights, dignity, status, integrity, safety, security and well-being of older persons.
","Boto ya Setheo sa Aforika Borwa sa Merero ya Leokwane  Rre Satish Roopa thapilwe go nna Monnasetulo)  Mme Carmen Mpelwane  Ngaka Salome Chiloane-Nwabueze; mmogo led.
",0.61807275
"In this regard, Cabinet calls upon all communities to care, respect and support older persons, especially against abuse, ill-treatment, neglect and GBV  MessagesCongratulations.
","Rre Xolile Sizani.
",0.27299476
"Cabinet extended its congratulations and well-wishes to:Prize winners of the 2022 SADC Media Awards.
","Boto ya Setheo sa Metsi sa Trans-Caledon Tunnel  Mme Precious Nompumelelo Sibiya thapilwe go nna Monnasetulo)  Rre Gerald Dumas thapilwe go nna Motlatsamonnasetulo)  Rre Gregory Nigel Joseph White  Mme Zelda Ncedekile-Tshabalala  Mme Vidhu Nardev Vedalankar  Rre Neo Mooketsi Tladinyane  Mme Mmanare Evelyn Mamabolo  Rre Patrick Roy Mnisi; mmogo lei.
",0.6830863
"Issues in the environment.
","Puo ya Maemo Setšhaba (SoNA).
",0.51463294
"State of the Nation Address (SoNA).
","Kabinete boeletsa mafoko ga Moporesitente Cyril Ramaphosa mo boikuelong jwa gagwe jo bo dirileng mo Puong ya Maemo Setšhaba (SoNA) ya ngwaga wa 2023 mo ikuetseng mo go maAforika Borwa otlhe go tshwarisana tiro mmogo le go dira bonnete jwa gore go se nne le ope yo ba mo tlogelang kwa morago fa go samaganwe le dikgwetlho tse di boima tse naga ya rona tobaneng natso.
",0.49103308
"Cabinet reaffirmed President Cyril Ramaphosa’s clarion call made in his 2023 State of the Nation Address for all South Africans to work together and leave no one behind as we tackle our country’s pressing challenges.
","Dikgato tse di sa tseweng ke phefo tsa ga moporesitente di beile kwa pele maano puso monongwaga go samagana le motlakase o tshabetseng ruri le go dira gore re se tlhole re sokodisiwa ke tlhaelo ya motlakase..  Kabinete ikuela mo maphateng otlhe setšhaba sa rona go ema nokeng matsholo otlhe go boletsweng ka ona mo puong ya SoNA ya Moporesitente, go nne botlhokwa mo go maswe mo go fokotseng botlhokatiro, tshokolo le ditlhwatlhwa tse di goletseng ruri tsa go reka dilo tse batho ba iphedisang ka tsona mmogo le go lwantshana le botlhokotsebe le bonweenwee.
",0.7571249
"The President’s bold measures put energy at the forefront of government’s plan of action for the year to deal decisively with load-shedding and secure sustainable energy supply.
","Puso tloga ikemiseditse go potlakisa tiro go setseng go samaganwe le yona ya go oketsa motlakase ka fa nageng mme tiro re tobaneng le yona ke go sutisa sengwe le sengwe se se kgoreletsang gore seno se diragale.
",0.7311342
"Cabinet urged all sectors of society to support the initiatives outlined in the SoNA by the President, which are critical to sustaining our efforts to reduce unemployment, poverty and the rising cost of living as well as combat crime and corruption.
","Fela jaaka Moporesitente Ramaphosa setse tlhalositse mo go SoNA ya gagwe, mo dibekeng di le mmalwa tse di tlang, ditlhotshwana tsa ditirelo tsa puso di tla abelana ka tshedimosetso ka botlalo ka ga Leano la Dikgato tse Puso tla di Tsayang (PoA) mo ngwageng yo re lebileng.
",0.64498425
"Government is determined to accelerate the work already underway to increase energy supply to the national grid and our task is to remove any impediments to that progress.
","Puo ya Tekanyetsokabo ya Naga le yona ka Laboraro, 22 Tlhakole 2023 tla abelana ka tshedimosetso e tseneletseng ka ga merero ya PoA.
",0.5772994
"In the next few weeks, cluster briefings will provide more information on government’s Programme of Action (PoA) for the year ahead, as highlighted by President Ramaphosa in the SoNA.
","Kopano Kgolo ya Beng ba Meepo mo Nageng ya Aforika ya Ngwaga wa.
",0.5318092
"The National Budget to be presented on Wednesday, 22 February 2023 will provide further information on government’s PoA.
","Kabinete sekegetse tsebe dintlha tse di tšhotlhilweng kwa Kopanong Kgolo ya Beng ba Meepo mo Nageng ya Aforika e neng tshwaretswe kwa Cape Town International Convention Centre go tloga ka la bo 6 go fitlha ka la bo 9 Tlhakole 2023 mo molaetsamogolo neng re: “Go Bulela Dipeeletso mo Meepong ya Aforika: Go Tlisa Tsetsepelo, Polokesego le Tlamelo e sa Kgaotseng”.
",0.68994236
"African Mining Indaba.
","Kopano Kgolo ya Beng ba Meepo mo Nageng ya Aforika tsenetswe ke beng ba meepo go tswa mo kontinenteng le mo lefatsheng ka bophara bile itiretse leina ka go itsege jaaka khonferense e di gogang kwa pele mo dipeeletsong tsa meepo mo kontinenteng.
",0.5559269
"Cabinet noted the outcomes of the African Mining Indaba held at the Cape Town International Convention Centre from 6 to 9 February 2023 under the theme: “Unlocking African Mining Investment: Stability, Security and Supply”.
","Moepo tswelela go nna le seabe se segolo mo go tliseng tlhabologo le mo go ageng diintaseteri mo kontinenteng ka bophara botlhokwa thata fa go tla mo go tlholeng ditiro le mo go direng gore batho ba se latlhegelwe ke ditiro bile ke ona o dirileng gore go nne le ditiro di ka nna halofo ya milione mo meepong le ditiro tse dingwe di ka nna milione tse di ikokotletseng ka ditiro tsa meepo mo nageng ya Aforika Borwa.
",0.67347324
"The African Mining Indaba brought together industry players from across the continent and the globe, and cemented its place as the premier mining investment conference on the continent.
","Dilo tse di tlhagisitsweng mo meepong ya Aforika Borwa mo ngwageng yo fetileng di fitlhile kwa mankalankaleng mo di dirileng bokanaka  18 trilione, tsa godisa dilo tse di tlhagisiwang ka fa nageng, ditlhagisiwa tsa naga ya rona tse di rekisediwang dinaga tsa boditšhaba mmogo le letseno la rona.
",0.6998514
"Mining continues to play pivotal role in development and industrialisation across the continent.
","Kabinete ikuela mo go botlhe ba ba nang le seabe mo intasetering eno go tswelela go tshwarisana tiro le puso gore re kgone go nna le intaseteri e itsegeng mo lefatsheng e kgonang go ema nokeng kgolo ya ikonomi, go tlhola ditiro le go tlisa tlhabololo e tsepameng.
",0.6606741
"It is an important contributor to job creation and retention, accounting for close to half million direct jobs and close to million indirect jobs in South Africa.
","Merwalela.
",0.16287458
"Mining production in South Africa last year reached record high of  18 trillion, boosting our gross domestic product, exports and revenue.
","Kabinete rometse matshediso kwa malapeng bao ba latlhegetsweng ke ba malapa bona mo merwaleleng ya mo malobanyaneng e gogotseng mafelo le mantsinyana ka fa nageng..  Re leboga go menagane go ba ditirelo tsa tshoganyetso go ralala le naga ya rona ba ba neng ba tshwere phage ka dingana go pholosa matshelo batho.
",0.69004726
"Cabinet calls on all role players in the industry to continue working with government to realise globally competitive industry that boosts economic growth, creates jobs and drives sustainable development.
","Re le naga tla re ipopeng seoposengwe mme re tswe thuso bao ba tlhokang tlhokomelo le kemonokeng.
",0.61769915
"Floods.
","Kabinete ikuetse mo baaging gore ba nne ka fa dintlong fa pula tshologa le fa go na le merwalela, mmogo le go gakolola bao ba nnang mo mafelong ao metsi tamang mo go ona fa pula nele thata gore ba itlhokomele..  Baagi ba elediwa gore ba se tsamaele gaufi le mo metsi mantsi sianang ka lobelo, ba se thumele mo go ona kgotsa ba se kgabaganye mo metsing ano ka dijanaga tsa bona kgotsa gona go leka go kgabaganya ditsela, maborogo le dinoka mo metsi tletseng.
",0.34815228
"Cabinet expressed its condolences to the families who have lost loved ones in the recent devastating floods which hit several parts of our country.
","Kabinete ikuetse mo baaging go dira bonnete jwa gore ka gale bana ba bona ba bolokesegile bile ga go na kgonagalo ya gore ba ka gogolwa ke metsi fa go na le merwalela..  Tirisodikgoka ka Ditlhobolo.
",0.6853653
"We thank our emergency and rescue services across the country who have worked tirelessly to save lives.
","Kabinete rometse matshediso yona kwa go ba lelapa le ditsala tsa ga seopedi sa mmino wa hip-hop Rre Kiernan Forbes, yo tumileng thata ka leina la AKA, mmogo le ba lelapa le ditsala tsa ga tsala ya gagwe yo neng le seapei se se tumileng bong Rre Tebello Motsoane, bao bobedi bo jelweng ka tlhobolo kwa Durban..  Kabinete batla gape le go romela matshediso yona kwa go ba lelapa le ditsala tsa ga molwelakgaratlho ya go lwantshana le bosenyi bong Rre Ayob Mungalee, yo mo malobanyaneng jelweng ke tlhobolo kwa Eldorado Park kwa Johannesburg ne le Mokaedi wa mokgatlho o rotloetsang baagi go ema ka dinao kgatlhanong le digongwana tsa bosenyi le thekiso ya diritibatsi wa People Seeking Justice Action Group..  Kabinete rometse matshediso kwa go ba lelapa le ditsala tsa batho bao ba jelweng ka ditlhobolo kwa porofenseng ya Kapa Bophirima, KwaZulu-Natal le ya Kapa Botlhaba.
",0.58236784
"Let us come together as nation and offer assistance to those who are in desperate need of care and support.
","Ditiragalo tse di setlhogo tseno tsa go tlhasela batho ba bangwe, tseo ba sepodisi ba setseng ba weditse diphuruphutso tsa tsona, di re bontsha ka fao tirisodikgoka ka ditlhobolo setseng aname ka gona mmogo le dikotsi tse nang le tsona mo baaging..  Kabinete netefaletsa maAforika Borwa gore go samaganwe le dikgato tse di tla matlafatsang Tirelo ya Sepodisi sa Aforika Borwa (SAPS) gore kgone go lwantshana le bosenyi.
",0.64170283
"Cabinet urged people to stay indoors in cases of heavy rain and stormy weather, and reminded those who live in low-lying areas to take extra caution.
","Tsona di tsenyeletsa go oketsa palo ya mapodisi mo mebileng mmogo le go tlhoma ditlhopha tse di tla lwantshanang le bosenyi jo bo rileng.
",0.6721181
"People are cautioned not to walk, swim or drive through fast-moving floodwater or cross flooded roads, bridges and rivers.
","Aforika Borwa tla dirisa gape le dikgato tsa go dirisa tshedimosetso ka mokgwa o tlhalefileng go itse gore ke mafelo fe a tumileng ka bosenyi le bosenyi bo itaolang mo go ona..  SAPS samagane le go gagamatsa matsholo go utolola ditlhobolo le dikolo le go thopa tsotlhe tse di seng mo molaong tse di leng mo diatleng tsa ditlhokotsebe.
",0.7025434
"Cabinet urged members of the public to ensure that children are always safe from drowning during floods.
","Mo dikgweding di le 12 tse di fetileng mapodisi ne thopa ditlhobolo di le 65 519 tse di neng di le mo diatleng tsa batho..  Puso ikuela mo baaging botlhe mmogo le mo mekgatlhong ya baagi go sikara mmogo tiro eno le ba sepodisi go fedisa botlhokotsebe mo metseng ya rona.
",0.6386879
"Gun violence.
","Fa go na le sengwe se se itseng se se ka romelang kwa kgolegelong batho ba mo motseng ba ba dirang dilo tse di seng mo molaong, loma mapodisi tsebe ka go letsetsa Mogala wa go Lwantshana le Ditiro tsa Bosenyi mo go 0800. .
",0.42589888
"Cabinet expressed its condolences to the family and friends of hip-hop artist Mr Kiernan Forbes, popularly known as AKA, and celebrity chef Mr Tebello Motsoane, who were recently gunned down in Durban.
","Masepala wa Selegae wa Enoch Mgijima (EMLM).
",0.52565116
"Cabinet also expressed its sympathies to the family and friends of anti-crime activist Mr Ayob Mungalee, who was recently shot dead at Eldorado Park in Johannesburg.
","Tona ya Pusoselegae le Merero ya Setso Mme Nkosazana Dlamini Zuma mmogo le Tona ya Matlole Rre Enoch Godongwana ba ne ba sedimosetsa ditokololo tsa Kabinete ka maeto bona go buisana le bannaleseabe ba ba nang le dikarolo le seabe se se botlhokwa mo masepaleng ono wa Enoch Mgijima.
",0.7407684
"He was the national director of the People Seeking Justice Action Group movement which mobilised community members to take stand against gangsterism and drug dealing.
","Ka kgwedi ya Moranang, Kabinete ne ya nesetsa pula dikgato tse di ka tsewang go rarabolola matsapa mo masepaleng ono go ya ka Karolo ya bo 139(7) ya Molaotheo wa Rephaboliki ya Aforika Borwa wa 1996, fa buisiwa mmogo le Karolo ya bo 150 ya Molao wa Taolo ya Matlole Dimasepala wa ngwaga wa 2003 (Molao wa bo 56 wa 2003).
",0.63250494
