src_text,tgt_text,cosine_score
"Kabinete netefaditše gore dikgetho ke motheo wa temokrasi ya gaborena le gore di swanetše go šireletšwa ka fao go ka kgonagalago..     Khonferense ya Ditona ya bo-12 (MC12) ya Setheo sa Dikgwebišano Magareng ga Dinaga tša Lefase (WTO).
","Khabinete yi tlhele yi amukela ku voniwa nandzu ni ku gweviwa ka mudyondzisi wa le Durban, Mnn Nomusa Precious Gabuza (37) – loyi gweviweke malembe manharhu ya vulanguteri bya swa makhotso ni mune wa malembe ekhotsweni, lama hinkwawo ma yimisiwaka nkarhinyana ku ringana malembe manharhu eka Khoto ya Muganga ya Umlazi eKwaZulu-Natal – hi ku tlula Nawu wa Nhlawulo wa Mfumo wa Muganga, wa 2000 (Nawu wa 27 wa 2000).
",0.7135682
"Kabinete amogetše dipoelo tša WTO MC12 ye bego swaretšwe kua Geneva, Switzerland go thoma ka la 12 go fihla ka la 17 Phupu 2022, kudukudu sephetho sa gore dinaga tše nago le maloka di ka kgona go fekeetša dilaesense tša maswanedi tšhireletšosemolao ya nako ye rileng ya meento ya COVID-19 go fihla ka ngwaga wa.
","Tanihi mudyondzisi eka xikolo lexi xitirhisiwa tanihi xitichi xo vhotela hi nkarhi wa Nhlawulo wa Masipala hi Nhlangula 2021, Mnn Gabuza tivone nandzu wa vukungundzwana bya ku vhota ka 24, ku katsa 12 wa Mihlawulo ya Masipala na 12 wa Mihlawulo ya Wadi.
",0.74793535
"Sephetho sa ge eba go swanetše go oketšwa mekgwa ya go alafa le go phekola COVID-19 se diegišitšwe ka dikgwedi tše tshela.
","Ku voniwa nandzu ni ku gweviwa ku tshikelela ku tiboha ka Khomixini ya Nhlawulo ya Afrika-Dzonga ku nghenelela ka nkarhi na nkarhi ni ku tirhisa ku lawuriwa ka switandzhaku.
",0.7098386
"Afrika Borwa be eteletše pele boipiletšo bja WTO bja go beelathoko maloka botlhami le boikgopolelo ao tlemaganego le meento ya COVID-19 ao tlo netefatšago gore go ba le khumanego ya go lekalekana ya meento le go kgontšha dinaga tša go ba le mabokgoni go itirela meento go dira bjalo.
","Lexi nakambe xihlambanyo xa matimba xa tisisiteme ta nhlawulo, leti hi mpfhuka ti tiyisiweke hi ku tivisiwa ka Switirhisiwa swo Lawula Tivhoti loku sivelaka ku vhota kambirhi.
",0.74468315
"Khonferense ye ikgafetše gape go latela tshepedišo ya go se ute selo le ya go akaretša bohle ya go hlama leswa mediro le mehola ya yona ka moka le go dumelelana go tsenela sekgoboko sa dikwanelo tša dikgwebišano tša go swaragana le magoro go etša maphelo, go thea magomo go diphokoletšo tša boreahlapi, kiletšo ya dikgwebišano ka mokgwa wa elektroniki gotee le tšhireletšego ya dijo     Diphetho tša Kabinete.
","Khabinete yi tiyisise leswaku mihlawulo masungulo ya xidemokirasi xa hina naswona yi fanele ku sirheleriwa hi tindlela hinkwato.
",0.6668002
"Kgatelopele Lenaneong la go Fetogela Kgašong ya Titšithale (BDM).
","Nhlengeletano ya vu12 ya Vaholobye (MC12) ya Nhlangano wa Mabindzu ya Misava (WTO).
",0.67504334
"Kabinete amogetše tshedimošetšo ka Lenaneo la BDM le go lemoga kgatelopele ye dirilwego ka go lokelwa ga mapokisana dithelebišene bjalo ka karolo ya go fulara kgašo ya dieriele go fetogela kgašong ya titšithale.
","Khabinete yi amukele mbuyelo wa WTO MC12 lowu khomeriweke eGeneva, Switzerland ku sukela hi ti12 ku fikela ti17 Khotavuxika 2022, hi ku kongoma xiboho xa leswaku matiko lama nga ringanela ma nga tsan’wa timfanelo ta murhi wa COVID-19 ku fika.
",0.7180503
"Kabinete gateletše gapegape nyakego ya ka pelapela ya go ruma BDM go kgona go bulela tsela maphoto ao nyakegago dikgokagano tša gohle tša motlalanaga, gotee le tshedimošo ye nngwe le theknolotši ya dikgokagano ya go amana le morero wo..     Tona ya Dikgokagano le Theknolotši ya Titšithale Khumbudzo Ntshavheni tla swara kopano ya tshedimošetšo ya babegaditaba gosasa (Labohlano, 24 Phupu) go fana ka tshedimošo ka botlalo.
","Xiboho xa ndlela leyi ku nga yisiwaka emahlweni hayona ka mirhi ya vutshunguri ni vukamberi bya COVID-19 ku hlwerisiweke ku ringana tin’hweti ta tsevu.
",0.67524254
"Pego ya Ngwaga ka Ngwaga ka Seemo sa Bosetšhaba sa Ditokelo tša Bana.
","Afrika-Dzonga ri ri karhi ri rhangela xirhambo xa WTO ku nyiketa timfanelo to tirhisa vutumbuluxi byo karhi lebyi fambisanaka ni ntlhavelo wa COVID-19 lebyi nga ta tiyisisa ku fikelela loku ringanaka ka ntlhavelo ni ku kotisa matiko lama nga ni vuswikoti byo humelerisa ntlhavelo ku endla tano.
",0.45878607
"Kabinete dumeletše go phatlalatšwa ga Pego ya Bobedi ya Ngwaga ka Ngwaga ya Bosetšhaba ya Ditokelo tša Bana.
","Nhlengeletano yi tlhele yi tiboha eka maendlelo mo pfuleka no hetiseka ku cinca swikongomelo swa yona hinkwaswo ni ku twanana hi phakeji ya mitwanano ya bindzu ku ololoxa tindhawu to fana ni rihanyo, ku veka swipimelo swa swipfuno swa maphasele ya tihlampfi, nawu wa bindzu ra xielekitironiki na nhlayiseko wa swakudya     Swiboho swa khabinete.
",0.5501209
"Pego ye tsebiša ka seemo sa ditaba ka phethagatšo ya Leano la Magato Bosetšhaba la bana go lebeletšwe nako ya magareng ga 2019-. .
","Phurogireme ya Nhluvukiso wa ku Cinca ka Mahaxelo ya Xidijithali (BDM).
",0.5925784
"Pego ye laetša diphenyo tšeo di gatišitšwego mengwageng ya magareng ga 2020- laetša gape le magoro ao santše lego tlhotlo, go akaretšwa le polokego ya bana le dithulano tšeo di tšwetšego pele magareng ga bahloki le bahumi go lebeletšwe bana.
","Khabinete yi amukele leswitshwa leswi engeteriweke eka Phurogireme ya BDM ni ku tekela enhlokweni ku antswisiwa loku endliweke hi ku nghenisiwa ka mabokisi ya vuhlanganisi tanihi xiphemu xo cinca kusuka eka anoloko ku ya eka vuhaxi bya dijithali.
",0.76344764
"Pego ye laetša ka fao leuba la COVID-19 le amilego bana ka yona mengwaga ye boletšwego..     Magato go namola seemo ao phethagatšwago ke mmušo nepile go lemoša batho ka moka ka ditokelo tša bana, go ya le ka fao go hlalošitšwego ka gare ga Molaotheo wa Rephabliki ya Afrika Borwa wa.
","Khabinete yi tshikele ku hatlisisa ku fikisa emakumu ka BDM ku tshuxa xipekitiramu lexi dingekaka xa vuhangalasi byo rhendzeleka na byona, ni vuxokoxoko byin’wana ni swikongomelo swa thekinoloji ya vuhlanganisi lebyi yelanaka..     Holobye wa Vuhlanganisi ni Tithekinoloji ta Dijithali Khumbudzo Ntshavheni ta va ni nhlengeletano ya swa mahungu mundzuku (Ravuntlhanu, 24 Khotavuxika) ku nyika vuxokoxoko hi ntalo.
",0.7871522
"Magato a thekga gape le ditlamego tša naga ye godimo ga Dikwano tša UN ka Ditokelo tša Bana (UNCRC) le Tumelelano ya Afrika ka Ditokelo le Boiketlo bja Bana (ACRWC).
","Xiyimo xa Xiviko xa Timfanelo ta Vana xa Lembe xa Rixaka.
",0.5828366
"Afrika Borwa ke ye nngwe ya naga ya go saenela kwano go bobedi UNCRC le ACRWC..     Pego ye hlamilwe ka go rerišana pele le dikgoro tša mmušo le palo ye bonagalago ya bakgathatema ba maleba maemong bosetšhaba le profense.
","Khabinete yi pasise Xiyimo xa Xiviko xa Timfanelo ta Vana xa Lembe xa Rixaka xa vumbirhi leswaku xi kandziyisiwa.
",0.6436531
"Pego ye feletšego ka botlalo tla phatlalatšwa websaeteng ya Kgoro ya Tlhabollo ya Leago mo go: www.dsd.gov.za.
","Xiviko xi nyika xiyimo lexintshwa xa ku humelerisa eka Magoza ya Nkunguhato wa Rixaka ya Vana hi nkarhi wa 2019-..     Xiviko xi kombisa leswi tsariweke leswi fikeleriweke swa nkarhi wa 2020-.
",0.6472779
"Pego ye Kopantšwego ya Kgafetšakgafetša ya Afrika Borwa ya lekga la boraro go fihla go la boselela yeo hlagišeditšwego UNCRC.
","Xi tlhela xi kombisa tindhawu leti tshamaka ta ha ri tlhontlho, ku katsa vuhlayiseki bya vana ni ku ya emahlweni ka ku nga ringanani exikarhi ka swisiwana ni switsutsu hi ku kongomisa eka vana.
",0.5640857
"Kabinete dumeletše go hlagišetšwa UNCRC Pego ya Kgafetšakgafetša ya boraro go fihla go ya boselela.
","Xiviko xi tlhela xi ehleketa ndlela leyi ntungu wa COVID-19 wu khumbeke vana hakona hi nkarhi lowu.
",0.63699484
"Pego ye latela Pego ya bobedi ya Kgafetšakgafetša yeo hlagišeditšwego UNCRC ka..     Pego ye hlamilwe ka go tsamaišana le Kgatišo 44 ya UNCRC, ebile akaretša mebono le ditšhišinyo tšeo di dirilwego go tšwa pegong ya mafelelo.
","Magoza mo nghenelela lama simekiweke hi mfumo ma kongomise eka ku lemukisa timfanelo ta vana, tanihi loko ti andlariwile eka Vumbiwa ra Rhiphapuliki ra Afrika-Dzonga ra.
",0.67233187
"UNCRC rometše mebono le ditšhišinyo tša yona tša naga ye ka..     Go hlangwa ga pego ye go dirilwe ka go rerišana pele le dikgoro ka moka tšeo di amegago le bakgathatema ka moka go ralala le naga.
","Ma tlhela ma seketela vutihlamuleri bya tiko eka Mitwanano ya UN eka Timfanelo ta Vana (UNCRC) na Ntwanano wa Afrika eka Timfanelo ta Rihanyo ra Vana (ACRWC).
",0.66525614
"Pego ye feletšego ka botlalo tla dirwa phatlalatša ge šetše hlagišeditšwe UNCRC.
","Afrika-Dzonga xirho xa UNCRC na ACRWC.
",0.56771314
"Pego ya Bosetšhaba phethagatšong ya Lenaneothero le Leswa la Metsesetoropo.
","Xiviko xi hlengeletiwile hi ku tihlanganisa ni tindzawulo ta mfumo na nhlayo ya vakhumbeki lava faneleke eka swiyimo swa tiko ni le ka swifundzankulu.
",0.72295517
"Kabinete dumeletše go hlagišwa ga pego ya bosetšhaba ya mathomo ya Afrika Borwa ka phethagatšo ya Lenaneothero le Leswa la Metsesetoropo go Lenaneo la UN la Madulo Batho (UN-Habitat).
","Xiviko hi ku hetiseka xi ta rhumeriwa eka webusayiti ya Ndzawulo ya Nhluvukiso wa Vaaki eka: www.dsd.gov.za.
",0.7088512
"UN-Habitat amogetše Lenaneothero la yona le Leswa la Metsesetoropo kua Khonfereseng ya yona ka Dintlo le Tlhabollo ye Swarelelago ya Metsesetoropo ka Diphalane.
","Xiviko xa Nkarhi na Nkarhi xa Nkatsakanyo xa vunharhu kufika eka vutsevu xa Afrika-Dzonga eka UNCRC.
",0.6469296
"Mebušo ye lego maloko lenaneo le go be bo letetšwe gore romele dipego ka boithaopo tša gore mošomo tlela kae.
","Khabinete yi pasise ku andlariwa ka Xiviko xa Nkarhi na Nkarhi xa vunharhu kufika eka vutsevu eka UNCRC.
",0.6390369
"Afrika Borwa thekgile go amogelwa ga Lenaneothero le Leswa la Metsesetoropo le go le phethagatša ka morago ga gore le amogelwe ka go šomiša Tlhako ya naga ye ya Mohlakanelwa ya Tlhabollo ya Metsesetoropo (IUDF).
","Xiviko lexi xi landzela Xiviko xa Nkarhi na Nkarhi xa vumbirhi lexi nga andlariwa eka UNCRC hi..     Xiviko xi hlanganisiwile hi ku landzelela Tsalwa ra 44 ra UNCRC, kutani ri angarhela nxiyisiso ni swibumabumelo leswi endliweke kusuka eka xiviko lexosungula.
",0.74879843
"Nepo ya IUDF ke go hlahla go hlabollwa ga madulo metsesetoropo go akaretša batho ka moka go tielela le go phelega..     Pego ye ya kgatelopele ya mošomo hlamilwe ka go rerišana pele le didiko tša mmušo tša bosetšhaba, tša profense le tša selegae gotee le di-NGO tše maleba.
","UNCRC ri rhumele nangutisiso ni swibumabumelo swa rona swa tiko hi.
",0.6466499
"Leanopeakanyo la Mohlakanelwa la Tlhabollo ya Baswa (IYDS).
","Ku hlanganisa ku endliwile hi ku tihlanganisa ni tindzawulo hinkwato leti yelanaka ni vakhumbeki etikweni hinkwaro.
",0.59603715
"Kabinete dumeletše go phethagatšwa ga IYDS.
","Xiviko hi ku hetiseka xi ta fikeleriwa hi vaaki loko se xi andlariwile eka UNCRC.
",0.6858487
"Leanopeakanyo le le kgontšha Pholisi ya Bosetšhaba ya Baswa ya 2020 go fihla ka.
","Xiviko xa rixaka Ekusimekiweni ka Ajenda Yintshwa ya Madoroba.
",0.63640094
"Yona hlatholla magato, diprotšeke le mananeo ao tlo dirwago ke bakgathatema ba go fapafapana go tšwa dihlophaneng tša baswa swaragana gape le ka go fokotša go ipušeletša gantši ga magato mmušo le go fa tlhahlo ya ka fao mekgatlo ye lego setšhabeng le lefapha la praebete ka thekgago baswa gore ba ka ikhweletša bjang menyetla ya mešomo.
","Khabinete yi pasise ku nyiketiwa ka xiviko xosungula xa rixaka xa Afrika-Dzonga eka ku Simekiwa ka Ajenda Yintshwa ya Madoroba eka Phurogireme ya UN ya Vutshamiso bya Vanhu (UN-Habitat).
",0.7143707
"Ge go be go hlangwa leanopeakanyo le, mafapha go fapafapana setšhaba amegile go lona go fa dikgopolo le go ntšha sa bona sa mafahleng.
","UN-Habitat yi amukele Ajenda Yintshwa ya Madoroba eka Nhlengeletano ya yona ya Tindlu ni Nhluvukiso wa Madoroba leyi nga tiyiselaka nkarhi wo leha hi Nhlangula.
",0.6866929
"Sengwalwa sa Makgoraditsela ka Pabalelo le Tšhomišano ye Swarelelago ya Diphedi tša go Fapafapana tša Afrika Borwa.
","Swirho swa matiko swi languteriwe ku nyika swiviko swo humelela hi ku tinyiketela.
",0.60656226
"Kabinete dumeletše seakanywa sa Mokgoraditsela ka Pabalelo le Tšhomišo ye Swarelelago ya Diphedi tša go Fapafapana tša Afrika Borwa gore setšhaba se fe ditshwayotshwayo tša sona.
","Afrika-Dzonga ri seketele ku amukeriwa ka Ajenda Yintshwa ya Madoroba naswona endhaku ka sweswo ri yi humelerisile hi ku tirhisa Rimba ro Hlanganisa ra Nhluvukiso wa Madoroba (IUDF).
",0.7653396
"Diphedi tša go fapafapana tša Afrika Borwa di fana ka motheo wo bohlokwa wa go kgontšha kgolo ya ikonomi le tlhabollo, ebile wona motheo wo tloga le bohlokwa kudu go lebeletšwe mekgwa yeo batho ba iphedišago ka yona..     Sengwalwa se sa makgoraditsela ke sona se kgontšhago ditšhišinyo tšeo di dirilwego ke Sehlopha sa Maemo Godimodimo sa Ditsebi tšeo di thwetšwego ka 2019 go fetleka dipholisi tša rena tša bjale, melao le ditlwaedi ka merero ya go amana kudu le diphedi tše tša mohuta wa moswananoši..     Pego ye šišintše gore go hlangwe pholisi ye akaretšago tšohle ka pabalelo le tšhomišo ye swareleago ya diphedi tša go fapafapana tša naga ye.
","IUDF ri kongome ku letela nhluvukiso wa nhlanganelo, ku tiyisela ni vutshamo bya madoroba lama nga ringanela ku tshama.
",0.71473587
"Pholisi ye tla phethagatšwa go ralala didiko ka moka tša mmušo.
","Xiviko xa antswiso xi hlanganisiwile hi ku tihlanganisa ni tiko, swifundzankulu ni swiyenge swa miganga swa mfumo, na tiNGOs leti fambelanaka.
",0.6471081
"Pabalelo tloga le bohlokwa lesolong la naga ye la go akgofiša kgolo ya ikonomi le tlhomo ya mešomo.
","Kungu ro Hlanganisa ra Nhluvukiso wa Vantshwa (IYDS).
",0.52248514
"Leanopeakanyo la Nama ya Diphoofolo tša Lešoka.
","Khabinete yi pasise ku simekiwa ka IYDS.
",0.65378606
"Kabinete dumeletše go phatlalatšwa ga seakanywa sa Leanopeakanyo la Nama ya Diphoofolo tša Lešoka gore setšhaba se fe ditshwayotshwayo tša sona.
","Kungu ri nyika ku tirha eka Pholisi ya Rixaka ya Vantshwa ya 2020-.
",0.6479311
"Leanopeakanyo le le šeditše go botsefatša le go fetoša gabotse intasteri ya nama ya diphoofolo tša lešoka.
","Yi andlala magoza, tiprojeke ni tiphurogireme leswaku yi amukeriwa hi vakhumbeki vo hambanahambana kusuka eka ku tumbuluxiwa ka vantshwa.
",0.7494886
"Le šetšane gape le go kgatha tema tšhireletšegong ya dijo ka mokgwa wo swarelelago.
","Yi tlhela yi tirhana ni ku hunguta ku vuyelerisa ko nghenelela ka mfumo ni ku letela ndlela leyi vaaki ni mabindzu mo ka ma nga ri ma mfumo leswaku va seketela vantshwa ku kota ku fikelela mikateko hakona.
",0.63353693
"Intasteri ya nama ya diphoofolo tša lešoka ka boati ke intasteri ya go se lefišwe metšhelo ya go šoma thokwana le noši.
","Ku hlanganisiwa ka kungu ku katse switsundzuxo swo hambanahambana kusuka eka mabindzu ya hambanahambana ya vaaki.
",0.6995053
"Leanopeakanyo le le šišintšwego le fana ka leano la phethagatšo leo le tla botsefatšago le go matlafatša intasteri ye bjalo ka bobedi moabi wa tšhireletšego ya dijo le lefapha la kgolo ya ikonomi leo le tla thušago go hloma menyetla ya mešomo     Melaokakanywa.
","Mpfapfarhuto wa Nawumbisi wa Nhlayiso ni Ntiyiselo wo Tirhisa Bayodayivhesiti ya Afrika-Dzonga.
",0.6855428
"Molaokakanywaphetošwa ka Kakaretšo wa 2022 wa Merero ya Setšo.
","Khabinete yi pasise mpfapfarhuto wa Nawumbisi wa Nhlayiso ni Ntiyiselo wo Tirhisa Bayodayivhesiti ya Afrika-Dzonga leswaku vaaki va nyika mavonelo ya vona.
",0.64072573
"Kabinete dumeletše go hlagišwa Palamenteng ga Molaokakanywaphetošwa wa 2022 wa Merero ya Setšo gore Palamente go sekaseke goya pele.
","Bayodayivhesiti ya Afrika-Dzonga yi nyika masungulo ya nkoka ya nkuriso ni nhluvukiso wa ikhonomi, kutani yi ni nkoka swinene eka vutomi bya vanhu.
",0.6601882
"Diphetošo tše di šetšane le go fetleka Molao wa Setšo le wa Boetapele bja maKhoi-San, 2019 (Molao 3 wa 2019), wo tsentšwego tirišong ka la 1 Moranang.
","Nawumbisi wu nyika matimba eka swibumabumelo leswi endliweke hi Huvo ya Xiyimo xa le Henhla ya Switivi leyi thoriweke hi 2019 ku langutisisa hi vuntshwa tipholisi ta hina ta sweswi, milawu ni mintolovelo eka timhaka leti yelanaka na muxaka lowu tivekaka swinene.
",0.727209
"Molaokakanywaphethošwa wa 2022 wa Tšhireletšo ya Temokrasi ya Molaotheo Kgahlanong le Ditiragalo tša Matšhošetši le tše dingwe tša go amana le tšona.
","Xiviko xi bumabumele ku hluvukisiwa ka pholisi leyi angarhelaka nhlayiso ni ntiyiselo wo tirhisa bayodayivhesiti ya tiko.
",0.6939928
"Kabinete dumeletše go hlagišwa Palamenteng ga Molaokakanywaphetošwa wa 2022 ka Tšhireletšo ya Temokrasi ya Molaotheo Kgahlanong le Matšhošetši le tše dingwe tša go amana le ona gore Palamente go sekaseke goyapele.
","Pholisi yi ta humelerisiwa eka swiyenge swa mfumo hinkwaswo.
",0.5723444
"Ge šetše amogetšwe, Molaokakanywa wo tla fetoša Molao wa bjale wa Tšhireletšo ya Temokrasi ya Molaotheo Kgahlanong le Matšhošetši le Ditiragalo tša go Amana le ona, 2004 (Molao 33 wa 2004).
","Nhlayiso wu ni nkoka eka fu fambisa tiko ku kota ku hatlisisa nkuriso wa ikhonomi ni ku tumbuluxa mitirho..     Kungu hi Nyama ya Swihari.
",0.6753286
"Molaokakanywa wo fetile pele ditherišanong tšeo di tseneletšego tša setšhaba morago ga gore dumelelwe ke Kabinete ka Mopitlo.
","Khabinete yi pasise ku kandziyisiwa ka mpfapfarhuto wa Kungu hi Nyama ya Swihari leswaku vaaki va nyika mavonelo ya vona.
",0.7428084
"Diphetošo tše di šetšane le go bea madulong didirišwa tšeo di tšweleditšwego ka nageng ye tša go lwantšha matšhošetši gotee le magato lefaseng ka bophara ao hlomilwego.
","Kungu ri lava ku endla ximfumo ni ku cinca bindzu ra nyama ya swihari.
",0.72155446
"Diphetošo tše di šogašogane gape le ditemana tšeo go tšeerwego sephetho ke Kgorotsheko ya Molaotheo sa gore ga di gate ka mošito tee le Molaotheo.
","Ri tlhela ri lava ku hoxa xandla eka mayelano ni nhlayiso wa swakudya hi ndlela ya ntiyiselo wa nkarhi wo leha.
",0.62434363
"Bjalo ka ye nngwe ya naga ye lego leloko la Khansele ya UN ya Tšhireletšego, Afrika Borwa tlamegile goya ka mohola wa yona go batametša kgauswi melao ya boditšhabatšhaba yeo šetšanego le go maatlafatša magato le go lwantšha matšhošetši lefaseng ka bophara     Ditiragalo tše di Tlago.
","Bindzu ra nyama ya swihari hakanyingi bindzu leri nga riki ra ximfumo leri tirhaka hi ndlela yo ka yi nga ri enawini.
",0.6048951
"Samiti ya bo-14 ya Brazil, Russia, India, China le Afrika Borwa (BRICS).
","Kungu leri ringanyetiweke ri nyika pulani yo humelerisa leyi nga ta va ya ximfumo ni ku tiyisa bindzu tanihi munyiki wa vuhlayiseki bya swakudya ni bindzu ra nkuriso wa ikhonomi leswi nga ta pfuna ku tumbuluxa mikateko ya mitirho     Milawumbisi.
",0.59319127
"Mopresidente Ramaphosa tla eta pele go kgatha tema ga Afrika Borwa Samiting ya bo-14 ya go swarwa ka dikgokagano tša bidio ya Baetapele ba BRICS yeo swerwego ke Rephabliki ya Bohle ya China go thoma ka Labone, 23 go fihla ka Labohlano, 24 Phupu.
","Ndzulamiso wa Nawumbisi wo Angarhela wa Timhaka ta Ndhavuko wa.
",0.570382
".
","Khabinete yi pasise ku nyiketiwa ka Ndzulamiso wa Nawumbisi wo Angarhela wa Timhaka ta Ndhavuko wa 2022 ePalamente leswaku wu humelerisiwa ku ya emahlweni.
",0.42175162
"Maloko rena BRICS ba tšwelapele go hola naga ye.
","Ndzulamiso wu lava ku pfuxeta Nawu wa Vurhangeri bya Ndhavuko wa Makhoyi-Sani, wa 2019 (Nawu wa 3 wa 2019), lowu sunguleke ku tirha hi siku ra 1 Dzivamisoko.
",0.54070294
"Ngwageng wa go feta, diromelwantle tša go feta 17% tša Afrika Borwa di be di nepišitšwe dinageng tše dingwe tša BRICS, le gona palomoka ya go feta 29% ya ditšwantle tša rena di be di tšwa go tšona dinaga tše.
","Ndzulamiso wa Nawumbisi wa Nsirhelelo wa Vumbiwa ra Xidemokirasi Ku lwa ni Vutherorisi na Migingiriko leyi Yelanaka wa.
",0.6115705
"Boleng bja theko ya kgwebišano ye bo tšwelapele go golela godimo, ka palomoka ya dikgwebišano tša Afrika Borwa le dinaga tše dingwe tša BRICS batamela R702 bilione ka 2021, morago ga gore golele godimo go tloga go R487 bilione ka.
","Khabinete yi pasise ku nyiketiwa ka Ndzulamiso wa Nawumbisi wa Nsirhelelo wa Vumbiwa ra Xidemokirasi Ku lwa ni Vutherorisi na Migingiriko leyi Yelanaka wa 2022 ePalamente ku wu humelerisa ku ya emahlweni.
",0.72089946
".
","Loko wu kala wu amukeriwa, Nawumbisi wu ta lulamisa Nawu wa Nsirhelelo wa Vumbiwa ra Xidemokirasi Ku lwa ni Vutherorisi na Migingiriko leyi Yelanaka lowu nga kona, wa 2004 (Nawu wa 33 wa 2004).
",0.47749132
"Tšhomišanommogo gare ga dinaga tše lego maloko BRICS magorong go fapafapana go swana le maphelo le dikgwebišanong tše kaonafetšego godišitše intasteri ya ka mo nageng, le go hola dinaga ka moka tše lego maloko BRICS.
","Nawumbisi wu hundzile hi le ka ndlela leyikulu ya ku tihlanganisa ni vaaki endzhaku ko pasisiwa hi Khabinete hi Mudyaxihi hi.
",0.69578093
"Dipeeletšo tša rena diprotšekeng tša tlhabollo ya mananeokgoparara le matsapa go fokotša go raragana ga magatotshepedišo mmušo ge go dirwa kgwebo di nepile go oketša diromelwantle go bagwebišani ba rena ba BRICS.
","Mindzulamiso yi lava ku ololoxa switirhisiwa swa tiko swo lwa ni vutherorisi hi ku tirhisa magoza ya misava hinkwayo lama vekiweke.
",0.6997491
"Sekolo sa Marega sa Tshepedišo ya Ikonomi Mmušong.
","Va tlhele va ololoxa swiyenge leswi ku tshembiwaka leswaku swi le nawini ku ya hi Khoto ya Vumbiwa.
",0.5221686
"Sekolotlhahlo sa Bosetšhaba sa Mmušo (NSG) se tla be se swere Lenaneo la sona la Boraro la Balaodiphethiši ba tša Dipolotiki gola Johannesburg go thoma ka la 27 Phupu go fihla ka la 1 Mosegamanye.
",".
",0.43423948
"Thuto ye go yona go tla tla Ditona go tšwa Côte d'Ivoire; Borwa bja Sudan le Afrika Borwa gotee le Balaodipharephare ba go tšwa Lesotho, Zambia, DRC, Tanzania le Ghana.
","Tanihi swirho swa Huvo ya Vusirhelelo ya UN, Afrika-Dzonga ra boheka ku lawula milawu ya matiko ya misava leyi lavaka ku tiyisa magoza yo lwa ni vutherorisi bya misava     Migingiriko leyitaka.
",0.65985715
"Dimeyara tša Afrika Borwa, gotee le maloko dikomiti tša meyara le makgotlaphethiši le bona ba tla ba gona..     Go letetšwe gore baetapelephethiši ba sepolotiki go tšwa dinageng tša go fapafapana ba ngwathelane dikgopolo le tšeo ba ithutilego go tšwa go tšona maemong go fapafapana ditiragalo ao ba itemogetšego ona mešomong ya bona ya tšatši ka tšatši.
","Samiti ya vu14 ya Brazil, Russia, India, China na Afrika-Dzonga (BRICS).
",0.6292912
"NSG hlamile lenaneo la ngwaga ka ngwaga go maloko lekgotlakhuduthamaga ka 2020, bjalo ka karolo ya thekgo ya lona ya boikgafo bja mmušo bja go hlola mmušo wo kgonago.
","Presidente Ramaphosa ta rhangela Afrika-Dzonga eka ku teka xiave eka Samiti ya Varhangeri ya vu14 ya vhichuwali ya BRICS leyi rhurheriweke hi People’s Republic of China ku sukela hi Ravumune, 23 ku fikela Ravuntlhanu, 24 Khotavuxika..     Vuxirho bya hina eka BRICS byi ya emahlweni byi vuyerisa tiko.
",0.7465484
"Lenaneo le, magareng ga tše dingwe, le šetšane le go tlabela lekgotlakhuduthamaga ka tsebo mo didikong tše tharo tša mmušo ka boetapele bjo bjo kaonafetšego le mabokgoni go bea leihlo mošomo wo dirilwego gore go kgonagale go lekolaleswa ditlhotlo tša pušo tšeo di šitišago go akaretšwa ga bohle le kgolo yeo swarelelago ya ikonomi.
","Lembe leri nga hundza ku tlula 17% wa leswi Afrika-Dzonga ri swi xaviselaka matikomambe swi kongomisiwile eka matiko laman’wana ya BRICS, kutani ku tlula 29% wa ntsengo wa hina hinkwawo wa swixaviseriwa matikomambe swi huma eka matiko lawa.
",0.6829843
"Letšatši la Boditšhabatšhaba la Nelson Mandela.
","Nkoka wa ku xaviselana loku wu kula wu ya emahlweni, wu ni ntsengo wa kwalomu ka R702 wa tibiliyoni wa ku xaviselana ka Afrika-Dzonga ni matiko laman’wana ma BRICS hi 2021, ku yile ehenhla ku sukela eka R487 wa tibiliyoni hi.
",0.37398374
"Letšatši la Boditšhabatšhaba la Nelson Mandela la lenyaga ka Mošupologo, 18 Mosegamanye le tla ketekelwa ka fase ga morero wa lefase ka bophara wo latelago: “Dira se se kgonago, ka seo nago le sona, kae goba kae mo lego gona”.
",".
",0.5014893
"Bjo ke boipiletšo bjo bo kwalakwaditšwego gore batho ba thekge le go kgatha tema lesolong le ka go logišana maano magato ao swarelelago nako ye telele go ba le ditlamorago tša go tšea telele.
","Vuxaka exikarhi ka swirho swa BRICS eka tindhawu to hambana tanihi swa rihanyo ni ku xaviselana loku antswisiweke ku kurisile mabindzu ya laha kaya, ni ku vuyerisa swirho hinkwaswo swa BRICS.
",0.6926918
"Ye nngwe ya magato mohuta wo ke Dipoledišano tša Baswa tša Nelson Mandela le Lenaneo la Boetapele bja Potego leo le lebeletšego kudu merero ye diragalago gona bjale ya go ama baswa ka mo Afrika Borwa le go potologa lefase ka bophara.
","Vuvekisi bya hina eka tiprojeke ta nhluvukiso wa swimakiwa ni matshalatshala yo hunguta ku tikisiwa ka milawu loko ku endliwa mabindzu ku kongomise ku kurisa ka swixaviseriwamatikomambe ku ya vatirhisanikulobye va hina va BRICS.
",0.7451329
"Sehla sa Metšhelo.
","Xikolo xa Vuxika xo Lawula Ikhonomi.
",0.70856845
"Sehla sa go faela metšhelo ya 2022 se tla bulwa go thoma ka la 1 Mosegamanye go fihla ka la 24 Diphalane.
","Xikolo xa Rixaka xa Mfumo (NSG) xi ta rhurhela Phurogireme ya xona ya vunharhu ya Xikolo xa Vuxika xo Lawula Ikhonomi xa swirhonkulu swa tipolitiki eJohannesburg kusuka hi ti27 Khotavuxika kufika ti1 Mawuwani.
",0.68988323
