src_text,tgt_text,cosine_score
"Xiyimo xa Xiviko xa Timfanelo ta Vana xa Lembe xa Rixaka.
","UMphathiswa wezoNxibelelwano nobuChwepheshe beDijithali uKhumbudzo Ntshavheni uza kunika iinkcukacha ezithe vetshe ngomso (uLwesihlanu, umhla wama-24 kweyeSilimela)..     INgxelo yoNyaka yeSimo seSizwe saMalungelo oMntwana.
",0.63272893
"Khabinete yi pasise Xiyimo xa Xiviko xa Timfanelo ta Vana xa Lembe xa Rixaka xa vumbirhi leswaku xi kandziyisiwa.
","IKhabhinethi ivumile ukuba ipapashwe iNgxelo yoNyaka yesibini engeSimo seSizwe kumaLungelo abaNtwana.
",0.9117305
"Xiviko xi nyika xiyimo lexintshwa xa ku humelerisa eka Magoza ya Nkunguhato wa Rixaka ya Vana hi nkarhi wa 2019-..     Xiviko xi kombisa leswi tsariweke leswi fikeleriweke swa nkarhi wa 2020-.
","Le ngxelo ibonelela ngohlaziyo ngokufezekiswa kwesiCwangciso seSizwe  saBantwana kwisithuba esiphakathi kweminyaka yama-2019-..
",0.855016
"Xi tlhela xi kombisa tindhawu leti tshamaka ta ha ri tlhontlho, ku katsa vuhlayiseki bya vana ni ku ya emahlweni ka ku nga ringanani exikarhi ka swisiwana ni switsutsu hi ku kongomisa eka vana.
","Le ngxelo iqaqambisa impumelelo ebhalwe phantsi yexesha eliphakathi kweminyaka yama-2020-.
",0.6527289
"Xiviko xi tlhela xi ehleketa ndlela leyi ntungu wa COVID-19 wu khumbeke vana hakona hi nkarhi lowu.
","Ikwaqaqambisa iinkalo ezisathe gqolo zingumceli mngeni, kubandakanywa ukhuseleko lwabantwana kunye nokuqhubekeka kokungalingani phakathi kwabahlwempu nezinhanha ngokubhekiselele ebantwaneni.
",0.6855791
"Magoza mo nghenelela lama simekiweke hi mfumo ma kongomise eka ku lemukisa timfanelo ta vana, tanihi loko ti andlariwile eka Vumbiwa ra Rhiphapuliki ra Afrika-Dzonga ra.
","Le ngxelo ikwabonisa indlela ubhubhani we-COVID-19 ochaphazele ngayo abantwana ngeli xesha.
",0.71438456
"Ma tlhela ma seketela vutihlamuleri bya tiko eka Mitwanano ya UN eka Timfanelo ta Vana (UNCRC) na Ntwanano wa Afrika eka Timfanelo ta Rihanyo ra Vana (ACRWC).
","Amanyathelo okungenelela aphunyezwa ngurhulumente ajolise ekufezekiseni amalungelo abantwana, njengoko kucacisiwe kuMgaqo-siseko weRiphablikhi yoMzantsi Afrika wowe-.
",0.7368786
"Afrika-Dzonga xirho xa UNCRC na ACRWC.
","Lama nyathelo akwaxhasa izibophelelo zelizwe kwiiNgqungquthela ze-UN malunga namaLungelo oMntwana (i-UNCRC) kunye noMqulu wase-Afrika wamaLungelo kunye neNtlalontle yoMntwana (i-ACRWC).
",0.66667575
"Xiviko xi hlengeletiwile hi ku tihlanganisa ni tindzawulo ta mfumo na nhlayo ya vakhumbeki lava faneleke eka swiyimo swa tiko ni le ka swifundzankulu.
","UMzantsi Afrika watyikitya  kwi-UNCRC kunye ne-ACRWC.
",0.67288375
"Xiviko hi ku hetiseka xi ta rhumeriwa eka webusayiti ya Ndzawulo ya Nhluvukiso wa Vaaki eka: www.dsd.gov.za.
","Ingxelo yaqulunqwa ngokubonisana namasebe karhulumente kunye neqela labathathi-nxaxheba abafanelekileyo kwinqanaba lesizwe nelephondo.
",0.7057464
"Xiviko xa Nkarhi na Nkarhi xa Nkatsakanyo xa vunharhu kufika eka vutsevu xa Afrika-Dzonga eka UNCRC.
","Ingxelo epheleleyo iza kufakwa kwiwebhusayithi yeSebe loPhuhliso loLuntu: www.dsd.gov.za.
",0.63756716
"Khabinete yi pasise ku andlariwa ka Xiviko xa Nkarhi na Nkarhi xa vunharhu kufika eka vutsevu eka UNCRC.
","Ingxelo yeXeshana eDityanisiweyo yoMzantsi Afrika yesithathu ukuya kweyesithandathu kwi-UNCRC.
",0.8802024
"Xiviko lexi xi landzela Xiviko xa Nkarhi na Nkarhi xa vumbirhi lexi nga andlariwa eka UNCRC hi..     Xiviko xi hlanganisiwile hi ku landzelela Tsalwa ra 44 ra UNCRC, kutani ri angarhela nxiyisiso ni swibumabumelo leswi endliweke kusuka eka xiviko lexosungula.
","IKhabhinethi ikuvumile ukunikezelwa kweNgxelo yeXeshana lesithathu ukuya kwelesithandathu kwi-UNCRC.
",0.7604354
"UNCRC ri rhumele nangutisiso ni swibumabumelo swa rona swa tiko hi.
","Le ngxelo ilandela iNgxelo yexeshana yesibini eyayithiwe thaca kwi-UNCRC ngowama-..     Ingxelo iqulunqwe ngokungqinelana neSiqendu 44 se-UNCRC, kwaye ikwabandakanya imigqaliselo kunye nezindululo ezenziwe kwingxelo yokugqibela.
",0.6603049
"Ku hlanganisa ku endliwile hi ku tihlanganisa ni tindzawulo hinkwato leti yelanaka ni vakhumbeki etikweni hinkwaro.
","I-UNCRC yayithumele imigqaliselo kunye neengcebiso zayo kweli lizwe ngo-..     Olu qulunqo lwenziwe ngodliwano-ndlebe nawo onke amasebe afanelekileyo nabachaphazelekayo kwilizwe liphela.
",0.82183063
"Xiviko hi ku hetiseka xi ta fikeleriwa hi vaaki loko se xi andlariwile eka UNCRC.
","Ingxelo epheleleyo iza kwaziswa eluntwini emva kokuba yondlelwe kwi-UNCRC.
",0.9253061
"Xiviko xa rixaka Ekusimekiweni ka Ajenda Yintshwa ya Madoroba.
","Ingxelo yeSizwe emalunga nokuphunyezwa kweNkqubo eNtsha yoPhuhliso lweDolophu.
",0.8747599
"Khabinete yi pasise ku nyiketiwa ka xiviko xosungula xa rixaka xa Afrika-Dzonga eka ku Simekiwa ka Ajenda Yintshwa ya Madoroba eka Phurogireme ya UN ya Vutshamiso bya Vanhu (UN-Habitat).
","IKhabhinethi ikuvumile ukungeniswa kwengxelo yokuqala yesizwe yoMzantsi Afrika emalunga nokuPhunyezwa kweNkqubo eNtsha yoPhuhliso lweDolophu kwiNkqubo yokuHlaliswa koLuntu ye-UN (i-UN-Habitat).
",0.93895996
"UN-Habitat yi amukele Ajenda Yintshwa ya Madoroba eka Nhlengeletano ya yona ya Tindlu ni Nhluvukiso wa Madoroba leyi nga tiyiselaka nkarhi wo leha hi Nhlangula.
","I-UN-Habitat yamkele iNkqubo eNtsha yoPhuhliso lweDolophu kwiNkomfa yayo yeZindlu kunye noPhuhliso oluZinzileyo lweDolophu kweyeDwarha  ngonyaka wama-.
",0.91167784
"Swirho swa matiko swi languteriwe ku nyika swiviko swo humelela hi ku tinyiketela.
","Amazwe angamalungu kwakulindeleke ukuba angenise iingxelo zenkqubela-phambili ngokuzithandela.
",0.9188225
"Afrika-Dzonga ri seketele ku amukeriwa ka Ajenda Yintshwa ya Madoroba naswona endhaku ka sweswo ri yi humelerisile hi ku tirhisa Rimba ro Hlanganisa ra Nhluvukiso wa Madoroba (IUDF).
","UMzantsi Afrika uxhase ukwamkelwa kweNkqubo eNtsha yoPhuhliso lweDolophu waza emva koko wayizalisekisa ngeNkqubo-sikhokelo yelizwe eDityanisiweyo yoPhuhliso lweDolophu (i-IUDF).
",0.9454293
"IUDF ri kongome ku letela nhluvukiso wa nhlanganelo, ku tiyisela ni vutshamo bya madoroba lama nga ringanela ku tshama.
","I-IUDF ijolise ekukhokeleni uphuhliso lweendawo zokuhlala ezisezidolophini ezibandakanyayo, ezikwaziyo ukuzimela nekuhlalekayo kuzo..     Ingxelo yenkqubela-phambili yaqulunqwa ngokubonisana norhulumente wesizwe, wephondo nowengingqi, kunye neeNGO ezifanelekileyo.
",0.8441944
"Xiviko xa antswiso xi hlanganisiwile hi ku tihlanganisa ni tiko, swifundzankulu ni swiyenge swa miganga swa mfumo, na tiNGOs leti fambelanaka.
","ISicwangciso esiHlangeneyo soPhuhliso loLutsha (i-IYDS).
",0.68356514
"Kungu ro Hlanganisa ra Nhluvukiso wa Vantshwa (IYDS).
","IKhabhinethi iyamkele i-IYDS ukuba iphunyezwe.
",0.7295146
"Khabinete yi pasise ku simekiwa ka IYDS.
","Esi sicwangciso-qhinga siphumeza uMgaqo-nkqubo woLutsha weSizwe wowama-2020-.
",0.7146642
"Kungu ri nyika ku tirha eka Pholisi ya Rixaka ya Vantshwa ya 2020-.
","Ichaza amanyathelo, iiprojekthi kunye neenkqubo eziza kwenziwa ngabathathi-nxaxheba abohlukeneyo abavela kumaqumrhu olutsha.
",0.6511506
"Yi andlala magoza, tiprojeke ni tiphurogireme leswaku yi amukeriwa hi vakhumbeki vo hambanahambana kusuka eka ku tumbuluxiwa ka vantshwa.
","Ikwajongene nokuncitshiswa kokuphindwa kongenelelo lukarhulumente kwaye ikhokele indlela uluntu kunye necandelo labucala abanokuxhasa ngayo abantu abatsha ekufikeleleni kumathuba.
",0.8004086
"Yi tlhela yi tirhana ni ku hunguta ku vuyelerisa ko nghenelela ka mfumo ni ku letela ndlela leyi vaaki ni mabindzu mo ka ma nga ri ma mfumo leswaku va seketela vantshwa ku kota ku fikelela mikateko hakona.
","Ukuqulunqwa kwesi sicwangciso kubandakanye amagalelo ahlukeneyo avela kumacandelo ngamacandelo oluntu.
",0.76512325
"Ku hlanganisiwa ka kungu ku katse switsundzuxo swo hambanahambana kusuka eka mabindzu ya hambanahambana ya vaaki.
","IPhepha leNgcaciso eYilwayo yoLondolozo kunye noSetyenziso oluZinzileyo lweZityalo eZiphilayo zaseMzantsi Afrika.
",0.70526195
"Mpfapfarhuto wa Nawumbisi wa Nhlayiso ni Ntiyiselo wo Tirhisa Bayodayivhesiti ya Afrika-Dzonga.
","IKhabhinethi iluvumile uyilo lwePhepha leNgcaciso yoMgaqo-nkqubo ngoLondolozo kunye noSetyenziso oluZinzileyo lweZityalo eZiphilayo zaseMzantsi Afrika ukuze uluntu luhlomle.
",0.82889026
"Khabinete yi pasise mpfapfarhuto wa Nawumbisi wa Nhlayiso ni Ntiyiselo wo Tirhisa Bayodayivhesiti ya Afrika-Dzonga leswaku vaaki va nyika mavonelo ya vona.
","Iintlobo-ntlobo zezityalo nezilwanyana zaseMzantsi Afrika zibonelela ngesiseko esibalulekileyo sokukhula koqoqosho nophuhliso, kwaye zikwa balulekile nakubomi babantu.
",0.7555213
"Bayodayivhesiti ya Afrika-Dzonga yi nyika masungulo ya nkoka ya nkuriso ni nhluvukiso wa ikhonomi, kutani yi ni nkoka swinene eka vutomi bya vanhu.
","Eli Phepha leNgcaciso yoMgaqo-nkqubo lenza ukuba zisebenze izindululo ezenziwe liGqiza leeNgcali elikwiNqanaba eliPhezulu elalonyulwe ngowama-2019 ukuba lihlole imigaqo-nkqubo yethu yeli xesha, imithetho kunye nezenzo kwimiba enxulumene neentlobo zezilwanyana ezidumileyo.
",0.7115669
"Nawumbisi wu nyika matimba eka swibumabumelo leswi endliweke hi Huvo ya Xiyimo xa le Henhla ya Switivi leyi thoriweke hi 2019 ku langutisisa hi vuntshwa tipholisi ta hina ta sweswi, milawu ni mintolovelo eka timhaka leti yelanaka na muxaka lowu tivekaka swinene.
","Le ngxelo icebise ngokuqulunqwa komgaqo-nkqubo obanzi wolondolozo nokusetyenziswa ngokuzinzileyo kwezityalo nezilwanyana zelizwe.
",0.7557632
"Xiviko xi bumabumele ku hluvukisiwa ka pholisi leyi angarhelaka nhlayiso ni ntiyiselo wo tirhisa bayodayivhesiti ya tiko.
","Lo mgaqo-nkqubo uza kuphunyezwa kuwo onke amanqanaba karhulumente.
",0.57208836
"Pholisi yi ta humelerisiwa eka swiyenge swa mfumo hinkwaswo.
","Ulondolozo lubalulekile kwiphulo lelizwe lokukhawulezisa ukukhula koqoqosho nokudala imisebenzi.
",0.60104173
"Nhlayiso wu ni nkoka eka fu fambisa tiko ku kota ku hatlisisa nkuriso wa ikhonomi ni ku tumbuluxa mitirho..     Kungu hi Nyama ya Swihari.
","Isicwangciso-qhinga esimalunga nenyama yenyamakazi.
",0.6198027
"Khabinete yi pasise ku kandziyisiwa ka mpfapfarhuto wa Kungu hi Nyama ya Swihari leswaku vaaki va nyika mavonelo ya vona.
","IKhabhinethi ikuvumile ukupapashwa  kwesiCwangciso-qhinga esisayilwayo seNyama yenyamakazi ukuze uluntu luhlomle.
",0.89052266
"Kungu ri lava ku endla ximfumo ni ku cinca bindzu ra nyama ya swihari.
","Esi sicwangciso-qhinga sijonge ukuvumela ngokusesikweni kunye nokuguqula ishishini lenyama yenyamakazi.
",0.9300844
"Ri tlhela ri lava ku hoxa xandla eka mayelano ni nhlayiso wa swakudya hi ndlela ya ntiyiselo wa nkarhi wo leha.
","Sikwafuna ukufaka isandla ekuqinisekeni kokuba khona kokutya ngendlela ezinzileyo.
",0.8662425
"Bindzu ra nyama ya swihari hakanyingi bindzu leri nga riki ra ximfumo leri tirhaka hi ndlela yo ka yi nga ri enawini.
","Ishishini lenyama yenyamakazi ubukhulu becala lishishini elingekho sikweni elisebenza ngendlela engafaniyo.
",0.9309969
"Kungu leri ringanyetiweke ri nyika pulani yo humelerisa leyi nga ta va ya ximfumo ni ku tiyisa bindzu tanihi munyiki wa vuhlayiseki bya swakudya ni bindzu ra nkuriso wa ikhonomi leswi nga ta pfuna ku tumbuluxa mikateko ya mitirho     Milawumbisi.
","Esi sicwangciso-qhinga sicetywayo sibonelela ngesicwangciso somiliselo esiza kumisela ngokusesikweni kwaye someleze eli candelo njengababoneleli bokutya kunye necandelo lohlumo loqoqosho elinokunceda ekudaleni amathuba emisebenzi     Umthetho osayilwayo.
",0.9141931
"Ndzulamiso wa Nawumbisi wo Angarhela wa Timhaka ta Ndhavuko wa.
","UMthetho osaYilwayo oLungisiweyo weMicimbi yezeMveli wowama-.
",0.8730874
"Khabinete yi pasise ku nyiketiwa ka Ndzulamiso wa Nawumbisi wo Angarhela wa Timhaka ta Ndhavuko wa 2022 ePalamente leswaku wu humelerisiwa ku ya emahlweni.
","IKhabhinethi ikuvumile ukungeniswa koMthetho-siHlomelo oYilwayo weMicimbi yezeMveli  wowama-2022 ePalamente ukuze uqhubeke nokuqhutywa.
",0.9109217
"Ndzulamiso wu lava ku pfuxeta Nawu wa Vurhangeri bya Ndhavuko wa Makhoyi-Sani, wa 2019 (Nawu wa 3 wa 2019), lowu sunguleke ku tirha hi siku ra 1 Dzivamisoko.
","Ezi zihlomelo zifuna ukuhlaziya uMthetho wobuNkokheli beMveli nobu-Khoi-San, wowama-2019 (uMthetho wesi-3 wama-2019), oqale ukusebenza ngomhla woku-1 kuTshazimpuzi ngowama-.
",0.92252004
"Ndzulamiso wa Nawumbisi wa Nsirhelelo wa Vumbiwa ra Xidemokirasi Ku lwa ni Vutherorisi na Migingiriko leyi Yelanaka wa.
","Umthetho osaYilwayo Wokukhuselwa kweNtando yesininzi yoMgaqo-siseko ngokuchasene nabanqolobi kunye neMisebenzi eNxulumene nabo wama-..     IKhabhinethi ikuvumile ukungeniswa ePalamente koMthetho osaYilwayo wokuKhuselwa kweNtando yesininzi yoMgaqo-siseko ngokuchasene nabanqolobi kunye neMisebenzi eNxulumeneyo nabo wama-2022 ukuba iqhutywelwe phambili.
",0.77991205
"Khabinete yi pasise ku nyiketiwa ka Ndzulamiso wa Nawumbisi wa Nsirhelelo wa Vumbiwa ra Xidemokirasi Ku lwa ni Vutherorisi na Migingiriko leyi Yelanaka wa 2022 ePalamente ku wu humelerisa ku ya emahlweni.
","Wakuba wamkelwe, lo Mthetho uYilwayo uza kuhlomela uMthetho okhoyo ngoku woKhuseleko lweNtando yesininzi yoMgaqo-siseko ekuchasene nabanqolobi neMisebenzi eNxulumeneyo nabo, wama-2004 (uMthetho wama-33 wama-2004).
",0.80438364
"Loko wu kala wu amukeriwa, Nawumbisi wu ta lulamisa Nawu wa Nsirhelelo wa Vumbiwa ra Xidemokirasi Ku lwa ni Vutherorisi na Migingiriko leyi Yelanaka lowu nga kona, wa 2004 (Nawu wa 33 wa 2004).
","Emveni  kokuba uvunyiwe lo mthetho usayilwayo yiKhabhinethi kuCanzibe wama-2021, uye waba kwinkqubo yokubonisana noluntu ngokubanzi.
",0.750388
"Nawumbisi wu hundzile hi le ka ndlela leyikulu ya ku tihlanganisa ni vaaki endzhaku ko pasisiwa hi Khabinete hi Mudyaxihi hi.
","Ezi zihlomelo zifuna ukulungelelanisa iindlela zokusebenza zeli lizwe zokulwa nobunqolobi kunye nemilinganiselo yehlabathi esele ibekiwe.
",0.71510744
"Mindzulamiso yi lava ku ololoxa switirhisiwa swa tiko swo lwa ni vutherorisi hi ku tirhisa magoza ya misava hinkwayo lama vekiweke.
","Kwakhona kuphinde kwajongwana  namagatya ayethe athathwa njenga magatya angekho kumgaqo-siseko yiNkundla yoMgaqo-siseko.
",0.6951959
"Va tlhele va ololoxa swiyenge leswi ku tshembiwaka leswaku swi le nawini ku ya hi Khoto ya Vumbiwa.
","Nanjenge lizwe elityikitye kwiBhunga loKhuseleko le-UN, uMzantsi Afrika ubophelelekile ukuba ube nemithetho yamazwe ngamazwe ezama ukomeleza amanyathelo okulwa nobunqolobi behlabathi     Imisitho Ezayo.
",0.63843095
".
","INkomfa ye-14 yase-Brazil, i-Russia, i-India, i-China noMzantsi Afrika (i-BRICS).
",0.537803
"Tanihi swirho swa Huvo ya Vusirhelelo ya UN, Afrika-Dzonga ra boheka ku lawula milawu ya matiko ya misava leyi lavaka ku tiyisa magoza yo lwa ni vutherorisi bya misava     Migingiriko leyitaka.
","UMongameli Ramaphosa uza kukhokela uMzantsi Afrika ekuthatheni inxaxheba kwiNkomfa ye-14 yeeNkokheli ze-BRICS ebanjwe yiRiphablikhi yase-China ukusuka ngoLwesine, umhla wama-23 ukuya kuLwesihlanu, umhla wama-24 kweyeSilimela ngowama-..     Ubulungu bethu be-BRICS busaqhubeka bunceda ilizwe.
",0.71489453
"Samiti ya vu14 ya Brazil, Russia, India, China na Afrika-Dzonga (BRICS).
","Kulo nyaka uphelileyo ngaphezulu kwe-17% yempahla ethunyelwa ngaphandle yaseMzantsi Afrika ithunyelwe kwamanye amazwe e-BRICS, kwaye ngaphezulu kwama-29% empahla engene kweli lizwe isuka kula mazwe.
",0.6156212
"Presidente Ramaphosa ta rhangela Afrika-Dzonga eka ku teka xiave eka Samiti ya Varhangeri ya vu14 ya vhichuwali ya BRICS leyi rhurheriweke hi People’s Republic of China ku sukela hi Ravumune, 23 ku fikela Ravuntlhanu, 24 Khotavuxika..     Vuxirho bya hina eka BRICS byi ya emahlweni byi vuyerisa tiko.
","Ixabiso lolu rhwebo liyaqhubeleka nokukhula, urhwebo loMzantsi Afrika lulonke namanye amazwe e-BRICS lufikelele kwiibhiliyoni zeerandi ezingama-R702 ngowama-2021, lusuka kwiibhiliyoni zeerandi ezingama- R487 zonyaka wama-.
",0.74643666
"Lembe leri nga hundza ku tlula 17% wa leswi Afrika-Dzonga ri swi xaviselaka matikomambe swi kongomisiwile eka matiko laman’wana ya BRICS, kutani ku tlula 29% wa ntsengo wa hina hinkwawo wa swixaviseriwa matikomambe swi huma eka matiko lawa.
","Ukusebenzisana phakathi kwamalungu e-BRICS kwiinkalo ezahlukeneyo ezifana nezempilo kunye norhwebo olwandisiweyo kukhulise ishishini lethu lasekhaya, kwaye kwanceda onke amalungu e-BRICS.
",0.74355847
"Nkoka wa ku xaviselana loku wu kula wu ya emahlweni, wu ni ntsengo wa kwalomu ka R702 wa tibiliyoni wa ku xaviselana ka Afrika-Dzonga ni matiko laman’wana ma BRICS hi 2021, ku yile ehenhla ku sukela eka R487 wa tibiliyoni hi.
","Utyalo-mali lwethu kwiiprojekthi zophuhliso lweziseko ezingundoqo kunye neenzame zokunciphisa imiqathango esetyenziswayo xa sisenza ushishino lujolise ekwandiseni ukuthunyelwa kwempahla kumazwe angaphandle angamahlakani ethu e-BRICS.
",0.7382121
".
","ISikolo esiqhutywa ngexesha laseBusika soLawulo loQoqosho.
",0.39449367
"Vuxaka exikarhi ka swirho swa BRICS eka tindhawu to hambana tanihi swa rihanyo ni ku xaviselana loku antswisiweke ku kurisile mabindzu ya laha kaya, ni ku vuyerisa swirho hinkwaswo swa BRICS.
","ISikolo sikaRhulumente seSizwe (i-NSG) siza kubamba iNkqubo yaso yesithathu yaseBusika yoLawulo lwezoQoqosho yaBaphathi bezoPolitiko eRhawutini ukusuka ngomhla wama-27 kweyeSilimela ukuya kowoku-1 kweyeKhala kulo nyaka wama-.
",0.6970422
"Vuvekisi bya hina eka tiprojeke ta nhluvukiso wa swimakiwa ni matshalatshala yo hunguta ku tikisiwa ka milawu loko ku endliwa mabindzu ku kongomise ku kurisa ka swixaviseriwamatikomambe ku ya vatirhisanikulobye va hina va BRICS.
","Iza kube izinyaswe ngabaPhathiswa abavela e-Côte d'Ivoire; i-South Sudan noMzantsi Afrika; kunye nabaLawuli-Jikelele abavela e-Lesotho, e-Zambia, e-Democratic Republic of Congo, e-Tanzania nase-Ghana.
",0.66801363
"Xikolo xa Vuxika xo Lawula Ikhonomi.
","Oosodolophu boMzantsi Afrika, kwakunye namalungu eekomiti zosodolophu namabhunga alawulayo, nabo baza kuba yinxalenye yesi sikolo..     Abaphathi bezopolitiko abavela kumazwe ahlukeneyo kulindeleke ukuba babelane ngezimvo kunye nezifundo kwiimeko ezahlukeneyo abazifumanayo kwimisebenzi yabo yemihla ngemihla.
",0.47228807
"Xikolo xa Rixaka xa Mfumo (NSG) xi ta rhurhela Phurogireme ya xona ya vunharhu ya Xikolo xa Vuxika xo Lawula Ikhonomi xa swirhonkulu swa tipolitiki eJohannesburg kusuka hi ti27 Khotavuxika kufika ti1 Mawuwani.
","I-NSG iyile inkqubo yonyaka yamalungu esigqeba ngo-2020, njengenxalenye yenkxaso yayo ekuzinikeleni  kukarhulumente ekwakheni urhulumente okwaziyo ukusebenza.
",0.73913324
"Xi ta ngheniwa hi Vaholobye vo huma eCôte d'Ivoire; South Sudan na Afrika-Dzonga; na Mufambisinkulu wo huma eLesotho, Zambia, Democratic Republic of Congo, Tanzania na Ghana.
","Phakathi kwezinye izinto, ijonge ukuxhobisa abalawuli abakumanqanaba amathathu karhulumente ngobunkokeli nobuchule bokubeka iliso ukuze bakwazi ukuphonononga  imingeni yolawulo ethintela ubandakanyo kunye nohlumo kwezoqoqosho oluzinzileyo.
",0.6823415
"Vameyara va Afrika-Dzonga, ku katsa ni swirho swa tikomiti ta swirho swa vakhanselara, na vona va ta nghenela.
","USuku luka-Nelson Mandela lweHlabathi.
",0.60132533
"Swirhonkulu swa tipolitiki kusuka eka matiko yo hambanahambana va languteriwa ku avelana miehleketo ni tidyondzo kusuka eka swiyimo swo hambanahambana leswi va hlanganaka na swona eka mitirho ya vona ya siku na siku.
","Kulo unyaka uSuku luka-Nelson Mandela lweHlabathi  oluzakube lungoMvulo, umhla we-18 kweyeKhala ngowama-2022 luza kubhiyozelwa phantsi komxholo wehlabathi jikelele othi: “Yenza onako, ukwenza ngoko onako, naphi na apho ukhoyo”.
",0.6242746
"NSG yi kunguhate phurogireme ya lembe ya swirho swa swirhonkulu hi 2020, tanihi xiphemu xa nseketelo wa yona eka ku tiboha ka mfumo ku aka tiko leri nga ni vuswikoti.
","Likhwelo elicacileyo lokuba abantu baxhase kwaye bathathe inxaxheba kwiphulo ngokufaka igalelo kungenelelo oluzinzileyo olunefuthe elizakuhlala lihleli.
",0.7071854
"Yi lava, exikarhi ka swin’wana, ku letela swirhonkulu exikarhi ka swiphemu swa mfumo swinharhu leswi nga ni vurhangeri lebyi nga antswisiwa ni vuswikoti bya vunhlori ku kota ku kambela nakambe mitlhontlo yo lawula leyi tshikelelaka nhlanganelo wa ku kula ka ntiyiselo wa ikhonomi.
","Olunye ungenelelo oluzinzileyo yiNkqubo yaminyaka le yeNgxoxo yoLutsha kunye neNkqubo yobuNkokheli bokuziphatha egxile kwimiba engumxholo ephathelene nolutsha eMzantsi Afrika nakwihlabathi liphela.
",0.7687175
"Siku ra Misava hinkwayo ra Nelson Mandela.
","Ixesha leRhafu.
",0.5549076
"Lembe leri Siku ra Misava hinkwayo ra Nelson Mandela ri hi Musumbhunuku, 18 Mawuwani 2022 ri ta tlangeriwa ehansi ka nkongomelo wa misava hinkwayo wa: “Endla leswi swi kotaka, hi leswi nga na swona, kwihi ni kwihi laha nga kona” xikombelo xa matimba eka vanhu hinkwavo ku seketela ni ku teka xiave eka mpfhumba hi ku hoxa xandla hi ku tinghenelerisa loku nga ni ntiyiselo lowu nga ni mbuyelo wa nkarhi woleha.
","Ixesha lokufakwa kwerhafu yama-2022 liya kuvulwa ukususela ngomhla woku-1 kweyeKhala ukuya kowama-24 kweyeDwarha.
",0.6701561
"Kun’wana ka ku tinghenelerisa ka ntiyiselo wa nkarhi woleha Njhekanjhekisano wa Vantshwa wa Nelson Mandela wa lembe na Phurogireme ya Vululami ya Vurhangeri hi ku kongomisa eka timhaka ta nkarhi wa sweswi mayelano ni vantshwa eAfrika-Dzonga ni ka misava hinkwayo.
","Abahlawuli berhafu bayakhuthazwa ukuba bafake imbuyekezo yabo yerhafu apha ku-eFiling (www.sarsefiling.co.za) okanye  kwi-MobiApp yeNkonzo yeRhafu yoMzantsi Afrika (i-SARS).
",0.69407225
"Nguva ya Xibalo.
","Kulo nyaka i-SARS iza kuqhubeka nenkqubo yovavanyo oluzenzekelayo lomrhafi ngamnye, olu vavanyo luyimbuyekezo yengeniso esele ibekwe ngaphambili  oku kwenzelwa ukunceda ukwenza lula inkqubo yokungeniswa.
",0.38529256
"Nguva ya ntsariso wa xibalo ya 2022 yi ta pfula kusukela hi ti1 Mawuwani kufika ti24 ta Nhlangula.
","Ngowama-2021 babangaphezulu kwezigidi ezithathu abahlawuli berhafu abathi bavavanywa  ngale nkqubo yokuzenzekela.
",0.7617295
"Vabari va hlohloteriwa ku tsarisa  mivuyelo ya vona eka eFiling (www.sarsefiling.co.za) kumbe eka MobiApp ya Vukorhokeri bya Xibalo bya Afrika-Dzonga.
","Ukungeniswa kwangethuba nangokuchanekileyo kweengxelo zerhafu akuqinisekisi nje kuphela ukuba abahlawuli berhafu bahlala bethobela umthetho, kodwa kukwanceda urhulumente ukuba akwazi ukunikezele ngeenkonzo kubemi boMzantsi Afrika abazidinga kakhulu     Imiyalezo.
",0.6673674
"Lembe leri SARS yi ta ya emahlweni ni ku tirhisa xiendla hi xoxe ku kambela vabari hi un’weun’we, leswi ku nga ku tlherisiwa ka mbuyelo wa xibalu xa muholo ku pfuna ku olovisa ndlela ya maheleketelo.
","UkuvuyisanaIkhabhinethi igqithisa amazwi okuvuyisana kunye neminqweno emihle: KwiJaji u-Owen Lloyd Rogers emva kokuchongwa kwakhe njenge Jaji leNkundla  yaseMzantsi Afrika yoMthethosisekelo.
",0.71661
"Hi 2021 ku tlula kwalomu ka mamiliyoni manharhu ya vabari va kamberiwile hi ku tirhisa xiendla hi xoxe.
","Ikhabhinethi idibane noMongameli ivuyisana nalowo wayesakuba ngumongameli u- Thabo Mbeki imnqwenelela imini yokubhiyozela ukuzalwa kwakhe, ebhiyozela iminyaka engama-80 esatya amazimba ngomhla wama-18 kweyeSilimela.
",0.65408355
"Nkarhi wa kahle naswona lowu faneleke wa manyikelo ya mivuyelo ya xibalo swi tiyisisi ntsena leswaku vabari va tshama va tshembekile, kambe swi tlhela swi pfuna mfumo ku yisa vukorhokeri eka MaAfrika-Dzonga lava byi dingaka swinene     Mahungu.
","U-Mnu Thabo Mbeki wabeka abemi beli loMzantsi Afrika kwikamva eliqaqambileyo nelinempumelelo     Izithuba zengqesho Zonke izikhundla zixhomekeke ekuqinisekisweni kwamabakala ezemfundo kunye nokuqinisekiswa okufanelekileyo kwezokhuselo.
",0.77644897
"Ku hoyozelaKhabinete yi hundzisa mahungu ya yona mo hoyozela ni ku navelela mikateko eka:Muavanyisi Owen Lloyd Rogers hi ku landza ku thoriwa ka yena ku nga ri khale tanihi Muavanyisi wa Khoto ya Vumbiwa ya Afrika-Dzonga.
","Abalawuli abangengabo abesigqeba seBhodi yoGunyaziwe woPhapho loLuntu loMzantsi Afrika     UMnu Ernest Khosa     Nksz Bulelwa Koyana     Mnu Surendra Sooklal; kunyed.
",0.76196265
"Khabinete yi tikatse ni Presidente Ramaphosa eka ku navelela khale ka Presidente Thabo Mbeki siku ro Tlangela lembe ra vu80 ra ku velekeiwa, leri ri tlangeleke hi siku ra 18 Khotavuxika.
","Nksz Rejoice Edith Phewa.
",0.647203
"Tat Mbeki kongomise ku hoyozela ni ku humelela ka vumundzuku bya MaAfrika-Dzonga hinkwavo     Ku tholaMatholelo hinkwawo ma fanele ma kambisisa tidyondzo ni ku basisiwa eka manyala.
","Amalungu e-Ofisi yokuBhengeza iMali-mboleko yeKhaya     Nksz.
",0.5946507
"Swirhotsongo swa Huvo ya Vulawuri bya Vuhahisi bya Rixaka bya Afrika-Dzonga     Tat Ernest Khosa     Mnn Bulelwa Koyana     Tat Surendra Sooklal; nad.
","Kenosi Pearl Louisa Selane (Usihlalo)     Nksz.
",0.7435696
"Mnn Rejoice Edith Phewa.
","Catharina Maria Van der Sandt     UMnu.Errol Vincent Magerman     Igqwetha Mandla Dludlu     UMnu.
",0.74503636
"Swirho swa Hofisi ya Mpaluxo wa Vulombisi bya swa Tindlu na Mpaluxo wa Swikweleti     Mnn Kenosi Pearl Louisa Selane (Mutshamaxitulu)     Mnn Catharina Maria Van der Sandt     Tat Errol Vincent Magerman     Adv Mandla Dludlu     Tat Matsobane Gabriel Mello     Mnn Palesa Mawasha     Mnn Penelope Anne Beck-Paxton     Mnn Sphiwe Dorris Mayinga     Mnn Tshifhiwa Victor Mphigalale; naj.
","Matsobane Gabriel Mello     Nksz.
",0.66944814
"Mahungu mantshwa hi Vuvabyi bya Khoronavhayirasi (COVID-19).
","Ezintsha malunga neSifo seNtsholongwane ye-Corona (i-COVID-19).
",0.95694065
"Khabinete yi bumabumele vanhu hinkwavo va Afrika-Dzonga lava hlawuleke ku sawutisiwa ni ku landzelela milawu ya COVID-19 leswi endleke leswaku tiko ri sivela ku tlakuka ka nhlayo ya timhangu tintshwa hi nkarhi wa gandlati ra vuntlhanu ra ntungu.
","IKhabhinethi iyababulela bonke abantu eMzantsi Afrika abathe bakhetha ukuzigonya nokuthobela imiqathango ye-COVID-19 into leyo ebangele ukuba eli lizwe likwazi ukunqanda ukunyuka kwamanani abantu abasolulelwa okokuqala yi-COVID-19 ngethuba lomsinga wesihlanu walo bhubhane.
",0.9521682
