src_text,tgt_text,cosine_score
"Beke ya go Keteka Tshireletso ya Bana Naga ya Aforika Borwa e tla keteka Beke ya Tshireletso ya Bana go tloga ka la bo 28 Motsheganong 2023 ka molaetsamogolo yo o reng: “Tla re Sireletseng Bana mo Pakeng ya COVID-19 le go ya go ile”.
","Madalo a Vhulavhelesi ha DDM ngei Kapa Vhubvaḓuvha.1 Muthusaphresidennde Vho, Mr Paul Mashatile vha ḓo fara Madalo a Vhulavhelesi ha DDM ngei Kapa Vhubvaḓuvha nga ḽa 26 na 27 Shundunthule 2023 kha Tshiṱiriki tsha OR Tambo na Buffalo City Metro, ngei Kapa Vhubvaḓuvha.2 Madalo aya ndi tshipiḓa tsha maga a muvhuso a u vhona uri hu khou vha na u bveledzwa ha zwitshavha nga nḓila ine ya ṱuṱuwedzwa nga maitele a DDPhalamennde ya vhurathi ya Pan-African Parliament (PAP)4.1 Vharangaphanḓa u bva kha dzhango ḽoṱhe ḽa Afrika vho ṱangana u bva nga Musumbuluwo, wa ḽa 15 Shundunthule 2023 ngei Midrand, Afrika Tshipembe, kha muṱangano wa Vhurathi wa Phalamennde ya PADzulo iḽi ḽi ḓo khunyeledzwa nga ḽa 02 Fulwi 20 2 PAP i khou lingedza u tandulula khaedu dzi fanaho kha dzhango ḽa Afrika nahone yo imelwa nga vharangaphanḓa vha Afrika u bva kha dzhango ḽoṱhe nga u angaredza.
",0.5711806
"Letsholo leno le dira gore makala otlhe le ditšhaba tsotlhe di tshwaraganele kgodiso, tlhokomelo le tshireletso ya bana.
","Khomishini ya Vhukati ha Mivhuso ya nga ha zwa Lwanzheni (IOC)5.1 Shango ḽa Afrika Tshipembe ḽi ḓo shela mulenzhe kha dzulo ḽa vhu56 ḽa khorotshitumbe ḽine ḽa ḓo farelwa fhaḽa ḓoroboni ya Paris, kha ḽa France u bva ḽa 16 u swika ḽa 30 Fulwi 20 2 IOC ya Dzangano ḽa zwa Pfunzo, Saintsi na Mvelele ḽa UN (IOC-UNESCO), ndi tshiimiswa tsha UN tshine tsha vha na vhuḓifhinduleli ha u tikedza saintsi na tshumelo dza lwanzheni dza ḽifhasi.3 Shango ḽa Afrika Tshipembe ḽi khou dzhiela nṱha ndeme ya ṱhoḓisiso na ndangulo ya maḓanzhe aḽo khathihi na vhupo ha khunzikhunzini hu tshi itelwa mveledziso ya tshifhinga tshilapfu.
",0.47864154
"La monongwaga letsholo le tla nna le seabe mo go RISIHA, seno ke letsholo la mo motseng la go thibela le go sekaseka maemo a a sa itumediseng a bana, mme maitlhomo a lona ke go ntsha bana mo tlalelong go ba dira gore ba nne pelokgale.
","Ṱhoḓisiso dza zwa lwanzheni dzi thusa kha u ṋetshedza ngafhadzo nga tshifhinga dza nga ha malugana na zwizwo zwa lwanzheni u itela u thusa mivhuso uri i kone u dzhia tsheo dzo teaho..Shango ḽa Afrika Tshipembe ḽi khou fara mitambo mihulwane ya vhugweṋa.1 Vhafuni vha mitambo u mona na ḽifhasi ḽoṱhe vha nga lavhelela u ṱanganedzwa nga muya wa Ubuntu khathihi na u farwa nga nḓila ya maimo a nṱha musi vha tshi dzhenela mitambo ya Tshiphuga tsha Ḽifhasi tsha Netibolo khathihi na Vhugwena ha Ḽifhasi ha Karati ya Kimura Shukokai International (KSI) fhano kha ḽa Afrika Tshipembe.
",0.5679985
"Leeto la go Lekola Maemo a go Tsenya Tirisong DDM mo Porofenseng ya Kapa Botlhaba.1 Motlatsamoporesitente, Rre Paul Mashatile e tla re ka la bo 26 le la bo 27 Motsheganong 2023 o tla tsaya leeto la go lekola maemo kwa Tikologong ya OR Tambo le kwa Teropokgolong ya Buffalo City kwa porofenseng ya Kapa Botlhaba.2 Leeto leno ke karolo ya letsholo la puso la go dira bonnete jwa gore tlhabololo mo baagi ba nnang e diragala ka tolamo ka go latela thulaganyo ya DDPalamente ya Borataro ya Setheo sa Palamente ya Kutlwano ya Dipolotiki tsa MaAforika (PAP)4.1 Baeteledipele go tswa kwa dikhutlong nne tsa kontinente ba kopane ka Mosupologo wa la bo 15 Motsheganong 2023 kwa Midrand, mo nageng ya Aforika Borwa go bula Palamente ya Borataro ya PAKopano eno e tla garelwa ka la bo 02 Seetebosigo 20 2 Maitlhomo a PAP ke go samagana le dikgwetlho tse di tlwaelegileng mo kontinenteng ka bophara mme ka jalo e na le baemedi ba maAforika go tswa kwa dikhutlong nne tsa kontinente.
","Shango ḽa Afrika Tshipembe ḽi na rekhodo yavhuḓi ya u kona u fara vhuṱambo vhuhulwane ha ḽifhasi nga nḓila yavhuḓi.2 U nyanyuwa hu khou engedzea musi ho tou sala fhedzi maḓuvha a furathi (60) phanḓa ha musi mitambo ya Tshiphuga tsha Netibolo ya Ḽifhasi i tshi thoma fhaḽa Ḓoroboni ya Kapa u bva nga ḽa 28 Fulwana u swika ḽa 6 Ṱhangule 2023.
",0.74912477
"Khomišene ya Ditheo tsa Puso mo Mererong ya Dithuto tsa Mawatle (IOC)5.1 Naga ya Aforika Borwa e tla tsaya karolo mo kopanong ya bo 56 ya lekgotlakhuduthamaga e e tla tshwarelwang kwa Paris, kwa nageng ya France go tloga ka la bo 16 go fitlha ka la bo 30 Seetebosigo 20 2 Khomišene ya Ditheo tsa Puso mo Mererong ya Dithuto tsa Mawatle e e leng karolo ya Mokgatlho wa Thuto, Saense le Setso mo Dinagakopanong (IOC-UNESCO) ke karolo ya UN e e rwelelng maikarabelo a go ema nokeng merero ya lefatshe ka bophara ya saense le ditirelo mo mawatleng.3 Naga ya Aforika Borwa e tlhaloganya sentle botlhokwa jwa dipatlisiso mo tlhokomelong ya mawatle a yona le mabopo a yona fa go tla mo tshomarelong ya ona.
","Hezwi zwi ḓo vha lwa u tou thoma musi mitambo ya maimo a nṱha ngaurali i tshi farelwa fhano kha mavu a dzhango ḽa Afrika,6.3 Khabinethe i khou ita khuwelelo kha muthu muṅwe na muṅwe ya uri a tikedze fulo ḽa Netball Fridays, nga u ambara zwikhipha zwa vhatikedzi kana u ambara zwikhipha zwa mivhala ya thimu ya lushaka u itela u tikedza thimu ya Netibolo ya Lushaka ya Afrika Tshipembe.4 KSI Afrika Tshipembe na yone i khou ḓo fara mitambo ya vhu20 ya KSI ya Vhugwena ha Karati ha Ḽifhasi ngei Ḓoroboni ya Kapa u bva nga ḽa 10 u swika ḽa 15 Fulwana 2023, nahone ri khou tamela mashudu Team SA musi vha tshi khou ḓilugisela vhuṱambo uvhu ha mitambo iyi ya ḽifhasi ya maimo a nṱha ngaurali.5 Shango ḽa Afrika Tshipembe ḽi khou ḓihudza nga u fara mitambo ya Makhaulatshele a Vhugweṋa ha mitambo ya Table Tennis ya ṅwaha wa 2023 ine ya ḓo farelwa fhaḽa Sentharani ya zwa Miṱangano ya Dzitshaka ya Durban.
",0.72509027
"Dipatlisiso tsa mawatle gape di thusa ka go abelana ka matshwao a dikotsi go sa le gale fa go tla mo matlhotlhapelong a a fuduwang ke mawatle mme seno se thusa puso go tsaya dikgato tse di lolameng ka ntlha ya kitso eo.
","Vhatambi vha swikaho 600 u bva kha mashango o fhambanaho ndi vhane zwazwino vha kati nahone mitambo iyi i ṋetshedza vhatambi vhashu tshikhala tsha u sumbedza vhukoni havho.
",0.5512868
"Naga ya Aforika Borwa e tla Tshwara Metshameko e Megolo ya Dikgaisano tsa Bomampodi.1 Barati ba metshameko go tswa kwa dikhutlong nne tsa lefatshe ba ka solofela go amogelwa ka diatla tsoopedi tse di mofutho tse di nang le Botho mmogo le borobasogo jwa maemo a a kwa godimo fa ba tlile ka fa nageng ya Aforika Borwa go bona Motshameko wa Sejana sa Lefatshe sa Bolotloa mmogo le wa Dikgaisano tsa Bomampodi tsa Lefatshe wa Karathi wa Kimura Shukokai International (KSI) jaaka naga e setse e ipontshitse gore e na le bokgoni jwa go tshwara ka katlego metshameko e megolo.2 Boitumelo bo tswelela go oketsega jaaka go setse matsatsinyana fela a a fetang a le 60 gore Motshameko wa Sejana sa Lefatshe sa Bolotloa o o tla tshamekelwang kwa Motsekapa go tloga ka la bo 28 Phukwi go fitlha ka la bo 6 Phatwe 2023.
","Mitambo iyi yo thoma nga ḽa 20 Shundunthule 2023 nahone i ḓo bvela phanḓa u vhuya u swikela nga ḽa 28 Shundunthule 2023.Milaedza.
",0.75187576
"Leno ke lekgetlo la ntlha dikgaisano tseno di tshwarelwa mo nageng ya Aforika.3 Kabinete e ikuela mo go batho botlhe go ema nokeng Letsholo la Netball Friday ka go apara diaparo tsa mebala e e emang nokeng ditlhopha tse di tla tshamekang kgotsa ka go apara mebala ya setlhopha sa naga go ema nokeng Setlhopha sa Naga ya Aforika Borwa sa Metshameko ya Bolotloa.4 KSI ya Naga ya Aforika Borwa le yona e tla bo e tshwaretse Dikgaisano tsa Bomampodi ba Lefatshe kwa Motsekapa go tloga ka la bo 10 go fitlha ka la bo 15 Phukwi 2023, mme re eletsa Setlhopha sa Aforika Borwa masego jaaka se ipaakanyetsa dikgaisano tseno tse di botlhokwa tsa lefatshe.5 Naga ya Aforika Borwa e motlotlo go tshwarela Metshameko ya Makgaolakgang a Tenese e e Tshamekelwang mo Tafoleng ya Ngwaga wa 2023 kwa Durban International Convention Centre.
","U fhululedzaKhabinethe yo rumela milaedza yayo ya u fhululedza na u tamela mashudu kha: Minisṱa wa Gwama, Vho Enoch Godongwana, vhe vha ṋewa pfufho ya maimo a nṱha ya African Banker 2023, Pfufho ya u vha Minisṱa wa Gwama wa Ṅwaha ngei Sharm El Sheikh, kha ḽa Egypt nga Ḽavhuraru, ḽa 24 Shundunthule 2023 kha ndingedzo dzavho kha tshifhinga tsha miṅwaha mivhili yo fhelaho dza u langa ikonomi ya shango ḽa Afrika Tshipembe kha nyimele i konḓaho ya ḽifhasi na ya ngomu hayani.
",0.80520487
"Ga jaana go na le batho ba le 600 ba ba tswang kwa dinageng ka go farologana mo lefatsheng ba ba tshamekang mo dikgaisanong tseno mme seno se naya batshameki ba naga ya rona tšhono ya go tlhagisa bokgoni jwa bona.
","Pfufho iyi i dzhiele nṱha nḓila ye Minisṱa vha shumisa ngayo mbekanyamaitele ya zwa masheleni u itela u enegedza vhubindudzi kha sekhithara ya fulufulu ḽi vusuluseaho.
",0.6310736
"Metshameko eno e simolotse ka la bo 20 Motsheganong mme e tla garela ka la bo 28 Motsheganong 2023.Melaetsa.
","Hana Gammon, muṅwali wa ḽa Afrika Tshipembe wa miṅwaha ya 20 nge a wina Pfufho ya Nganeapfufhi ya Mashango a Muṱanganelano ya ṅwaha wa 2023, kha dzingu ḽa Afrika khathihi na u vha ene muthu muṱukusa u wina kha ḓivhazwakale ya pfufho iyi.
",0.562491
"Melaetsa ya go AkgolaKabinete e romela melaetsa ya yona ya go akgola le go eletsa masego kwa go: Tona ya Matlole, Rre Enoch Godongwana, yo a neetsweng Kabo ya Tlotlo ya Batlhankedi ba Dibanka tsa Aforika ya Ngwaga wa 2023 ya go Nna Tona ya Matlole e e Dirileng Tiro e e Tswileng Diatla mo Ngwageng e a e amogetseng kwa Sharm El Sheikh, kwa nageng ya Egepeta ka Laboraro wa la bo 24 Motsheganong 2023 e leng kabo e e akgolang matsapa a gagwe ao a a dirileng mo dingwageng di le pedi tse di fetileng mo go laoleng ikonomi ya naga ya Aforika Borwa mo maemo a ikonomi mo lefatsheng le ka fa nageng a neng a le matswakabele.
","Thimu ya mutambo wa Ragibii ya The Stormers nge ya kona u swikela makhaulatshele a miṱaṱisano ya United Rugby Championship.
",0.73263466
"Kabo eno e lebelela gape le ka fao Tona a dirisitseng pholisi ya taolo ya matlole go oketsa palo ya dipeeletso mo lephateng la motlakase wa go fetlhiwa ka ditsela tse dintšhwa.
","Thimu iyi ya The Stormers i ḓo vha i tshi khou tamba na thimu ya The Irish Musters fhaḽa Ḓoroboni ya Kapa nga Mugivhela, wa ḽa 27 Shundunthule 2023.
",0.6102289
"Hana Gammon, mokwadi wa moAforika Borwa yo a nang le dingwaga di le 20 jaaka a fentse Dikgaisano tsa Dinaga tsa Seoposengwe fa go tla mo Dikabong tsa go kwala Dikgang tse Dikhutshwane mo kgaolong ya Aforika mme e bile ke ene yo monnye go gaisa fa e sale yo a kileng a fenya kabo eno.
","Vho Zakes Mda, muṅwali wa nganea wa shango ḽa Afrika Tshipembe na Phrof Vho Tshilidzi Marwala, Ṱhoho na Muthusa Tshantseḽara wa kale wa Yunivesithi ya Johannesburg, vhe vhuvhili havho vha nangwa kha Pfufho dza African Genius dza ṅwaha wa 2023.
",0.67976415
"Setlhopha sa Motshameko wa Rakabi sa The Stormers jaaka se fitlheletse makgaolakgang a Dikgaisano tsa Bomapodi ba Metshameko ya Rakabi.
","Vho Mda na Phrof Vho Marwala vho nangwa vhukati ha maṅwe mazhakanḓila a dzhango ḽa Afrika a swikaho 19 vhe vha shuma zwavhuḓi vhukuma kha masia o fhambanaho.
",0.5650373
"The Stormers ba tla thulana le setlhopha sa The Irish Musters kwa Lebaleng la Metshameko la kwa Motsekapa ka Lamatlhatso wa la bo 27 Motsheganong 2023.
","Ndiliso Khabinethe yo ṱahisa maipfi ayo a ndiliso kha vha miṱa na dzikhonani dza: Muambasada wa ḽa Afrika Tshipembe kha shango ḽa Riphabuḽiki ya Algeria, Vho Billy Masetlha, vhe vha shumela shango ḽa Afrika Tshipemebe kha vhuimo ho fhambanaho kha muvhuso, hu tshi katelwa na u vha Mulangi Muhulwane wa tshumelo dza zwa vhusevhi.
",0.55711913
"RreZakes Mda, mokwadi wa dibuka tsa dipadi wa moAforika Borwa mmogo le Moporofesara Tshilidzi Marwala, yo e kileng ya nna Motlatsatlhogo le Tlhogo ya Yunibesiti ya Johannesburg, bobedi maina a bona a okotswe go ka abelwa Kabo ya Ngwaga wa 2023 ya Botlhogoputswa ba Kontinente ya Aforika.
","Vho vha vho ḓidzhenisa tshoṱhe kha nndwa ya mbofholowo ya shango ḽa Afrika Tshipembe, hu tshi katelwa na u vha muraḓo wa mmbi ya Umkhonto we Sizwe.
",0.6862942
"Rre Mda le Moporofesara Marwala maina a bona a okotswe mmogo le a maAforika a mangwe a le 19 a le ona ditiro tsa bona di tswileng diatla ao a dirileng bontle mo maphateng a a farologaneng.
","Vho Murthi Naidoo, vhe vha kumedzela vhutshilo havho kha zwa nndwa ya u lwela mbofholowo.
",0.57435226
"Melaetsa ya Matshediso Kabinete e romela matshediso a yone le kutlwelobotlhoko kwa go ba lelapa le ditsala tsa: Moambasatara wa naga ya Aforika Borwa yo a neng a dira kwa nageng ya Algeria, Rre Billy Masetlha, yo a diretseng naga eno mo ditirong tse di farologaneng mo pusong, go tsenyeletsa le go nna Mokaedikakaretso wa Setheo sa Ditirelo tsa Twantsho ya Bosenyi.
","Vho swika he vha farwa nga mapholisa a zwa vhutsireledzi u bva nga ṅwedzi wa Lara 1965 u swika Lambamai 1966 hu songo vha na mulandu we vha hweswa wone nahone vho shela mulenzhe zwihulwane vhukuma nga tshifhinga tsha musi tshiimo tsha shishi tshi kati henengei kha miṅwaha ya 1980.Vho Barry Dwolatzky, vhe vha vha vhe ḽizhakanḓila kha sekhithara ya thekhinoḽodzi ya zwa vhudavhidzani na mafhungo ya ḽino shango.
",0.59183073
"O ne a dira go tlala seatla mo Kgaratlhelong ya Kgololesego mo nageng ya Aforika Borwa, mme o kile gape ya nna tokololo ya Umkhonto we Sizwe.
","Vho vha vhe Phrofesa (Emeritus) kha Muhasho wa Vhuinzhiniere ha zwa Mafhungo na Muḓagasi kha Fakhaḽithi ya Vhuinzhiniere na Zwifhaṱo fhaḽa kha Yunivesithi ya Wits.
",0.59645003
"Murthi Naidoo, yo a dirileng ka boineelo go lwela kgololesego ya naga eno.
","Vhathu vha 15 vhe vha lovha nga mulandu wa tshiwo tsha dwadze ḽa khoḽera fhaḽa Hammanskraal kha vhupo ha Ḓorobo khulwane ya Tshwane.
",0.57956684
"Taolo ya go Runya ga Bolwetse jwa Kholera Kabinete e neseditse pula boitahaopo jwa ga Moporesitente Cyril Ramaphosa jwa go leba kwa Hammanskraal go jela baagi bao nala le go buisana le bona.
","Cholera outbreak Management
",0.5287937
"O tlhotse a jetse motse oo nala gompieno, Labone wa la bo 08 Seetebosigo 2023, mme leeto leno le neile Moporesitente tšhono ya go ikutlwela ka boene selelo sa baagi ka ga dikgwetlho tse ba lebaganeng le tsona.
","Cabinet welcomed President Cyril Ramaphosa’s planned visit to and interaction with residents of Hammanskraal.
",0.65397745
"Moporesitente, Tona ya Lefapha la Metsi le Kgeleloleswe mmogo le Meyara yo Mogolo wa Tshwane ba kgonne go iponela ka matlho a bona seo puso e se dirang mo kgaolong eo mmogo le go neela baagi dikarabo tse di maleba.
","The visit did take place today, Thursday, 08 June, 2023, and this engagement gave the President the opportunity to hear directly from residents about the challenges they face.
",0.6759089
"Ditharabololo tsa puso di tsenyeletsa le tsa go romela maokelo a dijanaga kwa mabaleng a motse wa Kanana, Hammanskraal, mmogo le go romela baitseanape ba maphata a a farologaneng go thusa go thibela go anama ga bolwetse jono mme batho ba le makgolokgolo ba alafilwe ka katlego.
","The President, the Minister of Water and Sanitation and the Executive Mayor of Tshwane were able to assess government interventions in the area and provide relevant feedback to residents.
",0.7458297
"Go samaganwe le tiro ya go dira bonnete jwa gore bakhanselara ba dikgaolo tseno ba dirisa ka tshwanelo madi a go samagana le mafaratlhatlha a metsi.
","Government interventions include the field hospital operational in Kanana, Hammanskraal, and a multi-disciplinary team of experts to arrest the spread which has successfully treated hundreds of people.
",0.65327823
"Mo ngwageng o re leng mo go ona ono, go beilwe kwa thoko madi a feta R14 bilione go thusa dimasepala go samagana le tshalelomorago e e leng teng mo mafaratlhatlheng a metsi.
","Work is also underway to ensure that local councils use their water infrastructure grants effectively.
",0.6538854
"Kabinete e itumedisitswe ke tirisanommogo e e nnileng teng magareng ga Teropokgolo ya Tshwane le Lefapha la Metsi le Kgeleloleswe mo go logeng maano a go samagana le kgodiso ya Bodutelo jwa go Tlhatswa Metsi jwa Rooiwal, mme tiro eno e tla diragadiwa ka dikgaolo di le tharo mme go tla tlhokagala madi a le kanaka R4 bilione.
","For the current financial year, over R14 billion has been set aside for municipalities to address water infrastructure backlogs.
",0.70371705
"Kabinete e ikuela mo metseng e e amegileng go itlhokomela le go tlhokomela segolobogolo bana.
","Cabinet welcomes the cooperation between the City of Tshwane and Department of Water and Sanitation on the planned upgrade of the Rooiwal Water Treatment plant, which will be undertaken over three phases at a cost of R4 billion.
",0.57680154
"Kholera e ka thibelwa ka go dirisa metsi a a tlhatswitsweng.
","Cabinet calls on the affected communities to remain vigilant and to take special care of children.
",0.5442609
"A tlhatswe ka go a bedisa sebaka sa motsotso o le mongwe mme o ka dirisa metsi a a phepa le sesepa go tlhapa diatla.
","Cholera can be prevented by using safe water.
",0.6236599
"Go bona tshedimosetso ka botlalo ka ga go thibela bolwetse jono etela webesaete ya WEBTOKEN Puso e rata go leboga mekgatlho yotlhe ya baithaopi mmogo le batho ba bangwe ba ba tsentshitseng letsogo ka go thusana le baagi bano..Pegelo e e ka ga Boleng jwa Metsi
","Treat the water first by boiling it for at least 1 minute and always wash your hands with clean water and soap.
",0.58578515
"Kabinete e amogetse Matsholo a go Thibela go Dutla le fa e le Lerothodi le le Lengwe la Metsi a go Nwewa le a Kgeleloleswe mme ona labofelo fa a ne a diragadiwa e ne e le ka ngwaga wa 2013 le wa 2015 ka go latelana ga ona.
","For more information on prevention tips WEBTOKEN Government thanks those volunteer organisations and individuals who have stepped forward to lend a hand.
",0.6324426
"Matsholo a ke a Lefapha la Metsi le Kgeleloleswe a go dira bonnete jwa gore melao ya metsi e a obamelwa jaaka lefapha leno e le maikarabelo a le a rweleng mo lekaleng la metsi go ya ka Molao wa Metsi a Naga le Molao wa Ditirelo tsa Metsi.
","Water Quality Report
",0.47198355
"Maitlhomo a sedirisiwa seno sa naga ya Aforika Borwa sa go dira bonnete jwa gore melao ya metsi e a obamelwa ke go tokafatsa boleng jwa metsi a a nwewang mo dimasepaleng, tlhokomelo ya metsi a kgeleloleswe mmogo le go tlhokomela seelo sa tlhoko ya ditirelo tseno.
","Cabinet welcomed the reintroduction of the Blue, Green and No Drop Watch which were last conducted in 2013 and 2015 respectively.
",0.6046705
"Kabinete e atlhaatlhile dipegelo tsa dipoelo tsa matsholo ano mo ngwageng wa 2023 mmogo le seabe se a tla nnang le sona, mme tsona di phasaladitswe ka la bo 6 Seetebosigo 2023.
","The Green, Blue and No Drop Certification programmes are regulatory mechanisms of the Department of Water and Sanitation (DWS) as the water sector regulator in terms of both the National Water Act and Water Services Act, DWS
",0.6062341
"Dipegelo tseno di bontsha gore go tloga ka motsi wa bofelo o dipegelo tseno di konoseditsweng ka ona boleng jwa metsi a a nwewang bo wetse kwa tlase mme metsi a a sa direng letseno mo lekgethong a oketsegile.
","The aim of this uniquely South African regulatory tool is to improve municipal drinking water quality, wastewater management as well as water conservation and demand management.
",0.713186
"Kabinete e itumedisitswe ke dikgato tse di tla tsewang ke Lefapha la Metsi le Kgeleloleswe mo go samaganeng le maemo a ga jaana fa go tla mo go tlhokomeleng metsi a a nwewang le a kgeleloleswe.
","Cabinet deliberated on the results and implications of the 2023, Blue, Green and No Drop Watch reports, which were made public on Tuesday, 6 June.
",0.618845
"Tona ya Lefapha la Metsi le Kgeleloleswe mo dibekeng di le mmalwa tse di tlang o tla itsise dikgato tseno tse porofense nngwe le nngwe e tla di tsayang..Motlakase
","The Watch Reports indicate that there has been a decline in drinking water quality and an increase in non-revenue water since the last Drop reports were issued.
",0.6135469
"Kabinete e itumedisitswe ke dipuisano tse di tshwerweng magareng ga Tona ya Merero ya Motlakase, Ngaka Kgosientsho Ramokgopa mmogo le Tona ya Metswedi ya Dimenerale le Motlakase ya naga ya Mozambique, Carlos Zacarias, tse di ka ga go reka motlakase kwa nageng ya Mozambique go oketsa o o leng teng ka fa nageng gore diyuniti tsa tlamelo ya motlakase di se goge boima.
","Cabinet welcomes measures to be taken by the Department of Water and Sanitation to address the current state of affairs in relation to water and waste water management.
",0.6897851
"Ka ono motsotso, naga ya Mozambique e ka kgona go re rekisetsa dimekawate di le 80 mme mo tsamaong ya nako e tla kgona go e oketsa ka dimekawate tse dingwe gape di le 1 000.
","The Minister of Water and Sanitation will in the following weeks announce these measures per Province.
",0.5394211
"Kabinete e tsweletse go ikuela mo go maAforika Borwa go ema nokeng letsholo la Tlhokomelo ya Seelo sa Tiriso ya Motlakase mo Marigeng le le thankgolotsweng ke Tona ya Merero ya Motlakase, gore re kgone go boloka motlakase le go dira gore diyuniti tsa tlamelo ya motlakase di se goge boima mmogo le go dira gore mo marigeng re kgone go fokotsa ditiragalo tsa motlakase o o tshabetseng ruri.
","Energy Cabinet welcomed the recent deliberations between the Minister of Electricity, Dr Kgosientsho Ramokgopa and the Mozambican Minister for Mineral Resources and Energy, Carlos Zacarias, to secure additional power from Mozambique to support our national grid.
",0.74797255
"Kabinete e amogetse pegelo ya Tona ya Merero ya Motlakase e e bontshang dilo tse dintšhwa tseo re di fitlheletseng mo go tlhokomeleng diteišene tsa motlakase le dikarolo tse dingwe tsa tirelo eno tse, go naya motlhala, di re thusitseng gore mo matsatsing a a senang go feta a bokhutlho jwa beke re se dirise leokwane la disele gore re nne le motlakase.
","In the immediate term, Mozambique can provide 80MW and a further 1000MW over the medium term.
",0.6271124
"Tona ya Merero ya Motlakase o tla tshwara kopano le bobegakgang kamoso Labotlhano ka ura ya bobedi motshegare go buisana le bona ka dikgang tseno le tse dingwe tse di diragalang.
","Cabinet continues to urge South Africans to support the Winter Demand Management campaign launched by the Minister of Electricity, to save electricity to reduce strain on the national grid and help lower load shedding stages this winter.
",0.587293
"Operation Vulindlela
","Cabinet received a report by the Minister of Electricity which detailed recent gains in the management of power stations and other operations which, for example, overcame the need for Eskom to burn diesel this past weekend and avoid load shedding.
",0.26507112
"Kabinete e amogetse kgatelopele e e dirilweng ka letsholo la operation Vulindlela jaaka e tlhalositswe ke Tona mo Kantorong ya Moporesitente, Khumbudzo Ntshavheni, mme yona e mabapi le go fetola sebopego sa maphata a tlamelo ya motlakase, mafaratlhatlha a go rwala dithoto, tlhaeletsano ka didirisiwa tsa thekenoloji mmogo le a ditirelo tsa di-visa.
","The Minister of Electricity will brief media at 14h00 tomorrow, Friday, on these and other developments.
",0.6022254
"Palo ya maphata a diphetogo tseno di setseng di konoseditswe mo go ona e oketsegile go tloga mo go a le mararo go ya mo go a le 11 mme mo go a mangwe gape a le 14 tiro eno e ntse e tsamaya sentle.
","Operation Vulindlela
",0.38199246
"Maitlhomomagolo ke go samagana le matsapa a motlakase mmogo le go tokafatsa tiro ya go rwala dithoto ka diterene, mme bobedi jono ke jona jo bo imetsang kgolo ya ikonomi ya naga ya rona..Lekgotla la Tsamaiso ya Merero ya Moporesitente (PCC)
","Cabinet welcomed the progress under the operation Vulindlela as detailed by the Minister in the Presidency, Khumbudzo Ntshavheni, with regard to the implementation of structural reforms in the areas of energy supply, logistics network and infrastructure, digital communications and the visa regime.
",0.6691508
"Kabinete e eme nokeng boikuelo jwa ga Moporesitente Cyril Ramaphosa jo a bo dirileng mo kopanong ya PCC ka la bo 02 Seetebosigo 2023 jwa gore kabo ya ditirelo e potlakisiwe gore ditlhokwa tsa baagi di tsibogelwe.
","The number of completed reforms has risen from three to 11, while a further 14 reforms are on track.
",0.5837165
"Moporesitente o laetse lekgotla leno go potlakisa ditiro tsa go tokafatsa kabo ya ditirelo mmogo le go samagana le dikgwetlho tse di leng teng tse di tsamaisanang le molao, tsamaiso le tlhaelo ya dithata le badiredi.
","The primary focus is on addressing the electricity crisis and improving the efficiency of freight rail, both of which are weighing heavily on economic growth.
",0.70231104
"Mo kopanong eno go tšhotlhilwe gape le diphetogo tsa Molao wa Metsi le tsa Molao wa Ditirelo tsa Metsi gore melao eno e kgone go tswela mosola merero ya metsi.
","President’s Coordinating Council
",0.43695676
"Lekgotla le ne la itsisiwe gape le ka ditharabololo tse di dirilweng ke Lefapha la Dipalangwa fa go tla mo ditirelong tsa tshoganyetso mmogo le tsa go baakanya le go tlhokomela mafaratlhatlha mmogo le tiro e kgolo ya go ntsha mo diatleng tsa puso ya porofense maikarabelo a go laola ditsela gore a rwalwe ke ditheo tsa naga gore ditsela tsa diporofense di kgonwe go tlhokomelwa sentle ke Setheo sa Puso ya Aforika Borwa sa Kago ya Ditsela mo Nageng (Sanral)..Lefelo la Tlamelo ka Diphatse tsa Dijanaga la Batyi (BACS)
","Cabinet supported President Cyril Ramaphosa’s call during the meeting of the President’s Coordinating Council on 2 June 2023 to accelerate service delivery in response to the needs of communities.
",0.673824
