src_text,tgt_text,cosine_score
"Kgwedi ya go Keteka Aforika
","Ndivho khulwane ya AU ho vha u bveledza mulalo na vhudziki kha dzhango..Vhugwena ha Ḽifhasi ha Mutambo wa Tennis i tambelwaho kha Ṱafula
",0.27771872
"Ka kgwedi ya Motsheganong naga ya Aforika Borwa e tla keteka Kgwedi ya go Keteka Aforika, e leng kgwedi e go tlotlomadiwang tshimololo ya Mokgatlho o o Tshwaraganeng wa Aforika (OAU) mo ngwageng wa 1963, o gompieno o bediwang Mokgatlhotshwaraganelo wa Aforika (AU).
","Makhaulatshele a Vhugweṋa ha Ḽifhasi ha Mutambo wa Tennis ya Ṱafulani ha ITTF ha ṅwaha wa 2023, a ḓo farwa u bva nga ḽa 20 u swika ḽa 28 Shundunthule 2023.
",0.65615106
"Tiro e e namagadi e mokgatlho ono o sa bolong go tobana le yona ke ya go godisa go rena ga kagiso le kutlwano mo kontinenteng..Dikgaisano tsa Metshameko ya Tenese e e Tshamekelwang mo Tafoleng
","Vhuṱambo uvhu vhu ḓo farelwa Sentharani ya Miṱangano ya Dzitshaka ya Durban, hune ha ḓo tambiwa mitambo ya Dzisingili dza Vhanna na Vhafumakadzi, khathihi na vhuṱambo ha mitambo ya Vhanna, Vhafumakadzi na Dzidavhulu dzo Ṱanganelaho.
",0.5928575
"Dikgaisano tsa Makgaolakgang tsa Ngwaga wa 2023 tsa Metshameko ya Tenese e e Tshamekelwang mo Tafoleng tsa Mokgatlho wa Lefatshe wa Metshameko ya Tenese e e Tshamekelwang mo Tafoleng (ITTF) di tla tshwarwa go tloga ka la bo 20 go fitla ka la bo 28 Motsheganong 2023.
","Khabinethe i tamela mashudu vhoṱhe vhane vha ḓo dzhenela vhuṱambo uvhu.
",0.44383064
"Metshameko eno e tla tshwarelwa kwa Durban International Convention Centre, mo go tla nnang le metshameko ya banna ba ba tshamekang ba le esi le basadi ba ba tshamekang ba le esi, metshameko ya banna ba ba tshamekang kgatlhanong le banna, metshameko ya basadi ba ba tshamekang kgatlhanong le basadi, moogo le eo ba tshamekang ka setlhotshwana se se tswakilweng ka bong jo bo farologaneng.
","Makhaulatshele a Vhugwena ha Ḽifhasi ha Mitambo ya Tennis i tambelwaho kha Ṱafula ya ITTF a ḓo vha vhuṱambo ha tshiga kha ḓivhazwakale ya Tennis i tambelwaho kha Ṱafula, sa izwi hu tshi do vha hu lwa u thoma kha miṅwaha ya 80 musi vhuṱambo uvhu vhu tshi farelwa kha mavu a fhano Afrika.
",0.6563112
"Kabinete e eletsa tsotlhe tse di molemo go botlhe ba ba tshamekang.
","Tshiphuga tsha Ḽifhasi tsha mutambo wa Netiboḽo Musi ho sala maḓuvha a 81 u ya kha Tshiphuga tsha Ḽifhasi tsha Mutambo wa Netiboḽo, Khabinethe i khou ṱuṱuwedza vhadzulapo vha Afrika Tshipembe uri vha bvele phanḓa na u funga ḓenzhe ḽa u pembelela mitambo iyi nga ita uri Ḽavhuṱanu ḽiṅwe na ḽiṅwe ḽi pembelelwe sa Netball Friday.
",0.41953287
"Dikgaisano tsa Makgaolakgang tsa Metshameko ya Tenese e e Tshamekelwang mo Tafoleng tsa ITTF e tla nna tsa ntlha tsa fa e sale go nna le metshameko ya tenese e e tshamekelwang mo tafoleng dingwaga di feta di le 80 tse di fetileng metshameko eno e tshwarelwa mo lefatsheng la Aforika.
","Vhulavhelesi ha Mbekanyamushumo ya Mveledziso ya Tshiṱiriki
",0.5596679
"Sejana sa Lefatshe sa Metshameko ya Bolotloa
","Phresidennde Vho Cyril Ramaphosa vha ḓo ranga phanḓa mushumo wa Imbizo ya Phresidennde ya vhumalo ya Ḽiedza ḽa Mveledziso ya Tshiṱiriki (DDM) fhaḽa kha Tshiṱiriki tsha Cape Winelands kha ḽa Kapa Vhukovhela nga ḽa 19 Shundunthule 2023 sa tshipiḓa tsha ndingedzo dza muvhuso dza u khwinifhadza nḓisedzo ya tshumelo khathihi na u ita khuwelelo kha vhadzulapo na zwitshavha nga u angaredza ya uri vha vhe tshipiḓa tsha u bveledza shango ḽashu ḽa Afrika Tshipembe na uri hu sa vhe na ane a salela murahu kha mushumo uyu.
",0.3502898
"Jaaka go setse matsatsi a le 81 pele Metshameko ya Bolotloa ya Sejana sa Lefatshe e simolola, Kabinete e ikuela mo maAforika Borweng gore ba tswelele go fetlha mowa wa go bontsha gore metshameko eno e tla tshwarelwa mo nageng ya bona ka go apara diaparo tsa mebala ya setlhopha se ba se emang nokeng sa bolotloa Labotlhano mongwe le mongwe.
","Miraḓo ya Khorotshitumbe hu si kale vha ḓo thoma luṱa lu tevhelaho lwa Mbekanyamushumo ya Imbizo sa tshipiḓa tsha vhudavhidzani ho ṱanganelaho vhune ha ḓisa muvhuso tsini na vhathu khathihi na u bveledza maitele a demokirasi ya u shela mulenzhe nga vhathu vhoṱhe hu tshi itelwa u tandulula khaedu dza nḓisedzo ya tshumelo.
",0.62192255
"Tekolo ya Letsholo la Tiragatso ya Kabo ya Ditirelo le le Ikaegileng ka Ditikologo
","Milaedza.
",0.39069074
"Moporesitente Cyril Ramaphosa o tla Diragatsa Letsholo la Borobedi la Tiragatso ya Kabo ya Ditirelo le le Ikaegileng ka Ditikologo (DDM) ka Imbizo ya Moporesitente e e tla tshwarelwang kwa Tikologong ya Cape Winelands, kwa Kapa Bophirima ka la bo 19 Motsheganong 2023 mme seno ke karolo ya maiteko a puso a go tokafatsa kabo ya ditirelo le go dira gore baagi le mekgatlho ya setšhaba yotlhe ba ipope ngatana nngwe mme ba nne le seabe mo go tshwaraneleng Aforika Borwa mmogo gore e gole le mo go direng gore go se nne le ope yo e sa mo tsweleng mosola.
","U FHULULEDZAKhabinethe i khou rumela mulaedza wa u fhululedza na u tamela mashudu kha: Mufumakadzi Vho Kirsten Neuschäfer nge vha wina Mbambe ya Golden Globe ye khayo vha fhedza maḓuvha a ṱoḓaho u lingana 235 vha tshi khou alavha vha si na GPS na dziṅwe thekhinoḽodzhi.
",0.70433533
"Maloko a khuduthamaga mo nakong e e sa fediseng pelo a tla simolola ka Matsholo a Imbizo jaaka e le karolo ya go buisana le setšhaba, e leng seo se dirang gore puso e ye kwa baaging le go dira gore re nne le temokerasi e baagi ba nang le seabe mo go yona mo go rarabololeng dilo tse di saletseng morago tse di botlhokwa mo kabong ya ditirelo.
","Vho vha vhone mufumakadzi a eṱhe we a dzhenela mbambe iyi khathihi na u vha mufumakadzi wa u thoma u wina mbambe ya ḽifhasi ya muthu muthihi a tshi mona na ḽifhasi..Maipfi a Ndiliso Khabinethe i khou livhisa maipfi ayo a ndiliso kha vha muṱa na khonani dza: Mulwelambofholowo a lwaho na muvhuso wa tshiṱalula vhane vha vha Mudatshi Vho Klaas de Jonge, mulwelambofholowo we a vha o ḓiimisela vhukuma, muṱanganedzi w Muṅene wa Lushaka wa Vhaḽedzani vha OR Tambo.
",0.55355465
"Messages.
","Vho De Jonge vha humbulwa nga u ṱoda havho vhudzumbamo ngei kha embasi ya Netherlands he vha dzula lwa miṅwaha mivhili vha tshi shavha u farwa nga mapholisa a muvhuso wa tshiṱalula.
",0.061985366
"Melaetsa ya go AkgolaKabinete e romela melaetsa ya yona ya go akgola le go eletsa masego kwa go: Mme Kirsten Neuschäfer jaaka a fentse kabo ya tlotlo mo motshamekong wa mekorwana ya Golden Globe Race jaaka a kgannile mokorwana wa gagwe sebaka sa matsatsi a ka nna 235 a sena GPS kana tse dingwe tsa dithekenoloji tsa go mo supetsa tsela.
","Vha dovha hafhu vha humbulwa nga kha mushumo wavho wa u kona u tandulula khuḓano kha mashango manzhi vha dzhango.
",0.5596175
"E ne e le ene a le esi mosadi yo a tsenetseng motshameko ono mme e nnile ene mosadi wa ntlha wa go fenya lebelo leno la go dikologa lefatshe ka nosi..Melaetsa ya Matshediso Kabinete e romela matshediso a yone le kutlwelobotlhoko kwa go ba lelapa le ditsala tsa: Molwelakgaratlho wa mo-Dutch e bong Rre Klaas de Jonge, yo a lwetseng kgololesego ka boinelo, yo a amogetseng Kabo ya Naga ya Tlotlo ya Batsamaisanetselammogo ba OR Tambo.
","Muḓivhi wa zwa fulufulu, Vho Ted Blom, vhe vha vha vhe musaukanyi a re na nḓivho khulwane kha zwa mbekanyamaitele ya fulufulu.
",0.6919351
"De Jonge o tla gopolwa ka botshabelo jwa gagwe jwa go tshabela kwa embasing ya ma-Dutch mo a neng a nna gone sebaka sa dingwaga di le pedi a tshaba gore o tla golegwa ke mapodisi a puso ya tlhaolele.
","Sedzheni Vho Lwando Lawrence Bunga, Sedzheni Vho Mario Nel na Vho Khonstebuḽu Vho Lefaka, vhaofisiri vhararu vha Tshumelo ya Mapholisa ya Afrika Tshipembe vhe vha vhulahwa vhege yo fhiraho musi vha tshi khou ita mushumo wavho kha zwiṱiriki zwavho nga u fhambana hazwo ngei kha Masipala Muhulwane wa Nelson Mandela na wa Buffalo City hune ha vha kha vunḓu ḽa Kapa Vhubvaḓuvha na ngei Atteridgeville, kha ḽa Gauteng.
",0.5571536
"O gopolwa gape le ka tiro ya gagwe ya go rarabolola dikgogakgogano mo dinageng di le dintsinyana ka fa kontinenteng.
","Ho dovha hafhu ha vha na vhaṅwe vhaofisiri vhavhili vhe vha vhulahwa mulovha.
",0.42812932
"Moitseanape wa Merero ya Motlakase, Rre Ted Blom, yo a neng a phela a ntsha maikutlo a gagwe ka pholisi ya merero ya motlakase e bile a ne a tlhagisa mabaka a a utlwagalang.
","Khabinethe i khou sasaladza mabulayo ayo a vhaofisiri vha zwa mulayo nahone i dzhia zwiito izwi sa mishushedzo yo tou livhiswaho kha tsireledzo yashu ya lushaka.
",0.63398993
"Ngaka ya Tiro ya Dikaro Lwando Lawrence Bunga, Ngaka ya Tiro ya Dikaro Mario Nel mmogo le Mokonetabole Lefaka, batlhankedi bano ba Tirelo ya Sepodisi sa Aforika Borwa (SAPS) boraro jwa bona bo bolailwe ba samagane le ditiro tsa bona mo mafelong a a farologaneng e leng kwa Teropong e Kgolo ya Nelson Mandela mmogo le ya Buffalo City kwa porofenseng ya Kapa Botlhaba mmogo le kwa lefelong la Atteridgeville, kwa porofenseng ya Gauteng.
","Khabinethe yo ṋea ndaela vha mazhendedzi a zwa mulayo ya uri hu songo siiwa tombo nṱha ḽiṅwe musi hu tshi itwa ṱhoḓisiso dza u fara zwigevhenga izwi zwo vhulayaho vhaofisiri vhashu vha zwa mulayo.Ḽizhakanḓila ḽa mutambo wa khororo ḽi funeaho vhukuma fhano kha ḽa Afrika Tshipembe, Vho John Bland (77), vhe vha wina thitele dza 36 kha budo ḽavho ḽe khaḽo vha shuma zwavhuḓi vhukuma kha tshifhinga tsha miṅwaha ya mahumi o vhalaho.
",0.6923393
"Motlakase
","Fulufulu
",0.51045275
"Kabinete e nopotse kgatelopele e e setseng e dirilwe mo go tsenyeng tirisong Leano la Naga la go Tseela Motlakase Dikgato, e bile e a dumelana gore go santse go le gontsi go go santseng go tlhoka go diriwa mo go baakanyeng diyuniti tsa tlamelo ya motlakase ka fa nageng.
","Khabinethe yo dzhiela nṱha mvelaphanḓa yo swikelwaho kha zwa u thoma u shumiswa ha Pulane ya Mashumele ya zwa Fulufulu, ngeno nga thungo i tshi khou dovha hafhu ya ṱanganedza vhuleme vhuhulwane vhukuma vhune ha kha ḓi vha hone kha sisṱeme ya lushaka ya nḓisedzo ya muḓagasi.
",0.5313362
"Jaaka naga e tsena mo marigeng, Kabinete e itumedisitswe ke konteraka e e sa tswang go garelwa ya dimekawate di le 400 ya go oketsa motlakase ka Letsholo la go Reka Motlakase mo Ditlamong tse di Nang le Motlakase o Montsi go Feta o di o Dirisang mme motlakase ono o tla gokelelwa mo diyuniting tsa rona tsa motlakase pele kgwedi ya Motsheganong 2023 e konosela.
","Zwenezwi musi shango ḽi tshi khou dzhena kha khalaṅwaha ya Vhuriha, Khabinethe yo ṱanganedza zwa u khunyeledzwa ha Khonṱhiraka ya u ṋetshedza muḓagasi wa 400 megawatsi (MW) dza u ḓadzisa nga kha Mbekanyamushumo ya Ṋetshedzo yo Linganaho (Standard Offer Programme) dzine dza ḓo thoma u vha hone kha sisṱeme ya nḓisedzo ya muḓagasi phanḓa ha musi ṅwedzi wa Shundunthule 2023 u tshi fhela.
",0.68502766
"Mo godimo ga seno, Lefapha la Boitekanelo le nopotse maokelo a le 213 a a sa tshwanelwang ke go kgorelediwa ke go tshabela ruri ga motlakase, mo go ona a le 76 ke ao a ntseng a sa itemogele matsapa ano mme tiro ya go oketsa palo eno ka maokelo a mangwe gape a le 46 e gatetse pele mo go bonagalang.
","Nga nnḓa ha izwo, Muhasho wa Mutakalo wo ṱalusa zwibadela zwa 213 sa zwone zwine zwa tea u sa kwamea nga mafhungo a u khaulwa ha muḓagasi nga u sielisana, hune zwibadela zwi linganaho 76 kha zwenezwi, zwa vha uri zwo no ḓi thoma u sa kwamea nga uhu u khaulwa ha muḓagasi nga u sielisana ngeno hu na uri mushumo wa u engedza zwiṅwe zwibadela zwi linganaho 46 kha mutevhe wa izwo zwine zwa si tee u kwamea nga izwo zwa u khaulwa ha muḓagasi, u tsini na u khunyeledzwa.
",0.66367257
"Kabinete e itumedisitswe gape le ke thankgololo e e solofetsweng ya Lefelo la Ditirelo tse Dintsi tsa Merero ya Motlakase ka la bo 31 Motsheganong 2023 le le tla thankgololwang ke ba Dipeeletso tsa Naga ya Aforika Borwa e leng selo se se tla potlakisang dithulaganyo tsa go ikobela melao go tswela thuso ditlamo tse dintšhwa tsa motlakase gore le tsona di kgone go thusa.
","Khabinethe yo dovha hafhu ya ṱanganedza zwa u rwelwa ṱari ha Energy One-Stop Shop zwine zwa khou ḓo vha hone hu si kale nga ḽa 31 Shundunthule 2023 nga vha Invest SA u itela u tshimbidza mafhungo a zwa milayo ine ya ḓo thusa khamphani ntswa dza u bveledza muḓagasi u itela uri na dzone dzi thome u shuma nga u ṱavhanya.
",0.68826044
"E nopotse kgatelopele e e setseng e dirilwe kwa Seteišeneng sa Motlakase sa Kusile go busetsa tirisong dimekawate di le 3 200 tsa yuniti ya bo 1, 2, 3 le 5 tsa motlakase mo bokhutlhong jwa ngwaga wa 2023.
","Khabinethe yo dovha hafhu ya dzhiela nṱha mvelaphanḓa yo no itwaho fhaḽa kha Tshiṱitshi tsha Muḓagasi tsha Kusile hu tshi itelwa u vhuedzedzwa hafhu ha muḓagasi u linganaho 3 200 MW, kha yunithi dza 1, 2, 3 na 5, murahu kha sisṱeme ya nḓisedzo ya muḓagasi ya lushaka mafheloni a ṅwaha wa 2023.
",0.7028581
"Kabinete e santse e tlhobaediwa ke dikgang tsa maaka tse di tswelelang go phasaladiwa mo mafaratlhatlheng a ditlhaeletsano tse di reng naga e tlo welwa ke lefifi la go tlhoka motlakase ka ntlha ya go phutlhama ga diyuniti tsotlhe tsa tlamelo ya motlakase.
","Khabinethe yo kwamea nga zwiito zwa u phaḓaladzwa ha mafhungo ane a si vhe ngoho zwine zwa khou bvela phanḓa, hu tshi khou shumiswa nyanḓadzamafhungo dza matshilisano hune khadzo ha khou ambiwa zwauri hu si kale hu khou ḓo vha na u wa tshoṱhe ha sisṱeme ya nḓisedzo ya muḓagasi ya lushaka, zwine ha khou pfala uri zwi ḓo fhedza zwo vhanga u dzima tshoṱhe ha muḓagasi shango ḽoṱhe.
",0.5660625
"Eskom e netefaleditse puso gore e na le maano a go tlhokomela diyuniti tseno go dira gore naga e se iphitlhele mo seemong sa go welwa ke lefifi.
","Eskom yo fulufhedzisa muvhuso uri hu na pulane dzi re hone kha sisṱeme yavho dza u thivhela uri hu si vhe na u dzima lwa tshoṱhe ha muḓagasi kha shango ḽoṱhe.
",0.53105503
"Kabinete e santse e boeletsa boikuelo jwa yona jwa gore batho botlhe ka fa nageng ya Aforika Borwa ba tshwanetse go boloka motlakase.
","Khabinethe yo dovha hafhu ya ombedzela khuwelelo kha vhathu vhoṱhe vha fhano Afrika Tshipembe ya uri vha bvele phanḓa na u vhulunga muḓagasi.
",0.49569082
"Maitlhomo ke go boloka motlakase yo o kanaka dimekawate di le 1 000 ka letsatsi, mme seno se tla kgona go fokotsa motlakase o o tshabetseng ruri ka kgato e le nngwe letsatsi le letsatsi.
","Tshipikwa tshihulwane ndi u vhulunga muḓagasi u linganaho 1 000 MW ḓuvha ḽiṅwe na ḽiṅwe, zwine hezwi zwa lingana na u vhulunga luṱa lwoṱhe lwa u thoma lwa u khaulwa ha muḓagasi nga u sielisana ḓuvha ḽiṅwe na ḽiṅwe.
",0.61966896
"Tona ya Merero ya Motlakase, Ngaka Kgosientsho Ramokgopa, mo kopanong le bobegakgang ka Labotlhano wa la bo 26 Motsheganong 2023 o tla baya naga mo dinakong ka dikgato tse di tserweng mo go tsenyeng tirisong Leano la go Tseela Motlakase Dikgato.
","Minisṱa vha Muḓagasi, Dokotela Vho Kgosientsho Ramokgopa, vha ḓo ḓivhadza shango nga ha u thoma u shumiswa ha Pulane ya Mashumele ya zwa Fulufulu nga Ḽavhuṱanu, ḽa 26 Shundunthule 2023, musi vha tshi khou amba na vhoramafhungo.
",0.63453716
"Boitekanelo
","Mutakalo
",0.4914783
"Go tloga ka la bo 24 Motsheganong 2023 Puso e tlhomile Komiti ya Merero ya Setegeniki, e e eteletsweng pele ke Lefapha la Boitekanelo la Naga, go samagana le bolwetse jwa Kholera jo bo weleng kwa Hammanskraal mo masepaleng wa Teropo ya Tshwane, jo ga jaana bo setseng bo fetile ka matshelo a le.
","Muvhuso wo vhumba komiti ya u shuma ya zwa thekiniki, ine ya khou langwa nga Muhasho wa Mutakalo wa Lushaka, nga murahu ha musi ho vha na tshiwo tsha vhulwadze ha Khoḽera ngei Hammanskraal kha Ḓorobo khulwane ya Tshwane, vhune ho no vhulaha vhathu vha swikaho 15 u swika zwino, nga ḽa 24 Shundunthule 2023.
",0.6367308
"Go samaganwe le namane e tona ya tiro ya go batlisisa gore bolwetse jono bo runtse kae e ka tswa e le mo metsweding ya metsi, diteroko tse di isetsang baagi metsi, mo dipompong le mo Seteišeneng sa go Tlhatswa Metsi a a Leswe sa Rooiwal (WWTW).
","Hu na mushumo muhulwane u re kati zwazwino wa u ita ndingo kha zwiko zwoṱhe zwine zwa nga vha zwi zwone zwo ḓisaho tshikafhadzo iyi, zwi nga vha zwiko zwa maḓi, maḽori a u ṋetshedza maḓi, dzibommbi na tshiimiswa tsha Mishumo ya u Kunakisa Maḓi a Mashika tsha Rooiwal (WWTW).
",0.65942186
"Go fitlha mo motsing ono, ga go bopaki bope jo bo bontshang fa go na le kokwana ya kholera mo metsweding yotlhe eno, mme seno se re raya se re go wa ga bolwetse jono ke ka ntlha ya tiragalo e le nngwe e e diragetseng e ga jaana e fetileng mme balwetse ba bangwe ba ba tlhagelelang ga jaana ke ka ntlha ya fa ba tshwaetsana.
","U swika zwino, a hu athu wanala vhuṱanzi vhu sumbaho uri ho wanala bakhitheria ya khoḽera kha zwiko izwi, zwine hezwi zwa ṋea fulufhelo ḽa uri hu na khonadzeo ya uri tshiwo itshi tsha khoḽera tshi nga vha tsho vha hone nga mulandu wa u tshikafhadzwa ho bvelelaho fhethu huthihi fhedzi, lune zwiwo zwi re hone zwazwino zwa nga vha zwo vha hone nga mulandu wa u tshikafhala ho vhangwaho nga zwiitisi zwa vhuvhili na zwa vhuraru (phiriselano).
",0.486229
"Jaaka go tsweletswe ka ditharabololo, baagi ba motse wa Hammanskraal ba rotloediwa gore ba bedise metsi a a tswang mo dipompong mme ba a topetse letswatswana pele ba ka nwa.
","Musi maga aya a u lingedza u tandulula thaidzo iyi a tshi khou ḓi bvela phanḓa, vhadzulapo vha fhaḽa Hammanskraal vha khou ṱuṱuwedzwa uri vha vhilise maḓi avho a bommbini nahone vha shele na muṋo muṱuku phanḓa ha musi vha tshi a nwa.
",0.5693143
"Se sengwe gape, fa motho a berekwa ke mala, a feroga dibete kgotsa a na le matshwao a motho yo a tshwerweng ke mala, a motho yoo a lebe kokelong kgotsa kwa tleliniking ya kwa motseng yo a leng mo go ona.
","Zwiṅwe hafhu, muthu muṅwe na muṅwe ane a vha na malani, u silingwa kana tsumbadwadze dza thaidzo ya tsukanyo, u tea uri nga u ṱavhanya a dalele dokotela wawe kana kiḽiniki ya henefho tsini nae.
",0.26177
"Tona ya Lefapha la Metsi le Kgeleloleswe, Rre Senzo Mchunu, o tla ikopanya le Meyara wa Masepala wa Teropo ya Tshwane, Mokhanselara Cilliers Brink, ka Labotlhano 26 Motsheganong 2023 maitlhomo e le go loga leano mmogo la go samagana le go aga sešwa Rooiwal WWTGo bona tshedimosetsoka botlalo o ka letsetsa mogala wa tshoganyetso o o dirang bosigo le motshegare wa Setheo sa Naga sa Malwetse a a Fetelanang (NICD) mo go 082 883 9920.
","Minisṱa vha Muhasho wa Maḓi na Vhuthathazwitzhili, Vho Senzo Mchunu, vha ḓo vha na muṱangano na Ṋeḓorobo wa Ḓorobo khulwane ya Tshwane, Mukhantseḽara Vho Cilliers Brink, nga Ḽavhuṱanu, ḽa 26 Shundunthule 2023 u itela u lingedza u bveledza pulane yo ṱanganelaho ya mushumo wa u vusuluswa ha tshiimiswa tsha Rooiwal WWTW tshine tsho vha tsho tea tsho no vusuluswa kale.
",0.7511726
"Maele a go okobatsa bolwetse jwa kholera a teng mo go WEBTOKEDipatlisiso tsa Kgweditharo tsa Dipalopalo tsa Badiri (QLFS)
","U itela u wana zwidodombedzwa zwinzhi, vha nga founela kha nomboro ya luṱingo ya Tshiimiswa tsha Malwadze a Phirela tsha Lushaka (NICD) i shumaho awara dza 24 nga ḓuvha kha 082 883 9920.
",0.58355665
"Kabinete e tiisiwa mmoko ke seo pegelo ya 2023 ya QLFS e se tlhagisang mo palo ya batho ba ba thapiwang e tlhatlogileng garataro mo dikotareng ka go latelana mme palo ya batho ba ba nang le ditiro ba le milione e atumelang mo go ba le milione e leng palo e re neng re le mo go yona pele ga COVID-19.
","Tsumbamaitele dza u ilafha vhulwadze ha Khoḽera dzi wanala kha inthanethe kha WEBTOKEṰhoḓisiso dza zwa Vhashumi dza Kotara (QLFS)
",0.34234807
"Seno ke se supo se se tlhamaletseng sa gore ikonomi ya naga ya Aforika Borwa e boela sekeng.
","Khabinethe i khou ṱuṱuwedzwa nga fhungo ḽa uri QLFS ya u thoma ya ṅwaha wa 2023 yo sumbedzisa uri ho vha na nyengedzedzo ya vhurathi ya nga kotara nga u tevhekana kha tshivhalo tsha mishumo khathihi na uri zwa u tholwa ha vhathu vha swikaho miḽioni zwi khou vhonala zwi tshi khou ri sendedzela tsini na uri ri swike kha tshivhalo tsha miḽioni tsha vhathu vho tholiwaho kha maḓuvha a phanḓa ha tshiwo tsha dwadze ḽa Khoronavairasi (COVID-19).
",0.42536765
"Dipalopalo tsa batho ba ba thapilweng mo kgweditharong ya ntlha di bontsha gore go tlhodiwle ditiro di le 209 000 mo ditirong tsa semmuno mmogo le tse dingwe di le 107 000 mo ditirong tseo e seng tsa semmuso mo kgweditharong ya ntlha ya monongwaga.
","Hezwi zwi tou vha tsumbo i re khagala ya uri ikonomi ya Afrika Tshipembe i khou vhonala i tshi khou vhuyelela nga nḓila yo khwaṱhaho vhukuma u bva kha masiandaitwa a dwadze iḽo.
",0.50741917
"Tirisanommogo ya Naga ya Aforika Borwa le ya Amerika Kabinete e totobatsa kgang ya gore botsalano jwa naga ya Aforika Borwa le jwa Amerika e santse e le jwa go ntshana se se mo inong, jo bo sa nonofileng e bile bo tswela maphata otlhe mosola ka go lekana mme seno se latela gore Tona ya Dikamano le Tirisano le Dinaga tsa Boditšhaba, Ngaka Naledi Pandor a rwale maoto go kopana le Moambasatara wa naga ya Amerika, Reuben E Brigety, go tšhotlha kgang ya gagwe ka go latofatsa naga ya Aforika Borwa gore e rekiseditse naga ya Russia dibetsa.
","Mbalombalo dza nga ha vhathu vhane vha khou shuma dza kotara ya u thoma dzo sumbedza uri ho sikwa mishumo i swikaho 209 000 kha sekhithara yo dzudzanyeaho ngeno miṅwe mishumo ya 107 000 yo sikwa kha sekhithara i songo dzudzanyeaho kha tshifhinga tsha kotara ya u thoma ya ṅwaha..Vhushaka ha shango ḽa Afrika Tshipembe na ḽa Amerika (US) Khabinethe yo ombedzela zwauri vhushaka vhukati ha shango ḽa Afrika Tshipembe na ḽa Amerika vhu kha ḓi vha havhuḓi, ho khwaṱha nahone vhune ha vhuedza masia oṱhe u swika zwino nga murahu ha muṱangano we wa vha hone vhukati ha Minisṱa vha Muhasho wa Vhushaka ha Dzitshaka na Tshumisano, Dokotela Vho Naledi Pandor na Muambasada wa ḽa Amerika fhano Afrika Tshipembe, Vho Reuben E Brigety, nga murahu ha maambiwa avho he khao vha vha vha tshi khou pomoka Afrika Tshipembe uri ḽo ṋetshedza zwiṱhavhane kha shango ḽa Russia.
",0.67924976
"Kabinete e boeletsa mafoko a yona gore go na le dikgato tse di tlhomilweng tse di itsegeng tsa setipolomate tsa go se gatane menwana ya maoto tse dinaga tsotlhe di itseng gore di tshwanetse go di latela, le yona Amerika, fa go na le sengwe se se ba tshwenyang gore go kgonwe go mekamekanwa le botsalano jwa dinaga ka bobedi.
","Khabinethe yo dovha hafhu ya ombedzela zwauri hu na nḓila dzi ḓivheaho dza zwa vhudipuḽomati dzine dza tea u shumiswa nga tshaka dzoṱhe, hu tshi katelwa na shango ḽa US, kha u bvisela khagala thaidzo dzine vha vha nadzo zwenezwo musi dzi tshi tutuwa kha zwa kulangelwe kwa vhushaka ha vhavhili.
",0.54580396
"Kabinete e itumedisitswe ke mafoko a Moporesitente Cyril Ramaphosa a gore go thankgololwe dipatlisiso tse di sa tseyeng letlhakore go batlisisa mofetsho ono wa gore naga ya Aforika Borwa e rekiseditsa naga ya Russia dibetsa.
","Khabinethe yo ṱanganedza nḓivhadzo nga Phresidennde Vho Cyril Ramaphosa ya u vhumbwa ha ṱhoḓisiso yo ḓiimisaho nga yoṱhe ya u ṱoḓisisa mavharivhari a u ṋetshedzwa ha zwiṱhavhane zwi bvaho fhano kha ḽa Afrika Tshipembe zwi tshi ṋewa shango ḽa Russia.
",0.7354532
"Dintlha tse di ribololwang ke dipatlisiso tseno di tla itsisiwe mo nakong e e sa fediseng pelo.
","Zwidodombedzwa zwa ṱhoḓisiso iyo zwi ḓo ḓivhadzwa musi tshifhinga tshi tshi swika.
",0.10382313
"Tirisanommogo ya naga ya Aforika Borwa le ya Singapore
","Vhushaka vhukati ha shango ḽa Afrika Tshipembe na ḽa Singapore
",0.5414346
"Moporesitente Ramaphosa o ne a amogetse Tonakgolo Lee Hsien Loong wa Naga ya Rephaboliki ya Singapore ka Labobedi, 16 Motsheganong 2023.
","Phresidennde Vho Ramaphosa vho ṱanganedza Minisṱa Muhulwane wa Riphabuḽiki ya Singapore Vho Lee Hsien Loong nga Ḽavhuvhili, ḽa 16 Shundunthule 2023.
",0.749103
"Naga ya Singapore e beeletsa tota mo nageng ya Aforika Borwa, dipeeletso tsa teng di feta R5 bilione mo maphateng a a jaaka la tlhagisodikuno, la ditirelo tsa matlole le la thekiso ya dintlo.
","Shango ḽa Singapore ndi mubindudzi muhulwane fhano kha ḽa Afrika Tshipembe, hune ha vha na vhubindudzi ha masheleni a fhiraho R5 biḽioni kha sekhithara dzi fanaho na zwa vhumagi, tshumelo dza zwa masheleni na zwa ndaka.
",0.69834757
"Ditumelano tse di saenilweng magareng ga dinaga ka bobedi maitlhomo a tsona ke go gagamatsa tirisanommogo mo mererong ya kgwebisano, dipeeletso, thuto mmogo le ya sesole..Imbizo ya Moporesitente ya Leano la Tiragatso ya Kabo ya Ditirelo le le Ikaegileng ka Ditikologo (DDM) la Porofense ya Kapa Bophirima
","Thendelano dzo sainwaho vhukati ha mashango aya mavhili ndi dzine dzo livhiswa kha u khwaṱhisa mbambadzo, vhubindudzi, pfunzo na tshumisano kha zwa vhupileli..Imbizo ya Phresidennde ya nga ha Ḽiedza ḽa Mveledziso ya Tshiṱiriki tsha Kapa Vhukovhela (DDM)
",0.6871565
"Moporesitente Ramaphosa o garetse Imbizo ya Moporesitente ya borataro ya DDM kwa Porofenseng ya Kapa Bophirima, kwa Masepaleng wa Selegae wa Drakenstein, mo Tikologong ya Cape Winelands ka Labotlhano wa la bo 19 Motsheganong 2023.
","Phresidennde Vho Ramaphosa vho fara Imbizo ya Phresidennde ya vhurathi ya nga ha DDM ya fhaḽa Kapa Vhukovhela, kha Masipala Wapo wa Drakenstein, kha Tshiṱiriki tsha Cape Winelands, nga Ḽavhuṱanu, ḽa 19 Shundunthule 2023.
",0.7507824
"Moporesitente o ne a goga kwa pele baeteledipele botlhe ba maphata otlhe a le mararo a puso ka molaetsamogolo yo o reng: “Go se Nne le Ope yo a Tlogelwang kwa Morago”.
","Phresidennde vho ranga phanḓa vhurumelwa vhu bvaho kha masia mararu a muvhuso nga fhasi ha thero ine ya ri: “A hu Tei U vha na Tsaleli”.
",0.62853706
