src_text,tgt_text,cosine_score
"Swirho swa Vurhangerinkulu ku nga ri khale swi ta sungula xiphemu lexi landzelaka xa Nongoloko wa Swivijo tanihi xiphemu xa mivulavurisano yo tirhisana leyi tisaka mfumo ekusuhi swinene na vanhu na ku tlakusa xidemokirasi xa ku nghenelela eka ku ololoxa mitlimbo ya le vanhwini na mphakelo wa vukorhokeri byin'wana.
","Milaedza.
",0.29463542
"Marungula.
","U FHULULEDZAKhabinethe i khou rumela mulaedza wa u fhululedza na u tamela mashudu kha: Mufumakadzi Vho Kirsten Neuschäfer nge vha wina Mbambe ya Golden Globe ye khayo vha fhedza maḓuvha a ṱoḓaho u lingana 235 vha tshi khou alavha vha si na GPS na dziṅwe thekhinoḽodzhi.
",0.08378068
"KU HOYOZELAKhabinete yi hoyozerile na ku navelela leswinene eka: Manana Kirsten Neuschäfer eka ku wina Mphikizano wa Misava wa Nsuku wo xiximeka lowu eka wona a tekeke kwalomu ka 235 wa masiku a ri eku tluteni a ri hava GPS na thekinoloji yin'wana.
","Vho vha vhone mufumakadzi a eṱhe we a dzhenela mbambe iyi khathihi na u vha mufumakadzi wa u thoma u wina mbambe ya ḽifhasi ya muthu muthihi a tshi mona na ḽifhasi..Maipfi a Ndiliso Khabinethe i khou livhisa maipfi ayo a ndiliso kha vha muṱa na khonani dza: Mulwelambofholowo a lwaho na muvhuso wa tshiṱalula vhane vha vha Mudatshi Vho Klaas de Jonge, mulwelambofholowo we a vha o ḓiimisela vhukuma, muṱanganedzi w Muṅene wa Lushaka wa Vhaḽedzani vha OR Tambo.
",0.6402403
"A ri mungheneri wa xisati a ri yexe naswona u vile wansati wo sungula ku wina mphikizano wo rhendzeleka hi misava u ri wexe..Ku chavelela Khabinete yi kombise ku chavelela eka ndyangu na vanghana va: Mugingirikeli wo lwisana na xihlawuhlawu wa Mudachi Tatana Klaas de Jonge, mulwelantshunxeko wo tiyimisela, muamukeri wa Risiva ra Rixaka ra Vanghana va OR Tambo.
","Vho De Jonge vha humbulwa nga u ṱoda havho vhudzumbamo ngei kha embasi ya Netherlands he vha dzula lwa miṅwaha mivhili vha tshi shavha u farwa nga mapholisa a muvhuso wa tshiṱalula.
",0.72689533
"De Jonge u tsundzukiwa hikwalaho ko lava nsirhelelo eka tindlu ta vuyimeri bya tiko ra Dachi laha a tshameke kona ku ringana malembe mambirhi ku papalata ku khomiwa hi maphorisa ya mfumo wa xihlawuhlawu.
","Vha dovha hafhu vha humbulwa nga kha mushumo wavho wa u kona u tandulula khuḓano kha mashango manzhi vha dzhango.
",0.51975644
"U tsundzukiwa kuya emahlweni hi ntirho wa yena wa switshunxo swa mitlimbo ematikweni yo tala lama nga eka tikokulu.
","Muḓivhi wa zwa fulufulu, Vho Ted Blom, vhe vha vha vhe musaukanyi a re na nḓivho khulwane kha zwa mbekanyamaitele ya fulufulu.
",0.5279914
"Mutivinkulu wa eneji, Tatana Ted Blom, loyi a ri mubumabumeri wa nkhinkhi na ku va wo ehleketisisa hi mayelana na pholisi ya eneji.
","Sedzheni Vho Lwando Lawrence Bunga, Sedzheni Vho Mario Nel na Vho Khonstebuḽu Vho Lefaka, vhaofisiri vhararu vha Tshumelo ya Mapholisa ya Afrika Tshipembe vhe vha vhulahwa vhege yo fhiraho musi vha tshi khou ita mushumo wavho kha zwiṱiriki zwavho nga u fhambana hazwo ngei kha Masipala Muhulwane wa Nelson Mandela na wa Buffalo City hune ha vha kha vunḓu ḽa Kapa Vhubvaḓuvha na ngei Atteridgeville, kha ḽa Gauteng.
",0.5756533
"Sejeni Lwando Lawrence Bunga, Sejeni Mario Nel na Phorisa Lefaka, vaofisiri vanharhu va Vukorhokeri bya Maphorisa ya Afrika-Dzonga lava va dlaweke evhikini leri nga hundza loko va ri karhi va tirha mitirho ya vona eka swifundza swa vona hi ku hambanahambana eka Dorobakulu ra Nelson Mandela na Dorobakulu ra Buffalo City eKapaVuhumadyambu na le Atteridgeville, eGauteng.
","Ho dovha hafhu ha vha na vhaṅwe vhaofisiri vhavhili vhe vha vhulahwa mulovha.
",0.60019165
"Hi ku engetela, vaofisiri van’wana vambirhi va dlawile tolo.
","Khabinethe i khou sasaladza mabulayo ayo a vhaofisiri vha zwa mulayo nahone i dzhia zwiito izwi sa mishushedzo yo tou livhiswaho kha tsireledzo yashu ya lushaka.
",0.33109847
"Khabinete yi sola ku dlayiwa ka vaofisiri va vahlayisi va nawu naswona yi vona leswi tanihi nxungeto wo kongoma eka nsirhelelo wa hina wa rixaka.
","Khabinethe yo ṋea ndaela vha mazhendedzi a zwa mulayo ya uri hu songo siiwa tombo nṱha ḽiṅwe musi hu tshi itwa ṱhoḓisiso dza u fara zwigevhenga izwi zwo vhulayaho vhaofisiri vhashu vha zwa mulayo.Ḽizhakanḓila ḽa mutambo wa khororo ḽi funeaho vhukuma fhano kha ḽa Afrika Tshipembe, Vho John Bland (77), vhe vha wina thitele dza 36 kha budo ḽavho ḽe khaḽo vha shuma zwavhuḓi vhukuma kha tshifhinga tsha miṅwaha ya mahumi o vhalaho.
",0.4837345
"Gezi
","Fulufulu
",0.55008906
"Khabinete yi tekele enhlokweni ku humelela lo ku endliweke eka ku tirhisa Kungu ra Matirhelo ra Eneji, loko yi ri karhi yi amukela ku tikeriwa lokukulu loku ka ha riki kona eka giridi ya rixaka.
","Khabinethe yo dzhiela nṱha mvelaphanḓa yo swikelwaho kha zwa u thoma u shumiswa ha Pulane ya Mashumele ya zwa Fulufulu, ngeno nga thungo i tshi khou dovha hafhu ya ṱanganedza vhuleme vhuhulwane vhukuma vhune ha kha ḓi vha hone kha sisṱeme ya lushaka ya nḓisedzo ya muḓagasi.
",0.58498156
"Loko tiko ri ri karhi ri nghena eka nkarhi wa Vuxika, Khabinete yi amukerile ku hetisisiwa ka kontiraka ya 400 wa timegawati (MW) to engeteleleka ka vuswikoti hi ku tirhisa Nongoloko wa Manyikelo lama Pimiweke lama nga ta va eka ithanete ku nga se hela n’hweti ya Mudyaxihi 2023.
","Zwenezwi musi shango ḽi tshi khou dzhena kha khalaṅwaha ya Vhuriha, Khabinethe yo ṱanganedza zwa u khunyeledzwa ha Khonṱhiraka ya u ṋetshedza muḓagasi wa 400 megawatsi (MW) dza u ḓadzisa nga kha Mbekanyamushumo ya Ṋetshedzo yo Linganaho (Standard Offer Programme) dzine dza ḓo thoma u vha hone kha sisṱeme ya nḓisedzo ya muḓagasi phanḓa ha musi ṅwedzi wa Shundunthule 2023 u tshi fhela.
",0.693799
"Ku yisa emahlweni, Ndzawulo ya rihanyo yi hlawurile swibedlhele swa 213 leswi nga ta ka swi nga timeriwi gezi, laha 76 wa swona se swi nga ha timerikwiki gezi naswona ntirho wo engetela swibedlhele swin’wana swa 46 wu le kusuhi no fika emakumu.
","Nga nnḓa ha izwo, Muhasho wa Mutakalo wo ṱalusa zwibadela zwa 213 sa zwone zwine zwa tea u sa kwamea nga mafhungo a u khaulwa ha muḓagasi nga u sielisana, hune zwibadela zwi linganaho 76 kha zwenezwi, zwa vha uri zwo no ḓi thoma u sa kwamea nga uhu u khaulwa ha muḓagasi nga u sielisana ngeno hu na uri mushumo wa u engedza zwiṅwe zwibadela zwi linganaho 46 kha mutevhe wa izwo zwine zwa si tee u kwamea nga izwo zwa u khaulwa ha muḓagasi, u tsini na u khunyeledzwa.
",0.6156753
"Khabinete yi tlhela yi amukela ku simekiwa loku nga ta va kona ka Ndhawu yo Xavisa Swilo Hinkwaswo swa Gezi hi ti 31 Mudyaxihi 2023 hi Invest SA ku hatlisisa endlelo ro lawula leri nga ta pfuna ku nghena ka tikhamphani letintshwa to tumbuluxa gezi.
","Khabinethe yo dovha hafhu ya ṱanganedza zwa u rwelwa ṱari ha Energy One-Stop Shop zwine zwa khou ḓo vha hone hu si kale nga ḽa 31 Shundunthule 2023 nga vha Invest SA u itela u tshimbidza mafhungo a zwa milayo ine ya ḓo thusa khamphani ntswa dza u bveledza muḓagasi u itela uri na dzone dzi thome u shuma nga u ṱavhanya.
",0.6991794
"Yi lemukile ku humelela loku endliweke eka Xitici xa Gezi xa Kusile ko vuyelerisa 3 200 MW, hi ku tirhisa tiyuniti ta 1, 2, 3 na 5, eka giridi ya rixaka hi ku hela ka 2023.
","Khabinethe yo dovha hafhu ya dzhiela nṱha mvelaphanḓa yo no itwaho fhaḽa kha Tshiṱitshi tsha Muḓagasi tsha Kusile hu tshi itelwa u vhuedzedzwa hafhu ha muḓagasi u linganaho 3 200 MW, kha yunithi dza 1, 2, 3 na 5, murahu kha sisṱeme ya nḓisedzo ya muḓagasi ya lushaka mafheloni a ṅwaha wa 2023.
",0.7468873
"Khabinete yi vilerisiwa hi ku hangalasiwa ka mahungu ya mavunwa lama hehlaka leswaku giridi ya rixaka yi ta wa leswi nga ta vanga ku timeka ka gizi ka makumu, hi ku tirhisa vuhangalasamahungu bya le ka inthanete.
","Khabinethe yo kwamea nga zwiito zwa u phaḓaladzwa ha mafhungo ane a si vhe ngoho zwine zwa khou bvela phanḓa, hu tshi khou shumiswa nyanḓadzamafhungo dza matshilisano hune khadzo ha khou ambiwa zwauri hu si kale hu khou ḓo vha na u wa tshoṱhe ha sisṱeme ya nḓisedzo ya muḓagasi ya lushaka, zwine ha khou pfala uri zwi ḓo fhedza zwo vhanga u dzima tshoṱhe ha muḓagasi shango ḽoṱhe.
",0.599522
"Eskom yi tshembise mfumo hi makungu lama nga kona yo hlayisa sisiteme no sivela ku timiwa ka gezi ra makumu etikweni hinkwaro.
","Eskom yo fulufhedzisa muvhuso uri hu na pulane dzi re hone kha sisṱeme yavho dza u thivhela uri hu si vhe na u dzima lwa tshoṱhe ha muḓagasi kha shango ḽoṱhe.
",0.5296943
"Khabinete yi vuyelela xikombelo eka vanhu hinkwavo va Afrika-Dzonga xo ya emahlweni no hlayisa gezi.
","Khabinethe yo dovha hafhu ya ombedzela khuwelelo kha vhathu vhoṱhe vha fhano Afrika Tshipembe ya uri vha bvele phanḓa na u vhulunga muḓagasi.
",0.5253757
"Thagete i ku hlayisa kwalomu ka 1 000 MW masiku hinkwawo, leswi ringana na ku hlayisa xiteji xinwe xa ku timiwa ka gezi hi ku siyerisana siku ri n’wana na rin’wana.
","Tshipikwa tshihulwane ndi u vhulunga muḓagasi u linganaho 1 000 MW ḓuvha ḽiṅwe na ḽiṅwe, zwine hezwi zwa lingana na u vhulunga luṱa lwoṱhe lwa u thoma lwa u khaulwa ha muḓagasi nga u sielisana ḓuvha ḽiṅwe na ḽiṅwe.
",0.6211288
"Holobye wa Gezi, Dr Kgosientsho Ramokgopa, u ta tivisa tiko hi ku tirhisiwa ka Kungu ra Matirhelo ra Eneji hi Ravuntlahnu, 26 Mudyaxihi 2023, hi nhlengeletano yo tivisa vuhangalasi va mahungu.
","Minisṱa vha Muḓagasi, Dokotela Vho Kgosientsho Ramokgopa, vha ḓo ḓivhadza shango nga ha u thoma u shumiswa ha Pulane ya Mashumele ya zwa Fulufulu nga Ḽavhuṱanu, ḽa 26 Shundunthule 2023, musi vha tshi khou amba na vhoramafhungo.
",0.652704
"Rihanyo
","Mutakalo
",0.5346477
"Mfumo wu tumbuluxile komiti yo tsundzuxa hi matirhelo, leyi rhangeriweke hi Ndzawulo ya Rihanyo ya Rixaka, ku hlamula eka ku tumbuluka ka kholera eHammanskraal eka City of Tshwane, leyi se yi nga koxa vutomi bya 15 ku fikela hi ti 24 Mudyaxihi 2023.
","Muvhuso wo vhumba komiti ya u shuma ya zwa thekiniki, ine ya khou langwa nga Muhasho wa Mutakalo wa Lushaka, nga murahu ha musi ho vha na tshiwo tsha vhulwadze ha Khoḽera ngei Hammanskraal kha Ḓorobo khulwane ya Tshwane, vhune ho no vhulaha vhathu vha swikaho 15 u swika zwino, nga ḽa 24 Shundunthule 2023.
",0.65951264
"Ku le ku endliweni ka ntirho lowukulu wo kambela swilo hinkwaswo leswi nga vaka swivangelo swa nthyakiso, ku nga va ku ri ku suka eka mati, mathangi lama phakelaka mati, tipompi na Mitirho yo Basisa Mati ya Soreji ya le Rooiwal (WWTW).
","Hu na mushumo muhulwane u re kati zwazwino wa u ita ndingo kha zwiko zwoṱhe zwine zwa nga vha zwi zwone zwo ḓisaho tshikafhadzo iyi, zwi nga vha zwiko zwa maḓi, maḽori a u ṋetshedza maḓi, dzibommbi na tshiimiswa tsha Mishumo ya u Kunakisa Maḓi a Mashika tsha Rooiwal (WWTW).
",0.6213962
"Ku fikela sweswi a ku se kumeka vumbhoni bya bakitheriya ya kholera eka tindhawu leti hinkwato, leswi nyikaka ku tshemba leswaku swi nga endleka leswaku ku hangalaka ka kholera swi nga va swi suka eka xivangelo xa nthyakiso xa ntirho wa siku rin’we, laha timhangu ta sweswi ti nga vaka ti vangiwa hi nthyakiso wa vumbirhi kumbe wa vunharhu.
","U swika zwino, a hu athu wanala vhuṱanzi vhu sumbaho uri ho wanala bakhitheria ya khoḽera kha zwiko izwi, zwine hezwi zwa ṋea fulufhelo ḽa uri hu na khonadzeo ya uri tshiwo itshi tsha khoḽera tshi nga vha tsho vha hone nga mulandu wa u tshikafhadzwa ho bvelelaho fhethu huthihi fhedzi, lune zwiwo zwi re hone zwazwino zwa nga vha zwo vha hone nga mulandu wa u tshikafhala ho vhangwaho nga zwiitisi zwa vhuvhili na zwa vhuraru (phiriselano).
",0.48219293
"Loko ku nghenelela loku ku ri karhi ku endliwa, vaaki va le Hammanskraal va khutaziwa ku virisa mati ya le tipompini na ku chela munyu wuntsongo loko va nga se ma nwa.
","Musi maga aya a u lingedza u tandulula thaidzo iyi a tshi khou ḓi bvela phanḓa, vhadzulapo vha fhaḽa Hammanskraal vha khou ṱuṱuwedzwa uri vha vhilise maḓi avho a bommbini nahone vha shele na muṋo muṱuku phanḓa ha musi vha tshi a nwa.
",0.58144426
"Ku engetela eka leswi, munhu un’wana na un’wana loyi a nga na nchuluko, ku hlamba timbilu kumbe ku vava ka le khwirini u fanele ku ya eka dokodela wa yena kumbe tliniki hi xihatla.
","Zwiṅwe hafhu, muthu muṅwe na muṅwe ane a vha na malani, u silingwa kana tsumbadwadze dza thaidzo ya tsukanyo, u tea uri nga u ṱavhanya a dalele dokotela wawe kana kiḽiniki ya henefho tsini nae.
",0.2286059
"Holobye wa mati na Mbhasiso, Tatana Senzo Mchunu, u ta hlangana na Meyara wa City of Tshwane, Cllr Cilliers Brink, hi Ravuntlhanu 26 Mudyaxihi 2023 ku ri matshalatshala yo hluvukisa kungu ro hlanganeriwa ra ku pfuxetiwa ka Rooiwal WWTW leswi a swi fanele swi endliwe khale.
","Minisṱa vha Muhasho wa Maḓi na Vhuthathazwitzhili, Vho Senzo Mchunu, vha ḓo vha na muṱangano na Ṋeḓorobo wa Ḓorobo khulwane ya Tshwane, Mukhantseḽara Vho Cilliers Brink, nga Ḽavhuṱanu, ḽa 26 Shundunthule 2023 u itela u lingedza u bveledza pulane yo ṱanganelaho ya mushumo wa u vusuluswa ha tshiimiswa tsha Rooiwal WWTW tshine tsho vha tsho tea tsho no vusuluswa kale.
",0.7646607
"Ku kuma mahungu hi xitalo u nga fonela nomboro ya 24 wa tiawara leyi vekeriweke Nhlangano wa Mavabyi yo Tlulela wa Rixaka (NICD) eka 082 883 9920.
","U itela u wana zwidodombedzwa zwinzhi, vha nga founela kha nomboro ya luṱingo ya Tshiimiswa tsha Malwadze a Phirela tsha Lushaka (NICD) i shumaho awara dza 24 nga ḓuvha kha 082 883 9920.
",0.73252904
"Swiletelo swa vutshunguri bya Kholera swi kumeka eka inthanete eka WEBTOKENkambisiso wa Vatirhi wa Kotara (QLFS)
","Tsumbamaitele dza u ilafha vhulwadze ha Khoḽera dzi wanala kha inthanethe kha WEBTOKEṰhoḓisiso dza zwa Vhashumi dza Kotara (QLFS)
",0.35337642
"Khabinete yi na matimba hi leswi QLFS ya kotara yo sungula ya 2023 yi nga komba ku tlakuka eka tikotara ta tsevu hi ku landzelelana eka nhlayo ya mitirho na leswaku ku thoriwa ka vanhu vo ringana wa timiliyoni swi le ku tshuneleleni eka vanhu va wa timiliyoni lava a va thoriwile loko ku nga se va na Khoronavhayirasi (COVID)-19.
","Khabinethe i khou ṱuṱuwedzwa nga fhungo ḽa uri QLFS ya u thoma ya ṅwaha wa 2023 yo sumbedzisa uri ho vha na nyengedzedzo ya vhurathi ya nga kotara nga u tevhekana kha tshivhalo tsha mishumo khathihi na uri zwa u tholwa ha vhathu vha swikaho miḽioni zwi khou vhonala zwi tshi khou ri sendedzela tsini na uri ri swike kha tshivhalo tsha miḽioni tsha vhathu vho tholiwaho kha maḓuvha a phanḓa ha tshiwo tsha dwadze ḽa Khoronavairasi (COVID-19).
",0.69191206
"Leswi swi veka erivaleni leswaku ikhonomi ya Afrika-Dzonga yi le ku vuyeleleni ku suka eka ntshikelelo wa ntungu wolowo.
","Hezwi zwi tou vha tsumbo i re khagala ya uri ikonomi ya Afrika Tshipembe i khou vhonala i tshi khou vhuyelela nga nḓila yo khwaṱhaho vhukuma u bva kha masiandaitwa a dwadze iḽo.
",0.45225918
"Tinhlayo ta matholelo ta kotara yo sungula ti komba leswaku ku tumbuluxiwile mitirho ya 209 000 eka sikitara ya ximfumo na 107 000 eka sekitara yo ka yi nga ri ya ximfumo eka kotara yo sungula ya lembe.
","Mbalombalo dza nga ha vhathu vhane vha khou shuma dza kotara ya u thoma dzo sumbedza uri ho sikwa mishumo i swikaho 209 000 kha sekhithara yo dzudzanyeaho ngeno miṅwe mishumo ya 107 000 yo sikwa kha sekhithara i songo dzudzanyeaho kha tshifhinga tsha kotara ya u thoma ya ṅwaha..Vhushaka ha shango ḽa Afrika Tshipembe na ḽa Amerika (US) Khabinethe yo ombedzela zwauri vhushaka vhukati ha shango ḽa Afrika Tshipembe na ḽa Amerika vhu kha ḓi vha havhuḓi, ho khwaṱha nahone vhune ha vhuedza masia oṱhe u swika zwino nga murahu ha muṱangano we wa vha hone vhukati ha Minisṱa vha Muhasho wa Vhushaka ha Dzitshaka na Tshumisano, Dokotela Vho Naledi Pandor na Muambasada wa ḽa Amerika fhano Afrika Tshipembe, Vho Reuben E Brigety, nga murahu ha maambiwa avho he khao vha vha vha tshi khou pomoka Afrika Tshipembe uri ḽo ṋetshedza zwiṱhavhane kha shango ḽa Russia.
",0.5662857
"Vuxaka bya Afrika-Dzonga – United States (US) Khabinete yi tiyisisile leswaku vuxaka exikarhi ka Afrika-Dzonga na US bya ha ri kahle, byi tiyile no vuyerisa matiko hinkwawo ku landza ku hlangana ka Holobye wa Vuxaka bya Matiko ya Misava na Ntirhisano, Dr Naledi Pandor na Muyimeri wa US eAfrika-Dzonga, Tatana Reuben E Brigety, mayelana na mavonelo ya yena lama hehlaka leswaku Afrika-Dzonga yi nyike Rhaxiya matlhari.
","Khabinethe yo dovha hafhu ya ombedzela zwauri hu na nḓila dzi ḓivheaho dza zwa vhudipuḽomati dzine dza tea u shumiswa nga tshaka dzoṱhe, hu tshi katelwa na shango ḽa US, kha u bvisela khagala thaidzo dzine vha vha nadzo zwenezwo musi dzi tshi tutuwa kha zwa kulangelwe kwa vhushaka ha vhavhili.
",0.65201604
"Khabinete yi tlhele yi vula leswaku tindlela leti tshamisekeke ta vuxaka bya matiko ti kona eka tinxaka hinkwato, ku katsa US, ku boxa timhaka loko ti tshuka ti va kona eka mafambiselo ya vuxaka bya matiko mambirhi.
","Khabinethe yo ṱanganedza nḓivhadzo nga Phresidennde Vho Cyril Ramaphosa ya u vhumbwa ha ṱhoḓisiso yo ḓiimisaho nga yoṱhe ya u ṱoḓisisa mavharivhari a u ṋetshedzwa ha zwiṱhavhane zwi bvaho fhano kha ḽa Afrika Tshipembe zwi tshi ṋewa shango ḽa Russia.
",0.5910085
"Khabinete yi amukerile xitiviso xa President Cyril Ramaphosa xa ku tumbuluxiwa ka ndzavisiso lowu tiyimeleke ku lavisisa swihehlo swa ku nyikiwa ka Rhaxiya matlhari yo suka eAfrika-Dzonga.
","Zwidodombedzwa zwa ṱhoḓisiso iyo zwi ḓo ḓivhadzwa musi tshifhinga tshi tshi swika.
",0.19171354
"Vuxoxkoxoko bya ndzavisiso byi ta tivisiwa hi nkarhi lowu faneleke.
","Vhushaka vhukati ha shango ḽa Afrika Tshipembe na ḽa Singapore
",0.3059648
"Vuxaka bya Afrika-Dzonga – Singapore Presidente Ramaphosa u rhurhele Holobyenkulu Lee Hsien Loong wa Rhiphabliki ra Singapore hi Ravumbirhi, 16 Mudyaxihi 2023.
","Phresidennde Vho Ramaphosa vho ṱanganedza Minisṱa Muhulwane wa Riphabuḽiki ya Singapore Vho Lee Hsien Loong nga Ḽavhuvhili, ḽa 16 Shundunthule 2023.
",0.7924376
"Singapore i muvekisi wa nkoka laha Afrika-Dzonga, hi vuvekisi bya ntsengo wo hundza R5 wa tibiliyoni eka tisekitara to fana na vumaki, vukorhokeri bya timali na tinhundzu ta tindlu na misava.
","Shango ḽa Singapore ndi mubindudzi muhulwane fhano kha ḽa Afrika Tshipembe, hune ha vha na vhubindudzi ha masheleni a fhiraho R5 biḽioni kha sekhithara dzi fanaho na zwa vhumagi, tshumelo dza zwa masheleni na zwa ndaka.
",0.69585943
"Mitwanano leyi sayiniweke exikarhi ka matiko lamambirhi ti lava ku tiyisa bindzu, vuvekisi, dyondzo na ntirhisano wa vusirheleri..Imbizo ya Presidente ya Xikombiso xa Nhluvukiso ya le ka Xifundza xa Kapavupeladyambu (DDM) Presidente Ramaphosa u yisile DDM ya Imbizo ya Presidente ya vutsevu eKapavupeladyambu, eka Masipala wa Muganga wa Drakenstein, eka Xifundza xa Cape Winelands, hi Ravuntlhanu, 19 Mudyaxihi 2023.
","Thendelano dzo sainwaho vhukati ha mashango aya mavhili ndi dzine dzo livhiswa kha u khwaṱhisa mbambadzo, vhubindudzi, pfunzo na tshumisano kha zwa vhupileli..Imbizo ya Phresidennde ya nga ha Ḽiedza ḽa Mveledziso ya Tshiṱiriki tsha Kapa Vhukovhela (DDM)
",0.7140819
"Presidente u rhangele vurhumiwa ku suka eka swiyenge hinkwaswo swa mfumo ehansi ka Nhlokomhaka leyi nge: “Ku nga Siyiwi Munhu Ehandle”.
","Phresidennde Vho Ramaphosa vho fara Imbizo ya Phresidennde ya vhurathi ya nga ha DDM ya fhaḽa Kapa Vhukovhela, kha Masipala Wapo wa Drakenstein, kha Tshiṱiriki tsha Cape Winelands, nga Ḽavhuṱanu, ḽa 19 Shundunthule 2023.
",0.54007965
"Imbizo yi rhangeriwile hi rendzo ra Presidente ro ya eka Nhluvukiso wa Matshameloo ya Vanhu hi Xihatla bya le ka ndhawu ya le kusuhi eVlakkeland, lowu nga nhluvukiso lowukulu wa tindlu ta mfumo ku fikela sweswi eka Masipala wa Muganga wa Drakenstein.
","Phresidennde vho ranga phanḓa vhurumelwa vhu bvaho kha masia mararu a muvhuso nga fhasi ha thero ine ya ri: “A hu Tei U vha na Tsaleli”.
",0.63642687
"Nhluvukiso lowu wu sunguleke hi 2017 loko wu hela wu ta nyika vavuyeriwa lava fikelelaka tindlu ta 2 556.
","Imbizo iyi yo vha yo rangelwa phanḓa nga madalo a Phresidennde kha vhupo vhu re henefho nga tsini ha Tshiṱuṱuwedzi tsha Mveledziso ya Vhudzulo ha Vhathu ha Vlakkeland, vhune ha vha vhupo vhuhulwanesa ha mveledziso ya vhudzulo ha tshitshavha u swika zwino kha Masipala Wapo wa Drakenstein.
",0.43242174
"Ku akiwa ka tindlu ta 942 eka Xiphemu xo Sungula swi le ku yeni emahlweni, laha 454 ti nga hela na 301 ti nga eku akiweni.
","Mveledziso ye ya thomiwa nga ṅwaha wa 2017 dzi ḓo ri musi dzi tshi khunyeledzwa, dza ṋetshedza madzulo a swikala 2 556 kha vhathu vho teaho vhane vha tea u vhuelwa.
",0.52254677
"Nkoka wa phurojeke leyi hi leswaku yi nyika swilangwa swo hlaya swa tindlu ku suka eka lava holaka R0 kufika R3 500 (ehansi ka ku Endla swa Kahle ro Sungula), ku ya eka Nongoloko wa Mpfuneto wa Vanhu lowu Fambelanaka na Mali eka lava holaka exikarhi ka R3,501 na R22 000 hi lembe.
","Zwa u fhaṱwa ha nnḓu dzi swikaho 942 kha Luṱa lwa u Thoma zwazwino zwi kati, lune ho no khunyeledzwa dziṅwe dzi swikaho 454 ngeno dziṅwe dza 301 hu hone dzi tshi kha ḓi vha kati na u fhaṱiwa.
",0.65431845
"Swivandlanene haswimbirhi swa Tindlu ta Vaaki xikan’we na Swivandlanene swa Khale ka Tinhenha ta Nyimpi swa kumeka eka phurojeke leyi.
","Ndeme ya thandela iyi ndi ya uri i ṋetshedza tshaka dzo fhambanaho dza dzinnḓu u bva kha idzo dza avho vhane vha vha na muholo wa vhukati ha R0 u swika R3 500 (nga fhasi ha u Vula Nḓila Ntswa), u ya kha Mbekanyamushumo ya Sabusidi ya Muthu Muthihi yo Ṱumanywaho na Masheleni, kha avho vhane vha hola muholo wa vhukati ha R3,501 na R22 000 nga ṅwaha.
",0.56188595
"Rendzo ra Vulanguteri ro ya eka Masipala wa Dorobankulu ra eThekwini na Masipala wa Xifundza xa uMgungundlovu hi ti 18 na ti 19 Mudyaxihi 2023.
","Zwoṱhe zwikhala zwa Nnḓu dza zwa Matshilisano khathihi na zwikhala zwa Nnḓu dza Vhahali vha zwa Mmbi zwi a wanala kha thandela iyi.
",0.5906569
"Xandla xa Presidente Paul Mashatile u tihlanganisile na vatekaxiave va le ka dyondzo na vuleteri, vurimi, mabindzu na vumaki hi nkarhi wa rendzo ra vulanguteri ro ya eka Masipala wa Dorobankulu ra eThekwini na Masipala wa Xifundza xa uMgungundlovu tanihi xiphemu xa marendzo ya vulanguteri ya DDYin’wana ya tiphurojeke ta nkoka leti endzeriweke i ndhawu ya Phurojeke ya Xihatla ya le Ntshongweni, laha ku nga eku akiweni ka Doroba ra Manyunyu exikarhi ka Durban na Pietermaritzburg.
","Madalo a Vhulavhelesi kha Masipala Muhulwane wa eThekwini na kha Masipala wa Tshiṱiriki wa uMgungundlovu nga ḽa 18 na 19 Shundunthule 2023.
",0.7494581
"Phurojeke yi ta pfuxelela migingirko ya ikhonomi ya ndhawu leyi, leyi nyikaka kwalomu ka R15 wa tibiliyoni ta vuvekisi eka malembe lama taka ya 10 ku ya eka Swipfuno swa mati
","Muthusaphresidennde Vho Paul Mashatile vho amba na vhathu vha kwameaho u bva kha zwa pfunzo na vhugudisi, vhulimivhufuwi, makwevho na nḓowetshumo nga tshifhinga tsha madalo avho a zwa vhulavhelesi fhaḽa kha Masipala Muhulwane wa eThekwini na kha Masipala wa Tshiṱiriki wa uMgungundlovu sa tshipiḓa tsha madalo a vhulavhelesi a DDIṅwe ya thandela dza ndeme dze dza dalelwa, ho vha vhupo ha Thandela ya Tshanduko ya Ntshongweni, hune ha vha vhupo vhune khaho ha khou fhaṱiwa Ḓorobo yo Bveledzeaho kha zwa Thekhinoḽodzhi vhukati ha ḓorobo ya Durban na ya Pietermaritzburg.
",0.46318358
"Presidente Ramaphosa u endzerile Lesotho Highlands Water Project hi Ravumbirhi, 23 Mudyaxihi 2023 laha a nga nghenelela eka ntirho wo sungula ku aka wa Xiyenge xa 2 xa phurojeke.
","Thandela iyi i ḓo vusulusa mishumo ya zwa ikonomi kha vhupo honoho, lune ya ḓo ḓisa vhubindudzi vhu linganaho R15 biḽioni kha tshifhinga tsha miṅwaha ya 10 u ya kha ya 15 i ḓaho.
",0.6616032
"Yi sayiniweke eka malembe lama nga hundza no va yi hlwerile ku hela, ntirho lowu wu kombisa ku hatlisisiwa ka migingiriko leyi ya nkoka ya matiko mambirhi.
","Themamveledziso dza maḓi
",0.25643674
"Lesotho Highlands Water Project yi na nkoka eka ku tiyisisa ku hlayisiwa ka mphakelo wa mati eGauteng, Free State, Mpumalanga, North West na Northern Cape.
","Phresidennde Vho Ramaphosa vho dalela Thandela ya Maḓi ya Lesotho Highlands nga Ḽavhuvhili, ḽa 23 Shundunthule 2023 he vha shela mulenzhe kha vhuṱambo ha u vula Luṱa lwa 2 lwa thandela iyi.
",0.6606116
"Vuvekisi eka switirhisiwa swa mati ku antswisa vutomi bya MaAfrika-Dzonga swi ya emahlweni hi ku averiwa ka ku tlula R14 wa mabiliyoni eka timasipala ku lulamisa ku salela endzhaku ka switirhisia swa mati, hi ku tirhisa Nyiko ya Switirhisiwankulu swa Xifundza (RBIG) na Nyiko ya Switirhisiwa swa Vukorhokeri bya Mati (WSIG).
","Sa thandela yo sainiwaho miṅwaha minzhi yo fhelaho nahone ya dovha ya vha na tshilengo, hovhu vhuṱambo ho sumbedza ndeme ya u engedzwa ha luvhilo lwa u shumiwa ha thandela iyi ine ya vha mushumo wa ndeme wa vhukati ha mashango aya mavhili.
",0.6662047
"RBIG yi ta tirhisiwa eka tiphurojeke ta 130 kasi WSIG yi ta averiwa tiphurojeke to tlula 400 etikweni hinkwaro.
","Heyi Thandela ya Maḓi ya Lesotho Highlands ndi ya ndeme kha u ita uri hu vhe na nḓisedzo ya maḓi kha vunḓu ḽa Gauteng, Free State, Mpumalanga, Devhula Vhukovhela na Kapa Devhula.
",0.5765391
