src_text,tgt_text,cosine_score
"The President, the Minister of Water and Sanitation and the Executive Mayor of Tshwane were able to assess government interventions in the area and provide relevant feedback to residents.
","Izingenelelo zikahulumeni zibandakanya ukusebenza kwesibhedlela sesikhashana esingumahambanendlwana eKanana, e-Hammanskraal, kanye nethimba longoti abanamakhono ehlukahlukene abazonqanda ukubhebhetheka nasebelaphe ngempumelelo amakhulu abantu.
",0.72182316
"Government interventions include the field hospital operational in Kanana, Hammanskraal, and a multi-disciplinary team of experts to arrest the spread which has successfully treated hundreds of people.
","Umsebenzi uyaqhubeka ukuqinisekisa ukuthi imikhandlu yendawo isebenzisa izibonelelo zengqalasizinda yamanzi ngendlela efanele.
",0.5766386
"Work is also underway to ensure that local councils use their water infrastructure grants effectively.
","Kunyakamali wamanje, ingaphezu kwezigidigidi ezi-R14 imali ebekelwe ukuthi omasipala babhekane nokusilela emuva kwengqalasizinda yamanzi.
",0.6522162
"For the current financial year, over R14 billion has been set aside for municipalities to address water infrastructure backlogs.
","IKhabhinethi liyakwamukela ukusebenzisana phakathi kweDolobha lase-Tshwane kanye noMnyango Wezamanzi Nokuthuthwa Kwendle ohlelweni lokulungisa isiHlanzimanzi i-Rooiwal, okuzokwenzeka ngokwezigaba ezintathu ezizodla izigidigidi ezi-Ikhabhinethi licela imiphakathi ethintekile ukuthi ihlale iqaphile futhi inakekele kakhulu abantwana.
",0.66894627
"Cabinet welcomes the cooperation between the City of Tshwane and Department of Water and Sanitation on the planned upgrade of the Rooiwal Water Treatment plant, which will be undertaken over three phases at a cost of R4 billion.
","ISifo Sohudo singagwemeka ngokusebenzisa amanzi aphephile.
",0.48054692
"Cabinet calls on the affected communities to remain vigilant and to take special care of children.
","Hlanza amanzi ngokuwabilisa kuqala okungenani umzuzu owodwa futhi uhlanze izandla zakho ngamanzi ahlanzekile nensipho.
",0.5485142
"Cholera can be prevented by using safe water.
","Ngeminye imininingwane ngamasu okugwema lesi sifo vakashela WEBTOKEN Uhulumeni ubonga lezo zinhlangano zamavolontiya kanye nabantu abeze ngaphambili bazofaka isandla..UMbiko Wokuhlanzeka Kwamanzi
",0.57477796
"Treat the water first by boiling it for at least 1 minute and always wash your hands with clean water and soap.
","IKhabhinethi lamukele ukwethulwa futhi kohlelo lwe-Blue, Green and No Drop Watch olwagcina ukwenziwa ngowezi-2013 nowezi-2015.
",0.55626804
"For more information on prevention tips WEBTOKEN Government thanks those volunteer organisations and individuals who have stepped forward to lend a hand.
","Izinhlelo ze-Green, Blue and No Drop Certification ziyizindlela zokulawula zoMnyango Wezamanzi Nokuthuthwa Kwendle (i-DWS) njengomlawuli womkhakha wezamanzi ngokoMthetho Kazwelonke Wezamanzi kanye noMthetho Wezinsizakalo.
",0.6203215
"Water Quality Report
","Inhloso yale ndlela yokulawula ehlukile yaseNingizimu Afrika ngukwenza ngcono ukuhlanzeka kwamanzi aphuzwayo komasipala, ukulawulwa kwamanzi angcolile kanjalo nokugcinwa kwamanzi nokulawula indlela amanzi adingeka ngayo.
",0.4416238
"Cabinet welcomed the reintroduction of the Blue, Green and No Drop Watch which were last conducted in 2013 and 2015 respectively.
","IKhabhinethi lixoxisane kabanzi ngemiphumela kanye nemithelela yemibiko ye-Blue, Green and No Drop Watch yangowezi-2023, eyakhishelwa emphakathini ngoLwesibili, mhla wesi-6 kuNhlangulana.
",0.7575299
"The Green, Blue and No Drop Certification programmes are regulatory mechanisms of the Department of Water and Sanitation (DWS) as the water sector regulator in terms of both the National Water Act and Water Services Act, DWS
","IMibiko ibonisa ukuthi kube nokwehla kumgangatho wokuhlanzeka kwamanzi aphuzwayo kanye nokwenyuka kwamanzi amoshekayo kusukela kwakhishwa imibiko yokugcina.
",0.61391485
"The aim of this uniquely South African regulatory tool is to improve municipal drinking water quality, wastewater management as well as water conservation and demand management.
","IKhabhinethi lamukela izinyathelo ezizothathwa nguMnyango Wezamanzi Nokuthuthwa Kwendle zokubhekana nesimo samanje esihlobene nokulawulwa kwamanzi namanzi angcolile.
",0.70633227
"Cabinet deliberated on the results and implications of the 2023, Blue, Green and No Drop Watch reports, which were made public on Tuesday, 6 June.
","UNgqongqoshe Wezamanzi Nokuthuthwa Kwendle emavikini alandelayo uzomemezela lezi zinyathelo iSifundazwe ngasinye..Ezamandla
",0.5897485
"The Watch Reports indicate that there has been a decline in drinking water quality and an increase in non-revenue water since the last Drop reports were issued.
","IKhabhinethi lamukele izingxoxo zakamuva phakathi kukaNgqongqoshe Kagesi, uDkt Kgosientsho Ramokgopa kanye noNgqongqoshe wase-Mozambique Wezezimbiwa Nezamandla, u-Carlos Zacarias, ukuze kuzotholakala ugesi owengeziwe osuka e-Mozambique ukuseka isizinda sikazwelonke sikagesi.
",0.6622195
"Cabinet welcomes measures to be taken by the Department of Water and Sanitation to address the current state of affairs in relation to water and waste water management.
","Okwamanje, i-Mozambique ingakwazi ukuthi ihlinzeke ngama-80MW bese kuthi amanye ama-1000MW esikhathini esingengakanani esizayo.
",0.5153793
"The Minister of Water and Sanitation will in the following weeks announce these measures per Province.
","IKhabhinethi liyaqhubeka nokunxusa abantu baseNingizimu Afrika ukuthi beseke umkhankaso Wokulawula Ukudingeka Kukagesi Ebusika owethulwa nguNgqongqoshe Kagesi, ngenhloso yokonga ugesi ukuze kuzoncishiswa ukusindwa kwesizinda sikazwelonke sikagesi kanye nokusiza ukwehlisa izigaba zokucinywa kukagesi ngenhloso yokuwonga kulobu busika.
",0.5494175
"Energy Cabinet welcomed the recent deliberations between the Minister of Electricity, Dr Kgosientsho Ramokgopa and the Mozambican Minister for Mineral Resources and Energy, Carlos Zacarias, to secure additional power from Mozambique to support our national grid.
","IKhabhinethi lithole umbiko owenziwe nguNgqongqoshe Kagesi ochaza kabanzi okuzuziwe kamuva ekulawulweni kweziteshi zikagesi kanye neminye imisebenzi, isibonelo, evimbele ukuthi kube nesidingo sokuthi u-Eskom ashise udizili kule mpelasonto edlule nokuvimbele ukucinywa kukagesi ngenhloso yokuwonga.
",0.7083014
"In the immediate term, Mozambique can provide 80MW and a further 1000MW over the medium term.
","UNgqongqoshe Kagesi uzokwethulela kafushane abezindaba kusasa ngehora le-14:00, ngoLwesihlanu, ngalokhu kanye nokunye okwenzekayo.
",0.60139865
"Cabinet continues to urge South Africans to support the Winter Demand Management campaign launched by the Minister of Electricity, to save electricity to reduce strain on the national grid and help lower load shedding stages this winter.
","I-Operation Vulindlela
",0.3239811
"Cabinet received a report by the Minister of Electricity which detailed recent gains in the management of power stations and other operations which, for example, overcame the need for Eskom to burn diesel this past weekend and avoid load shedding.
","IKhabhinethi lamukele inqubekelaphambili yohlelo lwe-Operation Vulindlela njengokuchaza kukaNgqongqoshe eHhovisini likaMongameli, uKhumbudzo Ntshavheni, mayelana nokuqaliswa kwezinguquko zezakhiwo emikhakheni yezokuthunyelwa kwezamandla, ingqalasizinda yezokuthunyelwa kwempahla, ezokuxhumana ngokwedijithali kanye nezimvume zokungena nokuphuma kwamanye amazwe.
",0.7342229
"The Minister of Electricity will brief media at 14h00 tomorrow, Friday, on these and other developments.
","Inani lezinguquko eseziphothuliwe likhuphuke lisuka kwezintathu laya kweziyi-11, lapho ezinye eziyi-14 sizaqhubeka.
",0.58182937
"Operation Vulindlela
","Lapho kugxilwe khona kakhulu kusekuxazululeni inkinga kagesi kanye nokuthuthukisa ukusebenza kahle kojantshi nezitimela ezithwala impahla, kokubili okusemahlombe okukhula komnotho..UMkhandlu Wokuxhumanisa KaMongameli
",0.4796325
"Cabinet welcomed the progress under the operation Vulindlela as detailed by the Minister in the Presidency, Khumbudzo Ntshavheni, with regard to the implementation of structural reforms in the areas of energy supply, logistics network and infrastructure, digital communications and the visa regime.
","IKhabhinethi leseke isicelo sikaMongameli u-Cyril Ramaphosa ngesikhathi somhlangano woMkhandlu Wokuxhumanisa KaMongameli mhla zi-2 kuNhlangulana 2023 sokusheshisa ukuthunyelwa kwezidingonqangi njengendlela yokuphendula izidingo zemiphakathi.
",0.70334667
"The number of completed reforms has risen from three to 11, while a further 14 reforms are on track.
","UMongameli uyalele uMkhandlu ukuthi usheshise ukuthunyelwa kwezidingonqangi futhi uxazulule izinselele ezihlobene nokushaywa komthetho, ukuphatha kanye nezithiyo kwezamakhono.
",0.53194886
"The primary focus is on addressing the electricity crisis and improving the efficiency of freight rail, both of which are weighing heavily on economic growth.
","Umhlangano uphinde wabheka izinguquko kuMthetho Wezamanzi kanye noMthetho Wezinsizakalo Zamanzi ngenhloso yokuhlinzeka ukuthunyelwa okungcono kwamanzi.
",0.6905564
"President’s Coordinating Council
","Ngokufanayo, uMkhandlu waziswe kafushane ngezingenelelo zoMnyango Wezokuthutha ngomsebenzi ophuthumayo kanye nomsebenzi wokunakekela, kanjalo nokudluliselwa kwemigwaqo emikhulu isuka emagunyeni esifundazwe iye kuzwelonke ukuze kuzophathwa kangcono imigwaqo yezifundazwe yi-Ejensi Kazwelonke Yezemigwaqo eNingizimu Afrika..ISikhungo i-Batyi Automotive Component Supply IKhabhinethi lamukele ukuvulwa kweSikhungo i-Batyi Automotive Component Supply (i-BACS) ePitoli lokho okuqinisekisa indawo yaleli lizwe njengezwe emhlabeni eliyingxenye yomkhakha wezokukhandwa kwezimoto.
",0.42484757
"Cabinet supported President Cyril Ramaphosa’s call during the meeting of the President’s Coordinating Council on 2 June 2023 to accelerate service delivery in response to the needs of communities.
","I-BACS ingumkhiqizo wesikhungo esakha izimoto sakwa-Ford Motor Company kanye no-Motherson, okuyibona abahlinzeki bopende ofazwayo kanye nezingxenye zemoto.
",0.6251701
"The President directed the Council to accelerate service delivery improvement and address challenges in relation to legislation, governance and capacity constraints.
","Lesi sikhungo seseka abahlinzeki abamnyama ukuthi bazimele futhi bancintisane nomhlaba emva kokuthola iziqu zabo eZifundweni Zokwakhwa izimoto eSikhungweni Semboni Yokwakhiwa Kwezimoto (i-AIDC).
",0.6716858
"The meeting also considered reforms to the Water Act and Water Services Act to provide for better service delivery of water.
","Isikhungo se-BACS njengamanje siqashe abantu abangama-60, abangama-30 basebenza emini, bese kuthi abanye abangama-30 basebenza ebusuku.
",0.5598311
"Similarly, the Council was briefed on interventions by the Department of Transport for emergency work and routine maintenance, as well as primary road transfers from provincial authorities to the national road network for better management of provincial roads by the South African National Roads Agency Limited..Batyi Automotive Component Supply Facility
","Ngaphezu kwalokhu, sibheke ekuthatheni intsha ezoqeqeshwa ukuze izothuthukisa amakhono ayo..UMklamo Wezindlu Zokuhlala e-Lufhereng IKhabhinethi lamukele ukwethulwa koMklamo Wezindlu Zokuhlala e-Lufhereng e-Soweto nguMnyango Wezokuhlaliswa Kwabantu, onezindlu ezingama-407 zokurenta ezabantu abathile.
",0.7429899
"Cabinet welcomed the opening of the Batyi Automotive Component Supply (BACS) Facility in Pretoria which cements the country’s position as a global player in the automotive sector.
","Uhlelo lukahulumeni lwezindlu zokuhlala luhlanganisa abantu abahola imiholo ehlangene, luqeda ukusilela emuva ekwakhiweni kwezindlu futhi lusondeza eduze namathuba omnotho kulabo bantu abahlala ngemuva kwamajalidi kanye nasemikhukhwini..INgqalasizinda Yomgwaqo
",0.6802766
"BACS is a product of an incubation centre by Ford Motor Company and Motherson, a supplier of spray painting and components.
","Ukuvulwa komklamo womgwaqo obiza izigidi ezingama-R56 e-Estcourt, KwaZulu-Natali, kuyingxenye yemizamo kahulumeni yokuthuthukisa ukuthunyelwa kwempahla emadolobheni asemakhaya.
",0.7026637
"The centre supports black suppliers to be independent and globally competitive after graduating from the Automotive Industry Development Centre (AIDC’s) Incubation Programme.
","Umsebenzi owenziwe kumklamo womgwaqo ubandakanya ukwakhiwa kabusha komgwaqo wobhuqu wase-D1252 ube yitiyela.
",0.6028799
"The BACS facility currently employs 60 people, with 30 working the day shift, and 30 the night shift.
","Umgwaqo uphumela kumgwaqo omkhulu u-N3, ohlanganisa iTheku neGoli, lokho okuzovulela intsha yendawo engasebenzi amathuba kanye nosonkontileka abasafufusa.
",0.68108314
"Moreover, it is looking at bringing in young trainees to further develop their skill sets.
","Ngempahla engaphezu kwamaphesenti angama-60 ehanjiswa ngomgwaqo u-N3, ukulungiswa komgwaqo kuzoqinisekisa ukuhanjiswa kwempahla nezinsizakalo kuyoyonke iNingizimu Afrika ne-Afrika eseNingizimu ye-Sahara..Ukubambisana Nomphakathi
",0.5601107
"Lufhereng Social Housing Project
","IKhabhinethi lamukele ukubambisana nenkampani yemayini i-Impala Platinum e-Rustenburg ukuze kwakhiwe umtholampilo kanye nesikhungo senkulisa njengengxenye yoHlelo Lwezenhlalakahle Nezabasebenzi.
",0.58430374
"Cabinet welcomed the Department of Human Settlements’ launch of the Lufhereng Social Housing Project in Soweto, which consists of 407 units of rental stock for targeted beneficiaries.
","UMtholampilo wase-Freedom Park kanye neSikhungo Senkulisa zidluliselwe kuMnyango Wezempilo kanye noMnyango Wemfundo Eyisisekelo eSifundazweni saseNyakatho Ntshonalanga..Ukusebenzisana phakathi kukahulumeni namabhizinisi ahlelekile
",0.6799319
"Government’s social housing programme integrates mixed-income groups, curbs the housing backlog and brings backyard and informal settlement dwellers closer to economic opportunities.
","IKhabhinethi lamukele ukusebenzisana phakathi kukaHulumeni namabhizinisi ahlelekile ukuthi kusetshenziswane ekususeni izingqinamba ezivimbela ukukhula komnotho ofaka wonke umuntu kanye nokusungulwa kwemisebenzi.
",0.73877645
"Road Infrastructure
","Izingxenye ezibekwe eqhulwini ezamandla, ezokuthuthwa kwempahla kanye nokulwa nobugebengu nenkohlakalo, kanye nomunye umsebenzi owenziwayo ohlelweni lokusungula imisebenzi..Ezokuphepha Nokuvikeleka
",0.4732772
"The opening of the R56 million road project in Estcourt, KwaZulu- Natal, is part of government’s efforts to improve logistic connectivity in rural towns.
","Ukuqapha nokuvikela imiphakathi ethintwe udlame, uPhiko Lwamaphoyisa eNingizimu Afrika selubeke eceleni cishe izigidigidi ezi-R2 ukuze kuzothengwa ama-drone kanye nezimoto ukuze kuzokwanda ukubonakala kwamaphoyisa emphakathini.
",0.7109914
"Work done on the road project included the upgrading of the D1252 from gravel to tar roads.
","Izigidi ezingama-R65 nazo zibekelwe iziteshi ezingama-30 ezihamba phambili ngokuba nobugebengu ukuze zizolwa nokubulawa kwabantu namanye amacala.
",0.65619636
"The road links to the N3, which connects eThekwini and Johannesburg, opening opportunities for local unemployed youth and emerging contractors.
","Ngaphezu kwalokhu, ama-Tactical Response Team ayatshalwa eziteshini nasezifundeni ezindaweni ezinamazinga aphezulu obugebengu.
",0.61548305
"With more than 60 per cent of goods transported through the N3 corridor, the road upgrade will further facilitate the efficient movement of goods and services to the rest of South Africa and Sub-Saharan Africa..Social Partnership
","UPhiko Lwamaphoyisa eNingizimu Afrika luthuthukisa amaqembu okuthungatha amacala akhethekile, azoqeqeshwa esigabeni sesifundazwe nakwisifunda ukuze ezothungatha aphinde abophe izigilamkhuba..IThimba Lophenyo Elizimele
",0.70398724
"Cabinet welcomed the partnership with mining company Impala Platinum in Rustenburg on the building of a clinic and early childhood development centre as part of its Social and Labour Plan.
","IKhabhinethi lamukele ukuthi uMongameli u-Cyril Ramaphosa abeke ithimba elizimele lamalungu amathathu elizophenya ngezimo zokuboshwa komkhumbi wase-Russia owaziwa ngelika-Lady Ithimba osihlalo lalo iPhini laphambilini likaMongameli wamaJaji eNkantolo ePhakeme eNingizimu ye-Gauteng uJaji Phineas Mojapelo linikezwe amaviki ayisithupha ukuhlolisisa ukuthi ngabe izibopho zomthethosisekelo, ezomthetho kanye nezinye zagcinwa na ngesikhathi kuboshwa umkhumbi e-Simon’s Town, eKapa, futhi lizokwethula umbiko walo kuMongameli..Izithunywa ezizoya emazweni e-G7
",0.748121
"The Freedom Park Clinic and an Early Childhood Development Centre were handed over to the Departments of Health and Basic Education in the North West Province.
","IKhabhinethi lamukele isinqumo sikaMongameli u-Cyril Ramaphosa sokuthumela izithunywa zongqongqoshe ukuthi bayohlangana neQembu Lamazwe Ayisikhombisa (i-G7) ukuze beyochaza ukuthi iNingizimu Afrika ayihlangene neze nempi ephakathi kwe-Russia ne-Ukraine.
",0.646677
"Partnership between government and organised business
","Iqembu lezithunywa lizobandakanya uNgqongqoshe Wezobudlelwano Bamazwe Ngamazwe Nokusebenzisana u-Naledi Pandour, uNgqongqoshe Wezohwebo, Izimboni Nokuncintisana u-Ebrahim Patel, uNgqongqoshe Wezezimali u-Enoch Godongwana kanye noNgqongqoshe weHhovisi LikaMongameli u-Khumbudzo Ntshavheni..Amalungiselelo eNgqungquthela ye-BRICS
",0.5141773
"Cabinet welcomed the partnership initiative between Government and organised business to actively work towards removing obstacles to inclusive economic growth and job creation.
","Ukulungiselela iNgqungquthela ye-BRICS ezayo kusuka mhla wama-22 kuya mhla wama-24 kuNcwaba 2023, iNingizimu Afrika isingathe ngempumelelo uMhlangano Wongqongqoshe Bamazwe e-BRICS mhla lu-1 kuNhlangulana 2023 eKapa.
",0.61165714
"The current priority areas are in energy, logistics and crime and corruption fighting, with further work being done in pursuit of the jobs agenda.
","IKhabhinethi likuphawulile ukushicilelwa kusomqulu kwesaziso soMthetho Wamalungelo Nokuvikeleka Kwamanxusa, okuyinto eyenziwayo uma kunezingqungquthela zamazwe ngamazwe ezizobanjelwa eNingizimu Afrika.
",0.65950227
"Safety and security
","Izindlela zokuvikeleka zenzelwe ingqungquthela yonke hhayi abantu abathile.
",0.35749578
"To monitor and protect communities affected by crime, the SA Police Service has set aside nearly R2 billion to procure drones and vehicles to enhance visibility.
","Lokhu kungukuhlinzeka ngezokuvikeleka okujwayelekile esikwenzayo kuzo zonke izinkomfa nezingqungquthela zamazwe ngamazwe ezibanjelwa eNingizimu Afrika ngaphandle kokubheka ukuthi bangakanani abantu abazoba yingxenye yayo.
",0.5598299
"R65 million has also been allocated to the top 30 crime-intensive stations to address murder and other contact offences.
","Zenzelwe ukuvikela ingqungquthela kanye nezethameli zayo ukuthi izwe lingasebenzisi amandla alo njengezwe elisingathile kuze kuphele ingqungquthela.
",0.5793668
"In addition, Tactical Response Teams are being deployed at stations and districts in areas with high crime rates.
","Izinqumo zeKhabhinethi.
",0.24414347
"The South African Police Service is also enhancing specialised tracking teams, who will be trained further at provincial and district level to effectively track and apprehend offenders.
","IMibiko Yakabili Ngonyaka yeNqubekelaphambili Yomsebenzi
",0.4137024
"Independent Panel of Inquiry
","IKhabhinethi ligunyaze imibiko yakabili ngonyaka yenqubekelaphambili yomsebenzi yesikhathi sikaMfumfu 2022 kuya kuNdasa 2023 eba yingxenye yoHlakamsebenzi Lweqhingasu Lesikhathi Esiphakathi (i-MTSF) lwangowezi-2019-2024.
",0.374879
"Cabinet welcomed the appointment by President Cyril Ramaphosa of a three-member independent panel to enquire into the circumstances of the docking of the Russian vessel known as Lady The panel chaired by former Deputy Judge President of the South Gauteng High Court Justice Phineas Mojapelo has been given six weeks to evaluate whether constitutional, legal or other obligations were fulfilled or violated when the vessel docked in Simon’s Town, Cape Town, and will report their findings to the President..Envoys to G7 countries
","UMnyango Wezokuhlela, Ukuqapha Nokuthuthukisa, kuzothi evikini noma kwamabili ezayo lazise izwe ngemininingwane mayelana nale mibiko yenqubekelaphambili.
",0.5972167
"Cabinet welcomed President Cyril Ramaphosa’s decision to send ministerial envoys to meet Group of Seven (G7) countries to explain the country’s non-aligned stance on the Russia-Ukraine war.
","Isikhathi esibuyekezwayo sihambisane nokuphazanyiswa ukucinywa kukagesi ngenhloso yokuwonga lokho okuhambise ngonyawo lonwabu imisebenzi yomnotho futhi kwaphazamisa ukulethwa kwezidingonqangi ezweni.
",0.6440227
"The envoys will include International Relations & Cooperation Minister Naledi Pandor, Trade, Industry & Competition Minister Ebrahim Patel, Finance Minister Enoch Godongwana and Minister in the Presidency Khumbudzo Ntshavheni.
","Noma kunjalo, iKhabhinethi lithokoze kakhulu ngenqubekelaphambili esiyenziwe ekuqalisweni lokho abakwazile ukuthi kwenziwe.
",0.4639244
"BRICS Summit Preparations
","IKhabhinethi liphinde laphawula izinhlelo zokuhlenga ezihlosiwe ezethulwe ngamaklasta ngokulandelana kwawo.
",0.53067154
"In preparation for the upcoming BRICS Summit from 22 to 24 August 2023, South Africa successfully hosted the BRICS Foreign Ministers Meeting on 1 June 2023 in Cape Town.
","NgoMfumfu wezi-2019, iKhabhinethi lagunyaza i-MTSF, njengohlelo lukahulumeni lweminyaka emihlanu lokuqaliswa kwe-NDP 2030 kanye negunya lezokhetho lezokuBusa Kwehlandla Lesithupha.
",0.710495
"Cabinet noted the gazetting of a notice for the Diplomatic Immunity and Privileges Act, which is a standard practice for international summits held in South Africa.
","Imibiko yeminyango yamaklasta igxile ezintweni eziyisikhombisa ezibekwe eqhulwini ezamukelwa nguhulumeni ekubuseni kwehlandla lesithupha okuyilezi: Okokuqala okuseqhulwini: Ukwakha umbuso onekhono, oziphatha ngendlela nothuthukayo Okwesibili okuseqhulwini: Izinguquko kwezomnotho nokusungulwa kwamathuba emisebenzi Okwesithathu okuseqhulwini: Ezemfundo, amakhono kanye nezempilo Okwesine okuseqhulwini: Ukuhlanganisa amaholo omphakathi ngokuletha izidingonqangi ezisemgangathweni nangokwethembeka Okwesihlanu okuseqhulwini: Ukuhlanganiswa kwezindawo, ukuhlaliswa kwabantu kanye nohulumeni basekhaya Okwesithupha okuseqhulwini: Ukubumbana komphakathi nokuphepha kwemiphakathi Okwesikhombisa okuseqhulwini: I-Afrika kanye Nomhlaba Ongcono.
",0.6980221
"The immunities are for the conference and not for specific individuals.
","Enye yalezi zingxenye zenqubekelaphambili yileyo yokuvikeleka komphakathi okuyinto ebaluleke kakhulu ukuqinisekisa imali engenayo kanye nokuvikela abantu baseNingizimu Afrika ababuthakathaka.
",0.5888781
"This is a standard conferment of immunities that we do for all international conferences and summits held in South Africa irrespective of the level of participation.
","Mayelana nalokhu kanye nokuphumelelisa iphuzu Lesine lokuseqhulwini, isabelomali sangowezi-2023 sezibonelelo zomphakathi sanyuka ngezigidigidi ezi-R1 165 futhi lokhu kwenze ngcono izimo zokuphila zabantu baseNingizimu Afrika abangaphezu kwezigidi eziyi-18 abadla imbuya ngothi.
",0.59326875
"They are meant to protect the conference and its attendees from the jurisdiction of the host country for the duration of the conference.
","Ukugcina izethembiso zokubhekana nomthelela we-COVID-19, zingaphezu kwezi-27 344 izibonelelo ezakhokhelwa abantu baseNingizimu Afrika abafanelekile ngoNdasa wezi-2023.
",0.56520927
"Cabinet decisions.
","Ngesikhathi esibuyekezwayo, abomthetho baqinise isandla ekulweni nobugebengu obuhleliwe.
",0.4421344
"Bi-Annual Performance Progress Reports
","Kube nokwenyuka okungamaphesenti angama-86.7 kwezinga lokugwetshwa kwabantu ababoshelwe ukwebiwa kwamakhebuli lokhu kubaluleke kakhulu uma ubheka izingqinamba zikagesi izwe elibukene nazo..Ukunqatshelwa Wemfucuza Yensimbi
",0.47476473
"Cabinet approved bi-annual performance progress reports for the period October 2022 to March 2023 that form part of the Medium-Term Strategic Framework (MTSF) 2019-2024.
","IKhabhinethi licubungule umbiko ngenqubekalaphambili yezinyathelo zokunciphisa ukwebiwa kwemfucuza yensimbi kanye namakhebuli ethusi.
",0.6460445
"The Department of Planning, Monitoring and Development will, in the course of the coming week or two brief the nation on the detail of these progress reports.
","Imithethonqubo yashicilelwa ukuze umphakathi uphawule.
",0.4666314
"The period under review coincided with disruptive load-shedding which has slowed down economic activity and affected service delivery in the country.
","Isitatimende sizokhishwa ngokushesha uma udaba selucutshunguliwe.
",0.49721274
"However, Cabinet is pleased with the progress that has been made in implementing the key expected deliverables.
","IKhabhinethi liphinde labonisa ukuzimisela ukuqinisekisa ukuthi zonke izinyathelo ziyathathwa ukusombulula le nkinga edala umonakalo kwizigidigidi zamarandi emnothweni lokho okuholela ekucimeni kukagesi nokuphazamiseka kwemisebenzi.
",0.65942156
"Cabinet also noted the envisaged recovery programmes that have been outlined by respective clusters.
","Ukuqasha.
",0.29966486
"In October 2019, Cabinet approved the MTSF, as government’s five- year programme for the implementation of the NDP 2030 and of the electoral mandate of the Sixth Administration.
","U-Hosi Pheni Cyprain Ngove njengoSihlalo we-Housing Development Agency.
",0.608752
