src_text,tgt_text,cosine_score
"Mehutahuta ya difeme tša Afrika Borwa e beeleditše ka Nigeria, mola dikhamphani tša Nigeria le tšona di oketša kgolo ya tšona ka Afrika Borwa.
","Imiqhudelwano iqale mhla wama-20 kuNhlaba 2023 kanti iyoze iphele mhla wama-28 kuNhlaba 2023.
",0.5694463
"Beke ya Tšhireletšo ya Bana Afrika-Borwa e tla keteka Beke ya Tšhireletšo ya Bana go tloga ka la 28 Mopitlo go fihla ka la 4 Phupu 2023 ka fase ga kgwekgwe ye: “A re šireletšeng Bana nakong ya COVID-19 le ka Morago ga moo”.
","Imiyalezo.
",0.03334155
"Lesolo le le kgoboketša makala ka moka le ditšhaba go ya tlhabollong, tlhokomelong, le tšhireletšong ya bana.2 Ngwaga wo lesolo le tla lebiša tlhokomelo go RISIHA, lenaneo la thibelo le kgato ya ka pela le thibelo ye e theilwego setšhabeng, leo le lebišitšwego go šuthiša bana go tšwa kotsing go ya kgotlelelong.
","Ukuhalalisa IKhabhinethi lihalalisela futhi lifisela okuhle laba abalandelayo: UNgqongqoshe Wezezimali, uMnu Enoch Godongwana, oklonyeliswe ngendondo i-African Banker 2023 Finance Minister of the Year Award e-Sharm El Sheikh, e-Egypt ngoLwesithathu, mhla wama-24 kuNhlaba 2023 ngemizamo yakhe onyakeni owedlule wokuphatha umnotho waseNingizimu Afrika kwisimo esimazombezombe somhlaba nesalapha ekhaya.
",0.70844173
"Ketelo ya Tlhokomedišo ya DDM ya Kapa Bohlabela.1 Motlatšamopresidente, Morena Paul Mashatile ka la 26 le la 27 Mopitlo 2023 o tla dira Ketelo ya Tekolo ya DDM Seleteng sa OR Tambo le Toropo ya Metropholithene ya Buffalo, Kapa Bohlabela.2 Ketelo ye ke karolo ya maitapišo a mmušo a go kgonthiša gore tlhabollo ya ditšhaba e direga ka tsela ye e kopantšwego yeo e thekgwago ke mokgwa wa DDPalamente ya Botshelela ya Palamente ya Dinaga tša Afrika (PAP)4.1 Baetapele go tšwa go ralala le kontinente ba kgobokane go tloga ka Mošupologo, 15 Mopitlo 2023 go la Midrand, Afrika Borwa bakeng sa Palamente ya Botshelela ya PAKopano e tla fela ka la 02 Phupu 20 2 PAP e nyaka go šogana le ditlhohlo tše di swanago go ralala le kontinente gomme e emetšwe ke baetapele ba Afrika go tšwa kontinenteng ka bophara.
","Lo mklomelo ubonga ukuthi uNgqongqoshe wasebenzisa inqubomgomo yezimali ukusheshisa utshalomali kumkhakha wezamandla avuselelekayo.
",0.574833
"Khomišene ya Mawatle ya Magareng ga Mebušo (IOC)5.1 Afrika Borwa e tla kgatha tema kopanong ya bo56 ya lekgotlaphethiši yeo e tlago swarelwa Paris, France go tloga ka la 16 go fihla ka la 30 Phupu 20 2 IOC ya Mokgatlo wa Thuto, Mahlale le Setšo wa UN (IOC-UNESCO) ke mokgatlo wa UN wo o nago le maikarabelo a go thekga saense le ditirelo tša mawatle a lefase ka bophara.3 Afrika Borwa e amogela bohlokwa bja dinyakišišo le taolo ya mawatle a yona le ditikologo tša lebopong tša tlhabollo ya go ya go ile.
","U-Hana Gammon, umbhali waseNingizimu Afrika oneminyaka engama-20 ubudala ngokuhlomula umklomelo we-2023 Commonwealth Short Story Prize, esifundeni sase-Afrika nobe ngomncane kunabobonke emlandweni ukuhlomula lo mklomelo.
",0.72324204
"Dinyakišišo tša mawatle gape di thuša go fa ditemošo tša ka pela malebana le dikotsi tšeo di theilwego lewatleng le go thuša mebušo go dira diphetho tše di nago le tsebo.
","Iqembu Lebhola Lombhoxo ama-Stormers ngokufinyelela kowamanqamu kwimidlalo ye-United Rugby Championship.
",0.63735133
"Afrika Borwa ke Monggae wa Dipapadi tše Kgolo tša Diphadišano.1 Barati ba dipapadi go tšwa lefaseng ka bophara ba ka letela kamogelo ye borutho ya Ubuntu le kamogelo ya baeng ya maemo a godimo ge ba e tla go bona Sebjana sa Lefase sa Kgwele ya Diatla le Phadišano ya Lefase ya Karate ba Kimura Shukokai International (KSI) ka Afrika Borwa.
","Ama-Stormers azotholana phezulu neqembu i-Irish Musters enkundleni i-Cape Town Stadium ngoMgqibelo, mhla wama-27 kuNhlaba 2023.
",0.6880037
"Afrika Borwa e na le rekoto ye e hlatselegago ya go beakanya ditiragalo tše kgolo ka katlego.2 Lethabo le tšwela pele go oketšega ka matšatši a go fetanyana a masometshela (60) go ya go thomeng ga Sebjana sa Lefase sa Kgwele ya Diatla ka Motse Kapa go tloga ka la 28 Mosegamanye go fihla ka la 6 Phato 2023.
","UMnu Zakes Mda, umbhali wamanoveli waseNingizimu Afrika kanye noSlz Tshilidzi Marwala, owayeyiPhini likaShansela noThishanhloko waphambilini weNyuvesi yase-Johannesburg, bobabili abakhethwe kuma-2023 African Genius Awards.
",0.73363227
"Le ke lekga la mathomo phadišano ye ya maemo a godimo e swarwa mmung wa Afrika.3 Kabinete e dira boipiletšo go bohle go thekga lesolo la Labohlano la Kgwele ya Diatla, ka go apara diaparo tša bathekgi goba go apara mebala ya bosetšhaba go thekga sehlopha sa Bosetšhaba sa Kgwele ya Diatla sa Afrika Borwa.4 KSI South Africa gape ke monggae wa Diphadišano tša Lefase tša Karati ya KSI ya bo20 ka Motse Kapa go tloga ka la 10 go fihla ka la 15 Mosegamanye 2023, gomme dikganyogo tša rena tše botse di romelwa go Team SA ge ba itokišeletša tiragalo ye ya maemo a godimo ya lefase ka bophara.5 Afrika Borwa e swere ka boikgantšho Diphadišano tša Makgaolakgang tša Phadišano ya Thenese ya Tafola tša 2023 ka Senthareng ya Dikopano ya Boditšhabatšhaba ya Durban.
","UMnu Mda noSlz Marwala bakhethwe kanye nabanye abahamba phambili e-Afrika abayi-19 abenze ezibukwayo emikhakheni eyehlukahlukene..Amazwi enduduzo IKhabhinethi lizwakalisa amazwi enduduzo emndenini nakubangani balaba abalandelayo: INxusa leRiphabhulikhi yase-Algeria, uMnu Billy Masetlha, osebenzele iNingizimu Afrika emisebenzini eyehlukahlukene kuhulumeni, kubandakanya nokuba nguMqondisi-Jikelele wezemisebenzi yobunhloli.
",0.7985535
"Dibapadi tše di ka bago 600 go tšwa dinageng tše di fapanego lefaseng ka bophara ka se sebaka di a bapala gomme phadišano ye e fa dibapadi tša rena sebaka sa go bontšha talente ya tšona.
","Wayezibandakanye kakhulu kumzabalazo weNingizimu Afrika wenkululeko, kufaka phakathi nokuba yilungu loMkhonto weSizwe.
",0.6151311
"Phadišano ye e thomile ka la 20 Mopitlo 2023 gomme e tla tšwela pele go fihla ka la 28 Mopitlo 2023.Melaetša.
","U-Murthi Naidoo, owanikela impilo yakhe kumzabalazo wenkululeko yezwe.
",0.495704
"DitebogišoKabinete e rometše ditebogišo le melaetša ya yona ya takaletšo ya mahlatse go: Tona ya Ditšhelete, Morena Enoch Godongwana, yo a filwego Sefoka sa Tona ya Ditšhelete ya Ngwaga sa African Banker sa 2023 sa maemo a godimo go la Sharm El Sheikh, Egepeta ka Laboraro, la 24 Mopitlo 2023 ka maitapišo a gagwe mo ngwageng wo o fetilego go laola ikonomi ya Afrika Borwa ka tikologo ye e nago le mathata ya lefase ka bophara le ya ka mo nageng.
","Waboshwa ngamaphoyisa kusuka ngoLwezi 1965 kuya kuMbasa 1966 ngaphandle kokubekwa amacala futhi wadlala indima ebonakalayo ngesikhathi sobunzima besimo esiphuthumayo ngeminyaka yokuphela ko-1980.U-Barry Dwolatzky, ivulandlela kumkhakha wezobuchwepheshe bolwazi nokuxhumana.
",0.75899506
"Sefoka se lebogile tšhomišo ya Tona ya pholisi ya ikonomi go akgofiša dipeeletšo ka lekaleng la enetši ye mpshafatšegago.
","UbenguSolwazi (i-Emeritus) kuPhiko Lwezobunjiniyela Bogesi Nolwazi kuMkhakha Wezobunjiniyela Nokwakha eNyuvesi yase-Wits.
",0.7130383
"Hana Gammon, mongwadi wa mengwaga ye 20 wa Afrika Borwa ka lebaka la go thopa Sefoka sa Dikanegelokopana sa Kgweranaditšhaba sa 2023, seleteng sa Afrika le go ba yo monnyane mo historing ya sefoka.
","Abantu abayi-15 abalahlekelwe izimpilo zabo ngenxa yokuqubuka kwesifo sohudo e-Hammanskraal eDolobheni lase-Tshwane.
",0.74238676
"Cholera outbreak Management
","Ukulawulwa kokuqubuka kweSifo Sohudo IKhabhinethi lamukele uhambo oluhleliwe lukaMongameli u-Cyril Ramaphosa lokuyoxoxisana nabahlali base-Hammanskraal.
",0.56280065
"Cabinet welcomed President Cyril Ramaphosa’s planned visit to and interaction with residents of Hammanskraal.
","Lolu hambo lwenzeke namuhla, ngoLwesine, mhla wesi-8 kuNhlangulana 2023, kanti lokhu kuxoxisana kunike uMongameli ithuba lokuzizwela ngezakhe kubahlali ngezinselele ababhekene nazo.
",0.6565026
"The visit did take place today, Thursday, 08 June, 2023, and this engagement gave the President the opportunity to hear directly from residents about the challenges they face.
","UMongameli, uNgqongqoshe Wezamanzi Nokuthuthwa Kwendle kanye noSodolobha Omkhulu wase-Tshwane bakwazile ukuhlola izingenelelo zikahulumeni kule ndawo kanye nokunikeza abahlali izimpendulo.
",0.6417436
"The President, the Minister of Water and Sanitation and the Executive Mayor of Tshwane were able to assess government interventions in the area and provide relevant feedback to residents.
","Izingenelelo zikahulumeni zibandakanya ukusebenza kwesibhedlela sesikhashana esingumahambanendlwana eKanana, e-Hammanskraal, kanye nethimba longoti abanamakhono ehlukahlukene abazonqanda ukubhebhetheka nasebelaphe ngempumelelo amakhulu abantu.
",0.74043095
"Government interventions include the field hospital operational in Kanana, Hammanskraal, and a multi-disciplinary team of experts to arrest the spread which has successfully treated hundreds of people.
","Umsebenzi uyaqhubeka ukuqinisekisa ukuthi imikhandlu yendawo isebenzisa izibonelelo zengqalasizinda yamanzi ngendlela efanele.
",0.5958934
"Work is also underway to ensure that local councils use their water infrastructure grants effectively.
","Kunyakamali wamanje, ingaphezu kwezigidigidi ezi-R14 imali ebekelwe ukuthi omasipala babhekane nokusilela emuva kwengqalasizinda yamanzi.
",0.63362753
"For the current financial year, over R14 billion has been set aside for municipalities to address water infrastructure backlogs.
","IKhabhinethi liyakwamukela ukusebenzisana phakathi kweDolobha lase-Tshwane kanye noMnyango Wezamanzi Nokuthuthwa Kwendle ohlelweni lokulungisa isiHlanzimanzi i-Rooiwal, okuzokwenzeka ngokwezigaba ezintathu ezizodla izigidigidi ezi-Ikhabhinethi licela imiphakathi ethintekile ukuthi ihlale iqaphile futhi inakekele kakhulu abantwana.
",0.6828146
"Cabinet welcomes the cooperation between the City of Tshwane and Department of Water and Sanitation on the planned upgrade of the Rooiwal Water Treatment plant, which will be undertaken over three phases at a cost of R4 billion.
","ISifo Sohudo singagwemeka ngokusebenzisa amanzi aphephile.
",0.52321005
"Cabinet calls on the affected communities to remain vigilant and to take special care of children.
","Hlanza amanzi ngokuwabilisa kuqala okungenani umzuzu owodwa futhi uhlanze izandla zakho ngamanzi ahlanzekile nensipho.
",0.52848643
"Cholera can be prevented by using safe water.
","Ngeminye imininingwane ngamasu okugwema lesi sifo vakashela WEBTOKEN Uhulumeni ubonga lezo zinhlangano zamavolontiya kanye nabantu abeze ngaphambili bazofaka isandla..UMbiko Wokuhlanzeka Kwamanzi
",0.56352276
"Treat the water first by boiling it for at least 1 minute and always wash your hands with clean water and soap.
","IKhabhinethi lamukele ukwethulwa futhi kohlelo lwe-Blue, Green and No Drop Watch olwagcina ukwenziwa ngowezi-2013 nowezi-2015.
",0.55836636
"For more information on prevention tips WEBTOKEN Government thanks those volunteer organisations and individuals who have stepped forward to lend a hand.
","Izinhlelo ze-Green, Blue and No Drop Certification ziyizindlela zokulawula zoMnyango Wezamanzi Nokuthuthwa Kwendle (i-DWS) njengomlawuli womkhakha wezamanzi ngokoMthetho Kazwelonke Wezamanzi kanye noMthetho Wezinsizakalo.
",0.63038784
"Water Quality Report
","Inhloso yale ndlela yokulawula ehlukile yaseNingizimu Afrika ngukwenza ngcono ukuhlanzeka kwamanzi aphuzwayo komasipala, ukulawulwa kwamanzi angcolile kanjalo nokugcinwa kwamanzi nokulawula indlela amanzi adingeka ngayo.
",0.40989456
"Cabinet welcomed the reintroduction of the Blue, Green and No Drop Watch which were last conducted in 2013 and 2015 respectively.
","IKhabhinethi lixoxisane kabanzi ngemiphumela kanye nemithelela yemibiko ye-Blue, Green and No Drop Watch yangowezi-2023, eyakhishelwa emphakathini ngoLwesibili, mhla wesi-6 kuNhlangulana.
",0.780811
"The Green, Blue and No Drop Certification programmes are regulatory mechanisms of the Department of Water and Sanitation (DWS) as the water sector regulator in terms of both the National Water Act and Water Services Act, DWS
","IMibiko ibonisa ukuthi kube nokwehla kumgangatho wokuhlanzeka kwamanzi aphuzwayo kanye nokwenyuka kwamanzi amoshekayo kusukela kwakhishwa imibiko yokugcina.
",0.6523856
"The aim of this uniquely South African regulatory tool is to improve municipal drinking water quality, wastewater management as well as water conservation and demand management.
","IKhabhinethi lamukela izinyathelo ezizothathwa nguMnyango Wezamanzi Nokuthuthwa Kwendle zokubhekana nesimo samanje esihlobene nokulawulwa kwamanzi namanzi angcolile.
",0.7239018
"Cabinet deliberated on the results and implications of the 2023, Blue, Green and No Drop Watch reports, which were made public on Tuesday, 6 June.
","UNgqongqoshe Wezamanzi Nokuthuthwa Kwendle emavikini alandelayo uzomemezela lezi zinyathelo iSifundazwe ngasinye..Ezamandla
",0.5742698
"The Watch Reports indicate that there has been a decline in drinking water quality and an increase in non-revenue water since the last Drop reports were issued.
","IKhabhinethi lamukele izingxoxo zakamuva phakathi kukaNgqongqoshe Kagesi, uDkt Kgosientsho Ramokgopa kanye noNgqongqoshe wase-Mozambique Wezezimbiwa Nezamandla, u-Carlos Zacarias, ukuze kuzotholakala ugesi owengeziwe osuka e-Mozambique ukuseka isizinda sikazwelonke sikagesi.
",0.64624107
"Cabinet welcomes measures to be taken by the Department of Water and Sanitation to address the current state of affairs in relation to water and waste water management.
","Okwamanje, i-Mozambique ingakwazi ukuthi ihlinzeke ngama-80MW bese kuthi amanye ama-1000MW esikhathini esingengakanani esizayo.
",0.4963896
"The Minister of Water and Sanitation will in the following weeks announce these measures per Province.
","IKhabhinethi liyaqhubeka nokunxusa abantu baseNingizimu Afrika ukuthi beseke umkhankaso Wokulawula Ukudingeka Kukagesi Ebusika owethulwa nguNgqongqoshe Kagesi, ngenhloso yokonga ugesi ukuze kuzoncishiswa ukusindwa kwesizinda sikazwelonke sikagesi kanye nokusiza ukwehlisa izigaba zokucinywa kukagesi ngenhloso yokuwonga kulobu busika.
",0.562917
"Energy Cabinet welcomed the recent deliberations between the Minister of Electricity, Dr Kgosientsho Ramokgopa and the Mozambican Minister for Mineral Resources and Energy, Carlos Zacarias, to secure additional power from Mozambique to support our national grid.
","IKhabhinethi lithole umbiko owenziwe nguNgqongqoshe Kagesi ochaza kabanzi okuzuziwe kamuva ekulawulweni kweziteshi zikagesi kanye neminye imisebenzi, isibonelo, evimbele ukuthi kube nesidingo sokuthi u-Eskom ashise udizili kule mpelasonto edlule nokuvimbele ukucinywa kukagesi ngenhloso yokuwonga.
",0.72124463
"In the immediate term, Mozambique can provide 80MW and a further 1000MW over the medium term.
","UNgqongqoshe Kagesi uzokwethulela kafushane abezindaba kusasa ngehora le-14:00, ngoLwesihlanu, ngalokhu kanye nokunye okwenzekayo.
",0.5955417
"Cabinet continues to urge South Africans to support the Winter Demand Management campaign launched by the Minister of Electricity, to save electricity to reduce strain on the national grid and help lower load shedding stages this winter.
","I-Operation Vulindlela
",0.3266509
"Cabinet received a report by the Minister of Electricity which detailed recent gains in the management of power stations and other operations which, for example, overcame the need for Eskom to burn diesel this past weekend and avoid load shedding.
","IKhabhinethi lamukele inqubekelaphambili yohlelo lwe-Operation Vulindlela njengokuchaza kukaNgqongqoshe eHhovisini likaMongameli, uKhumbudzo Ntshavheni, mayelana nokuqaliswa kwezinguquko zezakhiwo emikhakheni yezokuthunyelwa kwezamandla, ingqalasizinda yezokuthunyelwa kwempahla, ezokuxhumana ngokwedijithali kanye nezimvume zokungena nokuphuma kwamanye amazwe.
",0.73435515
"The Minister of Electricity will brief media at 14h00 tomorrow, Friday, on these and other developments.
","Inani lezinguquko eseziphothuliwe likhuphuke lisuka kwezintathu laya kweziyi-11, lapho ezinye eziyi-14 sizaqhubeka.
",0.5921316
"Operation Vulindlela
","Lapho kugxilwe khona kakhulu kusekuxazululeni inkinga kagesi kanye nokuthuthukisa ukusebenza kahle kojantshi nezitimela ezithwala impahla, kokubili okusemahlombe okukhula komnotho..UMkhandlu Wokuxhumanisa KaMongameli
",0.38264832
"Cabinet welcomed the progress under the operation Vulindlela as detailed by the Minister in the Presidency, Khumbudzo Ntshavheni, with regard to the implementation of structural reforms in the areas of energy supply, logistics network and infrastructure, digital communications and the visa regime.
","IKhabhinethi leseke isicelo sikaMongameli u-Cyril Ramaphosa ngesikhathi somhlangano woMkhandlu Wokuxhumanisa KaMongameli mhla zi-2 kuNhlangulana 2023 sokusheshisa ukuthunyelwa kwezidingonqangi njengendlela yokuphendula izidingo zemiphakathi.
",0.72382843
"The number of completed reforms has risen from three to 11, while a further 14 reforms are on track.
","UMongameli uyalele uMkhandlu ukuthi usheshise ukuthunyelwa kwezidingonqangi futhi uxazulule izinselele ezihlobene nokushaywa komthetho, ukuphatha kanye nezithiyo kwezamakhono.
",0.5145315
"The primary focus is on addressing the electricity crisis and improving the efficiency of freight rail, both of which are weighing heavily on economic growth.
","Umhlangano uphinde wabheka izinguquko kuMthetho Wezamanzi kanye noMthetho Wezinsizakalo Zamanzi ngenhloso yokuhlinzeka ukuthunyelwa okungcono kwamanzi.
",0.7055448
"President’s Coordinating Council
","Ngokufanayo, uMkhandlu waziswe kafushane ngezingenelelo zoMnyango Wezokuthutha ngomsebenzi ophuthumayo kanye nomsebenzi wokunakekela, kanjalo nokudluliselwa kwemigwaqo emikhulu isuka emagunyeni esifundazwe iye kuzwelonke ukuze kuzophathwa kangcono imigwaqo yezifundazwe yi-Ejensi Kazwelonke Yezemigwaqo eNingizimu Afrika..ISikhungo i-Batyi Automotive Component Supply IKhabhinethi lamukele ukuvulwa kweSikhungo i-Batyi Automotive Component Supply (i-BACS) ePitoli lokho okuqinisekisa indawo yaleli lizwe njengezwe emhlabeni eliyingxenye yomkhakha wezokukhandwa kwezimoto.
",0.3138901
"Cabinet supported President Cyril Ramaphosa’s call during the meeting of the President’s Coordinating Council on 2 June 2023 to accelerate service delivery in response to the needs of communities.
","I-BACS ingumkhiqizo wesikhungo esakha izimoto sakwa-Ford Motor Company kanye no-Motherson, okuyibona abahlinzeki bopende ofazwayo kanye nezingxenye zemoto.
",0.63916624
"The President directed the Council to accelerate service delivery improvement and address challenges in relation to legislation, governance and capacity constraints.
","Lesi sikhungo seseka abahlinzeki abamnyama ukuthi bazimele futhi bancintisane nomhlaba emva kokuthola iziqu zabo eZifundweni Zokwakhwa izimoto eSikhungweni Semboni Yokwakhiwa Kwezimoto (i-AIDC).
",0.67617476
"The meeting also considered reforms to the Water Act and Water Services Act to provide for better service delivery of water.
","Isikhungo se-BACS njengamanje siqashe abantu abangama-60, abangama-30 basebenza emini, bese kuthi abanye abangama-30 basebenza ebusuku.
",0.5256243
"Similarly, the Council was briefed on interventions by the Department of Transport for emergency work and routine maintenance, as well as primary road transfers from provincial authorities to the national road network for better management of provincial roads by the South African National Roads Agency Limited..Batyi Automotive Component Supply Facility
","Ngaphezu kwalokhu, sibheke ekuthatheni intsha ezoqeqeshwa ukuze izothuthukisa amakhono ayo..UMklamo Wezindlu Zokuhlala e-Lufhereng IKhabhinethi lamukele ukwethulwa koMklamo Wezindlu Zokuhlala e-Lufhereng e-Soweto nguMnyango Wezokuhlaliswa Kwabantu, onezindlu ezingama-407 zokurenta ezabantu abathile.
",0.75730735
"Cabinet welcomed the opening of the Batyi Automotive Component Supply (BACS) Facility in Pretoria which cements the country’s position as a global player in the automotive sector.
","Uhlelo lukahulumeni lwezindlu zokuhlala luhlanganisa abantu abahola imiholo ehlangene, luqeda ukusilela emuva ekwakhiweni kwezindlu futhi lusondeza eduze namathuba omnotho kulabo bantu abahlala ngemuva kwamajalidi kanye nasemikhukhwini..INgqalasizinda Yomgwaqo
",0.69833106
"BACS is a product of an incubation centre by Ford Motor Company and Motherson, a supplier of spray painting and components.
","Ukuvulwa komklamo womgwaqo obiza izigidi ezingama-R56 e-Estcourt, KwaZulu-Natali, kuyingxenye yemizamo kahulumeni yokuthuthukisa ukuthunyelwa kwempahla emadolobheni asemakhaya.
",0.7120739
"The centre supports black suppliers to be independent and globally competitive after graduating from the Automotive Industry Development Centre (AIDC’s) Incubation Programme.
","Umsebenzi owenziwe kumklamo womgwaqo ubandakanya ukwakhiwa kabusha komgwaqo wobhuqu wase-D1252 ube yitiyela.
",0.6069962
"The BACS facility currently employs 60 people, with 30 working the day shift, and 30 the night shift.
","Umgwaqo uphumela kumgwaqo omkhulu u-N3, ohlanganisa iTheku neGoli, lokho okuzovulela intsha yendawo engasebenzi amathuba kanye nosonkontileka abasafufusa.
",0.6764296
"Moreover, it is looking at bringing in young trainees to further develop their skill sets.
","Ngempahla engaphezu kwamaphesenti angama-60 ehanjiswa ngomgwaqo u-N3, ukulungiswa komgwaqo kuzoqinisekisa ukuhanjiswa kwempahla nezinsizakalo kuyoyonke iNingizimu Afrika ne-Afrika eseNingizimu ye-Sahara..Ukubambisana Nomphakathi
",0.52658665
"Lufhereng Social Housing Project
","IKhabhinethi lamukele ukubambisana nenkampani yemayini i-Impala Platinum e-Rustenburg ukuze kwakhiwe umtholampilo kanye nesikhungo senkulisa njengengxenye yoHlelo Lwezenhlalakahle Nezabasebenzi.
",0.5748972
"Cabinet welcomed the Department of Human Settlements’ launch of the Lufhereng Social Housing Project in Soweto, which consists of 407 units of rental stock for targeted beneficiaries.
","UMtholampilo wase-Freedom Park kanye neSikhungo Senkulisa zidluliselwe kuMnyango Wezempilo kanye noMnyango Wemfundo Eyisisekelo eSifundazweni saseNyakatho Ntshonalanga..Ukusebenzisana phakathi kukahulumeni namabhizinisi ahlelekile
",0.70569074
"Government’s social housing programme integrates mixed-income groups, curbs the housing backlog and brings backyard and informal settlement dwellers closer to economic opportunities.
","IKhabhinethi lamukele ukusebenzisana phakathi kukaHulumeni namabhizinisi ahlelekile ukuthi kusetshenziswane ekususeni izingqinamba ezivimbela ukukhula komnotho ofaka wonke umuntu kanye nokusungulwa kwemisebenzi.
",0.74107563
"Road Infrastructure
","Izingxenye ezibekwe eqhulwini ezamandla, ezokuthuthwa kwempahla kanye nokulwa nobugebengu nenkohlakalo, kanye nomunye umsebenzi owenziwayo ohlelweni lokusungula imisebenzi..Ezokuphepha Nokuvikeleka
",0.43852305
"The opening of the R56 million road project in Estcourt, KwaZulu- Natal, is part of government’s efforts to improve logistic connectivity in rural towns.
","Ukuqapha nokuvikela imiphakathi ethintwe udlame, uPhiko Lwamaphoyisa eNingizimu Afrika selubeke eceleni cishe izigidigidi ezi-R2 ukuze kuzothengwa ama-drone kanye nezimoto ukuze kuzokwanda ukubonakala kwamaphoyisa emphakathini.
",0.71420646
"Work done on the road project included the upgrading of the D1252 from gravel to tar roads.
","Izigidi ezingama-R65 nazo zibekelwe iziteshi ezingama-30 ezihamba phambili ngokuba nobugebengu ukuze zizolwa nokubulawa kwabantu namanye amacala.
",0.6598529
"The road links to the N3, which connects eThekwini and Johannesburg, opening opportunities for local unemployed youth and emerging contractors.
","Ngaphezu kwalokhu, ama-Tactical Response Team ayatshalwa eziteshini nasezifundeni ezindaweni ezinamazinga aphezulu obugebengu.
",0.62929827
"With more than 60 per cent of goods transported through the N3 corridor, the road upgrade will further facilitate the efficient movement of goods and services to the rest of South Africa and Sub-Saharan Africa..Social Partnership
","UPhiko Lwamaphoyisa eNingizimu Afrika luthuthukisa amaqembu okuthungatha amacala akhethekile, azoqeqeshwa esigabeni sesifundazwe nakwisifunda ukuze ezothungatha aphinde abophe izigilamkhuba..IThimba Lophenyo Elizimele
",0.7330885
"Cabinet welcomed the partnership with mining company Impala Platinum in Rustenburg on the building of a clinic and early childhood development centre as part of its Social and Labour Plan.
","IKhabhinethi lamukele ukuthi uMongameli u-Cyril Ramaphosa abeke ithimba elizimele lamalungu amathathu elizophenya ngezimo zokuboshwa komkhumbi wase-Russia owaziwa ngelika-Lady Ithimba osihlalo lalo iPhini laphambilini likaMongameli wamaJaji eNkantolo ePhakeme eNingizimu ye-Gauteng uJaji Phineas Mojapelo linikezwe amaviki ayisithupha ukuhlolisisa ukuthi ngabe izibopho zomthethosisekelo, ezomthetho kanye nezinye zagcinwa na ngesikhathi kuboshwa umkhumbi e-Simon’s Town, eKapa, futhi lizokwethula umbiko walo kuMongameli..Izithunywa ezizoya emazweni e-G7
",0.73828477
"The Freedom Park Clinic and an Early Childhood Development Centre were handed over to the Departments of Health and Basic Education in the North West Province.
","IKhabhinethi lamukele isinqumo sikaMongameli u-Cyril Ramaphosa sokuthumela izithunywa zongqongqoshe ukuthi bayohlangana neQembu Lamazwe Ayisikhombisa (i-G7) ukuze beyochaza ukuthi iNingizimu Afrika ayihlangene neze nempi ephakathi kwe-Russia ne-Ukraine.
",0.6267903
"Partnership between government and organised business
","Iqembu lezithunywa lizobandakanya uNgqongqoshe Wezobudlelwano Bamazwe Ngamazwe Nokusebenzisana u-Naledi Pandour, uNgqongqoshe Wezohwebo, Izimboni Nokuncintisana u-Ebrahim Patel, uNgqongqoshe Wezezimali u-Enoch Godongwana kanye noNgqongqoshe weHhovisi LikaMongameli u-Khumbudzo Ntshavheni..Amalungiselelo eNgqungquthela ye-BRICS
",0.47681925
