src_text,tgt_text,cosine_score
"Ku thoriwa Ku thoriwa hinkwako ku ya hi ku tiyisisiwa ka vuthwaseri na ku kamberiwa ka mpfumelelo wa vuhlayiseki loku faneleke.
","Vho Bernard Scelo Duma sa Muthusa Mulangi Muhulu: Mashumele a Mivhuso Yapo na Thikhedzo kha Muhasho wa Tshumisano dza Mavhusele..Bodo ya Vhalangi vha Khoro ya Thekhinoḽodzhi ya Minerala
",0.514449
"Tatana Bernard Scelo Duma tanihi Mulawurinkulu: Matirhelo ya Mfumo wa Muganga na Nseketelo eka Ndzawulo ya Mafumele ya Ntirhisano..Bodo ya Valawurinkulu va Huvo ya Thekinoloji ya Swicelwa
","Mufumakadzi Vho Ntombifuthi Zikalala-Mvelase (Muthusamudzulatshidulo vha khou tou dovha u tholwa hafhu )
",0.64513195
"Manana Ntombifuthi Zikalala-Mvelase (Xandla xa Mutshamaxitulu na ku thoriwa nakambe)
","Mufumakadzi Vho Pontsho Maruping (vha khou tou dovha u tholwa hafhu) Vho Rudolf Heydenrich (vha khou tou dovha u tholwa hafhu) Dokotela Vho Siyabonga Simayi Dokotela Vho Takalani Madzivhanḓila Mufumakadzi Vho Azwinndini Mavis Thomani Vho Livhuwani Nengovhela na Mufumakadzi Vho Faith Ntokozo Ngcwabe (Muhasho wa Zwiko zwa Minerala na muimeleli wa Fulufulu)..Bodo ya Vhalangi vha Khoro ya Saintsi ya Mupo
",0.37360293
"Manana Pontsho Maruping (ku thoriwa nakambe) Tatana Rudolf Heydenrich (ku thoriwa nakambe) Dokodela Siyabonga Simayi Dokodela Takalani Madzivhandila Manana Azwinndini Mavis Thomani Tatana Livhu Nengovhela na Manana Faith Ntokozo Ngcwabe (muyimeri wa Ndzawulo ya Swipfuno swa Swicelwa na Eneji)..Bodo ya Valawuri va Huvo ya Sayense ya Misava
","Vho Kelepile Dintwe (Mudzulatshidulo) Vho Xolisa Mvinjelwa (Muthusamudzulatshidulo) Muambeli Vho Ntika Maake Dokotela Vho Mayshree Singh Dokotela Vho Siyanda Mngadi Dokotela Vho Ntombifuthi Nxumalo Mufumakadzi Vho Thobeka Njozela Vho Andries Moatshe Dokotela Vho Moloko Matlala Vho Mandla Malindisa
",0.48385936
"Tatana Kelepile Dintwe (Mutsahamaxitulu) Tatana Xolisa Mvinjelwa (Xandla xa Mutshamaxitulu) Gqweta Ntika Maake Dokodela Mayshree Singh Dokodela Siyanda Mngadi Dokodela Ntombifuthi Nxumalo Manana Thobeka Njozela Tatana Andries Moatshe Dokodela Moloko Matlala Tatana Mandla Malindisa
","Dokotela Vho Mmboneni Muofhe na Vho Mosa Mabuza (CEO).
",0.7305383
"Dokodela Mmboneni Muofhe na Tatana Mosa Mabuza (CEO).
","Milayotibe.
",0.5784725
"Milawumbisi.
","Mvetamveto ya Mulayotibe wa Khwiniso ya Khethekanyo ya Ṱhoḓisiso dza Mapholisa dzo Ḓiimisaho (IPID), ya ṅwaha wa 2023 Khabinethe yo ṱanganedza mvetamveto ya Mulayotibe wa Khwiniso ya IPID wa ṅwaha wa 2023 uri i rumelwe Phalamenndeni.
",0.25373673
"Mpfapfarhuto wa Nawumbisi wo Cinca Xiyenge xa Vulavisisi bya Maphorisa lexi Tiyimeleke wa 2023.
","Mulayotibe uyu u khwinisa Mulayo wa IPID, wa ṅwaha wa 2011 (Mulayo 1 wa 2011), nahone wa dovha wa ṋetshedza makumedzwa o livhiswaho kha u khwaṱhisa zwa u ḓiimisa nga ndoṱhe ha tshiimiswa na kha mashumele a IPID, zwine hezwi zwa khwaṱhisedza izwo zwine zwa ḓivhiwa sa “McBride judgement”.
",0.5356103
"Khabinete yi pasisile mpfapfarhuto wa Nawumbisi wo Cinca IPID wa 2023 ku va wu yisiwa ePalamende.
","Khwiniso idzi dzi dovha hafhu dza lavhelesa kha fhungo ḽe ḽa ambiwa nga Khothe ya Ndayotewa ye ya ḓivhadza uri dziṅwe mbetshelwa dza Mulayo wa IPID wa ṅwaha wa 2011 a dziho mulayoni, zwine hezwi zwa ṋea maanḓa Minisṱa vha Muhasho wa Mapholisa uri vha imise u shuma Mulangi Muhulu, vha dzhie maga a khaidzo kha Mulangi Muhulu nga murahu ha u imiswa hawe u shuma, khathihi na u pandela Mulangi Muhulu mushumoni.
",0.52945757
"Nawumbisi wu cinca Nawu wa IPID, 2011 (Nawu wa 1 wa 2011), na ku endla swiringanyeto leswi kongomisaka eka ku nghenisa ku tiyimela ka vandla na matirhelo ya IPID, hi ku tirhisa “Vuahluri bya McBride”.
","Mulayotibe u dzinginya uri hu vhe na maitele a re khagala nahone a pfalaho a u tholwa ha Mulangi Muhulu khathihi na maitele o fhelelaho nahone o itwaho nga vhuronwane hu tshi itelwa u kona u linga u fulufhedzea ha vhaofisiri vha IPIMulayotibe uyu u dovha hafhu wa ṋetshedza mbetshelwa ya u khwinifhadzwa ha dziṅwe mbetshelwa dza Mulayo Muhulwane, hu u itela uri IPID i kone u ita mushumo wayo nga nḓila yo fhelelaho nahone yavhuḓi.
",0.5811329
"Ku cinca ku tlhela ku lulamisa mhaka leyi vuriweke hi Khoto ya Vumbiwa leyi boxeke leswaku swilaveko swin’wana swa Nawu wa IPID wa 2011 a swi le nawini, leswi pfumeleleke Holobye wa Maphorisa ku yimisa Mulawurinkulu entirhweni, ku teka magoza yo tshinya ehenhla ka Mulawurinkulu ku landzela ku yimisiwa entirhweni, na ku susa Mulawurinkulu entirhweni.
","Iyi mvetamveto ya Mulayotibe i nga wanala kha webusaithi ya WEBTOKEMvetamveto ya Mulayotibe wa Khwiniso ya Milayo ya zwa Vhusevhi nga u Angaredza (GILAB) ya ṅwaha wa 2023 Khabinethe yo ṱanganedza mvetamveto ya GILAB ya ṅwaha wa 2023 u itela uri i kone u rumelwa Phalamenndeni.
",0.63731223
"Nawumbisi wu ringanyeta endlelo leri nga erivaleni ra matholelo ya Mulawurinkulu na vuxokoxoko na endlelo leri fambisiwaka kahle ro kambela ku tshembeka ka vatirhi va IPINawumbisi wu tlhela wu lulamisela ku cinciwa ka swilaveko swin’wana swa Nawunkulu, ku endlela ku tiyisisa leswaku IPID yi tirha ntirho lowu yi nyikweke wona hi ku hetiseka na vuswikoti.
","GILAB i dzinginya uri hu vhe na khwiniso kha Mulayo wa Vhusevhi ha Maimo a Nṱha ha Lushaka, wa ṅwaha wa 1994 (Mulayo 39 wa 1994).
",0.55331784
"Mpfapfarhuto wa nawumbisi wu nga kumeka eka WEBTOKEMpfapfarhuto wa Nawumbisi wo Cinca Milawu ya Vunhlori hi ku Angarhela (GILAB) wa 2023 Khabinete yi pasisile mpfapfarhuto wa GILAB wa 2023 ku va wu yisiwa ePalamende.
","Mulayotibe uyu u ṋea thendelo ya u thoma u shumiswa ha themendelo dza Phaneḽe ya Tsenguluso ya Maimo a Nṱha dza nga ha Zhendedzi ḽa Vhutsireledzi ha Shango (SSA) nga Phresidennde hu tshi katelwa na pulane dza u thoma u shumiswa ha themendelo dza Khomishini ya Ṱhoḓisiso ya zwa Vhulamukanyi kha Mavharivhari a Zwiito zwa u Dzhenelela ha Vhathu vha Nnḓa kha Muvhuso, Zwiito zwa Vhuaḓa na Vhufhura kha Sekhithara ya Muvhuso hu tshi katelwa na Zwiimiswa zwa Muvhuso.
",0.6024267
"GILAB yi ringanyeta ku cinciwa ka Nawu wa Gqingha ra Vunhlori wa Rixaka, 1994 (Nawu wa 39 wa1994).
","Mulayotibe uyu u lingedza u:
",0.6004704
"Nawumbisi wu tirhisa swibumabumelo swa Phanele ya Presidente ya Nkambisiso wa Xiyimo xa le Henhla eka Ejensi ya Vusirheleri bya Tiko (SSA) xikan’we na ku tirhisa kungu ra swibumabumelo swa Khomixini ya Vuavanyisi swa Vulavisisi bya Swihehlo swa ku Tekiwa ka Vulawuri bya Mfumo, Vukungundzwana na Vuxisi eka Mfumo ku katsa na Swiyenge swa Mfumo.
","vusulusa tshumelo dza zwa vhusevhi u itela u ṋetshedza mbonalo ya tshiimiswa tshine tsha ita uri hu vhe na mashumele avhuḓi nahone o khwaṱhaho nga u vhumba zhendedzi ḽa zwa vhusevhi ha ngomu hayani khathihi na tshumelo dza zwa vhusevhi ha mashango a nnḓa
",0.6020969
"Exikarhi ka swinwana Nawumbisi wu lava:
","u khakhulula vhukhakhi vhune ha vha hone kha Mashumele a Vhusevhi ha Vhurathisi sa zwe zwa khwaṱhisedzwa nga Khothe ya Ndayotewa
",0.36494654
"ku cinca mavumbelo ya vukorhokeri bya vunhlori ku nyika xivumbeko xa vandla leri endlaka leswaku ku va na ku tirha hi ku hetiseka na vuswikoti hi ku tumbuluxa ejensi ya vunhlori ya laha kaya na vukorhokeri bya vunhlori bya matiko ya le handle
","u tandulula thaidzo dza vhuṱudzeṱudze he ha ṱaluswa nga maitele a vha Tshigwada tsha u Shuma tsha Mishumo ya zwa Masheleni, hu tshi katelwa na maga a u fhelisa zwiito zwa u tshimbidzwa ha masheleni nga nḓila i siho mulayoni khathihi na zwa u ṋetshedzwa ha masheleni kha zwiito zwa vhutherorisi nga u maanḓafhadza zwiimiswa zwa vhutsireledzi ha lushaka u itela uri zwi kone u ita ṱhoḓisiso na u ita tsenguluso ya zwa vhusevhi arali muthu kana tshiimiswa itsho tshi tsha ndeme kha lushaka
",0.61300087
"ku lulamisa ku hluleka ka matirhelo ya Vuswikoti bya Swikombiso swa Vunhlori tanhilaha swi tiyisisiweke hi Khoto ya Vumbiwa
","U khwaṱhisa maga a u langa na u tshimbidza nḓowetshumo ya zwa vhutsireledzi ha phuraivethe sa tshipiḓa tsha maitele a tsireledzo ya lushaka nga u angaredza na
",0.57387936
"ku lulamisa ku tsana loku kumiweke hi endlelo ra Vandla ro Tirha Nghingiriko wa swa Timali, ku katsa magoza yo herisa ku ngungumerisiwa ka mali na ku hakeleriwa ka vutherorisi hi ku nyika mitlawa ya vusirheleri matimba yo lavisisa no endla nkambelo wa vusirheleri loko munhu kumbe vandla ri ri na ntsakelo wa kahle eka vusirheleri bya rixaka
","u vhea maga a u langa vhuḓifari ha miraḓo ya kale ya tshumelo khathihi na vhaṅwe vhane vha vha na tswikelo kha mafhungo a zwa vhusevhi.
",0.60952616
"ku tiyisisa magoza yo lawula no hlanganisa indhasitiri ya vusirheleri leyi tiyimeleke tanihi hi xiphemu xa endlelo leri anameke ra vusirheleri bya rixaka na
","Hoyu Mulayotibe u ḓo dovha hafhu wa vhona uri tshumelo dza SSA a dzi khou shumiswa nga nḓila i songo teaho hu tshi itelwa u vhuedza kana u bveledza ndivho dza vhaṅwe vhathu.
",0.5040066
"ku veka magoza yo lawula matikhomelo ya khale ka swirho swa vukorhokeri na van’wana lava kotaka ku fikelela mahungu ya vunhlori.
","Khwiniso dzi ḓo dovha hafhu dza khwaṱhisa mushumo wa zwa vhulavhelesi ha mazhendedzi a zwa vhusevhi nga zwiimiswa zwi fanaho na Muṱolimuhulwane wa zwa Vhusevhi, Komiti ya Phalamennde yo Ṱanganelaho na Muṱolambalelano wa Afrika Tshipembe.
",0.60609376
"Nawumbisi wu ya emahlweni wu tiyisisa leswaku vukorhokeri bya SSA a byi tirhisiwi hi ndlela yo biha ku fikelela mitsakelo kumbe makungu ya vanhu vo karhi.
","Mulayotibe uyu u khou wanala kha webusaithi ya WEBTOKEN..Mvetamveto ya Mulayotibe wa Khomishimi ya Tshumelo dza Muvhuso (PSC) ya ṅwaha wa 2023 Khabinethe yo ṱanganedza u anḓadzwa ha mvetamveto ya Mulayotibe wa PSC wa ṅwaha wa 2023 u itela vhupfiwa ha nnyi na nnyi.
",0.5917448
"Ku cinca swi ta tiyisa ku vekiwa tihlo ka tiejensi ta vunhlori hi tihuvo to fana na Mukamberinkulu wa Vunhlori, Komiti ya Nkarhi Hinkwawo ya swa Vunhlori na Muoditinkulu wa Afrika-Dzonga.
","Mulayotibe uyu u phumula Mulayo wa PSC, wa ṅwaha wa 1997 (Mulayo 46 wa 1997) wa Ndayotewa ya Riphabuḽiki ya Afrika Tshipembe, wa 1996.
",0.6388738
"Nawumbisi wa kumeka eka WEBTOKEN..Mpfapfarhuto wa Nawumbisi wa Khomixini ya Vukorhokeri bya Mfumo (PSC) wa 2023 Khabinete yi pasisile ku kandziyisiwa ka mpfapfarhuto wa Nawumbisi wa PSC wa 2023 ku kuma swibumabumelo swa vanhu.
","Mulayotibe u ṋetshedza tshikhala tsha u thomiwa ha khethekanyo ya vhuṅwaleli ho ḓiimisaho ha PSC hu tshi itelwa u khwaṱhisa zwa u ḓiimisa nga ndoṱhe na u sa dzhia sia ha dzangano.
",0.6371728
"Nawumbisi wu herisa Nawu wa PSC, 1997 (Nawu wa 46 wa1997) wa Vumbiwa ra Rhiphabliki ra Afrika-Dzonga ra 1996.
","Musi Mulayotibe wo no phasiswa uri u vhe mulayo, mushumo wa PSC u vho ḓo engedzwa u ya na kha mimasipala khathihi na zwiimiswa zwa muvhuso.
",0.5408797
"Nawumbisi wu lulamisela ku tumbuluxiwa ka hofisi ya matsalana ya PSC leyi tiyimeleke ku tiyisa ku tiyimela na ku nga teki tlhelo ka nhlangano.
","Khwinifhadzo iyi i ḓo ṋea PSC tshikhala tsha u kona u tou lavhelesa lwa tshoṱhe kha zwa u shela mulenzhe hu pfadzaho ho livhiswaho kha u fhaṱa tshumelo ya muvhuso i sedzaho zwililo zwa vhathu, i re na mikhwa yavhuḓi nahone i langwaho nga maitele a tshumelo dzavhuḓi dza muvhuso.
",0.58287203
"Loko Nawumbisi wu pasisiwa wu va nawu, matimba ya PSC ya ta hundziseriwa eka timasipala na mavandla ya mfumo.
","Mulayotibe uyu u khou wanala kha webusaithi ya WEBTOKEN.
",0.5222374
"Ku cinca swi ta nyika PSC endlelo leri nga na miehleketo yo enta ro hoxa xandla hi ndlela yo twisiseka eka ku aka vukorhorkeri bya mfumo lebyi hlamulaka, matikhomelo lamanene na ku va lebyi susumetiwaka hi nkoka.
","Mvetamveto ya Mulayotibe wa Mulavhelesi wa Nyukilia ya Lushaka ya ṅwaha wa 2023.
",0.59205127
"Nawumbisi wa kumeka eka WEBTOKEN.
","Khabinethe yo ṱanganedza Mvetamveto ya Mulayotibe wa Mulavhelesi wa Nyukilia ya Lushaka uri u kone u rumelwa Phalamenndeni.
",0.5832592
"Mpfapfarhuto wa Nawumbisi wo Cinca Mulawuri wa Nyutliya wa Rixaka wa 2023.
","Mulayotibe uyu u khwinisa Mulayo wa Mulavhelesi wa Nyukilia ya Lushaka (NNR), wa ṅwaha wa 1999 (Mulayo 47 wa 1999).
",0.6295571
"Khabinete yi pasisile mpfapfarhuto wa Nawumbisi wo Cinca Mulawuri wa Nyutliya ku va wu yisiwa ePalamende.
","Mulayotibe u khou lingedza u fhelisa tshikhala tshine tsha vha hone zwazwino kha Mulayo wa NNR wa 1999.
",0.5841937
"Nawumbisi wu cinca Nawu wa Mulawuri wa Nyutliya wa Rixaka (NNR), 1999 (Nawu wa 47 wa 1999).
","Mulayo uyu kha tshivhumbeo tshawo tsha zwino, a u elani na maitele a mashumele avhuḓi a dzitshaka kha sia ḽa milayo ya tsireledzo ya nyukilia ngauri a u ambi tshithu nga ha u sa tsireledzea mishumoni ha vhashumi kha muhasaladzo wa tshikhalani.
",0.49232298
"Nawumbisi wu lava ku lulamisa mavangwa lama nga eka Nawu lowu nga kona wa NNR wa 1999.
","Mulayotibe uyu wo dovha hafhu wa dzudzanyelwa uri u tshimbilelane na Mulayo wa NNR wa 1999 khathihi na milayo na maitele avhuḓi a Zhendedzi ḽa Fulufulu ḽa Athomiki ḽa Dzitshaka (IAEA).
",0.6140055
"Leswi Nawu wu nga xiswona sweswi a wu fambisani na mitolovelo ya kahle ya matiko ya misava eka xiyenge xa swinawana swa vuhlayiseki bya nyutliya hikuva a wu khumbi mhaka ya ku nga sirheleleki ka vatirhi va le moyeni eka rhadiyexini ya le xibakabakeni.
","Afrika Tshipembe ndi muraḓo wa IAEA.
",0.53764725
"Nawumbisi wu tlhele wu endleriwa ku yelanisa Nawu wa NNR wa 1999 na swileriso swa Ejensi ya Eneji ya Tiathomo ya Matiko ya Misava (IAEA) na ntolovelo wa yona wa kahle.
","Vhuṱambo vhune ha khou ḓa.
",0.47984844
"Afrika-Dzonga i xirho xa IAEA.
","U Dzheniswa Tshiduloni ha Phresidennde wa Riphabuḽiki ya Federala ya Nigeria
",0.5398197
"Mitirho Leyi Taka.
","Nga Musumbuluwo, wa ḽa 29 Shundunthule 2023, Phresidennde Vho Ramaphosa vha ḓo ṱanganedza thambo ya u dzhenela vhuṱambo ha u Dzheniswa Tshiduloni ha Phresidennde Vho Bola Ahmed Tinubu vha Riphabuḽiki ya Federala ya Nigeria vhane vha kha ḓi tou bva u nangiwa.
",0.19202426
"Ku Vekiwa exitulwini ka Presidente wa Rhiphabliki ra Federali ra Nigeria
","U shela mulenzhe ha Phresidennde hu ḓo sumbedza u bvela phanḓa ha vhushaka ha ndeme vhu re hone vhukati ha shango ḽa Afrika Tshipembe na ḽa Nigeria.
",0.43357658
"Hi Musumbunuku, 29 Mudyaxihi 2023, Presidente Ramaphosa u ta xixima xirhambo xo ya eka ntirho wo vekiwa exitulwini ka Presidente la hlawuriweke Tatana Bola Ahmed Tinubu wa Rhiphabliki ra Federali ra Nigeria.
","Sango ḽa Nigeria ndi muvhambadzelani muhulwane vhukuma na shango ḽa Afrika Tshipembe kha tshipiḓa tsha mashango a re Vhukovhela ha dzhango ḽa Afrika.
",0.64376915
"Ku nghenelela ka Presidente swi ta komba ku ya emahlweni ka vuxaka exikarhi ka Afrika-Dzonga na Nigeria.
","Mamaga manzhi o fhambanaho a ḽa Afrika Tshipembe a khou bindudza fhaḽa kha ḽa Nigeria, ngeno khamphani dza ḽa Nigeria na dzone dzi tshi khou thoma u vhonala fhano kha ḽa Afrika Tshipembe.
",0.5086465
"Nigeria i mutirhisani lonkulu wa Afrika-Dzonga wa swa mabindzu eVupeladyambu bya Afrika.
","Vhege ya Tsireledzo ya Vhana Afrika Tshipembe ḽi ḓo vha ḽi tshi khou fhululedza Vhege ya Tsireledzo ya Vhana u bva nga ḽa 28 Shundunthule u swika ḽa 4 Fulwi 2023 nga fhasi ha thero ine ya ri: “Kha ri Tsireledze Vhana nga Tshifhinga tsha Dwadze ḽa COVID-19 na u Fhira”.
",0.4908135
"Tifeme ta mabindzu yo hambanahambana ya Afrika-Dzonga ti endlile vuvekisi eNigeria, loko tikhamphani ta le Nigerian na tona ti ri ku ngheneni eAfrika-Dzonga.
","Fulo iḽi ḽi kuvhanganya sekhithara dzoṱhe na zwitshavha uri zwi aluse, zwi ṱhogomele na u tsireledza vhana.2 Houno ṅwaha, fulo iḽi ḽi ḓo sedzesa kha RISIHA, ine ya vha mbekanyamushumo ya u thivhela na u dzhenelela nga u ṱavhanya i wanalaho ngomu kha tshitshavha, ine muhumbulo wayo ha vha u bvisa vhana kha tshiimo tshine a vho ngo tsireledzea ya vha isa kha tshiimo tsha u kona u konḓelela.
",0.4532964
"Vhiki ra Nsirhelelo wa Vana Afrika-Dzonga yi ta fungha Vhiki ra Nsirhelelo wa Vana kusukela hi ti 28 Mudyaxihi kufikela ti 4 Khotavuxika 2023 ehansi ka nhlokomhaka leyi nge: “A hi Sirheleleni Vana hi Nkarhi wa COVID-19 na le Ndzhaku kayona”.
","Madalo a Vhulavhelesi ha DDM ngei Kapa Vhubvaḓuvha.1 Muthusaphresidennde Vho, Mr Paul Mashatile vha ḓo fara Madalo a Vhulavhelesi ha DDM ngei Kapa Vhubvaḓuvha nga ḽa 26 na 27 Shundunthule 2023 kha Tshiṱiriki tsha OR Tambo na Buffalo City Metro, ngei Kapa Vhubvaḓuvha.2 Madalo aya ndi tshipiḓa tsha maga a muvhuso a u vhona uri hu khou vha na u bveledzwa ha zwitshavha nga nḓila ine ya ṱuṱuwedzwa nga maitele a DDPhalamennde ya vhurathi ya Pan-African Parliament (PAP)4.1 Vharangaphanḓa u bva kha dzhango ḽoṱhe ḽa Afrika vho ṱangana u bva nga Musumbuluwo, wa ḽa 15 Shundunthule 2023 ngei Midrand, Afrika Tshipembe, kha muṱangano wa Vhurathi wa Phalamennde ya PADzulo iḽi ḽi ḓo khunyeledzwa nga ḽa 02 Fulwi 20 2 PAP i khou lingedza u tandulula khaedu dzi fanaho kha dzhango ḽa Afrika nahone yo imelwa nga vharangaphanḓa vha Afrika u bva kha dzhango ḽoṱhe nga u angaredza.
",0.61858743
"Pfhumba ri hlanganisa tisekitara hinkwato na vaakindhawu ku fikelela nhluvukiso, nhlayiso na nsirhelelo wa vana.2 Lembe leri pfhumba ri ta kongomisa eka RISIHA, nongoloko lowu simekiweke eka vaakindhawu wo sivela no nghenelela ka ha ri na nkarhi, leswi nga na xikongomelo xo susa vana eka ku ka va nga sirhelelekanga ku ya eka ku sihalala.
","Khomishini ya Vhukati ha Mivhuso ya nga ha zwa Lwanzheni (IOC)5.1 Shango ḽa Afrika Tshipembe ḽi ḓo shela mulenzhe kha dzulo ḽa vhu56 ḽa khorotshitumbe ḽine ḽa ḓo farelwa fhaḽa ḓoroboni ya Paris, kha ḽa France u bva ḽa 16 u swika ḽa 30 Fulwi 20 2 IOC ya Dzangano ḽa zwa Pfunzo, Saintsi na Mvelele ḽa UN (IOC-UNESCO), ndi tshiimiswa tsha UN tshine tsha vha na vhuḓifhinduleli ha u tikedza saintsi na tshumelo dza lwanzheni dza ḽifhasi.3 Shango ḽa Afrika Tshipembe ḽi khou dzhiela nṱha ndeme ya ṱhoḓisiso na ndangulo ya maḓanzhe aḽo khathihi na vhupo ha khunzikhunzini hu tshi itelwa mveledziso ya tshifhinga tshilapfu.
",0.6110833
"Rendzo ra DDM ya Vulanguteri ra le ka Xifundzankulu xa Kapavuxa Xandla xa Presidente, Tatana Paul Mashatile u ta teka Rendzo ra DDM ya Vulanguteri ro ya eka Xifundza xa OR Tambo na Buffalo City Metro, eKapavuxa hi ti 26 na ti 27 Mudyaxihi 2023.
","Ṱhoḓisiso dza zwa lwanzheni dzi thusa kha u ṋetshedza ngafhadzo nga tshifhinga dza nga ha malugana na zwizwo zwa lwanzheni u itela u thusa mivhuso uri i kone u dzhia tsheo dzo teaho..Shango ḽa Afrika Tshipembe ḽi khou fara mitambo mihulwane ya vhugweṋa.1 Vhafuni vha mitambo u mona na ḽifhasi ḽoṱhe vha nga lavhelela u ṱanganedzwa nga muya wa Ubuntu khathihi na u farwa nga nḓila ya maimo a nṱha musi vha tshi dzhenela mitambo ya Tshiphuga tsha Ḽifhasi tsha Netibolo khathihi na Vhugwena ha Ḽifhasi ha Karati ya Kimura Shukokai International (KSI) fhano kha ḽa Afrika Tshipembe.
",0.684169
"Rendzo leri i xiphemu xa ku sungula ka mfumo ku tiyisisa leswaku nhluvukiso wa vaakindhawu wu endliwa hi ndlela yo hlanganeriwa leyi seketeriwaka hi endlelo ra DDM..Palamende ya Vutsevu ya Palamende ya Matiko ya Afrika (PAP)4.1 Varhangeri ku suka eka tikonkulu hinwaro va hlengeletanile kusukela hi Musumbunuku, 15 Mudyaxihi 2023 eMidrand, eAfrika-Dzonga hikwalaho ka Palamende ya Vutsevu ya PANtshamo wu ta hela 02 Khotavuxika 20 2 PAP yi lava ku languta mitlhontlho yo fana eka tikonkulu hinkwaro naswona yi andlariwa hi Varhengeri va Afrika ku suka eka tikonkulu hinkwaro.
","Shango ḽa Afrika Tshipembe ḽi na rekhodo yavhuḓi ya u kona u fara vhuṱambo vhuhulwane ha ḽifhasi nga nḓila yavhuḓi.2 U nyanyuwa hu khou engedzea musi ho tou sala fhedzi maḓuvha a furathi (60) phanḓa ha musi mitambo ya Tshiphuga tsha Netibolo ya Ḽifhasi i tshi thoma fhaḽa Ḓoroboni ya Kapa u bva nga ḽa 28 Fulwana u swika ḽa 6 Ṱhangule 2023.
",0.693464
"Khomixini ya Sayense ya le Lwandle ya le Xikarhi ka Mifumo (IOC)5.1 Afrika-Dzonga yi ta nghenela sexini ta vu56 ya huvonkulu leyi nga ta khomeriwa eParis, eFrance kusukela ti 16 ku fikela ti 30 Khotavuxika 20 2 IOC ya nhlangano wa UN wa Dyondzo, Sayense na Mfuwo (IOC-UNESCO) I huvo ya UN leyi nga na vutihlamuleri byo seketela sayense ya le lwandle ya misava hinkwayo na vukorhokeri.3 Afrika-dzonga yi tekela enhlokweni nkoka wa ndzavisiso na mafambiselo ya malwandle ya yona na mimbango ya le tibuweni ta malwandle ku fikelela nhluvukiso lowu kotaka ku yiseka emahlweni.
","Hezwi zwi ḓo vha lwa u tou thoma musi mitambo ya maimo a nṱha ngaurali i tshi farelwa fhano kha mavu a dzhango ḽa Afrika,6.3 Khabinethe i khou ita khuwelelo kha muthu muṅwe na muṅwe ya uri a tikedze fulo ḽa Netball Fridays, nga u ambara zwikhipha zwa vhatikedzi kana u ambara zwikhipha zwa mivhala ya thimu ya lushaka u itela u tikedza thimu ya Netibolo ya Lushaka ya Afrika Tshipembe.4 KSI Afrika Tshipembe na yone i khou ḓo fara mitambo ya vhu20 ya KSI ya Vhugwena ha Karati ha Ḽifhasi ngei Ḓoroboni ya Kapa u bva nga ḽa 10 u swika ḽa 15 Fulwana 2023, nahone ri khou tamela mashudu Team SA musi vha tshi khou ḓilugisela vhuṱambo uvhu ha mitambo iyi ya ḽifhasi ya maimo a nṱha ngaurali.5 Shango ḽa Afrika Tshipembe ḽi khou ḓihudza nga u fara mitambo ya Makhaulatshele a Vhugweṋa ha mitambo ya Table Tennis ya ṅwaha wa 2023 ine ya ḓo farelwa fhaḽa Sentharani ya zwa Miṱangano ya Dzitshaka ya Durban.
",0.7192562
"Ndzavisiso wa le lwandle wu tlhela wu pfuna hi ku nyika swilemukiso swa le ku sunguleni swa makhombo lama sukelaka elwandle na ku pfuna mfumo ku teka swiboho swo twisiseka.
","Vhatambi vha swikaho 600 u bva kha mashango o fhambanaho ndi vhane zwazwino vha kati nahone mitambo iyi i ṋetshedza vhatambi vhashu tshikhala tsha u sumbedza vhukoni havho.
",0.5366628
"Afrika-Dzonga yi rhurhela vunghwazi bya mitlangu leyikulu.1 Vaseketeri va mitlangu ku suka emisaveni hinkwayo va nga langutela ku amukeriwa hi mandla mambirhi ka Ubuntu na malwandla loko va ta eka Khapu ya bolo ya mavoko na Vunghwazi bya Karati ya Misava ya Kimura Shukokai International (KSI) Karate eAfrika-Dzonga.
","Mitambo iyi yo thoma nga ḽa 20 Shundunthule 2023 nahone i ḓo bvela phanḓa u vhuya u swikela nga ḽa 28 Shundunthule 2023.Milaedza.
",0.7094823
"Afrika-dzonga yi na rhekhodo ya ku rhurhela mitlangu leyikulu hi ku hetiseka.2 Nyanyuko wu ya emahlweni wu kula leswi ku nga sala ku hundza masiku ya makumetsevu (60) ku nga se sungula Khapu ya Bolo ya Mavoko eKapa kusukela ti 28 Mawuwani ku fikela ti 6 Mhawuri 2023.
","U fhululedzaKhabinethe yo rumela milaedza yayo ya u fhululedza na u tamela mashudu kha: Minisṱa wa Gwama, Vho Enoch Godongwana, vhe vha ṋewa pfufho ya maimo a nṱha ya African Banker 2023, Pfufho ya u vha Minisṱa wa Gwama wa Ṅwaha ngei Sharm El Sheikh, kha ḽa Egypt nga Ḽavhuraru, ḽa 24 Shundunthule 2023 kha ndingedzo dzavho kha tshifhinga tsha miṅwaha mivhili yo fhelaho dza u langa ikonomi ya shango ḽa Afrika Tshipembe kha nyimele i konḓaho ya ḽifhasi na ya ngomu hayani.
",0.7009574
"Leri i ro sungula ku va mphikizano lowu wa ndhuma wu khomeriwa eAfrika.3 Khabinete yi kombela vanhu hinkwavo ku seketela pfhumba ra Ravuntlhanu ra Bolo ya Mavoko, hi ku ambala mpahla ya vaseketeri kumbe ku khavisa hi mihlovo ya rixaka ku seketela xipano xa Afrika-Dzonga xa Bolo ya Mavoko.4 KSI ya Afrika-Dzonga na yona yi rhurhela Vunghwazi bya Karati ya Misava ya KSI ya vu20 eKapa kusukela ti 10 kufikela ti 15 Mawuwani 2023, naswona ku navelela leswinene ka hina swi hundziseriwa eka Team SA loko yi ri karhi yi lulamisela ntirho lowu wa ndhuma wa misava hinkwayo.5 Afrika-Dzonga yi rhurhela Vunghwazi bya Makumu bya Tinghwazi ta Thenisi ya le Tafuleni ya 2023 hi ku tinyungubyisa eDurban International Convention Centre.
","Pfufho iyi i dzhiele nṱha nḓila ye Minisṱa vha shumisa ngayo mbekanyamaitele ya zwa masheleni u itela u enegedza vhubindudzi kha sekhithara ya fulufulu ḽi vusuluseaho.
",0.6919352
"Kwalomu ka 600 wa vatlangi kusuka ematikweni yo hambanahambana emisaveni hinkwayo va le ka migingiriko leyi eka nkarhi wa swewi naswona mphikizano lowu wu nyika vatlangi va hina xivandlanene xo kombisa talenta ya vona.
","Hana Gammon, muṅwali wa ḽa Afrika Tshipembe wa miṅwaha ya 20 nge a wina Pfufho ya Nganeapfufhi ya Mashango a Muṱanganelano ya ṅwaha wa 2023, kha dzingu ḽa Afrika khathihi na u vha ene muthu muṱukusa u wina kha ḓivhazwakale ya pfufho iyi.
",0.6040296
"Mphikizano wu sungurile hi ti 20 Mudyaxihi 2023 naswona wu ta ya emahlweni kufikela ti 28 Mudyaxihi 2023.Marungula.
","Thimu ya mutambo wa Ragibii ya The Stormers nge ya kona u swikela makhaulatshele a miṱaṱisano ya United Rugby Championship.
",0.5288016
"Ku hoyozelaKhabinete yi hundzisele ku hoyozela na ku navelela leswinene eka: Holobye wa timali, Tatana Enoch Godongwana, loyi a nga nyikiwa Sagwadi ra Mubangi wa Afrika wa Ndhuma wa Holobye wa Timali wa Lembe wa 2023 eSharm El Sheikh, eEgypt hi ravunharhu, 24 Mudyaxihi 2023 hi matshalatshala yo fambisa ikhonomi ya Afrika-Dzonga lembe leri nga hundza eka mbango wo tika wa matiko ya misava na wa laha kaya.
","Thimu iyi ya The Stormers i ḓo vha i tshi khou tamba na thimu ya The Irish Musters fhaḽa Ḓoroboni ya Kapa nga Mugivhela, wa ḽa 27 Shundunthule 2023.
",0.7739194
"Sagwadi ri tekela enhlokweni ku tirhisa ka Holobye ka pholisi ya swa timali ku hatlisisa vuveksi eka sekitara ya eneji leyi pfuxetiwaka.
","Vho Zakes Mda, muṅwali wa nganea wa shango ḽa Afrika Tshipembe na Phrof Vho Tshilidzi Marwala, Ṱhoho na Muthusa Tshantseḽara wa kale wa Yunivesithi ya Johannesburg, vhe vhuvhili havho vha nangwa kha Pfufho dza African Genius dza ṅwaha wa 2023.
",0.57318485
