src_text,tgt_text,cosine_score
"Rampbestuur na aanleiding van die vloede.
","Issues in the environment.
",0.43537524
"Die Kabinet het hul medelye uitgespreek met almal wat geliefdes verloor het tydens die onlangse verwoestende vloede wat verskeie dele van die land geraak het, in besonder KwaZulu-Natal..
","Disaster management after the floods.
",0.46516854
"Die verklaring van ŉ nasionale ramptoestand en sosio-ekonomiese hulpingrypings wat onlangs deur President Cyril Ramaphosa aangekondig is, het ten doel om doeltreffende en gekoördineerde teenmaatreëls regoor alle regeringsfere te verseker, by wyse van die nasionale rampbestuursentrum.
","Cabinet expressed condolences to all people who have lost their loved ones in the recent devastating floods that hit several parts of our country, particularly KwaZulu-Natal..
",0.64279515
"Die R1 miljard wat beskikbaar gestel is deur die regering word aangewend om verligtings- en herstelpogings te steun, basiese dienste weer beskikbaar te stel en humanitêre steun te lewer by wyse van voedsel, water, skuiling, sanitasie en klere..
","The declaration of National State of Disaster and socio-economic relief interventions recently announced by President Cyril Ramaphosa, sought to ensure an effective and coordinated response across all spheres of government, through the National Disaster Management Centre..
",0.6845267
"Die proses om areas wat deur die vloede geraak is, te herbou, het reeds begin, met ons land se mense wat verenig is in hul vasberadenheid om hulp te verleen aan diegene wat hul huise en besittings verloor het..     Nuutste oor die koronavirussiekte (KOVID-19).
","The R1 billion made available by the government is being used to support relief and recovery efforts, restore basic services and provide humanitarian assistance in the form of food, water, shelter, sanitation and clothing..
",0.67006385
"Die Kabinet is besorg oor die onlangse skerp styging in KOVID-19-infeksies in sommige dele van die land en spoor alle burgers aan om voorkomingsmaatreëls te tref om hulself teen die virus te beskerm, veral tydens die winterseisoen..
","The process to rebuild affected areas has already started as the people of our country unite in their determination to assist those who have lost their homes and possessions.
",0.6697534
"Die virus is steeds ŉ bedreiging en inenting bied die mees doeltreffende beskerming daarteen.
","Update on the Coronavirus Disease (COVID-19).
",0.5402081
"Die Kabinet is daarmee genoë dat al meer en meer mense kies om ingeënt te word vir beskerming teen die virus, na aanleiding van onlangse statistieke wat getoon het dat ons die mylpaal van meer as 50% van volwasse inentings in vyf provinsies bereik het..
","Cabinet noted with concern the recent spike in COVID-19 infections in some parts of the country and urged all people to take precautionary measures to protect themselves against the deadly virus, especially during winter.
",0.6969898
"Die Kabinet doen ŉ beroep op almal wat nog nie ingeënt is nie, om ingeënt te word om hulself en hul geliefdes te beskerm.
","The virus is still constant threat and vaccination remains the most effective weapon to protect ourselves.
",0.6214495
"Ons moet ook alle KOVID-19-voorkomingsmaatreëls volg, insluitend die dra van gesigmaskers wat beide neus en mond bedek, gereelde handewas met seep en water of ŉ 70%-alkoholgebaseerde handsaniteerder, en om ŉ veilige sosiale afstand van minstens een meter van ander mense te handhaaf..     Maatskaplike verligting van nood-toelae.
","The cabinet is pleased that more people continue to choose vaccination as their first line of defence against COVID-19 after recent statistics showed that we have reached the milestone of over 50 per cent of adult vaccinations in five provinces.
",0.6561597
"Die Kabinet moedig burgers wat die R350 maatskaplike verligting van nood-toelae ontvang om weer daarvoor aansoek te doen, na aanleiding van die nuwe regulasies wat aansoeke en kwalifisering vir die toelae reguleer..     Aansoeke kan ingedien word op die Suid-Afrikaanse Agentskap vir Maatskaplike Sekerheid (SASSA) se webwerf://srd.sassa.gov.za/.
",".
",0.052800275
"Die stelsel vir aansoeke het op 23 April 2022 in werking getree en die proses is ten volle digitaal om vinnige omkeertye te verseker..
","Cabinet calls on those who have not yet been vaccinated to do so to protect themselves and their loved ones.
",0.5466063
"Die toelae is ŉ belangrike veiligheidsnet vir behoeftige gesinne wat andersins nie die mas sou opkom onder die juk van armoede en werkloosheid nie.
","We should also all continue to adhere to all COVID-19 prevention protocols, including the wearing of mask that covers both the nose and mouth, washing hands with water and soap, or using 70% alcohol-based hand sanitiser, and keeping safe social distance of at least one metre..   Social Relief of Distress (SRD) Grant.
",0.6452867
"Die regering is daartoe verbind om maatskaplike steun te lewer aan die mees weerlose mense in ons samelewing sodat daar aan hule basiese behoeftes voldoen word..     Veiligheid en sekuriteit.
","Cabinet encouraged citizens receiving the R350 SRD Grant to reapply, following the introduction of new regulations governing applications and eligibility for the grant.
",0.68790686
"Die Kabinet verdoem steeds die sinnelose moor van vroue en het die spoedige aksie van wetstoepassingsagentskappe in die inhegtenisname van verdagtes in die moord op me.
","Applications can be lodged on the South African Social Security Agency (SASSA)  website: https://srd.sassa.gov.za/.
",0.53668547
"Hillary Gardee (28) van Kamagugu in Mpumalanga verwelkom.
","The application system opened on 23 April 2022 and is fully digital process to enable quick turnaround times..
",0.52743053
"Die Kabinet verdoem verder ook die moord op ses mense in Khayelitsha, Kaapstad.
","The relief grant is an important safety net for needy families who would otherwise be devastated by the scourge of poverty and unemployment.
",0.547052
"Hierdie sinnelose moorde dien as herinnering daaraan dat ons as ŉ samelewing meer moet doen om geweld en geslagsgebaseerde geweld en vrouemoord (GGGV) te verhoed..
","Government is committed to providing social assistance to the most vulnerable so that they can meet their basic needs.
",0.52736896
"Die Kabinet spoor alle landsinwoners aan om hul samewerking aan die regering te gee in die stryd teen misdaad en GGGV.
","Safety and security.
",0.34825704
"Saam kan ons verseker dat ons gemeenskappe en strate veilig is vir alle mense, insluitend bejaardes, vroue en kinders..     Ekonomie.
","Cabinet continues to condemn the senseless killing of women and has welcomed the swift response by law-enforcement officers in arresting suspects in connection with the death of Ms Hillary Gardee (28), of Kamagugu in Mpumalanga.
",0.62006736
"Die Kabinet verwelkom die amptelike opening van Corobrik se Kwastina-baksteenvervaardigingsfabriek in Driefontein in Gauteng, behartig deur President Ramaphosa op Woensdag, 4 Mei.
","Cabinet further condemned the killing of six people in Khayelitsha, Cape Town.
",0.71754885
"Die ultra-moderne fabriek vorm deel van ŉ belegging van R800 miljoen, tesame met ŉ verdere R200 miljoen wat daarvoor geoormerk is om Corobrik se betonhandel in KwaZulu-Natal uit te brei.
","These senseless murders are reminder that we must do more as society to end violence and gender-based violence and femicide (GBVF)..
",0.634127
"Corobrik is een van verskeie plaaslike ondernemings wat gereageer het op President Ramaphosa se beroep op Suid-Afrika en buitelandse ondernemings om in ons ekonomie te belê..
","Cabinet urged all people in the country to work with the government in the fight against crime and GBVF.
",0.6251866
"Die Kabinet neem daarvan kennis dat die ontluikende waterstofekonomie ŉ hupstoot ontvang het danksy die loods van ŉ trok wat waterstof as brandstof gebruik, deur Anglo American.
","Together we can ensure that our communities and streets are safer for all people, including the elderly, women and children..  Economy.
",0.5724492
"Die trok – wat vanaf diesel na waterstof aangepas is en deels krag trek vanaf litium-ioon batterye – is een van die eerste van sy soort in die wêreld.
","Cabinet welcomed the official opening of Corobrik’s Kwastina brick manufacturing factory at Driefontein in Gauteng by President Ramaphosa on Wednesday, 4 May.
",0.66388994
"Die waterstofekonomie is identifiseer as ŉ strategiese prioriteit vir ons land se groen ekonomie en as noodsaaklik om ekonomiese groei en werkskepping aan te dryf..
","The state-of-the-art factory forms part of an R800 million investment, which goes hand in hand with further R200 million earmarked to expand Corobrik’s concrete operations in KwaZulu-Natal.
",0.6219114
"Die Kabinet verwelkom ook ŉ verdere belegging in ons ekonomie deur die Ierse voedselmaatskappy The Kerry Group, wat ŉ nuwe uitleg ter waarde van R650 miljoen in Hammarsdale, KwaZulu-Natal geopen het met die doel om volhoubare voedsel vir die kontinent te produseer.
","Corobrik is one of several local businesses that have responded to President Ramaphosa’s call on South African and international enterprises to invest in this economy.
",0.6793932
"Die uitleg is uniek synde dit spog met verskeie volhoubare eietrekke insluitend lae-energieverbruiktoerusting, sonkragopwekking op verbruik op die plaaslike netwerk te verminder, die herwinning van verspilde hitte, asook die herwinning, herbruik en verminderde gebruik van water.
","Cabinet noted that the fledgling hydrogen economy has been given boost with the launch of hydrogen-powered truck by Anglo American.
",0.6332643
"Die Kerry Group is sedert 2011 werksaam in Suid-Afrika en hul verdere belegging is ŉ teken dat Suid-Afrika ŉ voorkeur-beleggingsbestemmig is..     Hierdie beleggings volg in die voetspore van die loods van die plaaslikvervaardigde Isuzu D-Max-bakkie laasmaand in Gqeberha in die Oos-Kaap.
","The truck – which was converted from diesel to hydrogen, and is powered in part by lithium-ion batteries – is world first.
",0.6873014
"Die nuwe-generasie D-MAX bekroon Isuzu se verbintenis tot Suid-Afrika en is een van die suksesse wat behaal is onder die vaandel van die voertuigvervaardigingsontwikkelingsprogram (oftewel Automotive Production Development Programme [APDP]).
","The hydrogen economy has been identified as strategic priority for our country’s green economy, and to drive economic growth and employment..
",0.6533599
"Die APDP is ŉ vervaardigingsaanporingskema vir die voertuigbedryf wat gemik is op die bevordering van vervaardigingsvolumes in die aangewese motorvoertuigbedryf, wat voorts ook toegevoegde waarde bevorder en op dié manier werkskepping regoor die voertuigwaardeketting aanspoor.
","Cabinet also welcomed further investment into our economy by an Irish food company, The Kerry Group, which has opened new R650-million plant in Hammarsdale, KwaZulu-Natal aimed at producing sustainable food for the continent.
",0.67525446
"Plaaslike vervvardiging van inhoud van nagenoeg  8 miljard sal tydens die lewensiklus van die APDP plaasvind.
","The plant is unique as it boasts numerous sustainability features including low energy usage equipment, solar power generation to reduce consumption from the local grid, waste heat capture, and efficient water capture, reuse and reduction.
",0.6141915
"Die belegging sal meer as 1 000 direkte poste by die uitleg skep en 24 000 mense indirek van werk voorsien, wat ŉ aansienlike bydrae tot die opheffing van die plaaslike gemeenskap sal lewer..     Mynwese-indaba.
","The Kerry Group has had presence in South Africa since 2011, and their further investment is sign that South Africa remains an investment destination of choice.
",0.6163236
"Die “Investing in African Mining” Indaba 2022 het vanaf 9 tot 12 Mei by die Kaapstad internasionale konferensiesentrum plaasgevind.
","These investments follow in the footsteps of the launch of the locally manufactured Isuzu D-Max bakkie in Gqeberha in the Eastern Cape last month.
",0.65231705
"Dit is een van die grootste platforms vir interaksie en samewerking tussen belanghebbendes in die mynwese-sektor.
","The new generation D-MAX crowns Isuzu’s commitment to South Africa and is one of the successes achieved under the Automotive Production Development Programme (APDP).
",0.5977567
"Die tema vir die indaba was “Evolusie van die Mynwese in Afrika: Belegging in die Oordrag van Energie, ESG en die Ekonomieë”.
","The APDP is production incentive scheme for the motor industry aimed at promoting production volumes in the specified motor vehicle industry, promoting added value in the automotive component industry thus creating employment across the automotive value chain.
",0.6361201
"Die Kabinet is vol vertroue dat die mynwese-indaba by sal dra tot die tentoonstelling en bevording van Suid-Afrika as ŉ voorkeur-beleggingsbestemming.
","Approximately R2,8 billion will be generated in local content production value through the lifecycle of the APDP.
",0.570812
"Suid-Afrika verwelkom beleggings in ons land en is daartoe verbind om gunstige toestande te skep vir inklusiewe groei en transformasie in die ekonomie..     Internasionale en streeksbande.
","The investment will secure more than 1 000 direct jobs at the plant and indirectly employ 24 000 people, contributing significantly to community upliftment in the region..  Mining Indaba.
",0.69674516
"Die Kabinet verwelkom ook President Ramaphosa se onlangse interaksies met onderskeidelik President Joe Biden van die Verenigde State, President Emmanuel Macron van Frankryk en President Hakainde Hichilema van Zambië, wat op verskillende platforms plaasgevind het.
","The Investing in African Mining Indaba 2022 held at the Cape Town International Convention Centre from 9 to 12 May 2022, is one of the biggest platforms for engagement and collaboration between all stakeholders in the mining industry.
",0.6815941
"Hierdie geleenthede het aan die president die geleentheid gebied om bilaterale verhoudinge en samewerking tussen Suid-Afrika en ons vennootslande te versterk ten opsigte van streeks- en internasionale sake van sleutelbelang, insluitend ŉ vreedsame oplossing tot die konflik in die Oekraïene     Kabinetsbesluite.
","The theme of the event was: “Evolution of African Mining: Investing in the Energy Transition, ESG, and the Economies”.
",0.62852836
"Begrotingstem.
","Cabinet is confident that the Mining Indaba will assist in showcasing and promoting South Africa as an investment destination of choice.
",0.37172753
"Die Kabinet doen ŉ beroep op alle burgers om die onderskeie begrotingstemme deur die nasionale staatsdepartemente en die Presidensie te volg sodat hulle die regering tot verantwoording kan roep..     Tydens die begrotingstem lewer alle departemente ŉ gedetailleerde verslag van hul beplanning en prioriteite vir die jaar.
","South Africa welcomes investments into our country and is committed to creating favourable conditions for inclusive growth and transformation of the economy.
",0.6152531
"Die begrotingstem het ten doel om te verseker dat openbare fondse doeltreffend bestee word om die behoeftes van die publiek te vervul..
","International and regional relations.
",0.2987702
"Die begrotingstem verskaf ook die ideale platform vir ministers om uit te wy oor die werkverrigting van die regering, insluitend suksesse en uitdagings..     Vloeibare petroleumgas (VPG) uitrolstrategie.
","Cabinet also welcomed President Ramaphosa’s recent interactions with President Joe Biden of the United States, President Emmanuel Macron of France and President Hakainde Hichilema of Zambia on different platforms.
",0.65460336
"Die Kabinet keur die VPG-uitrolstrategie goed vir implementering.
","These engagements allowed the President to strengthen bilateral relations and cooperation between South Africa and partner states on key regional and international issues, including finding peaceful solution to the conflict in Ukraine  Cabinet Decisions.
",0.55960786
"Die strategie is in Maart 2022 gepubliseer vir openbare konsultasie.
","Budget Votes.
",0.3540846
"Die strategie het ten doel om die VPG-bedryf in die land uit te brei.
","Cabinet calls on all citizens to follow the various Budget Votes by national government departments and The Presidency so that they can hold the government to account..  During Budget Votes, all departments give detailed account of their plans and priorities for the year.
",0.53117687
"VPG sal ŉ betekenisvolle bydrae lewer tot die diversifikasie van energiebronne..
","Budget Votes seek to ensure that public funds are spent efficiently in meeting the needs of the public..
",0.6236322
"Die strategie sal ingrypings soos die regulering van pryse in die waardeketting en die steun van die vervaardiging van VPG-silinders in die land implementeer.
","They also provide the ideal platform for Ministers to further unpack the work of government, including successes and challenges..  Liquefied Petroleum Gas (LPG) Rollout Strategy.
",0.66893995
"Dit sal ook die publiek inlig oor die voordele van die gebruik van VPG as ŉ alternatiewe vorm van energie..
","Cabinet approved the LPG Rollout Strategy for implementation, which was published for public consultation in March.
",0.5877958
"Die strategie sal beskikbaar wees aan die publiek sodra dit deur die departement van minerale hulpbronne en energie gepubliseer word op www.dmr.gov.za.
","The strategy seeks to expand the LPG industry in the country.
",0.6033551
"Nasionale strategiese raamwerk vir die bewusmakingsveldtogte van die regte van mense met gestremdhede.
","LPG will contribute meaningfully to the diversification of sources of energy..
",0.58769894
"Die Kabinet keur die nasionale strategiese raamwerk vir die bewusmakingsveldtogte van die regte van mense met gestremdhede goed.
","The strategy will amongst other interventions, regulate the pricing in the value chain and support the manufacturing of LPG cylinders in the country.
",0.6446919
"Die raamwerk het ten doel om leiding te bied aan beide die privaatsektor en die openbare sektor om te verseker dat die regte van mense met gestremdhede beskerm word, soos vasgelê in die Grondwet van Suid-Afrika..
","It will also educate the public about the benefits of using LPG as an alternative form of energy..
",0.6249509
"Die raamwerk voorsien die nodige instrumentasie om diskriminerende versperrings in besluitneming te verwyder, veral rakende mense met gestremdhede.
","It will be accessible after it has been published by the Department of Mineral Resources and Energy on www.dmr.gov.za.
",0.57339096
"Dit bemagtig ook mense met gestremdhede om hul regte te ken, soos beskerm deur die Grondwet.
","National Strategic Framework on Disability Rights Awareness-Raising Campaigns for Persons with Disabilities.
",0.5626794
"Die raamwerk verskaf voorts ook opleiding, mediaverslaggewing en bewustheidskepping in die samelewing rakende die regte van mense met gestremdhede..     Dit bekragtig die Witskrif oor die Regte van Mense met Gestremdhede.
","Cabinet approved the National Strategic Framework on Disability Rights Awareness-Raising Campaigns for Persons with Disabilities.
",0.6667329
"Suid-Afrika is ŉ ondertekenaar van die Verenigde Nasies (VN) se Konvensie vir die Regte van Mense met Gestremdhede asook die VN Protokol vir die Afrika Handves vir Menseregte vir die Regte van Mense met Gestremdhede (oftewel die African Disability Rights Protocol).
","The framework seeks to guide both private and public sectors in ensuring the rights of persons with disabilities are protected, as enshrined in the Constitution of the Republic of South Africa of.
",0.66360176
"Die raamwerk is bespreek met alle belanghebbendes, insluitend die nasionale raad vir ekonomiese ontwikkeling en arbeid (Nedlac).
",".
",0.10621817
"Spitsberaad vir grond-administrasie en eiendomsreg in kommunale areas.
","The framework provides toolkit that will assist in the removal of discriminatory barriers in decision-making, especially those related to persons with disabilities.
",0.5895995
"Die Kabinet het die spitsberaad vir grond-administrasie en eiendomsreg in kommunale areas wat op Vrydag, 27 Mei 2022 en Saterdag, 28 Mei 2022 in Gauteng sal plaasvind, goedgekeur..
","It also conscientise persons with disabilities to know their rights as protected by the Constitution.
",0.47156623
"Die Kabinet het in Maart 2021 die standpuntskrif vir grond administrasie en eiendomsreg in kommunale areas aanvaar.
","The framework also provides training, media reporting and awareness-raising within society on the rights of persons with disabilities.
",0.6213337
"Die Kabinet het kennis gegee dat verdere konsultasie met alle belanghebbendes moet plaasvind..
","It gives effect to the White Paper on the Rights of Persons with Disabilities.
",0.5453186
"Die spitsberaad sal die slotsom wees van die werk wat in die afgelope jaar verrig is, waartoe verskeie insethouers bygedra het     Toekomstige Gebeure.
","South Africa is signatory to the United Nations (UN) Convention on the Rights of Persons with Disabilities and the UN Protocol to the African Charter on Human and Peoples’ Rights on the Rights of Persons with Disabilities (African Disability Rights Protocol).
",0.4882581
"Vyfde Wêreldkonferensie oor die uitwissing van kinderarbeid.
","The framework was consulted with all relevant stakeholders, including the National Economic Development and Labour Council.
",0.55268574
"Suid-Afrika sal vanaf Sondag, 15 Mei 2022 tot Vrydag, 20 Mei 2022 gasheer speel vir die vyfde wêreldkonferensie oor die uitwissing van kinderarbeid, wat sal plaasvind by die Durban internasionale konferensiesentrum.
","Land Administration and Land Tenure in Communal Areas Summit.
",0.48755604
"Dit sal die eerste keer wees wat die Internasionale Arbeidsorganisasie (IAO) hierdie konferensie in Afrika hou..     Verskeie staatshoofde, 120 ministers, drieledige kiesers vanuit 187 lidlande van die IAO, VN-agentskappe, akademiese instellings, burgerlike samelewingsorganisasies, nie-staatsinstellings, die media en die burgerlike samelewing sal die konferensie bywoon..
","Cabinet approved the hosting of the Land Administration and Land Tenure in Communal Areas Summit on Friday, 27 and Saturday, 28 May 2022 in Gauteng.
",0.6530898
"Die konferensie sal ook aan Suid-Afrika die geleentheid bied om die land se Grondwet voor te hou, veral met betrekking tot die hoë mate waartoe dit die regte van kinders beskerm.
","Cabinet adopted the Position Paper on Land Administration and Land Tenure in Communal Land Areas in March.
",0.57089794
"Die land sal met verskeie lande wat ons vooruit is in die uitwis van kinderarbeid in gesprekvoering tree en by hulle leer..     Distriksontwikkelingsmodel (DDM) presidensiële imbizo.
","It directed that further consultation be undertaken will all relevant stakeholders.
",0.5015889
"President Ramaphosa sal op Vrydag, 20 Mei 2022 ŉ DDM presidensiële imbizo in Mpumalanga hou met die tema: “Laat niemand agter nie”.
","The summit will be the culmination of the work that was done in the past year, which solicited inputs from various stakeholders  Upcoming Events.
",0.50456065
"As ŉ belangrike openbare platform bied die imbizo aan die President die geleentheid om direk met verskeie insethouers te skakel – veral plattelandse gemeenskappe – en te luister na die kwessies en uitdagings wat hulle ervaar met die oog daarop om dit aan te spreek..
","Fifth Global Conference on the Eradication of Child Labour.
",0.42986315
"Die DDM presidensiële imbizo het ten doel om blokkasies tot geïntegreerde dienslewering te ontsluit en openbare deelname, soos belyn met die DDM, te bevorder.
","South Africa will host the Fifth Global Conference on the Eradication of Child Labour at the Durban International Convention Centre in KwaZulu-Natal from Sunday, 15 to Friday, 20 May.
",0.6275388
"Suid-Afrikaners kan nou gesprekvoering en bespreking op sosiale media volg en self daaraan deelneem met die hutsmerk #PresidentialImbizo.
","It is the first time the International Labour Organisation (ILO) hosts this conference in Africa..
",0.5521774
"Afrika-maand.
","Heads of state, 120 ministers, tripartite constituents of 187 member countries of the ILO, UN agencies, academic institutions, civil society organisations, non-governmental organisations, media and civil society are expected to attend the conference.
",0.4076867
"Die viering van die jaarlikse Afrika-maand en Afrika-dag op Woensdag, 25 Mei 2022 sal plaasvind met die tema: “Die Jaar van Voeding: Die Versterking van die Veerkragtigheid van Voeding en Voedselsekerheid op die Kontinent van Afrika”..     As deel van die langtermynvisie wat in Agenda 2063 uiteengesit is (Agenda 2063 is Afrika se ontwikkelingsbloudruk om inklusiewe en volhoubare sosio-ekonomiese ontwikkeling oor 50 jaar te bereik), fokus die tema op die potensiaal van die mense van Afrika, met klem op vroue, jeugdiges en kinders.
","The event will also allow South Africa to bring to the fore the country’s Constitution as it protects the rights of children.
",0.5726147
"Hierdie is van sleutelbelang tot ontwikkeling aangesien dit lei tot verbeterde lewens vir individue, hoër verdienste en verbeterde inkomstes vir lande.
","The country will engage with different countries that are ahead of us in eliminating child labour and learn from them..  District Development Model (DDM) Presidential Imbizo.
",0.615548
"ŉ Vername hoogtepunt in Afrika-maand se feesvieringe is Afrika-kommunikasieweek, wat vanaf 23 Mei 2022 tot 27 Mei 2022 by Konstitusieheuwel in Johannesburg sal plaasvind.
","President Ramaphosa will hold DDM Presidential Imbizo in Mpumalanga on Friday, 20 May 2022 under the theme: “Leave no one behind”.
",0.71338844
