src_text,tgt_text,cosine_score
"South Africa – Singapore relations
","Izivumelwano ezisayiniwe phakathi kwamazwe womabili zihlose ukuqinisa uhwebo, utshalomali, ezemfundo kanye nokubambisana kwezokuvikeleka..IMbizo kaMongameli yoHlelo Lokuthuthukiswa Kwezifunda (i-DDM) eNtshonalanga Kapa
",0.5035325
"President Ramaphosa hosted Prime Minister Lee Hsien Loong of the Republic of Singapore on Tuesday, 16 May 2023.
","UMongameli u-Ramaphosa ubambe iMbizo kaMongameli ye-DDM yesithupha eNtshonalanga Kapa, kuMasipala Wendawo i-Drakenstein, kwiSifunda sase-Cape Winelands, ngoLwesihlanu ziyi-19 kuNhlaba 2023.
",0.803506
"Singapore is a significant investor in South Africa, with investments totalling over R5 billion in sectors such as manufacturing, financial services and real estate.
","UMongameli uhole ithimba eliphuma kuzo zontathu izinhlaka zikahulumeni ngaphansi kwesiqubulo esithi: “Asishiyi Muntu Ngemuva”.
",0.5269095
"Signed agreements between the two countries aim to strengthen trade, investment, education and defence cooperation..Western Cape District Development Model (DDM) Presidential Imbizo
","IMbizo yandulelwa uhambo lukaMongameli lokuvakashela lapho kwakhiwa khona indawo yokuhlalisa abantu eseduze i-Vlakkeland Catalytic Human Settlement Development, okuluhlelo olukhulu lokwakhiwa kwezindlu zomphakathi olwake lwaba khona kuze kube manje kuMasipala Wendawo i-Drakenstein.
",0.68746424
"President Ramaphosa undertook the sixth DDM Presidential Imbizo to the Western Cape, Drakenstein Local Municipality, Cape Winelands District, on Friday, 19 May 2023.
","Ukwakhiwa okwaqala ngowezi-2017 kuzothi kungaphothulwa bese kuhlinzeka ngezindlu eziyi-2 556 kulabo abafanelekile.
",0.5594629
"The President led a delegation from all three spheres of government under the theme: “Leave No One behind”.
","Ukwakhiwa kwezindlu ezingama-942 kweSigaba Sokuqala kuyaqhubeka, okuyizindlu ezingama-454 eseziphothuliwe kanye nezingama-301 ezisakhiwa.
",0.5216956
"The Imbizo was preceded by the President’s visit to the nearby Vlakkeland Catalytic Human Settlement Development, which is the largest public housing development to date in the Drakenstein Local Municipality.
","Ukubaluleka kwalo mklamo ukuthi ubhekelela izinhlelo zezindlu ezehlukahlukene kusuka kulabo abahola i-R0 kuya kwizi-R3 500 (ngaphansi KoHlelo Oludidiyelwe Lokuhlaliswa Kwabantu), kuya kulabo abasoHlelweni Lokuxhaswa Ngezimali Zokuthenga Indlu, labo abahola phakathi kwezi-R3 501 kuya kwizi-R22 000 ngenyanga.
",0.6734296
"The development that commenced in 2017 will upon completion provide 2 556 houses to qualifying beneficiaries.
","Womabili amathuba Ezindlu Zomphakathi kanjalo namathuba ezindlu Zomakadebona Bezempi akhona kulo mklamo..UHambo Lokuyohlola Umsebenzi kuMasipala Wedolobha laseThekwini kanye noMasipala Wesifunda saseMgungundlovu mhla we-18 nomhla we-19 kuNhlaba 2023.
",0.59710217
"The construction of 942 houses in the First Phase is underway, with 454 completed and 301 under construction.
","IPhini likaMongameli u-Paul Mashatile uxoxisane nababambiqhaza kwezemfundo nokuqeqeshwa, ezolimo, ezentengiselwano kanye nezimboni ngesikhathi sohambo lokuyohlola umsebenzi kuMasipala Wedolobha laseThekwini kanye noMasipala Wesifunda saseMgungundlovu njengengxenye yokuhambela ukuhlola imisebenzi ye-DDEnye yemiklamo ehamba phambili evakashelwe kube yindawo okwakhiwa kuyona i-Ntshongweni Catalytic Project, lapho okwakhiwa khona iDolobha Lesimanjemanje phakathi kweTheku noMgungundlovu.
",0.63915575
"The importance of this project is that it caters for a variety of housing options from those with an income of R0 to R3 500 (under Breaking New Ground), to Finance Linked Individual Subsidy Programme, for those earning between R3,501 and R22 000 per annum.
","Lo mklamo uzovuselela imisebenzi efukula umnotho endaweni, nokufaka igalelo lotshalomali olubiza izigidigidi ezi-R15 eminyakeni eyi-10 kuya kweyi-15 ezayo..Ingqalasizinda yamanzi
",0.6991183
"Both Social Housing opportunities as well as opportunities for Military Veterans are available in this project.
","UMongameli U-Ramaphosa uvakashele umklamo i-Lesotho Highlands Water Project ngoLwesibili, mhla wama-23 kuNhlaba 2023 lapho abe yingxenye womcimbi wokuphendulwa kwesoyi leSigaba Sesibili somklamo.
",0.57113564
"Oversight Visit to eThekwini Metropolitan Municipality and uMgungundlovu District Municipality on 18 and 19 May 2023.
","Lo mklamo owasayinwa eminyakeni eminingi eyadlula futhi wabambezeleka, lo mcimbi ubonisa ukubaluleka kokusheshiswa kwalo msebenzi obalulekile wala mazwe womabili.
",0.5361249
"Deputy President Paul Mashatile engaged stakeholders in education and training, agriculture, commerce and industry during an oversight visit to the eThekwini Metropolitan Municipality and uMgungundlovu District Municipality as part of the DDM oversight visits.
","Umklamo i-Lesotho Highlands Water Project ubaluleke kakhulu ekuqinisekiseni ukutholakala kwamanzi e-Gauteng, eFreyistata, eMpumalanga, eNyakatho Ntshonalanga naseNyakatho Kapa.
",0.7082637
"One of the key projects visited was the Ntshongweni Catalytic Project site, where a Smart City is being constructed between Durban and Pietermaritzburg.
","Ukutshalwa kwezimali kwingqalasizinda yamanzi ukuze kuzothuthukiswa izimpilo zabantu baseNingizimu Afrika kuyaqhubeka njengoba kwatshelwe omasipala imali engaphezu kwezigidigidi ezi-R14 ukuthi babhekana nenkinga yokusilela emuva kwingqalasizinda yamanzi, ngokusebenzisa iSibonelelo Sengqalasizinda Yezifunda (i-RBIG) kanye neSibonelelo Sengqalasizinda Yezinsizakalo Zamanzi (i-WSIG).
",0.6648646
"The project will revitalise economic activity in the area, contributing about R15 billion worth of investments in the next 10 to 15 years.
","I-RBIG izosetshenziswa kwimiklamo eyi-130 bese kuthi i-WSIG yona izofakwa kwimiklamo engama-400 kulolonke izwe.
",0.65126264
"Water infrastructure
","IKhabhinethi liphinde lathokozela ukuthi uMnyango Wamanzi Nokuthuthwa Kwendle (i-DWS) uthatha amagxathu ekulweni nenkohlakalo njengoba usuthole cishe izigidi ezingama-R600 ezikhokhwe yizinkampani ezazuza ngokuthola amathenda ngokungekho emthethweni.
",0.33938235
"President Ramaphosa visited the Lesotho Highlands Water Project on Tuesday, 23 May 2023 during which he participated in the sod-turning ceremony of Phase 2 of the project.
","IKhabhinethi liphinde laziphawula izinyathelo zokulawula ezibekwe ngumnyango zokuqeda ukusetshenziswa kwezimali okungahambisani nomthetho, okungenasidingo nokumoshayo.
",0.511331
"Signed a number of years back and having faced delays, this ceremony signified the pacing up of this critical binational initiative.
","Indondo Yezokuvikeleka Komphakathi
",0.3691938
"The Lesotho Highlands Water Project is critical in ensuring security of water supply in Gauteng, the Free State, Mpumalanga, North West and Northern Cape.
","INingizimu Afrika ithole iNdondo Yomsebenzi Omuhle kwezoKuvikeleka Komphakathi e-Afrika ngowezi-2023 yeNhlangano Yamazwe Ngamazwe Kwezokuvikeleka Komphakathi (i-ISSA), ebonisa ukubonga ukuzinikela kukahulumeni ezimpilweni zabantwana bethu, ikakhulukazi labo abaphuma emakhaya adla imbuya ngothi futhi abuthakathaka.
",0.6663395
"The investment in water infrastructure to uplift the lives of South Africans continues with the allocation of over R14 billion to municipalities to address water infrastructure backlogs, through the Regional Bulk Infrastructure Grant (RBIG) and the Water Services Infrastructure Grant (WSIG).
","Isicelo sokungenela ukuthola le ndondo seNingizimu Afrika sasinesihloko esithi: “Ukwandiswa kancane kancane kokuvikeleka kwenhlalo yabantwana ababuthakathaka: Udaba lweSibonelelo Sabantwana, eNingizimu Afrika”.
",0.6999088
"The RBIG will be spent on 130 projects and the WSIG will be allocated to over 400 projects across the country.
","Inani eliphelele lezicelo zokungenela ezamukelwa zazisuka ezikhungweni ezingamalungu ezingama-48 emazweni angaphezu kwama-30 e-Afrika.
",0.67229104
"Cabinet is also pleased that the Department of Water and Sanitation (DWS) is making strides in the fight against corruption with nearly R600 million repaid by companies who benefited from receiving irregular tenders.
","Izibonelelo zethu zomphakathi zingummongo wohlelo lukahulumeni lokuqeda ububha futhi zingumnyombo wokubuyisa isithunzi sabantu bakithi.
",0.60597336
"Cabinet also noted the preventative control measures put in place by the department to eliminate irregular, fruitless and wasteful expenditure.
","Uhlelo lweNingizimu Afrika lokuvikela umphakathi luphakathi kwezinhlelo ezinkulukazi emhlabeni, njengoba lunabantu abangaphezu kwezigidi eziyi-18 abahlomula kulona..Amavoti Ezabelomali
",0.5548481
"Social Security Award
","IKhabhinethi liyathokoza ukuthi amaVoti Ezabelomali eminyango kahulumeni aqhubeka kahle.
",0.4076374
"South Africa has received the prestigious International Social Security Association (ISSA) Good Practice Award in Social Security for Africa 2023, which recognises government’s investment in the lives of our children, especially those from poor and vulnerable households.
","Uhlelo lwamaVoti Ezabelomali azayo kanye nezithangami zabezindaba:.NgoLwesihlanu mhla wama-26 kuNhlaba 2023 ngehora le-13:00, uNgqongqoshe Wezokubusa Ngokubambisana Nezindaba Zendabuko (i-CoGTA), uNks Thembi Nkadimeng, uzobamba isithangami sabezindaba mayelana neVoti leSabelomali elizocacisa izinyathelo okuhloswe ngazo ukuqinisa ukusebenza komasipala..NgoLwesibili, mhla wama-30 kuNhlaba 2023, uNgqongqoshe Wezokuthuthukiswa Komphakathi, uNks Lindiwe Zulu, kanye noNgqongqoshe Wezobulungiswa Nokuhlunyeleliswa Kwezimilo, uMnu Ronald Lamola, bazoba namaVoti Ezabelomali kanti imininingwane yezithangami zabezindaba izokhishwa ngokuhamba kwesikhathi..IVoti Lesabelomali leHhovisi likaMongameli lizokwethulwa ngoLwesithathu, mhla wama-31 kuNhlaba 2023 kanti isithangami sabezindaba ngeNqubekelaphambili Yezinguquko Zezakhiwo kanye Nemizamo Yokusungula Imisebenzi ehlanganiswa ngohlelo lwe-Operation Vulindlela sizoba ngoLwesibili, mhla wama-30 kuNhlaba 20
",0.70495635
"South Africa’s entry to this prestigious award was titled: “Gradual extension of social security coverage to vulnerable children: The case of the Child Support Grant, South Africa”.
","USuku Lwe-Afrika kanye nokubungaza iminyaka engama-20 yeNdlela Yokuhlolana Kwamazwe ase-Afrika (i-APRM)
",0.60200274
"A total of 138 entries were received from 48 member institutions in over 30 countries in Africa.
","IKhabhinethi nabobonke abantu baseNingizimu Afrika bahlanganyele nezwekazi lase-Afrika nomhlaba wonke ukubungaza uSuku lwe-Afrika ngoLwesine, mhla wama-25 kuNhlaba.
",0.57946986
"Our social assistance is at the heart of government’s poverty alleviation programme and central to restoring the dignity of our people.
","Lo nyaka ubalulekile ikakhulukazi njengoba uluphawu lokuphela kweminyaka engama-60 kwasayinwa isisekelo somqulu weNhlangano Yobumbano Lwamazwe ase-Afrika, eyandulela uBumbano Lwamazwe Ase-Afrika.
",0.6293454
"South Africa’s social protection system is amongst the largest in the world, with more than 18 million beneficiaries..Budget Votes
","Isiqubulo semibungazo yangowezi-2023 esithi - “Ukusheshisa Ukuqaliswa Kokuhwebelana Ngaphandle Kokukhokha Intela Kwamazwe Asezwenikazini i-Afrika” – sibonisa amagxathu athathwayo ekuqaliseni ukusebenza kwale nkundla yokuhweba enkulukazi emhlabeni.
",0.61564887
"Cabinet is pleased that Budget Votes by government departments are progressing well.
","Umbungazo weNyanga ye-Afrika wakulo nyaka uqondane nokuphela kweminyaka engama-20 ye-APRM, okuhloswe ngako ukuqinisa ukubusa kahle ezwenikazini ngokulandela izindlela zokuthi izwe lifunde kwelinye izwe futhi aphinde ahlolane wona.
",0.584226
"The schedule of upcoming Budget Votes and supporting media briefings:.Friday 26 May 2023 at 13:00, the Minister of Cooperative Governance and Traditional Affairs (CoGTA), Ms Thembi Nkadimeng, will conduct a media briefing on the CoGTA Budget Vote which will outline measures aimed at strengthening the performance of municipalities..On Tuesday, 30 May 2023, the Minister of Social Development, Ms Lindiwe Zulu, and the Minister of Justice and Correctional Services, Mr Ronald Lamola, will hold their Budget Votes and details of their media briefings will be shared in due course.
","Izinqumo zeKhabhinethi.
",0.2071462
"The Presidency’s Budget Vote will be tabled on Wednesday, 31 May 2023 and the media briefing on Progress with Structural Reforms and the Employment Initiatives coordinated through Operation Vulindlela will be held on Tuesday, 30 May 20
","INdawo Yomnotho Okhethekile (i-SEZ) e-Namakwa
",0.5033348
"Africa Day and the African Peer Review Mechanism (APRM) 20 year anniversary
","IKhabhinethi ligunyaze ukubekwa kwe-SEZ e-Namakwa e-Aggeneys eNyakatho Kapa.
",0.54340136
"Cabinet and all South Africans join the African continent and the globe in celebrating Africa Day on Thursday, 25 May.
","Lesi sethulo sokubekwa senziwe ngokwemigomo yoMthetho Wezindawo Zomnotho Okhethekile, wezi-2014 (uMthetho we-16 wezi-2014) futhi i-SEZ eyethuliwe iyingxenye yoMkhankaso KaMongameli Wotshalomali.
",0.5797204
"This year is particularly important as it marks the 60th anniversary of the signing of the founding charter of the Organisation of African Unity, the forerunner to the African Union.
","I-SEZ yase-Namakwa izovula amathuba okuhlomula ezimayini, ukukhiqizwa kwehayidrojini ehlanzekile, ukuthuthukiswa kwezingqalasizinda, ugesi ovuselelekayo kanye nokwenziwa kwemikhiqizo yezolimo.
",0.5945089
"The theme for the 2023 celebrations – “Acceleration of the African Continental Free Trade Area implementation” – acknowledges the strides being made in bringing into operation of the world’s largest free trade area.
","Le mikhakha ibaluleke kakhulu ekusungulweni kwemisebenzi kanye nokuthuthukiswa komnotho waseNyakatho Kapa nowezwe.
",0.58404857
"This year’s Africa Month commemoration coincides with the 20th anniversary of the APRM, which is aimed at fostering good governance in the continent through systematic peer learning and self-assessment.
","Lungaphezu kwezigidigidi ezingama-R29 utshalomali oseluvele luthenjisiwe esigabeni sokuqala se-SELokhu kubandakanya izithembiso eziphuma ku-Vedanta Zinc (izigidigidi eziyi-R16), e-Frontier Rare Earth (izigidigidi eziyi-R13), e-Hive Energy (izigidi ezingama-R200) kanye nase-RRS Trade and Investment (izigidi eziyi-R100)..UShicilelo Lwesithathu Lweqhingasu Likazwelonke Lwezinsiza Zamanzi (i-NWRS-3) lwangowezi-2023.
",0.683396
"Cabinet decisions.
","IKhabhinethi ligunyaze i-NWRS-3 yangowezi-2023 ukuthi iqaliswe futhi leli qhingasu liphoqa zonke iziphathimandla kanye nezikhungo ezisebenzisa uMthetho Kazwelonke Wamanzi, we-1998 (uMthetho wama-36 we-1998).
",0.40312955
"Namakwa Special Economic Zone (SEZ)
","Leli qhingasu lakhiwe ngokubuyekezwa kweminyaka emithathu ye-NWRS-2, okuveze izindawo lapho kube nempumelelo khona kanye nezindawo ezisanenselele.
",0.5081105
"Cabinet approved the designation of the Namakwa SEZ in Aggeneys in the Northern Cape.
","I-NWRS-3 iqukethe izinhlosonqangi ezintathu, zokuthi ezamanzi nokuthuthwa kwendle kufanele zeseke ukuthuthukiswa, ukuqedwa kobubha nokungalingani, zifake igalelo emnothweni nasekusungulweni kwemisebenzi, futhi amanzi kufanele avikelwe, asetshenziswe, athuthukiswe, aphathwe futhi alawulwe ngokusimeme nangokulingana.
",0.5635635
"The proposed designation is done in terms of the Special Economic Zones Act, 2014 (Act 16 of 2014) and the proposed SEZ is part of the Presidential Investment Drive.
","Leli qhingasu lenza izethulo ezibambekayo zokukhushulwa kokuthunyelwa kwamanzi, ukunciphisa ukudingeka kwamanzi, ukuphathwa ngendlela kwamanzi nokuthuthwa kwendle, ukubekwa kwezinqubomgomo emkhakheni wezamanzi nokuthuthwa kwendle, ukuphakwa kwamanzi ukuze kuzokwenzeka izinguquko, ukugqugquzela ukubambisana kwamazwe ngamazwe, kanye nokuphathwa kwamanzi nokuthuthwa kwendle ngaphansi kwesimo sezulu esiguquguqukayo.
",0.62250704
"The Namakwa SEZ will unlock mining beneficiation, production of green hydrogen, infrastructure development, renewable energy and agro-procession.
","I-NWRS-3 ishicilelwe kwiwebhusayithi yase-DWS ethi: WEBTOKEN..Umbiko ngezinyathelo eziqaliswe nguMnyango Wezokuvikeleka (i-DoD) ukubhekana nendlela yokuziphatha kwamalungu oMbutho Wezokuvikeleka Kuzwelonke eNingizimu Afrika (i-SANDF) atshalwe kwimisebenzi yokuletha ukuthula.
",0.710029
"These sectors are critical to job creation and economic development of the Northern Cape and the country.
","IKhabhinethi lithole umbiko ngenqubekelaphambili eyenziwa iNingizimu Afrika ekubhekaneni nendlela yokuziphatha kwamanye amalungu e-SANDF atshalwe kwimisebenzi yokugcina ukuthula kulolonke izwekazi.
",0.6506355
"More than R29 billion in investments has already been committed for phase one of the SEThese include commitments from Vedanta Zinc (R16 billion), Frontier Rare Earth (R13 billion), Hive Energy (R200 million) and RRS Trade and Investment (R100 million)..National Water Resource Strategy Third Edition (NWRS-3) 2023.
","I-SANDF ibilokhu ingumthombo wokuzigqaja kwesizwe njengoba iyingxenye yemisebenzi yokugcina ukuthula ezwenikazini eletha uzinzo nokuthula ezizweni zase-Afrika ezibambene ngempi ngosizo lweZizwe Ezibumbene (i-UN).
",0.6303779
"Cabinet approved the NWRS-3 2023 for implementation and the strategy is binding on all authorities and institutions implementing the National Water Act, 1998 (Act 36 of 1998).
","Mayelana nezinsolo zamacala ezocansi abandakanya abagcini bokuthula bombutho wezokuvikeleka ezaqubuka ngowezi-2015, iThimba loNgqongqoshe lasungulwa ngowezi-2019 ukuze lizophenyisisa amacala okuxhashazwa nokuhlukunyezwa ngokocansi (i-SEA) ngaphakathi e-DoIKhabhinethi lithokozile ngeqoqo lezinyathelo ezibekiwe ukubhekana nezehlakalo ze-SEA kwimisebenzi ye-SANDF yokugcina ukuthula.
",0.6857342
"This strategy is informed by a three-year review of the NWRS-2, which identified areas of success and areas that remain a challenge.
","I-UN iyayibonga iNingizimu Afrika ngokwenza kahle futhi yancoma leli lizwe ngenqubekelaphambili eliyenzile ngokuqeda i-SEA kwi-SANDIKhabhinethi ligcizelele ukuthi izenzo ze-SEA ngeke zimukeleke ukudicilela phansi umlando omuhle we-SANDF ezwenikazini..INyanga Yentsha yangowezi-2023 IKhabhinethi ligunyaze uHlelo Lwenyanga Yentsha lwangowezi-2023 ngaphansi kwesiqubulo esithi: “Ukusheshisa Ukukhululwa Komnotho Wentsha Ukuze Izoba Nekusasa Elisimeme”.
",0.6210643
"The NWRS-3 comprises three thematic goals, that water and sanitation must support development, the elimination of poverty and inequality, contribute to the economy and job creation, and water must be protected, used, developed, managed and controlled sustainably and equitably.
","IPhini likaMongameli u-Mashatile uzokwethula inkulumo yoSuku Lukazwelonke kulo nyaka oluzobe lugujwa ngezinsuku ezimbili kusuka mhla we-16 kuya mhla we-17 kuNhlangulana 2023 e-Mangaung Outdoor Sport Centre, e-Mangaung, e-Bloemfontein, eFreyistata.
",0.626137
"This strategy makes tangible proposals for increasing water supply, reducing water demand, effective water and sanitation management, regulating the water and sanitation sector, redistributing water for transformation, promoting international cooperation, and managing water and sanitation under a changing climate.
","Kulezi zinsuku ezimbili, kuzoba nethuba lokuthi intsha ibe yingxenye yenkulumo-mpendulwano noNgqongqoshe kanye nabanye ababambiqhaza mayelana nokuqeqeshwa okwehlukahlukene, amathuba amabhizinisi nawokuzithuthukisa akhona kuhulumeni nakulabo okubanjisenwe nabo emphakathini.
",0.71497077
"The NWRS-3 is published on the DWS website on WEBTOKEN..Report on measures implemented by the Department of Defence (DoD) to address the conduct and behaviour of South African National Defence Force (SANDF) members deployed in peace missions.
","INyanga Yentsha izokwethulwa ngoLwesine, mhla lu-1 kuNhlangulana nguNgqongqoshe eHhovisi likaMongameli laBesifazane, Intsha kanye Nabantu Abaphila Nokukhubazeka, uDkt Nkosazane Dlamini Zuma kwisigcinamagugu i-Hector Pieterson Memorial and Museum e-Soweto.
",0.698974
"Cabinet received a report on progress South Africa is making to address the conduct of some of the members of the SANDF deployed in peace-keeping missions across the continent.
","IKhabhinethi linxusa umphakathi ukuthi uqinise imizamo yokuqinisekisa ukuthi abantu abasha bayafinyelela emathubeni azobavumela ukuthi babe yingxenye yomnotho.
",0.655989
"The SANDF has been a source of national pride as it participates in peacekeeping missions on the continent to secure stability and peace in war torn African nations under the auspices of the United Nations (UN).
","Uhulumeni, njengomqashi omkhulu, usephendulile kwisidingo sokuthuthukiswa kwamakhono nokuqashwa kwentsha ngokuvulela labo abaneziqu kodwa abangasebenzi ukuthi bathole ulwazi lomsebenzi ngohlelo lwe-Public Service Graduate Internship and Learnership Programme.
",0.64498705
"With allegations of sexual offences involving military peacekeepers surfacing in 2015, a Ministerial Task Team was established in 2019 to investigate cases of sexual exploitation and abuse (SEA) within the DoCabinet is pleased by the set of measures that have been put in place to address the incidents of SEA in the SANDF peace keeping missions.
","Uhulumeni uphinde waqalisa isikhwama i-Social Employment Fund (i-SEF) wabuye wavuselela imizamo ye-National Youth Service (i-NYS) yokusungula imisebenzi edonsele izinkulungwane zabantu abasha emnothweni.
",0.7000829
"The UN recognises South Africa as best practices and had commended the country for the progress it has made to stamping out SEA in the SANDCabinet emphasised that the practice of SEA will not be allowed to tarnish the good record of the SANDF on the continent..2023 Youth Month Cabinet approved the 2023 Youth Month Programme under the theme: “Accelerating youth economic emancipation for a sustainable future”.
","UHlelo lukaMongameli Lokusungulela Intsha Imisebenzi seluvele luphumelele ukuthola amathuba emisebenzi yesikhashana ekhokhelayo eyizigidi ezi-1.5, abayisigidi abafakwe emisebenzini, amathuba ayizi-250 000 okufunda usebenza, amathuba ayizi-250 000 emisebenzi ekhokhelayo kanye nabantu abasha abayizi-500 000 abasemathubeni okuhola okusimeme.
",0.6549368
"Deputy President Mashatile will address the National Day which will this year be celebrated over a two day period from 16 to 17 June 2023 at the Mangaung Outdoor Sport Centre, Mangaung, Bloemfontein, in the Free State.
","Njengoba siqala iNyanga Yentsha, uhulumeni ukhumbuza abantu abasha ukuthi babhalise kwinkundla WEBTOKEN njengoba ozakwabo abayizigidi ezine benzile, lapho amathuba emisebenzi etholakala khona..Ukusingathwa kanyekanye kweNgqungquthela Yesi-8 Yamabhizinisi Ezolimo e-Afrika kanye neViki Lesayensi leForamu Yezocwaningo Lwezolimo e-Afrika (-FARA) noMhlangano Omkhulu wesi-9.
",0.71341807
"Over the two days, there will be the opportunity for youth to participate in dialogues with Ministers, Deputy Ministers and other stakeholders on various training, entrepreneurial and developmental opportunities available within government and social partners.
","IKhabhinethi ligunyaze ukuthi iNingizimu Afrika isingathe kanyekanye iNgqungquthela yesi-8 Yamabhizinisi Ezolimo e-Afrika kanye neViki Lesayensi ye-FARA noMhlangano Omkhulu wesi-9 eThekwini kusuka mhla wesi-5 kuya mhla wesi-9 kuNhlangulana 2023.
",0.6688448
"Youth Month will be launched on Thursday, 1 June by the Minister in The Presidency for Women, Youth and Persons with Disabilities, Dr Nkosazana Dlamini Zuma at the Hector Pieterson Memorial and Museum in Soweto.
","I-FARA iyinhlangano yezwekazi esesiqongweni elawula futhi ihlanganise ucwaningo lwezolimo nokuthuthukisa ukusungulwa kwemikhiqizo emisha ezwenikazini.
",0.62666357
"Cabinet urged society to intensify efforts to ensure young people access opportunities which allow them to enter active participation in the economy.
","Ngokusingatha lo mcimbi, iNingizimu Afrika izozuza ngokubambisana nangokusebenzisana nezikhungo zezwekazi zezolimo nocwaningo ngokwabelana imisebenzi emihle yesayensi yezolimo nocwaningo.
",0.6180124
"Government, as the largest employer, has responded to the need for skills development and youth employment by enabling unemployed graduates to gain experience through the Public Service Graduate Internship and Learnership Programme.
","INingizimu Afrika ilwazisa kakhulu ucwaningo lwezolimo kwezentuthuko, ikakhulukazi uma kukhulunywa ngokuguquguquka kwesimo sezulu kanye nezinye izimo ezikhinyabeza ikhono lezwe lokuthi kube nokudla, ukuthuthukiswa komnotho kanye namathuba emisebenzi.
",0.684592
"Government is also implementing the Social Employment Fund (SEF) and revitalised National Youth Service (NYS) job-creation initiatives that draw thousands of young people into the economy.
","Ingqungquthela kulindeleke ukuthi ihehele izihambeli ezingama-800 KwaZulu-Natali nase-Gauteng, futhi lokhu kuzofaka igalelo emnothweni..Izindaba zohwebo
",0.6842257
"The Presidential Youth Employment Intervention has already successfully supported access to 934 563 temporary earning opportunities for young people across the country.
","IKhabhinethi lithole umbiko okhombisa inqubekelaphambili kuhwebo lezwe kanye nohlelo lokuthunyelwa kwempahla kwamanye amazwe.
",0.5747597
"As we enter Youth Month, government reminds young people to join over million of their compatriots and register on the WEBTOKEN platform to access a wide range of learning and earning opportunities.
","Lo mbiko ubonise ukuthi iNingizimu Afrika ithumele emazweni ayi-12 impahla yenani eliyizigidigidi ezingama-R300 ngowezi-2022, lokho okudale amathuba emisebenzi abalelwa kwizi-57 300.
",0.66465783
"Co-hosting of the Forum for Agricultural Research in Africa’s (FARA) 8th African Agri-Business and Science Week Conference and its 9th General Assembly.
","Abaqashiwe Bonke abaqashiwe kumele kuqinisekiswe iziqu zabo futhi bahlolwe ngokufanele.
",0.44728333
