src_text,tgt_text,cosine_score
"10 May – 29th Anniversary of the Inauguration of first democratically elected president
","UMhla we-10 kuNhlaba – Ukuphela kweminyaka engama-29 yokuGcotshwa kukamongameli wokuqala owakhethwa ngentando yeningi labantu.
",0.7342065
"This Cabinet meeting took place exactly 29 years to the day when President Nelson Mandela was inaugurated as the first President of a democratic South Africa on 10th May 1994.
","Lo mhlangano weKhabhinethi ubanjwe waqondana ngqo nosuku lweminyaka engama-29 lapho uMongameli u-Nelson Mandela wagcotshwa njengoMongameli wokuqala wentando yeningi labantu eNingizimu Afrika mhla we-10 kuNhlaba 1994.
",0.9036137
"After three and a half centuries of colonialism and separate development where one’s ability to have access to basic services were on the basis of one’s skin colour, a democratic South Africa set inclusive development goals to achieve a prosperous, non-racial, non-sexist and equal society.
","Emva kweminyakakhulu emithathu nesigamu yobuqonela kanye nokuhlukana kwentuthuko lapho umuntu ukuze afinyelele kwizidingonqangi kwakuya ngebala lesikhumba sakhe, iNingizimu Afrika yentando yeningi labantu yabeka imigomo yentuthuko ebandakanya wonke umuntu ukuze kuzoba nomphakathi ophumelelayo, ongacwasi ngokwebala, ongabandlululi ngokobulili futhi olinganayo.
",0.9049434
"While many gains have been made since 1994, much more still needs to be done to realise the country’s development goals.
","Ngesikhathi kukuningi esikuzuzile kusukela ngowe-1994, kusekuningi futhi okusafanele kwenziwe ukuze sizofeza amaphupho entuthuko yaleli lizwe.
",0.88137925
"The South African Reserve Bank has released an upgraded series of banknotes and coins, which celebrate our constitutional democracy and pay tribute to our beloved Madiba.
","IBhangengodla laseNingizimu Afrika likhiphe uchungechunge lwezinhlamvu namaphepha emali abuyekeziwe, okungukubungaza intando yeningi labantu yomthethosisekelo kanye nokuhlonipha uMadiba wethu esimthandayo..INgqungquthela Yezempilo KaMongameli
",0.86576545
"Presidential Health Summit
","INgqungquthela Yezempilo kaMongameli eyayibanjwe mhla wesi-4 kuya mhla wesi-5 kuNhlaba 2023 yayigxile ezinsikeni eziyisishiyagalolunye zoHlelo Lwezempilo LikaMongameli lwezi-2019: izindaba zabasebenzi ukufinyelela emithini yokwelapha, imigomo nemikhiqizo yezempilo ingqalasizinda ukuxoxisana nomkhakha ozimele ukunakekelwa kwezempilo okusezingeni eliphezulu ukwenza ngcono ukuphathwa kwezimali zomphakathi ukubusa nobuholi ukuxoxisana nemiphakathi izindlela zokudlulisa ulwazi kanye nokulungela izifo eziwubhubhane.
",0.4006741
"The second Presidential Health Summit held on 4-5 May 2023 focussed on nine pillars of the 2019 Presidential Health Compact: human resources access to medicine, vaccines and health products infrastructure private sector engagement quality healthcare public sector financial management improvements governance and leadership community engagements information systems and pandemic preparedness.
","Eminye yemiphumela yeNgqungquthela kwaba kunguvuselela ukuzinikela ekuqalisweni koMshwalense Kazwelonke Wezempilo (i-NHI).
",0.62535644
"One of the outcomes of the Summit was the renewed commitment to implement the National Health Insurance (NHI).
","Lena yingxenye yohlelo lokunciphisa ukungafani ekufinyeleleni kwizinsizakalo zokunakekelwa ngokwezempilo ngokususa umthwalo wezezimali zokuthola izinsizakalo zokunakekelwa ngokwezempilo.
",0.6541581
"This is part of a programme to reduce disparities in accessing health care services by alleviating the financial burden for accessing healthcare services.
","IKhabhinethi lamukele ukuvunywa kwezinyathelo ezidingekayo ukulungisa kabusha uhlelo lwezempilo kanye nokusheshisa izinguquko ze-NHLokhu kuzosondeza izinhlelo zethu zezempilo eduze ukuze zisize abantu baseNingizimu Afrika..Ezamandla
",0.69462585
"Cabinet welcomes the adoption of measures that are needed to recalibrate the health system and accelerate the NHI reforms.
","Uhulumeni usebenza ngokusondelana kakhulu no-Eskom ukusheshisa ukulungiswa kwamayunithi aholele ekutheni izwe libe kwiSigaba sesithupha sokucimakonga ugesi ezinsukwini ezedlule nokukhinyabeze inqubekelaphambili ohlelweni lokuthuthukisa ukutholakala kukagesi ezweni.
",0.7263135
"These move our health systems closer to better serve South Africans.
","Umsebenzi onzima uyaqhubeka kwa-Eskom wokukhuphula uHlelo Lokutholakala Kukagesi ngokunakekela okusimeme, okukhuphula ukusetshenziswa kweziphehli zegesi ama-Open Cycle Gas Turbine, lokho okuzokwenza kutholakale umthamo owengeziwe kubatshalizimali abazimele bakagesi ovuselelekayo kanye nokuqwashisa ngokwenza ngcono uKulawulwa Kokusetshenziswa Kukagesi kusuka kulabo abasebenzisa ugesi omningi nasemakhaya.
",0.62932336
"Energy
","Izenzo zokucekela phansi ziyaqhubeka nokukhathaza ingqalasizinda yakwa-Eskom kanjalo nokutshalwa kwamalungu e-SANDF angama-880 ukuthi aqaphe iziteshi zikagesi eziningi zika-Eskom kuyingxenye yezinyathelo zokugwema imizamo yokuwisa isizinda sikagesi sikazwelonke.
",0.24999647
"Government is working closely with Eskom to fast-track the repair of units that have resulted in Stage 6 load shedding in recent days and frustrated progress in the programme to improve energy security in the country.
","IKhabhinethi lamukele isinqumo sokudlulisa isinqumo sakamuva seNkantolo Ephezulu yasePitoli esiyalele u-Eskom ukuthi izikhungo zomphakathi, okubandakanya izikole, imitholampilo, izibhedlela, kanye neziteshi zamaphoyisa zingacishelwa ugesi ngenhloso yokuwonga ngokubhekela imithelela yalesi sahlulelo.
",0.71545994
"Intense work is underway at Eskom to increase the Utility’s Energy Availability Factor through substantial maintenance, maximising the use of Open Cycle Gas Turbines, securing additional generation capacity from private investment in renewables and scaling up awareness to improve Demand Side Management from large electricity users and from households.
","IKhabhinethi lifisa ukukhumbuza abantu baseNingizimu Afrika ukuthi baqhubeke nokonga ugesi oyi-1 000MW kuzwelonke..UKuthuthukiswa Kwengqalasizinda Umkhankaso wengqalasizinda yaseNingizimu Afrika wokuvuselela umnotho nokusungula imisebenzi uyaqhubeka nokuthola umfutho.
",0.748139
"Acts of sabotage continue to plague the Eskom’s infrastructure and therefore the continued deployment of 880 SANDF members to safeguard a number of Eskom power stations is part of measures to prevent attempts to collapse the national grid.
","Mayelana nalokhu, uNgqongqoshe Wezokuthutha, uNks Sindi Chibunga uqalise umklamo we-Ashburton Interchange Project obiza izigidigidi ezi-R.4 kuMasipala waseMsunduzi KwaZulu-Natali, ozothuthukisa ukuthuthwa okungenazihibe kwempahla esuka kwiChweba laseThekwini iya ezweni lonkana kanye nasesifundeni se-SADUNgqongqoshe Wesemisebenzi Kahulumeni Nengqalasizinda, uMnu Sihle Zikalala usedlulise amachweba amancane ayi-13 alungiswe kabusha kusetshenziswa izigidi ezingama-R501 zoHlelo Lukahulumeni Lokulungiswa Kabusha Nokunakekelwa Kwamachweba Amancane.
",0.70471036
"Cabinet welcomed the decision to appeal the recent Pretoria High Court ruling that instructed Eskom to exempt public institutions, including schools, clinics, hospitals, and police stations, from load shedding based on the implications of this judgement.
","Ukulungiswa kwala machweba kuzokhuphula ukusebenza kahle kwawo futhi kusize umkhakha wendawo wezokudoba kanye neminye imikhakha kwiminotho yendawo..Uhambo lokuvakashela e-Jagersfontein
",0.6581129
"Cabinet wishes to remind South Africans to continue to save electricity towards the national target to save 1000MInfrastructure Development
","IPhini likaMongameli, u-Paul Mashatile uthathe uhambo lokuvakashela e-Jagersfontein, kuMasipala Wendawo i-Kopanong kwiSifunda sase-Xhariep eFreyistata.
",0.6562564
"South Africa’s infrastructure drive to revitalise the economy and create employment continues to gain momentum.
","Kube nezimpendulo ngokuphakelwa okuyimpumelelo nokulinganayo kwamanzi, kanye nokuhlaliswa kabusha kwamalungu omphakathi akhahlanyezwa yinhlekelele eyadalwa ngukuqhuma kothango lwedamu.
",0.6509697
"In this regard, the Minister of Transport, Ms Sindi Chikunga broke ground for the Ashburton Interchange Project worth R.4-billion in Msunduzi Municipality in KwaZulu-Natal, which will improve the seamless movement of cargo from the Port of Durban into the country and the SADC region.
","IKhabhinethi licele bonke abezakhiwo zemayini ukuthi babhalise amadamu agcina izinsalela zemikhiqizo yemayini noma amadamu emfucuza yemayini ohlwini loMnyango Wezamanzi Nokuthuthwa Kwendle ukuze kuzoqinisekiswa ukuthotshelwa kwemithetho yokuphepha kwamadamu.
",0.7129322
"Minister of Public Works and Infrastructure, Mr. Sihle Zikalala has handed over 13 small harbours refurbished through the R501 million government’s Small Harbours Repairs and Maintenance Programme.
","UMnyango Wezamanzi Nokuthuthwa Kwendle njengamanje ubuyekeza uhlu lwamadamu agcina izinsalela noma amadamu agcina imfucuza yezimayini kuleli lizwe ahlangabezana nezimfuneko ezizobizwa ngokuthi yi- ""Dams with Safety Risk”.
",0.67738265
"The refurbishment of these harbours will increase their efficiency and better serve the local fishing sector and other sectors in local economies.
","Ngemininingwane ethe xaxa mayelana namadamu agcina imfucuza yasemayini ungathumela i-imeyili EMAILTOKEN INgqungquthela Yezokuvakasha e-Afrika
",0.65284383
"Oversight visit to Jagersfontein
","INgqungquthela Yezokuvakasha e-Afrika yangowezi-2023 iyaqhubeka e-Inkosi Albert Luthuli International Convention Centre eThekwini, eyethanyelwe imboni yezokuvakasha e-Afrika, okungamazwe angaphezu kwama-20 ase-Afrika abambe iqhaza futhi abeke nemibukiso yemikhiqizo yezokuvakasha engaphezu kwama-350.
",0.55542505
"Deputy President, Paul Mashatile conducted an oversight visit Jagersfontein, Kopanong Local Municipality in the Xhariep District of the Free State.
","Lo mcimbi uyinkundla ebaluleke kakhulu ukuze izingcweti zalo mkhakha zizohlanganyela ndawonye, zabelane ngamasu futhi zakhe ubudlelwano obuzozikhulisa.
",0.61788714
"Feedback on the efficient and equitable supply of water, and the resettlement of community members who were affected by the disaster caused when the dam wall burst.
","INingizimu Afrika iyazigqaja ngokuthi uhulumeni weseka amabhizinisi amancane, aphakathi, namancanyana, aphethwe ngabesifazane kanye nentsha emkhakheni wezokuvakasha nokungcebeleka..Amavoti Ezabelomali Iminyango kahulumeni isiqalile ukwethula amavoti ayo ezabelomali, lapho iziphendulela emphakathini ngomsebenzi umnyango osuwenzile kunyakamali.
",0.68397045
"Cabinet called on all mining houses to register their tailing dams or mine residue deposit dams on the Department of Water and Sanitation database in order to ensure compliance with dam safety regulations.
","Uhlelo lwePhalamende lwamavoti Ezabelomali lungatholakala kwiwebhusayithi ethi: WEBTOKEN Uhlelo Lwenkulumo-mpikiswano Yamavoti Ezabelomali (Amakomidi Omphakathi) kusuka mhla we-16 kuNhlaba 2023 kuya mhla we-19 kuNhlaba 2023.
",0.6120007
"The department if Water and Sanitation is currently updating the database of all tailing dams or mine residue deposit dams in the country that meet the requirements to be classified as” Dams with Safety Risk”.
","I-EPC yeZezimbiwa Nezamandla(Isithangami sabezindaba 13h00 Siqinisekisiwe)16 kuNhlaba 2023Good Hope Chamber 10:00 kuya ku-15:15I-EPC Yezamanzi Nokuthuthwa Kwendle(Isithangami Sabezindaba 08:30-09:30 Sisazoqinisekiswa)16 kuNhlaba 2023M4610:00 kuya ku-12:15I-EPC Yezemisebenzi Kahulumeni Nokuphathwa Kwayo (ISikole Sikazwelonke Sikahulumeni neKhomishini Yemisebenzi Kahulumeni)(Isithangami Sabezindaba 10:00-11:00 Sisazoqinisekiswa)16 kuNhlaba 2023Good Hope Chamber 14:00 kuya ku-16:15I-EPC YoPhiko Lwezokuxhumana Kuhulumeni Nokuhlinzekwa Kolwazi(Isithangami Sabezindaba 12:00-13:00 Sisazoqinisekiswa)16-kuNhlaba-23M4614:00 kuya ku-16:15I-EPC Yezokuthuthukiswa Kwamabhizinisi Amancane(Isithangami Sabezindaba 14:00-15:00 Sisazoqinisekiswa)16 kuNhlaba 2023Good Hope Chamber16:30 kuya ku-18:15I-EPC YoMgcinimafa Kuzwelonke(Isithangami Sabezindaba 15:00-16:00 Sisazoqinisekiswa)16 kuNhlaba 2023 M4616:30 kuya ku-18:15I-EPC Yezokuthutha(Isithangami Sabezindaba 12:00-13:00 Sisazoqinisekiswa)17 kuNhlaba 2023Good Hope Chamber15:00 kuya ku-17:15I-EPC Yezokuxhumana Nobuchwepheshe Bedijithali(Isithangami Sabezindaba 11:00-12:00 Sisazoqinisekiswa)17 kuNhlaba 2023M4615:00 kuya ku-17:15I-EPC Yezindaba Zasekhaya(Isithangami Sabezindaba 09:00-10:00 Sisazoqinisekiswa)17 kuNhlaba 2023Good Hope Chamber17:30 kuya ku-19:00I-EPC Yezemfundo Eyisisekelo(Isithangami Sabezindaba 09:00-10:00 Sisazoqinisekiswa)18 kuNhlaba 2023Good Hope Chamber14:00 kuya ku-16:15I-EPC Yezokuhlunyeleliswa Kwezimilo(Isithangami Sabezindaba 11:00-12:00)18 kuNhlaba 2023Good Hope Chamber16:30 kuya ku-18:15I-EPC Yezokuhlela, Ukuqapha, Nokuhlola(Isithangami Sabezindaba 10:00-11:00 Sisazoqinisekiswa)18 kuNhlaba 2023 M4616:30 kuya ku-18:15Ezamahlathi, Ezokudoba neMvelo(Isithangami Sabezindaba 08:30-09:30 Siqinisekisiwe)19 kuNhlaba 2023Good Hope Chamber10:00 kuya ku-12:15Ezokuvikeleka Kombuso(Isithangami Sabezindaba 13:00 -14:00 Sisazoqinisekiswa)19 kuNhlaba 2023 M4610:00 kuya ku-12:15.UHlelo Lokucisha Izikweletu Zomasipala UNgqongqoshe Wezezimali usethule uhlelo lokucisha izikweletu oluzocisha izikweletu zomasipala kwa-Eskom lokho okuzosiza ukuthi imali ekhona komasipala ihlinzeke ngezidingonqangi.
",0.62066066
"For additional information on tailing/ mine residue deposit dams email EMAILTOKEN Africa Travel Indaba
","OMasipala kuzodingeka ukuthi bahlangabezane nezimfuneko ezihambisana nemibandela engama-33 ukuze bafaneleke.
",0.466734
"The 2023 Africa’s Travel Indaba is underway at the Inkosi Albert Luthuli International Convention Centre in Durban, with a diverse representation of Africa’s tourism industry, accounting for over 20 African countries participating and displaying over 350 tourism products.
","Le mibandela ibandakanya ukuba nenani elithile lemali engenayo ezosetshenziselwa ugesi nezinsizakalo zamanzi okuzofaka yonke imali eqoqwe kugesi, amanzi kanye nokuthuthwa kwendle kanye nokukhokhela u-Eskom imali yamanje kuqala kanye nokwesibili ukukhokhela amanzi ngaphambi kokukhokha enye yanyangazonke..UHlelo Lwe-Afrika UMongameli u-Cyril Ramaphosa ube yingxenye yoMhlangano Osezingeni Eliphezulu we-11 Wohlaka Lwesifunda Esengamele Izindlela Zokuletha Ukuthula, Ukuvikelela kanye Nokubambisana (i-PSC) we-Democratic Republic of the Congo kanye ne-Great Lakes Region, e-Burundi, njengengxenye yokuthuthukisa uHlelo Lwe-Afrika lokuthulisa izibhamu ngowezi-2030.
",0.7432634
"The event serves as a crucial platform for industry professionals to come together, share insights and forge partnerships that will drive growth.
","UMongameli u-Cyril Ramaphosa uphinde wahambela ingqungquthela ye-Extraordinary Organ Troika Summit Plus e-Namibia.
",0.603897
"South Africa is proud of the support government gives to small, medium, micro, women-owned and youth-owned enterprises in the tourism and hospitality sector.
","Le Ngqungquthela ithole umbiko obuya kwi-SADC Field Assessment Mission eseMpumalanga ye-Democratic Republic of Congo yabe seyibheka impendulo yesifunda ekwandeni kwezokuvikeleka nesimo sokusiza abantu.
",0.6566943
"Budget Votes
","Kule Ngqungquthela kuvunyiwe ukuthi i-AU kufanele ihlanganise imizamo eyehlukene yokuletha ukuthula nokuthuthukisa ezokuvikeleka eMpumalanga ye-DRIKhabhinethi lamukele ukuqala kwezingxoxo zokuqala phakathi kombutho wezempi wase-Sudan kanye ne-Rapid Support Forces, eziqale e-Jeddah, e-Saudi Arabia, mhla we-6 kuNhlaba 2023.
",0.22752695
"Government departments have begun presenting their budget votes, which are a public account of the work a department has undertaken over the financial year.
","I-Sudan enokuthula, eholwa nguhulumeni wabantu, ayibalulekanga nje kuphela e-Sudan kodwa nakwisifunda ngokubanzi nasezwenikazini.
",0.58900213
"Parliament’s Budget Vote programme can be found on the website: WEBTOKEN
","IKhabhinethi ngakho-ke licela womabili amaqembu ukuthi axoxisane ngesivumelwano sokuqeda ingxabano futhi aqede ukuhlupheka kwabantu base-Sudan.
",0.49514377
"Budget Vote Debates (Extended Public Committees) Schedule from 16 May 2023 to 19 May 2023.Mineral Resources and Energy EPC(Media Briefing 13h00pm Confirmed)16-May-23Good Hope Chamber10h00am to 15h15pmWater and Sanitation EPC(Media Briefing 08h30-09h30 TBC)16-May-23M4610h00am to 12h15pmPublic Service and Administration (National School of Government and Public Service Commission EPC(Media Briefing 10h00-11h00 TBC)16-May-23Good Hope Chamber14h00pm to 16h15pmGovernment Communications and Information Services EPC(Media Briefing 12h00-13h00 TBC)16-May-23M4614h00pm to 16h15pmSmall Business Development EPC(Media Briefing 14h00-15h00 TBC)16-May-23Good Hope Chamber16h30pm to 18h15pmNational Treasury EPC(Media briefing 15h00-16h00 TBC)16-May-23M4616h30pm to 18h15pmTransport EPC(Media Briefing 12h00-13h00 TBC)17-May-23Good Hope Chamber15h00pm to 17h15pmCommunications and Digital Technologies EPC(Media Briefing 11h00-12h00 TBC)17-May-23M4615h00pm to 17h15pmHome Affairs EPC(Media Briefing 09h00-10h00 TBC)17-May-23Good Hope Chamber17h30pm to 19h00pmBasic Education EPC(Media Briefing 09h00-10h00 TBC)18-May-23Good Hope Chamber14h00pm to 16h15pmCorrectional Services EPC(Media Briefing 11h00-12h00)18-May-23Good Hope Chamber16h30pm to 18h15pmPlanning, Monitoring and Evaluation EPC(Media Briefing 10h00-11h00 TBC)18-May-23 M4616h30pm to 18h15pmForestry, Fisheries and the Environment(Media Briefing 08h30-09h30 Confirmed)19-May-23Good Hope Chamber10h00am to 12h15pmState Security(Media Briefing 13h00 -14h00TBC)19-May-23 M4610h00am to 12h15pm.
","IKhabhinethi liyathokoza ukuthi bonke abantu baseNingizimu Afrika abebebonise ukuthi bafisa ukubuya ekhaya bashiye izwe lase-Sudan elilwayo manje sebebuyile ekhaya futhi nosizo olulethwe ngabantu baseNingizimu afrika lusize namazwe angomakhelwane bethu..IZindaba Zohwebo
",0.5341053
"Municipal Debt Relief Package
","IKhabhinethi litshelwe kafushane ngokuqhubekayo ezindabeni zohwebo laphinde lakuphawula ukuthi ngenyanga kaNdasa 2023, impahla ethunyelwa kwamanye amazwe yaseNingizimu Afrika ibe izigidigidi ezi-R184 seyiyonke.
",0.46969783
"The Minister of Finance has introduced a debt relief package that writes off historic municipal debt to Eskom to help free up revenue at municipalities to provide reliable basic services.
","UMkhakha Wezokukhiqiza wenze kahle kakhulu ekufakeni igalelo lezigidigidi ezingama-R85 ngemikhiqizo yethu ekhiqiziwe, kanye noMkhakha Wezezimayini ngokufaka igalelo lezigidigidi ezingama-R84 kanye Nezolimo ngezigidigidi eziyi-La manani, yize engaphansi kwalawo angoNdasa wezi-2022, abonisa ukuthi umnotho waseNingizimu Afrika uhlala uqine kanjani ngisho nangesikhathi sokwehla kokukhula komnotho.
",0.6775789
"Municipalities will be required to meet strict requirements in the form of 33 conditions to qualify.
","Isamba esiphelele sezigidigidi ezingama-R41 sale mpahla ethunyelwa ngaphandle sithunyelwe kwamanye amazwe ase-Afrika lokho okubonisa amagxathu athathwa izimboni zaseNingizimu Afrika ukwandisa izimakethe zayo kulolonke izwekazi.
",0.5664958
"These conditions include maintaining a minimum average revenue collection targets for electricity and water services ring fencing all electricity, water and sanitation revenue collected and paying the Eskom current account first and the bulk water current account second before any other monthly payments..African Agenda
","Izimakethe lapho uhwebo ludlondlobale khona zibandakanya i-China, i-Belgium, i-Italy kanye ne-United Arab Emirates okubonisa izinzuzo ezisuka ngqo kumakhono omnotho waseNingizimu Afrika.
",0.6346596
"President Cyril Ramaphosa participated in the 11th High Level Segment of the Regional Oversight Mechanism of the Peace, Security and Cooperation (PSC) Framework for the Democratic Republic of the Congo and the Great Lakes Region, in Burundi, as part of advancing the African Agenda of silencing the guns by 2030.
","Izinqumo zeKhabhinethi.
",0.19982493
"President Cyril Ramaphosa also attended the Extraordinary Organ Troika Summit Plus in Namibia.
","IQhingasu Elididiyelwe Lokulwa Nokushushumbiswa Kwezilwane Zasendle (i-NISCWT)
",0.54392666
"The Summit received a report from the SADC Field Assessment Mission in the Eastern Democratic Republic of Congo and considered the regional response to the escalating security and humanitarian situation.
","IKhabhinethi ligunyaze iQhingasu Elididiyelwe Lokulwa Nokushushumbiswa Kwezilwane Zasendle (i-NISCWT).
",0.64265364
"The Summit agreed that the AU must coordinate the various peace keeping and security improvement efforts on the Eastern DRCabinet welcomed the start of pre-negotiation talks between the Sudanese army and the Rapid Support Forces, which commenced in Jeddah, Saudi Arabia, on 6 May 2023.
","Leli iqhingasu lokuqala ngqa eNingizimu Afrika.
",0.40700173
"A peaceful Sudan, led by a civilian government, is essential not only for Sudan but also for the broader region and the continent.
","INhlosonqangi yalo ngukuhlomisa izinhlaka zabomthetho ngamakhono adingekayo ukunciphisa nokugwema isihlava esikhulayo sokushushumbiswa kwezilwane zasendle kuleli lizwe nokusongela ezokuvikeleka kuzwelonke.
",0.6375685
"Cabinet therefore calls on both parties to negotiate an agreement to end the conflict and alleviate the suffering of the Sudanese people.
","IQhingasu leli liza nezethulo eziphathekayo zokuthuthukisa ikhono labezomthetho kuleli lizwe, okubandakanya ukugxila okuthile ekuphenyeni nasekushushiseni amaqembu ezigelekeqe ezishushumbisa izilwane zasendle.
",0.64139295
"Cabinet is pleased that all South Africans that had indicated that they wish to return home from conflict-stricken Sudan are now back home and the assistance the South African initiative afforded our neighbouring countries.
","I-NISCWT ishicilelwe kuMnyango Wezamahlathi, Ezokudoba Nezemvelo WEBTOKEN..Okhethiwe eNingizimu Afrika Njengozongenela Ukuba yiJaji Lenkantolo Yamazwe Ngamazwe Yobulungiswa (i-ICJ)
",0.65581286
"Trade Matters
","IKhabhinethi ligunyaze ukukhethwa kukaSolwazi u-Dire Tladi njengomele iNingizimu Afrika ozongenela ukukhethwa njengeJaji Lenkantolo Yamazwe Ngamazwe Yobulungiswa (i-ICJ) ngesikhathi sokhetho lwale nhlangano ngoLwezi wezi-2023.
",0.26572326
"Cabinet received a briefing on developments on trade matters and noted that for the month of March 2023, South Africa’s total exports stood at R184 billion.
","U-Dire Tladi unguSolwazi Womthetho Wamazwe Ngamazwe eNyuvesi yasePitoli futhi osebenza njengomengameli we-South African Branch of the International Law Association kanye neLungu Lesigungu Esiphezulu se-International Law Association.
",0.5911883
"The Manufacturing Sector was the best performing contributing over R85 billion through our manufactured products, and the Mining Sector contributing R84 billion and Agriculture R11 billion.
","Usebenze njengoSihlalo we-International Law Commission, okuyinhlangano ye-UN ethathwa ngokuthi yiyona eyindikimba ye-ICNgaphambilini ubenguMeluleki Wezomthetho we-South African Mission e-New York kanye noMeluleki Omkhulu we-South African Foreign Ministers.
",0.595127
"These significant amounts, although marginally lower than in March 2022, demonstrate how robust the South African economy remains even in the period of low economic growth.
","Abaqashiwe Bonke abaqashiwe kumele kuqinisekiswe iziqu zabo futhi bahlolwe ngokufanele.
",0.46034893
"A total of R41 billion of these exports are to other African countries indicating the strides South African industries are making in broadening their markets across the continent.
","Abantu abasha abaqashiwe kwiBhodi Labalawuli Abazimele Bebhodi labaCwaningimabhuku.
",0.5144321
"The markets where trade has increased include China, Belgium, Italy and the United Arab Emirates indicating the direct benefits from South Africa’s economic diplomacy.
","Nks Precious Nompumelelo Sibiya kanye
",0.53775287
"Cabinet decisions.
","noMnu Mojalefa Mosala.
",0.5712087
"National Integrated Strategy to Combat Wildlife Trafficking (NISCWT)
","Abaqashwe kwiBhodi Lesikhashana lo-Umngeni Water Board.
",0.6409607
"Cabinet approved the National Integrated Strategy to Combat Wildlife Trafficking (NISCWT).
","Nks Khulekelwe Glynnis Mbonambi Mnu Mzimkulu Msiwa Nks Sylvia Thandazile Mhlongo Nks Hlengiwe Patricia Majozi Mnu Mfanveli James Ndlovu Mnu Sibusiso Wycliff Mkhize kanye
",0.6336261
"The strategy is the first of its kind in South Africa.
","noMmeli u-Lavan Gopaul.
",0.4154469
"Its primary goal is to empower law enforcement structures with the necessary tools to reduce and prevent the increasing scourge of wildlife trafficking in the country that is posing a threat to the country’s national security.
","IMithethosivivinywa.
",0.36084837
"The Strategy makes tangible proposals to enhance the capacity of law enforcement in the country, including a specific focus on the investigation and prosecution of wildlife trafficking syndicates.
","UMthethosivivinywa Wokuchibiyela Ezokuhlunyeleliswa Kwezimilo, wangowezi-2023.
",0.59241843
"The NISCWT is published on the Department of Forestry, Fisheries and Environment at WEBTOKESouth Africa’s Nominated Candidate As A Judge Of the International Court of Justice (ICJ)
","IKhabhinethi ligunyaze ukuhanjiswa ePhalamende isihlongozo soMthethosivivinywa Wokuchibiyela Ezokuhlunyeleliswa Kwezimilo wangowezi-2023.
",0.6165689
"Cabinet approved the nomination of Profssor Dire Tladi as South Africa’s candidate for election as the Judge of the International Court of Justice (ICJ) during the November 2023 elections of this body.
","Lezi zichibiyelo ziyimpendulo yeSahlulelo Senkantolo Yomthethosisekelo esakhishwa ngoZibandlela wezi-2020 kwi-Sonke Gender Justice NPC noMengameli weRiphabhulikhi yaseNingizimu Afrika kanye nabanye.
",0.73994434
