src_text,tgt_text,cosine_score
"Monghadi Mojalefa Mosala Dithonyo ho Boto ya Nakwana ya Umngeni Water:
","Amazwe apho kubekho ukunyuka kwemithamo yorhwebo aquka i-China, i-Belgium, i-Italy kunye ne-United Arab Emirates into ebonisa ukuba siyaxhamla kwizivumelwano zoqoqosho esinazo nala mazwe.
",0.64041436
"Mofumahadi Khulekelwe Glynnis Mbonambi Monghadi Mzimkulu Msiwa Mofumahadi Sylvia Thandazile Mhlongo Mofumahadi Hlengiwe Patricia Majozi Monghadi Mfanveli James Ndlovu Monghadi Sibusiso Wycliff Mkhize le
","Izigqibo zeKhabhinethi.
",0.28838044
"Moatefokate Lavan GopaulDibili.
","IsiCwangciso-qhinga esiHlangeneyo seSizwe sokuLwa ukuRhweba ngokungekho Mthethweni ngeziLwanyana zaseNdle (i-NISCWT)
",0.63391066
"Sehlomathiso sa Bili ya Ditshebeletso tsa Tlhabollo ya Batshwaruwa, 2023.
","IKhabhinethi isivumile isiCwangciso-qhinga esiHlangeneyo seSizwe sokuLwa ukuRhweba ngokungekho Mthethweni ngeziLwanyana zaseNdle (i-NISCWT).
",0.66655296
"Kabinete e tjhaelletse monwana kgothaletso ya moralo wa Sehlomathiso sa Bili ya Ditshebeletso tsa Tlhabollo ya Batshwaruwa ya selemo sa 2023, Palamenteng.
","Esi sicwangciso-qhinga sesokuqala ngqa apha eMzantsi Afrika.
",0.5926986
"Dihlomathiso tsena ke karabelo ho Kahlolo ya Lekgotla la Molaotheo e dihilweng ka Tshitwe 2020 nyeweng ya Sonke Gender Justice NPC v the President of the Republic of South Africa and others.
","Eyona njongo yaso iphambili kukuxhobisa ii-arhente zogcino-mthetho ngezixhobo ezifanelekileyo zokuphungula nokuthintela umkhuba odlangileyo wokurhweba ngokungekho mthethweni ngezilwanyana zasendle kweli lizwe obeka emngciphekweni ukhuseleko lwelizwe.
",0.7145679
"Dihlomathiso di tiisa boikemelo ba Bohlahlobi ba Molao ba Ditshebeletso tsa Tlhabollo ya Batshwaruwa jwalo ka ha ho rerilwe Karolong 7(2) ya Molaotheo wa Riphabliki ya Afrika Borwa wa selemo sa 1996.
","Esi sicwangciso-qhinga siza neziphakamiso ezibambekayo zokuxhobisa ii-arhente zogcino-mthetho kweli lizwe, kuquka nokugxininisa kakhulu kumba wokuphandwa nokunye nokutshutshisa imigulukudu erhweba ngokungekho mthethweni ngezilwanyana zasendle.
",0.71900594
"Sena se tla lebisa ho kenngweng tshebetsong ha Karolo 88A (1)
","I-NISCWT ipapashwe kwiwebhusayithi yeSebe lezamaHlathi, ezokuLoba nezokusiNgqongileyo ethi: WEBTOKEN..UMgqatswa woMzantsi Afrika Otyunjelwe ukuba yiJaji kwiNkundla yezoBulungisa yeHlabathi (i-ICJ)
",0.5593667
"le 91 tsa Molao wa Ditshebeletso tsa Tlhabollo ya Batshwaruwa, 1998 (Molao 111 wa 1998).
","IKhabhinethi ikwamkele ukutyunjwa kukaNjingalwazi Dire Tladi njengomgqatswa woMzantsi Afrika ukuze onyulwe njengeJaji yeeNkundla yezoBulungisa yeHlabathi (i-ICJ) ngethuba lonyulo lwale nkundla oluza kubanjwa ngeyeNkanga 2023.
",0.6402601
"Kahoo sepheo ka kgothaletso ya moralo wa Bili ke ho kenya tshebetsong mehato ya tokiso bakeng sa dikarolo tsa Molao tse fosahetseng jwalo ka ha Lekgotla la Molaotheo le boletse.
","U-Dire Tladi yiNjingalwazi kwiCandelo le-International Law kwiDyunivesiti yasePitoli kwaye ukwanguye noMongameli weCandelo loMzantsi Afrika le-International Law Association kunye neLungu lesiGqeba soLawulo se-International Law Association.
",0.6770501
"Bili ya Ditheko tsa Mmuso
","Wayekhe wanguye noSihlalo we-International Law Commission, iqumrhu le-UN elithathwa njengelinceda ngolwazi i-ICWayenguMcebisi wezoMthetho kwi-Ofisi yoMzantsi Afrika yezoZakuzo ese-New York ikwanguye noMcebisi oKhethekileyo wabaPhathiswa bezangaPhandle boMzantsi Afrika.
",0.40557036
"Kabinete e tjhaelletse monwana kgothaletso ya moralo wa Bili ya Ditheko tsa Mmuso, Palamenteng.
","IzikhundlaZonke izikhundla zixhomekeke ekuqinisekisweni kwamabakala ezemfundo kunye nokuqinisekiswa okufanelekileyo kwezokhuselo.
",0.7445759
"Bili ena e hlakola Molao wa Moralo wa Leano la Ditheko tsa Mmuso tse Ikgethang wa selemo sa 2000 (Molao 5 wa 2000).
","Abantu abatsha abaqeshwe kwiBhodi ye-Independent Regulatory Board for Auditors.
",0.6436397
"Sepheo sa moralo wa Bili ke ho theha moralo o le mong wa ditheko tsa mmuso le ho fedisa karohano melaong e sebetsanang le ditheko tsa mmuso.
","UNksz Precious Nompumelelo Sibiya kunye
",0.55834484
"Bohlokwa ba moralo wa Bili ya Ditheko tsa Mmuso ke hore e thusa phihlellong ya maikemisetso a rona a naha a kang ho tliswa ha diphetoho, matlafatso ya basadi, batjha le diqhwala.
","NoMnu Mojalefa Mosala Abaqeshwe kwiBhodi yeThutyana ye-Umngeni Water Board.
",0.70253736
"E boetse e thusa ka ho kgothaletsa ho rekwa ha thepa ya lehae le ho tshehetsa boqapi ba lehae le diphuputso, mme e kgothaletsa ho rekwa ha thepa dikgwebong tse nyane le tse mahareng tsa Afrika Borwa.
","UNksz Khulekelwe Glynnis Mbonambi UMnu Mzimkulu Msiwa UNksz Sylvia Thandazile Mhlongo UNksz Hlengiwe Patricia Majozi UMnu Mfanveli James Ndlovu UMnu Sibusiso Wycliff Mkhize kunye
",0.7016089
"Diketsahalo tse Tlang.
","No-Adv Lavan GopaulImiThetho eYilwayo.
",0.43236884
"Lenaneo la Matjhaba
","UMthetho-siHlomelo oYilwayo weeNkonzo zoLuleko, wowama-2023.
",0.42979127
"Ka la 12 Motsheanong 2023 Moporesidente Cyril Ramaphosa o tla amohela Moporesidente wa Bulgaria, Monghadi Rumen Radev leetong la tshebetso.
","IKhabhinethi ikuvumile ukungeniswa ePalamente koMthetho-siHlomelo oYilwayo weeNkonzo zoLuleko wowama-2023 oseluyilo.
",0.7091305
"Leeto le tla tsepamisa maikutlo kahong ya maqhama a sepolotiki le kgwebisano, hammoho le phapanyetsano ya botjhaba ba Afrika Borwa le Bulgaria.
","Ezi zilungiso zenziwe ngenxa yesiGwebo seNkundla yoMgaqo-siseko esawiswa ngeyoMnga 2020 kwityala le-Sonke Gender Justice NPC imangalele uMongameli woMzantsi Afrika nabanye.
",0.7428964
"Bulgaria esale e le molekane wa bohlokwa kgwebisanong le Afrika Borwa mme ka 2022 naha ena e rometse diyantle tse ballwang ho R.96 bilione Bulgaria.
","Ezi zilungiso zibethelele umba wokuzimela kweCandelo lezoBulungisa leeNkonzo zoLuleko njengoko kuchaziwe kwiCandelo 7(2) loMgaqo-siseko weRiphabhliki yoMzantsi Afrika wowe-1996.
",0.6671002
"Moporesidente Ramaphosa o tla boela a amohele Tonakgolo ya Riphabliki ya Singapore, Monghadi Lee Hsien Loong ka la 16 Motsheanong 2023 leetong la hae la semmuso Afrika Borwa, le tla tsepamisa maikutlo hodima ho tiisa dikamano tse teng pakeng tsa dinaha ka bobedi.
","Oku kukuqalisa ukusebenzisa iCandelo 88A (1) kunye neCandelo 91 loMthetho weeNkonzo zoLuleko, wowe-1998 (uMthetho 111 wowe-1998).
",0.6222265
"Afrika Borwa e rometse diyantle tsa R.3 bilione Singapore ka selemo sa 2022, moo Afrika Borwa e bileng le masalla.
","Ukungeniswa kwalo Mthetho uYilwayo useluyilo kwenzelwe ukulungisa ukuqhwalela okukhoyo kumacandelo athile alo Mthetho achazwe yiNkundla yoMgaqo-siseko.
",0.606207
"Diyantle tsa Arika Borwa tse ka sehloohong tse rometsweng Singapore di kenyeletsa alominiamo ya tlhaho, dolomaete e tjhesitsweng le samente ya Portland, hara tse ding..Bonkakarolo bo Tlang Diketsahalong tsa Lefatshe tsa Tikoloho
","UMthetho oYilwayo wezeNtengo kuRhulumente
",0.49737817
"Kabinete e tjhaelletse monwana thomo ya Afrika Borwa ya ditherisano le bonkakarolo ho Tulo ya Bobedi ya Komiti ya Mebuso e Kopanetsweng ya Ditherisano (INC 2) ya Tumellano e Tlamang ya Matjhaba ya Tshilafatso ya Polastiki e Kenyeletsang Ditikoloho tsa Lewatle, e tla tshwarelwa Paris, Fora ho tloha ka la 29 Motsheanong ho isa ho la 02 Phuptjane 2023.
","IKhabhinethi ikuvumile ukungeniswa ePalamente koMthetho oYilwayo wezeNtengo kuRhulumente.
",0.68112373
"INC e na le boikarabelo ba ho netefatsa ntshetsopele ya tumellano ya lefatshe ya tshilafatso ya polastiki, ho kenyeletsa le tikoloho ya mawatleng.
","Lo Mthehto uYilwayo uguzula uMthetho woMgaqo-nkqubo wokuThenga ngokweNzelelela wowama-2000 (uMthetho uNombl 5 wowama-2000).
",0.7081934
"Kabinete e boetse e tjhaelletse monwana thomo ya Afrika Borwa ya ditherisano tsa Lekgotla la Bohokahanyi la Matjhaba la bo-35 la Lenaneo la Matjhaba a Kopaneng la Thuto, Saense le Setso la Motho le Tikoloho ya hae tse tla tshwarelwa Paris, Fora ho tloha ka la 12 ho isa ka la 16 Phuptjane 2023.
","Lo Mthetho uYilwayo useluyilo uza kudala isicwangciso esinye sokuthenga kurhulumente kuze kupheliswe nengxaki yemithetho emininzi emalunga nezentengo kurhulumente.
",0.6592142
"Thomo ya UNESCO MAB ICC ke ho kgothaletsa mekgwa ya ho phela e hlokomelang tikoloho ka tsela e sa e senyeng.
","Lo Mthetho uYilwayo wezeNtengo useluyilo ubaluleke ngokuba ulwela ukufezekisa iinjongo eziphambili zesizwe ezifana neenguqu, ukuxhotyiswa ngezakhono kwamanina, ulutsha kunye nabantu abakhubazekileyo.
",0.74738055
"Afrika Borwa e qadile ho nka karolo Lenaneong la Motho le Tikoloho ya hae (MAB) ka 1995 Sebokeng sa Seville, Spain.
","Ukwavulela nokuba kusetyenziswe kakhulu iimveliso zalapha ekhaya kunye nokuxhaswa kokuyilwa kwezinto apha ekhaya kunye nophando, kwaye uvumela ukuba amashishini amancinci naphakathi eMzantsi Afrika enzelelelwe xa kuthengwa.
",0.67268276
"Hajwale Afrika Borwa e mokgahlelong wa ho kenya tshebetsong Leano la Tlatsetso la Afrika Borwa la Naha la Tikoloho leo e leng tataiso ya ho kenngwa tshebetsong ha Lenaneo la MAB maemong ohle a botsamaisi ba tikoloho a tlatsetso.
","Imisitho Ezayo.
",0.3984521
"Leeto la Motlatsa-Moporesidente wa Colombia, Afrika Borwa
","Imiba yehlabathi
",0.6016829
"Motlatsa-Moporesidente Paul Mashatile o tla amohela molekane wa hae wa Colombia, Motlotlehi Mofumahadi Vice Francia Elena Márquez, Motlatsa-Moporesidente wa Riphabliki ya Colombia, ya tla beng a le leetong la Semmuso ka Labohlano la 12 Motsheanong 2023.
","UMongameli Cyril Ramaphosa uza kundwendwelwa nguMongameli wase-Bulgaria uMnu Rumen Radev ngomhla we-12 kuCanzibe 2022 oza kuba ekutyelelo lwaseburhulumenteni.
",0.82211536
"Sepheo ka leeto lena ke ho tiisa maqhama pakeng tsa Afrika Borwa le Colombia kaha Colombia e thakgola dipuisano tse matla le kontinente ya Afrika.
","Olu tyelelo luza kwakha ubudlelwano bezopolitiko nezoqoqosho, futhi nentsebenziswano ngokwezenkcubeko phakathi koMzantsi Afrika ne-Bulgaria.
",0.7906091
"Dikopano le boraditaba tse tlang le ditho tsa Phethahatso tsa Naha
","I-Bulgaria liqabane lezorhwebo elibaluleke kakhulu kuMzantsi Afrika kangangokuba ngowama-2022 eli lizwe lathumela e-Bulgaria iimpahla zorhwebo ezixabisa imali eyibhiliyoni yeerandi eyi-
",0.45151794
"Letona la Motlakase Ngaka Kgosientsho Ramokgopa le tla beha boraditaba sehlohlolong ka kgatelopele e mabapi le ho kenngwa tshebetsong ha Morero wa Tshebetso wa Eneji (EAP) ka Labohlano la 12 Motsheanong 2023 ka 14:00.
","UMongameli Ramaphosa uza kundwendwelwa nayiNkulumbuso ye-Republic of Singapore uMnu Lee Hsien Loong ngomhla we-16 kuCanzibe 2023 ozakube ekutyelelo lwaseburhulumenteni oluza eMzantsi Afrika.
",0.79168296
"Dikopano tsena tsa beke le beke di fana ka monyetla wa ho beha boraditaba le setjhaba sehlohlolong ka kgatelopele e teng twantshong ya ho kgaolwa ha motlakase bekeng e fetileng mme di boele di fane ka monyetla wa ho hlakisa le ho hlalosa dintlha tse nang le tshusumetso ho kgaolweng ha phepelo ya motlakase morao tjena..Kgwedi ya Afrika
","Olu tyelelo luza kusetyenziselwa ukuqinisa obu budlelwane bukhoyo phakathi kwala mazwe mabini.
",0.6313567
"Ka Motsheanong, Afrika Borwa e keteka Kgwedi ya Afrika eo ka yona e leng sehopotso sa ho thehwa ha Mokgatlo Kopano ya Afrika (OAU) ka selemo sa 1963, o seng o tsejwa e le Kopano ya Afrika (AU).
","Ngowama-2022 uMzantsi Afrika uthumele e-Singapore iimpahla zorhwebo ezixabisa imali ezibhiliyoni zeerandi eziyi-10.3, ngolo hlobo wagqithisa kumlinganiselo wesiqhelo.
",0.7102123
"Mosebetsi o ka sehloohong wa AU ke ho ntshetsa pele kgotso le botsitso kontinenteng..Dipapadi tsa Bompodi ba Lefatshe tsa Table Tennis
","Iimpahla ezingundoqo zorhwebo zoMzantsi Afrika ezithunyelwa e-Singapore ziquka i-aluminiyam yendalo, i-sintered dolomite kunye ne-Portland cement, phakathi kwezinye..ImiSitho yeHlabathi yezokusiNgqongileyo Esiza Kuthatha Inxaxheba Kuyo IKhabhinethi iyivumile imiba ekuza kuxoxelwa phezu kwayo nguMzantsi Afrika kunye nokuba uthathe inxaxheba kwiSeshoni yesi-2 yeKomiti yokuThetha-thetha yooRhulumente abaHlukeneyo (i-INC2) ngesiVumelwano esiBophelelayo seHlabathi esiMalunga noNgcoliseko lweePlastiki kunye neeLwandle eza kubanjelwa e-Paris, e-France ukusuka ngomhla wama-29 kuCanzibe ukuya kowesi-2 kweyeSilimela 2023.
",0.76893854
"Dipapadi tsa Makgaolakgang tsa Bompodi ba Lefatshe tsa Table Tennis tsa selemo sa 2023 tsa ITTF di tla tshwarwa ho tloha ka la 20 ho isa ka la 28 Motsheanong 2023.
","I-INC yenza umsebenzi wokuqulunqa isivumelwano sehlabathi esingongcoliseko lweeplastiki kuquka neelwandle.
",0.6409404
"Thonamente ena e tla bapallwa Setsing sa Matjhaba sa Dikopano sa Thekong, e tla ba le dipapadi tsa ba babedi tsa Banna le Basadi, tsa Banna, Basadi le tsa ba bane tse Tswakileng.
","IKhabhinethi iyivumile imiba ekuza kuzoxelwa phezu kwayo nguMzantsi Afrika kwiBhunga lama-35 leHlabathi lokuQuquzelela iNkqubo yaBantu neNdalo loMbutho wezeMfundo, ezeNzululwazi nezeNkcubeko weZizwe eziManyeneyo (i-UNESCO MAB ICC) eza kuqhuba ukusuka ngomhla we-12 ukuya kowe-16 kweyeSilimela 2023.
",0.793261
"Kabinete e lakaletsa bankakarolo bohle tse molemo ketsahalong ena.
","Injongo ye-UNESCO MAB ICC kukukhuthaza ukuba kuphilwe ngeendlela ezingenzi monakalo kokusingqongileyo nezilondoloza indalo.
",0.64051616
"Dipapadi tsa Makgaolakgang tsa Bompodi ba Lefatshe tsa Table Tennis tsa ITTF e tla ba ketsahalo e kgolo nalaneng ya papadi ya table tennis kaha e tla be e le lekgetlo la pele dilemong tse 80 di tshwarelwa Afrika.
","UMzantsi Afrika waqalisa ukuthatha inxaxheba kwiNkqubo ye-MAB ngowama-1995 kwiNkomfa yase-Seville e-Spain.
",0.7007667
"Mohope wa Lefatshe wa Netebolo
","UMzantsi Afrika ngoku ukwisigaba sokuqalisa ukusebenzisa isiCwangciso-qhinga soMzantsi Afrika sokuLondoloza iNdalo esiza kusetyenziswa njengesikhokelo sokuqaliswa kweNkqubo ye-MAB kuwo onke amaqoqo olawulo lolondolozo lwendalo.
",0.51968306
"Moo ho seng ho setse Matsatsi a 81 pele ho qala Mohope wa Lefatshe wa Netebolo, Kabinete e ipiletsa ho Maafrika Borwa ho bontsha morolo wa naha eo dipapadi tla tshwarelwa ho yona ka mohoo wa Netball Fridays..Peholeihlo ya Lenaneo la Ntshetsopele ya Ditereke
","UTyelelo oluza eMzantsi Afrika nguSekela-Mongameli wase-Colombia
",0.4720013
"Moporesidente Cyril Ramaphosa o tla hlophisa Imbizo ya Borobedi ya Motlolo wa Ntshetsopele ya Ditereke (DDM), Seterekeng sa Cape Winelands, Kapa Bophirima ka la 19 Motsheanong 2023, e le karolo ya maiteko a mmuso a ho ntlafatsa phumantsho ya ditshebeletso le ho kgothaletsa badudi le setjhaba ka kakaretso ho ba karolo ya ho hodisa Afrika Borwa mmoho le ho se siye ba bang morao maitekong ana.
","USekela-Mongameli u-Paul Mashatile uza kundwendwelwa ngugxa wakhe wase-Colombia, oHloniphekileyo uNkskz Vice Francia Elena Márquez, uSekela-Mongameli we-Republic of Colombia oza kube ekuTyelelo lwaseBurhulumenteni ngoLwesihlanu, umhla we-12 kuCanzibe 2023.
",0.79538584
"Ditho tsa Phethahatso di tla kena mokgahlelong o latelang wa Lenaneo la Imbizo e le karolo ya mekgwa ya tshebedisano e atametsang mmuso bathong le ho kgothaletsa hore baahi ba be le seabo pusong molemong wa ho rarolla tshallomorao ho tsa bohlokwa le phumantshong ya ditshebeletso.
","Olu tyelelo luneenjongo zokuqinisa ubudlelwano phakathi koMzantsi Afrika ne-Colomiba njengoko i-Colombia ikwiphulo elibanzi lokwakha ubudlelwane neli lizwekazi le-Afrika.
",0.777584
"Melaetsa.
","Iintlanganisa ezizayo eziza kubanjwa noonondaba ngamaLungu eKhabhinethi
",0.401125
"Ditakaletso tsa MahlohonoloKabinete e thoholeditse le ho lebisa ditakaletso tse ntle ho: Mofumahadi Kirsten Neuschäfer ya ikgapetseng tlholo ya Golden Globe Race e tummeng kamora ho qeta matsatsi a batlang a ba 235 a beisa ka seketswana lewatle ntle le GPS le disebediswa tse ding tsa theknoloji.
","UMphathiswa wezoMbane uGq Kgosientsho Ramokgoba uza kunika oonondaba iinkcukacha ngeza kutsha nje ngomgama osele uhanjiwe malunga nokuqaliswa kwesiCwangciso sezoMbane (i-EAP) ngoLwesihlanu umhla we-12 kuCanzibe 2023 ngentsimbi yesi-14:00.
",0.7656175
"E ne e le yena feela mosadi ya kenetseng lebelo lena mme ya ba mosadi wa pele ho hapa lebelo lena la ho tsamaya a le mong a potoloha lefatshe..Matshediso Kabinete e lebisitse matshediso ho lelapa le metswalle ya: Moahi wa Netherlands eo e neng e le moitseki kgahlanong le mmuso wa kgethollo Monghadi Klaas de Jonge, ya neng a inehetse ho lwanela tokoloho, ya ileng a hlomphuwa ka National Order of the Companions of OR Tambo.
","Ezi ndibano zibanjwa rhoqo ngeveki zenzelwe ukunika oonondaba kunye nesizwe iinkcukacha ngomsebenzi osele wenziwe malunga nokulwa le ngxaki kacimi-cimi wombane kwiveki engaphambili futhi zikwanika nengcaciso malunga nezinto ezibangele le ngxaki kacimi-cimi wombane kutsha nje..INyanga ye-Afrika
",0.77665967
"De Jonge o hopolwa ka ho batla botshabelo ntlong ya bonqosa ya Netherlands moo a phetseng dilemo tse pedi a qoba ho tshwarwa ke sepolesa sa mmuso wa kgethollo.
","NgekaCanzibe, uMzantsi Afrika ubhiyozela iNyanga ye-Afrika, esisikhumbuzo sokusekwa koMbutho weManyano ye-Afrika (i-OAU) ngowe-1963, namhlanje ebizwa ngokuba yiMbumba ye-Afrika (i-AU).
",0.65792024
"O boetse o hopolwa ka mosebetsi wa hae wa bonamodi ba dikgohlano dinaheng tse ngata kontinenteng ena.
","Owona msebenzi uphambili we-AU kukulwela uxolo nozinzo kweli lizwekazi.
",0.77210104
"Setsebi sa tsa Eneji, Monghadi Ted Blom, ya neng a hlola a ntsha maikutlo a hae ka tjantjello le ka boqhetseke ka leano la eneji.
","ITumente yeHlabathi ye-Table Tennis
",0.48239854
"Sajene Lwando Lawrence Bunga, Sajene Mario Nel le Konstabole Lefaka, e leng bahlanka ba bararo ba Tshebeletso ya Sepolesa sa Afrika Borwa ba bolailweng bekeng e fetileng ba le mosebetsing diterekeng tsa bona tsa Masepala e Moholo wa Nelson Mandela, le Masepala e Moholo wa Buffalo City Kapa Botjhabela le Atteridgeville, Gauteng.
","ITumente yowama-2023 yeHlabathi ye-Table Tennis yoMbutho weHlabathi we-ITTF iza kubanjwa ukususela ngomhla wama-29 ukuya kowama-28 kuCanzibe 2023.
",0.61344314
"Ho feta moo, mapolesa a mang a mabedi a bolailwe maobane.
","Lo msitho uza kubanjelwa e-Durban International Convention Centre, apho kuza kudlalwa iintlobo ezahlukeneyo zalo mdlalo eziquka i-Men’s Singles, i-Women’s Singles, i-Men’s Doubles, i-Women’s Doubles kunye ne-Mixed Doubles.
",0.39873254
"Kabinete e tshwela ka mathe polao ya mapolesa le ho e nka e le tlhaselo ya tshireletso ya naha ka ho otloloha.
","IKhabhinethi inqwenelela okuhle kodwa abo baza kuthatha inxaxheba kule midlalo.
",0.6829603
"Kabinete e laetse ba qobello ya molao ho etsa ka hohle kamoo ba ka kgonang ho batlana le ditlokotsebe tse bolayang mapolesa.
","Le Tumente yeHlabathi ye-ITTF ye-Table Tennis iyimbali kumdlalo we-table tennis njengoko kuza kuba kokokuqala kwiminyaka engaphezulu kwama-80 le midlalo iza kudlalelwa kweli lizwekazi lase-Afrika.
",0.5858453
"Mokaubere papading ya kolofo Afrika Borwa, Monghadi John Bland (77), ya ileng a hapa dikgau tse 36 kamora mashome a mangata a dilemo a bapala papadi ena.
","INdebe yeHlabathi yeBhola yoMnyazi
",0.54735965
"Eneji
","Ezamandla
",0.75373834
"Kabinete e etse hloko tswelopele entsweng ka ho kenngwa tshebetsong ha Moralo wa Tshebetso ya Eneji, ha e ntse e amohela hore ho na le ditshitiso tse ntseng di le teng kgahlanong le marangrang a naha.
","IKhabhinethi iwuncomile umsebenzi osele wenziwe malunga nokuqaliswa ukusetyenziswa kwesiCwangciso sokuSebenza soMbane, nangona ivumile ukuba iziko lombane lesizwe liseneengxakana elijongene nazo.
",0.9079087
"Ha naha e kena nakong ya Mariha, Kabinete a amohetse phethelo ya Konteraka bakeng sa di-megawatts tse 400 (MW) tsa bokgoni bo ekeditsweng ka Standard Offer Programme e tla ba inthaneteng pele ho mafelo a Motsheanong 2023.
","Njengokuba singena kwixesha laseBusika kweli lizwe, iKhabhinethi ikwamkele ukuqukunjelwa kwesiVumelwano sombane ozimegawathi (i-MW) ezingama-400 eziza kongezwa kulo sinawo ovela kwinkqubo ebizwa i-Standard Offer Programme oza kugalelwa kulo wesizwe phambi kokuphela kukaCanzibe wowama-2023.
",0.9209217
"Ho feta moo, Lefapha la Bophelo bo botle le kgethile dipetlele tse 213 hore di se angwe ke ho kgaoha ha motlakase, ho tsona tse 76 di se di ntse di qheletswe ka thoko mme lefapha le sebeletsa hore le eketse dipetlele tse ding tse 46 ha boemo bo se bo hatetse pele.
","Ukongeza, iSebe lezeMpilo likhethe izibhedlela ezingama-213 ezingazikuchatshazelwa ngucimi-cimi wombane.
",0.8679638
"Kabinete e amohela hape ho thakgolwa ho atametseng ha Energy One-Stop Shop ka la 31 Motsheanong 2023 ke Invest SA ho potlakisa mekgwa ya taolo e tla thusa dikhampani tse ntjha tse fehlang matla hore le tsona di nke karolo.
","Kwezi zibhedlela, ezingama-76 sele zixhamla kule nkqubo yokungachatshazelwa ngucimi-cimi wombane, kwaye sele equkunjelwa amalungiselela ezinye ezingama-46 okuzikhusela kule ngxaki kacimi-cimi wombane.
",0.7604538
"E etse hloko tswelopele e entsweng Seteisheneng se Fehlang Matla sa Kusile ho tsosolosa 3 200 MW, yuniting ya 1, 2, 3 le ya 5, ho marangrang a naha qetellong ya 2023.
","IKhabhinethi iphinde yawamkela nalo msebenzi uzayo wokusekwa kweZiko lezaMandla elinguNtozonke ngomhla wama-31 kuCanzibe 2023 yi-Invest SA ngeenjongo zokukhawulezisa iinkqubo zokuqulunqa imithetho eza kwenza ukuba kube lula kwiinkampani ezintsha ezivelisa umbane ukuba ziqalise umsebenzi wazo wokuvelisa umbane.
",0.756938
"Kabinete e tshwenyehile ka tswelopele ya phatlalatso ya ditaba tsa bohata, ho pharalla le metjha ya ditaba ya setjhaba e bolelang ka katamelo ya ho putlama ha marangrang a naha e leng se tla baka ho tima ha motlakase ka ho felletseng.
","Ivile nangomsebenzi osele wenziwe kwiZiko loPhehlo-mbane laseKusile sokuba iphinde ivelise umbane ongama-3 200 MW isebenzisa i-unithi 1, 2, 3 no-5 oza kugalelwa kulo wesizwe phambi kokuba lo nyaka wama-2023 uphele.
",0.7461823
"Eskom e tiiseditse mmuso ka merero e keneng tshebetsong bakeng sa ditshireletso tsa tsamaiso ho thibela ho tima ha motlakase ka ho felletseng naheng yohle.
","IKhabhinethi ixhalabile zindaba ezibubuvuvu ezisasazwa ngabantu besebenzisa amakhasi onxibelelwano ezityhola ngokuba iziko lombane leli liza kuwa into leyo eza kubangela ukuba isizwe sonke sibe sebumnyameni.
",0.80395275
"Kabinete e ipiletsa hape ho batho bohle ba Afrika Borwa hore ba tswele pele ho boloka motlakase.
","U-Eskom umxelele urhulumente ukuba unazo izicwangciso zokulalelisela xa kunokwenzeka ukuba umbane ucime pam kwizwelonke.
",0.68587154
"Morero ke ho boloka bonyane 1 000 MW ka letsatsi, e leng se lekanang le ho boloka mohato wa pele wa ho kgaoha ha motlakase letsatsi ka leng.
","IKhabhinethi iyaqhuba nekhwelo eyayilihlabile lokuba bonke abantu abaseMzantsi Afrika mabonge umbane.
",0.674001
"Letona la Motlakase, Ngaka Kgosientsho Ramokgopa, o tla tsebisa naha ka dintlha tsa moraorao tsa ho kenngwa tshebetsong ha Moralo wa Tshebetso ya Eneji ka Labohlano la 26 Motsheanong 2023, puisanong ya boraditaba.
","Iinjongo zethu kukuba sikwazi ukonga umbane oli-1 000 MW yonke imihla, umyinge lowo ulingana nenqanaba elinye lokucinywa kombane ngosuku ngalinye.
",0.6808061
"Bophelo bo Botle
","UMphathiswa wezoMbane, uGq Kgosientsho Ramokgopa, uza kunika ingxelo ngeza kutsha nje malunga nokuqaliswa ukusetyenziswa kwesiCwangciso sokuSebenza sezaMandla ngoLwesihlanu, umhla wama-26 kuCanzibe 2023, kwintlanganiso aza kube eyibambe noonondaba.
",0.11201972
"Mmuso o thehile komiti e sebetsang ya setekgeniki, e etellwang pele ke Lefapha la Naha la Bophelo bo Botle, ho arabela seweng sa kholera Hammanskraal Toropong ya Tshwane, e seng e bolaile batho ba 15 ho tloha ka la 24 Motsheanong 2023.
","Ezempilo
",0.15638408
"Ho etswa mosebetsi o moholo wa ho lekola mehlodi yohle e ka bang teng ya tshilafalo, e bang ke mehlodi ya metsi, ditanka tse tsamaisang metsi, dipompo le Tshebetso ya ho Hlwekisa Metsi a Ditshila ya Rooiwal (WWTW).
","Urhulumente useke ikomiti yeengcali, ekhokelwa liSebe lezeMpilo likaZwelonke, eza kujongana nale ngxaki yokuqhambuka kwesifo sotyatyazo e-Hammanskraal kwisiXeko sase-Tshwane, apho sele kusweleke abantu abali-15 ngokweengxelo zomhla wama-24 kuCanzibe 2023.
",0.7217269
"Ho fihlela jwale, ha ho na bopaki ba ho fumanwa ha baktheria ya kholera mehloding ena, e leng se re kgodisang hore ho ka etsahala ebe kholera e bile ketsahalo ya nako e le nngwe feela ya tshilafalo, ka ditshwaetso tsa hajwale tseo e ka nna ya ba di bakilwe ke ba tshwaeditsweng mme le bona ba tshwaetsa ba bang.
","Sithetha nje uyaqhuba umsebenzi omkhulu wokuzingela izinto ezinokuba zizo ezingcolise amanzi, ukusuka emanzini la uqobo, ukuya kwiiloli ezithutha amanzi, iimpompo zamanzi kunye ne-Rooiwal Wastewater Treatment Works (i-WWTW).
",0.7775724
"Ha mesebetsi ena e ntse e tswela pele, baahi ba Hammanskraal ba kgothaletswa hore ba bedise metsi a pompo mme ba tshele letswai le seng le kae pele ba a nwa.
","Ukuza kuthi ga ngoku, akukabikho bungqina bukhomba ukuba intsholongwane yesifo sotyatyazo ifumaneka kwezi zinto zikhankanyiweyo, into leyo ke efuna ukuhambelana nalo mbono uthi kungenzeka ukuba olu qhambuka lubangelwe yile ntsholongwane ethe yangena ngebhaqo emanzini, baze ke aba bantu banaso ngoku babe bosulelwe ngabanye abantu okanye bosulelwe ngabo nabo bosulelweyo.
",0.78840405
"Ho phaella moo, mang kapa mang ya nang le letshollo, ho nyekelwa ke pelo kapa matshwao a tshebetso ya mala o lokela ho potlakela ngakeng kapa tleliniking ya lehae.
","Njengoko la malinge okungenelela eqhuba, abahlali base-Hammanskrral bayacelwa ukuba bawabilise amanzi aphume empompeni baze bawathi chatha intwana yetyuwa phambi kokuba bawasele.
",0.73876655
"Letona la Metsi le Bohlweki, Monghadi Senzo Mchunu, o tla kopana le Ramotse wa Toropo ya Tshwane, Mokhanselara Cilliers Brink, ka Labohlano la 26 Motsheanong 2023 boitekong ba ho theha moralo o kopanetsweng wa ntjhafatso e seng e siilwe ke nako ya Rooiwal WWTBakeng sa dintlha tse ding o ka letsetsa mohala wa mahala o sebetsang bosiu le motsheare wa Setsi sa Naha sa Mafu a Tshwaetsanang (NICD) ho 082 883 9920.
","Ukongeza, nabani na osesisu esihambisayo, onesicaphu-caphu okanye olunywa sisisu kufuneka aye kwagqirha okanye kwiklinikhi ekufutshane ngokukhawuleza.
",0.7074505
