src_text,tgt_text,cosine_score
"Mopitlo 10 – Ngwaga wa bo 29 wa go Bewa Setulong ga Mopresidente yoo a Kgethilwego ka Tsela ya Demokrasi Kopano ye ya Kabinete e bile gona ka letšatši leo go felago mengwaga ye 29 mola Mopresidente Nelson Mandela a ilego a bewa setulong bjalo ka Mopresidente wa mathomo wa Afrika Borwa ya demokrasi ka la 10 Mopitlo 1994.
","Kamora mengwahakgolo e meraro le halofo ya bokoloniale le ho kgethollwa ha batho ho ya ka merabe ya bona, le nakong eo batho ba neng ba nehwa ditshebeletso tsa motheo ho latela mebala ya bona, Afrika Borwa ya demokrasi e ile ya teka merero e kenyeletsang ya ntshetsopele molemong wa ho fihlella naha e atlehileng, e sa kgetholleng ka mmala, e sa kgetholleng ka bong le e nang le tekano-tekano.
",0.6740848
"Morago ga mengwaga ye makgolo a mararo le seripa ya bokoloneale le kgethollo fao gore motho a hwetše ditirelo tša motheo a swanetše go be a le wa mmala o itseng, Afrika Borwa ya demokrasi e beile dinepo tša tlhabollo tšeo di akaretšago go fihlelela setšhaba seo se atlegago, se sa kgethollego go ya ka mmala, ka bong, ebile se lekalekanago.
","Leha ho na le tse ngata tse fihleletsweng ho tloha ka selemo sa 1994, ho sa na le tse ngata tse lokelang ho etswa molemong wa ho phethahatsa tseo naha ena e di labalabelang tse amanang le ntshetsopele.
",0.6163438
"Le ge e le gore go bile le diphihlelelo tše ntšhi tšeo di fihleletšwego esale go tloga ka 1994, go sa na le tše ntšhi gape tšeo di hlokago go dirwa gore re fihlelele dinepo tša naga tša tlhabollo.
","Banka ya Resefe ya Afrika Borwa e ntshitse ditjhelete tsa pampiri le dikhoene tse ntlafaditsweng, tsa ho keteka demokrasi ya rona e itshetlehileng molaong wa motheo le ho tlotla Madiba wa rona eo re mo ratang..Seboka sa Bophelo bo Botle sa Moporesidente Seboka sa bobedi sa Bophelo bo Botle sa Moporesidente se neng se tshwerwe ka la 4-5 Motsheanong 2023 se ne se shebane le ditshia tse robong tse Momahantsweng tsa Bophelo bo Botle tsa Boporesidente tsa 2019: khiro ya batho phihlello ya meriana, diente le dihlahiswa tsa kalafo infrastraktjha kenyeletso ya lekala la poraefete tlhokomelo ya kalafo ya boleng ntlafatso ya bolaodi ba ditjhelete ba lekala la mmuso taolo le boetapele kenyeletso ya badudi ditsamaiso tsa tlhahisoleseding le ho ba malala-a-laotswe bakeng sa diwa.
",0.60291344
"Panka ya Resefe ya Afrika Borwa e lokolotše ditšhelete tša pampiri le tša tšhipi tšeo di mpshafaditšwego, tšeo di ketekago demokrasi ya rena ya semolaotheo gape le go ba segopotšo go Madiba yoo re mo ratago..Samiti ya Maphelo ya Mopresidente Samiti ya Bobedi ya Maphelo ya Mopresidente, yeo e bego e swerwe ka la 4-5 Mopitlo 2023, e ile ya bea šedi ya yona go dikokwane tše senyane tša Kgohlagano ya Maphelo ya Mopresidente ya 2019: merero ya bašomi phihlelelo ya meriana, meento le ditšweletšwa tša maphelo mananeokgoparara dipoledišano le lekala la praebete tlhokomelo ya maphelo ya boleng dikaonafatšo tša taolo ya ditšhelete tša lekala la setšhaba pušo le boetapele dipoledišano le setšhaba boitokišetšo bja mananeo a tshedimošo le leuba.
","Se seng sa sephetho sa Seboka sena e bile boitlamo bo ntjhafetseng ba ho kenya tshebetsong Inshorense ya Naha ya Bophelo bo Botle (NHI).
",0.6096772
"Ye nngwe ya dipoelo tša Samiti e bile boikgafo bjoo bo mpshafaditšwego bja go phethagatša Inšorentshe ya Maphelo ya Bosetšha (NHI).
","Ena ke karolo ya lenaneo la ho fokotsa ho se lekane-lekane phumantshong ya ditshebeletso tsa tlhokomelo ya kalafo, ka ho fedisa mathata a ditjhelete a amang phihlello ya ditshebeletso tsa tlhokomelo ya kalafo.
",0.7859859
"Se ke karolo ya lenaneo la go fokotša diphapano ge go etla phihlelelong ya ditirelo tša maphelo ka go fediša morwalo wa ditefelo ge go hwetšwa ditirelo tša maphelo.
","Kabinete e ananela ho tjhaellwa monwana ha mehato e hlokehang molemong wa ho ntlafatsa tsamaiso ya bophelo bo botle le ho potlakisa diphetoho tsa NHTsena di atametsa ditsamaiso tsa bophelo bo botle bakeng sa ho sebeletsa Maafrika Borwa..Eneji
",0.7515151
"Kabinete e amogela go fetišwa ga mekgwa yeo e hlokegago go lokiša lenaneo la maphelo ka leswa le go akgofiša diphetogo tša NHSe se batametša lenaneo la rena la maphelo tabeng ya go šomela MaAfrika Borwa bokaone..Enetši Mmušo o šoma le Eskom ka sekgauswi go akgofiša go lokišwa ga diyuniti tšeo di hlotšego Legato la bo 6 la kgaotšo ya mohlagase mo matšatšing ano yeo e ditelago tšwelopele ya lenaneo la go kaonafatša tšhireletšo ya mohlagase ka nageng.
","Mmuso o sebetsa le Eskom ho potlakisa ho lokiswa ha diyuniti tse bakileng hore ho kenwe Mokgahlelong wa Botshelela wa ho tingwa ha motlakase morao tjena, mme sena sa ba sa sitisa kgatelopele ya lenaneo la ho ntlafatsa boteng ba nako e telele ba motlakase ka hara naha.
",0.84390104
"Mošomo woo o tseneletšego o gare o a dirwa ka Eskom go oketša Sekao sa Eskom sa Go ba gona ga Mohlagase ka ditokišo tše bohlokwa, go šomiša ka botlalo di-Open Cycle Gas Turbines, go hwetša maatla a tšweletšo ya mohlagase a tlaleletšo go tšwa dipeeletšong tša praebete ka dimpshafatšong, gape le go oketša temošo ya go kaonafatša Taolo ya Nyakego ya ka Thoko go tšwa badirišingbagolo ba mohlagase le go tšwa go malapa.
","Eskom e sebetsa ka matla ho eketsa Boteng ba Motlakase ke Setheo sena ka ho lokiswa ho matla, katiso ya mekgwa e meng ya ho fehlwa ha motlakase ka ho sebedisa Dithebaene tsa Kgase, ho eketswa ha mekgwa e meng ya ho fehla motlakase e kenyeletsang ya mehlodi ya tlhaho ya matsete a lekala la poraefete, le ho matlafatsa temoso ya tsena molemong wa ho ntlafatsa Tsamaiso ya Tlhokeho e Matla ho tloha ho ba sebedisang motlakase haholo le malapeng.
",0.9206878
"Ditiro tša go senya di tšwela pele go tshwenya mananeokgoparara a Eskom, gomme ka go realo go thwalwa ga maloko a SANDF a 880 go leta ditiši tše mmalwa tša mohlagase tša Eskom ke karolo ya mekgwa ya go thibela maitekelo a go wiša mararankodimagolo a bosetšhaba a mohlagase.
","Diketso tsa sabotasi di tswela pele ho senya infrastraktjha ya Eskom, mme ho tswella ka ho romelwa ha ditho tsa Lebotho la Naha la Tshireletso la Afrika Borwa (SANDF) tse 880 ho lebela dibaka tsa ho fehla motlakase tsa Eskom, ke karolo ya mehato ya ho thibela ho putlama ha marangrang a naha.
",0.93307346
"Kabinete e amogetše sephetho sa go dira boipobolo go kahlolo yeo e sa tšwago dirwa ya Kgorokgolo ya Tsheko ya Pretoria yeo e laetšego Eskom go se kgaotše mohlagase wa ditheo tša setšhaba tšeo di akaretšago dikolo, dikliniki, maokelo, le ditiši tša maphodisa, ka ge se se ka ba le ditlamorago.
","Kabinete e ananetse qeto ya ho ipiletsa kgahlano le kahlolo ya morao tjena ya Lekgotla le Phahameng la Dinyewe la Pretoria le laetseng Eskom hore e se kgaole phepelo ya motlakase ditheong tsa setjhaba tse kenyeletsang dikolo, ditleliniki, dipetlele le diteishene tsa sepolesa ho itshetlehilwe hodima dikateng tsa kahlolo eo.
",0.94794977
"Kabinete e duma go lemoša MaAfrika Borwa go tšwela pele go boloka mohlagase go iša nepong ya bosetšhaba ya go boloka 1 000MW..Tlhabollo ya Mananeokgoparara Lesolo la Afrika Borwa la mananeokgoparara ka nepoya go tsošoloa ikonomi le go hlola mešomo le tšwela pele go kgwahlelela.
","Kabinete e lakatsa ho hopotsa Maafrika Borwa ho tswella le ho baballa motlakase bakeng sa ho fihlella morero wa ho baballa 1 000MW ka hara naha.
",0.83979666
"Ka go realo, Tona ya Dinamelwa, Mme Sindi Chikunga, o thakgotše Protšeke ya Pharakano ya Ditsela ya Ashburton ya go ja R.4 bilione ka Mmasepaleng wa Msunduzi ka KwaZulu-Natal, yeo e tlo kaonafatšago go sepetšwa ga merwalo gabonolo go tloga Boemakepeng bja Durban go tsena ka nageng le go ya ka tikologong ya SADTona ya Mešomo ya Setšhaba le Mananeokgoparara, Morena Sihle Zikalala o neelane ka maemakepe a mannyane a 13 ao a mpshafaditšwego ka tsela ya Lenaneo la Tokišo ya Maemakepe a Mannyane la mmušo la go ja R501 milione.
","Ntshetsopele ya Infrastraktjha Letsholo la Afrika Borwa bakeng sa ho tsosolosa moruo le ho hlahisa mesebetsi le tswela pele ka matla.
",0.7336934
"Mpshafatšo ya maemakepe a e tla oketša go šoma bokaone ga ona gape le go hlankela lekala la boreahlapi la selegae bokaone, mmogo le makala a mangwe ka diikonoming tša selegae..Ketelo ya Peoleihlo ka Jagersfontein Motlatšapresidente, Paul Mashatile o bile le ketelo ya peoleihlo go la Jagersfontein ka Mmasepaleng wa Selegae wa Kopanong ka Seleteng sa Xhariep ka Freistata.
","Tabeng ena, Letona la Dipalangwang, Mofumahadi Sindi Chikunga le thakgotse letsholo lena bakeng sa Projeke ya Ashburton Interchange ya R.4-bilione, Masepaleng wa Msunduzi o KwaZulu-Natal, e tla ntlafatsa tsamaiso e se nang mathata ya thepa ho tloha Port of Durban ho kena naheng ena le lebatoweng la Ntshetsopele ya Badudi ba Afrika e Borwa (SADC).
",0.8320459
"Go bile le dikarabo mabapi le kabo ya meetse yeo e phethagetšego ebile yeo e lekalekanago, le khudušo ya maloko a setšhaba ao a amilwego ke masetlapelo ao a hlotšwego ke ge lebota la letamo le phatloga.
","Letona la Mesebetsi ya Setjhaba le Infrastraktjha, Monghadi Sihle Zikalala le nehelane ka maemakepe a manyane a fetang 13 ka palo a ntlafaditsweng ka Lenaneo la mmuso la R501 milione la Tokiso le Tlhokomelo ya Maemakepe a Manyane.
",0.7726108
"Kabinete e ipileditše go dikhamphani ka moka tša meepo go ngwadiša matamo a tšona a go tšhela mašaledi a dirafša goba a go tšhela ditšhila tša go tšwa ka moepong lenaneongtshedimošo la Kgoro ya Meetse le Kelelatšhila gore go netefatšwe gore a latela melawana ya polokego ya matamo.
","Ntjhafatso ya dikou tsena e tla eketsa bokgabane ba ona le ho thusa lekala la lehae la botshwasi le dikgwebo tse ding tsa lehae.
",0.7943616
"Kgoro ya Meetse le Kelelatšhila gabjale e mpshafatša lenaneotshedimošo la matamo ka moka a go tšhela mašaledi a dirafša goba a go tšhela ditšhila tša go tšwa ka moepong ka mo nageng ao a latelago dinyakwa tšeo di tlo bitšwago “Matamo ao a Nago le Kotsi go Polokego”.
","Leeto la Peholeihlo la Jagersfontein
",0.5407709
"Go hwetša tshedimošo ya tlaleletšo ka ga matamo a go tšhela mašaledi goba ditšhila tša ka moepong, romela imeile go EMAILTOKEN.
","Motlatsa-Moporesidente Paul Mashatile o ne a le leetong la peholeihlo Jagersfontein, Masepaleng wa Lehae wa Kopanong, Seterekeng sa Xhariep Freistata.
",0.68625945
"Indaba ya Boeti ya Afrika Indaba ya Boeti ya Afrika ya 2023 e gare e tšwela pele go la Inkosi Albert Luthuli International Convention Centre ka Durban, ka dikemedi tša go fapafapana tša indaseteri ya boeti, tšeo di emetšego dinaga tša go feta 20 tša Afrika tšeo di kgathago tema ebile di bontšhago ditšweletšwa tša tšona tša boeti tša go feta 350.
","Tlaleho ka phepelo e hlwahlwa le e nang le tekano-tekano ya metsi, le ho lokisetsa botjha bodulo bakeng sa badudi ba neng ba anngwe ke koduwa e ileng ya bakwa ke ho phatloha ha lebota la letamo.
",0.7062023
"Tiragalo ye ke polatefomo e bohlokwa ya diprofešenale tša indaseteri gore di kopane, di abelane dikgopolo le go hlola dikamano tšeo di tlo tlišago kgolo.
","Kabinete e ipileditse dikhampaning tsohle tsa merafo ho ngodisa matamo a tsona a seretse dathabeising ya Lefapha la Metsi le Tsamaiso ya Dikgwerekgwere, ho netefatsa boimatahanyo le melawana ya polokeho ya matamo.
",0.7431394
"Afrika Borwa e ikgantšha ka thekgo yeo mmušo o e fago dikgwebo tše nnyane, tša magareng, tšeo beng ba tšona e lego basadi le tšeo beng ba tšona e lego baswa ka lekaleng la boeti le boamogelabaeng..Diboutu tša Tekanyetšo
","Lefapha la Metsi le Tsamaiso ya Dikgwerekgwere le ntse le ntjhafatsa dathabeisi ya matamo ohle a seretse ka hara naha a imatahanyang le dipehelo hore a nkuwe e le “Matamo a ka bang Kotsi.” Bakeng sa tlhahisoleseding e eketsehileng ka matamo a seretse o ka romela imeile ho EMAILTOKEN Indaba ya Bohahlaudi ya Afrika
",0.8210594
"Dikgoro tša mmušo di thomile go ala diboutu tša tšona tša tekanyetšo, tšeo e lego go tšea maikarabelo setšhabeng ka mošomo woo kgoro ye nngwe le ye nngwe e o dirilego mo ngwageng wa ditšhelete.
","Indaba ya Bohahlaudi ya Afrika ya 2023 e tswela pele Setsing sa Matjhaba sa Dikopano sa Inkosi Albert Luthuli, Thekong, moo indasteri ya tsa bohahlaudi Afrika e emetsweng ke baemedi ba fapaneng, ba tswang dinaheng tse fetang 20 tsa Afrika tse nang le seabo sebokeng, le ho pepesa dihlahiswa tse fetang 350 tsa bohahlaudi.
",0.71004975
"Lenaneo la Diboutu tša Tekanyetšo la Palamente le ka hwetšwa mo wepsaeteng ye: WEBTOKEN Lenaneo la Dingangišano tša Diboutu tša Tekanyetšo (Dikomiti tša Setšhaba tše Katološitšwego (EPC)) go tloga ka la 16 Mopitlo 2023 go fihla ka la 19 Mopitlo 2023.EPC ya Diminerale le Enetši(Kopano le boraditaba1300 E netefaditšwe)16 Mopitlo 2023Good Hope Chamber10:00 go fihla ka 15:15EPC ya Meetse le Kelelatšhila(Kopano le boraditaba 08:30-09:30 E sa tlo netefatšwa)16 Mopitlo 2023M4610:00 go fihla ka 12:15pmEPC ya Ditirelo tša Setšhaba le Tshepedišo (Sekolo sa Bosetšhaba sa Mmušo le Khomišene ya Ditirelo tša Setšhaba)(Kopano le boraditaba 10:00-11:00 E sa tlo netefatšwa)16 Mopitlo 2023Good Hope Chamber14:00 go fihla ka 16:15EPC ya Ditirelo tša Dikgokagano le Tshedimošo ya Mmušo (GCIS)(Kopano le boraditaba 12:00-13:00 E sa tlo netefatšwa)16 Mopitlo 2023M4614:00 go fihla ka 16:15EPC ya Tlhabollo ya Dikgwebopotlana(Kopano le boraditaba 14:00-15:00 E sa tlo netefatšwa)16 Mopitlo 2023Good Hope Chamber16:30 go fihla ka 18:15EPC ya Matlotlo a Bosetšhaba(Kopano le boraditaba 15:00-16:00 E sa tlo netefatšwa)16 Mopitlo 2023M4616:30 go fihla ka 18:15EPC ya Dinamelwa( Kopano le boraditaba 12:00-13:00 E sa tlo netefatšwa)17 Mopitlo 203Good Hope Chamber15:00 go fihla ka 17:15EPC ya Dikgokagano le Ditheknolotši tša Ditšithale(Kopano le boraditaba 11:00-12:00 E sa tlo netefatšwa)17 Mopitlo 203M4615:00 go fihla ka 17:15EPC ya Merero ya Selegae(Kopano le boraditaba 09:00-10:00 E sa tlo netefatšwa)17 Mopitlo 203Good Hope Chamber17:30 go fihla ka 19:00EPC ya Thuto ya Motheo(Kopano le boraditaba 09:00-10:00 E sa tlo netefatšwa)18 Mopitlo 2023Good Hope Chamber14:00 go fihla ka 16:15EPC ya Ditirelo tša Tshokollo(Kopano le boraditaba 11:00-12:00)18 Mopitlo 2023Good Hope Chamber16:30 go fihla ka 18:15EPC ya Peakanyo, Peleihlo le Tekolo(Kopano le boraditaba 10:00-11:00 E sa tlo netefatšwa)18 Mopitlo 2023M4616:30 go fihla ka 18:15Dithokgwa, Boreahlapi le Tikologo(Kopano le boraditaba 08:30-09:30 E netefaditšwe)19 Mopitlo 2023Good Hope Chamber10:00 go fihla ka 12:15Tšhireletšo ya Mmušo(Kopano le boraditaba 13:00-14:00 E sa tlo netefatšwa)19 Mopitlo 2023M4610:00 go fihla ka 12:158.
","Ketsahalo ena ke lepatlelo la bohlokwa la ba sebetsang indastering ena la ho kopana, ba abelane maele le ho theha mekgwa ya tshebedisano e tla kgothaletsa kgolo.
",0.5246395
"Ngata ya Kimollo ya Sekoloto sa Mebasepala
","Afrika Borwa e motlotlo ka tshehetso eo mmuso o e nehang dikgwebo tse nyane, tse mahareng, tse kgolo, tsa basadi le tsa batjha lekaleng la bohahlaudi le boeti..Dipuo tsa Ditekanyetso Mafapha a mmuso a se a qadile ho teka dipuo tsa ona tsa ditekanyetso, tseo e leng tlaleho mmusong ya mosebetsi oo lefapha ka leng le o entseng selemong sa ditjhelete.
",0.47422206
"Tona ya Ditšhelete o tsebagaditše ngata ya kimollo yeo e phumolago sekoloto sa kgale sa mebasepala go Eskom go thuša go lokolla letseno mebasepaleng gore e kgone go aba ditirelo tša motheo tša go tshepagala.
","Lenaneo la Puo ya Ditekanyetso la Palamente le a fumaneha websaeteng ena: WEBTOKEN Sekejule sa Dipuo tsa Ditekanyetso (Dikomiti tse Atolositsweng tsa Setjhaba (EPC)) sa ho tloha ka la 16 Motsheanong 2023 ho isa ho la 19 Motsheanong 2023.EPC ya Diminerale le Eneji(Seboka le Boraditaba ka 13:00 se netefaditswe)16 Motsheanong 2023Good Hope Chamber 10:00 ho ya ho 15:15EPC ya Metsi le Tsamaiso ya Dikgwerekgwere(Seboka le Boraditaba ka 08:30-09:30 nako e tla netefatswa)16 Motsheanong 2023M4610:00 ho ya ho 12:15EPC ya Ditshebeletso tsa Setjhaba le Tsamaiso (EPC ya Sekolo Sa Mmuso sa Naha le Khomishene ya Tshebeletso ya Setjhaba(Seboka le Boraditaba 10:00-11:00 nako e tla netefatswa)16 Motsheanong 2023Good Hope Chamber14:00 ho ya ho 16:15EPC ya Ditshebeletso tsa Dikgokahanyo tsa Mmuso le Tlhahisoleding (Seboka le Boraditaba 12:00-13:00 nako e tla netefatswa)16 Motsheanong 2023M4614:00 ho ya ho 16:15EPC ya Ntshetsopele ya Dikgwebo tse Nyane(Seboka le Boraditaba 14:00-15:00 nako e tla netefatswa)16 Motsheanong 2023Good Hope Chamber16:30 ho ya ho 18:15EPC ya Matlotlo a Naha(Seboka le Boraditaba 15:00-16:00 nako e tla netefatswa)16 Motsheanong 2023M4616:30 ho ya ho 18:15EPC ya Dipalangwang(Seboka le Boraditaba 12:00-13:00 nako e tla netefatswa)17 Motsheanong 2023Good Hope Chamber15:00 ho ya ho 17:15EPC ya Dikgokahanyo le Ditheknoloji tsa Dijithale (Seboka le Boraditaba 11:00-12:00 nako e tla netefatswa)17 Motsheanong 2023M4615:00 ho ya ho 17:15EPC ya Merero ya Lehae(Seboka le Boraditaba 09:00-10:00 nako e tla netefatswa)17 Motsheanong 2023Good Hope Chamber17:30 ho ya ho 19:00EPC ya Thuto ya Motheo(Seboka le Boraditaba 09:00-10:00 nako e tla netefatswa)18 Motsheanong 2023Good Hope Chamber14:00 ho ya ho 16:15EPC ya Tlhabollo ya Batshwaruwa(Seboka le Boraditaba 11:00-12:00)18 Motsheanong 2023Good Hope Chamber16:30 ho ya ho 18:15EPC ya Meralo, Bodisa le Tekolo(Seboka le Boraditaba 10:00-11:00 nako e tla netefatswa)18 Motsheanong 2023M4616:30 ho ya ho 18:15Meru, Botshwasi le Tikoloho(Seboka le Boraditaba 08:30-09:30 nako e sa tla netefatswa)19 Motsheanong 2023Good Hope Chamber10:00 ho ya ho 12:15Tshireletso ya Puso(Seboka le Boraditaba 13:00 -14:00 nako e tla netefatswa)19 Motsheanong 2023M4610:00 ho ya ho 12:15.Thuso ya ho Lefa Melato ya Bomasepala Letona la ditjhelete le hlahisitse mokgwa wa thuso ya ho hlakola melato eo ka yona ho tla fediswa melato ya kgale ya bomasepala ho Eskom, mme sena se tla thusa bomasepala hore ba be le ditjhelete ba kgone ho nehelana ka ditshebeletso tsa motheo tse tshepahalang.
",0.57789904
"Mebasepala go tlo nyakega gore e kgotsofatše dinyakwa tše thata ka tsela ya dipeelo tše 33 gore e be le maswanedi.
","Ho lebeletswe hore bomasepala ba fihlelle dipehelo tse tiileng tse 33 hore ba lokele ho fuwa thuso ena.
",0.8641267
"Dipeelo tše di akaretša dinepo tša kgoboketšo ya letseno ya motheo ge go etla ditirelong tša mohlagase le meetse go se šomiše letseno ka moka ga lona, leo le kgobokeditšwego ka ditefelo tša mohlagase, meetse le kelelatšhila le go lefela Eskom pele gomme go latele go lefela meetse pele ga ge go ka dirwa ditefelo dife goba dife tša kgwedi..Nepo ya Afrika Mopresidente Cyril Ramaphosa o kgathile tema ka Karolong ya Maemo a Phagamego ya bo 11 ya Tlhako ya Mokgwa wa Peoleihlo wa Tikologo ya Khutšo, Tšhireletšo le Tšhomišano (PSC) bakeng sa Democratic Republic of the Congo le Great Lakes Region, ka Burundi, bjalo ka karolo ya go matlafatša Nepo ya Afrika ya go homotša dithunya pele ngwaga wa 2030 o feta.
","Dipehelo tsena di kenyeletsa bokgoni ba bomasepala ba ho bokella bonyane ba tjhelete e lebeletsweng ya ditshebeletso tsa phepelo ya motlakase le metsi ho se senngwe ha tjhelete yohle ya motlakase, metsi le ditshebeletso tsa tsamaiso ya dikgwerekgwere e bokelletsweng le ho lefa akhaonte ya Eskom pele, ebe ho latela akhaonte ya metsi a mangata pele ho etswa ditefello dife kapa dife tsa kgwedi..Lenaneo la Afrika Moporesidente Cyril Ramaphosa o bile le seabo Motjheng wa Lebatowa wa Peholeihlo wa bo-11 wa Karolo e Boemong bo Hodimo ya Tsela ya Kgotso, Tshireletso le Tshebedisano (PSC), wa naha ya Riphabliki ya Demokrasi ya Congo (DRC), Lebatoweng la Matsha a Maholo, Burundi, e le karolo ya ho ntshetsa pele Morero wa Afrika wa ho fedisa dintwa ka selemo sa 2030.
",0.94297343
"Mopresidente Cyril Ramaphosa o tsenetše gape le Extraordinary Organ Troika Summit Plus ka Namibia.
","Moporesidente Cyril Ramaphosa o boetse a kenela Seboka sa Botho ba Dinaha tse Tharo se Ikgethang, Namibia.
",0.8858968
"Samiti ye e amogetše pego go tšwa SADC Field Assessment Mission ka Bohlabela bja Democratic Republic of Congo gomme ya tšeela hlogong karabelo ya selete go seemo seo se oketšegago sa tšhireletšo le botho.
","Seboka se fumane tlaleho ya Mosebetsi wa Tekolo ya Tikoloho wa SADC ka Botjhabela ba DRC mme seboka sa shebisisa karabelo ya lebatowa maemong a tswellang le ho ama tshireletso le boemo ba batho sebakeng seo.
",0.8528809
"Samiti e dumetše gore AU e swanetše e kgokaganye maitekelo a go fapafapana a go tliša khutšo le tšhireletšo ka Bohlabela bja DRKabinete e amogetše go thoma ga dipoledišano tša pele ga ditherišano magareng ga sešole sa Sudan le Rapid Support Forces, tšeo di thomilego go la Jeddah ka Saudi Arabia ka la 6 Mopitlo 2023.
","Sebokeng seo ho dumellanwe ka hore AU e hokahanye maiteko a fapaneng a ho ntlafatsa poloko ya kgotso le mekutu ya ho ntlafatsa tshireletso Botjhabela ba DRKabinete e ananetse qaleho ya dipuisano tsa pele ho ditherisano pakeng tsa sesole sa Sudan le Rapid Support Forces, tse qadileng Jeddah, Saudi Arabia, ka la 6 Motsheanong 2023.
",0.9359047
"Sudan yeo e nago le khutšo, yeo e etilwego pele ke mmušo wa batho, ga e bohlokwa feela go Sudan efela le go selete ka bophara le kontinente.
","Sudan e nang le kgotso le e buswang ke mmuso o kgethilweng ke batho e bohlokwa bakeng sa Sudan le lebatowa ka kakaretso le kontinente.
",0.89648914
"Ka go realo, Kabinete e ipiletša go maphakga ka bobedi go rerišana ka ga tumelelano ya go fediša ntwa gomme ba fediše le tlaišego ya batho ba Sudan.
","Kahoo kabinete e ipiletsa mahlakoreng ka bobedi ho rerisana ka tumellano e tla fedisa ntwa le tshotleho ya batho ba Sudan.
",0.9235679
"Kabinete e thabišitšwe ke gore MaAfrika Borwa ka moka ao a laeditšego gore a duma go boa gae go tšwa Sudan yeo e wetšwego ke dintwa bjale a boile, gomme lesolo la tlhakodišo la Afrika Borwa le thušitše le dinagamabapi.
","Kabinete e thabetse ho utlwa hore Maafrika Borwa ohle a neng a batla ho kgutlela hae ho tloha naheng ya Sudan e aparetsweng ke dikgohlano jwale a kgutletse lapeng, le ho kgotsofatswa ke thuso eo Afrika Borwa e nehelaneng ka yona ho dinaha tsa boahisani..Merero ya Kgwebisano Kabinete e amohetse tlaleho mabapi le dintshetsopele tsa merero ya kgwebisano, le ho lemoha hore kgweding ya Tlhakubele 2023 diyantle tsa Afrika Borwa dinaheng tse ding di ballwa ho R184 bilione.
",0.8219228
"Ditaba tša Kgwebišano Kabinete e amogetše tsebišo ka ga tšwelopele ya ditaba tša kgwebišano gomme ya lemoga gore mo kgweding ya Hlakola 2023, diromelwantle tša Afrika Borwa di dirile R184 bilione.
","Lekala la Tlhahiso le sebeditse ka bokgabane ka ho nyehela R85 bilione ka dihlahiswa, Lekala la Merafo la nyehela R84 bilione ha la Temo le nyehetse R11 bilione.
",0.8026632
"Lekala la Tšweletšontšhi e bile lona le šomilego gabotse ka letseno la R85 bilione ka thomelontle ya ditšweletšwa tša rena, gomme Lekala la Meepo le bile le letseno la R84 bilione, gomme Temo ya tsenya R11 bilione.
","Ditjhelete tsena tsa bohlokwa leha di le nyane ho feta tsa Tlhakubele 2022, di bontsha kamoo moruo wa Afrika Borwa o leng matla kateng le nakong ena ya kgolo e fokolang ya moruo.
",0.73416424
"Ditšhelete tše tse ntšhi tše, le ge e le gore di ka tlase ga tšeo di dirilwego ka Hlakola 2022, di bontšha ka fao ikonomi ya Afrika Borwa e tšwelago pele go ba le matšato le ka nakong ya kgolo ye nnyane ya ikonomi.
","Paloyohle ya Thepa ya R41 bilione ya diyantle tsena e ile dinaheng tse ding tsa Afrika mme sena ke sesupo sa maiteko ao diindasteri tsa Afrika Borwa di a etsang ho atolosa kgwebisano ya tsona kontinenteng ena.
",0.7841798
"Palomoka ya R41 bilione ya diromelwantle tše di ile dinageng tše dingwe tša Afrika, e lego seo se laetšago maitekelo ao diindaseteri tša Afrika Borwa di a dirago go oketšeng mebaraka ya tšona go phatlalala le kontinente.
","Dimmaraka moo kgwebisano e hodileng di kenyeletsa China, Belgium, Italy le United Arab Emirates mme sena se supa melemo e kgolwang ka kotloloho kamanong ya Afrika Borwa ya tsa moruo le dinaha tse ding.
",0.76727664
"Mebaraka yeo go yona kgwebišano e gotšego e akaretša China, Belgium, Italy le United Arab Emirates, e lego seo se laetšago dikholegothwii go tšwa maanong a ikonomi a Afrika Borwa.
","Diqeto tsa Kabinete.
",0.2935701
"Diphetho tša Kabinete.
","Lewa la Naha le Kopanetsweng la ho Lwantsha Kgwebisano ya Diphoofolo tse Hlaha (NISCWT)
",0.39313102
"Leano la Bosetšhaba la Seriti go Lwa le go Utswiwa ga Diphoofolo tša Lešoka (NISCWT)
","Kabinete e tjhaelletse monwana Leano la Naha le Kopanetsweng la ho Lwantsha Kgwebisano ya Diphoofolo tse Hlaha (NISCWT).
",0.81789577
"Kabinete e dumeletše Leano la Bosetšhaba la Seriti go Lwa le go Utswiwa ga Diphoofolo tša Lešoka (NISCWT).
","Ke lewa la pele la mofuta ona Afrika Borwa.
",0.5969379
"Leano le ke la mathomo la mohuta wa lona ka Afrika Borwa.
","Sepheo sa lona sa mantlha ke ho matlafatsa makala a qobello ya molao, ka disebediswa tse hlokehang bakeng sa ho fokotsa le ho thibela bothata bo totang ba kgwebisano ya diphoofolo tse hlaha bo amang tshireletso ya naha.
",0.516748
"Nepokgolo ya lona ke go matlafatša ditheo tša phethagatšo ya molao ka didirišwa tša maleba go fokotša koketšego ya go utswiwa ga diphoofolo tša lešoka ka nageng goo go beago tšhireletšo ya naga ya bosetšhaba kotsing.
","Leano lena le etsa ditshisinyo tse bonahalang tsa ho ntlafatsa bokgoni ba qobello ya molao ka hara naha, ho kenyeletsa tsepamiso ya maikutlo e tobileng phuputso le ho tjhutjhiswa ha maqulwana a kgwebisano ya diphoofolo tse hlaha.
",0.85241073
