src_text,tgt_text,cosine_score
"Kamora mengwahakgolo e meraro le halofo ya bokoloniale le ho kgethollwa ha batho ho ya ka merabe ya bona, le nakong eo batho ba neng ba nehwa ditshebeletso tsa motheo ho latela mebala ya bona, Afrika Borwa ya demokrasi e ile ya teka merero e kenyeletsang ya ntshetsopele molemong wa ho fihlella naha e atlehileng, e sa kgetholleng ka mmala, e sa kgetholleng ka bong le e nang le tekano-tekano.
","Umhla we-10 kuCanzibe – isiKhumbuzo sama-29 sokuBekwa kukamongameli wokuqala owonyulwa ngokwentando yesininzi
",0.6244186
"Leha ho na le tse ngata tse fihleletsweng ho tloha ka selemo sa 1994, ho sa na le tse ngata tse lokelang ho etswa molemong wa ho phethahatsa tseo naha ena e di labalabelang tse amanang le ntshetsopele.
","Intlanganiso yeKhabhinethi ibanjwe kanye emva kweminyaka engama-29 emva kokubekwa ngokusesikweni kukaMongameli Nelson Mandela njengoMongameli wokuqala woMzantsi Afrika olawulwa ngokwentando yesininzi ngomhla we-10 kuCanzibe 1994.
",0.61689794
"Banka ya Resefe ya Afrika Borwa e ntshitse ditjhelete tsa pampiri le dikhoene tse ntlafaditsweng, tsa ho keteka demokrasi ya rona e itshetlehileng molaong wa motheo le ho tlotla Madiba wa rona eo re mo ratang..Seboka sa Bophelo bo Botle sa Moporesidente Seboka sa bobedi sa Bophelo bo Botle sa Moporesidente se neng se tshwerwe ka la 4-5 Motsheanong 2023 se ne se shebane le ditshia tse robong tse Momahantsweng tsa Bophelo bo Botle tsa Boporesidente tsa 2019: khiro ya batho phihlello ya meriana, diente le dihlahiswa tsa kalafo infrastraktjha kenyeletso ya lekala la poraefete tlhokomelo ya kalafo ya boleng ntlafatso ya bolaodi ba ditjhelete ba lekala la mmuso taolo le boetapele kenyeletso ya badudi ditsamaiso tsa tlhahisoleseding le ho ba malala-a-laotswe bakeng sa diwa.
","Emva kweenkulungwana ezintathu ezinesiqingatha phantsi kwenkqubo yobukholoniyali kunye neyocalu-calulo apho ilungelo lomntu lokufumana iinkonzo ezisiseko lalixhomekeka kwibala lakhe, uMzantsi Afrika olawulwa ngokwentando yesininzi wamisela iinjongo zophuhliso eziza kusiza kwisizwe esiqhubela phambili, esingacaluli ngokwebala, ngokwesini nesinolingwano.
",0.81675905
"Se seng sa sephetho sa Seboka sena e bile boitlamo bo ntjhafetseng ba ho kenya tshebetsong Inshorense ya Naha ya Bophelo bo Botle (NHI).
","Nangona umninzi umsebenzi owenziweyo ukususela ngowama-1994, kusekuninzi ekufuneka kwenziwe ukuze sizalisekise la maphupha eenjongo zophuhliso.
",0.58043
"Ena ke karolo ya lenaneo la ho fokotsa ho se lekane-lekane phumantshong ya ditshebeletso tsa tlhokomelo ya kalafo, ka ho fedisa mathata a ditjhelete a amang phihlello ya ditshebeletso tsa tlhokomelo ya kalafo.
","IBhanki enguVimba yoMzantsi Afrika ikhuphe imali entsha ephuculiweyo engamaphepha nezingqekembe, ebhiyozela urhulumente wethu olawulwa ngokomgaqo-siseko futhi ikwenza oku ngelokuhlonipha utata wethu uMadib’omde.
",0.75239015
"Kabinete e ananela ho tjhaellwa monwana ha mehato e hlokehang molemong wa ho ntlafatsa tsamaiso ya bophelo bo botle le ho potlakisa diphetoho tsa NHTsena di atametsa ditsamaiso tsa bophelo bo botle bakeng sa ho sebeletsa Maafrika Borwa..Eneji
","INgqungquthela kaMongameli yezeMpilo
",0.26402354
"Mmuso o sebetsa le Eskom ho potlakisa ho lokiswa ha diyuniti tse bakileng hore ho kenwe Mokgahlelong wa Botshelela wa ho tingwa ha motlakase morao tjena, mme sena sa ba sa sitisa kgatelopele ya lenaneo la ho ntlafatsa boteng ba nako e telele ba motlakase ka hara naha.
","INgqungquthela kaMongameli yezeMpilo yesibini ibibanjwe ngomhla wesi-4 nowesi-5 kuCanzibe 2023 ibigxile kwiintsika ezisithoba zesiVumelwano sikaMongameli sezeMpilo: abasebenzi ukufumaneka kwamayeza, amachiza okuthintela kunye neemveliso zempilo iziseko zophuhliso ukubonisana necandelo labucala iinkonzo zempilo ezisemgangathweni ukuphucula indlela urhulumente azilawula ngayo izimali ezolawulo nobunkokeli ukufakana imilomo noluntu iinkqubo zolwazi kunye nokulungela oobhubhane.
",0.7202143
"Eskom e sebetsa ka matla ho eketsa Boteng ba Motlakase ke Setheo sena ka ho lokiswa ho matla, katiso ya mekgwa e meng ya ho fehlwa ha motlakase ka ho sebedisa Dithebaene tsa Kgase, ho eketswa ha mekgwa e meng ya ho fehla motlakase e kenyeletsang ya mehlodi ya tlhaho ya matsete a lekala la poraefete, le ho matlafatsa temoso ya tsena molemong wa ho ntlafatsa Tsamaiso ya Tlhokeho e Matla ho tloha ho ba sebedisang motlakase haholo le malapeng.
","Esinye seziphumo sale Ngqungquthela kukuzibophelela ngokutsha kumba wokuphunyezwa kwe-Inshorensi yeSizwe yezeMpilo (i-NHI).
",0.69749784
"Diketso tsa sabotasi di tswela pele ho senya infrastraktjha ya Eskom, mme ho tswella ka ho romelwa ha ditho tsa Lebotho la Naha la Tshireletso la Afrika Borwa (SANDF) tse 880 ho lebela dibaka tsa ho fehla motlakase tsa Eskom, ke karolo ya mehato ya ho thibela ho putlama ha marangrang a naha.
","Oku kuyinxalenye yenkqubo yokuphungula umsantsa okhoyo kwindlela esifikelela ngayo kwiinkonzo zempilo ngokuphungula umyinge wemali efunwayo ukuze umntu afumane iinkonzo zempilo ezisemgangathweni.
",0.7471844
"Kabinete e ananetse qeto ya ho ipiletsa kgahlano le kahlolo ya morao tjena ya Lekgotla le Phahameng la Dinyewe la Pretoria le laetseng Eskom hore e se kgaole phepelo ya motlakase ditheong tsa setjhaba tse kenyeletsang dikolo, ditleliniki, dipetlele le diteishene tsa sepolesa ho itshetlehilwe hodima dikateng tsa kahlolo eo.
","IKhabhinethi ichulumancile kukwamkelwa kwamanyathelo afunekayo ukuvuselela icandelo lezempilo kunye nokukhawulezisa utshintsho oluza kuza ne-NHOku kuza kwenza iinkonzo zempilo zeli zisondele kwinqanaba lokukwazi ukunceda abemi boMzantsi Afrika ngcono..Ezamandla
",0.811834
"Kabinete e lakatsa ho hopotsa Maafrika Borwa ho tswella le ho baballa motlakase bakeng sa ho fihlella morero wa ho baballa 1 000MW ka hara naha.
","Urhulumente usebenzisana ngamandla no-Eskom ukwenza ukuba ukhawuleziswe umsebenzi wokulungiswa kweeyunithi ezibangele ukuba sifikelele kwiSigaba se-6 sikacimi-cimi wombane kwezi ntsukwana zimbalwa zidlulileyo saze saphazamisa inkqubo yokuqinisekisa ukuba sinombane owaneleyo kwe kweli lizwe.
",0.770697
"Ntshetsopele ya Infrastraktjha Letsholo la Afrika Borwa bakeng sa ho tsosolosa moruo le ho hlahisa mesebetsi le tswela pele ka matla.
","Umsebenzi omandla uyaqhuba kwa-Eskom ukuze kunyuswe uMthamo woMbane oKhoyo (i-EAF) weli Ziko loMbane ngokwenza umsebenzi omkhulu wokukhanda, ukusetyenziswa kakhulu kwee-Open Cycle Gas Turbines, ukuthenga omnye umbane ohlaziyekayo kwiinkampani zabucala kunye nokuqhubeleka nokufundiswa kwamashishini asebenzisa umbane kakhulu kunye namakhaya ngenkqubo yokuLawulwa kweSantya sokuSetyenziswa koMbane.
",0.8167301
"Tabeng ena, Letona la Dipalangwang, Mofumahadi Sindi Chikunga le thakgotse letsholo lena bakeng sa Projeke ya Ashburton Interchange ya R.4-bilione, Masepaleng wa Msunduzi o KwaZulu-Natal, e tla ntlafatsa tsamaiso e se nang mathata ya thepa ho tloha Port of Durban ho kena naheng ena le lebatoweng la Ntshetsopele ya Badudi ba Afrika e Borwa (SADC).
","Izenzo zokonokalisa ngabom ziyaqhubeleka nokuthwaxa iziseko ezingundoqo zika-Eskom ke ngoko ukutyalwa kwamajoni e-SANDF ukuze agade izikhululo zophehlo-mbane zika-Eskom eziliqela kuyinxalenye yamanyathelo esiwathabathileyo ukuthintela ukuba iziko lombane lesizwe lingacimi.
",0.77127373
"Letona la Mesebetsi ya Setjhaba le Infrastraktjha, Monghadi Sihle Zikalala le nehelane ka maemakepe a manyane a fetang 13 ka palo a ntlafaditsweng ka Lenaneo la mmuso la R501 milione la Tokiso le Tlhokomelo ya Maemakepe a Manyane.
","IKhabhinethi isamkele isigqibo sokubhena kwisigwebo sakutsha nje seNkundla ePhakamileyo yasePitoli ebesinyanzelisa u-Eskom ukuba aqinisekise ukuba awachatshazelwa ngucimi-cimi wombane amaziko kawonke-wonke, aquka izikolo, iiklinikhi, izibhedlela kunye nezikhululo zamapolisa ngenxa yeengxaki ezinokwenziwa sesi sigwebo.
",0.7879752
"Ntjhafatso ya dikou tsena e tla eketsa bokgabane ba ona le ho thusa lekala la lehae la botshwasi le dikgwebo tse ding tsa lehae.
","IKhabhinethi icela abemi boMzantsi Afrika ukuba baqhubeleke nokonga umbane kude kufikelelwe kulo myinge wesizwe umiselweyo uyi-1000MUPhuhliso lweziSeko ezinguNdoqo
",0.73830056
"Leeto la Peholeihlo la Jagersfontein
","Iphulo loMzantsi Afrika lokukhwezela uqoqosho kunye nokudala imisebenzi liqhuba kakuhle kakhulu.
",0.64814955
"Motlatsa-Moporesidente Paul Mashatile o ne a le leetong la peholeihlo Jagersfontein, Masepaleng wa Lehae wa Kopanong, Seterekeng sa Xhariep Freistata.
","Kangangokuba, uMphathiswa wezoThutho, uNks Sindi Chikunga uphethule isoyi yokuqaliswa komsebenzi wokwakha i-Ashburton Interchange Project eza kuxabisa imali ezibhiliyoni zeerandi eziyi-2.4 kuMasipala waseMsunduzi kwiphondo laKwaZulu-Natal into leyo eza kwenza ukuba ihambe lula imithwalo esuka kwiZibuko laseThekwini ukungena kweli lizwe nakummandla we-SADUMphathiswa weMisebenzi kaRhulumente neziSeko ezinguNdoqo, uMnu Sihle Zikalala unikezele ngamazibuko amancinci aselwandle ali-13 alungiswe ngemali ezizigidi zeerandi ezingama-501 njengenxalenye yeNkqubo yokuVuselelwa nokuLungiswa kwamaZibuko amaNcinci.
",0.8132795
"Tlaleho ka phepelo e hlwahlwa le e nang le tekano-tekano ya metsi, le ho lokisetsa botjha bodulo bakeng sa badudi ba neng ba anngwe ke koduwa e ileng ya bakwa ke ho phatloha ha lebota la letamo.
","Ukuhlaziywa kwala mazibuko kuza kulenza lisebenze ngcono futhi kulincede kakhulu icandelo lokuloba lengingqi nganye kunye namanye amacandelo oqoqosho lwengingqi..Utyelelo lokuya kuHlola e-Jagersfontein
",0.798109
"Kabinete e ipileditse dikhampaning tsohle tsa merafo ho ngodisa matamo a tsona a seretse dathabeising ya Lefapha la Metsi le Tsamaiso ya Dikgwerekgwere, ho netefatsa boimatahanyo le melawana ya polokeho ya matamo.
","USekela-Mongameli uPaul Mashatile ebeyokuhlola e-Jagersfontein, kuMasipala weNgingqi wase-Kopanong kwiSithili sase-Xhariep eFreyistata.
",0.7764534
"Lefapha la Metsi le Tsamaiso ya Dikgwerekgwere le ntse le ntjhafatsa dathabeisi ya matamo ohle a seretse ka hara naha a imatahanyang le dipehelo hore a nkuwe e le “Matamo a ka bang Kotsi.” Bakeng sa tlhahisoleseding e eketsehileng ka matamo a seretse o ka romela imeile ho EMAILTOKEN Indaba ya Bohahlaudi ya Afrika
","Ufumene ingxelo ngokunikezelwa ngokufanelekileyo nangokulinganayo kwamanzi, kunye nokunikwa indawo yokuhlala kwabantu ababechatshazelwe yile ntlekele eyabangelwa kukudilika kweendonga zedama.
",0.8568026
"Indaba ya Bohahlaudi ya Afrika ya 2023 e tswela pele Setsing sa Matjhaba sa Dikopano sa Inkosi Albert Luthuli, Thekong, moo indasteri ya tsa bohahlaudi Afrika e emetsweng ke baemedi ba fapaneng, ba tswang dinaheng tse fetang 20 tsa Afrika tse nang le seabo sebokeng, le ho pepesa dihlahiswa tse fetang 350 tsa bohahlaudi.
","IKhabhinethi ihlabe ikhwelo kuzo zonke iinkampani ezinemigodi ukuba ziwabhalise amadama wazo entlenge eludaka lomgodi kwiSebe lezaManzi noGutyulo ukuze kuqinisekiswe ukuba asebenza ngokwemigaqo elawula ukhuseleko lwamadama.
",0.75041914
"Ketsahalo ena ke lepatlelo la bohlokwa la ba sebetsang indastering ena la ho kopana, ba abelane maele le ho theha mekgwa ya tshebedisano e tla kgothaletsa kgolo.
","ISebe lezaManzi noGutyulo sithetha nje lihlaziya uluhlu lwawo onke amadama entlenge eludaka lomgodi kweli lizwe anazo zonke izinto ezifunwayo ukuze athathwe ngokuba “ngamaDama angenaMngcipheko wobuNgozi”.
",0.7393012
"Afrika Borwa e motlotlo ka tshehetso eo mmuso o e nehang dikgwebo tse nyane, tse mahareng, tse kgolo, tsa basadi le tsa batjha lekaleng la bohahlaudi le boeti..Dipuo tsa Ditekanyetso Mafapha a mmuso a se a qadile ho teka dipuo tsa ona tsa ditekanyetso, tseo e leng tlaleho mmusong ya mosebetsi oo lefapha ka leng le o entseng selemong sa ditjhelete.
","Xa ufuna iinkcukacha ezithe vetshe malunga namadama entlenge eludaka lomgodi thumela i-imeyile ku: EMAILTOKEN I-Africa Travel Indaba
",0.7472023
"Lenaneo la Puo ya Ditekanyetso la Palamente le a fumaneha websaeteng ena: WEBTOKEN Sekejule sa Dipuo tsa Ditekanyetso (Dikomiti tse Atolositsweng tsa Setjhaba (EPC)) sa ho tloha ka la 16 Motsheanong 2023 ho isa ho la 19 Motsheanong 2023.EPC ya Diminerale le Eneji(Seboka le Boraditaba ka 13:00 se netefaditswe)16 Motsheanong 2023Good Hope Chamber 10:00 ho ya ho 15:15EPC ya Metsi le Tsamaiso ya Dikgwerekgwere(Seboka le Boraditaba ka 08:30-09:30 nako e tla netefatswa)16 Motsheanong 2023M4610:00 ho ya ho 12:15EPC ya Ditshebeletso tsa Setjhaba le Tsamaiso (EPC ya Sekolo Sa Mmuso sa Naha le Khomishene ya Tshebeletso ya Setjhaba(Seboka le Boraditaba 10:00-11:00 nako e tla netefatswa)16 Motsheanong 2023Good Hope Chamber14:00 ho ya ho 16:15EPC ya Ditshebeletso tsa Dikgokahanyo tsa Mmuso le Tlhahisoleding (Seboka le Boraditaba 12:00-13:00 nako e tla netefatswa)16 Motsheanong 2023M4614:00 ho ya ho 16:15EPC ya Ntshetsopele ya Dikgwebo tse Nyane(Seboka le Boraditaba 14:00-15:00 nako e tla netefatswa)16 Motsheanong 2023Good Hope Chamber16:30 ho ya ho 18:15EPC ya Matlotlo a Naha(Seboka le Boraditaba 15:00-16:00 nako e tla netefatswa)16 Motsheanong 2023M4616:30 ho ya ho 18:15EPC ya Dipalangwang(Seboka le Boraditaba 12:00-13:00 nako e tla netefatswa)17 Motsheanong 2023Good Hope Chamber15:00 ho ya ho 17:15EPC ya Dikgokahanyo le Ditheknoloji tsa Dijithale (Seboka le Boraditaba 11:00-12:00 nako e tla netefatswa)17 Motsheanong 2023M4615:00 ho ya ho 17:15EPC ya Merero ya Lehae(Seboka le Boraditaba 09:00-10:00 nako e tla netefatswa)17 Motsheanong 2023Good Hope Chamber17:30 ho ya ho 19:00EPC ya Thuto ya Motheo(Seboka le Boraditaba 09:00-10:00 nako e tla netefatswa)18 Motsheanong 2023Good Hope Chamber14:00 ho ya ho 16:15EPC ya Tlhabollo ya Batshwaruwa(Seboka le Boraditaba 11:00-12:00)18 Motsheanong 2023Good Hope Chamber16:30 ho ya ho 18:15EPC ya Meralo, Bodisa le Tekolo(Seboka le Boraditaba 10:00-11:00 nako e tla netefatswa)18 Motsheanong 2023M4616:30 ho ya ho 18:15Meru, Botshwasi le Tikoloho(Seboka le Boraditaba 08:30-09:30 nako e sa tla netefatswa)19 Motsheanong 2023Good Hope Chamber10:00 ho ya ho 12:15Tshireletso ya Puso(Seboka le Boraditaba 13:00 -14:00 nako e tla netefatswa)19 Motsheanong 2023M4610:00 ho ya ho 12:15.Thuso ya ho Lefa Melato ya Bomasepala Letona la ditjhelete le hlahisitse mokgwa wa thuso ya ho hlakola melato eo ka yona ho tla fediswa melato ya kgale ya bomasepala ho Eskom, mme sena se tla thusa bomasepala hore ba be le ditjhelete ba kgone ho nehelana ka ditshebeletso tsa motheo tse tshepahalang.
","I-Africa Travel Indaba yowama-2023 iyaqhuba sithetha nje e-Inkosi Albert Luthuli International Convention Centre eThekwini, apho izinyaswe zizithunywa ezahlukeneyo eziphuma kwicandelo lezokhenketho lase-Afrika.
",0.64015806
"Ho lebeletswe hore bomasepala ba fihlelle dipehelo tse tiileng tse 33 hore ba lokele ho fuwa thuso ena.
","Amazwe ase-Afrika athatha inxaxheba kulo msitho angaphezulu kwama-20 futhi abonisa ngeemveliso zezokhenketho ezingaphezulu kwama-350.
",0.7062367
"Dipehelo tsena di kenyeletsa bokgoni ba bomasepala ba ho bokella bonyane ba tjhelete e lebeletsweng ya ditshebeletso tsa phepelo ya motlakase le metsi ho se senngwe ha tjhelete yohle ya motlakase, metsi le ditshebeletso tsa tsamaiso ya dikgwerekgwere e bokelletsweng le ho lefa akhaonte ya Eskom pele, ebe ho latela akhaonte ya metsi a mangata pele ho etswa ditefello dife kapa dife tsa kgwedi..Lenaneo la Afrika Moporesidente Cyril Ramaphosa o bile le seabo Motjheng wa Lebatowa wa Peholeihlo wa bo-11 wa Karolo e Boemong bo Hodimo ya Tsela ya Kgotso, Tshireletso le Tshebedisano (PSC), wa naha ya Riphabliki ya Demokrasi ya Congo (DRC), Lebatoweng la Matsha a Maholo, Burundi, e le karolo ya ho ntshetsa pele Morero wa Afrika wa ho fedisa dintwa ka selemo sa 2030.
","Lo msitho uliqonga elibalulekileyo eliza kusetyenziswa zingcali zezokhenketho ukuba zidibane, zibonisane zize zityikitye nezivumelwano zentsebenziswano eziza kukhulisa eli candelo.
",0.69065034
"Moporesidente Cyril Ramaphosa o boetse a kenela Seboka sa Botho ba Dinaha tse Tharo se Ikgethang, Namibia.
","UMzantsi Afrika uyibulela kakhulu inkxaso enikwa ngurhulumente kumashishini oomama nolutsha amancinci, aphakathi namancinane akwicandelo lezokhenketho nezokutenda iindwendwe.
",0.6649653
"Seboka se fumane tlaleho ya Mosebetsi wa Tekolo ya Tikoloho wa SADC ka Botjhabela ba DRC mme seboka sa shebisisa karabelo ya lebatowa maemong a tswellang le ho ama tshireletso le boemo ba batho sebakeng seo.
","IiVoti zoHlahlo Lwabiwo-mali
",0.35807943
"Sebokeng seo ho dumellanwe ka hore AU e hokahanye maiteko a fapaneng a ho ntlafatsa poloko ya kgotso le mekutu ya ho ntlafatsa tshireletso Botjhabela ba DRKabinete e ananetse qaleho ya dipuisano tsa pele ho ditherisano pakeng tsa sesole sa Sudan le Rapid Support Forces, tse qadileng Jeddah, Saudi Arabia, ka la 6 Motsheanong 2023.
","Amasebe karhulumente ayiqalisile inkqubo yokunikezela ngeevoti zohlahlo lwabiwo-mali, eziyingxelo ezinikwa esidlangalaleni zomsebenzi owenziwe lisebe kunyaka-mali.
",0.6984583
"Sudan e nang le kgotso le e buswang ke mmuso o kgethilweng ke batho e bohlokwa bakeng sa Sudan le lebatowa ka kakaretso le kontinente.
","Inkqubo yeeVoti zoHlahlo Lwabiwo-mali eziza kwenziwa ePalamente iyafumaneka kule webhusayithi: WEBTOKEN Isicwangciso seeNgxoxo-mpikiswano zeVoti yoHlahlo Lwabiwo-mali ukusuka ngomhla we-16 kuCanzibe 2023 ukuya ngomhla we-19 kuCanzibe 2023.
",0.6097636
"Kahoo kabinete e ipiletsa mahlakoreng ka bobedi ho rerisana ka tumellano e tla fedisa ntwa le tshotleho ya batho ba Sudan.
","I-EPC yezeMithombo yeziMbiwa naMandla(Indibano nooNondaba 13:00 Iqinisekisiwe)16 kuCanzibe 2023Good Hope Chamber 10:00 -15:15I-EPC yezaManzi noGutyulo (Indibano nooNondaba 08:30-09:30 Isezakuqinisekiswa)16 kuCanzibe 2023M46 10:00 -12:15I-EPC yezaBasebenzi bakaRhulumente noLawulo (isiKolo seSizwe sikaRhulumente (i-NSG) kunye neKhomishini yezaBasebenza bakaRhulumente)(Indibano nooNondaba 10:00-11:00 Isezakuqinisekiswa)16 kuCanzibe 2023Good Hope Chamber 14:00 -16:15I-EPC yeZiko lezoNxibelelwano nokuSasazwa koLwazi lukaRhulumente(Indibano nooNondaba 12:00-13:00 Isezakuqinisekiswa)16 kuCanzibe 2023M46 14:00 – 16:15I-EPC yezokuPhuhliswa kwamaShishini amaNcinci(Indibano nooNondaba 14:00-15:00 Isezakuqinisekiswa)16 kuCanzibe 2023Good Hope Chamber 16:30 -18:15I-EPC kaNondyebo weSizwe(Indibano nooNondaba 15:00-16:00 Isezakuqinisekiswa)16 kuCanzibe 2023 M46 16:30 -18:15I-EPC yezoThutho(Indibano nooNondaba 12:00-13:00 Isezakuqinisekiswa)17 kuCanzibe 2023Good Hope Chamber 15:00 -17:15I-EPC yezoNxibelelwano neeNtlobo zobuXhaka-xhaba bale Mihla(Indibano nooNondaba 11:00-12:00 Isezakuqinisekiswa)17 kuCanzibe 2023M46 15:00 -17:15I-EPC yezeMicimbi yeKhaya (Indibano nooNondaba 09:00-10:00 Isezakuqinisekiswa)17 kuCanzibe 2023Good Hope Chamber 17:30-19:00I-EPC yezeMfundo esisiSeko(Indibano nooNondaba 09:00-10:00 Isezakuqinisekiswa)18 kuCanzibe 2023Good Hope Chamber 14:00-16:15I-EPC yezeNkonzo zoLuleko (Indibano nooNondaba 11h00-12h00 )18 kuCanzibe 2023Good Hope Chamber 16:30-18:15I-EPC yezoCwangciso, ukuHlola nokuVavanya (Indibano nooNondaba 10h00-11h00 Isezakuqinisekiswa)18 kuCanzibe 2023 M46 16:30 -18:15ElezamaHlathi, ezokuLoba nezokusiNgqongileyo(Indibano nooNondaba 08:30-09:30 Iqinisekisiwe)19 kuCanzibe 2023Good Hope Chamber 10:00- 12:15EzoKhuseleko lweLizwe(Indibano nooNondaba 13:00-14:00 Isezakuqinisekiswa)19 kuCanzibe 2023 M46 10:00-12:158.
",0.51876295
"Kabinete e thabetse ho utlwa hore Maafrika Borwa ohle a neng a batla ho kgutlela hae ho tloha naheng ya Sudan e aparetsweng ke dikgohlano jwale a kgutletse lapeng, le ho kgotsofatswa ke thuso eo Afrika Borwa e nehelaneng ka yona ho dinaha tsa boahisani..Merero ya Kgwebisano Kabinete e amohetse tlaleho mabapi le dintshetsopele tsa merero ya kgwebisano, le ho lemoha hore kgweding ya Tlhakubele 2023 diyantle tsa Afrika Borwa dinaheng tse ding di ballwa ho R184 bilione.
","IsiBonelelo sokuNceda kuMatyala ooMasipala UMphathiswa wezeMali uze nesibonelelo sokunceda kumatyala oomasipala esisetyenziswa ukucima amatyala amadala oomasipala ku-Eskom ngeenjongo zokunceda oomasipala ukuba babenayo imali yokunikezela iinkonzo ezisisiseko ngokusisigxina.
",0.766019
"Lekala la Tlhahiso le sebeditse ka bokgabane ka ho nyehela R85 bilione ka dihlahiswa, Lekala la Merafo la nyehela R84 bilione ha la Temo le nyehetse R11 bilione.
","Oomasipala kuza kufuneka bebenazo zonke ezi zinto zingqingqwa zingama-33 zifunwayo ukuze bakwazi ukuxhamla kwesi sibonelelo.
",0.7453183
"Ditjhelete tsena tsa bohlokwa leha di le nyane ho feta tsa Tlhakubele 2022, di bontsha kamoo moruo wa Afrika Borwa o leng matla kateng le nakong ena ya kgolo e fokolang ya moruo.
","Le miqathango iquka ukukwazi ukuqokelela imali yerhafu yamanzi nombane engumyinge othile azibekele wona ukubekela bucala yonke irhafu eqokelweyo yombane, amanzi nogutyulo kunye nokubhatala ityala lika-Eskom kuqala kuze kubhatalwe elamanzi okwesibini phambi kokuba kubhatalwe amanye amatyala enyanga.
",0.7457694
"Paloyohle ya Thepa ya R41 bilione ya diyantle tsena e ile dinaheng tse ding tsa Afrika mme sena ke sesupo sa maiteko ao diindasteri tsa Afrika Borwa di a etsang ho atolosa kgwebisano ya tsona kontinenteng ena.
","AmaPhulo e-Afrika
",0.40294558
"Dimmaraka moo kgwebisano e hodileng di kenyeletsa China, Belgium, Italy le United Arab Emirates mme sena se supa melemo e kgolwang ka kotloloho kamanong ya Afrika Borwa ya tsa moruo le dinaha tse ding.
","UMongameli Cyril Ramaphosa uthathe inxaxheba kwiNdibano ye-11 yeNqanaba eliPhezulu yeNkqubo yeNgingqi yokuHlola isiCwangcsio soXolo, uKhuseleko neNtsebenziswano e-Democratic Republic of Congo noMmandla we-Great Lakes, ebibanjwe e-Burundi njengenxalenye yenkqubo yase-Afrika yokuphelisa nya iimfazwe kweli lizwekazi ngowama-2030.
",0.7426137
"Diqeto tsa Kabinete.
","UMongameli Cyril Ramaphosa uphinde wazimasa i-Extraordinary Organ Troika Summit Plus e-Namibia.
",0.30236125
"Lewa la Naha le Kopanetsweng la ho Lwantsha Kgwebisano ya Diphoofolo tse Hlaha (NISCWT)
","Le Ngqungquthela ifumene ingxelo kwiGqiza le-SADC lokuHlola kwiMpuma ye-Democratic Republic of Congo yaze yaxoxa ngamanyathelo aza kuthatyathwa yile ngingqi kula ngxaki ibeka emngciphekweni ukhuseleko nentlalontle yabantu.
",0.52444667
"Kabinete e tjhaelletse monwana Leano la Naha le Kopanetsweng la ho Lwantsha Kgwebisano ya Diphoofolo tse Hlaha (NISCWT).
","Le Ngqungquthela iye yavumelana ukuba i-AU ibeyiyo ekhokela amaphulo ogcino-xolo nokhuseleko kwiMpuma ye-DRIKhabhinethi ikwamkele ukuqalisa kweengxoxo ezihlakulela uthetha-thethwano phakathi komkhosi wase-Sudan kunye ne-Rapid Support Forces, eziqale e-Jeddah, e-Saudi Arabia, ngomhla wesi-6 kuCanzibe 2023.
",0.67152596
"Ke lewa la pele la mofuta ona Afrika Borwa.
","Ilizwe lase-Sudan elinoxolo, elikhokelwa ngurhulumente wabantu, libalulekile hayi nje kuphela e-Sudan koko kula mmandla uwonke kunye neli lizwekazi.
",0.6421433
"Sepheo sa lona sa mantlha ke ho matlafatsa makala a qobello ya molao, ka disebediswa tse hlokehang bakeng sa ho fokotsa le ho thibela bothata bo totang ba kgwebisano ya diphoofolo tse hlaha bo amang tshireletso ya naha.
","IKhabhinethi ke ngoko ibongoza omabini amaqela akolu ngquzulwano ukuba azame ukuvumelana ngokuthetha-thethana ukuze lupheliswe olu ngquzulwano kuyekwe nokungcungcuthekiswa kwabantu base-Sudan.
",0.79268515
"Leano lena le etsa ditshisinyo tse bonahalang tsa ho ntlafatsa bokgoni ba qobello ya molao ka hara naha, ho kenyeletsa tsepamiso ya maikutlo e tobileng phuputso le ho tjhutjhiswa ha maqulwana a kgwebisano ya diphoofolo tse hlaha.
","IKhabhinethi ichulumancile zindaba zokuba bonke abemi boMzantsi Afrika abathi bafuna ukubuyela ekhaya beshiya ilizwe lase-Sudan elithwaxwa zizidube-dube babuyele ekhaya ngenene kunye noncedo elalinika amazwe angabamelwane eli phulo laqalwa nguMzantsi Afrika.
",0.7579177
"NISCWT e phatlaladitswe Lefapheng la Meru, Botshwasi le Tikoloho ho WEBTOKEN..Nkgetheng wa Afrika Borwa ya Thonyeditsweng Ho Ba Moahlodi Lekgotleng la Toka la Matjhaba (ICJ)
","IMiba yezoRhwebo
",0.34076664
"Kabinete e tjhaelletse monwana ho thonngwa ha Moprofesara Dire Tladi e le nkgetheng wa Afrika Borwa bakeng sa ho kgethelwa ho ba Moahlodi wa Lekgotla la Toka la Matjhaba (ICJ) dikgethong tsa ka Pudungwana 2023 tsa lekala lena.
","IKhabhinethi ixelelwe ngezamva nje malunga nemiba yezorhwebo yaze yeva nangokuba kwinyanga yoKwindla yowama-2023, iimveliso zorhwebo zoMzantsi Afrika ezithunyelwe kumazwe angaphandle bezixabisa imali ezibhiliyoni zeerandi ezili-184.
",0.7916995
"Dire Tladi ke moprofesara wa Molao wa Matjhaba Yunivesithing ya Pretoria mme o boetse ke Moporesidente wa Lekala la Afrika Borwa la Mokgatlo wa Molao wa Matjhaba le Setho sa Phethahatso sa Mokgatlo wa Molao wa Matjhaba.
","ICandelo leMizi-mveliso lilo eliqhube kakuhle kakhulu kuba lona ligalele imali ezibhiliyoni zeerandi ezingama-85 ngokuthengisa iimveliso eziveliswe kweli, laze lona iCandelo lezeMigodi lenza imali ezibhiliyoni zeerandi ezingama-84 laze lona elezoLimo lagalela imali ezibhiliyoni zeerandi ezili-11.
",0.7022847
"E kile ya ba Modulasetulo wa Khomishene ya Molao wa Matjhaba, e leng mokgatlo wa UN oo hangata o nkuwang e le lekala la ICE kile ya ba Moeletsi wa Molao wa Ntlo ya Bonqosa ya Afrika Borwa e New York le ho ba Moeletsi ya Ikgethang wa Matona a Afrika Borwa a Lefapha la Ditaba tsa Kantle ho Naha..DithonyoMangolo a thuto a bathonngwa a tla netefatswa mme ho netefatswe le hore ha ba so ka ba tlola molao.
","Ezi zixa-mali zibonakalayo, nangona zingaphantsi nje kancinci kwezi zenyanga yoKwindla yowama-2022, zibonisa indlela elinyamezela ngayo uqoqosho loMzantsi Afrika nangethuba apho uhlumo lwalo luphantsi.
",0.71954954
"Dithonyo tse ntjha ho Boto e Ikemetseng ya Bolaodi ya Bahlahlobi ba Dibuka tsa Ditjhelete: Mofumahadi Precious Nompumelelo Sibiya le
","Kwezi mpahla zorhwebo, ezixabisa imali ezibhiliyoni zeerandi ezingama-41 zithunyelwe kumanye amazwe ase-Afrika into ebonakalisa ukuba amashishini aseMzantsi Afrika angena ngamandla ngokwezorhwebo kweli lizwekazi lase-Afrika.
",0.67977583
