src_text,tgt_text,cosine_score
"Kabinete amogetše go thongwa ga polante ya tšweletšo ya plastiki ya maemo godimodimo lefaseng ka khampani ya go dira plastiki yeo tšwago pele maemong boditšhabatšhaba, ya go bitšwa ALPLA Group, go la Lanseria kua Gauteng.
","Mo go yona go akarediwa lenaneo la go ithutela tiro la baithutela mekhateroniki ba le 36 le borathekeniki ba tirisogape ba ditirelo tsa ALPLA go ralala borwa jwa Aforika.
",0.76543045
"Se se tlaleletša maikgafo Mopresidente Ramaphosa go bea sekeng tlhabollo ya mananeokgoparara bjalo ka mokgwa wa go hlohleletša kgolo ya ikonomi le go atiša mešomo..   Dipeeletšo tša boleng bja US$50 milione di kgatha tema ye kgolo godimo ga Leanolegolo la Toropo ya Mabonwa ya Lanseria leo le tlo hlohleletšago seemo seo se tieletšego le tšhomišoleswa le gape go hlola le go šireletša mešomo ye.
","Lenaneo la go ithutela tiro le tla simolola ka 2023, mme baithutela tiro ba ntlha ba le 12 ba Aforika Borwa ba tla bo ba tswa mo mafelong selegae..   Ditiragalo tsa Meepo tse di seng mo Molaong.
",0.69323945
"Godimo ga dipeeletšo tše go akaretšwa le lenaneo la go ithutela mošomo la batsebi ba 36 ba bointšineere bja dikgerekgere le ba tšhomišogape ba ditiro tša ALPLA Group go ralala selete sa Borwa bja Afrika.
","Ditiragalo tsa meepo tse di seng mo molaong di phuaganya metse mo setšhabeng sa borona mmogo le ikonomi ya rona, le go baka tatlhegelo ya lotseno go bobedi puso le lekala la meepo..   Kabinete itumedisitswe ke go amogiwa moselesele wa ditlhobolo le go tshwarwa ga babelaelwa ba le 20 ba ba golaganngwang le ditiragalo tsa meepo tse di seng mo molaong ka nako ya letsholo le le neng la dirwa kwa šafoteng ya moepo wa Stilfontein kwa Bokone Bophirima..   Kabinete ikuela go Maaforika Borwa go tswelela go dirisana le ditheo tsa molao go dira bonnete jwa gore matsholo thibelo ya bosenyi isago le ona atlega.
",0.7457104
"Lenaneo le la boithutelamošomo le tlo thoma ka 2023, ka baithutelamošomo ba mathomo ba 12 ba MaAfrika Borwa ba go tšwa mafelong ka mo nageng.
","Se se tla romela molaetsa o bogale wa gore bosenyi ga bo duele, le gore disenyi di tla tshwarwa le go sekisiswa ntle le poifo kgotsa kgethololo..   Motlakase.
",0.5690042
"Meepo ye Sego Molaong.
","Go sale gale Eskom saenile ditumelano tsa kadimo tsa dingwaga tse 30 le babeeletsi ba bafetlhi ba ba ba ikemetseng ba motlakase ba le bane go aga mothamo mošwa wa go fetlhiwa ga motlakase o phepa kwa diteišeneng tsa motlakase tsa Majuba le Tutuka kwa Mpumalanga.
",0.43160433
"Meepo ye sego molaong kweša setšhaba bohloko le go gobatša ikonomi ya gaborena, ebile dipoelo tša yona ke tobo ya letseno go bobedi mmušo le lefapha la meepo..   Kabinete amogetše go amogwa ga dithunya tšeo di bego di utilwe le go golegwa ga bagononelwa ba 20 ba go amana le meepo ye sego molaong ka nako ya lesolophuruphutšo kua mokoting wa moepo wa Stilfontein go la Leboa Bodikela.
","Dikadimo tse tsa lefatshe di tla ngoka peeletso e lekanyediwang go diranta di le dibilione tse.
",0.56492823
"Kabinete dira boipiletšo go MaAfrika Borwa go tšwelapele go šomišana le mabotho phethagatšo ya molao go netefatša go atlega ga masolo kamoso twantšho ya bosenyi.
",".
",0.11232278
"Se se tla romela molaetša wo bogale wa gore bosenyi ga bo thuše ka selo, le gore badirabosenyi ba tlo golegwa le go sekišwa ntle poifo goba go šokelwa..  Enetši.
","Babeeletsi ba bane ba - HDF Energy South Africa, Red Rocket SA, Sola Group le  Mainstream Renewable Power Developments South Africa – ba tla tsenya bonnye dimekawate di le 2 000 mo mafaratlhatlheng motlakase bosetšhaba..   Mothamo mošwa wa go fetlhwa ga motlakase solofelwa go golaganngwa mo mafaratlhatlheng motlakase mo dikgweding tse 24 go ya go 36 go tloga ka konosetso ya tsa matlole, go ikaegilwe ka ditetlelelo tsa tikologo, tlhaolo ya lefatshe le tse dingwe tsa taolo..   Dikgato tsa go Dira Bonnete jwa gore Naga ga Tlhaele Dijo.
",0.67145663
"Eskom saenetše dikwanelo tša go hiriša tša mengwaga ye 30 gotee le babeeletši ba bane ba batšweletši ba go ikema ba mohlagase go aga metšhene ye mefsa ya go fehla enetši ya go hlweka kua ditišing tša mohlagase tša Majuba le Tutuka gola Mpumalanga.
","Kabinete amogetse gore Kopano ya Agri SA ya 2022 tshwarelwe kwa Pretoria ka la bo 13 le la bo 14 Diphalane 2022 ka fa tlase ga setlhogo: “Re Kotula seo re se Jetseng ka fa Nageng”.
",0.7212963
"Khirišo ye ya seripa sa naga tla goketša dipeeletšo tše phopholeditšwego tša go batamela R40 bilione.
","Kopano e ne buisanela merero e jaaka go dira gore maanomagolo temothuo direle balemi ba naga; mafaratlhatlha a boikanyego tlhagiso ya dijo ya selegae go isa isagong, le go matlafatsa bokgoni ba batlhagisi ba dijo go dira ka ditlhagiswa tse di jetsweng mono..   Mo dikgatong tse dingwe gape tsa go dira bonnete jwa gore naga ga tlhaele dijo, Kabinete amogetse gape go thankgololwa ga Sefala sa Bosetšhaba sa Tshireletso ya Dimela le Diphologolo, ke Lenaneo la Semphato sa Itlhamelo mo go tsa Temothuo le Ikonomi ya Dimela le Diphologolo sa Lefapha la Saense le Boitlhamelo, ka tirisano le Yunibesithi ya Pretoria.
",0.62247443
"Babeeletši ba ba bane – HDF Energy South Africa, Red Rocket SA, Solar Group le Mainstream Renewable Power Developments South Africa – ba tlo fehla mohlagase wa go lekana dimekawate tše 2 000 godimo ga mohlagase wa go tšweletšwa setšhabeng.
","Sefala se se tla tshegetsa thibelo, phokotso le taolo ya malwetse dimela le diphologolo leng se se tla oketsang tlhagiso, tshireletso ya dijo le tlhabololo e tsepameng ya metsemagae   Ditshwetso tsa Kabinete.
",0.71820134
"Phehlo ye ye mpsha ya mohlagase go letetšwe gore kgokaganywe le mohlagase wo tšweletšwago nageng ka bophara mo dikgweding tše 24 go fihla go tše 36 go tloga ge ngwaga wo wa ditšhelete fela, ka go latela ditumelelo tša tikologo, tša karolo ya mafelo le tše dingwe tša taolo.
","Mametlelelo ya Tšhata ya Tsamaiso e seng ya Bogareng ya Mokgatlo wa Tirisano ya Aforika (AU).
",0.5154854
"Tšhireletšego ya Dijo.
","Kabinete amogetse go romelwa kwa Palamenteng ga Tšhata ya AU ka ga Meono le Melawana ya Tsamaiso e Seng ya Bogareng, Bobusi ba Selegae le Tlhabololo ya Selegae gore mametlelelwe.
",0.25406355
"Kabinete amogetše go swarwa ka mo nageng ga Lekgotla la 2022 la Agri SA go la Pretoria ka la 13 le la 14 Diphalane 2022 ka fase ga morero wo: “Kgodišo ya Tšweletšo ya ka Nageng”.
","Aforika Borwa saenile Tšhata ka Phatwe.
",0.5097357
"Lekgotla le le rerišane ka merero ya go swana le go dira gore maanakgolo temo šomele batšweletši ba ka mo nageng; mananeokgoparara go swarelela dijo tša go tšweletšwa ka mo nageng; go dira gore tikologo ya ka mo nageng tšee nako ye telele godimo ga tšweletšo ya dijo ya ka mo nageng le ka bokamosong, le go matlafatša mabokgoni tšweletšo ya dijo go diriša ditšweletšo tšeo di tšweleditšwego ka mo nageng.
",".
",0.059013784
"Ka gona go bea pele tšhireletšego ya dijo kamoso, Kabinete amogetše go tsebagatšwa ga Hapo ya Bosetšhaba ya Tšhireletšego ya Tlhago, ka Kgoro ya Saense le Lenaneo la Kgwebišano ya Temo ya Ikonomi ya Diphedi, ka tšhomišano le Yunibesithi ya Pretoria.
","Tšhata ya Tsamaiso e seng ya Bogareng tlamela letlhomeso go dinaga tsotlhe tse leng ditokololo setlankana sa kaedi ka ga tsamaiso e seng ya bogareng ya dithata le ditiro go tswa go puso ya bosešhaba go ya go makala mangwe puso.
",0.7217442
"Hapo ye tla thekga thibelo, phokotšo le taolo ya dipuno le malwetši diphoofolo, ao tlo bago le seabe sa tšweletšo ye hlatlogetšego godimo, tšhireletšego ya dijo le tlhabollo ye swarelelago ya dinagamagae   Diphetho tša Kabinete.
","Tšhata samagana bogolo le tsamaiso e seng ya bogareng ya thata le ditiro, letlhomeso la bobusi ba selegae le tlhabololo ya selegae..   Lekgotla la Boditšhaba la Ngwaga le Ngwaga la bo 32 la Pabalesego mo Diporong (IRSC).
",0.7442902
"Go Dumelelwa ga Tšhatha ya Kopano ya Afrika (AU) ya go Hlongwa ga Makala.
","Kabinete amogetse go tshwarwa ga Kopano ya Ngwaga le Ngwaga ya bo 32 ya IRSC kwa Johannesburg go tloga ka 1 go fitlha ka 6 Diphalane 2023 ka fa tlase ga setlhogo: “Poposešwa ya diporo mo Lefatsheng le le sa tlhomamisegeng”.
",0.61913323
"Kabinete dumeletše tlhagišo Palamenteng ga Tšhatha ya AU ka Mehola le Metheo ya go Hlongwa ga Makala, Pušoselegae le Tlhabollo ya ka Nageng gore dumelelwe.
","RSC ke kopano sa boditšhaba e kopanyang dirutegi mo mererong ya pabalesego ya diporo go ralala lefatshe go abelana maitemogelo bona ka maikaelelo go tokafatsa pabalesego ya diporo..   Jaaka tokololo ya IRSC, Molaodi wa Taolo ya Diporo wa Aforika Borwa nnile moamogelabaeng wa kopano la bofelo ka.
",0.73009676
"Afrika Borwa saenetše tšhatha ye ka Phato.
",".
",0.2871133
".
","Seralwa sa Leano la Mafaratlhatlha Bosetšhaba la 2050 (NIP 2050) Kgato ya bo.
",0.4316395
"Tšhatha ye ya go Hlongwa ga Makala fana ka tlhako go mebušo ka moka ye lego maloko ka sengwalwa sa tlhahlo ka khuetšo ya go hlongwa ga makala le mehola ya ona go tloga mmušong wa bosetšhaba go ya didikong tše dingwe tša mmušo.
","Kabinete amogetse go phasaladiwa ga seralwa sa NIP 2050 Kgato ya bo 2 go ngoka ditshwaelo tsa baagi.
",0.719343
"Tšhatha ye swaragane kudu le phatlalatšo ya taolo le mehola, tlhako ya pušo le tlhabollo ya ka mo nageng.
","Leano le le neelana ka tsela ya go matlafatsa le go tlaleletsa diporojeke tsa puso tse di golaganeng..
",0.696571
"Khansele ya bo-32 ya Ngwaga ka Ngwaga ya Boditšhabatšhaba ya Polokego ya Ditimela (IRSC).
","Le tlhagisa diporojeke tsa botlhokwa tsa mafelobonno batho; motlakase wa bommasepala; metsi; matlakala a popota; dipalangwa; mafaratlhatlha thuto le boitekanelo; mafaratlhatlha dijithale, le bosenyi le bobodu..   Popego ya leano le tlamela ka ponelopele ya karolo e tshwanetseng go lejwa tlamela ka tshekatsheko ya maemo ga jaana tlhalosa dipeelo tse di botlhokwa go netefatsa katlego le go tlhalosa tse di tshwanetseng go dirwa go fitlhelela ponelopele eo tshitshinya tsela ya tsenyotirisong e tshwanetseng go dirwa mo pakeng ya dingwaga tse tharo tsa leanotiro..   Letlhomeso la Bosetšhaba la Tsenyotirisong la go Dira Bodiredipuso ba Porofešenale.
",0.4766346
"Kabinete dumeletše go swarwa ga Kopano ya bo-32 ya Ngwaga ka Ngwaga ya IRSC gola Johannesburg go thoma ka la 1 go fihla ka la 6 Diphalane 2023 ka fase ga morero wo: “Phetošo ya sebopego sa ditimela mo Lefaseng leo go sa tsebjego tša kamoso”.
","Kabinete amogetse Letlhomeso la Bosetšhaba la Tsenyotirisong la go Dira Bodiredipuso ba Porofešenale.
",0.57083464
"IRSC ke foramo ya boditšhabatšhaba ya go kopantšha mmogo ditsebi tša polokego ya ditimela go tšwa lefaseng ka bophara go fana maitemogelo go kaonafatša polokego ya ditimela..   Bjalo ka leloko la IRSC, Kemedi ya Afrika Borwa ya Polokego ya Ditimela swere foramo ye la mafelelo ka.
","Letlhomeso le le phasaladitswe ka 2021 go ngoka ditshwaelo tsa baagi..   Letlhomeso le le tlamela ka dipilara tse tlhano tsa ditsereganyo mo go direng Bodiredipuso ba porofešenale.
",0.74674034
"Seakanywa sa Leano la Bosetšhaba sa Mananeokgoparara 2050 (NIP 2050) Kgato ya.
","Dipilara tse di akaretsa go ngoka le tlhaolo ya pele ga go tsena mo Bodiredipusong; peodinakong le tshimololo; thulaganyo le taolo ya tiragatso; thuto e tswelelang le tlhabololo ya porofešenale; le tlhatlogo ka maemo mo tirong le ditiragalo mo tirong..   Diphetogo mo Dipeelong tsa Tiro tsa Bakaedikakaretso (bo DG).
",0.60850877
"Kabinete dumeletše phatlalatšo kuranteng ya mmušo ya Kgato ya Bobedi ya seakanywa sa NIP sa 2050 gore setšhaba se fe ditshwayotshwayo tša sona.
","Kabinete amogetse pegelo e tshitshinyang mekgwa ya go matlafatsa nonofo le bokgoni ba bo DG mo Bodiredipusong.
",0.7080327
"Leano le le fa tlhahlo matlafatšong le kaonafatšong ya diprotšeke tše logetšwego maano tša mmušo tša mohlakanelwa..   Seakanywa se se hlaola diprotšeke tše logetšwego maano madulong batho; mohlagase wa mmasepala; meetse; dilahlwa tše thata; dinamelwa tša banamedi; thuto le mananeokgoparara maphelo; mananeokgoparara titšithale, le bosenyi le bomenetša.
","Pegelo e dirile ditshitshinyo di le mmalwa, go akaretsa paka ya tiro ya bo DG le taolo ya maatlatiro ka Bothati ba Khuduthamaga go bantlhankedi ba ba rweleng maikarabelo..   Pegelo e tshitshintse gape gore DG mo Kantorong ya Moporesitente tla tsewa gape le Tlhogo ya Botsamaisi ba Puso.
",0.7896334
"Sebopego sa leano le se fana ka ponelopele ya fao go swanetšego go fiwa šedi, se fana ka phetleko ya seemo sa bjale, se hlatholla dipeelano tše bohlokwa tša go atlega le go bolela gore go swanetše gore go dirwe eng go fihlelela ponelopele ye.
","Mo diporofenseng, tiro e tla newa oDG ba ba mo dikantorong tsa Ditonakgolo.
",0.6346879
"Se šišinya tshepedišo ya phethagatšo ye swanetšego go latelwa mo leanong la magato la go gagaba tekano ya mengwaga ye meraro.
","Pegelo e tshitshintse gape mekgwa ya go kaela mafapha ka ga taolo ya dikonteraka tsa bo DG..   Tsamaiso ya Taolo ya Tiragatso ntšhwa ya bo DG a tlhabololwa go nyalanya le diphetogo tse di dumeletsweng..   Tona ya Nama-o-Tshwere ya Bodiredipuso le Botsamaisi, Rre Thulas Nxesi tla bitsa kopano ya bobegakgang mo bekeng e tlang go tlhalosa Letlhomeso la Bosetšhaba la Tsenyotirisong la go Dira Bodiredipuso ba Porofešenale le go tlhagisa gape le diphetogo tse di letleletsweng mo dipeelong tsa tiro ya bo DG..   Pegelo ya Botlhano ya Tswelopele mo Tsenyotirisong ya Lekwalopuso la Mabudusatsela ka ga Ditshwanelo tsa Batho ba ba nang le Bogole (WPRPD) ya 2020-.
",0.63960636
"Tlhako ya Phethagatšo ya Bosetšhaba ya go Fihlelela Bokgoni Ditirelong tša Mmušo.
","Kabinete amogetse Pegelo ya Botlhano ya Tswelopele mo Tsenyotirisong ya WPRPD e tlhagisang peodinakong ka go tsenngwa tirisong ga WPRPD.
",0.71924853
"Kabinete dumeletše Tlhako ya Phethagatšo ya Bosetšhaba ya go fihlelela Bokgoni Ditirelong tša Mmušo.
","Pegelo e akaretsa ditshitshinyo go tswa go mafapha puso bosetšhaba le diporofense tlamela ka peodinakong ka ga tsenyotiriosong ya pholisi e akaretsang kabo ya matlole..   Pegelongwaga ya ntlha ya tswelopele phasaladitswe ka.
",0.7665262
"Tlhako ye phatlaladitšwe ka 2021 gore setšhaba se ntšhe sa mafahleng sona..   Tlhako ye fana ka maikokotlelo mahlano mo magatong go hloma bokgoni Ditirelong tša Mmušo.
","Pegelo ya Tswelopele ya botlhano letleletswe go phasaladiwa ka kuranta ya puso ke Lefapha la Basadi, Bašwa le Batho ba ba nang le Bogole.
",0.69141746
"Metheo ye ya boikokotlelo akaretša kgoketšo ya pele tsena le tlhokolo mo Ditirelong tša Mmušo; kgakolo le tlwaetšo; thulaganyo le taolo ya bodiragatši; thuto ye tšwelagopele, kgatelopele ya kgetho ya mošomo le ditiragalo tša mabapi le kgetho ya mošomo.
",".
",0.09485731
"Diphetogo ka Gare ga Dipeelano tša Mošomo tša Balaodipharephare (di-DG).
","Tokafatso ya Athikele 20(1) ya Tumelano ka ga go Fedisiwa ga Mefuta yotlhe ya Kgethololo Kgatlhanong le Basadi (CEDAW).
",0.7027915
"Kabinete dumeletše pego ya go šišinya magato go matlafatša mabokgoni le bokgoni bja Balaodipharephare (di-DG) Ditirelong tša Mmušo.
","Kabinete dumeletse go romelwa kwa Palamenteng ga tokafatso ya Athikele 20(1) ya CEDAW gore mametlelelwe.
",0.7141268
"Pego ye dirile ditšhišinyo tše mmalwa, go akaretšwa le paka ya ka kantorong ya di-DG le taolo ya baromiwa ka Lekgotlaphethiši go bahlankedi ba taolo..   Pego ye šišintše gape le gore Molaodipharephare Kantorong ya Mopresidente tla neelwa Hlogo ya Ditirelo tša Mmušo.
","Diphetogo tse di tlamela ka paka e okeditsweng ya dikopano tsa komiti e sekasekang dipegelo tsa dinaga tse leng ditokololo..   Aforika Borwa saenile tumelano ka 1993 le go mametlelela ka Sedimonthole.
",0.77254754
"Kua diprofenseng, mošomo wo tla neelwa Balaodipharephare dikantorong tša Ditonakgolo.
","Go romelwa kwa Palamenteng go senka go golaganya tumelano e mametleletsweng mo malobeng le tokafatso ya Athikele 20(1) ya tumelano .
",0.56314707
"Pego ye šišintše gape le magato go hlahla dikgoro ka taolo ya dikontraka le Balaodipharephare.
","Tumelano ya Dinaga tsa Lefatshe ka ga Kamogelo ya Makwalothuto Tebang le Thuto Kgolwane.
",0.6028396
"Peakanyo ye Fetlekilwego ya Taolo ya Bodiragatši go Balaodipharephare gare ya fetlekwa gore gate ka mošito tee le diphetogo tšeo di dumeletšwego.
","Kabinete amogetse go romelwa kwa Palamenteng ga Tumelano ya Dinaga tsa Lefatshe ka ga Kamogelo ya Makwalothuto tebang le Thuto Kgolwane gore tsenngwe molaong semmuso.
",0.75253415
"Tona ya Motšwaoswere ya Ditirelo tša Mmušo le Tsamaišo, Ntate Thulas Nxesi tlare mo bekeng ye tlago sware kopano ya tshedimošetšo ya babegaditaba go hlatholla Tlhako ya Bosetšhaba ya Phethagatšo go fihlelela Bokgoni Ditirelong tša Mmušo le gape go hlatholla gabotse diphetogo tše dumeletšwego dipeelanong tša go thwalwa ga Balaodipharephare.
","Fa sena go tsenngwa molaong semmuso tla romelwa go Mokgatlo wa Thuto, Saenthifiki le Setso wa Ditšhabakopano (UN) le mono gae tla nna karolo ya Molao wa Leano la go Tsamaisa Tiro la Naga la Makwalothuto wa ngwaga wa 2008 (Molao wa bo 67 wa 2008)..   Tumelano eno ya Dinaga tsa Lefatshe tlhoma melawana ya lefatshe ka bophara ya Kamogelo ya makwalothuto ditheo tsa thuto kgolwane le makwalothuto mangwe ka go dira gore lefatshe ka bophara go se nne le makwalothotu a sa tseeweng tsiya a nang le lehunelo, le a sa tlhaolweng.
",0.7742087
"Pego ya Bohlano ya Mošomo ka Phethagatšo ya Sengwalwa sa Makgoraditsela ka Ditokelo tša Batho ba go Phela ka Bogole (WPRPD) 2020-.
","Tumelano eno neela tetla ya gore makwalothuto dinaga disele mo dinageng tse 193 tse leng ditokololo tsa UN amogelwe ke dinaga tseno..   Kgogelomorago ya Ditokafatso mo Kaeding ya Maloko Khuduthamaga.
",0.69561607
"Kabinete dumeletše Pego ya Bohlano ya Mošomo ka phethagatšo ya WPRPD, yeo fanago ka seemo sa bjale ka phethagatšo ya WPRPD.
","Kabinete tlhomamisitse pegelo e dirilweng ke Kantoro ya ga Moporesitente ka Mosupologo, 17 Diphalane 2022 go gogela morago diphetogo tse di dirilweng tsa 2022 mo Kaeding ya Maloko Khuduthamaga e bidiwang gape Bukana ya Ditona..   Ditokafatso tse di dirilweng ka Moranang 2022 di tlamela ka mothamo o okeditsweng mo dikantorong tse dingwe tsa Ditona tse di nang le maikarabelo makala feta bongwe.
",0.76466864
"Pego ye akaretša le ditshwayotshwayo go tšwa dikgorong tša mmušo tša bosetšhaba le tša profense fana ka seemo sa bjale ka phethagatšo ya pholisi ye akaretšago diriparipana tša ditekanyetšokabo..   Pego ya mathomo ya seemo sa mošomo ya ngwaga ka ngwaga phatlaladitšwe ka.
","Di ne di tlhagisa gape gore Puso tshwanetse go rwala maikarabelo ka botlalo ditshenyegelo tse di jaaka tlamelo ya motlakase le metsi kwa mafelobonnong semmuso maloko khuduthamaga..   Kabinete etse tlhoko dingongorego tsa baagi mme sweditse go leba sešwa Kaedi ya Maloko Khuduthamaga.
",0.8341938
"Pego ye ya bohlano dumeletšwe go gatišwa kuranteng ya mmušo le go phatlalatšwa ke Kgoro ya Basadi, Baswa le Batho ba go Phela ka Bogole.
","Tiragalo e tla dirwa ke setheo se se ikemetseng mme fa sena go konosediwa, kaedi e tla phasaladiwa mo webosaeteng ya Lefapha la Bodiredipuso le Botsamaisi: www.dpsa.gov.za..  Semphato sa Phetogo e Lolameng sa Maatla (JETP) le Leano la JETP (JEPT-IP).
",0.6978796
"Phetošo ya Athikele ya 20(1) ya Kopano ya Phedišo ya Mehuta ka Moka ya Kgethollo Kgahlanong le Basadi (CEDAW).
","Morago ga go amogela tlhagisetso ya JEPT le JETP-IP, Kabinete ne ya mametlelela JETP-IP le go supa ditebogo ka tiro e botlalo e dirilweng go tlhagisa..   JETP-IP tlhalosa dipeeletso tse di tlhokegang go fitlhelela boineelo ba Puso ya Aforika Borwa ba go fedisa khabone le go tsweletsa kgolo e tswelelang, le go netefatsa phetogo e lolameng go badiri le mafelo a amegang..   Komiti ya Ditona ya Phetogo ya Tlelaemete tla tshwara kopano ya bobegakgang mo nakong e sa fediseng pelo go neela ka dintlha ka botlalo   Melaotlhomo.
",0.62356293
"Kabinete dumeletše tlhagišo Palamenteng ya Phetošo ya Athikele 20(1) ya CEDAW gore dumelelwe.
","Molaotlhomo wa Thomelo ya Dithoto ka Dikepe wa.
",0.51772654
"Diphetošo tše di fana ka nako ye teletšana ya dikopano tša komiti tša go lebelela dipego tša mebušo ye lego maloko.
","Kabinete amogetse go romelwa ga Molaotlhomo wa Thomelo ya Dithoto ka Dikepe wa 2022 kwa Palamenteng go diragadiwa.
",0.66621137
"Afrika Borwa saenetše kwano ye ka 1993 le go dumelela moragonyana ga fao ka Manthole.
","Molaotlhomo o tlhabolola Molao wa Thomelo ya Dithoto ka Dikepe, 1957 (Molao 57 wa 1951) o setseng le dingwaga di le.
",0.6425179
"Tlhagišo ye Palamenteng šetšane le go tsamaiša ka mošito tee kwano ye dumeletšwego kua morago gotee le phetošo ya Athikele 20(1) ya kwano ye.
",".
",0.17407325
"Kwano ya Lefase ka Bophara ka Kamogelo ya Mangwalo Thuto Mabapi le Thuto ya Godingwana.
","Fa sena go amogelwa jaaka molao, Molaotlhomo o tla tlamela ka letlhomeso la semolao go laola tsamaiso ya boleng ya dikepe.
",0.6908833
"Kabinete dumeletše tlhagišo Palamenteng ya Kwano ya Lefase ka Bophara ka Kamogelo ya Mangwalo Thuto mabapi le Thuto ya Godingwana gore dumelelwe.
","Gareng ga tse dingwe tla laola popego, kwadiso, maina le go fedisiwa ga dikepe..   Diphetogo tse di tla nna le seabe mo go tsosoloseng lekala la tsamaiso ya dithoto ka dikepe gammogo le go nyalanya naga le Tumelano ya Mokgatlo wa Boditšhaba wa Pharakano ya Dikepe.
",0.68814695
"Ge šetše dumeletšwe tla romelwa Mokgatlong wa Ditšhabakopano (UN) wa Thuto, Saenthefiki le tša Setšo le go kgontšhwa go šoma ka mo nageng ka Molao wa Bosetšhaba wa Tlhako ya Mangwalo Thuto, 2008 (Molao 67 wa 2008).
","Aforika Borwa mametleletse tumelano     .
",0.40492746
"Kwano ye ya Lefase ka Bophara hloma metheo ya motlalanaga ya temogo ya go se tšee lehlakore le ya go se kgetholle ya mangwalo thuto ya godingwana le mangwalo thuto ka kakaretšo dumelela temogo ya mangwalo thuto dinagašele mo mebušo ye 193 ye lego maloko UN.
","Molaotlhomo wa Tokafatso ya Dipalopalo wa.
",0.39926192
"Kgogelomorago ya Diphetošo tša Tlhahli ya Maloko Komitiphethiši.
","Kabinete amogetse go romelwa kwa Palamenteng ga Molaotlhomo wa Tokafatso ya Dipalopalo wa 2022 gore tswelediwe.
",0.66193336
"Kabinete dumeletše kwalakwatšo ye kwalakwaditšwego ke Kantoro ya Mopresidente ka Mošupologo, 17 Diphalane 2022 go gogelamorago diphetošo tšeo di dirilwego go Tlhahli ya Maloko Komitiphethiši, yeo bitšwago Pukukgakollo ya Ditona, ya..   Diphetošo tše di dirilwego ka Moranang 2022 di fane ka thekgo ya tlaleletšo go tše dingwe tša dikantoro tša Ditona tšeo di rwelego maikarabelo lefapha la go feta le tee.
","Molaotlhomo o tshitshinya tokafatso ya Molao wa Ditlhopho, 1999 (Molao 6 wa 1999).
",0.56821656
"Diphetošo tše di be di nyaka gore Mmušo rwale maikarabelo ka botlalo disenyegelo tša go amana le kabo ya mohlagase le meetse madulong semmušo go dulwa ke maloko komitiphethiši..   Kabinete lemogile dipelaelo tšeo di hlagišitšwego ke maloko setšhaba ebile tšeere sephetho sa go sekaseka Tlhahli ya Maloko Komitiphethiši.
","Diphetogo di tlamela ka tlhabololo le tsenyotirisong ya Tsamaiso ya Bosetšhaba ya Dipalopalo e tshegetsang ditshwetso tse di tshegediwang ke bopaki..   Di matlafatsa kgolagano magareng ga Setheo sa Dipalopalo sa Aforika Borwa le ditheo tse dingwe tsa puso, le go atolosa letlhomeso la taolo la Molao D.  Ditiragalo tse di Tlang.
",0.82593226
"Tshepedišo ye šogašogwa ke setheo sa go se tšee lehlakore ebile ge fihlile mafelelong, tlhahli ye tlo phatlalatšwa setšhabeng ka wepsaete ye ya Kgoro ya Ditirelo tša Mmušo le Tsamaišo: www.dpsa.gov.za.
","Samiti ya Moporesitente ya Dikgwebopotlana, tse Dinnye le tse di Magareng (SMME) le Dikoporasi.
",0.61464393
"Kgwerano Diphetogong tša Enetši tša go se Tšee Lehlakore (JETP) le Leano la Dipeeletšo la JETP (JETP-IP).
","Lefapha la Tlhabololo ya Dikgwebopotlana, ka tirisano le bannaleseabe ba lekala la poraefete, le tla tshwara Samiti ya SMME le Dikoporasi ya Moporesitente ya Bosetšhaba kwa Bryanston, Gauteng ka 13 go fitlha ka 15 Ngwanatsele..   Samiti e tla kopanya bannaleseabe ba botlhokwa ba lekala la poraefete le la puso mo tikologong ya dikgwebopotlana go rerisana ka go senka ditsela tsa go dirisana mmogo go matlafatsa lekala le.
",0.7327155
"Ka morago ga go amogela tlhagišo ka JETP le JETP-IP, Kabinete thekgile ka atla pedi ETP-IP le go laetša ka fao kgotsofetšego ka gona ka mošomo wa go tsenelela wo dirilwego go kaonafatša..   JETP-IP hlatholla dipeeletšo tšeo di nyakegago go fihlelela maikgafo go fediša khabone ao dirilwego ke Mmušo wa Afrika Borwa mola ka go le lengwe go hlohleletšwa tlhabollo ya go swarelela nako ye teletšana, le go netefatša gore go fihlelelwa diphetogo tša go se tšee lehlakore go bašomedi bao ba amegago le setšhaba..   Komiti ya Magareng ga Ditona ka Phetogo ya Klaemete tlare go se goye kae ya swara tshedimošetšo le babegaditaba go fana ka tshedimošo ka botlalo   Melaokakanywa.
","Bannaleseabe ba ba solofelwang ba akaretsa mekgatlo ya kgwebo, badiri ba diSMME, dirutegi, badiri ba dipholisi le ditheo tsa tlhabololo ya matlole..     Samiti tla rerisana gape le ka ga Leanolegolo le le Momaganeng la Bosetšhaba la Tlhabololo ya Dikgwebopotlana, le le tlamelang ka letlhomeso le le botlhokwa go matlafatsa lekala la SMME.
",0.81707585
"Molaokakanywa wa 2022 wa Dinamelwakepe tša Bagwebi.
","Samiti e solofelwa gape go thankgolola Dikabo tsa Bosetšhaba tsa SMME tsa Moporesitente tsa Ngwaga le Ngwaga..     Go Tshwarwa ga Samiti ya Moporesitente ya 2022 ya Tirisodikgoka e Ikaegileng ka Bong le Polao ya Basadi (GBVF).
",0.6697342
"Kabinete dumeletše tlhagišo Palamenteng ya Molaokakanywa wa 2022 wa Dinamelwakepe tša Bagwebi gore lebelelwe goya pele.
","Moporesitente Ramaphosa tla tshwara Samiti ya bobedi ya Moporesitente ya GBVF kwa Gallagher Convention Centre mo Gauteng ka 1 le 2 Ngwanatsele.
",0.6894987
