src_text,tgt_text,cosine_score
"Malawulelo ya timhangu endzhaku ka mikhukhulo.
","Ulawulo lweentlekele emva kwezikhukhula.
",0.9394642
"Khabinete yi hundzise michavelelo eka vanhu hinkwavo lava va lahlekeriweke hi varhandziwa va vona eka mikhukhulo yo onhetela leya ha ku vaka kona leyi yi hlaseleke swiphemu swo tala swa tiko ra ka hina, ngopfungopfu KwaZulu-Natal..     Xitiviso xa Xiyimo xa Rixaka xa Mhangu na miphalalo ya vanhu na ikhonomi leya ha ku tivisiwaka hi Phuresidente Cyril Ramaphosa, sa yi lava ku tiyisisa leswaku ku va na angulo lowu tirhaka kahle na ku va lowu hlanganisiweke eka swiyenge hinkwaswo swa mfumo, hi ku tirhisa Senthara ya Malawulelo ya Timhangu ya Rixaka..     R1 ya biliyoni leyi endliweke yi kumeka hi mfumo  yi le ku tirhisiweke ku seketela mphalalo na matshalatshala yo hlakarhela, ku vuyisela vukorhokeri bya masungulo na ku nyika mpfuneto wa nhlayiseko wa vanhu hi xivumbeko xa swakudya, mati, vutumbelo, nkululo na swiambalo..     Phurosese ya ku aka hi vuntshwa tindhawu leti hlaseriweke se yi sungurile tanihiloko vanhu va tiko ra ka hina va ri karhi va vumba vun'we ku pfuneta lava va lahlekeriweke hi makaya ya vona na nhundzu ya vona.
","IKhabhinethi ithi mabalale ngenxeba bonke abantu abaswelekelwe zizihlobo zabo kwezi zikhukhula zakutsha nje zenze umonakalo omkhulu bezithwaxe iindawo ezithile kweli lizwe lethu, ingakumbi kwiphondo laKwaZulu-Natal.
",0.8342277
"Vuxokoxoko byintshwa hi mayelana na Vuvabyi bya Khoronavhayirasi (COVID-19).
","Ukubhengezwa kweMeko yeNtlekele kwiZwelonke kunye namanyathelo oncedo kwezentlalo nakwezoqoqosho abhengezwe nguMongameli Cyril Ramaphosa, kuneenjongo zokuqinisekisa ukuba kukho intsebenziswano emandla nebambeneyo kuwo onke amaqoqo karhulumente, ngokusebenzisa iZiko leSizwe loLawulo lweeNtlekele.
",0.6218934
"Khabinete yi lemuke hi ku vilerisiwa hi ntlakuko lowa ha ku vaka kona eka mitluletavuvabyi ya COVID-19 eka swiphemu swin'wana swa tiko naswona yi hlohlotele vanhu ku teka magoza yo sirhelela ku tisirhelela ehenhla ka xitsongwatsongwana lexo dlaya, ngopfungopfu hi vuxika.
","Le mali iyibhiliyoni yeerandi ikhutshwe ngurhulumente iza kusetyenziselwa ukuncedisa kumaphulo oncedo nawohlangulo, ukubuyisela iinkonzo ezisisiseko kunye nokunikezela uncedo olunxulumene nentlalontle yabantu olufana nokutya, amanzi, iindawo zokufihla intloko, ugutyulo kunye neempahla zokunxiba.
",0.7193106
"Xitsongwatsongwana lexi xa ha ri nxungeto lowu nga cincacinciki naswona nsawutiso wu tshama wa ha ri xitlhavana lexo tirha kahle swinene ku tisirhelela.
","Inkqubo yokwakha kwakhona iindawo ebezichaphazelekile sele iqalile njengoko abantu belizwe lakuthi bathe bafunquka ngobuninzi babo bafaka isandla kwabo amakhaya abo adilizwe zizikhukhula baze futhi balahlekelwa nazizinto zabo.
",0.71630025
"Khabinete yi tsakisiwa hi leswaku vanhu vo tala va ya emahlweni va hlawula nsawutiso tanihi ntila wa vona wo sungula wa vusirheleri ehenhla ka COVID-19 endzhaku ka tinhlayonhlayo leta ha ku vaka kona leti kombeke leswaku hi fikelerile ndzimakulu ya kutlula wa tiphesente ta misawutiso ya vanhu lavakulu eka ntlhanu wa swifundzakulu.
","Ezakutsha malunga nesiFo seNtsholongwana ye-Corona (i-COVID-19).
",0.7147522
".
","IKhabhinethi ixhalatyisiwe kukunyuka kwenani labantu abosulelwe yi-COVID-19 kutsha nje kwiindawo ezithile kweli lizwe kwaye ibongoza bonke abantu ukuba bathathe amanyathelo okuzikhusela kule ntsholongwana ingubhubhane, ingakumbi ngeli xesha lasebusika.
",0.48983157
"Khabinete yi kombela lava va nga si sawutisiwaka ku endla tano ku tisirhelela vona na varhandziwa va vona.
","Le ntsholongwane iseyingxaki kuthi sonke kwaye inye indlela yokuyilwa nokuzikhusela kuyo, kukugonya.
",0.73926884
"Hi fanele ku tlhela hinkwerhu hi ya emahlweni hi landzelela milawu yo sivela ya COVID-19, ku katsa na ku ambala masiki leyi yi funengetaka havumbirhi bya nhompfu na nomu, ku hlamba swandla hi mati na xisibi, kumbe ku tirhisa sanithayizara ya swandla leyi nga na xihoko xa 70%, ku hlayisa mpfhuka exikarhi ka vanhu lowu hlayisekeke wa mpimohansi wa mitara yin'we..     Malimpfuneto ya Mphalalo wa Vanhu wa Ntshikelelo (SRD) .
","IKhabhinethi ichulumancile kukubona abantu abaninzi beqhubeleka besebenzisa amachiza okugonya njengezona zixhobo zokuzikhusela kwi-COVID-19 njengoko iingxelo zakutsha nje zichaza ukuba kumaphondo amahlanu ngabantu abadala abangaphezulu kwe-50% asele begonyiwe.
",0.77932096
"Khabinete yi khutaze vaakatiko lava kumaka Malimpfuneto ya SRD ya R350 SRD ku endla swikombelo hi vuntshwa, endzhaku ka ku tivisiwa ka yswinawana swintshwa leswi fumaka swikombelo na mfikeleleko wa malimpfuneto leyi.
","IKhabhinethi icela abo bangekagonyi ukuba baye kugonya ukuze bakhusele bona kunye nezihlobo zabo.
",0.7530613
"Swikombelo swi nga nghenisiwa eka webusayiti ya Ejensi ya Nsirhelelo wa vanhu ya Afrika-Dzonga (SASSA): https://srd.sassa.gov.za/.
","Kufuneka futhi siqhubeleke nokuthobela imiqathango yokuthintela i-COVID-19, equka ukunxiba isifonyo esigquma impumlo nomlomo, ukuhlamba izandla ngamanzi anesepha okanye ukusebenzisa isibulala-ntsholongwane esine-alkhoholi eyi-70%, kunye nokuqinisekisa ukuba kukho umgama oyimitha enye phakathi kwethu.
",0.64503914
"Sisiteme ya swikombelo yi pfurile hi siku ra 23 Dzivamisoko 2022 naswona phurosese ya xidijitali hi vutalo ku kotisa ku hleriwa ko hatlisa ka swikombelo..     Malimpfuneto ya mphalalo ritavala ra vuhlayiseki ra nkoka eka mindyangu leyi dinga leyi nkarhi wun’wana ti va yi onheteriwile hi mpingu wa vusweti na mpfumaleko wa mitirho.
","IsiBonelelo sezeNtlalo soNcedo (i-SRD).
",0.51952624
"Mfumo wa tiboha ku nyika mpfuneto wa vanhu eka lava nga sirhelelekangi ngopfu ku endlela leswaku va kota ku fikelela swidingo swa vona swa masungulo.
","IKhabhinethi ikhuthaza abemi beli abafumana isiBonelelo se-SRD esiyi-R350 ukuba baphinde bafake izicelo kwakhona kulandela ukuqaliswa kwemigaqo emitsha eza kulandelwa xa kuphicothwa izicelo kujongwa ukuba umntu ufanelekile na ukuba afumane esi sibonelelo.
",0.7777596
"Nhlayiseko na nsirhelelo.
","Izicelo kufuneka zifakwe kwiwebhusayithi ye-Arhente yoMzantsi Afrika yeziBonelelo zeNtlalo (i-SASSA) ethi: https://srd.sassa.gov.za/.
",0.21973006
"Khabinete yi ya emahlweni yi sola ku dlayiwa ko pfumala xivangelo ka vavasati naswona yi amukerile angulo wa xihatla hi vaofisiri va nsindziso wa nawu eka ku khomiwa ka vaehleketeleriwa hi mayelana na rifu ra Mnn Hillary Gardee (28), wa le Kamagugu eMpumalanga.
","Inkqubo yokungenisa izicelo yavulwa ngomhla wama-23 kuTshazimpunzi 2022 kwaye yonke iqhutywa ngobuxhaka-xhaka be-intanethi into leyo iza kwenza ukuba ikhawuleze..     Isibonelelo soncedo sibalulekile ukunceda amakhaya angathathi ntweni engethwaxwa kanobom yindlala nentswela-msebenzi ukuba besingekho.
",0.71497905
"Khabinete yi ye emahlweni yi sola ku dlayiwa ka tsevu wa vanhu eKhayelitsha, Kapa.
","Urhulumente uzimisele ukunikezela ngezibonelelo kubantu abangathathi ntweni ukuba bakwazi ukufumana izinto ezisisiseko zokuziphilisa..     Ukhuselo nokhuseleko.
",0.7229627
"Ku dlaya loku ko pfumala xivangelo xitsundzuxo xa leswaku hi boheka ku endla swo tala tanihi rixaka ku herisa madzolonga na madzolonga yo ya hi rimbewu na ku dlayeteriwa ka vaxisati (GBVF)..     Khabinete yi hlohlotele vanhu hinkwavo etikweni ku tirha na mfumo eka lwisana na vugevenga na GBVF.
","IKhabhinethi iyaqhubeleka nokugxeka kabukhali umkhuba wokubulawa kwamabhinqa ngolunya kwaye iyawubulela umsebenzi owenziwe ngamagosa olwaphulo-mthetho athe abamba ngokukhawuleza abarhanelwa abakrokrelwa ngokubulala uNksz Hillary Gardee (obeneminyaka engama-28 ubudala), waKamagugu eMpumalanga.
",0.782696
"Hi ri swin’we hi nga tiyisisa leswaku miganga ya ka hina na switarata swa ka hina swi hlayisekile eka vanhu hinkwavo, ku katsa na vadyuhari, vavasati na vana..     Ikhonomi.
","IKhabhinethi iyakugxeka kunye nokubulawa kwabantu abathandathu eKhayelitsha.
",0.6366323
"Khabinete yi amukele ku pfuriwa ka ximfumo ka feme yo endla switina ya Kwastina ya Corobrik eDriefontein eGauteng hi Phuresidente Ramaphosa hi Ravunharhu, 4 Mudyaxihi.
","Lo mkhuba wokubulawa kwabantu ngolunya usikhumbuza ukuba kusekuninzi ekufuneka sikwenzile sisisizwe ukulwa ubundlobongela ngokubanzi kunye nobo busekelwe kwisini kunye nokubulawa kwamanina (i-GBVF).
",0.70027053
"Feme leya ximanguvalawa yi vumba xiphemu xa vuvekisi bya R800 wa timiliyoni, leswi swi fambisanaka na R200 ya timiliyoni to yisa emahlweni leti vekeriweke ku ndlandlamukisa mitirho ya khonkhele ya Corobrik eKwaZulu-Natal.
","IKhabhinethi ibongoza bonke abantu elizweni ukuba basebenzisane norhulumente kwidabi lokulwa ulwaphulo-mthetho ne-GBVF.
",0.7162821
"Corobrik hi rin’wana ra mabindzu ya laha tikweni yo hlayanyana lama ma anguleke eka xikombelo xa Phuresidente Ramaphosa hi mayelana na mabindzu ya le Afrika-Dzonga na ya le matikweni ya misava ku vekisa eka ikhonomi leyi.
","Xa sibambisene singaqinisekisa ukuba bakhuselekile abantu kunye neendawo abahlala kuzo, abo bantu baquka abantu abadala, amanina kunye nabantwana..     Ezoqoqosho.
",0.7155796
"Khabinete yi lemuke leswaku ikhonomi hayidirojeni leya ha riki dyebyana yi nyikiwile matimba hi ku simekiwa ka tiraka leyi tirhisaka matimba ya hayidirojeni hi Anglo American.
","IKhabhinethi ikwamkele ukuvulwa ngokusesikweni komzi-mveliso wokwenza izitena wakwa-Kwastina Corobrik ose-Driefontein e-Gauteng nguMongameli Ramaphosa ngoLwesithathu, umhla wesi-4 kuCanzibe.
",0.7892785
"Tiraka leyi – leyi yi hundzuluxiweke kusuka eka dizele kuya eka hayidirojeni, naswona yi tirhisaka hi xiphemu tibateri ta lithium-ion – yo sungula emisaveni hinkwayo.
","Lo mzi-mveliso wale mihla uyinxalenye yotyalo-mali oluxabisa izigidi zeerandi ezingama-800, oluhambisana nolunye lwezigidi zeerandi ezingama-200 ezibekelwe ukwandisa umzi-mveliso wakwa-Corobrik oKwaZulu-Natal.
",0.781631
"Ikhonomi ya hayidirojeni yi kumekile tanihi xirhangana xa xiqhinga xa ikhonomi ya rihlaza ya tiko ra ka hina, na ku lawula ku kula ka ikhonomi na mitirho..     Khabinete yi tlhele yi amukela vuvekisi byo yisa emahlweni eka ikhonomi ya hina hi khamphani ya swakudya ya le Ireland, Kerry Group, leyi yi pfuleke pulanti ya R650 wa timiliyoni yintshwa eHammarsdale, KwaZulu-Natal leyi kongomisiweke eka ku humesa swakudya leswi yisekaka emahlweni swa tikokulu.
","U-Corobrik yenye yeenkampani eziliqela zeli ezithe zasabela ikhwelo elahlatywa nguMongameli Ramaphosa kwinkampani zoMzantsi Afrika nezehlabathi ukuba zityale imali kuqoqosho lweli lizwe..     IKhabhinethi ithethile nangomba wecandelo lehaydrojini elikhulayo elithe lahlutshezwa nayiloli ehamba ngehaydrojini yakwa-Anglo American.
",0.8696673
"Pulanti leyi yi fana yi ri yoxe tanihileswi yi nga na swihlawulekisi swa vuyisekamahlweni swo tala ku katsa na switirhisiwa swo tirhisa eneji ya le hansi, vuendli bya gezi ya dyambu ku hunguta ku tirhisiwa ka giridi ya laha tikweni, ku khomiwa ka rihiso ra thyaka, na ku khomiwa ka mati loku tirhaka kahle, ku tirhisiwa hi vuntshwa na hunguto.
","Le loli – ebikade ihamba ngedizili yaza yatshintshwa yayesebenzisa ihaydrojini futhi isebenzisa neebhetri ze-lithium-ion – yeyokuqala elolu hlobo ehlabathini.
",0.78757864
"Kerry Group yi vile kona eAfrika-Dzonga kusukela hi 2011, naswona vuvekisi bya yona byo yisa emahlweni mfungho wa leswaku Afrika-Dzonga yi tshama ya ha ri ndhawu ya vuvekisi leyi nga yi hlawulaka.
","Icandelo lehaydrojini lityuntywe njengalamanye abalulekileyo ekufuneka akhokeliswe phambili kuqoqosho lweli olungenabungozi kokusingqongileyo, kunye nokukhokela kumaphulo okukhulisa uqoqosho nawokudala imisebenzi..     IKhabhinethi iphinde yalubulela notyalo-mali olwenziwe yinkampani yase-Ireland, i-Kerry Group, evule umzi-mveliso oxabisa imali ezizigidi zeerandi ezingama-650 e-Hammersdale, kwiphondo laKwaZulu-Natal, inkampani leyo iza kuvelisela eli lizwekazi ukutya ngendlela engazikwenza monakalo kokusingqongileyo.
",0.74234116
"Vuvekisi lebyi byi landzela eka mikondzo ya ku simekiwa ka xibebe xa Isuzu D-Max lexi makiwaka laha tikweni eGqeberha eKapa-Vupeladyambu n’hweti leyi nga hundza.
","Lo mzi-mveliso ufana wodwa kuba usebenzisa iintlobo zobuxhaka-xhaka obungenzi monakalo kokusingqongileyo obuquka izixhobo ezingatyi mbane kakhulu, ukuvelisa umbane ngemitha yelanga ukuze ungatyi kakhulu umbane oveliswa liziko lombane leli, ukuvelisa amandla okuzifudumeza kusetyenziswa inkunkuma, ukuqokelelwa, ukusetyenziswa kwakhona kunye nokuphungulwa kwamanzi asetyenziswayo ngendlela ehlakaniphileyo.
",0.71097773
"D-MAX ya rixaka lerintshwa yi tatisa vutiboheleri bya Isuzu eAfrika-Dzonga naswona hi yin’wana ya Nongonoko wa Nhluvukiso wa Vuhumesi bya Mimovha (APDP).
","Le nkampani yakwa-Kerry Group yaqala ukusebenza eMzantsi Afrika ngowama-2011, futhi ukutyala kwayo enye imali kubonakalisa ukuba uMzantsi Afrika lilizwe elithandwayo ngabatyali-mali.
",0.78812516
"APDP xikimi xa nhlohlotelo wa vuhumesi wa indasitiri ya mimovha lexi nga na xikongomelo xa tlakusa tivholomu ta vuhumesi eka indasitiri ya swipandzamananga leyi vuriweke, ku tlakusa nkoka lowu engeteriweke eka indasitiri ya tiphatsi ta mimovha hikwalaho ka sweswo ku tumbuluxiwa mitirho eka nkhulukelano wa migingiriko hinkwawo.
","La maphulo otyalo-mali alandela kanye emva kokuba kuveliswe i-bakkie eluhlobo lwe-Isuzu D-Max eGqebera eMpuma Koloni kule nyanga iphelileyo.
",0.7264309
"Kwalomu ka R2,8 wa tibiliyoni ti ta endliwa eka nkoka wa vuhumesi bya swilo swa laha tikweni hi ku tirhisa ndzhendzeleko wa vutomi bya APDP.
","Olu hlobo lutsha lwebakkie luyi-D-MAX lubonisa phandle ukuba abakwa-Isuzu bazimisele ukuzinza eMzantsi Afrika kwaye luyeminye yemisebenzi emihle ezelwe yiNkqubo yokuPhuhlisa iMizi-mveliso yeziThuthi (i-APDP).
",0.731859
"Vuvekisi lebyi byi ta endla kutlula 1 000 ra mitirho yo kongoma eka pulanti leyi naswona yi ta thola hi ku nga kongomi 24 000 ya vanhu, yi ri karhi yi hoxa xandla hi ndlela yo tivikana eka ku antswisiwa ka miganga eka xifundza lexi..     Khomferense ya Vucelamigodi.
","I-APDP sisibonelelo secandelo lezithuthi esenzelwe ukunyusa umthamo wezithuthi eziveliswayo , into leyo eza kukhwezela necandelo leentsimbi zeemoto ngolo hlobo kudaleke imisebenzi kuwo onke amashishini achaphazelekayo kwicandelo lezithuthi.
",0.79742664
"Khomferense ya ku Vekisa eka Vucelamigodi bya Afrika ya 2022leyi khomeriweke eCape Town International Convention Centre kusuka 9 kufika 12 Mudyaxihi 2022, hi yin’wana ya tipulatifomo letikulukumba eka hinkwato ta mbulavurisano na ntirhisano exikarhi vakhomaxiavek hinkwavo eka indasitiri ya vucelamigodi.
","Imali eqikelelwa kwiibhiliyoni zeerandi eziyi-2,8 iza kwenziwa kumashishini avelisa iintsimbi zeemoto alapha ekhaya ngoku isaqhubeka ukusebenza i-APDP.
",0.7118837
"Nkongomelo wa xiendleko lexi ku ri: “Ku Cinca ka Vucelamigodi bya Afrika: Ku Vekisa eka Ncinco wa Eneji, ESG, na Tiikhonomi”.
","Olu tyalo-mali luza kudala imisebenzi engaphezulu kwe-1 000 eza kuvela ngqo kulo mzi-mveliso luze ludale neminye engama-24 000 kwamanye amacandelo asebenzisana neli, into leyo iza kuphelisa intsokolo kubantu balo mmandla.
",0.6665921
"Khabinete ya tshemba leswaku Khomferense leya Vucelamgodi yi ta pfuna eka ku kombisa na ku tlakusa Afrika-Dzonga tanihi ndhawu ya vuvekisi leyi ua nga yi hlawulaka.
",".
",0.4032662
"Afrika-Dzonga yi amukela vuvekisi etikweni ra ka hina naswona ya tiboha ku tumbuluxa swiyimo swa rhandzeka swa ku kula ko katsa hinkwavo na ncinco eka ikhonomi.
","Ingqungquthela yezeMigodi.
",0.39155176
"Vuxaka bya matiko ya misava na swifundza.
","INgqungquthela yokuTyala iMali kwezeMigodi e-Afrika yowama-2022 ibibanjelwe kwiZiko laseKapa leNgqungquthela zeHlabathi ukususela ngomhla wesi-9 ukuya kowe-12 kuCanzibe 2022, yenye yeendibano ezinkulu yokudibana nokusebenzisana phakathi kwawo onke amahlakani akwicandelo lemigodi.
",0.36552215
"Khabinete yi tlhele yi amukela miangulano leya ha ku vaka kona ya Phuresidente Ramaphosa na Phuresidente Joe Biden wa United States, Phuresidente Emmanuel Macron wa Furwa na Phuresidente Hakainde Hichilema wa Zambia eka tipulatifomo to hambana.
","Umxholo wale ngqungquthela ubusithi: “Ukutshintsha kweMigodi e-Afrika: Ukutyala imali kwiMithombo eMitsha yaMandla, i-ESG kunye noQoqosho”.
",0.72071576
"Mivulavurisano leyi yi pfumelele Phuresidente ku tisa vuxaka bya matiko lamambirhi na ntirhisio exikarhi ka Afrika-Dzonga na mifumo ya vatirhisani hi mayelana na swiphiqokulu swa swifundza na matiko ya misava, ku katsa na ku kuma xitshunxo xa ku rhula xa ntlimbo eUkraine     Swiboho swa Khabinete.
","IKhabhinethi iqinisekile ukuba le Ngqungquthela yezeMigodi iza kubonisa futhi ithengise noMzantsi Afrika njengelizwe eliphambili elinamathuba otyalo-mali.
",0.7386932
"Tivhoti ta Mpimanyeto.
","UMzantsi Afrika uyawamkela amaphulo otyalo-mali eza kweli kwaye uyathembisa ukuba uza kudala iimeko ezifanelekileyo eziza kukhuthaza uhlumo oluza kuxhanyulwa ngumntu wonke kunye neenguqu kuqoqosho lweli lizwe..     Ubudlelwane namazwe ehlabathi nawengingqi.
",0.3558545
"Khabinete yi kombela vaakatiko hinkwavo ku landzelela Tivhoti ta Mpimanyeto hi tindzawulo ta mfumo wa rixaka na Hofisi ya Phuresidente ku endlela leswaku va kota ku endla mfumo wu tihlamulela..     Hi nkarhi wa Tivhoti ta Mpimanyeto, tindzawulo hinkwato ti nyika nhlamuselo leyi koxometiweke ya makungu ya tona na swirhangana swa lembe.
","IKhabhinethi iyalwamkela uqhakamshelwano uMongameli Ramaphosa abenalo noMongameli Joe Biden wase-United States, uMongameli Emmanuel Macron wase-France kunye noMongameli Hakainde Hichilema wase-Zambia esebenzisa amaqonga awahlukeneyo.
",0.76706874
"Tivhoti ta Mpimanyeto ti lava ku tiyisisa leswaku timali ta mfumo ti tirhisiwa hindlela leyi nga ti tlangisiki eka ku fikelela swidingo swa vaaki..     Ti tlhela ti nyika pulatifomo yo hetiseka eka Vaholobye ku ntlhantlha ku yisa emahlweni ntirho wa mfumo, ku katsa na ku humelela na mitlhontlho..     Qhinga ra Vuhangalasi bya Gasi ya Oyilimbisi leyi Endliweke Xihalaki (LPG).
","Olu qhakamshelwano lunike uMongameli ithuba lokuqinisa ubudlelwane nentsebenziswano phakathi koMzantsi Afrika nala mazwe angamahlakani wawo kwimiba engundoqo etya le ngingqi nehlabathi, equka ukusombulula ungquzulwano oluse-Ukraine     Izigqibo zeKhabhinethi.
",0.7912227
"Khabinete yi pasise Qhinga ra Vuhangalasi bya LPG leswaku ri simekiwa, leri ri kandziyisiweke leswaku vaaki va nyika mavonelo hi Nyenyankulu.
","IiVoti zoHlahlo Lwabiwo-mali.
",0.5613415
"Qhinga leri ri ndlandlamukisa indasitiri ya LPG etikweni.
","IKhabhinethi ihlaba ikhwelo kubo bonke abemi beli ukuba bamamele iintetho zeVoti zoHlahlo Lwabiwo-mali lwamasebe esizwe karhulumente kunye nolwe-Ofisi kaMongameli ukuze bakwazi ukuqinisekisa ukuba urhulumente bambeke phantsi kweliso ngenene..     Ngethuba kuqhutywa ezi ntetho zoHlahlo Lwabiwo-mali, onke amasebe aza kunika iinkcukacha ezigcweleyo ngezicwangciso zawo kunye nezinto aza kuzikhokelisa phambili kulo nyaka.
",0.5973221
"LPG yi ta hoxa xandla hi ndlela ya nkoka eka ku hambanisiwa ka swihlovo swa eneji..     Qhinga leri, exikarhi ka miphalalo yin’wana, ri lawula mavekelo ya mixavo eka nkhulukelano wa migingiriko na nseketelo wa vumaki bya tisilindara ta LPG etikweni.
","IiNtetho zoHlahlo Lwabiwo-mali zenzelwe ukuqinisekisa ukuba imali yombuso isetyenziswa ngobunono kwizinto ezifunwa luluntu.
",0.7630148
"Ri ta tlhela ri dyondzisa vaaki hi mayelana na mivuyelo ya ku tirhisa LPG tanihi muxaka wun’wana wa eneji..     Ri ta fikeleriwa endzhakukaloko ri kandziyisiwile hi Ndzawulo ya Swipfuno swa Swicelwa na Eneji eka www.dmr.gov.za.
","Zikwanika ithuba nabaPhathiswa ukuba bacacise ngokupheleleyo umsebenzi karhulumente, kuquka izinto ezenziwe ngempumelelo kunye nezo ziseyimingeni.
",0.7553463
"Rimba ra Xiqhinga ra Rixaka hi mayelana na Mapfhumba ya ku Tlakusa Vulemukisi bya Timfanelo ta Vutsoniwa ya Vanhu lava nga na Vutsoniwa.
","IsiCwangciso-qhinga sokuZisa iRhasi Elulwelo (i-LPG).
",0.75448895
"Khabinete yi pasise Rimba ra Xiqhinga ra Rixaka hi mayelana na Mapfhumba ya ku Tlakusa Vulemukisi bya Timfanelo ta Vutsoniwa ya Vanhu lava nga na Vutsoniwa.
","IKhabhinethi ivumile ukuba siqalise ukusebenza isiCwangciso-qhinga sokuZisa i-LPG, esasipapashwe ngenyanga yoKwindla yowama-2022 ukuba uluntu luhlomle kuso.
",0.7604232
"Rimba leri ri lava ku letela havumbirhi bya tisekitara leti na riki ta mfumo na ta mfumo eka ku tiyisisa leswaku timfanelo ta vanhu lava nga na vutsoniwa ta sirheleriwa, tanihilaha ti hlayisiweke hakona eka Vumbiwa ra Rhiphabuliki ya Afrika-Dzonga ra.
","Esi sicwangciso-qhinga sineenjongo zokwandisa icandelo le-LPG kweli lizwe.
",0.7137971
".
","I-LPG iza kunceda kakhulu kwiphulo lokuqinisekisa ukuba sineentlobo ezahlukeneyo zamandla..     Esi sicwangciso-qhinga siza kubeka imithetho eza kulawula ukubekwa kwamaxabiso kumashishini akweli candelo size sixhase nokuveliswa kwamagadlela e-LPG kweli lizwe, phakathi kwezinye izinto.
",0.559195
"Rimba leri ri nyika khiti ya switirho leswi swi nga ta pfuneta eka ku susiwa ka swirhalanganyi swa xihlawuhlawu eka ku tekiwa ka swiboho, ngopfungopfu leswi swi fambelanaka na vanhu lava nga na vutsoniwa.
","Siza kufundisa noluntu malunga nezinto eziluncedo ngokusebenzisa i-LPG njengolunye uhlobo lwamandla.
",0.73916864
"Ri tlhela ri lemukisa vanhu lava nga na vutsoniwa ku tiva timfanelo ta vona tanihilaha ti sirheleriweke hakona hi Vumbiwa.
","Siza kufumaneka emva kokuba sipapashiwe liSebe leMithombo yeziMbiwa naMandla ku: www.dmr.gov.za.
",0.64384127
"Rimba leri ri tlhela ri nyika vuleteri, vuviki bya swihangalasamahungu na ku tlakusiwa ka vulemukisi erixakeni hi mayelana na timfanelo ta vanhu lava nga na vutsoniwa.
","IsiCwangciso-qhinga seSizwe esiQiqisisiweyo samaPhulo okuFundisa ngamaLungelo okuKhubazeka Abantu abaKhubazekileyo.
",0.7754369
"Ri humelerisa Phepha ra Swibumabumelo swa Mfumo hi mayelana na Timfanelo ta Vanhu lava nga na Vutsoniwa.
","IKhabhinethi isamkele isiCwangciso-qhinga seSizwe esiQiqisisiweyo samaPhulo okuFundisa ngamaLungelo okuKhubazeka Abantu abaKhubazekileyo.
",0.82346743
"Afrika-Dzonga musayini eka Ntwanano wa vun’we bya Tinxaka (UN) hi mayelana Timfanelo ta Vanhu lava nga na Vutsoniwa na Nawu ya UN eka Chatara ya Afrika hi mayelana na Timfanelo ta Ximunhu na Timfanelo ta Vanhu hi mayelana na Timfanelo ta Vanhu lava nga na Vutsoniwa (Nawu wa Timfanelo ta Vutsoniwa wa Afrika).
","Esi sicwangciso-qhinga sineenjongo zokusebenza njengesikhokelo sokunceda icandelo labucala kunye norhulumente ukuba aqinisekise ukuba akhuselekile amalungelo abantu abakhubazekileyo, njengoko noMgaqo-siseko weRiphabhlikhi yoMzantsi Afrika wowe-1996 usitsho.
",0.7400394
"Rimba leri ri kumile mavonelo eka vakhomaxiave lava faneleke hinkwavo, ku katsa na Khansele ya Nhluvukiso wa Ikhonomi na Vatirhi ya Rixaka.
","Esi scwangciso-qhinga sisixhobo esiza kunceda xa kuguzulwa imiqobo ecalulayo xa kuthathwa izigqibo, ingakumbi ngokumayelana nabantu abakhubazekileyo.
",0.69541913
"Mafambiselo ya Misava na Mfanelo ya ku Khoma Misava eka Tindhawunhlanganelo.
","Senzelwe kwanokufundisa abantu abakhubazekileyo ngamalungelo wabo akuMgaqo-siseko.
",0.6664164
"Khabinete yi pasise ku rhurheriwa ka Mafambiselo ya Misava na Mfanelo ya ku Khoma Misava eka Tindhawunhlanganelo hi Ravuntlhanu, 27 na Mudyaxihi, 28 Mudyaxihi 2022 eGauteng.
","Esi sicwangciso-qhinga sikwanceda nangoqeqesho, indlela amajelo eendaba anika iingxelo ngazo kunye nokufundisa uluntu ngamalungelo abantu abakhubazekileyo.
",0.6709213
"Khabinete yi amukele Phepha ra Xiyimo hi mayelana na Mafambiselo ya Misava na Mfanelo ya ku Khoma Misava eka Tindhawu ta Misava ya Nhlanganelo hi Nyenyankulu.
","Sikwazalisekisa izithembiso ezikwiPhepha eliCacisa uMgaqo-nkqubo wamaLungelo Abantu abaKhubazekileyo.
",0.695243
"Yi lerise leswaku mikanerisano yo yisa emahlweni yi endliwa na vakhomaxiave lava faneleke hinkwavo.
","UMzantsi Afrika lelinye lamazwe atyikitya isiVumelwano seZizwe eziManyeneyo (i-UN) samaLungelo Abantu Abakhubazekileyo kunye nesiVumelwano se-UN soXwebhu lwase-Afrika lwamaLungelo oLuntu nawaBantu abaKhubazekileyo (isiVumelwano samaLungelo Abantu abaKhubazekileyo e-Afrika).
",0.5769546
"Samiti leyi yi ta va mahetelelo ya ntirho lowu wu endliweke n’wexemu, lowu wu kombele mavonelo eka vakhomaxiave vo hambanahambana     Swiendleko leswi Taka.
","Onke amahlakani afanelekileyo ebelinikiwe ithuba lokuhlomla kwesi sicwangciso-qhinga, kuquka neBhunga leSizwe loPhuhliso lezoQoqosho nezaBasebenzi (i-Nedlac).
",0.6535296
"Khomferense ya Misava Hinkwayo ya vuntlhanu hi mayelana na ku Herisiwa ka Vatirhi lava ha riki Vana.
","INgqungquthela yoLawulo loMhlaba namaLungelo oMhlaba kwiiNdawo zoLuntu.
",0.7106219
"Afrika-Dzonga yi ta rhurhela Khomferense ya Misava Hinkwayo ya vuntlhanu hi mayelana na ku Herisiwa ka Vatirhi lava ha riki Vana Durban Internation Convention Centre KwaZulu-Natal kusuka hi Sonto, 15 kufika Ravuntlhanu, 20 Mudyaxihi rosungula Nhlangano wa Vatirhi wa Matiko ya Misava (ILO) wu rhurhela khomferense leyi eAfrika..     Varhangeri va tiko, 120 wa vaholobye, vaseketeri va mihlangano yinharhu ya 187 wa matiko lama nga swirho swa ILO, tiejensi ta UN, mihlangano ya dyondzo, mihlangano ya vaaki lava nga na ku tsakela kun’we, mihlangano leyi nga riki ya mfumo, swihangalasamahungu na vaaki lava nga na ku tsakela kun’we va languteriwa ku nghenela khomferense leyi.
","IKhabhinethi ivumile ukuba kubanjwe iNgqungquthela yoLawulo loMhlaba kunye namaLungelo oMhlaba kwiiNdawo zoLuntu ngoLwesihlanu, umhla wama-27 nangoMgqibelo, umhla wama-28 kuCanzibe 2022 e-Gauteng.
",0.78316426
"Xiendleko lexi xi ta tlhela xi pfumelela Afrika-Dzonga ku tisa emahlweni Vumbiwa ra tiko tanihileswi ri sirhelelaka timfanelo ta vana.
","IKhabhinethi ilamkele iPhepha elinoLuvo ngoLawulo loMhlaba kunye namaLungelo oMhlaba kwiiNdawo zoLuntu ngeyoKwindla.
",0.7241291
