src_text,tgt_text,cosine_score
"Ditaetši di dirilwe le bakgathatema ba maleba bao ba nago le kgahlego mo tlhabollong le matlafatšong ya bafsa ka mo nageng.
","Ku hlengeletiwa ka data ku ta hambanisiwa hi ku ya hi vukhale, rimbewu, vutsoniwa, ntlawahato ya rixakanghohe na matshamelo ya ndhawu ya miphalalo leyi.
",0.72250855
"Tshedimošo tla kgoboketšwa ka go aroganywa ka dikarolo go ya ka mengwaga, bong, bogolofadi, sehlopha sa merafe le tikologo ya thutafase ya ditsenogare tše.
",".
",0.53519094
"Dikgato tše tša go dira ditlhahlobo di tla dirwa ka mafelong ka moka mmušo, ka ditheong ka moka le lekaleng la praebete.
","Vulanguteri lebyi byi ta endliwa eka swiyenge swa mfumo hinkwaswo, mavandla na sekitara yo ka ya nga ri ya mfumo.
",0.91101545
"Dipego tša tšona di tla dirwa kotareng ye nngwe le ye nngwe gomme tša phatlalatšwa gabedi ka ngwaga.
","Swiviko leswi swi ta humesiwa kotara na kotara na ku kandziyisiwa kambirhi hi lembe.
",0.8664005
"Tlhako ya Pholisi ya Peakanyo ye Kopantšwego.
","Rimba ra Pholisi ra Nkunguhato lowu Hlanganisiweke.
",0.88199335
"Kabinete dumeletše Tlhako ya Pholisi ya Peakanyo ye Kopantšwego ya mmušo, yeo nyakago go šogana le mafokodi peakanyo ya pholisi ao utollotšwego mo lenaneong la peakanyo la gonabjale.
","Khabinete yi pasisile Rimba ra Pholisi ra Nkunguhato lowu Hlanganisiweke eka mfumo, leri ri lavaka ku ololoxa mavangwa  ya nkunguhato wa pholisi lama kumekeke eka sisiteme ya nkunguhato ya nkarhi sweswi.
",0.9256189
"Ditsenogare tšeo di šišintšwego di tla re gare ga tše dingwe tša šogana le tlhokego ya tlhopo ya peakanyo mo dikarolong tše tharo tša mmušo.
","Miphalalo leyi ringanyetiweke, exikarhi ka swin’wana, yi ta tirhana na ku pfumaleka ka mfambelaniso wa nkunguhato endzeni ka swiyenge swinharhu swa mfumo.
",0.8431956
"Ditsenogare di tla tsebiša mokgwa wa tlhahlobo wo theilwego go bohlatse.
","Miphalalo leyi yi ta tivisa ndlela ya vulanguteri leyi simekiweke ehenhla ka vumbhoni.
",0.89898264
"Tlhako ya pholisi tsebišitše gape kakanyo ye bonolo ka peakanyo ya nako ye telele go ya magareng le peakanyo ya nako ye kopana go phatlalala le mmušo tla šomela go thoma dimpshafatšo tša melao go kaonafatša kopano le kakanyo mo peakanyong le tlhahlobong ya mmušo.
","Rimba lera pholisi ri tlhela ri tivisa nkoteko wo vhumbela wo olova ku ri na nkunguhato wa nkarhi wo leha kuya eka wa le xikarhi eka mfumo hinkwawo.
",0.79812837
"Tumelelo ya Tumelelano ya go Thongwa ga Mokgatlo wa Dihlare tša Seafrika (AMA).
","Ri ta tirhela ku tivisa mipfuxeto ya milawu ku antswisa ntirhisano na nkoteko wo vhumbela eka nkunguhato na vulanguteri bya mfumo.
",0.56508386
"Kabinete dumeletše go saenwa ga Tumelelano ya go Thongwa ga AMA le go išwa ga yona Palamenteng go ka dumelelwa.
","Ntiyisiso wa Ntwanano wa ku Tumbuluxiwa ka Ejensi ya Vutshunguri ya Afrika (AMA).
",0.612512
"Se se tla phetha tumelelano yeo amogelwago ke Kopano ya Tumelelano ya Afrika ka.
","Khabinete yi pasise ku sayiniwa ka Ntwanano wa ku Tumbuluxiwa ka AMA na swiringanyeto swa yona ePalamente leswaku swi tiyisisiwa.
",0.7016133
"Tumelelano thoma semmušo AMA ya kontinente.
","Leswi swi ta humelerisa ntwanano lowu wu amukeriweke hi Huvo ya Yuniyoni ya Afrika hi.
",0.75629705
"Mokgatlo tla laola ditšweletšwa tša dihlare, gomme wa kaonafatša polokego le bokgoni bja ditšweletšwa tša dihlare ka kontinenteng.
","Ntwanano lowu wu tumbuluxa hi ndlela ya ximfumo AMA ya tikokulu.
",0.6338139
"Go saenwa le go dumelelwa ga tumelelano ye go tla kaonafatša boikgafo bja Afrika Borwa mo lefaseng le mo kontinenteng mo go matlafatšeng lenaneo la taolo ya kontinente mo go ditšweletšwa tša maphelo.
","Ejensi leyi yi ta lawula swikumiwa swa vutshunguri, na ku antswisa vuhlayiseki na matirhiselo ya swikumiwa swa vutshunguri swa tikokulu.
",0.7673407
"Pego ka ga Lenaneo la Tlhohleletšo ya Motšhelo la Phethagatšo ya Dinyakišišo le Tlhabollo (R&D) – 2019/20 le 2020/.
",".
",0.39512387
"Kabinete dumeletše go išwa ga Lenaneo la tlhohleletšo ya Motšhelo la R&D Palamenteng mo mengwageng ye mebedi ya go feta (2019/20 le 2020/21).
","Ku sayiniwa ka ku tiyisisiwa ka ntwanano lowu swi ta anstwisa ku tiboha ka misava hinkwa na ka tikokulu ka Afrika-Dzonga eka ku tiyisa sisiteme yo lawula ya tikokulu hi mayelana na swikumiwa swa rona swa rihanyo..     Xiviko hi mayelana na  wa Matirhelo ya Nongoloko wa Swihlohloteri swa Xibalo wa Ndzavisiso na Nhluvukiso (R&D)– 2019/20 na 2020/.
",0.75370955
"Se se sepelelana le karolo ya 11D (17) ya Molao wa Motšhelo wa Letseno, wa 1962 (Molao wa 58 wa 1962), woo nyakago go alwa ga dipego tše ka Palamenteng.
","Khabinete yi pasise ku ringanyetiwa ePalemente ka Nongoloko wa Swihlohloteri swa Xibalo wa R&D eka malembe mambirhi lama hundzeke (2019/20 na 2020/21).
",0.6992705
"Lenaneo la tlhohleletšo ya motšhelo le nyaka go hlohleletša dikhamphani tša praebete go beeletša mo go R&D gore go hlohleletšwe kgolo ya ekonomi, le go godiša katlego.
","Leswi swi fambisana na xiyenge xa 11D (17) xa Nawu wa Xibalo xa Malinghena, wa 1962 (Nawu wa 58 wa 1962), lowu wu lavaka ku andlariwa ka swiviko leswi ePalemente.
",0.6626642
"Kabinete thabela gore pego bontšha gore dikhamphani tše difsa di dirile kgopelo ya tlhohleletšo ya motšhelo hlohleletša dikhamphani tše dintši go hwetša setlamo se bjalo ka karolo ya go godiša dipeeletšo tša bona le go hlohleletša kgolo ya ekonomi.
","Nongoloko wa swihlohloteri swa xibalo wu lava ku hlohlotela tikhamphani to ka ti nga ri ta mfumo ku vekisa eka R&D hi xikongomelo xo hlohlotela ku kula ka vuvekisi.
",0.78598976
"Dikhamphani tše nne tša godimo tšeo di hweditšego tlhohleletšo ya motšhelo di ka makaleng tshepetšo ya ditšweletšwa tša temo; kaonafatšo ya meepo; dikhemikhale, dibotsefatši, dihlare le elektrotheknikhale le Theknolotši ya Tshedimošo tšeo Kabinete di dumeletšego bjalo ka dikarolo tše bohlokwa mo Leanong la Katlego ya Pholisi ya Intasteri.
","Wu pfumelela ku antswisiwa ka sayense na vutumbuluxi hi mayelana na ku kula ka ikhonomi, na ku kondletela vuphikizani.
",0.67856723
"Pego ka botlalo ka hwetšwa mo wepsaeteng ya Kgoro ya Saense le Kaonofatšo: www.dst.gov.za.
",".
",0.4649617
"Foramo ya Molao wa Dibaka le Kgolo ya Afrika (AGOA) -.
","Khabinete yi enerisiwa hileswaku xiviko lexi xi komba leswaku tikhamphani tintshwa ti endlile swikombelo swa xihlohloteri xa xibalo.
",0.49958596
"Kabinete dumeletše go swarwa ga Foramo ya AGOA ka.
","Swi hlohlotela tikhamphani to tala ku fikelela xikimi lexi tanihi xiphemu xo kurisa vuvekisi bya vona na ku hlohlotela ku kula ka ikhonomi.
",0.61981773
"AGOA dumeletšwe ke Amerika (USA) ka 2000 go fa phihlelelo ya go ikgetha ya kgwebo ya go ikema go bontši bja dinaga tša Afrika tša Borwa bja Sahara le mebaraka ya gae ya USA.
","Tikhamphani ta mune ta xiyimo xa le henhla leti ti fikeleleke xihlohloteri xa xibalo ti le ka ku phurosesiwa ka swa vurimi; antswiso wa swa vucelamigodi; tikhemikali; swixongisi; tisekitara to endla mirhi na ta xithekiniki xa xielekitironiki na ta Thekinoloji ya Vuxokoxoko leti Khabinete yi ti amukeleke tanihi tindhawu ta swirhangana eka Kungu ra ya Pholisi ya Matirhelo ya Tiindasitiri.
",0.6855843
"Dikišontle tša Afrika Borwa ka fase ga AGOA di akaretša dienywa tša go butšwa, dimake, dikoloi, didirišwa, tšhipi, setala le ditšweletšwa tša khemikhale.
","Xiviko hi vutalo xi nga fikeleriwa hi ku tirhisa webusayiti ya Ndzawulo ya Sayense na Vutumbuluxi eka: www.dst.gov.za.
",0.6783857
"Tšatšikgwedi la nnete le lefelo di sa tlo tsebišwa.
","Foramu ya Nawu wa ku Kula na Swivandlanene ya Afrika (AGOA) –.
",0.4324268
"Samiti ya Ditona ya Sehlopha sa Ditlhahlobo tša Lefase (GEO) –.
","Khabinete yi pasisile ku rhurheriwa ka Foramu ya AGOA hi.
",0.6464875
"Kabinete dumeletše gore Afrika Borwa sware Samiti ya Ditona ya GEO ka Motsekapa ka.
","AGOA yi pasisiwile hi United States of America (USA) hi 2000 ku nyika mfikelelo wa ntsakelo wa bindzu ro tiyimela eka matiko mo tala ya xifundza xa Afrika xa le dzongeni wa Sahara na makete wa le matikweni ya le USA.
",0.71308684
"GEO ke mokgatlo wa mebušo ya boditšhabatšhaba woo hlomilwego ka 2003 ka morago ga Samiti ya Lefase ya Tlhabollo ya go Swarelela šoma bjalo ka sefala sa kopano moo dinaga di kgathago tema ka go ithaopa go fihlelela nepo ya go swana ya go aga mananeo GEO.
","Swirhumeriwa ematikweni mambe hi Afrika-Dzonga ehansi ka AGOA swi katsa mihandzu yo dyiwa, timanga, mimovha, michini yo tirha hi yoxe, ngwedi, nsimbhi, na swikumiwa swa khemikali.
",0.66064197
"Gonabjale GEO na le mebušo ya bosetšhaba ya go feta 113, ye 30 ya yona tšwago ka Afrika gomme mekgatlo ye ka bago 140 kgatha tema, gomme ye 11 ya yona tšwa Afrika.
","Siku ra xiviri na ndhawu swa ha ta tivisiwa..     Samiti ya Vaholobye hi mayelana na Mixiyaxiyo ya Misava (GEO) – .
",0.70483744
"Afrika Borwa dutše le leloko la Komitiphethiši go tloga ka 2005 gomme boramahlale ba rena gonabjale ba kgatha tema mananeong dinyakišišo mmalwa ao etilwego pele ke GEO.
","Khabinete yi pasise leswaku Afrika-Dzonga yi rhurhela Samiti ya Vaholobye ya GEO eKapa hi.
",0.7387266
"Kgwedi ya Dinamelwa ya Diphalane (OTM) –.
","GEO huvo ya le xikarhi ka mifumo leyi tumbuluxiweke hi 2003 endzhaku ka Samiti ya Misava ya 2002 hi mayelana na Nhluvukiso wa Vuyisekamahlweni.
",0.5493523
"Kabinete dumeletše go thakgolwa ga lesolo la OTM ka Mokibelo, 1 Diphalane 2022, ka fase ga morero: “Sishov’ingolovane: mmogo re aga infrastraktšha ya dinamelwa yeo agago mešomo ya go swarelela”.
","Yi tirha tanihi pulatifomo ya mavandlanyingi laha matiko hi ku tinyiketela ma hoxaka xandla hi mayelana na xikongomelokulu xa nhlanganelo xa ku aka tisisiteme ta GEO.
",0.69173175
"OTM ya ngwaga le ngwaga šomišwa go godiša temošo ka dinamelwa bjalo ka dikarolo tše bohlokwa mo kgolong ya ekonomi le tlhabollo ya mahlakore mararo.
","Sweswi GEO yi na ku tlula 113 wa mifumo ya rixaka, leyi 30 ya yona yi humaka eAfrika na kwalomu ka 140 wa mihlangano leyi tekaka xiave, laha 11 wa leyi yi humaka eAfrika.
",0.5790111
"Go tla ba le ditiragalo tše mmalwa go bontšha dikarolo tše mmalwa tša infrastraktšha ya dinamelwa ka go difofane, dikepe, dinamelwa tša bohle le ditsela.
","Afrika-Dzonga yi vile xirho xa Vurhangerinkulu xo gingirika xa kusukela hi 2005 naswona van’watisayense va ka hina sweswi va le ku tekeni ka xiave eka mapfhumba ya ndzavisiso yo hlayanyana lama rhangeriweke  hi ku tirhisa GEO.
",0.6227584
"Ditiragalo di lemoša gape ka polokego le tšhireletšo ya dinamelwa.
","N’hweti ya Vutleketli ya Nhlangula (OTM) –.
",0.5104722
"Go tla akaretšwa gape bakgathatema go boledišana ka ditlhohlo tša go fapana mo lekaleng la dinamelwa.
","Khabinete yi pasise ku simekiwa ka pfhumba ra OTM hi Mugqivela, 1 Nhlangula 2022, ehansi ka nhlokomhaka: “Sishov’ingolovane: swin’we hi aka miako ya vutleketli leyi akaka na ku hlayisa vutihanyisi”..     OTM ya lembe na lembe yi tirhisiwa ku tlakusa vulemukisi hi mayelana na vutleketli tanihi xin’wana xa swiphemu swa nkoka eka kula ka ikhonomi na nhluvukiso wa tindhawu.
",0.60422564
"Mmušo dula ikgafile mo go kaonafatšeng infrastraktšha ya dinamelwa ya naga, bobedi mo mafelong segae le setoropong, gore go sepetšwe tshepelo ye botse gape ya bokgoni ya dithoto le batho.
","Migingiriko yo hlayanyana yi ta endliwa ku kombisa swiphemu swo hambanahambana swa switirhisiwakulu swa vutleketli eka swa vuhahisi, malwandle, swifambo swa mani na mani na mapatu.
",0.79107606
"Kopano ya Lenaneo la Magae la Bodulo bja Batho (UN-HABITAT) la Kopanoditšhaba (UN).
","Migingiriko leyi yi ta tlhela yi tlakusa vulemukisi hi mayelana na vuhlayiseki na vusirheleri bya vutleketli.
",0.39897466
"Kabinete dumeletše go swarwa ga kopano ya maloko UN-HABITAT ka Johannesburg ka la 16 Diphalane..  Kgoro ya Bodulo bja Batho tla sepetša kopano ye ya matšatši mabedi yeo tla tsenelwago ke ditsebi tša dipolotiki, ditsebi le banyakišiši, go akaretša malokomagolo Komiti ya go ya go ile ya Baemedi ba UN-HABITAT bao ba lego Nairobi, Kenya.
","Miburisano ya vakhomaxiave yi ta tlhela yi khomiwa ku burisana hi mitlhontlho yo hambanahambana eka sekitara ya vutleketli.
",0.6092937
"Ditaba tše bohlokwa tšeo go tla bolelwago ka tšona di tla akaretša ditsenogare tša phetogo go badudi ba mekhukhung le metsesetoropo go tlala kudu.
","Mfumo wu tshama wa ha tibohile ku antswisa switirhisiwakulu swa vutleketli swa tiko, havumbirhi eka tindhawu ta le matikoxikaya na ta le madorobeni, hi xikongomelo xo humelerisa mafambafambelo lama tirhaka kahle na lama hatlisaka ma nhundzu na vanhu.
",0.7636466
"Dipoelo tša dipoledišano tše di tla phethwa mo thakgolong ya Tlhako ya Leano la Katlego la Lefase, yeo tla alwago Kopanong ya UN-HABITAT gore dumelelwe ka  Melaokakanywa.
","Nhlengeletano ya Vutshamo wa Nongoloko wa Vutshamo bya Vanhu ya Vun’we bya Tinxaka (UN-HABITAT).
",0.5792675
"Molaokakanywa wa Khansele ya Setšhaba ya Dikgaruru tša Bong le Dipolao tša Basadi le Bana (GBVF) wa.
","Khabinete yi pasisile ku rhurheriwa ka nhlengeletano ya swirho swa UN-HABITAT eJoni hi masiku ya 16 na 17 Nhlangula..     Ndzawulo ya Vutshamo bya Vanhu yi ta hlanganisa nhlengeletano leya masiku mambirhi leswaku yi ngheneleriwa hi tinghwazi ta tipolitiki, vatirhi na valavisisi, ku katsa na swirhonkulu swa Komiti ya Vayimeri va Nkarhi hinkwawo ya  UN-HABITAT leyi kumekaka eNairobi, eKenya.
",0.6917745
"Kabinete dumeletše go išwa ga Molaokakanywa wa Khansele ya Setšhaba ya 2021 Palamenteng gore go šoganwe le wona.
","Timhakakulu leti ku faneleke ku vulavuriwa hi tona ti ta katsa ku lava miphalalo yo cinca ya swidakana na tindhawu ta doroba to hlakala..     Mivuyelo ya miburisano leyi yi ta fika emakumu loko ku simekiwa Rimba ra Kungu ra Matirhelo ra Misava Hinkwayo, leri ri nga ta andlariwa eka Huvo ya UN-HABITAT leswaku yi amukeriwa hi   Milawumbisi      .
",0.7255724
"Molaokakanywa wo fa tlhako ya molao mo go hlongweng ga mokgatlo wa molao gore go be le tsenogare ye nepišago mo go šoganeng le GBVF dumelela gape go thongwa ga Boto ya Khansele yeo tla fago taolo yeo beakantšwego gomme ya laola phethagatšo ya Leano la Taolo ya Setšhaba ka ga GBVF, leo le dumeletšwego ke Kabinete ka Diphalane 2020 go phethagatšwa.
","Khansele ya Rixaka hi mayelana na Nawumbisi wa Madzolonga yo ya hi Rimbewu na ku Dlayeteriwa ka Vaxisati (GBVF) wa.
",0.7341164
"Boto tla le kemedi ya 51 go tšwa go setšhaba sa gae le 49% go tšwa mmušong.
","Khabinete yi pasise ku ringanyetiwa ka Khansele ya Rixaka hi mayelana na Nawumbisi wa GBVF wa 2021 ePalamente leswaku wu langutisisiwa ku ya emahlweni.
",0.6626707
"Molaokakanywa šetše swayaswayilwe ke setšhaba.
","Nawumbisi lowu wu nyika rimba ra nawu leswaku ku tumbuluxiwa huvo ya xinawu ku nyika mphalalo wa nkongomo eka ku tirhana na GBVF.
",0.6418524
"Molaokakanywa wa Ditšweletšwa tša Motšoko le Didirišwa tša go Kgoga Motšoko tša Elektroniki wa.
","Wu tlhela wu lulamisela ku simekiwa ka Bodo ya Khansele leyi nga ta nyika vurhangeri bya xiqhinga ni ku vona ku angamela ka Kungu ra Xiqhinga ra Rixaka hi mayelana na GBVF, leri ri pasisiweke hi Khabinete hi Nhlangula 2020 leswaku ri tirhisiwa.
",0.67164683
"Kabinete dumeletše go išwa palamenteng Ditshwayotshwayo tša Molaokakanywa wa Ditšweletšwa tša Motšoko le Didirišwa tša go Kgoga Motšoko tša Elektroniki wa 2018, tšeo di nyakago go phumola Molao wa gonabjale wa go Laola Ditšweletšwa tša Motšoko, (Molao wa 83 wa 1993) go ya le ka moo mpshafaditšwego ka gona.
","Bodo leyi yi ta na vuyimeri bya 51% kusuka eka vaaki lava nga na ku tsakela kun’we na 94% kusuka eka mfumo.
",0.5906816
"Molaokakanywa nyaka go matlafatša magato maphelo setšhaba naga gomme dire gore sepelelane le Tumelelano ya Tlhako ya Mokgatlo wa Maphelo Lefase ka ga Taolo ya Motšoko.
","Nawumbisi lowu wu se wu hundzile eka ku nyikiwa ka mavonelo ya vanhu.
",0.6260104
"Molaokakanywa šišinya gare ga tše dingwe, gore go se sa folelwa ka gare ga meago le mafelo mangwe ka ntle ga meago; go fedišwa ga thekišo ya sekerete mo metšheneng ya go rekiša, le go thekga taba ya diphuthelwana tša disekerete le maswao temošo.
","Nawumbisi wa Vulawuri bya Swikumiwa swa Fole na Tisisiteme ta Mphakelo ta Xielekitironiki wa.
",0.7565699
"Molaokakanywa fetišitšwe dikgatong tša go tsenelela tša go nyaka maikutlo setšhaba go fapana, go akaretša intasteri ya metšoko mekgatlo ya badudi le dikgoro tša mmušo tša maleba  Ditiragalo tše di Tlago.
","Khabinete yi pasise ku ringanyetiwa ka Nawumbisi wa Vulawuri bya Swikumiwa swa Fole na Tisisiteme ta Mphakelo ta Xielekitironiki wa 2018 ePalemente, lowu lavaka ku herisa Nawu wa Vulawuri bya Swikumiwa swa Fole wa sweswi, 1993 (Nawu wa 83 wa 1993), tanihilaha wu hundzuluxiweke hakona..     Nawumbisi lowu wu tlhela wu lava ku tiyisa magoza ya rihanyo ra vaaki ya tiko na ku ma fambelanisa na Ntwanano wa Rimba ra Nhlangano wa Rihanyo wa Misava hi mayelana na Vulawuri bya Fole.
",0.74162513
"Kopano ya bo 77 ya Kopanokakaretšo ya UN (UNGA77).
","Nawumbisi lowu, exikarhi ka swin’wana, wu ringanyeta ku nga dzahiwi ka 100% endzeni ka miako na le ka tindhawu tin’wana ta le handle ka miako; ku yirisiwa ko xavisa tisigarete hi ku tirhisa michini yo xavisa, na ku tiyisa mapakatelelo ya tisigarete na mifungho yo lemukisa.
",0.3583647
"Afrika Borwa kgatha tema ka go UNGA77 yeo lego ka go dikantorokgolo tša UN ka Toropokgolong ya New York ka USA go tloga ka la 27 Lewedi 2022 ka fase ga morero: “Nako ya mathata: Go tšweletša ditharollo go kgokaganya ditlhohlo”.
","Nawumbisi lowu wu hundzile eka mbhurisano wo angarhela na le ka vakhomaxiave vo hambanahambana, ku katsa indasitiri ya fole, mihlangano ya vaaki lava nga na ku tsakela kun’we na tindzawulo ta mfumo leti faneleke     Swiendleko leswi Taka.
",0.6584786
"Go Borwa bja lefase, khuetšo ya ekonomi le ekonomi ya leago ya leuba la Bolwetši bja Coronavirus (COVID-19) bile bothata kudu malebana le tsošološo go Leboa leo le hlabologilego gomme se se nyaka maitapišo ao kopanetšwego go tšwa dinageng ka moka go kgonthiša gore ga go na yoo tlogetšwego morago.
","Sexini ya vu77 ya Huvo yo Angarhela ya UN (UNGA77).
",0.55122817
"Pele ga Ngangišano ya Kakaretšo ya UN, Mongwaledikakaretšo wa UN, Morena António Guterres tla beakanya samiti ka ga “Go fetoša Thuto” le go swara kopano ya maemo godimo yeo nepišago Dinepo tša Tlhabollo ya go Swarelela (di-SDG).
","Afrika-Dzonga yi le ku tekeni ka xiave eka UNGA77 leswi endleriwaka eka tihofisikulu ta UN eka Dorobakulu ra New York eUSA kusukela hi siku ra 20 kufikela 27 Ndzati 2022 ehansi ka nkongomelo: “Xiendleko xa xicincamatimu: Ku tshunxa switshunxo leswi tisaka ku cinca eka mitlhontlho ya nhlanganelo”.
",0.72484297
"Kopano ya di-SDG swanelwa ke go nyakišiša ditsela tšeo go ka tsošološago maatla le go potlakiša phethagatšo.
","Eka Dzonga wa misava hinkwayo, switandzhaku swa ikhonomi na vanhu leswi vangiweke hi ntungukulu wa Vuvabyi bya Khoronavhayirasi (COVID-19) swi ni ku hambana lokukulu hi mayelana na ku pfuxeleleka hi vuntshwa eka N’walungu leyi hluvukeke kutani leswi swi lava matshalatshala ya nhlanganelo kusuka eka tinxaka hinkwato ku tiyisisa leswaku ku nga vi na un’we loyi siyiwaka endzhaku..     Leswi nga ta rhangela Njhekajekisano wa , Matsalanankulu wa UN, Ttn António Guterres ta rhamba samiti hi mayelana na “Ku Cinca ka Dyondzo” na ku rhurhela nhlengeletano ya le henhla leyi kongomeke eka Swikongomelokulu swa Nhluvukiso leswi Yisekaka Emahlweni (SDGs).
",0.6152097
"Letšatši la Bohwa.
","Nhlengeletano ya tiSGD yi languteriwa ku valanga tindlela leti eka tona ku tlhelaka ku kumiwa matimba ni ku hatlisisa ku tirhisiwa ka tona.
",0.36212996
"Mopresidente Ramaphosa tla fa polelokgolo mo meketekong ya Letšatši la Bohwa la Setšhaba mo Union Buildings ka Mokibelo, 24 Lewedi.
","Siku ra Ndzhaka.
",0.43928754
"Moletlo tla swarwa ka fase ga morero: “Go keteka Bohwa bja Solomon Linda le Mmino wa Setšo wa Afrika Borwa”.
","Phuresidente Ramaphosa ta andlala mbulavulo wa mhakakulu eka mitlangelo ya Siku ra Rixaka ra Ndzhaka ra 2022 eUnion Buildings hi Mugqivela, 24 Ndzati.
",0.6380466
"Kgwedi ye ya Bohwa nepiša mmino wa setšo wa Afrika Borwa ka nepišo ya mmino wa Isicathamiya le tema yeo ikgathago go dipapadi, bokgabo, setšo le bohwa.
","Xiendleko lexi xi ta khomiwa ehansi ka nkongomelo: “Ku Tlangela Ndzhaka ya Solomon Linda na Vunanga bya Xintu bya Afrika-Dzonga”.
",0.7549254
"Morero hlompha matswalo bo 60 go hlokofala ga rammino, seopedi le motšweletši Solomon Popoli Linda (1901-1962), yoo tsebegago gape bjalo ka Solomon Ntsele, yoo tsebegago kudu bjalo ka motšweletši wa koša ya, “Mbube”.
","N’hweti ya Ndzhaka ya lembe leri yi kongomisa eka vunanga bya xintu bya Afrika-Dzonga hi ku kongomisa eka vunanga bya Isicathamiya ku katsa na ku hoxa ka byona xandla lokukulu eka mitlangu ya hina, vutshila, mfuwo na ndzhaka.
",0.7347189
"Moletlo wa go Lebana wa Letšatši la Dikepe la.
","Nkongomelo lowu wu xixima malembe ya vu60 ya ku hundza emisaveni ka n’wavunanga, xiyimbeleri tlhelo qambhi Solomon Popoli Linda (1909-1962), loyi tlhelaka tiveka tanihi Solomon Ntsele, loyi tivekaka ku antswa tanihi qambhi ya risimu ra “Mbube”.
",0.5225439
"Afrika Borwa tla be swara Moletlo wa go Lebana wa Letšatši la Dikepe la 2022 ka Durban go tloga ka la 14 Diphalane.
","Xiendleko xo Fana xa Siku ra Malwandle ra Misava xa.
",0.6149193
"Moletlo tla swarwa nakong ya OTM, woo le wona tla bago karolo ya go godiša tsebo ya lekala la rena la dikepe.
","Afrika-Dzonga ri ta va yi rhurhela Xiendleko xo Fana xa Siku ra Misava ra Malwandle wa 2022 eDurban kusuka hi siku ra12 kufika 14 Nhlangula.
",0.6609715
"Moletlo tla tliša baemedi go tšwa dinageng tša go fapana bao ba tla itemogelang intasteri ya dikepe ya Afrika Borwa.
","Xiendleko lexi xi ta rhurheriwa hi nkarhi wa OTM, lexi xi nga ta tlhela xi vumba xiphemu xo tlakusa vulemukisi bya sekitara ya hina ya malwandle.
",0.7230313
"Afrika Borwa bile leloko la Mokgatlo wa Dikepe wa Boditšhabatšhaba go tloga ka 1995, woo lego mokgatlo wa go ikgetha wa UN wa go laola dikepe.
","Xiendleko lexi xi ta tisa vurhumiwa byo huma eka matiko mo hambanahambana lava nga ta va na ntokoto wa sekitara ya malwandle ra Afrika-Dzonga.
",0.6930058
"Kgwedi ya Boeti.
","Afrika-Dzonga yi vile xirho xa Nhlangano wa Malwandle wa Matiko ya Misava kusukela hi 1995, lowu wu nga ejensi ya vukorhokeri byo kongomisa ya UN leyi nga na vutihlamuleri byo lawula vutleketli bya le lwandle.
",0.2715067
"Kgwedi ya Boeti ngwaga wo ketekwa ka fase ga morero wa Letšatši la Boeti la Lefase (27 Lewedi) wa “Nagana gape ka Boeti”.
",".
",0.45822564
"Boeti bja gae bo bohlokwa kudu mo go tsošološeng lekala la boeti, leo le kgathago tema kudu go GDP ya Afrika Borwa le go hlola mošomo.
","N’hweti ya Vupfhumba.
",0.31308547
"Kabinete thabišwa ke gore lekala la kamogelo ya baeti le begile kgolo ya baeti ka morago ga nako ya COVID-.
","Nan’waka N’hweti ya Vupfhumba yi le ku tlangeriweni ehansi ka nhlokomhaka ya Siku ra Vupfhumba ra Misava (27 Ndzati) ya “Ku Tsundzuka Nakambe Vupfhumba”.
",0.65444756
"Go tšerwe maeto gae  2 milione mo seripeng sa mathomo sa 2022 begile koketšego ya 114% ge go bapetšwa le nako ya go swana ka.
","Vupfhumba bya laha kaya byi ni nkoka eka ku pfuxelela sekitara ya vupfhumba, leyi nghenisaka xandla swinene eka GDP ya Afrika-Dzonga na ku tumbuluxiwa ka mitirho.
",0.60710907
"Se se bontšha kaonafalo ya mmaraka ya nako ya go swana ka 2019, yeo bonego maeto ao tšerwego gae  6 milione.
","Khabinete yi enerisiwile hileswaku sekitara ya malwandla yi rhekodile ntlakuko wa vuendzi endzhaku ka nkarhi wa COVID-.
",0.74212825
"Bjalo ka karolo ya go keteka Kgwedi ya Boeti, Kabinete hlohleletša maAfrika Borwa go tšea maeto ‘Shortleft’ go ya diprofense tša rena tša go fapana.
","Tendzo ta laha kaya ta.
",0.4850067
"Kabinete amogela gape sephetho sa Air Belgium go fofiša difofane tša sehla go ya Afrika Borwa, go thoma kgwedi yona ye (Lewedi), seo se tla matlafatšago boeti gomme sa tiišetša maemo rena bjalo ka nepo ya boeti ya kgetho.
","2 wa timiliyoni leti fambiweke eka hafu yo sungula ya 2022 ti rhekodile ntlakuko hi 114% loko hi fananisa na nkarhi lowu fanaka hi.
",0.6091136
"Se tla akaretša difofane tša beke ye nngwe le ye nngwe go ya Motsekapa le Johannesburg  Melaetša.
","Leswi swi kombisa ku antswa loku nga erivaleni ka nkarhi lowu fanaka hi 2019, laha hi voneke.
",0.56869364
"DitebogišoKabinete lebogiša le go lakaletša tše dibotse go:Mopresidente William Samoei Ruto wa Repabliki ya Kenya, yoo hlomamišitšwego ka Labobedi, 13 Lewedi 2022, go latela dikgetho tša bosetšhaba tša khutšo tšeo di swerwego ka la 9 Phato.
","6 wa timiliyoni ta tendzo leti fambiweke ta laha kaya.
",0.49367836
"Motlatšamopresidente David Mabuza tsenetše tlhomamišo legatong la Mopresidente Ramaphosa, le mmušo le batho ba Repabliki ya Afrika Borwa.South African Rugby Union le Toropokgolo ya Motsekapa go swara phadišano ya bo seswai ya Rugby World Cup Sevens gare ga 9 le 11 Lewedi be le lekga la mathomo tiragalo ye ye bohlokwa swarwa ke naga ya Afrika gomme barati ba diketekete bao ba tsenetšego ba ilwe ba thabišwa ka dijo tša rugby le kamogelo ye lemogwago ya Afrika Borwa.
","Tanihi xiphemu xa ku tlangela N’hweti ya Vupfhumba, Khabinete yi hlohlotela MaAfrika-Dzonga ku sungula tendzo ta ‘Shotleft’ to ya eka swifundzakulu swa ka hina swo hambanahambana..     Khabinete yi tlhele yi amukela xiboho hi Air Belgium ku hahisa swihahampfhuka swa tinguva kuya eAfrika-Dzonga, kusukela n’hweti leyi (Ndzati), leswi nga ta nyika matimba eka vupfhumba na ku tiyisisiwa ku ya emahlweni xiyimo xa hina tanihi ndhawu ya vupfhumba leyi nga yi hlawulaka.
",0.78838617
