src_text,tgt_text,cosine_score
"Ka fase ke Lenaneo la Dibouto tša Tekanyetšo tše di tlago le dikopano tša boraditaba tša thekgo:.Labohlano la 26 Mopitlo 2023 ka 13:00, Tona ya Pušotirišano le Merero ya Setšo (CoGTA), Mohumagadi Thembi Nkadimeng, o tla swara kopano ya boraditaba ka ga Bouto ya Tekanyetšo ya CoGTA yeo e tlago hlaloša magato ao a lebanego le go matlafatša tshepedišo ya mebasepala..Ka Labobedi, la 30 Mopitlo 2023, Tona ya Tlhabollo ya Leago, Mohumagadi Lindiwe Zulu, le Tona ya Toka le Ditirelo tša Tshokollo, Morena Ronald Lamola, ba tla swara Dibouto tša bona tša Tekanyetšo gomme dintlha tša dikopano tša bona tša boraditaba di tla abelanwa mo sebakeng sa go se fetše pelo.
","Vhuṱambo ha vhu20 ha Ḓuvha ḽa Afrika na Maitele a Tsenguluso ya Vhuthihi ha Afrika (APRM)
",0.715938
"Bouto ya Tekanyetšo ya Mopresidente e tla alwa ka Laboraro, la 31 Mopitlo 2023 gomme kopano ya boraditaba ka ga Kgatelopele ka Dipeakanyoleswa tša Sebopego le Maitapišo a Mešomo ao a rulagantšwego ka lenaneo la Operation Vulindlela e tla swarwa ka Labobedi, la 30 Mopitlo 20
","Khabinethe khathihi na vhadzulapo vhoṱhe vha ḽa Afika Tshipembe i khou vha luthihi na dzhango ḽoṱhe ḽa Afrika khathihi na ḽifhasi ḽoṱhe nga u angaredza kha u pembelela Ḓuvha ḽa Afrika nga Ḽavhuṋa, ḽa 25 Shundunthule.
",0.55101454
"Letšatši la Afrika le Segopotšo sa Mengwaga ye 20 ya Mokgwa wa Tekolo ya Sethaka wa Afrika (APRM)
","Uno ṅwaha ndi wa ndeme vhukuma sa izwi u ṅwaha wa u pembelela miṅwaha ya 60 u bva tshe ha sainwa thendelanomviswa ya u tumbulwa ha Dzangano ḽa Vhuthihi ha Afrika, ḽine ḽa vha ḽone ḽo rangelaho Mbumbano ya Afrika.
",0.60451424
"Kabinete le Maafrika Borwa ka moka ba kopana le kontinente ya Afrika le lefase ka bophara go keteka Letšatši la Afrika ka Labone, la 25 Mopitlo 2023.
","Thero ya vhuṱambo ha ṅwaha wa 2023 ndi ine ya ri “U Ṱavhanyedza u Thoma u Shumiswa ha Vhupo ha Mbambadzo dzo Vhofholowaho ha Dzhango ḽa Afrika” – u dzhiela nṱha ndingedzo dzine dza khou itwa kha zwa u thoma u shuma ha vhupo ha mbambadzo yo vhofholowaho vhu hulwanesa ḽifhasini.
",0.58749545
"Ngwaga wo o bohlokwa kudu ka ge re keteka segopotšo sa bo60 sa go saenwa ga tšhatha ya go hlongwa ga Mokgatlo wa Botee bja Afrika, e lego makgoraditsela a Kopano ya Afrika.
","Vhuṱambo ha u pembelela Ṅwedzi wa Afrika ha ṋaṅwaha, vhu khou vha hone nga tshifhinga tsha musi hu tshi khou pembelelwa miṅwaha ya 20 ya APRM, ine yo livhiswa kha u ṱuṱuwedza mavhusele avhuḓi kha dzhango ḽoṱhe nga kha maitele a u gudisana na u sengulusana nga tshashu.
",0.56473523
"Morero wa meketeko ya 2023 – “Go akgofiša phethagatšo ya Lefelo la Kgwebišano ya go Hloka Ditšhitišo Magareng ga Dinaga tša Kontinente ya Afrika” – o amogela dikgato tše di dirwago ka go tliša tirišong ya lefelo le legolo la kgwebišano ya go hloka ditšhitišo.
","Tsheo dza Khabinethe.
",0.5097898
"Segopotšo sa Kgwedi ya Afrika sa ngwaga wo se sepelelana le segopotšo sa bo20 sa APRM, yeo e ikemišeditšego go godiša pušo ye botse ka khontinenteng ka thuto ya mphato ye e rulagantšwego le go itekola.
","Vhupo ha zwa Ikonomi ho Khetheaho (SEZ) ha Namakwa Khabinethe yo ṱanganedza zwa u tiwa ha vhupo ha Namakwa SEZ vhu re ngei Aggeneys kha ḽa Kapa Devhula.
",0.59332836
"Diphetho tša Kabinete.
","U tiiwa uhu hune ha khou dzinginywa hu khou itwa u ya nga Mulayo wa Vhupo ho Khetheaho ha zwa Ikonomi, wa ṅwaha wa 2014 (Mulayo 16 wa 2014) nahone iyo SEZ ine ya khou dzinginywa ndi tshipiḓa tsha Fulo ḽa zwa Vhubindudzi ḽa Phresidennde.
",0.14119594
"Lefelo le le Kgethegilego la Ikonomi la Namakwa (SEZ)
","Hovhu vhupo ha Namakwa SEZ vhu ḓo vula zwikhala zwa mbuelo kha zwa migodi, vhubveledzi ha geseluḓi dala, vhubveledzi ha themamveledziso, fulufulu ḽi vusuluseaho na zwa u shandukiswa ha zwibveledzwa zwa vhulimi zwa vha zwiḽiwa.
",0.45290387
"Kabinete e dumeletše go kgethwa ga SEZ ya Namakwa ka Aggeneys ka Kapa Leboa.
","Hedzi sekhithara ndi dza ndeme kha u sikwa ha mishumo khathihi na mveledziso ya ikonomi ya vhupo ha Kapa Devhula khathihi na shango nga u angaredza.
",0.6399076
"Kgetho ye e šišintšwego e dirwa go ya ka Molao wa Dilete tše di Kgethegilego tša Ikonomi, 2014 (Molao wa 16 wa 2014) le SEZ ye e šišintšwego ke karolo ya Lesolo la Peeletšo ya Mopresidente.
","Vhubindudzi ha masheleni a fhiraho R29 biḽioni ho no ḓi fulufhedziswa u swika zwino kha luṱa lwa u thoma lwa SEHezwi zwi katela pfulufhedziso u bva kha vha Vedanta Zinc (R16 biḽioni), Frontier Rare Earth (R13 biḽioni), Hive Energy (R200 miḽioni) na RRS Trade and Investment (R100 miḽioni)..Luṱa lwa Vhuraru lwa Maano a Zwiko zwa Maḓi zwa Lushaka (NWRS-3) 2023.
",0.50625944
"SEZ ya Namakwa e tla bulela dikholego tša meepo, tšweletšo ya haetrotšene ye tala, tlhabollo ya mananeokgoparara, enetši ye mpshafatšegago le tshepedišo ya temo.
","Khabinethe yo ṱanganedza NWRS-3 2023 uri ithome u shumiswa nahone maano aya ndi ane a vha mbofho kha maanḓalanga na zwiimiswa zwoṱhe zwine zwa khou shumisa Mulayo wa Maḓi wa Lushaka, wa 1998 (Mulayo 36 wa 1998).
",0.68039703
"Makala a a bohlokwa kudu mo go hlomeng mešomo le mo tlhabollong ya ekonomi ya Kapa Leboa le naga.
","Haya maano o dzudzanywa hu tshi tevhedzwa tsenguluso ya miṅwaha miraru ya NWRS-2, ine ya vha yone ye ya ṱalusa masia ane ha vha na mvelaphanḓa khathihi na ayo ane a kha ḓi vha na khaedu.
",0.5912721
"Dipeeletšo tša go feta R29 pilione di šetše di dirilwe go kgato ya mathomo ya SETše di akaretša maitlamo go tšwa go Vedanta Zinc (R16 pilione), Frontier Rare Earth (R13 pilione), Hive Energy (R200 milione) le RRS Trade and Investment (R100 milione)..Leano la Bosetšhaba la Methopo ya Meetse Kgatišo ya Boraro (NWRS-3) 2023.
","NWRS-3 yo vhumbwa nga zwipikwa zwiraru zwine zwa elana, zwine masia a maḓi na vhuthathazwitzhili a tea u tikedza mveledziso yazwo, u fheliswa ha vhushai na tshayandingano, u shela mulenzhe kha ikonomi na u sika mishumo, na uri maḓi a tea u tsireledzwa, u shumiswa, u bveledziswa, u ṱhogomelwa na u langwa nga nḓila ine a nga vha hone lwa tshifhinga tshilapfu nahone nga nḓila i linganaho.
",0.685627
"Kabinete e dumeletše NWRS-3 2023 gore e phethagatšwe gomme leano le tlama balaodi ka moka le ditheo tšeo di phethagatšago Molao wa Bosetšhaba wa Meetse, 1998 (Molao wa 36 wa 1998).
","Haya maano a dzinginya makumedzwa a pfalaho a u engedza nḓisedzo ya maḓi, u fhungudza ṱhoḓea ya maḓi, ndangulo yavhuḓi ya maḓi na vhuthathazwitzhili, u langa sekhithara ya maḓi na vhuthathazwitzhili, u ṋetshedza hafhu maḓi hu tshi itelwa tshanduko, u ṱuṱuwedza tshumisano ya dzitshaka, u langa maḓi na vhuthathazwitzhili nga fhasi ha kilima ine ya khou shanduka.
",0.58536863
"Leano le le thekgwa ke tshekatsheko ya mengwaga ye meraro ya NWRS-2, yeo e hlaotšego mafelo a katlego le mafelo ao a sa dutšego e le tlhohlo.
","Heyi NWRS-3 i anḓadzwa kha webusaithi ya DWS ine ya vha WEBTOKEN..Muvhigo wa nga ha maga o thomaho u shumiswa nga Muhasho wa zwa Vhupileli (DoD) hu tshi itelwa u tandulula thaidzo dza mikhwa na vhuḓifari ha miraḓo ya Mmbi ya Vhupileli ha Lushaka ya Afrika Tshipembe (SANDF) vhane vha vha vho rumelwa kha mishumo ya u ḓisa mulalo.
",0.6003427
"NWRS-3 e akaretša dinepo tše tharo tša merero, gore meetse le kelelatšhila di swanetše go thekga tlhabollo, phedišo ya bohloki le go se lekalekane, di na le seabe ikonoming le tlholong ya mešomo, gomme meetse a swanetše go šireletšwa, go šomišwa, go hlabollwa, go hlokomelwa le go laolwa ka mokgwa wa go ya go ile le ka tekatekano.
","Khabinethe yo ṱanganedza muvhigo wa nga ha mvelaphanḓa ine shango ḽa Afrika Tshipembe ḽa khou ita hu tshi itelwa u tandulula thaidzo dza vhuḓifari ha miṅwe miraḓo ya SANDF ine ya vha yo rumelwa kha mishumo ya u ḓisa mulalo u mona na dzhango ḽa Afrika.
",0.65449804
"Leano le le dira ditšhišinyo tša go kwagala tša go oketša kabo ya meetse, go fokotša nyakego ya meetse, taolo ye e šomago gabotse ya meetse le kelelatšhila, go laola lekala la meetse le kelelatšhila, go aba meetse leswa bakeng sa phetogo, go tšwetša pele tšhomišano ya boditšhabatšhaba, le go laola meetse le kelelatšhila ka fase ga maemo a boso ao a fetogago.
","SANDF yo ḓi dzulela u vhonala sa tshiko tsha u ḓihudza ha lushaka sa izwi i tshi shela mulenzhe kha vhurumelwa ha u ḓisa mulalo kha dzhango ḽa Afrika u itela uri hu vhe na mulalo na vhudziki kha dzitshaka dzine dza vha dzo hoṱefhadzwa nga dzinndwa fhano kha dzhango ḽa Afrika i tshi khou shuma nga fhasi ha Dzangano ḽa Vhuthihi ha Dzitshakha (UN).
",0.35781175
"NWRS-3 e phatlaladitšwe wepsaeteng ya DWS go WEBTOKEN..Pego ka ga Magato ao a Phethagaditšwego ke Kgoro ya Tšhireletšo (DoD) go Šogana le Maitshwaro le Mekgwa ya Maloko a Sešole sa Tšhireletšo ya Setšhaba sa Afrika Borwa (SANDF) ao a Rometšwego go Tliša Khutšo Dinageng tša Dintwa Kabinete e amogetše pego ka ga kgatelopele yeo Afrika Borwa e e dirago go šogana le maitshwaro a a mangwe a maloko a SANDF ao a rometšwego masolong a go hlola khutšo go ralala le kontinente.
","Musi hu tshi vha na mavharivhari a milandu ya zwa vhudzekani nga ṅwaha wa 2015, ho mbo ḓi vhumbwa Tshigwada tsha U shuma tsha Vhukati ha Dziminisṱa nga ṅwaha wa 2019 u itela uri hu kone u ṱoḓisiswa milandu iyi ya u sa fara zwavhuḓi na u tambudza lwa vhudzekani (SEA) ine ya bvelela ngomu kha DoKhabinethe yo fushea nga mutevhe wa maga e a vhewa u itela u tandulula thaidzo dza zwiito zwa SEA ngomu kha vhurumelwa ha u ḓisa mulalo ha SANDDzangano ḽa Vhuthihi ha Dzitshaka ḽi dzhia shango ḽa Afrika Tshipembe sa ḽine ḽa vha na maitele a khwinesa nahone ḽo fhululedza shango ḽashu kha mvelaphanḓa ye ḽa ita kha nndwa ya u fhelisa tshoṱhe zwiito zwa SEA ngomu kha SANDKhabinethe yo ombedzela uri zwiito zwa SEA a zwi nga ḓo konḓelelwa uri zwi bvele phanḓa na u tshinyadza rekhodo yavhuḓi ine SANDF ya vha nayo kha dzhango ḽa Afrika..Ṅwedzi wa Vhaswa wa ṅwaha wa 2023 Khabinethe yo ṱanganedza Mbekanyamushumo ya Ṅwedzi wa Vhaswa ya 2023 nga fhasi ha thero ine ya ri: “U engedza mbofholowo ya vhaswa kha zwa ikonomi hu tshi itelwa vhumatshelo ha tshifhinga tshilapfu”.
",0.6711795
"SANDF e bile mothopo wa boikgantšho bja bosetšhaba ka ge e tšea karolo ka go masolo a go hlola khutšo ka kontinenteng go kgonthiša khutšo ka ditšhabeng tša Afrika tšeo di lego ntweng ka fase ga tlhokomelo ya Ditšhabakopano (UN).
","Muthusaphresidennde Vho Mashatile vha ḓo ṋetshedza tshipitshi nga Ḓuvha ḽa Lushaka ḽine kha uno ṅwaha ḽa ḓo pembelelwa lwa tshifhinga tsha maḓuvha mavhili u bva nga ḽa 16 u swika 17 Fulwi 2023 fhaḽa Sentharani ya zwa Mitambo ya nga Nnḓa ya Mangaung, Bloemfontein, kha ḽa Free State.
",0.5847999
"Ka ditatofatšo tša melato ya thobalano yeo e akaretšago bašireletši ba khutšo ba sešole tšeo di tšwelelago ka 2015, Sehlophatšhomo sa Tona se hlomilwe ka 2019 go nyakišiša melato ya tlaišo le tšhomišompe ya thobalano (SEA) ka gare ga DoKabinete e kgotsofaditšwe ke sehlopha sa magato ao a beilwego go šogana le ditiragalo tša SEA ka go masolo a go hlola khutšo a SANDUN e amogela Afrika Borwa bjalo ka mekgwa ye mekaone gape e lebogile naga ka kgatelopele yeo e e dirilego go fediša SEA ka go SANDKabinete e gateletše gore mokgwa wa SEA o ka se dumelelwe go šilafatša rekoto ye botse ya SANDF ka kontinenteng.
","Kha tshenetshi tshifhinga tsha maḓuvha mararu, hu ḓo vha na tshikhala tshine ngatsho vhaswa vha ḓo kona u shela mulenzhe kha nyambedzano na Dziminisṱa, Vhathusaminisṱa khathihi na vhaṅwe vhashelamulenzhe vha kwameaho nga ha vhugudisi ho fhambanaho, zwikhala zwa mabindu na zwa mveledziso zwine zwa vha hone kha muvhuso na vhashumisani kha zwa matshilele.
",0.6751232
"Kgwedi ya Baswa ya 2023.
","Ṅwedzi wa Vhaswa u ḓo rwelwa ṱari nga Ḽavhuṋa, ḽa 1 Fulwi nga Minisṱa Ofisini ya Phresidennde vho hweswaho maanḓa a Muhasho wa Vhafumakadzi, Vhaswa na Vhathu vha re na Vhuholefhali, Dokotela Vho Nkosazana Dlamini Zuma fhaḽa kha vhupo ha tshiga tsha Tshihumbudzi tsha Hector Pieterso na Muziamu tshi re fhaḽa kha ḽa Soweto.
",0.2892683
"Kabinete e dumeletše Lenaneo la Kgwedi ya Baswa la 2023 ka fase ga kgwekgwe ye: “Go akgofiša tokologo ya ikonomi ya baswa ya bokamoso bja go ya go ile”.
","Khabinethe yo eletshedza tshitshavha uri tshi engedze mafulufulu u itela u vhona uri vhathu vhaswa vha khou kona u swikela zwikhala zwine zwa vha tendela uri vha kone u ḓidzhenisa kha zwa u shela mulenzhe kha ikonomi nga nḓila yo fhelelaho.
",0.27940443
"Motlatšamopresidente Mashatile o tla fa polelo Letšatšing la Bosetšhaba leo ngwageng wo le tlago ketekwa ka nako ya matšatši a mabedi go tloga ka la 16 go fihla ka la 17 Phupu 2023 kua Senthareng ya Dipapadi tša ka Ntle ya Mangaung, Mangaung, Bloemfontein, ka Freistata.
","Muvhuso, sa wone mutholi muhulwanesa, wo fhindula kha ṱhoḓea dza mveledziso ya zwikili na u maanḓafhadzwa ha vhaswa nga u ita uri vhaswa vho fhedzaho pfunzo dzavho dza dziyunivesithi vhane vha si vhe na mishumo vha kone u wana tshenzhemo ya mishumo nga kha Mbekanyamushumo ya zwa Vhugudi na Vhugudisi ha Mishumo ya avho vho fhedzaho pfunzo dza Yunivesithi ya Muhasho wa Tshumelo dza Muvhuso.
",0.62988067
"Mo matšatšing a mabedi, go tla ba le sebaka sa gore baswa ba tšeye karolo dipoledišanong le Ditona, Batlatšatona le bakgathatema ba bangwe ka ga dibaka tša go fapafapana tša tlhahlo, tša kgwebo le tša tlhabollo tšeo di lego gona ka gare ga mmušo le bašomišane ba leago.
","Muvhuso u khou dovha hafhu wa thoma u shumisa Tshikwama tsha Mishumo ya zwa Matshilisano, Social Employment Fund (SEF) khathihi na maga a u sika mishumo a Tshumelo dza Vhaswa dza Lushaka (NYS) o vusuluswaho nahone ane a kona u kungedzela vhaswa vha zwigidi na zwigidi ngomu kha ikonomi.
",0.6322966
"Kgwedi ya Baswa e tla thakgolwa ka Labone, la 1 Phupu ke Tona ka go Kantorong ya Mopresidente ya Basadi, Baswa le Bagolofadi, Ngaka Nkosazana Dlamini Zuma ka Lefelong la Segopotšo la Musiamo wa Hector Pieterson.
","Maga a Mishumo ya Vhaswa a Phresidennde na one o no ḓi kona u tikedza vhaswa kha u kona u swikela zwikhala zwi swikaho miḽioni zwine ngazwo vhaswa vha vha vha tshi khou kona u wana miholo ya tshifhinganyana, u vhewa ha vhaswa kha mishumo i swikaho miḽioni nthihi, zwikhala zwa u guda zwi katelaho na mishumo zwa 250 000 khathihi na zwiṅwe zwikhala zwa 250 000 zwa tshumelo dzi badelaho hu tshi katelwa na vhaswa vha swikaho 500 000 vhane vho dzheniswa kha zwikhala zwa muholo wa tshifhinga tshilapfu.
",0.6449392
"Kabinete e hlohleleditše setšhaba go matlafatša maitapišo a go kgonthiša gore baswa ba hwetša menyetla yeo e ba dumelelago go kgatha tema ka mafolofolo ka ikonoming.
","Musi ri tshi khou dzhena kha Ṅwedzi wa Vhaswa, muvhuso u khou eletshedza vhathu vhaswa uri vha ḓiṅwalise kha puḽatifomo ya WEBTOKEN , ine ya vha puḽatifomo ine khayo vha nga kona u swikela zwikhala zwa mishumo sa izwi vhaṅwe ngavho vha swikaho miḽioni nṋa vho no ḓiṅwalisa u swika zwino.
",0.45370305
"Mmušo, bjalo ka mongmošomo yo mogolo, o arabetše tlhokego ya tlhabollo ya mabokgoni le go fa baswa mešomo ka go kgontšha dialoga tšeo di sa šomego go hwetša maitemogelo ka Lenaneo la Dialoga tša Tirelo ya Setšhaba la go Ithutela Mošomo le go Ithuta.
","U farwa ha Muṱangano wa zwa Ṱhoḓisiso dza zwa Vhulimi fhano Afrika (FARA), Khonifarentsi ya vhumalo (8) ya Mabindu a zwa Vhulimi a Afrika na Vhege ya Saintsi khathihi na Guvhangano ḽa Nnyi na Nnyi ḽa vhu.
",0.6107342
"Mmušo gape o phethagatša Sekhwama sa Mešomo ya Leago (SEF) le maitapišo a go tsošološa a go hloma mešomo a Tirelo ya Baswa ya Bosetšhaba (NYS) ao a gogelago baswa ba dikete ka ikonoming.
","Khabinethe yo ṱanganedza zwauri Afrika Tshipembe ḽi vhe ḽiṅwe ḽa mashango ane ha ḓo farelwa khaḽo Konifarentsi ya vhu8 ya Mabindu a zwa Vhulimi na Vhege ya zwa Saintsi khathihi na Guvhangano ḽa Nnyi na Nnyi ḽa vhu9 fhaḽa ḓoroboni ya Durban u bva nga ḽa 5 u swika 9 Fulwi 2023.
",0.5951737
"Lesolo la Mopresidente la Mešomo ya Baswa le šetše le thekgile ka katlego phihlelelo ya dibaka tša go hwetša mogolo wa nakwana tše milione, go bewa mošomong ga milione o tee, menyetla ya go ithuta ye e kopantšwego le mešomo ye 250 000, menyetla ye 250 000 ya tirelo ye e lefelwago le baswa ba 500 000 bao ba swaraganego le menyetla ya go tsenya letseno ya go ya go ile.
","FARA ndi dzangano ḽihulwane ḽa fhano kha dzhango ḽa Afrika ḽine ḽa vha na vhuḓifhinduleli ha u dzudzanya na u tshimbidza ṱhoḓisiso dza zwa vhulimi khathihi na mveledziso ya vhukoni kha dzhango.
",0.22530751
"Ge re tsena Kgweding ya Baswa, mmušo o gopotša baswa go ingwadiša polatefomong ya WEBTOKEN ka ge dimilione tše nne tša badudi ba gabo bona ba šetše ba na le tšona, moo menyetla ya mošomo e ka fihlelelwago.
","Nga u fara vhuṱambo uvhu, Afrika Tshipembe ḽi ḓo vhuelwa vhukuma u bva kha tshumisano na vhufarisani na zwiimiswa zwa vhulimi na ṱhoḓisiso zwa fhano kha dzhango ḽa Afrika musi hu tshi vha na u kovhana ha nḓivho na maitele avhuḓi kha zwa saintsi ya vhulimi na ṱhoḓisiso.
",0.5517956
"Go Monggae wa Khonferentshe ya bo 8 ya Beke ya Dikgwebo tša Temo le Saense ya Foramo ya Dinyakišišo tša Temo ka Afrika (FARA) gape le Kopano ya yona ya Kakaretšo ya bo Kabinete e dumeletše gore Afrika Borwa e sware mmogo Khonferentshe ya bo 8 ya FARA ya Beke ya Dikgwebo tša Temo le Saense ya Afrika le Seboka sa yona sa Maloko a Palamente sa bo 9 ka Durban go tloga ka la 5 go fihla ka la 9 Phupu 2023.
","Shango ḽa Afrika Tshipembe ḽi dzhiela nṱha ṱhoḓisiso dza zwa vhulimi u itela mveledziso, nga maanḓa zwino musi hu na thaidzo ya tshanduko ya kilima na zwiṅwe zwithu zwine zwa kwama vhukoni ha shango ha u kona u swikela nḓisedzo ya zwiḽiwa, mveledziso ya ikonomi na mishumo.
",0.65737605
"FARA ke mokgatlo wa kontinente wo mogologolo wo o ikarabelago ka go nolofatša le go kgokaganya dinyakišišo tša temo le tšwelopele ya boitlhamelo ka kontinenteng.
","Khonifarentsi iyi i khou lavhelelwa uri i ḓo kunga vhurumelwa vhu swikaho 800 kha vunḓu ḽa KwaZulu-Natal na ḽa Gauteng, nahone hezwi zwi ḓo shela mulenzhe muhulwane vhukuma kha mishumo ya zwa ikonomi..Mafhungo a mbambadzo
",0.5920734
"Ka go swara tiragalo ye, Afrika Borwa e tla holega go tšwa go tirišano le tshomišano le ditheo tša temo le dinyakišišo tša kontinente ka go abelana ka mekgwa ye mekaone ka go saense ya temo le dinyakišišo.
","Khabinethe yo ṱanganedza muvhigo une wa sumbedza uri hu khou vha na u khwinifhadzea ha mbekanyamushumo ya zwa mbambadzo na u rengisela nnḓa ya ḽino shango.
",0.5916475
"Afrika Borwa e tšeela godimo dinyakišišo tša temo bakeng sa tlhabollo, kudukudu ka lebaka la phetogo ya klaemete le mabaka a mangwe ao a amago bokgoni bja naga bja go fihlelela tšhireletšo ya dijo, tlhabollo ya ekonomi le mešomo.
","Muvhigo wo sumbedzisa uri Afrika Tshipembe ḽo rengisela nnḓa thundu dza mutengo u swikaho R300 biḽioni kha mashango a 12, zwe hezwi zwa sika mishumo ya vhukuma i anganyelwaho henefha kha 57 300.
",0.6156303
"Khonferentshe ye e letetšwe go goketša baemedi ba 800 go ya KwaZulu-Natal le Gauteng, gomme se se tla tsenya letsogo mo mešomong ya ikonomi..Ditaba tša Kgwebišano
","U tholwa U tholwa hoṱhe hu ḓo khunyeledzwa nga murahu ha musi ho no khwaṱhisedzwa ndalukano khathihi na u ṱanzwa madzina ho teaho.
",0.44757175
"Kabinete e amogetše pego yeo e šupago dikaonafatšo ka lenaneong la kgwebišano le la diromelwantle la naga.
","Vho Bernard Scelo Duma sa Muthusa Mulangi Muhulu: Mashumele a Mivhuso Yapo na Thikhedzo kha Muhasho wa Tshumisano dza Mavhusele..Bodo ya Vhalangi vha Khoro ya Thekhinoḽodzhi ya Minerala
",0.49058914
"Pego e laeditše gore Afrika Borwa e rometše ntle dithoto tša boleng bja R300 pilione ya nakong ya 2022 go dinaga tše 12, go tšwetša pele mešomo ye e akanyetšwago go 57 300 ya thwii.
","Mufumakadzi Vho Ntombifuthi Zikalala-Mvelase (Muthusamudzulatshidulo vha khou tou dovha u tholwa hafhu )
",0.54111737
"Bao ba Thwetšwego Mošomong Go thwalwa mošomong ga batho ka moka go tla laolwa ke tiišetšo ya mangwalo a bona a dithuto le tumelelo ya maleba.
","Mufumakadzi Vho Pontsho Maruping (vha khou tou dovha u tholwa hafhu) Vho Rudolf Heydenrich (vha khou tou dovha u tholwa hafhu) Dokotela Vho Siyabonga Simayi Dokotela Vho Takalani Madzivhanḓila Mufumakadzi Vho Azwinndini Mavis Thomani Vho Livhuwani Nengovhela na Mufumakadzi Vho Faith Ntokozo Ngcwabe (Muhasho wa Zwiko zwa Minerala na muimeleli wa Fulufulu)..Bodo ya Vhalangi vha Khoro ya Saintsi ya Mupo
",0.29104012
"Morena Bernard Scelo Duma bjalo ka Motlatšamolaodipharephare: Mešomo ya Pušoselegae le Thekgo ka Kgorong ya Pušotirišano.
","Vho Kelepile Dintwe (Mudzulatshidulo) Vho Xolisa Mvinjelwa (Muthusamudzulatshidulo) Muambeli Vho Ntika Maake Dokotela Vho Mayshree Singh Dokotela Vho Siyanda Mngadi Dokotela Vho Ntombifuthi Nxumalo Mufumakadzi Vho Thobeka Njozela Vho Andries Moatshe Dokotela Vho Moloko Matlala Vho Mandla Malindisa
",0.36921293
"Boto ya Balaodi ya Lekgotla la Theknolotši ya Diminerale Mohumagadi Ntombifuthi Zikalala-Mvelase (Motlatšamodulasetulo ebile o thwetšwe leboelela)
","Dokotela Vho Mmboneni Muofhe na Vho Mosa Mabuza (CEO).
",0.70938015
"Mohumagadi Pontsho Maruping (o thwetšwe leboelela) MorenaRudolf Heydenrich (o thwetšwe leboelela) Ngaka Siyabonga Simayi Ngaka Takalani Madzivhandila Mohumagadi Azwinndini Mavis Thomani Morena Livhu Nengovhela le Mohumagadi Faith Ntokozo Ngcwabe (Moemedi wa Kgoro ya Methopo ya Diminerale le Enetši)..Boto ya Balaodi ya Lekgotla la Tšeosaense
","Milayotibe.
",0.48670745
"Morena Kelepile Dintwe (Modulasetulo) Morena Xolisa Mvinjelwa (Motlatšamodulasetulo) Moadfokeiti Ntika Maake Ngaka Mayshree Singh Ngaka Siyanda Mngadi Ngaka Ntombifuthi Nxumalo Mohumagadi Thobeka Njozela Morena Andries Moatshe Ngaka Moloko Matlala Morena Mandla Malindisa
","Mvetamveto ya Mulayotibe wa Khwiniso ya Khethekanyo ya Ṱhoḓisiso dza Mapholisa dzo Ḓiimisaho (IPID), ya ṅwaha wa 2023 Khabinethe yo ṱanganedza mvetamveto ya Mulayotibe wa Khwiniso ya IPID wa ṅwaha wa 2023 uri i rumelwe Phalamenndeni.
",0.78632796
"Ngaka Mmboneni Muofhe le Morena Mosa Mabuza (CEO).
","Mulayotibe uyu u khwinisa Mulayo wa IPID, wa ṅwaha wa 2011 (Mulayo 1 wa 2011), nahone wa dovha wa ṋetshedza makumedzwa o livhiswaho kha u khwaṱhisa zwa u ḓiimisa nga ndoṱhe ha tshiimiswa na kha mashumele a IPID, zwine hezwi zwa khwaṱhisedza izwo zwine zwa ḓivhiwa sa “McBride judgement”.
",0.61637056
"Melaokakanywa.
","Khwiniso idzi dzi dovha hafhu dza lavhelesa kha fhungo ḽe ḽa ambiwa nga Khothe ya Ndayotewa ye ya ḓivhadza uri dziṅwe mbetshelwa dza Mulayo wa IPID wa ṅwaha wa 2011 a dziho mulayoni, zwine hezwi zwa ṋea maanḓa Minisṱa vha Muhasho wa Mapholisa uri vha imise u shuma Mulangi Muhulu, vha dzhie maga a khaidzo kha Mulangi Muhulu nga murahu ha u imiswa hawe u shuma, khathihi na u pandela Mulangi Muhulu mushumoni.
",0.18214473
"Molaokakanywaphetošo wa Bolaodi bja Dinyakišišo tša Maphodisa bjo bo Ikemego (IPID) wa Sethalwa 2023.
","Mulayotibe u dzinginya uri hu vhe na maitele a re khagala nahone a pfalaho a u tholwa ha Mulangi Muhulu khathihi na maitele o fhelelaho nahone o itwaho nga vhuronwane hu tshi itelwa u kona u linga u fulufhedzea ha vhaofisiri vha IPIMulayotibe uyu u dovha hafhu wa ṋetshedza mbetshelwa ya u khwinifhadzwa ha dziṅwe mbetshelwa dza Mulayo Muhulwane, hu u itela uri IPID i kone u ita mushumo wayo nga nḓila yo fhelelaho nahone yavhuḓi.
",0.46062338
"Kabinete e amogetše sengwalwa sa Molaokakanywaphetošo wa IPID wa 2023 gore o romelwe Palamenteng.
","Iyi mvetamveto ya Mulayotibe i nga wanala kha webusaithi ya WEBTOKEMvetamveto ya Mulayotibe wa Khwiniso ya Milayo ya zwa Vhusevhi nga u Angaredza (GILAB) ya ṅwaha wa 2023 Khabinethe yo ṱanganedza mvetamveto ya GILAB ya ṅwaha wa 2023 u itela uri i kone u rumelwa Phalamenndeni.
",0.6682803
"Molaokakanywa wo o fetoša Molao wa IPID, 2011 (Molao wa 1 wa 2011), gomme o dira ditšhišinyo tšeo di lebanego le go tiišetša boipušo bja setheo le bja tshepedišo ya IPID, go fa maatla “kahlolo ya Kgorotsheko mo Molatong wa McBride”.
","GILAB i dzinginya uri hu vhe na khwiniso kha Mulayo wa Vhusevhi ha Maimo a Nṱha ha Lushaka, wa ṅwaha wa 1994 (Mulayo 39 wa 1994).
",0.54944813
"Diphetošo tše gape di šogana le ditaba tšeo di tšweleditšwego ke Kgorotsheko ya Molaotheo yeo e tsebagaditšego bjalo ka mabaka a itšego a Molao wa IPID wa 2011, wo o dumeletšego Tona ya Maphodisa go fega Molaodiphethiši, go tšea magato a kgalemo kgahlanong le Molaodiphethiši ka morago ga go fegwa, le go lebogiša Molaodiphethiši mošomo.
","Mulayotibe uyu u ṋea thendelo ya u thoma u shumiswa ha themendelo dza Phaneḽe ya Tsenguluso ya Maimo a Nṱha dza nga ha Zhendedzi ḽa Vhutsireledzi ha Shango (SSA) nga Phresidennde hu tshi katelwa na pulane dza u thoma u shumiswa ha themendelo dza Khomishini ya Ṱhoḓisiso ya zwa Vhulamukanyi kha Mavharivhari a Zwiito zwa u Dzhenelela ha Vhathu vha Nnḓa kha Muvhuso, Zwiito zwa Vhuaḓa na Vhufhura kha Sekhithara ya Muvhuso hu tshi katelwa na Zwiimiswa zwa Muvhuso.
",0.6004066
"Molaokakanywa wo o šišinya tshepetšo ye e lego pepeneneng le ye e bulegilego kudu ya go thwala Molaodiphethiši gape le Tshepetšo ka botlalo ebile e le ye e tseneletšego ya go dira diteko tša botshepegi tša bahlankedi ba IPIMolaokakanywa wo o tšwetša pele phetošo ya mabaka a mangwe a Molao wo Mogolo, go kgonthiša gore IPID e phethagatša taelo ya yona ka bokgoni le ka tshwanelo.
","Mulayotibe uyu u lingedza u:
",0.5102346
