src_text,tgt_text,cosine_score
"Cabinet welcomed the announcement by President Cyril Ramaphosa of the establishment of an independent inquiry to probe the allegations of the supply of weapons from South Africa to Russia.
","Budlelwane emkhatsini weNingizimu Afrika neMelika (i-US) Ikhabhinethi ibucinisekisile budlelwano emkhatsini weNingizimu Afrika neMelika kutsi busasebuhle, busacinile futsi bunenzuzo emva kwemhlangano weNdvuna Yetebudlelwane Bemave Emhlaba Nekubambisana, Dkt.
",0.68417364
"Details of the inquiry will be announced in due course.
","Naledi Pandor neLincusa laseNingizimu Afrika eMelika, Mnu Reuben E Brigety, mayelana nekuphawula lokutsiwa ukwentile watsi live laseNingizimu Afrika litfumelele live laseRashiya tikhali.
",0.41388983
"South Africa – Singapore relations
","Ikhabhinethi iphindze yakusho kutsi kunetindlela tebuncusa letimisiwe kuto tonkhe tive, lokufaka ekhatsi iMelika, tekuvakalisa tingcinamba nativuka elulawulweni kwebudlelwane emkhatsini wemave lamabili.
",0.44372743
"President Ramaphosa hosted Prime Minister Lee Hsien Loong of the Republic of Singapore on Tuesday, 16 May 2023.
","Ikhabhinethi isemukele simemetelo lesentiwe nguMengameli Cyril Ramaphosa sekusungula luphenyo lolutimele lwekuphenya letinsolo tekuphakela ngetikhali live laseRashiya yiNingizimu Afrika.
",0.63017535
"Singapore is a significant investor in South Africa, with investments totalling over R5 billion in sectors such as manufacturing, financial services and real estate.
","Imininingwane yaloluphenyo itawumenyetelwa khona madvute nje..Budlelwane beNingizimu Afrika neSingapore
",0.5679997
"Signed agreements between the two countries aim to strengthen trade, investment, education and defence cooperation..Western Cape District Development Model (DDM) Presidential Imbizo
","Mengameli Ramaphosa usingatse Ndvunankhulu Lee Hsien Loong waseRiphabhliki yaseSingapore ngaLesibili, mhla ti-16 Inkhwekhweti 2023.
",0.6132907
"President Ramaphosa undertook the sixth DDM Presidential Imbizo to the Western Cape, Drakenstein Local Municipality, Cape Winelands District, on Friday, 19 May 2023.
","Live laseSingapore lingumtjalitimali lomcoka lapha eNingizimu Afrika, litjale timali letingetulu kwetigidzigidzi le-R5 emikhakheni lefananako neyekwakha imphahla, yetetimali neyemhlaba netakhiwo.
",0.665704
"The President led a delegation from all three spheres of government under the theme: “Leave No One behind”.
","Tivumelwane letisayiniwe emkhatsini walamave lamabili kuhloswe ngato kucinisa kuhwebelana, lutjalomali, temfundvo kanye nekubambisana kutekuvikela..Imbizo yaMengameli eNshonalanga Kapa YeLuhlelo Lwekutfutfukiswa kweTigodzi (i-DDM) Mengameli Ramaphosa utsatse Imbizo yaMengameli i-DDM yesitfupha wayisa eNshonalanga Kapa, kuMasipala Wendzawo waseDrakenstein eSigodzini saseCape Winelands ngaLesihlanu, mhla ti-19 Inkhwekhweti 2023.
",0.5497908
"The Imbizo was preceded by the President’s visit to the nearby Vlakkeland Catalytic Human Settlement Development, which is the largest public housing development to date in the Drakenstein Local Municipality.
","Mengameli uhole litsimba lelivela kuyo yonkhe imikhakha lemitsatfu yahulumende ngaphasi kwengcikitsi letsi: “Ungashiyi Namunye Ngemuva”.
",0.61096156
"The development that commenced in 2017 will upon completion provide 2 556 houses to qualifying beneficiaries.
","LeMbizo yendulelwe kuvakashela kwaMengameli e-Vlakkeland Catalytic Human Settlement Development lesedvute, lokuyintfutfuko yetindlu yemmango lenkhulukati kute kube ngulamuhla lekuMasipala weNdzawo waseDrakenstein.
",0.60640633
"The construction of 942 houses in the First Phase is underway, with 454 completed and 301 under construction.
","Lentfutfuko leyacala ngemnyaka wa-2017 kutawutsi naseyiphotfuliwe inikete tindlu le-2 556 kulabo bazuzi labafanele.
",0.68380904
"The importance of this project is that it caters for a variety of housing options from those with an income of R0 to R3 500 (under Breaking New Ground), to Finance Linked Individual Subsidy Programme, for those earning between R3,501 and R22 000 per annum.
","Kwakhiwa kwetindlu letinge-942 eSigabeni Sekucala kuyachubeka, kodvwa letinge-454 setiphotfuliwe kwatsi letinge-301 tisakhiwa.
",0.6504926
"Both Social Housing opportunities as well as opportunities for Military Veterans are available in this project.
","Lokumcoka ngalomklamo kutsi unakekela tinhlobo letahlukahlukene tebantfu kusukela kulabo labahola R0 kuya ku-R3 500 (ngaphasi kweLuhlelo Lekuhlaliswa Kwebantfu), kusita ngeTetimali Luhlelo Lwelusitomali Loluchumene Nalowo Nalowo, kulabo labahola emkhatsini wa-R3 501 ne-R22 000 ngenyanga.
",0.5999476
"Oversight Visit to eThekwini Metropolitan Municipality and uMgungundlovu District Municipality on 18 and 19 May 2023.
","Omabili ematfuba eTindlu Tesibonelelo kanye nematfuba etindlu teTigayigayi Temphi akhona kulomklamo.
",0.6504173
"Deputy President Paul Mashatile engaged stakeholders in education and training, agriculture, commerce and industry during an oversight visit to the eThekwini Metropolitan Municipality and uMgungundlovu District Municipality as part of the DDM oversight visits.
","Luvakasho lwekuhlola umsebenti wahulumende lwekuya kuMasipala Wasedolobheni laseThekwini nakuMasipala weSigodzi saseMgungundlovu mhla ti-18 nangemhla ti-19 Inkhwekhweti 2023.
",0.72317165
"One of the key projects visited was the Ntshongweni Catalytic Project site, where a Smart City is being constructed between Durban and Pietermaritzburg.
","Lisekelamengameli Paul Mashatile ucocisane nalabatsintsekako kutemfundvo nekucecesha, kutekulima, kutemabhizinisi nakutetimboni ngesikhatsi saloluvakasho lwekuya kuMasipala waseDolobheni laseThekwini nakuMasipala weSigodzi saseMgungundlovu njengencenye yeluvakasho lwekuhlola umsebenti wahulumende weluhlelo lwe-DDYinye yemiklamo lemcoka levakashelwe kube yindzawo yase-Ntshongweni Catalytic Project, lapho kwakhiwa khona Lidolobhakati Lesimanjemanje emkhatsini weDurban nePietermaritzburg.
",0.76085424
"The project will revitalise economic activity in the area, contributing about R15 billion worth of investments in the next 10 to 15 years.
","Lomklamo utawuvusetela imisebenti yetemnotfo kulendzawo ufake ligalelo lelilinganiselwa kutigidzigidzi leti-R15 telutjalomali eminyakeni lelishumi nale-15 letako..Sakhiwonchanti semanti
",0.8679549
"Water infrastructure
","Mengameli Ramaphosa uvakashele i-Lesotho Highlands Water Project ngaLesibili, mhla tinge-23 Inkhwekhweti 2023 kulokuvakasha ubese utimbandzakanya emcimbini wekugala umhlaba lapho kutawucala kwakhiwe khona umklamo weSigaba.
",0.30929497
"President Ramaphosa visited the Lesotho Highlands Water Project on Tuesday, 23 May 2023 during which he participated in the sod-turning ceremony of Phase 2 of the project.
","Kwasayinwa iminyaka leminyenti leyengca futsi kwahlangabetana nekubambeleleka, ngako-ke lomcimbi ukhombise kuphutfunyiswa kwalomtamo lomcoka emkhatsini waletive letimbili.
",0.58944225
"Signed a number of years back and having faced delays, this ceremony signified the pacing up of this critical binational initiative.
","I-Lesotho Highlands Water Project imcoka ekucinisekiseni kutsi kuba nekuphakelwa kwemanti eGauteng, eFreystata, eMpumalanga, eNyakatfo Nshonalanga naseNyakatfo Kapa.
",0.56089795
"The Lesotho Highlands Water Project is critical in ensuring security of water supply in Gauteng, the Free State, Mpumalanga, North West and Northern Cape.
","Lutjalomali lolwentiwa kusakhiwonchanti semanti lwekuphakamisa timphilo tebantfu baseNingizimu Afrika luyachubeka nekwabiwa kwetigidzigidzi letingetulu kwe-R14 kubomasipala kute kulungiswe kusilela emuva kwesakhiwonchanti semanti, ngekusebentisa i-Regional Bulk Infrastructure Grant (i-RBIG) kanye ne-Water Services Infrastructure Grant (i-WSIG).
",0.7277088
"The investment in water infrastructure to uplift the lives of South Africans continues with the allocation of over R14 billion to municipalities to address water infrastructure backlogs, through the Regional Bulk Infrastructure Grant (RBIG) and the Water Services Infrastructure Grant (WSIG).
","I-RBIG itawusetjentiselwa kumiklamo le-130 bese kutsi i-WSIG yona yabelwe imiklamo lengetulu kwe-400 eveni lonkhana.
",0.6859571
"The RBIG will be spent on 130 projects and the WSIG will be allocated to over 400 projects across the country.
","Ikhabhinethi iphindze futsi yajabula kutsi Litiko Letemanti Nekuhanjiswa Kwendle selichubekele embili kakhulu ekulweni nenkhohlakalo ngobe tinkampani setibuyise cishe tigidzi leti-R600 lebetizuze ngekutfola emathenda langekho emtsetfweni.
",0.67013586
"Cabinet is also pleased that the Department of Water and Sanitation (DWS) is making strides in the fight against corruption with nearly R600 million repaid by companies who benefited from receiving irregular tenders.
","Ikhabhinethi iphindze futsi yatinaka netinyatselo tekulawula kuvikela litiko lelitibekile kute kucedvwe lusebentisomali lolungekho emtsetfweni, lolute inzuzo nalolusaphata timali.
",0.71217823
"Cabinet also noted the preventative control measures put in place by the department to eliminate irregular, fruitless and wasteful expenditure.
","Umklomelo Wesibonelelomali Sembuso
",0.39897883
"Social Security Award
","Live laseNingizimu Afrika liklonyeliswe ngeMkomela lohlonishwako Wekwenta Kahle Wenhlangano Yesibonelelomali Sembuso Yemave Emhlaba (i-SSA) kuSibonelelomali Sembuso lapha e-Afrika nga-2023, lokungumklomelo lonaka lutjalomali lolwentiwa nguhulumende etimphilweni tebantfwana, ikakhulu kulabo labavela emakhaya laphuyile nalahlaseleka lula.
",0.36737043
"South Africa has received the prestigious International Social Security Association (ISSA) Good Practice Award in Social Security for Africa 2023, which recognises government’s investment in the lives of our children, especially those from poor and vulnerable households.
","Umngenela weNingizimu Afrika kulomklomelo lohlonishwako bewunesihloko lesitsi: “Kwendlulisela kancane kancane sibonelelomali sembuso kubantfwana labahlaseleka lula: Indzaba Yesibonelelomali Semntfwana, eNingizimu Afrika.” Imingenela seyiyonkhe letfoliwe ibe 138 letfunyelwe ngemalunga lange-48 etikhungo temave ase-Afrika langetulu kwalange-30.
",0.73431355
"South Africa’s entry to this prestigious award was titled: “Gradual extension of social security coverage to vulnerable children: The case of the Child Support Grant, South Africa”.
","Lusito lwetfu kutenhlalo lusenhlitiyweni yeluhlelo lwahulumende lwekunciphisa buphuya futsi lumcoka kakhulu ekubuyiseni sitfunti sebantfu bakitsi.
",0.6465971
"A total of 138 entries were received from 48 member institutions in over 30 countries in Africa.
","Luhlelo lwekuvikela kutenhlalakahle lusemkhatsini waletinye tinhlelo letinkhulukati emhlabeni, lolunebazuzi labangetulu kwetigidzi leti-
",0.6261467
"Our social assistance is at the heart of government’s poverty alleviation programme and central to restoring the dignity of our people.
","Emavoti eSabelomali
",0.3082663
"South Africa’s social protection system is amongst the largest in the world, with more than 18 million beneficiaries..Budget Votes
","Ikhabhinethi ijabulile kutsi Emavoti eSabelomali ematiko ahulumende achubeka kahle kakhulu.
",0.57696295
"Cabinet is pleased that Budget Votes by government departments are progressing well.
","Ishejuli yeMavoti eSabelomali letako nemihlangano nebetindzaba:10.
",0.56796575
"The schedule of upcoming Budget Votes and supporting media briefings:.Friday 26 May 2023 at 13:00, the Minister of Cooperative Governance and Traditional Affairs (CoGTA), Ms Thembi Nkadimeng, will conduct a media briefing on the CoGTA Budget Vote which will outline measures aimed at strengthening the performance of municipalities..On Tuesday, 30 May 2023, the Minister of Social Development, Ms Lindiwe Zulu, and the Minister of Justice and Correctional Services, Mr Ronald Lamola, will hold their Budget Votes and details of their media briefings will be shared in due course.
","NgaLesihlanu mhla tinge-26 Inkhwekhweti 2023 ngensimbi ye-13:00, Indvuna Yetekubusa Ngekubambisana Netendzabuko (i-CoGTA), Mk Thembi Nkadimeng, utawubamba umhlangano nebetindzaba lomayelana neVoti yeSabelomali se-CoGTA lapho atawuchaza khona ngetinyatselo lokuhloswe ngato kucinisa kusebenta kwabomasipala..NgaLesibili, mhla tinge-30 Inkhwekhweti 2023, Indvuna Yetekutfutfukisa Tenhlalakahle, Mk Lindiwe Zulu, kanye neNdvuna Yetebulungiswa Nekulungiswa Kwesimilo, MnuRonald Lamola, batawubamba inkhulumomphikiswano yeMavoti eSabelomali kantsi imininingwane yemhlangano wabo nebetindzaba itawukhishwa khona madvute.
",0.89480793
"The Presidency’s Budget Vote will be tabled on Wednesday, 31 May 2023 and the media briefing on Progress with Structural Reforms and the Employment Initiatives coordinated through Operation Vulindlela will be held on Tuesday, 30 May 20
","Ivoti yeSabelomali saseHhovisi laMengameli itakwetfulwa ngaLesitsatfu, mhla tinge-31 Inkhwekhweti 2023 kantsi umhlangano nebetindzaba lomayelana neNchubekelembili neTingucuko Temumo neTichamkelo Tekucashwa letichumaniswe ngekusebentisa i-Operation Vulindlela itawubanjwa ngaLesibili, mhla tinge-30 Inkhwekhweti 20
",0.86049867
"Africa Day and the African Peer Review Mechanism (APRM) 20 year anniversary
","Lusuku Lwe-Afrika nemgubho weminyaka lenge-20 yeNchubo Yekubuyeketana Kwabalingani YaseAfrika (i-APRM) Ikhabhinethi kanye nabo bonkhe bantfu baseNingizimu Afrika bahlanganyela nelivekati lase-Afrika nemhlaba wonkhe kugubha Lusuku Lwase-Afrika ngaLesine, mhla tinge-25 Inkhwekhweti.
",0.7461256
"Cabinet and all South Africans join the African continent and the globe in celebrating Africa Day on Thursday, 25 May.
","Lomnyaka ubaluleke ngalokukhetsekile ngobe ngumnyaka wemgubho weminyaka lenge-60 wekusayina kwemculu wekusungulwa kweNhlangano Yelubumbano Lwe-Afrika, lihambambili leLubumbano Lwe-Afrika.
",0.64191264
"This year is particularly important as it marks the 60th anniversary of the signing of the founding charter of the Organisation of African Unity, the forerunner to the African Union.
","Ingcikitsi yemigubho ya-2023 – “Kufezekisa Ngekushesha Kwendzawo Yekuhweba Ngekukhululeka kuleLivekati lase-Afrika” – kwatisa tinyatselo lesetihanjiwe ekuchubeleni embili kusebenta kwendzawo yemhlaba lenkhulu yekuhweba ngekukhululeka.
",0.67664593
"The theme for the 2023 celebrations – “Acceleration of the African Continental Free Trade Area implementation” – acknowledges the strides being made in bringing into operation of the world’s largest free trade area.
","Kugujwa kweNyanga yase-Afrika lonyaka kwenteka ngesikhatsi sinye nemgubho weminyaka lenge-20 ye-APRM, lokuhloswe ngayo kukhutsata kubusa lokuhle kulelivekati ngekusebentisa kufundza kulamanye emave ngalokuhlelekile nangekutihlola tsine njengesive matfupha.
",0.7166362
"This year’s Africa Month commemoration coincides with the 20th anniversary of the APRM, which is aimed at fostering good governance in the continent through systematic peer learning and self-assessment.
","Tincumo Tekhabhinethi.
",0.2150709
"Cabinet decisions.
","Indzawo Yomnotfo Lokhetsekile (i-SEZ) yaseNamakwa
",0.44778275
"Namakwa Special Economic Zone (SEZ)
","Ikhabhinethi ikuvumile kucokwa kwe-Namakwa SEZ e-Aggeneys eNyakatfo Kapa.
",0.5956311
"Cabinet approved the designation of the Namakwa SEZ in Aggeneys in the Northern Cape.
","Lokucokwa kwentiwa ngekulandzela Umtsetfo Wetindzawo Teminotfo Lekhetsekile, wanga-2014 (Umtsetfo Nombolo 16 wanga-2014) kantsi le-SEZ lephakanyisiwe iyincenye yeMkankhaso WaMengameli Welutjalomali.
",0.6701978
"The proposed designation is done in terms of the Special Economic Zones Act, 2014 (Act 16 of 2014) and the proposed SEZ is part of the Presidential Investment Drive.
","Le-Namakwa SEZ itawuvula inzuzo kutemnotfo letawukhicitwa ngulemayini, kukhicitwa kwehayidrojini leluhlata, kutfutfukiswa kwesakhiwonchanti, emandla lavusetelelwako nemikhicito yetekulima lesetjentiwe.
",0.67341006
"The Namakwa SEZ will unlock mining beneficiation, production of green hydrogen, infrastructure development, renewable energy and agro-procession.
","Lemikhakha imcoka ekudaleni imisebenti nekutfutfukisa temnotfo eNyakatfo Kapa naseveni lonkhana.
",0.6503676
"These sectors are critical to job creation and economic development of the Northern Cape and the country.
","Lutjalomali lolungetulu kwetigidzigidzi letinge-R29 seluvele lubekelwe eceleni kutsi lusetjentiselwe sigaba sekucala se-SELoku kufaka ekhatsi iminikelo levela ku-Vedanta Zinc (tigidzigidzi le-R16), kubaka-Frontier Rare Earth (tigidzigidzi le-R13), kubaka-Hive Energy (tigidzi letinge-R200) nakubaka-RRS Trade and Investment (tigidzi leti-R100).
",0.637192
"More than R29 billion in investments has already been committed for phase one of the SEThese include commitments from Vedanta Zinc (R16 billion), Frontier Rare Earth (R13 billion), Hive Energy (R200 million) and RRS Trade and Investment (R100 million)..National Water Resource Strategy Third Edition (NWRS-3) 2023.
","Lushicilelo Lwesitsatfu lweLisubuciko Lavelonkhe Letemitfombolusito Yemanti (i-NWRS-3) langa-2023.
",0.72550094
"Cabinet approved the NWRS-3 2023 for implementation and the strategy is binding on all authorities and institutions implementing the National Water Act, 1998 (Act 36 of 1998).
","Ikhabhinethi iyivumile i-NWRS-3 yanga-2023 kutsi ifezekiswe nekutsi lelisubuciko liyababopha bonkhe labasemagunyeni netikhungo letifezekisa Umtsetfo Wavelonkhe Wetemanti, wanga-1998 (Umtsetfo Nombolo 36 wanga-1998).
",0.8949337
"This strategy is informed by a three-year review of the NWRS-2, which identified areas of success and areas that remain a challenge.
","Lelisubuciko lisita lubuyeketo lweminyaka lemitsatfu lwe-NWRS-2, lolukhona kubona tindzawo lapho kube nemphumelelo khona kanye netindzawo letisanetinsayeya.
",0.8541939
"The NWRS-3 comprises three thematic goals, that water and sanitation must support development, the elimination of poverty and inequality, contribute to the economy and job creation, and water must be protected, used, developed, managed and controlled sustainably and equitably.
","I-NWRS-3 yakhiwa tinjongo tengcikitsi letintsatfu, letitsi emanti nekuhanjiswa kwendle kufanele kutsi kwesekela intfufuko, kucedvwa kwebuphuya nekungalingani, kufaka ligalelo kutemnotfo nekudala imisebenti, futsi emanti kufanele kutsi avikelwe, asetjentiswe, entiwe ncono, alawulwe futsi aphatfwe ngendlela lesimeme nangekulingana.
",0.91910815
"This strategy makes tangible proposals for increasing water supply, reducing water demand, effective water and sanitation management, regulating the water and sanitation sector, redistributing water for transformation, promoting international cooperation, and managing water and sanitation under a changing climate.
","Lelisu lenta tiphakamiso letiphatsekako tekwandzisa kuphakelwa kwemanti, kunciphisa kufuneka kwemanti, kulawula ngemphumelelo kwemanti nekuhanjiswa kwendle, kulawula umkhakha wetemanti nekuhanjiswa kwendle, kusabalalisa emanti kute kube nengucuko, kukhutsata kubambisana kwemave emhlaba, kanye nekulawula emanti nekuhanjiswa kwendle ngaphasi kwesimomvama selitulu lesigucukako.
",0.89956224
"The NWRS-3 is published on the DWS website on WEBTOKEN..Report on measures implemented by the Department of Defence (DoD) to address the conduct and behaviour of South African National Defence Force (SANDF) members deployed in peace missions.
","I-NWRS-3 ishicilelwe kuwebhusayithi ye-DWS ku: WEBTOKEN..Umbiko ngeTinyatselo letifezekiswe Litiko Letekuvikela (i-DoD) kulungisa indlela yekutiphatsa kwemalunga eMbutfo Wavelonkhe waseNingizimu Afrika Wetekuvikela (i-SANDF) latfunyelwe etindzaweni tekugcina kuthula
",0.89023054
"Cabinet received a report on progress South Africa is making to address the conduct of some of the members of the SANDF deployed in peace-keeping missions across the continent.
","Ikhabhinethi itfole umbiko lomayelana nenchubekelembili iNingizimu Afrika leyentako kulungisa indlela yekutiphatsa kwalamanye emalunga e-SANDF latfunyelwe kugcina kuthula evenikati lonkhana.
",0.859866
"The SANDF has been a source of national pride as it participates in peacekeeping missions on the continent to secure stability and peace in war torn African nations under the auspices of the United Nations (UN).
","I-SANDF beyingumtfombo weligcabho lavelonkhe nayitimbandzakanya kumikhankhaso yekugcina kuthula kulelivekati kute kube nekusimama nekuthula etiveni tase-Afrika letihlaselwe timphi ngaphasi kweligama laMhlabuhlangene (i-UN).
",0.862813
"With allegations of sexual offences involving military peacekeepers surfacing in 2015, a Ministerial Task Team was established in 2019 to investigate cases of sexual exploitation and abuse (SEA) within the DoCabinet is pleased by the set of measures that have been put in place to address the incidents of SEA in the SANDF peace keeping missions.
","Njengaloku kwaba netinsolo temacala etemacansi letimbandzakanya bagcini bekuthula betemphi letavumbuka nga-2015, Licembu Letindvuna Lemsebenti lasungulwa nga-2019 kutsi liphenye lamacala ekuchashatwa nekuhlukunyetwa ngekwemacansi (i-SEA) ekhatsi ku-DoIkhabhinethi kuyayijabulisa kubona tinyatselo letentiwe tekulungisa tehlakalo te-SEA ku-SANDF yekugcina kuthula.
",0.8979167
"The UN recognises South Africa as best practices and had commended the country for the progress it has made to stamping out SEA in the SANDCabinet emphasised that the practice of SEA will not be allowed to tarnish the good record of the SANDF on the continent..2023 Youth Month Cabinet approved the 2023 Youth Month Programme under the theme: “Accelerating youth economic emancipation for a sustainable future”.
","Mhlabuhlangene ubona kutsi lolokwentiwa live laseNingizimu Afrika kuyintfo lenhle kakhulu futsi ulidvumisile ngenchubekelembili leseliyentile kususa netimphandle kuchashatwa nekuhlukunyetwa ngekwemacansi (i-SEA) ku-SANDIkhabhinethi igcizelele kutsi umkhuba we-SEA ngeke uvunyelwe kutsi ungcolise lirekhodi lelihle le-SANDF kulelivekati.
",0.80794185
"Deputy President Mashatile will address the National Day which will this year be celebrated over a two day period from 16 to 17 June 2023 at the Mangaung Outdoor Sport Centre, Mangaung, Bloemfontein, in the Free State.
","Inyanga yeLusha yanga-2023 Ikhabhinethi iluvumile Luhlelo Lwenyanga Yelusha yanga-2023 ngaphasi kwengcikitsi letsi: “Kukhululwa ngekushesha kwelusha ngekwetemnotfo kute kube nelikusasa lelisimeme”.
",0.69692326
"Over the two days, there will be the opportunity for youth to participate in dialogues with Ministers, Deputy Ministers and other stakeholders on various training, entrepreneurial and developmental opportunities available within government and social partners.
","Lisekelamengameli Mashatile utawukhuluma ngaleLinga Lavelonkhe lonyaka lelitawugujwa tinsuku letimbili kusukela mhla ti-16 kuya mhla ti-17 Inhlaba 2023 lapha eMangaung Outdoor Sport Centre, eMangaung, eBloemfontein, eFreystata.
",0.69103265
"Youth Month will be launched on Thursday, 1 June by the Minister in The Presidency for Women, Youth and Persons with Disabilities, Dr Nkosazana Dlamini Zuma at the Hector Pieterson Memorial and Museum in Soweto.
","Kulamalanga lamabili, kutawuba nelitfuba lapho lusha lutawucocisana khona neTindvuna, Emasekela eTindvuna kanye nalabanye labatsintsekako mayelana nematfuba lahlukahlukene ekuceceshwa, etemabhizinisi newetekutfutfuka lakhona kuhulumende kanye nakubalingani betenhlalo.
",0.67052007
"Cabinet urged society to intensify efforts to ensure young people access opportunities which allow them to enter active participation in the economy.
","Inyanga Yelusha itakwetfulwa ngaLesine, mhla ti-1 Inhlaba yiNdvuna yaseHhovisi laMengameli Letabomake, Lusha Nebantfu Labaphila Nekukhubateka, Dkt.
",0.626372
"Government, as the largest employer, has responded to the need for skills development and youth employment by enabling unemployed graduates to gain experience through the Public Service Graduate Internship and Learnership Programme.
","Nkosazana Dlamini Zuma e-Hector Pieterson Memorial and Museum eSoweto.
",0.5590213
"Government is also implementing the Social Employment Fund (SEF) and revitalised National Youth Service (NYS) job-creation initiatives that draw thousands of young people into the economy.
","Ikhabhinethi ikhutsata kakhulu ummango kutsi ucinise imitamo yekucinisekisa kutsi bantfu labasha bafinyelela kutfola ematfuba labavumela kutsi batimbandzakanye ngemfutfo kutemnotfo.5 Hulumende, njengemcashi lomkhulu, uphendvulile esidzingweni sekutfutfukisa emakhono nekucasha bantfu labasha ngekwenta kutsi labaneticu temfundvo labangasebenti kutsi batfole lwati lwemsebenti ngekusebentisa luhlelo lweKufundza Ngekwenta Emsebentini Kwalabaneticu neLuhlelo Lwekufundza Ngekwenta Emsebentini i-Public Service Graduate Internship and Learnership Programme.
",0.7212166
"The Presidential Youth Employment Intervention has already successfully supported access to 934 563 temporary earning opportunities for young people across the country.
","Hulumende uphindze futsi afezekise Sikhwama Setenhlalo Sekucasha (i-SEF) kanye netichamukelo tekudala umsebenti letivusetelwe teMisebenti Yelusha Yavelonkhe leheha tinkhulungwane tebantfu labasha kutsi bangene kutemnotfo.
",0.7188219
"As we enter Youth Month, government reminds young people to join over million of their compatriots and register on the WEBTOKEN platform to access a wide range of learning and earning opportunities.
","Singenelelo saMengameli Sekucashwa Kwelusha sesivele sesekele ngemphumelelo tigidzi le-1.5 tekuhola kwesikhashana, sigidzi sinye salababekwe emsebentini, ematfuba ekufundza lange-250 000 lahlanganisa kusebenta nekufundza ematfuba emsebenti lokhokhelwako lange-250 000 kanye nebantfu labasha labange-500 000 labangene ematfubeni lasimeme ekuhola.
",0.7425094
