src_text,tgt_text,cosine_score
"Ge magato a a tšwelapele, badudi ba Hammanskraal ba hlohleletšwa gore ba bediše meetse a dipompi le go tšhela letswatšana pele ba a nwa.
","Ngaphezu kwalokhu, noma ngubani ohanjiswa yisisu, ukucanuzela kwenhliziyo noma izimpawu zokuphathwa isisu kufanele avakashele udokotela wakhe ngokushesha noma umtholampilo wendawo.
",0.694134
"Go tlaleletša, mang le mang yo a nago le letšhollo, go sellega goba dika tša go longwa ke mala o swanetše go ya ngakeng ya gagwe goba kliniking ya tikologo ka pela.
","UNgqongqoshe Wamanzi Nokuthuthwa Kwendle, uMnu Senzo Mchunu, uzohlangana noSodolobha weDolobha lase-Tshwane u-Cllr Cilliers Brink, ngoLwesihlanu mhla wama-26 kuNhlaba 2023 emzamweni wokuqhamuka nesu elihlanganyelwe lokulungiswa osekudlulelwe isikhathi kwe-Rooiwal WWTNgemininingwane ethe xaxa ungashayela inombolo ephuthumayo esebenza ubusuku nemini yeSikhungo Sikazwelonke Sezifo Ezithelelanayo (i-NICD) ku-082 883 9920.
",0.6887626
"Tona ya Meetse le Kelelatšhila, Morena Senzo Mchunu, o tla kopana le Meyara wa Toropokgolo ya Tshwane, Mokhanselara Cilliers Brink, ka Labohlano la di 26 Mopitlo 2023 ka maiteko a go tšweletša leano la mohlakanelwa la tsošološo ya WWTW ya Rooiwal yeo e šaletšego morago.
","Imihlahlandlela yokwelashwa kwesifo sohudo itholakala ngobuchwepheshe WEBTOKEUCwaningo Lwekota Lwabasebenzi (i-QLFS)
",0.67351687
"Go hwetša tshedimošo ka botlalo o ka leletša mogala wo o šomago bošego le mosegare wa Setheo sa Bosetšhaba sa Malwetši a Fetelago (NICD) go 082 883 9920.
","IKhabhinethi ligqugquzelwa ukuthi i-QLFS yokuqala yangowezi-2023 ibonise ukukhula ngekota okulandelanayo kwenani lemisebenzi kanye nokuqashwa kwabantu abayizigidi eziyi-16.2 kusondela kancane kwinani eliyizigidi eziyi-16.4 labantu abaqashwa ngaphambi kwezinsuku zokuhlasela kwegciwane le-Corona (i-COVID-19).
",0.7260044
"Melawana ya kalafo ya kholera e ka hwetšwa inthaneteng go WEBTOKEDinyakišišo tša Kotara ya Bašomi (QLFS)
","Lokhu kucacisa bha ukuthi umnotho waseNingizimu Afrika ululama ngokuqinile kwimiphumela yalolu bhubhane.
",0.53813994
"Kabinete e hlohleletšwa ke gore QLFS ya mathomo ya 2023 e laeditše koketšego ya botshelela ka go latelana ya kotara ya palo ya mešomo le gore mešomo ya batho ba milione e batamela kgauswi le batho ba milione bao ba thwetšwego ka matšatšing a pele ga Coronavirus (COVID-19).
","Izibalo zemisebenzi zekota yokuqala zibonisa imisebenzi eyizi-209 000 eyasungulwa kumkhakha ohlelekile kanye nemisebenzi eyizi-107 000 kumkhakha ongahlelekile ngesikhathi sekota yokuqala yonyaka..Ubudlelwano beNingizimu Afrika ne-United States (i-US) IKhabhinethi likuqinisekisile ukuthi ubudlelwano phakathi kweNingizimu Afrika ne-US busalokhu bubuhle, buqinile futhi womabili amazwe ayazuza kubona kulandela umhlangano phakathi kukaNgqongqoshe Wezobudlelwano Bamazwe Ngamazwe Nokubambisana, uDkt Naledi Pandor kanye neNxusa lase-US eliseNingizimu Afrika, uMnu Reuben E Brigety, emva kwezinsolo zakhe zokuthi iNingizimu Afrika inikeze i-Russia izikhali.
",0.76954466
"Se ke sešupo se se kwagalago sa gore ikonomi ya Afrika Borwa e kaonafala go tšwa go khuetšo ya leuba leo.
","IKhabhinethi liphinde lagcizelela ukuthi izindlela ezisunguliwe zokuxhumana zamanxusa azo zonke izizwe zikhona, kubandakanya i-US, ukuzwakalisa izinkinga uma ziqubuka ekuphathweni kobudlelwano phakathi kwala mazwe womabili.
",0.63991725
"Dipalopalo tša mešomo ya kotara ya mathomo di laetša gore mešomo ye 209 000 e hlotšwe ka lekaleng la semmušo gomme mešomo ye 107 000 ka lekaleng leo e sego la semmušo mo kotareng ya mathomo ya ngwaga.
","IKhabhinethi lamukele isimemezelo sikaMongameli u-Cyril Ramaphosa sokusungulwa kophenyo oluzimele oluzohlolisisa izinsolo zokuthi kwahanjiswa izikhali zisuka eNingizimu Afrika ziya e-Russia.
",0.64604986
"Dikamano tša Afrika Borwa le United States (US)
","Imininingwane yalolu phenyo izomenyezelwa ngokuhamba kwesikhathi..Ubudlelwano beNingizimu Afrika ne-Singapore
",0.56747293
"Kabinete e netefaditše gore dikamano gare ga Afrika Borwa le US ke ye botse, e tiile ebile e hola dinaga ka bobedi morago ga kopano gare ga Tona ya Dikamano tša Boditšhabatšhaba le Tirišano, Ngaka Naledi Pandor le Motseta wa Amerika ka Afrika Borwa, Morena Reuben E Brigety, ka ga dipolelo tša gagwe tša go latofatša gore Borwa Afrika e abetše Russia dibetša.
","UMongameli u-Ramaphosa usingathe uNgqongqoshe Wezwe u-Lee Hsien Loong weRiphabhulikhi yase-Singapore ngoLwesibili, mhla we-16 kuNhlaba 2023.
",0.7117258
"Kabinete e boeleditše gore dikanale tša botseta tše di tiiletšeng di hwetšagala ditšhabeng ka moka, go akaretšwa US, go hlagiša ditaba ge di tšwelela ka taolong ya dikamano tša dinagamaloko tše pedi.
","Izwe lase-Singapore lingabatshalizimali abakhulu eNingizimu Afrika, nasebetshale izimali zenani eliphelele elingaphezu kwezigidigidi ezi-R5 emikhakheni efana neyokukhiqiza, izinsizakalo zezimali kanye nokuthengiswa kwezindlu.
",0.71516865
"Kabinete e amogetše tsebišo ya Mopresidente Cyril Ramaphosa ya go hlongwa ga nyakišišo ye e ikemetšego go nyakišiša ditatofatšo tša kabo ya dibetša go tšwa Afrika Borwa go ya Russia.
","Izivumelwano ezisayiniwe phakathi kwamazwe womabili zihlose ukuqinisa uhwebo, utshalomali, ezemfundo kanye nokubambisana kwezokuvikeleka..IMbizo kaMongameli yoHlelo Lokuthuthukiswa Kwezifunda (i-DDM) eNtshonalanga Kapa
",0.7214059
"Dintlha ka botlalo tša nyakišišo di tla tsebagatšwa ka nako ye e swanetšego.
","UMongameli u-Ramaphosa ubambe iMbizo kaMongameli ye-DDM yesithupha eNtshonalanga Kapa, kuMasipala Wendawo i-Drakenstein, kwiSifunda sase-Cape Winelands, ngoLwesihlanu ziyi-19 kuNhlaba 2023.
",0.41036266
"Dikamano tša Afrika Borwa le Singapore
","UMongameli uhole ithimba eliphuma kuzo zontathu izinhlaka zikahulumeni ngaphansi kwesiqubulo esithi: “Asishiyi Muntu Ngemuva”.
",0.25303966
"Mopresidente Ramaphosa o amogetše Tonakgolo Lee Hsien Loong wa Repabliki ya Singapore ka Labobedi, la 16 Mopitlo 2023.
","IMbizo yandulelwa uhambo lukaMongameli lokuvakashela lapho kwakhiwa khona indawo yokuhlalisa abantu eseduze i-Vlakkeland Catalytic Human Settlement Development, okuluhlelo olukhulu lokwakhiwa kwezindlu zomphakathi olwake lwaba khona kuze kube manje kuMasipala Wendawo i-Drakenstein.
",0.68132746
"Singapore ke mmeeletši yo bohlokwa ka Afrika Borwa, ka dipeeletšo tša palomoka ya go feta R5 pilione ka makaleng a go swana le tšweletšo, ditirelo tša ditšhelete le thekišo ya dithoto.
","Ukwakhiwa okwaqala ngowezi-2017 kuzothi kungaphothulwa bese kuhlinzeka ngezindlu eziyi-2 556 kulabo abafanelekile.
",0.6362642
"Ditumelelano tše di saennwego gare ga dinaga tše pedi di ikemišeditše go matlafatša kgwebišano, peeletšo, tšhomišano ya thuto le tšhireletšo..Imbizo ya Mopresidente ya Mmotlolo wa Tlhabollo ya Selete sa Kapa Bodikela (DDM) Mopresidente Ramaphosa o swere Imbizo ya Mopresidente ya botshelela ya DDM go la Kapa Bodikela, Mmasepaleng wa Selegae wa Drakenstein, Seleteng sa Cape Winelands, ka Labohlano, la 19 Mopitlo 2023.
","Ukwakhiwa kwezindlu ezingama-942 kweSigaba Sokuqala kuyaqhubeka, okuyizindlu ezingama-454 eseziphothuliwe kanye nezingama-301 ezisakhiwa.
",0.6100146
"Mopresidente o etile pele kemedi go tšwa maemong ka moka a mararo a mmušo ka fase ga kgwekgwe ye: “Se tlogele motho morago”.
","Ukubaluleka kwalo mklamo ukuthi ubhekelela izinhlelo zezindlu ezehlukahlukene kusuka kulabo abahola i-R0 kuya kwizi-R3 500 (ngaphansi KoHlelo Oludidiyelwe Lokuhlaliswa Kwabantu), kuya kulabo abasoHlelweni Lokuxhaswa Ngezimali Zokuthenga Indlu, labo abahola phakathi kwezi-R3 501 kuya kwizi-R22 000 ngenyanga.
",0.6524179
"Imbizo e etilwe pele ke ketelo ya Mopresidente go Tlhabollo ya Bodulo bja Batho Bjo bo Kopanyago bja Vlakkeland ya kgauswi, yeo e lego tlhabollo ye kgolo ya dintlo tša setšhaba go fihla ga bjale ka Mmasepaleng wa Selegae wa Drakenstein.
","Womabili amathuba Ezindlu Zomphakathi kanjalo namathuba ezindlu Zomakadebona Bezempi akhona kulo mklamo..UHambo Lokuyohlola Umsebenzi kuMasipala Wedolobha laseThekwini kanye noMasipala Wesifunda saseMgungundlovu mhla we-18 nomhla we-19 kuNhlaba 2023.
",0.7792591
"Tlhabollo yeo e thomilego ka 2017 ge e phethilwe e tla fa baholegi ba ba kgotsofatšago dinyakwa dintlo tše 2 556.
","IPhini likaMongameli u-Paul Mashatile uxoxisane nababambiqhaza kwezemfundo nokuqeqeshwa, ezolimo, ezentengiselwano kanye nezimboni ngesikhathi sohambo lokuyohlola umsebenzi kuMasipala Wedolobha laseThekwini kanye noMasipala Wesifunda saseMgungundlovu njengengxenye yokuhambela ukuhlola imisebenzi ye-DDEnye yemiklamo ehamba phambili evakashelwe kube yindawo okwakhiwa kuyona i-Ntshongweni Catalytic Project, lapho okwakhiwa khona iDolobha Lesimanjemanje phakathi kweTheku noMgungundlovu.
",0.5717315
"Kago ya dintlo tše 942 mo Kgatong ya Pele e a tšwela pele, dintlo tše 454 di phethilwe gomme tše 301 di sa agwa.
","Lo mklamo uzovuselela imisebenzi efukula umnotho endaweni, nokufaka igalelo lotshalomali olubiza izigidigidi ezi-R15 eminyakeni eyi-10 kuya kweyi-15 ezayo..Ingqalasizinda yamanzi
",0.6511103
"Bohlokwa bja protšeke ye ke gore e hlokomela dikgetho tša dintlo tša go fapafapana go tloga go bao ba nago le letseno la R0 go ya go R3 500 (ka fase ga Breaking New Ground), go fihla go Lenaneo la Thušo ya Motho ka Noši leo le Kgokagantšwego ka Tšhelete, go bao ba hwetšago mogolo wa gare ga R3 501 le R22 000 ka ngwaga.
","UMongameli U-Ramaphosa uvakashele umklamo i-Lesotho Highlands Water Project ngoLwesibili, mhla wama-23 kuNhlaba 2023 lapho abe yingxenye womcimbi wokuphendulwa kwesoyi leSigaba Sesibili somklamo.
",0.70187277
"Bobedi menyetla ya Dintlo tša Leago gammogo le menyetla ya Bagale ba Sešole di gona ka gare ga protšeke ye.
","Lo mklamo owasayinwa eminyakeni eminingi eyadlula futhi wabambezeleka, lo mcimbi ubonisa ukubaluleka kokusheshiswa kwalo msebenzi obalulekile wala mazwe womabili.
",0.69699824
"Ketelo ya Tlhokomedišo go Mmasepala wa Metropholithene wa eThekwini le Mmasepala wa Selete wa uMgungundlovu ka la 18 le la 19 Mopitlo 2023.
","Umklamo i-Lesotho Highlands Water Project ubaluleke kakhulu ekuqinisekiseni ukutholakala kwamanzi e-Gauteng, eFreyistata, eMpumalanga, eNyakatho Ntshonalanga naseNyakatho Kapa.
",0.72301984
"Motlatšamopresidente Paul Mashatile o boledišane le bakgathatema thutong le tlhahlong, temong, kgwebong le intastering nakong ya ketelo ya tlhokomedišo go Mmasepala wa Metropholithene wa eThekwini le Mmasepala wa Selete wa uMgungundlovu bjalo ka karolo ya diketelo tša tlhokomelo ya DDE nngwe ya diprotšeke tše bohlokwa tšeo di etetšwego e bile lefelo la Protšeke ya Catalytic ya Ntshongweni, moo go agwago Smart City gare ga Durban le Pietermaritzburg.
","Ukutshalwa kwezimali kwingqalasizinda yamanzi ukuze kuzothuthukiswa izimpilo zabantu baseNingizimu Afrika kuyaqhubeka njengoba kwatshelwe omasipala imali engaphezu kwezigidigidi ezi-R14 ukuthi babhekana nenkinga yokusilela emuva kwingqalasizinda yamanzi, ngokusebenzisa iSibonelelo Sengqalasizinda Yezifunda (i-RBIG) kanye neSibonelelo Sengqalasizinda Yezinsizakalo Zamanzi (i-WSIG).
",0.7345619
"Protšeke ye e tla tsošološa ikonomi ka lefelong leo, go ba le seabe go dipeeletšo tša boleng bja R15 pilione mo mengwageng ye 10 go ya go ye 15 ye e tlago.
","I-RBIG izosetshenziswa kwimiklamo eyi-130 bese kuthi i-WSIG yona izofakwa kwimiklamo engama-400 kulolonke izwe.
",0.73509395
"Mananeokgoparara a Meetse
","IKhabhinethi liphinde lathokozela ukuthi uMnyango Wamanzi Nokuthuthwa Kwendle (i-DWS) uthatha amagxathu ekulweni nenkohlakalo njengoba usuthole cishe izigidi ezingama-R600 ezikhokhwe yizinkampani ezazuza ngokuthola amathenda ngokungekho emthethweni.
",0.37741095
"Mopresidente Ramaphosa o etetše Protšeke ya Meetse ya Dinagagodimo tša Lesotho ka Labobedi, 23 Mopitlo 2023 yeo a tšerego karolo moletlong wa yona wa go ribolla lekwate wa Kgato ya 2 ya protšeke.
","IKhabhinethi liphinde laziphawula izinyathelo zokulawula ezibekwe ngumnyango zokuqeda ukusetshenziswa kwezimali okungahambisani nomthetho, okungenasidingo nokumoshayo.
",0.5656123
"Bjalo ka ge o saenetšwe mengwaga ye mmalwa ye e fetilego le go diegišwa, moletlo wo o laeditše tšwelopele ya maitapišo a a bohlokwa a dinaga tše pedi.
","Indondo Yezokuvikeleka Komphakathi
",0.3950886
"Protšeke ya Meetse ya dinagagodimo tsa Lesotho e bohlokwa kudu mo go kgonthišeng polokego ya kabo ya meetse ka Gauteng, Freistata, Mpumalanga, Leboa Bodikela le Kapa Leboa.
","INingizimu Afrika ithole iNdondo Yomsebenzi Omuhle kwezoKuvikeleka Komphakathi e-Afrika ngowezi-2023 yeNhlangano Yamazwe Ngamazwe Kwezokuvikeleka Komphakathi (i-ISSA), ebonisa ukubonga ukuzinikela kukahulumeni ezimpilweni zabantwana bethu, ikakhulukazi labo abaphuma emakhaya adla imbuya ngothi futhi abuthakathaka.
",0.6798283
"Peeletšo ya mananeokgoparara a meetse go kaonafatša maphelo a Maafrika Borwa e tšwela pele ka kabo ya go feta R14 pilione go mebasepala go rarolla tshalelonthago ya kabo ya maneokgoparara a meetse, ka Thušo ya Mananeokgoparara a Magolo a Selete (RBIG) le Thušo ya Mananeokgoparara a Ditirelo tša Meetse (WSIG).
","Isicelo sokungenela ukuthola le ndondo seNingizimu Afrika sasinesihloko esithi: “Ukwandiswa kancane kancane kokuvikeleka kwenhlalo yabantwana ababuthakathaka: Udaba lweSibonelelo Sabantwana, eNingizimu Afrika”.
",0.76241577
"RBIG e tla šomišwa go diprotšeke tše 130 gomme WSIG e tla abelwa diprotšeke tša go feta 400 nageng ka bophara.
","Inani eliphelele lezicelo zokungenela ezamukelwa zazisuka ezikhungweni ezingamalungu ezingama-48 emazweni angaphezu kwama-30 e-Afrika.
",0.7060985
"Gape kabinete e kgotsofaditšwe ke gore Kgoro ya Meetse le Kelelatšhila (DWS) e gatela pele mo twantšhong ya bomenetša ka go lefelwa ga tšhelete ye e nyakileng go ba R600 milione ke dikhamphani tšeo di holegilego go tšwa kamogelong ya dithendara tša go se sepetšwe ka tshwanelo.
","Izibonelelo zethu zomphakathi zingummongo wohlelo lukahulumeni lokuqeda ububha futhi zingumnyombo wokubuyisa isithunzi sabantu bakithi.
",0.6371664
"Kabinete e lemogile gape magato a taolo ya thibelo ao a beilwego ke kgoro go fediša ditshenyegelo tše di sa sepetswego ka tshwanelo, tša tshenyo.
","Uhlelo lweNingizimu Afrika lokuvikela umphakathi luphakathi kwezinhlelo ezinkulukazi emhlabeni, njengoba lunabantu abangaphezu kwezigidi eziyi-18 abahlomula kulona..Amavoti Ezabelomali
",0.5842576
"Sefoka sa Tšhireletšo ya Leago
","IKhabhinethi liyathokoza ukuthi amaVoti Ezabelomali eminyango kahulumeni aqhubeka kahle.
",0.40729353
"Afrika Borwa e amogetše Sefoka sa Mekgwa ye Mebotse ya Mokgatlo wa Boditšhabatšhaba wa Tšhireletšo ya Leago (ISSA) ka go Tšhireletšo ya Leago ya Afrika 2023, seo se amogelago peeletšo ya mmušo maphelong a bana ba rena, kudu bao ba tšwago malapeng a bohloki le ao a lego kotsing.
","Uhlelo lwamaVoti Ezabelomali azayo kanye nezithangami zabezindaba:.NgoLwesihlanu mhla wama-26 kuNhlaba 2023 ngehora le-13:00, uNgqongqoshe Wezokubusa Ngokubambisana Nezindaba Zendabuko (i-CoGTA), uNks Thembi Nkadimeng, uzobamba isithangami sabezindaba mayelana neVoti leSabelomali elizocacisa izinyathelo okuhloswe ngazo ukuqinisa ukusebenza komasipala..NgoLwesibili, mhla wama-30 kuNhlaba 2023, uNgqongqoshe Wezokuthuthukiswa Komphakathi, uNks Lindiwe Zulu, kanye noNgqongqoshe Wezobulungiswa Nokuhlunyeleliswa Kwezimilo, uMnu Ronald Lamola, bazoba namaVoti Ezabelomali kanti imininingwane yezithangami zabezindaba izokhishwa ngokuhamba kwesikhathi..IVoti Lesabelomali leHhovisi likaMongameli lizokwethulwa ngoLwesithathu, mhla wama-31 kuNhlaba 2023 kanti isithangami sabezindaba ngeNqubekelaphambili Yezinguquko Zezakhiwo kanye Nemizamo Yokusungula Imisebenzi ehlanganiswa ngohlelo lwe-Operation Vulindlela sizoba ngoLwesibili, mhla wama-30 kuNhlaba 20
",0.7291107
"Kgopelo ya Afrika Borwa sefokeng se sa maemo a godimo e be e bitšwa: “Katološo ya kakaretšo ya tšhireletšo ya leago ka go nanya go bana bao ba lego kotsing: Taba ya Thušo ya Thekgo ya Bana, Afrika Borwa”.
","USuku Lwe-Afrika kanye nokubungaza iminyaka engama-20 yeNdlela Yokuhlolana Kwamazwe ase-Afrika (i-APRM)
",0.62437665
"Palomoka ya dikgopelo tše 138 di amogetšwe go tšwa go ditheo tše 48 tša maloko dinageng tša go feta tše 30 ka Afrika.
","IKhabhinethi nabobonke abantu baseNingizimu Afrika bahlanganyele nezwekazi lase-Afrika nomhlaba wonke ukubungaza uSuku lwe-Afrika ngoLwesine, mhla wama-25 kuNhlaba.
",0.61484504
"Thušo ya rena ya leago ke lenaneo la bohlokwa la mmušo la phokotšo ya bohloki ebile le bohlokwa pušetšong ya seriti go batho ba gabo rena.
","Lo nyaka ubalulekile ikakhulukazi njengoba uluphawu lokuphela kweminyaka engama-60 kwasayinwa isisekelo somqulu weNhlangano Yobumbano Lwamazwe ase-Afrika, eyandulela uBumbano Lwamazwe Ase-Afrika.
",0.6856657
"Mokgwa wa tšhireletšo ya leago wa Afrika Borwa o magareng ga a mangwe a magologolo lefaseng, ka bathušegi ba go feta 18 milione..Dibouto tša Tekanyetšo
","Isiqubulo semibungazo yangowezi-2023 esithi - “Ukusheshisa Ukuqaliswa Kokuhwebelana Ngaphandle Kokukhokha Intela Kwamazwe Asezwenikazini i-Afrika” – sibonisa amagxathu athathwayo ekuqaliseni ukusebenza kwale nkundla yokuhweba enkulukazi emhlabeni.
",0.70336294
"Kabinete e kgotsofatšwa ke gore Dibouto tša Tekanyetšo ka dikgoro tša mmušo di tšwela pele gabotse.
","Umbungazo weNyanga ye-Afrika wakulo nyaka uqondane nokuphela kweminyaka engama-20 ye-APRM, okuhloswe ngako ukuqinisa ukubusa kahle ezwenikazini ngokulandela izindlela zokuthi izwe lifunde kwelinye izwe futhi aphinde ahlolane wona.
",0.6669201
"Ka fase ke Lenaneo la Dibouto tša Tekanyetšo tše di tlago le dikopano tša boraditaba tša thekgo:.Labohlano la 26 Mopitlo 2023 ka 13:00, Tona ya Pušotirišano le Merero ya Setšo (CoGTA), Mohumagadi Thembi Nkadimeng, o tla swara kopano ya boraditaba ka ga Bouto ya Tekanyetšo ya CoGTA yeo e tlago hlaloša magato ao a lebanego le go matlafatša tshepedišo ya mebasepala..Ka Labobedi, la 30 Mopitlo 2023, Tona ya Tlhabollo ya Leago, Mohumagadi Lindiwe Zulu, le Tona ya Toka le Ditirelo tša Tshokollo, Morena Ronald Lamola, ba tla swara Dibouto tša bona tša Tekanyetšo gomme dintlha tša dikopano tša bona tša boraditaba di tla abelanwa mo sebakeng sa go se fetše pelo.
","Izinqumo zeKhabhinethi.
",0.20336053
"Bouto ya Tekanyetšo ya Mopresidente e tla alwa ka Laboraro, la 31 Mopitlo 2023 gomme kopano ya boraditaba ka ga Kgatelopele ka Dipeakanyoleswa tša Sebopego le Maitapišo a Mešomo ao a rulagantšwego ka lenaneo la Operation Vulindlela e tla swarwa ka Labobedi, la 30 Mopitlo 20
","INdawo Yomnotho Okhethekile (i-SEZ) e-Namakwa
",0.48185506
"Letšatši la Afrika le Segopotšo sa Mengwaga ye 20 ya Mokgwa wa Tekolo ya Sethaka wa Afrika (APRM)
","IKhabhinethi ligunyaze ukubekwa kwe-SEZ e-Namakwa e-Aggeneys eNyakatho Kapa.
",0.6599456
"Kabinete le Maafrika Borwa ka moka ba kopana le kontinente ya Afrika le lefase ka bophara go keteka Letšatši la Afrika ka Labone, la 25 Mopitlo 2023.
","Lesi sethulo sokubekwa senziwe ngokwemigomo yoMthetho Wezindawo Zomnotho Okhethekile, wezi-2014 (uMthetho we-16 wezi-2014) futhi i-SEZ eyethuliwe iyingxenye yoMkhankaso KaMongameli Wotshalomali.
",0.6075117
"Ngwaga wo o bohlokwa kudu ka ge re keteka segopotšo sa bo60 sa go saenwa ga tšhatha ya go hlongwa ga Mokgatlo wa Botee bja Afrika, e lego makgoraditsela a Kopano ya Afrika.
","I-SEZ yase-Namakwa izovula amathuba okuhlomula ezimayini, ukukhiqizwa kwehayidrojini ehlanzekile, ukuthuthukiswa kwezingqalasizinda, ugesi ovuselelekayo kanye nokwenziwa kwemikhiqizo yezolimo.
",0.63952774
"Morero wa meketeko ya 2023 – “Go akgofiša phethagatšo ya Lefelo la Kgwebišano ya go Hloka Ditšhitišo Magareng ga Dinaga tša Kontinente ya Afrika” – o amogela dikgato tše di dirwago ka go tliša tirišong ya lefelo le legolo la kgwebišano ya go hloka ditšhitišo.
","Le mikhakha ibaluleke kakhulu ekusungulweni kwemisebenzi kanye nokuthuthukiswa komnotho waseNyakatho Kapa nowezwe.
",0.6195819
"Segopotšo sa Kgwedi ya Afrika sa ngwaga wo se sepelelana le segopotšo sa bo20 sa APRM, yeo e ikemišeditšego go godiša pušo ye botse ka khontinenteng ka thuto ya mphato ye e rulagantšwego le go itekola.
","Lungaphezu kwezigidigidi ezingama-R29 utshalomali oseluvele luthenjisiwe esigabeni sokuqala se-SELokhu kubandakanya izithembiso eziphuma ku-Vedanta Zinc (izigidigidi eziyi-R16), e-Frontier Rare Earth (izigidigidi eziyi-R13), e-Hive Energy (izigidi ezingama-R200) kanye nase-RRS Trade and Investment (izigidi eziyi-R100)..UShicilelo Lwesithathu Lweqhingasu Likazwelonke Lwezinsiza Zamanzi (i-NWRS-3) lwangowezi-2023.
",0.7134516
"Diphetho tša Kabinete.
","IKhabhinethi ligunyaze i-NWRS-3 yangowezi-2023 ukuthi iqaliswe futhi leli qhingasu liphoqa zonke iziphathimandla kanye nezikhungo ezisebenzisa uMthetho Kazwelonke Wamanzi, we-1998 (uMthetho wama-36 we-1998).
",0.23093385
"Lefelo le le Kgethegilego la Ikonomi la Namakwa (SEZ)
","Leli qhingasu lakhiwe ngokubuyekezwa kweminyaka emithathu ye-NWRS-2, okuveze izindawo lapho kube nempumelelo khona kanye nezindawo ezisanenselele.
",0.4993868
"Kabinete e dumeletše go kgethwa ga SEZ ya Namakwa ka Aggeneys ka Kapa Leboa.
","I-NWRS-3 iqukethe izinhlosonqangi ezintathu, zokuthi ezamanzi nokuthuthwa kwendle kufanele zeseke ukuthuthukiswa, ukuqedwa kobubha nokungalingani, zifake igalelo emnothweni nasekusungulweni kwemisebenzi, futhi amanzi kufanele avikelwe, asetshenziswe, athuthukiswe, aphathwe futhi alawulwe ngokusimeme nangokulingana.
",0.6344049
"Kgetho ye e šišintšwego e dirwa go ya ka Molao wa Dilete tše di Kgethegilego tša Ikonomi, 2014 (Molao wa 16 wa 2014) le SEZ ye e šišintšwego ke karolo ya Lesolo la Peeletšo ya Mopresidente.
","Leli qhingasu lenza izethulo ezibambekayo zokukhushulwa kokuthunyelwa kwamanzi, ukunciphisa ukudingeka kwamanzi, ukuphathwa ngendlela kwamanzi nokuthuthwa kwendle, ukubekwa kwezinqubomgomo emkhakheni wezamanzi nokuthuthwa kwendle, ukuphakwa kwamanzi ukuze kuzokwenzeka izinguquko, ukugqugquzela ukubambisana kwamazwe ngamazwe, kanye nokuphathwa kwamanzi nokuthuthwa kwendle ngaphansi kwesimo sezulu esiguquguqukayo.
",0.66493356
"SEZ ya Namakwa e tla bulela dikholego tša meepo, tšweletšo ya haetrotšene ye tala, tlhabollo ya mananeokgoparara, enetši ye mpshafatšegago le tshepedišo ya temo.
","I-NWRS-3 ishicilelwe kwiwebhusayithi yase-DWS ethi: WEBTOKEN..Umbiko ngezinyathelo eziqaliswe nguMnyango Wezokuvikeleka (i-DoD) ukubhekana nendlela yokuziphatha kwamalungu oMbutho Wezokuvikeleka Kuzwelonke eNingizimu Afrika (i-SANDF) atshalwe kwimisebenzi yokuletha ukuthula.
",0.7433666
"Makala a a bohlokwa kudu mo go hlomeng mešomo le mo tlhabollong ya ekonomi ya Kapa Leboa le naga.
","IKhabhinethi lithole umbiko ngenqubekelaphambili eyenziwa iNingizimu Afrika ekubhekaneni nendlela yokuziphatha kwamanye amalungu e-SANDF atshalwe kwimisebenzi yokugcina ukuthula kulolonke izwekazi.
",0.6690372
"Dipeeletšo tša go feta R29 pilione di šetše di dirilwe go kgato ya mathomo ya SETše di akaretša maitlamo go tšwa go Vedanta Zinc (R16 pilione), Frontier Rare Earth (R13 pilione), Hive Energy (R200 milione) le RRS Trade and Investment (R100 milione)..Leano la Bosetšhaba la Methopo ya Meetse Kgatišo ya Boraro (NWRS-3) 2023.
","I-SANDF ibilokhu ingumthombo wokuzigqaja kwesizwe njengoba iyingxenye yemisebenzi yokugcina ukuthula ezwenikazini eletha uzinzo nokuthula ezizweni zase-Afrika ezibambene ngempi ngosizo lweZizwe Ezibumbene (i-UN).
",0.7088062
"Kabinete e dumeletše NWRS-3 2023 gore e phethagatšwe gomme leano le tlama balaodi ka moka le ditheo tšeo di phethagatšago Molao wa Bosetšhaba wa Meetse, 1998 (Molao wa 36 wa 1998).
","Mayelana nezinsolo zamacala ezocansi abandakanya abagcini bokuthula bombutho wezokuvikeleka ezaqubuka ngowezi-2015, iThimba loNgqongqoshe lasungulwa ngowezi-2019 ukuze lizophenyisisa amacala okuxhashazwa nokuhlukunyezwa ngokocansi (i-SEA) ngaphakathi e-DoIKhabhinethi lithokozile ngeqoqo lezinyathelo ezibekiwe ukubhekana nezehlakalo ze-SEA kwimisebenzi ye-SANDF yokugcina ukuthula.
",0.7111385
"Leano le le thekgwa ke tshekatsheko ya mengwaga ye meraro ya NWRS-2, yeo e hlaotšego mafelo a katlego le mafelo ao a sa dutšego e le tlhohlo.
","I-UN iyayibonga iNingizimu Afrika ngokwenza kahle futhi yancoma leli lizwe ngenqubekelaphambili eliyenzile ngokuqeda i-SEA kwi-SANDIKhabhinethi ligcizelele ukuthi izenzo ze-SEA ngeke zimukeleke ukudicilela phansi umlando omuhle we-SANDF ezwenikazini..INyanga Yentsha yangowezi-2023 IKhabhinethi ligunyaze uHlelo Lwenyanga Yentsha lwangowezi-2023 ngaphansi kwesiqubulo esithi: “Ukusheshisa Ukukhululwa Komnotho Wentsha Ukuze Izoba Nekusasa Elisimeme”.
",0.6910408
"NWRS-3 e akaretša dinepo tše tharo tša merero, gore meetse le kelelatšhila di swanetše go thekga tlhabollo, phedišo ya bohloki le go se lekalekane, di na le seabe ikonoming le tlholong ya mešomo, gomme meetse a swanetše go šireletšwa, go šomišwa, go hlabollwa, go hlokomelwa le go laolwa ka mokgwa wa go ya go ile le ka tekatekano.
","IPhini likaMongameli u-Mashatile uzokwethula inkulumo yoSuku Lukazwelonke kulo nyaka oluzobe lugujwa ngezinsuku ezimbili kusuka mhla we-16 kuya mhla we-17 kuNhlangulana 2023 e-Mangaung Outdoor Sport Centre, e-Mangaung, e-Bloemfontein, eFreyistata.
",0.6599542
"Leano le le dira ditšhišinyo tša go kwagala tša go oketša kabo ya meetse, go fokotša nyakego ya meetse, taolo ye e šomago gabotse ya meetse le kelelatšhila, go laola lekala la meetse le kelelatšhila, go aba meetse leswa bakeng sa phetogo, go tšwetša pele tšhomišano ya boditšhabatšhaba, le go laola meetse le kelelatšhila ka fase ga maemo a boso ao a fetogago.
","Kulezi zinsuku ezimbili, kuzoba nethuba lokuthi intsha ibe yingxenye yenkulumo-mpendulwano noNgqongqoshe kanye nabanye ababambiqhaza mayelana nokuqeqeshwa okwehlukahlukene, amathuba amabhizinisi nawokuzithuthukisa akhona kuhulumeni nakulabo okubanjisenwe nabo emphakathini.
",0.73215944
