src_text,tgt_text,cosine_score
"Sikhuluma nje mkhulu umsebenzi owenziwako wokuhlola yoke imithombo engahle ibe kulapho kucabheleke khona, kungaba kusemithonjeni yamanzi ngokwayo, kungaba sematankeni adiliva amanzi, kungaba seempompeni namkha ebuTsengelweni baManzi i-Rooivaal Wastewater Treatment Works (i-WWTW).
","Uhulumeni usesungule ikomidi lezobuchwepheshe, eliholwa nguMnyango Kazwelonke Wezempilo, njengendlela yokubhekana nokubheduka kwesifo sohudo e-Hammanskraal eDolobheni lase-Tshwane, esesithathe impilo yabantu abayi-15 ngomhla wama-24 kuNhlaba 2023.
",0.41771013
"Bekube nje, akunabufakazi bomulwana wekholera esele butholakele kilemithombo lokhu-ke kungatjho khona ukuthi mhlambe ukwehla kwesifesi kusukele esehlakalweni sinye sokusilaphazeka, abantu base bayathelelana ukusukela lapho bekufike kilobubujamo banje.
","Umsebenzi omkhulu uyaqhubeka wokuhlolisisa yonke imisuka yokungcola, okungaba imithombo yamanzi, izimoto ezihambisa amanzi, izimpompi kanye nesihlanzimanzi i-Rooiwal Wastewater Treatment Works (i-WWTW).
",0.62586266
"Njengoba kuthathwa lamagadango nje, izakhamuzi ze-Hammanskraal zikhuthazwa ukuthi ziwabilise amanzi wazo wepompo bese ziwanunga ngetsherwana yetshwayi ngaphambi kobana ziwasele.
","Kuze kube yimanje, abukho ubufakazi begciwane lesifo sohudo osebutholakele kule mithombo yamanzi, lokho okuqinisa ukuthi kungenzeka ukubheduka kwesifo sohudo kwasuka esigamekweni esisodwa sokungcola kwamanzi, njengoba izigameko zamanje zingenxa yokungcola okusuka kumuntu kuye komunye.
",0.6256561
"Ngaphezu kwalokho, umuntu ogijinyiswa yindeni, osililekako namkha onamatshayo wokuthi kunento engakalungi ngendeni akarhabele kudorhodere namkha etlinigi yangekhabo.
","Njengoba kuqaliswa izindlela zokungenelela, abahlali base-Hammanskraal bayagqugquzelwa ukuthi babilise amanzi empompi futhi bafake ingcosana kasawoti ngaphambi kokuwaphuza.
",0.6774539
"UNgqongqotjhe wezaManzi nezokuHlwengisa uNom.
","Ngaphezu kwalokhu, noma ngubani ohanjiswa yisisu, ukucanuzela kwenhliziyo noma izimpawu zokuphathwa isisu kufanele avakashele udokotela wakhe ngokushesha noma umtholampilo wendawo.
",0.45478323
"Senzo Mchunu uzokubonana noMeyara we-Tshwane uKhansela Cilliers Brink ngeLesihlanu womhla wama-26 kuMrhayili wee-2023 emzameni wokutlama ihlelo elihlanganyelweko lokuvuselela i-Rooiwal WWTW, esele kukade seqa isikhathi sokuyivuselela.
","UNgqongqoshe Wamanzi Nokuthuthwa Kwendle, uMnu Senzo Mchunu, uzohlangana noSodolobha weDolobha lase-Tshwane u-Cllr Cilliers Brink, ngoLwesihlanu mhla wama-26 kuNhlaba 2023 emzamweni wokuqhamuka nesu elihlanganyelwe lokulungiswa osekudlulelwe isikhathi kwe-Rooiwal WWTNgemininingwane ethe xaxa ungashayela inombolo ephuthumayo esebenza ubusuku nemini yeSikhungo Sikazwelonke Sezifo Ezithelelanayo (i-NICD) ku-082 883 9920.
",0.695186
"Eminye imininingwana ungayithola ngokufowunela iZiko leziFo eziThathelwanako (i-NICD) enomborweni yesizo ethi-082 883 9920.
","Imihlahlandlela yokwelashwa kwesifo sohudo itholakala ngobuchwepheshe WEBTOKEUCwaningo Lwekota Lwabasebenzi (i-QLFS)
",0.5403629
"Iinlimukiso ngokuthi ikholera ilapheka njani ungazithola kubunzinzolwazi WEBTOKEN..Ihlolo Ngabantu Abasebenzako Yaqobe Kota (i-QLFS) IKhabinethi ikhuthazekile ngokuthi i-QLFS yokuthoma yee-2023 itjengise ihlandla lesithandathu ngokulandelana lokukhuphuka ngenani lemisebenzi qobe kota nangokuthi inani labantu abasebenzako abaziingidi ezili-16.2 likhakhabela eduze neengidi ezili-16.4 zabantu ababesebenza ngaphambi kokusahlela kwesifo sengogwana ye-Corona (i-COVID-19).
","IKhabhinethi ligqugquzelwa ukuthi i-QLFS yokuqala yangowezi-2023 ibonise ukukhula ngekota okulandelanayo kwenani lemisebenzi kanye nokuqashwa kwabantu abayizigidi eziyi-16.2 kusondela kancane kwinani eliyizigidi eziyi-16.4 labantu abaqashwa ngaphambi kwezinsuku zokuhlasela kwegciwane le-Corona (i-COVID-19).
",0.38827765
"Lesi-ke sitjengiso esikhanyako esifakazela ukuthi umnotho weSewula Afrika uhluma ngobutjha ngamandla ngemva kwalesisifo esikhe sarhagala.
","Lokhu kucacisa bha ukuthi umnotho waseNingizimu Afrika ululama ngokuqinile kwimiphumela yalolu bhubhane.
",0.47929972
"Inani labantu abasebenzako ngekota yokuthoma litjengisa ukuthi imisebenzi ezii-209 000 ibe sekorweni ehlelekileko, kwathi imisebenzi eli-107 000 yavuleka ekorweni engakahleleki ngekota yokuthoma yomnyaka..Ubudlelwano BeSewula Afrika Ne-United States (i-US)
","Izibalo zemisebenzi zekota yokuqala zibonisa imisebenzi eyizi-209 000 eyasungulwa kumkhakha ohlelekile kanye nemisebenzi eyizi-107 000 kumkhakha ongahlelekile ngesikhathi sekota yokuqala yonyaka..Ubudlelwano beNingizimu Afrika ne-United States (i-US) IKhabhinethi likuqinisekisile ukuthi ubudlelwano phakathi kweNingizimu Afrika ne-US busalokhu bubuhle, buqinile futhi womabili amazwe ayazuza kubona kulandela umhlangano phakathi kukaNgqongqoshe Wezobudlelwano Bamazwe Ngamazwe Nokubambisana, uDkt Naledi Pandor kanye neNxusa lase-US eliseNingizimu Afrika, uMnu Reuben E Brigety, emva kwezinsolo zakhe zokuthi iNingizimu Afrika inikeze i-Russia izikhali.
",0.6808906
"IKhabinethi ifakazile ukuthi nangambala ubudlelwano beSewula Afrika ne-US busese buhle, buqinile, begodu buwahlomulisa womabili amazwe la, ngemva komhlangano hlangana kwakaNgqongqotjhe wezeTjhebiswano lamaZwe ngamaZwe nokuSebenzisana, uDorh.
","IKhabhinethi liphinde lagcizelela ukuthi izindlela ezisunguliwe zokuxhumana zamanxusa azo zonke izizwe zikhona, kubandakanya i-US, ukuzwakalisa izinkinga uma ziqubuka ekuphathweni kobudlelwano phakathi kwala mazwe womabili.
",0.29839814
"Naledi Pandor noMzenda we-US eSewula Afrika uNom.
","IKhabhinethi lamukele isimemezelo sikaMongameli u-Cyril Ramaphosa sokusungulwa kophenyo oluzimele oluzohlolisisa izinsolo zokuthi kwahanjiswa izikhali zisuka eNingizimu Afrika ziya e-Russia.
",0.63165724
"Reuben Brigety, ngamagama akhe awakhuluma athi batjho iSewula Afrika ihlomisa i-Russia (ngeenkhali).
","Imininingwane yalolu phenyo izomenyezelwa ngokuhamba kwesikhathi..Ubudlelwano beNingizimu Afrika ne-Singapore
",0.56962323
"IKhabinethi ibuyelele yaqinisa ukuthi iindlela zokusebenzisana ngabosomaqhinga zikhona zisetjenziswa kiwo woke amazwe, hlangana nawo ekubalwa nayo i-US, la kungakhulunyelwa khona imiraro yokulawula ubudlelwano bobubili bamazwe lawa.
","UMongameli u-Ramaphosa usingathe uNgqongqoshe Wezwe u-Lee Hsien Loong weRiphabhulikhi yase-Singapore ngoLwesibili, mhla we-16 kuNhlaba 2023.
",0.52163583
"IKhabinethi isithokozele isimemezelo sikaMengameli Cyril Ramaphosa sokusungulwa kwephenyo elizijameleko elizakuphenya izwangobatjho ethi iSewula Afrika ihlomisa i-Russia.
","Izwe lase-Singapore lingabatshalizimali abakhulu eNingizimu Afrika, nasebetshale izimali zenani eliphelele elingaphezu kwezigidigidi ezi-R5 emikhakheni efana neyokukhiqiza, izinsizakalo zezimali kanye nokuthengiswa kwezindlu.
",0.5942267
"Imininingwana yephenyweli izakumenyezelwa khona duze nje..Ubudlelwano BeSewula Afrika Ne-Singapore UMengameli Ramaphosa usingethe ivakatjho likaNdunakulu u-Lee Hsien Loong weRiphabhligi ye-Singapore ngeLesibili womhla we-16 kuMrhayili wee-2023.
","Izivumelwano ezisayiniwe phakathi kwamazwe womabili zihlose ukuqinisa uhwebo, utshalomali, ezemfundo kanye nokubambisana kwezokuvikeleka..IMbizo kaMongameli yoHlelo Lokuthuthukiswa Kwezifunda (i-DDM) eNtshonalanga Kapa
",0.48762318
"I-Singapore ililizwe eliqakathekileko elisisisa lapha eSewula Afrika, njengoba amasiso wayo adlula imali emabhiliyoni ama-R5 emakorweni anjengewokukhiqiza, zeemali kunye nezokwakhiwa nokuthengiswa kwemakho.
","UMongameli u-Ramaphosa ubambe iMbizo kaMongameli ye-DDM yesithupha eNtshonalanga Kapa, kuMasipala Wendawo i-Drakenstein, kwiSifunda sase-Cape Winelands, ngoLwesihlanu ziyi-19 kuNhlaba 2023.
",0.683379
"Iimvumelwano ezitlikitliweko hlangana namazwe amabili la zinqophe ukuqinisa ukusebenzisana kezerhwebo, zamasiso, zefundo nezokuvikela..Imbizo KaMengameli Ngesibonelo Sokuthuthukiswa kwesiyingi SeTjingalanga Kapa (i-DDM)
","UMongameli uhole ithimba eliphuma kuzo zontathu izinhlaka zikahulumeni ngaphansi kwesiqubulo esithi: “Asishiyi Muntu Ngemuva”.
",0.42716604
"UMengameli uRamaphosa ubize iMbizo yesithandathu yobeNgameli nge-DDM eTjingalanga Kapa, kuMasipala we-Drakenstein, esiYingini se-Cape Winelands, ngeLesihlanu womhla we-19 kuMrhayili wee-2023.
","IMbizo yandulelwa uhambo lukaMongameli lokuvakashela lapho kwakhiwa khona indawo yokuhlalisa abantu eseduze i-Vlakkeland Catalytic Human Settlement Development, okuluhlelo olukhulu lokwakhiwa kwezindlu zomphakathi olwake lwaba khona kuze kube manje kuMasipala Wendawo i-Drakenstein.
",0.6419177
"UMengameli uthwele ibandla leenthunywa elijamele zontathu iingaba zikarhulumende, ngaphasi kommongondaba othi: “Akungasali Muntu Ngemva.” Ngaphambi kweMbizo, uMengameli ukhe wavakatjhela ihlelo lokwakha izindlu eliseduzapho, i-Vlakkeland Catalytic Human Settlement Development, elilihlelo lokwakhela umphakathi elingelikhulu ukuwadlula woke akhe aba khona kuMasipala weNdawo ye-Drakenstein.
","Ukwakhiwa okwaqala ngowezi-2017 kuzothi kungaphothulwa bese kuhlinzeka ngezindlu eziyi-2 556 kulabo abafanelekile.
",0.25923932
"Zizii-2 556 izindlu ezizokutholwa babantu abalungele ukuzithola naliphelako lelihlelo lokwakhela abantu izindlu elathoma ngomnyaka wee-2017.
","Ukwakhiwa kwezindlu ezingama-942 kweSigaba Sokuqala kuyaqhubeka, okuyizindlu ezingama-454 eseziphothuliwe kanye nezingama-301 ezisakhiwa.
",0.57736146
"Uthomile umsebenzi wokwakha izindlu ezima-942 esiGabeni sokuthoma sokwakha, lapha sekuphele ezima-454, ukube kanti ezima-301 zisakhiwa.
","Ukubaluleka kwalo mklamo ukuthi ubhekelela izinhlelo zezindlu ezehlukahlukene kusuka kulabo abahola i-R0 kuya kwizi-R3 500 (ngaphansi KoHlelo Oludidiyelwe Lokuhlaliswa Kwabantu), kuya kulabo abasoHlelweni Lokuxhaswa Ngezimali Zokuthenga Indlu, labo abahola phakathi kwezi-R3 501 kuya kwizi-R22 000 ngenyanga.
",0.6600831
"Ukuqakatheka kwehlelweli kukuthi lakha izindlu zemihlobo ehlukahlukileko, ezilungele imirholo ehlukahlukileko, ukusukela ku-R0 ukuyokufika ku-R3 500 (ngaphasi kwe-Breaking New Ground) ukuya ehlelweni lokusizwa ngemali elibizwa ngokuthi yi-Finance Linked Individual Subsidy Programme, elenzelwe labo abarhola hlangana kwe-R3 501 ne-R22 000 ngomnyaka.
","Womabili amathuba Ezindlu Zomphakathi kanjalo namathuba ezindlu Zomakadebona Bezempi akhona kulo mklamo..UHambo Lokuyohlola Umsebenzi kuMasipala Wedolobha laseThekwini kanye noMasipala Wesifunda saseMgungundlovu mhla we-18 nomhla we-19 kuNhlaba 2023.
",0.650275
"Kilelihlelo lokwakha kunamathuba wokwakhelwa komphakathi ojayelekileko (i-Social Housing) kunye namathuba wokwakhelwa kwaboMakadabona bePi..Ivakatjho Lokuhlola Ukusebenza kuMasipala weDorobha leThekwini NeweSiyingi seMgungundlovu Ngomhla We-18 Nowe-19 KuMrhayili Wee-2023 ISekela likaMengameli u-Paul Mashatile ukhe wacocisana nabahlanganyeli kezefundo nokuthwasisa, kezokulima, zerhwebo nezamabubulo lokhuya nakasevakatjhweni lokuyokuhlola kwaMasipala weThekwini Methro nakuMasipala wesiYingi weMgungundlovu njengengcenye yamavakatjho wokuhlola ukusebenza kwehlelo le-DDEnye yamaphrojekthi aqakathekileko avakatjhelweko kube yiNtshongweni Catalytic Project lapho kwakhiwa khona i-Smart City hlangana kweTheku noMgungundlovu.
","IPhini likaMongameli u-Paul Mashatile uxoxisane nababambiqhaza kwezemfundo nokuqeqeshwa, ezolimo, ezentengiselwano kanye nezimboni ngesikhathi sohambo lokuyohlola umsebenzi kuMasipala Wedolobha laseThekwini kanye noMasipala Wesifunda saseMgungundlovu njengengxenye yokuhambela ukuhlola imisebenzi ye-DDEnye yemiklamo ehamba phambili evakashelwe kube yindawo okwakhiwa kuyona i-Ntshongweni Catalytic Project, lapho okwakhiwa khona iDolobha Lesimanjemanje phakathi kweTheku noMgungundlovu.
",0.6748327
"IPhojekthi le izakuvuselela imisebenzi yomnotho kilendawo, ngaleyindlela kungene imali elinganiselwa kumabhiliyonini ali-R15 ngamasiso, eminyakeni eli-10 ukuya keli-15 ezako..Umthangalasisekelo Wezamanzi UMengameli Ramaphosa uvakatjhele ihlelo lokuphakela amanzi i-Lesotho Highlands Water Project ngeLesibili womhla wama-23 kuMrhayili wee-2023 lapho abe khona nesandla ekambisweni yokuphendulwa kwesoyi yesiGaba 2 salelihlelo.
","Lo mklamo uzovuselela imisebenzi efukula umnotho endaweni, nokufaka igalelo lotshalomali olubiza izigidigidi ezi-R15 eminyakeni eyi-10 kuya kweyi-15 ezayo..Ingqalasizinda yamanzi
",0.58911145
"Ngemva kobana sekuminyaka satlikitlwa lesisivumelwano salelihlelo nangemva kobana seliriyade kangaka, ikambiso yamva le ibe lithemba lokuliphakamisa iinyawo lelihlelo eliqakathekileko.
","UMongameli U-Ramaphosa uvakashele umklamo i-Lesotho Highlands Water Project ngoLwesibili, mhla wama-23 kuNhlaba 2023 lapho abe yingxenye womcimbi wokuphendulwa kwesoyi leSigaba Sesibili somklamo.
",0.511012
"I-Lesotho Highlands Water Project iqakathekile ekuqinisekiseni ukutholakala kwamanzi e-Gauteng, eFreyistata, eMpumalanga, eTlhagwini Tjingalanga kunye neTlhagwini Kapa.
","Lo mklamo owasayinwa eminyakeni eminingi eyadlula futhi wabambezeleka, lo mcimbi ubonisa ukubaluleka kokusheshiswa kwalo msebenzi obalulekile wala mazwe womabili.
",0.51989967
"Ukusetjenziswa kweensetjenziswa nemithombo yamandla emthangalenisisekelo ukuphakamisa ipilo yamaSewula Afrika kusaragela phambili njengoba abomasipala sebabelwe imali engaphezulu kwamabhiliyoni ali-R14 kobanyana balungise imiraro yokusalela emva komthangalasisekelo, ngesiBonelelo somthangalasisekelo i-Regional Bulk Infrastructure Grant (i-RBIG) nese-Water Services Infrastructure Grant (i-WSIG).
","Umklamo i-Lesotho Highlands Water Project ubaluleke kakhulu ekuqinisekiseni ukutholakala kwamanzi e-Gauteng, eFreyistata, eMpumalanga, eNyakatho Ntshonalanga naseNyakatho Kapa.
",0.66323775
"I-RBIG izokusetjenziswa emaphrojekthini ali-130 bese kuthi i-WSIG ihlukaniselwa amaphrojekthi angaphezulu kwama-400 elizweni lokeli.
","Ukutshalwa kwezimali kwingqalasizinda yamanzi ukuze kuzothuthukiswa izimpilo zabantu baseNingizimu Afrika kuyaqhubeka njengoba kwatshelwe omasipala imali engaphezu kwezigidigidi ezi-R14 ukuthi babhekana nenkinga yokusilela emuva kwingqalasizinda yamanzi, ngokusebenzisa iSibonelelo Sengqalasizinda Yezifunda (i-RBIG) kanye neSibonelelo Sengqalasizinda Yezinsizakalo Zamanzi (i-WSIG).
",0.6523947
"IKhabinethi ithokozile nangokuthi umNyango wezaManzi nezokuHlwengisa (i-DWS) wenza indima ebonakalako ekulwiseni ubukhohlakali, njengoba pheze seyihlanganisa ama-R600 weengidi imali esele ibuyiswe ziinkhampani ezahlomula ngamathenda ayeragwe ngokungasimthetho.
","I-RBIG izosetshenziswa kwimiklamo eyi-130 bese kuthi i-WSIG yona izofakwa kwimiklamo engama-400 kulolonke izwe.
",0.57332
"IKhabinethi itjhejile nokuthi sekunamagadango abekiweko wokukhandela abekwe mnyango wezamanzi ukuqeda ukusetjenziswa kwemali ngokungakafaneli, nangendlela engabuyiseliko nekudlala ngemali..UNongorwana Wezokuvikeleka Komphakathi ISewula Afrika ithokozwe ngonongorwana orhanyazelako wamazwe ngamazwe wokuvikeleka komphakathi nokusebenza kuhle ngeendaba zomphakathi emazweni we-Afrika emnyakeni wee-2023 – i-International Social Security Association (i-ISSA) Good Practice Award in Social Security for Africa 2023 – othokoza umsebenzi karhulumende wokusiza epilweni yabantwabethu, khulukhulu labo ababuya emakhaya anganalitho nanganabuyo.
","IKhabhinethi liphinde lathokozela ukuthi uMnyango Wamanzi Nokuthuthwa Kwendle (i-DWS) uthatha amagxathu ekulweni nenkohlakalo njengoba usuthole cishe izigidi ezingama-R600 ezikhokhwe yizinkampani ezazuza ngokuthola amathenda ngokungekho emthethweni.
",0.33160087
"ISewula Afrika ingene kilonongorwana orhanyazelako ngesihloko esithi: “Kancanikancani Selula Isandla Sokuvikela Abantwana Abacaphazeka Lula Emphakathini: Indaba YesiBonelelo SabaNtwana, ESewula Afrika.” Babe li-138 abebaphalisana bavela eenjamisweni ezima-48 ezimalunga emazweni we-Afrika angaphezulu kwama-30.
","IKhabhinethi liphinde laziphawula izinyathelo zokulawula ezibekwe ngumnyango zokuqeda ukusetshenziswa kwezimali okungahambisani nomthetho, okungenasidingo nokumoshayo.
",0.49273634
"Isizo lethu lokwenyula umphakathi liyisika yehlelo likarhulumende lokwethula abantu umtlhago nokubuyisa isithunzi sabantu bekhethu.
","Indondo Yezokuvikeleka Komphakathi
",0.35112858
"Ihlelo lokuvikela umphakathi eSewula Afrika libalwa hlangana namahlelo angamakhulu khulu ephasini, njengoba lihlomulisa abantu abangaphezulu kweengidi ezili-18 nje..Amavowudi Ngesabelo Seemali IKhabinethi ithokozile ngokuthi amaVowudi ngeSabelo seeMali weminyango karhulumende akhamba kuhle.
","INingizimu Afrika ithole iNdondo Yomsebenzi Omuhle kwezoKuvikeleka Komphakathi e-Afrika ngowezi-2023 yeNhlangano Yamazwe Ngamazwe Kwezokuvikeleka Komphakathi (i-ISSA), ebonisa ukubonga ukuzinikela kukahulumeni ezimpilweni zabantwana bethu, ikakhulukazi labo abaphuma emakhaya adla imbuya ngothi futhi abuthakathaka.
",0.3631798
"Nanti irherho elizako lamaVowudi ngeSabelo seeMali nemihlangano yeendaba eliphekelelako:.ULesihlanu womhla wama-26 kuMrhayili wee-2023 nge-iri le-13:00, uNgqongqotjhe womNyango wezokuBusa ngokuBambisana nezeNdabuko (i-CoGTA), uMm.
","Isicelo sokungenela ukuthola le ndondo seNingizimu Afrika sasinesihloko esithi: “Ukwandiswa kancane kancane kokuvikeleka kwenhlalo yabantwana ababuthakathaka: Udaba lweSibonelelo Sabantwana, eNingizimu Afrika”.
",0.37608063
"uThembi Nkadimeng uzokubamba umhlangano nembikiindaba ngeVowudi yeSabelo seeMali se-CoGTA ezakubeka amagadango anqophe ukuqinisa ukusebenza kwabomasipala..NgeLesibili womhla wama-30 kuMrhayili wee-2023, uNgqongqotjhe wezokuThuthukiswa koMphakathi uMm.
","Inani eliphelele lezicelo zokungenela ezamukelwa zazisuka ezikhungweni ezingamalungu ezingama-48 emazweni angaphezu kwama-30 e-Afrika.
",0.5065388
"uLindiwe Zulu banoNgqongqotjhe wezomThethobulungiswa nezokuVuselelwa kweSimilo uNom.
","Izibonelelo zethu zomphakathi zingummongo wohlelo lukahulumeni lokuqeda ububha futhi zingumnyombo wokubuyisa isithunzi sabantu bakithi.
",0.5029731
"Ronald Lamola bazokubamba amaVowudi ngeSabelo seeMali seminyangwabo, nje-ke imininingwana yemihlangano yeendaba yakhona izakumenyezelwa khona duze nje..IVowudi ngeSabelo seeMali ye-Ofisi kaMengameli izokwethulwa ngeLesithathu womhla wama-31 kuMrhayili wee-2023 kanti-ke umhlangano nembikiindaba ngeNdima yamaTjhuguluko aQakathekileko nangamaGadango wemiSebenzi ahlanganiswe nge-Operation Vulindlela uzokubanjwa ngeLesibili womhla wama-30 kuMrhayili wee-2023..ILanga Le-Afrika Nomnyaka Wama-20 WeHlelo LokweLusana Kwamazwe We-Afrika (i-APRM) IKhabinethi nawo woke amaSewula Afrika ahlanganyela nelizwekazi le-Afrika nephasi loke ekugidingeni iLanga le-Afrika ngeLesine womhla wama-25 kuMrhayili.
","Uhlelo lweNingizimu Afrika lokuvikela umphakathi luphakathi kwezinhlelo ezinkulukazi emhlabeni, njengoba lunabantu abangaphezu kwezigidi eziyi-18 abahlomula kulona..Amavoti Ezabelomali
",0.51409584
"Umnyaka lo uqakatheke ngokukhethekileko njengoba phela ukuhlangana kwama-60 weminyaka kwatlikitlwa umtlolo wokusungulwa kweHlangano yoBunye be-Afrika, esele yaziwa njengeHlanganisela yamaZwe we-Afrika (i-AU).
","IKhabhinethi liyathokoza ukuthi amaVoti Ezabelomali eminyango kahulumeni aqhubeka kahle.
",0.43134075
"Ummongondaba wemigidingo yaNonyaka uthi – “Ukuphunyeleliswa Kwamsinyana Kwekundla Yokurhwebelana Ngekululeko Elizwekazini Le-Afrika” ¬– uvuma imizamo eyenziwako yokuwenza asebenze amagadango wokurhweba kilekundla engekulu ephasini ekurhwebelaneni ngekululeko.
","Uhlelo lwamaVoti Ezabelomali azayo kanye nezithangami zabezindaba:.NgoLwesihlanu mhla wama-26 kuNhlaba 2023 ngehora le-13:00, uNgqongqoshe Wezokubusa Ngokubambisana Nezindaba Zendabuko (i-CoGTA), uNks Thembi Nkadimeng, uzobamba isithangami sabezindaba mayelana neVoti leSabelomali elizocacisa izinyathelo okuhloswe ngazo ukuqinisa ukusebenza komasipala..NgoLwesibili, mhla wama-30 kuNhlaba 2023, uNgqongqoshe Wezokuthuthukiswa Komphakathi, uNks Lindiwe Zulu, kanye noNgqongqoshe Wezobulungiswa Nokuhlunyeleliswa Kwezimilo, uMnu Ronald Lamola, bazoba namaVoti Ezabelomali kanti imininingwane yezithangami zabezindaba izokhishwa ngokuhamba kwesikhathi..IVoti Lesabelomali leHhovisi likaMongameli lizokwethulwa ngoLwesithathu, mhla wama-31 kuNhlaba 2023 kanti isithangami sabezindaba ngeNqubekelaphambili Yezinguquko Zezakhiwo kanye Nemizamo Yokusungula Imisebenzi ehlanganiswa ngohlelo lwe-Operation Vulindlela sizoba ngoLwesibili, mhla wama-30 kuNhlaba 20
",0.6866056
"Ukugidingwa kweNyanga Ye-Afrika nonyaka kuthomana nokuhlangana kwama-20 weminyaka we-APRM, enqophe ukwakha ikambiso ehle yokusebenza elizwekazini le-Afrika ngehlelo lokufundisana namanye amazwe nelokuzinuka amakhwapha.
","USuku Lwe-Afrika kanye nokubungaza iminyaka engama-20 yeNdlela Yokuhlolana Kwamazwe ase-Afrika (i-APRM)
",0.6133994
"Iinqunto ZeKhabinethi.
","IKhabhinethi nabobonke abantu baseNingizimu Afrika bahlanganyele nezwekazi lase-Afrika nomhlaba wonke ukubungaza uSuku lwe-Afrika ngoLwesine, mhla wama-25 kuNhlaba.
",0.4543538
"Isizinda Esikhethekileko Sezomnotho LeNamakwa (i-SEZ)
","Lo nyaka ubalulekile ikakhulukazi njengoba uluphawu lokuphela kweminyaka engama-60 kwasayinwa isisekelo somqulu weNhlangano Yobumbano Lwamazwe ase-Afrika, eyandulela uBumbano Lwamazwe Ase-Afrika.
",0.5006201
"IKhabinethi ivumele ukukhethwa kwesizinda esikhethekileko sezomnotho i-Namakwa SEZ e-Aggeneys eTlhagwini Kapa.
","Isiqubulo semibungazo yangowezi-2023 esithi - “Ukusheshisa Ukuqaliswa Kokuhwebelana Ngaphandle Kokukhokha Intela Kwamazwe Asezwenikazini i-Afrika” – sibonisa amagxathu athathwayo ekuqaliseni ukusebenza kwale nkundla yokuhweba enkulukazi emhlabeni.
",0.6016177
"Ukukhethwa nokuthukwa kwendawo le njengeSizinda esiKhethekileko sezoMnotho kwenziwe ngokomThetho weeZinda zoMnotho aziKhethekileko wee-2014 (umThetho Nomboro 16 wee-2014) kanti-ke lendawo ekuphakanyiswe ukuthi ibe sizinda somnotho iyingcenye yeHlelo lamaSiso likaMengameli.
","Umbungazo weNyanga ye-Afrika wakulo nyaka uqondane nokuphela kweminyaka engama-20 ye-APRM, okuhloswe ngako ukuqinisa ukubusa kahle ezwenikazini ngokulandela izindlela zokuthi izwe lifunde kwelinye izwe futhi aphinde ahlolane wona.
",0.6357608
"INamakwa SEZ izokuvula ihlelo lokuhlengwa kwezenjiwa zemayini, ukukhiqizwa kwehayithrojini ehlaza, ukwakhiwa nokuthuthukiswa komthangalasisekelo, ukuvuseleleka kwegezi kunye nokulungiselelwa ukusetjenziswa kwemikhiqizo.
","Izinqumo zeKhabhinethi.
",0.16276088
"Amakoro lawa aqakathekile ekuvulweni kwemisebenzi nekuthuthukisweni komnotho weTlhagwini Kapa newelizwe loke.
","INdawo Yomnotho Okhethekile (i-SEZ) e-Namakwa
",0.4851145
"Ngewemali engaphezulu kwamabhiliyoni ama-R29 amasiso esele athenjiswe ukufakwa esigabeni sokuthoma se-SELapha-ke kubalwa iinthembiso zokuzibophelela kwe-Vedanta Zinc (amabhiliyoni ali-R16), kwe-Frontier Rare Earth (amabhiliyoni ali-R13), kwe-Hive Energy (iingidi ezima-R200) kunye nokwe-RRS Trade and Investment (iingidi ezili-R100)..Umgadangiso Wesithathu Wehlelo Lamanzi Lelizwe (i-NWRS-3) 2023 IKhabinethi ivumele ukuphunyeleliswa kwe-NWRS-3 2023 begodu ihlelweli lisibopho kizo zoke iimphathimandla neenjamiso eziphumelelisa umThetho wezaManzi womnyaka we-1998 (umThetho Nomboro 36 we-1998).
","IKhabhinethi ligunyaze ukubekwa kwe-SEZ e-Namakwa e-Aggeneys eNyakatho Kapa.
",0.56114715
"Ihlelweli lisekelwe libuyekezo leminyaka emithathu le-NWRS-2, eliveze ipumelelo eyenziweko neendawo ekusamele zitjhejwe.
","Lesi sethulo sokubekwa senziwe ngokwemigomo yoMthetho Wezindawo Zomnotho Okhethekile, wezi-2014 (uMthetho we-16 wezi-2014) futhi i-SEZ eyethuliwe iyingxenye yoMkhankaso KaMongameli Wotshalomali.
",0.56215394
"I-NWRS-3 yakhiwe minqopho emithathu yommongondaba ihlelo lamanzi nokuhlwengisa ekumele bona liyisekelele ukwakhiwa nokuthuthukiswa, kuqedwe ubuchaka nokutjhiyana ngendima ngokomnotho, kufakwe isandla sokuhlumisa umnotho nokuvulwa kwemisebenzi, amanzi avikelwe, asetjenziswe, atsengwe ngefanelo, aphathwe abe alawulwe ngendlela ebambelelako nelinganisekileko.
","I-SEZ yase-Namakwa izovula amathuba okuhlomula ezimayini, ukukhiqizwa kwehayidrojini ehlanzekile, ukuthuthukiswa kwezingqalasizinda, ugesi ovuselelekayo kanye nokwenziwa kwemikhiqizo yezolimo.
",0.63552976
"Ihlelweli lenza iimphakamiso ezizwakalako zokwandisa amanzi atholakalako, kuphunguke umthamo wokufuneka kwamanzi, amanzi nokuhlwengisa kuphathwe ngcono, kube nelawulo lekoro yamanzi nokuhlwengisa, amanzi asatjalaliswe ngobutjha ngokulandela ukuhlela ngobutjha, kukhuthazwe ukusebenzisana kwamazwe ngamazwe, kulawulwe zamanzi nezokuhlwengisa ebujameni betlayimethi obutjhugulukatjhugulukako.
","Le mikhakha ibaluleke kakhulu ekusungulweni kwemisebenzi kanye nokuthuthukiswa komnotho waseNyakatho Kapa nowezwe.
",0.48872614
"I-NWRS-3 igadangiswe kubunzinzolwazi be-DWS WEBTOKEN..Umbiko Ngamagadango Athethwe Mnyango Wezokuvikela (i-DoD) Ukukhalima Ukuziphatha Kwamalunga Webutho Lamajoni Wezokuvikela (i-SANDF) Athunywe Ukuyokusebenza Emahlelweni Wokuncengelela Ukuthula.
","Lungaphezu kwezigidigidi ezingama-R29 utshalomali oseluvele luthenjisiwe esigabeni sokuqala se-SELokhu kubandakanya izithembiso eziphuma ku-Vedanta Zinc (izigidigidi eziyi-R16), e-Frontier Rare Earth (izigidigidi eziyi-R13), e-Hive Energy (izigidi ezingama-R200) kanye nase-RRS Trade and Investment (izigidi eziyi-R100)..UShicilelo Lwesithathu Lweqhingasu Likazwelonke Lwezinsiza Zamanzi (i-NWRS-3) lwangowezi-2023.
",0.709501
"IKhabinethi ithole umbiko wendima yokusebenza eyenziwa yiSewula Afrika ukukhalima ukuziphatha Kwamanye Amalunga we-SANDF athunywe ukuyokusebenza emahlelweni wokuncengelela ukuthula elizwekazini le-Afrika.
","IKhabhinethi ligunyaze i-NWRS-3 yangowezi-2023 ukuthi iqaliswe futhi leli qhingasu liphoqa zonke iziphathimandla kanye nezikhungo ezisebenzisa uMthetho Kazwelonke Wamanzi, we-1998 (uMthetho wama-36 we-1998).
",0.57115495
