src_text,tgt_text,cosine_score
"Ge naga e tsena sehleng sa Marega, Kabinete e amogetše go phethwa ga Konteraka ya 400 megawatts (MW) ya mohlagase wa tlaleletšo ka Lenaneo la Kabo ya Tlwaelo leo le tla tsentšhwago mošomong pele ga mafelelo a Mopitlo 2023.
","Zwenezwi musi shango ḽi tshi khou dzhena kha khalaṅwaha ya Vhuriha, Khabinethe yo ṱanganedza zwa u khunyeledzwa ha Khonṱhiraka ya u ṋetshedza muḓagasi wa 400 megawatsi (MW) dza u ḓadzisa nga kha Mbekanyamushumo ya Ṋetshedzo yo Linganaho (Standard Offer Programme) dzine dza ḓo thoma u vha hone kha sisṱeme ya nḓisedzo ya muḓagasi phanḓa ha musi ṅwedzi wa Shundunthule 2023 u tshi fhela.
",0.68493676
"Go feta fao, Kgoro ya Maphelo e hlaotše dipetlele tše 213 gore di se akaretswe go kgaotšo ya mohlagase, tše 76 tša tšona di šetše di sa akaretšwe gomme mošomo wa go oketša dipetlele tše dingwe tše 46 o gatetše pele.
","Nga nnḓa ha izwo, Muhasho wa Mutakalo wo ṱalusa zwibadela zwa 213 sa zwone zwine zwa tea u sa kwamea nga mafhungo a u khaulwa ha muḓagasi nga u sielisana, hune zwibadela zwi linganaho 76 kha zwenezwi, zwa vha uri zwo no ḓi thoma u sa kwamea nga uhu u khaulwa ha muḓagasi nga u sielisana ngeno hu na uri mushumo wa u engedza zwiṅwe zwibadela zwi linganaho 46 kha mutevhe wa izwo zwine zwa si tee u kwamea nga izwo zwa u khaulwa ha muḓagasi, u tsini na u khunyeledzwa.
",0.61550665
"Kabinete e tšwetše pele go amogela thakgolo ye e lego kgauswi ya Lebenkele la Kakaretšo la Enetši ka la 31 Mopitlo 2023 ke Invest SA go akgofiša ditshepetšo tša taolo tšeo di tlago thuša dikhamphani tše mpsha tša go tšweletša mohlagase gore di akaretšwe.
","Khabinethe yo dovha hafhu ya ṱanganedza zwa u rwelwa ṱari ha Energy One-Stop Shop zwine zwa khou ḓo vha hone hu si kale nga ḽa 31 Shundunthule 2023 nga vha Invest SA u itela u tshimbidza mafhungo a zwa milayo ine ya ḓo thusa khamphani ntswa dza u bveledza muḓagasi u itela uri na dzone dzi thome u shuma nga u ṱavhanya.
",0.6647
"Kabinete e amogetše kgatelopele ye e dirilwego ka Seteišeneng sa Mohlagase sa Kusile ya go bušetša 3 200 MW, ka yuniting ya 1, 2, 3 le ya 5, go keriti ya bosetšhaba mafelelong a 2023.
","Khabinethe yo dovha hafhu ya dzhiela nṱha mvelaphanḓa yo no itwaho fhaḽa kha Tshiṱitshi tsha Muḓagasi tsha Kusile hu tshi itelwa u vhuedzedzwa hafhu ha muḓagasi u linganaho 3 200 MW, kha yunithi dza 1, 2, 3 na 5, murahu kha sisṱeme ya nḓisedzo ya muḓagasi ya lushaka mafheloni a ṅwaha wa 2023.
",0.74048376
"Kabinete e tshwenywa ke phatlalatšo ya ditaba tša maaka ye e tšwelago pele, ka bobegaditaba bja leago bjo bo latofatša go phuhlama ga keriti ya bosetšhaba wo o lego kgauswi woo o tlago feleletša ka kgaotšo ya mohlagase ka botlalo.
","Khabinethe yo kwamea nga zwiito zwa u phaḓaladzwa ha mafhungo ane a si vhe ngoho zwine zwa khou bvela phanḓa, hu tshi khou shumiswa nyanḓadzamafhungo dza matshilisano hune khadzo ha khou ambiwa zwauri hu si kale hu khou ḓo vha na u wa tshoṱhe ha sisṱeme ya nḓisedzo ya muḓagasi ya lushaka, zwine ha khou pfala uri zwi ḓo fhedza zwo vhanga u dzima tshoṱhe ha muḓagasi shango ḽoṱhe.
",0.604396
"Eskom e netefaleditše mmušo ka maano ao a lego gona a ditšhireletšo tša sestemo go thibela kgaotšo ya mohlagase ya bosetšhaba.
","Eskom yo fulufhedzisa muvhuso uri hu na pulane dzi re hone kha sisṱeme yavho dza u thivhela uri hu si vhe na u dzima lwa tshoṱhe ha muḓagasi kha shango ḽoṱhe.
",0.5066856
"Kabinete e bušeletša boipiletšo go batho ka moka ka Afrika Borwa go tšwela pele go boloka mohlagase.
","Khabinethe yo dovha hafhu ya ombedzela khuwelelo kha vhathu vhoṱhe vha fhano Afrika Tshipembe ya uri vha bvele phanḓa na u vhulunga muḓagasi.
",0.47988477
"Nepo ke go boloka bonnyane 1 000 MW letšatši le letšatši, yeo e lekanago le go boloka kgato e tee ya kgaotšo ya mohlagase letšatši le lengwe le le lengwe.
","Tshipikwa tshihulwane ndi u vhulunga muḓagasi u linganaho 1 000 MW ḓuvha ḽiṅwe na ḽiṅwe, zwine hezwi zwa lingana na u vhulunga luṱa lwoṱhe lwa u thoma lwa u khaulwa ha muḓagasi nga u sielisana ḓuvha ḽiṅwe na ḽiṅwe.
",0.5820657
"Tona ya Mohlagase, Ngaka Kgosientsho Ramokgopa, o tla begela setšhaba tshedimošo ya bjalebjale ka ga phethagatšo ya Leanotiro la Enetši ka Labohlano, la 26 Mopitlo 2023, ka kopano ya boraditaba.
","Minisṱa vha Muḓagasi, Dokotela Vho Kgosientsho Ramokgopa, vha ḓo ḓivhadza shango nga ha u thoma u shumiswa ha Pulane ya Mashumele ya zwa Fulufulu nga Ḽavhuṱanu, ḽa 26 Shundunthule 2023, musi vha tshi khou amba na vhoramafhungo.
",0.607768
"Maphelo
","Mutakalo
",0.5424435
"Mmušo o hlomile komiti ya mošomo ya setegeniki, yeo e etilwego pele ke Kgoro ya Bosetšhaba ya Maphelo, go araba go phulega ga kholera go la Hammanskraal ka Toropongkgolo ya Tshwane, yeo e šetšego e tšere maphelo a 15 go fihla ka la 24 Mopitlo 2023.
","Muvhuso wo vhumba komiti ya u shuma ya zwa thekiniki, ine ya khou langwa nga Muhasho wa Mutakalo wa Lushaka, nga murahu ha musi ho vha na tshiwo tsha vhulwadze ha Khoḽera ngei Hammanskraal kha Ḓorobo khulwane ya Tshwane, vhune ho no vhulaha vhathu vha swikaho 15 u swika zwino, nga ḽa 24 Shundunthule 2023.
",0.6778321
"Mošomo wo mogolo o tšwela pele go dira diteko tsa methopo ka moka ye e kgonegago ya tšhilafatšo, e ka ba methopo ya meetse, ditanka tša go sepetša meetse, dipompi le Lenaneo la Tlhwekišo ya Meetse a Ditšhila la Rooiwal (WWTW).
","Hu na mushumo muhulwane u re kati zwazwino wa u ita ndingo kha zwiko zwoṱhe zwine zwa nga vha zwi zwone zwo ḓisaho tshikafhadzo iyi, zwi nga vha zwiko zwa maḓi, maḽori a u ṋetshedza maḓi, dzibommbi na tshiimiswa tsha Mishumo ya u Kunakisa Maḓi a Mashika tsha Rooiwal (WWTW).
",0.5973067
"Go fihla ga bjale, ga go na bohlatse bja ditwatši tša kholera bjo bo hweditšwego methopong ye, se se fa tshepo ya gore go nale kgonagalo ya gore go phulega ga kholera go ka ba go tšwa tiragalong ya tšhilafatšo yeo e diregago gatee nakong ya go feta gomme ditiragalo tša bjale ke ditlamorago tša go fetetšana ka bolwetši gomme le bao ba feteditšwego le bona ba fetetša ba bangwe.
","U swika zwino, a hu athu wanala vhuṱanzi vhu sumbaho uri ho wanala bakhitheria ya khoḽera kha zwiko izwi, zwine hezwi zwa ṋea fulufhelo ḽa uri hu na khonadzeo ya uri tshiwo itshi tsha khoḽera tshi nga vha tsho vha hone nga mulandu wa u tshikafhadzwa ho bvelelaho fhethu huthihi fhedzi, lune zwiwo zwi re hone zwazwino zwa nga vha zwo vha hone nga mulandu wa u tshikafhala ho vhangwaho nga zwiitisi zwa vhuvhili na zwa vhuraru (phiriselano).
",0.5089776
"Ge magato a a tšwelapele, badudi ba Hammanskraal ba hlohleletšwa gore ba bediše meetse a dipompi le go tšhela letswatšana pele ba a nwa.
","Musi maga aya a u lingedza u tandulula thaidzo iyi a tshi khou ḓi bvela phanḓa, vhadzulapo vha fhaḽa Hammanskraal vha khou ṱuṱuwedzwa uri vha vhilise maḓi avho a bommbini nahone vha shele na muṋo muṱuku phanḓa ha musi vha tshi a nwa.
",0.5768919
"Go tlaleletša, mang le mang yo a nago le letšhollo, go sellega goba dika tša go longwa ke mala o swanetše go ya ngakeng ya gagwe goba kliniking ya tikologo ka pela.
","Zwiṅwe hafhu, muthu muṅwe na muṅwe ane a vha na malani, u silingwa kana tsumbadwadze dza thaidzo ya tsukanyo, u tea uri nga u ṱavhanya a dalele dokotela wawe kana kiḽiniki ya henefho tsini nae.
",0.23212916
"Tona ya Meetse le Kelelatšhila, Morena Senzo Mchunu, o tla kopana le Meyara wa Toropokgolo ya Tshwane, Mokhanselara Cilliers Brink, ka Labohlano la di 26 Mopitlo 2023 ka maiteko a go tšweletša leano la mohlakanelwa la tsošološo ya WWTW ya Rooiwal yeo e šaletšego morago.
","Minisṱa vha Muhasho wa Maḓi na Vhuthathazwitzhili, Vho Senzo Mchunu, vha ḓo vha na muṱangano na Ṋeḓorobo wa Ḓorobo khulwane ya Tshwane, Mukhantseḽara Vho Cilliers Brink, nga Ḽavhuṱanu, ḽa 26 Shundunthule 2023 u itela u lingedza u bveledza pulane yo ṱanganelaho ya mushumo wa u vusuluswa ha tshiimiswa tsha Rooiwal WWTW tshine tsho vha tsho tea tsho no vusuluswa kale.
",0.76220334
"Go hwetša tshedimošo ka botlalo o ka leletša mogala wo o šomago bošego le mosegare wa Setheo sa Bosetšhaba sa Malwetši a Fetelago (NICD) go 082 883 9920.
","U itela u wana zwidodombedzwa zwinzhi, vha nga founela kha nomboro ya luṱingo ya Tshiimiswa tsha Malwadze a Phirela tsha Lushaka (NICD) i shumaho awara dza 24 nga ḓuvha kha 082 883 9920.
",0.7135699
"Melawana ya kalafo ya kholera e ka hwetšwa inthaneteng go WEBTOKEDinyakišišo tša Kotara ya Bašomi (QLFS)
","Tsumbamaitele dza u ilafha vhulwadze ha Khoḽera dzi wanala kha inthanethe kha WEBTOKEṰhoḓisiso dza zwa Vhashumi dza Kotara (QLFS)
",0.3281988
"Kabinete e hlohleletšwa ke gore QLFS ya mathomo ya 2023 e laeditše koketšego ya botshelela ka go latelana ya kotara ya palo ya mešomo le gore mešomo ya batho ba milione e batamela kgauswi le batho ba milione bao ba thwetšwego ka matšatšing a pele ga Coronavirus (COVID-19).
","Khabinethe i khou ṱuṱuwedzwa nga fhungo ḽa uri QLFS ya u thoma ya ṅwaha wa 2023 yo sumbedzisa uri ho vha na nyengedzedzo ya vhurathi ya nga kotara nga u tevhekana kha tshivhalo tsha mishumo khathihi na uri zwa u tholwa ha vhathu vha swikaho miḽioni zwi khou vhonala zwi tshi khou ri sendedzela tsini na uri ri swike kha tshivhalo tsha miḽioni tsha vhathu vho tholiwaho kha maḓuvha a phanḓa ha tshiwo tsha dwadze ḽa Khoronavairasi (COVID-19).
",0.66310346
"Se ke sešupo se se kwagalago sa gore ikonomi ya Afrika Borwa e kaonafala go tšwa go khuetšo ya leuba leo.
","Hezwi zwi tou vha tsumbo i re khagala ya uri ikonomi ya Afrika Tshipembe i khou vhonala i tshi khou vhuyelela nga nḓila yo khwaṱhaho vhukuma u bva kha masiandaitwa a dwadze iḽo.
",0.49311587
"Dipalopalo tša mešomo ya kotara ya mathomo di laetša gore mešomo ye 209 000 e hlotšwe ka lekaleng la semmušo gomme mešomo ye 107 000 ka lekaleng leo e sego la semmušo mo kotareng ya mathomo ya ngwaga.
","Mbalombalo dza nga ha vhathu vhane vha khou shuma dza kotara ya u thoma dzo sumbedza uri ho sikwa mishumo i swikaho 209 000 kha sekhithara yo dzudzanyeaho ngeno miṅwe mishumo ya 107 000 yo sikwa kha sekhithara i songo dzudzanyeaho kha tshifhinga tsha kotara ya u thoma ya ṅwaha..Vhushaka ha shango ḽa Afrika Tshipembe na ḽa Amerika (US) Khabinethe yo ombedzela zwauri vhushaka vhukati ha shango ḽa Afrika Tshipembe na ḽa Amerika vhu kha ḓi vha havhuḓi, ho khwaṱha nahone vhune ha vhuedza masia oṱhe u swika zwino nga murahu ha muṱangano we wa vha hone vhukati ha Minisṱa vha Muhasho wa Vhushaka ha Dzitshaka na Tshumisano, Dokotela Vho Naledi Pandor na Muambasada wa ḽa Amerika fhano Afrika Tshipembe, Vho Reuben E Brigety, nga murahu ha maambiwa avho he khao vha vha vha tshi khou pomoka Afrika Tshipembe uri ḽo ṋetshedza zwiṱhavhane kha shango ḽa Russia.
",0.5080463
"Dikamano tša Afrika Borwa le United States (US)
","Khabinethe yo dovha hafhu ya ombedzela zwauri hu na nḓila dzi ḓivheaho dza zwa vhudipuḽomati dzine dza tea u shumiswa nga tshaka dzoṱhe, hu tshi katelwa na shango ḽa US, kha u bvisela khagala thaidzo dzine vha vha nadzo zwenezwo musi dzi tshi tutuwa kha zwa kulangelwe kwa vhushaka ha vhavhili.
",0.29743528
"Kabinete e netefaditše gore dikamano gare ga Afrika Borwa le US ke ye botse, e tiile ebile e hola dinaga ka bobedi morago ga kopano gare ga Tona ya Dikamano tša Boditšhabatšhaba le Tirišano, Ngaka Naledi Pandor le Motseta wa Amerika ka Afrika Borwa, Morena Reuben E Brigety, ka ga dipolelo tša gagwe tša go latofatša gore Borwa Afrika e abetše Russia dibetša.
","Khabinethe yo ṱanganedza nḓivhadzo nga Phresidennde Vho Cyril Ramaphosa ya u vhumbwa ha ṱhoḓisiso yo ḓiimisaho nga yoṱhe ya u ṱoḓisisa mavharivhari a u ṋetshedzwa ha zwiṱhavhane zwi bvaho fhano kha ḽa Afrika Tshipembe zwi tshi ṋewa shango ḽa Russia.
",0.7198092
"Kabinete e boeleditše gore dikanale tša botseta tše di tiiletšeng di hwetšagala ditšhabeng ka moka, go akaretšwa US, go hlagiša ditaba ge di tšwelela ka taolong ya dikamano tša dinagamaloko tše pedi.
","Zwidodombedzwa zwa ṱhoḓisiso iyo zwi ḓo ḓivhadzwa musi tshifhinga tshi tshi swika.
",0.21668023
"Kabinete e amogetše tsebišo ya Mopresidente Cyril Ramaphosa ya go hlongwa ga nyakišišo ye e ikemetšego go nyakišiša ditatofatšo tša kabo ya dibetša go tšwa Afrika Borwa go ya Russia.
","Vhushaka vhukati ha shango ḽa Afrika Tshipembe na ḽa Singapore
",0.6383052
"Dintlha ka botlalo tša nyakišišo di tla tsebagatšwa ka nako ye e swanetšego.
","Phresidennde Vho Ramaphosa vho ṱanganedza Minisṱa Muhulwane wa Riphabuḽiki ya Singapore Vho Lee Hsien Loong nga Ḽavhuvhili, ḽa 16 Shundunthule 2023.
",0.29119378
"Dikamano tša Afrika Borwa le Singapore
","Shango ḽa Singapore ndi mubindudzi muhulwane fhano kha ḽa Afrika Tshipembe, hune ha vha na vhubindudzi ha masheleni a fhiraho R5 biḽioni kha sekhithara dzi fanaho na zwa vhumagi, tshumelo dza zwa masheleni na zwa ndaka.
",0.354107
"Mopresidente Ramaphosa o amogetše Tonakgolo Lee Hsien Loong wa Repabliki ya Singapore ka Labobedi, la 16 Mopitlo 2023.
","Thendelano dzo sainwaho vhukati ha mashango aya mavhili ndi dzine dzo livhiswa kha u khwaṱhisa mbambadzo, vhubindudzi, pfunzo na tshumisano kha zwa vhupileli..Imbizo ya Phresidennde ya nga ha Ḽiedza ḽa Mveledziso ya Tshiṱiriki tsha Kapa Vhukovhela (DDM)
",0.5552
"Singapore ke mmeeletši yo bohlokwa ka Afrika Borwa, ka dipeeletšo tša palomoka ya go feta R5 pilione ka makaleng a go swana le tšweletšo, ditirelo tša ditšhelete le thekišo ya dithoto.
","Phresidennde Vho Ramaphosa vho fara Imbizo ya Phresidennde ya vhurathi ya nga ha DDM ya fhaḽa Kapa Vhukovhela, kha Masipala Wapo wa Drakenstein, kha Tshiṱiriki tsha Cape Winelands, nga Ḽavhuṱanu, ḽa 19 Shundunthule 2023.
",0.6911975
"Ditumelelano tše di saennwego gare ga dinaga tše pedi di ikemišeditše go matlafatša kgwebišano, peeletšo, tšhomišano ya thuto le tšhireletšo..Imbizo ya Mopresidente ya Mmotlolo wa Tlhabollo ya Selete sa Kapa Bodikela (DDM) Mopresidente Ramaphosa o swere Imbizo ya Mopresidente ya botshelela ya DDM go la Kapa Bodikela, Mmasepaleng wa Selegae wa Drakenstein, Seleteng sa Cape Winelands, ka Labohlano, la 19 Mopitlo 2023.
","Phresidennde vho ranga phanḓa vhurumelwa vhu bvaho kha masia mararu a muvhuso nga fhasi ha thero ine ya ri: “A hu Tei U vha na Tsaleli”.
",0.6680505
"Mopresidente o etile pele kemedi go tšwa maemong ka moka a mararo a mmušo ka fase ga kgwekgwe ye: “Se tlogele motho morago”.
","Imbizo iyi yo vha yo rangelwa phanḓa nga madalo a Phresidennde kha vhupo vhu re henefho nga tsini ha Tshiṱuṱuwedzi tsha Mveledziso ya Vhudzulo ha Vhathu ha Vlakkeland, vhune ha vha vhupo vhuhulwanesa ha mveledziso ya vhudzulo ha tshitshavha u swika zwino kha Masipala Wapo wa Drakenstein.
",0.5277908
"Imbizo e etilwe pele ke ketelo ya Mopresidente go Tlhabollo ya Bodulo bja Batho Bjo bo Kopanyago bja Vlakkeland ya kgauswi, yeo e lego tlhabollo ye kgolo ya dintlo tša setšhaba go fihla ga bjale ka Mmasepaleng wa Selegae wa Drakenstein.
","Mveledziso ye ya thomiwa nga ṅwaha wa 2017 dzi ḓo ri musi dzi tshi khunyeledzwa, dza ṋetshedza madzulo a swikala 2 556 kha vhathu vho teaho vhane vha tea u vhuelwa.
",0.61338866
"Tlhabollo yeo e thomilego ka 2017 ge e phethilwe e tla fa baholegi ba ba kgotsofatšago dinyakwa dintlo tše 2 556.
","Zwa u fhaṱwa ha nnḓu dzi swikaho 942 kha Luṱa lwa u Thoma zwazwino zwi kati, lune ho no khunyeledzwa dziṅwe dzi swikaho 454 ngeno dziṅwe dza 301 hu hone dzi tshi kha ḓi vha kati na u fhaṱiwa.
",0.5529646
"Kago ya dintlo tše 942 mo Kgatong ya Pele e a tšwela pele, dintlo tše 454 di phethilwe gomme tše 301 di sa agwa.
","Ndeme ya thandela iyi ndi ya uri i ṋetshedza tshaka dzo fhambanaho dza dzinnḓu u bva kha idzo dza avho vhane vha vha na muholo wa vhukati ha R0 u swika R3 500 (nga fhasi ha u Vula Nḓila Ntswa), u ya kha Mbekanyamushumo ya Sabusidi ya Muthu Muthihi yo Ṱumanywaho na Masheleni, kha avho vhane vha hola muholo wa vhukati ha R3,501 na R22 000 nga ṅwaha.
",0.5283078
"Bohlokwa bja protšeke ye ke gore e hlokomela dikgetho tša dintlo tša go fapafapana go tloga go bao ba nago le letseno la R0 go ya go R3 500 (ka fase ga Breaking New Ground), go fihla go Lenaneo la Thušo ya Motho ka Noši leo le Kgokagantšwego ka Tšhelete, go bao ba hwetšago mogolo wa gare ga R3 501 le R22 000 ka ngwaga.
","Zwoṱhe zwikhala zwa Nnḓu dza zwa Matshilisano khathihi na zwikhala zwa Nnḓu dza Vhahali vha zwa Mmbi zwi a wanala kha thandela iyi.
",0.60173535
"Bobedi menyetla ya Dintlo tša Leago gammogo le menyetla ya Bagale ba Sešole di gona ka gare ga protšeke ye.
","Madalo a Vhulavhelesi kha Masipala Muhulwane wa eThekwini na kha Masipala wa Tshiṱiriki wa uMgungundlovu nga ḽa 18 na 19 Shundunthule 2023.
",0.5633806
"Ketelo ya Tlhokomedišo go Mmasepala wa Metropholithene wa eThekwini le Mmasepala wa Selete wa uMgungundlovu ka la 18 le la 19 Mopitlo 2023.
","Muthusaphresidennde Vho Paul Mashatile vho amba na vhathu vha kwameaho u bva kha zwa pfunzo na vhugudisi, vhulimivhufuwi, makwevho na nḓowetshumo nga tshifhinga tsha madalo avho a zwa vhulavhelesi fhaḽa kha Masipala Muhulwane wa eThekwini na kha Masipala wa Tshiṱiriki wa uMgungundlovu sa tshipiḓa tsha madalo a vhulavhelesi a DDIṅwe ya thandela dza ndeme dze dza dalelwa, ho vha vhupo ha Thandela ya Tshanduko ya Ntshongweni, hune ha vha vhupo vhune khaho ha khou fhaṱiwa Ḓorobo yo Bveledzeaho kha zwa Thekhinoḽodzhi vhukati ha ḓorobo ya Durban na ya Pietermaritzburg.
",0.57276225
"Motlatšamopresidente Paul Mashatile o boledišane le bakgathatema thutong le tlhahlong, temong, kgwebong le intastering nakong ya ketelo ya tlhokomedišo go Mmasepala wa Metropholithene wa eThekwini le Mmasepala wa Selete wa uMgungundlovu bjalo ka karolo ya diketelo tša tlhokomelo ya DDE nngwe ya diprotšeke tše bohlokwa tšeo di etetšwego e bile lefelo la Protšeke ya Catalytic ya Ntshongweni, moo go agwago Smart City gare ga Durban le Pietermaritzburg.
","Thandela iyi i ḓo vusulusa mishumo ya zwa ikonomi kha vhupo honoho, lune ya ḓo ḓisa vhubindudzi vhu linganaho R15 biḽioni kha tshifhinga tsha miṅwaha ya 10 u ya kha ya 15 i ḓaho.
",0.6941328
"Protšeke ye e tla tsošološa ikonomi ka lefelong leo, go ba le seabe go dipeeletšo tša boleng bja R15 pilione mo mengwageng ye 10 go ya go ye 15 ye e tlago.
","Themamveledziso dza maḓi
",0.26692468
"Mananeokgoparara a Meetse
","Phresidennde Vho Ramaphosa vho dalela Thandela ya Maḓi ya Lesotho Highlands nga Ḽavhuvhili, ḽa 23 Shundunthule 2023 he vha shela mulenzhe kha vhuṱambo ha u vula Luṱa lwa 2 lwa thandela iyi.
",0.3314444
"Mopresidente Ramaphosa o etetše Protšeke ya Meetse ya Dinagagodimo tša Lesotho ka Labobedi, 23 Mopitlo 2023 yeo a tšerego karolo moletlong wa yona wa go ribolla lekwate wa Kgato ya 2 ya protšeke.
","Sa thandela yo sainiwaho miṅwaha minzhi yo fhelaho nahone ya dovha ya vha na tshilengo, hovhu vhuṱambo ho sumbedza ndeme ya u engedzwa ha luvhilo lwa u shumiwa ha thandela iyi ine ya vha mushumo wa ndeme wa vhukati ha mashango aya mavhili.
",0.6198172
"Bjalo ka ge o saenetšwe mengwaga ye mmalwa ye e fetilego le go diegišwa, moletlo wo o laeditše tšwelopele ya maitapišo a a bohlokwa a dinaga tše pedi.
","Heyi Thandela ya Maḓi ya Lesotho Highlands ndi ya ndeme kha u ita uri hu vhe na nḓisedzo ya maḓi kha vunḓu ḽa Gauteng, Free State, Mpumalanga, Devhula Vhukovhela na Kapa Devhula.
",0.5240133
"Protšeke ya Meetse ya dinagagodimo tsa Lesotho e bohlokwa kudu mo go kgonthišeng polokego ya kabo ya meetse ka Gauteng, Freistata, Mpumalanga, Leboa Bodikela le Kapa Leboa.
","Hovhu vhubindudzi ha kha themamveledziso ya maḓi vhune ha ḓo khwinifhadza matshilo a vhadzulapo vha Afrika Tshipembe vhu khou bvela phanḓa nga mukovho wa masheleni a fhiraho R14 biḽioni kha mimasipala u itela u tandulula thaidzo dza u salela murahu ha themamveledziso dza zwa maḓi, nga kha Gavhelo ḽa Themamveledziso ya Dzingu nga Vhunzhi (RBIG) khathihi na Gavhelo ḽa Themamveledziso ya Tshumelo dza zwa Maḓi (WSIG).
",0.58517313
"Peeletšo ya mananeokgoparara a meetse go kaonafatša maphelo a Maafrika Borwa e tšwela pele ka kabo ya go feta R14 pilione go mebasepala go rarolla tshalelonthago ya kabo ya maneokgoparara a meetse, ka Thušo ya Mananeokgoparara a Magolo a Selete (RBIG) le Thušo ya Mananeokgoparara a Ditirelo tša Meetse (WSIG).
","Masheleni a RBIG a ḓo shumiswa kha thandela dzi swikaho 130 ngeno ayo a WSIG a tshi ḓo kovhelwa kha thandela dzi fhiraho 400 u mona na shango.
",0.6781095
"RBIG e tla šomišwa go diprotšeke tše 130 gomme WSIG e tla abelwa diprotšeke tša go feta 400 nageng ka bophara.
","Khabinethe i khou dovha hafhu ya pfa yo takadzwa nga fhungo ḽa uri Muhasho wa zwa Maḓi na Vhuthathazwitzhili (DWS) u khou vha na mvelaphanḓa khulwane kha nndwa ya u lwa na zwiito zwa vhuaḓa hune masheleni a swikaho R600 miḽioni a vha o no badelwa murahu nga khamphani dze dza vhuelwa nga u wana thendara dzi songo ḓaho nga ngona.
",0.60927486
"Gape kabinete e kgotsofaditšwe ke gore Kgoro ya Meetse le Kelelatšhila (DWS) e gatela pele mo twantšhong ya bomenetša ka go lefelwa ga tšhelete ye e nyakileng go ba R600 milione ke dikhamphani tšeo di holegilego go tšwa kamogelong ya dithendara tša go se sepetšwe ka tshwanelo.
","Khabinethe yo dovha hafhu ya dzhiela nṱha maga a ndangulo ya u thivhela e a vhewa nga muhasho u itela u fhelisa kushumisele kwa masheleni nga nḓila ine ya si vhe yavhuḓi, ine ya si vhe na mbuelo nahone nga nḓila ya u tambisea.
",0.61954105
"Kabinete e lemogile gape magato a taolo ya thibelo ao a beilwego ke kgoro go fediša ditshenyegelo tše di sa sepetswego ka tshwanelo, tša tshenyo.
","Pfufho ya Magavhelo a zwa Matshilisano
",0.47535038
"Sefoka sa Tšhireletšo ya Leago
","Shango ḽa Afrika Tshipembe ḽo ṱanganedza Pfufho ya Maitele Avhuḓi ya Dzangano ḽa Magavhelo a zwa Matshilisano ḽa Dzitshaka (ISSA) kha zwa Magavhelo a zwa Matshilisano a Afrika kha ṅwaha wa 2023, ḽine ḽa dzhiela nṱha vhubindudzi ha muvhuso kha matshilo a vhana vhashu, nga maanḓa avho vhane vha bva kha miṱa yo shayaho nahone i songo tsireledzeaho.
",0.24930635
"Afrika Borwa e amogetše Sefoka sa Mekgwa ye Mebotse ya Mokgatlo wa Boditšhabatšhaba wa Tšhireletšo ya Leago (ISSA) ka go Tšhireletšo ya Leago ya Afrika 2023, seo se amogelago peeletšo ya mmušo maphelong a bana ba rena, kudu bao ba tšwago malapeng a bohloki le ao a lego kotsing.
","Zwa u dzhenela vhuṱambo uvhu ha pfufho idzi dza maimo a nṱha nga shango ḽa Afrika Tshipembe, zwo vha nga fhasi ha thero ine ya ri: “U engedzwa nga zwiṱuku ha magavhelo a zwa matshilisano uri a kone u katela na vhana vha songo tsireledzeaho: Fhungo ḽa Magavhelo a Thikhedzo ya Vhana, Afrika Tshipembe”.
",0.6400771
"Kgopelo ya Afrika Borwa sefokeng se sa maemo a godimo e be e bitšwa: “Katološo ya kakaretšo ya tšhireletšo ya leago ka go nanya go bana bao ba lego kotsing: Taba ya Thušo ya Thekgo ya Bana, Afrika Borwa”.
","Ho ṱanganedzwa khumbelo dza u tama u dzhenela vhuṱambo uvhu u bva kha zwiimiswa zwine zwa vha miraḓo zwi swikaho 48 zwa mashango a fhiraho 30 a dzhango ḽa Afrika.
",0.5766543
"Palomoka ya dikgopelo tše 138 di amogetšwe go tšwa go ditheo tše 48 tša maloko dinageng tša go feta tše 30 ka Afrika.
","Thuso yashu ya zwa matshilisano ndi tshone tshidziki tsha mbekanyamushumo dza u fhelisa vhushai dza muvhuso nahone ndi dza ndeme kha u vhuisa tshirunzi tsha vhathu vhashu.
",0.38994616
"Thušo ya rena ya leago ke lenaneo la bohlokwa la mmušo la phokotšo ya bohloki ebile le bohlokwa pušetšong ya seriti go batho ba gabo rena.
","Sisṱeme ya magavhelo a matshilisano ya ḽa Afrika Tshipembe ndi iṅwe ya sisṱeme dzine dza vha khulwanesa ḽifhasini, lune ya vha na vhathu vhane vha khou tea u vhuelwa vha fhiraho 18 miḽioni..Vouthu dza Migaganyagwama
",0.5047787
"Mokgwa wa tšhireletšo ya leago wa Afrika Borwa o magareng ga a mangwe a magologolo lefaseng, ka bathušegi ba go feta 18 milione..Dibouto tša Tekanyetšo
","Khabinethe yo takadzwa nga fhungo ḽa uri Vouthu dza Migaganyagwama dza mihasho ya muvhuso dzi khou tshimbila zwavhuḓi.
",0.556663
"Kabinete e kgotsofatšwa ke gore Dibouto tša Tekanyetšo ka dikgoro tša mmušo di tšwela pele gabotse.
","Sheduḽu ya Vouthu dza Migaganyagwama ine ya khou tevhela na nḓivhadzo dza u tikedza dza vhoramafhungo:.Ḽavhuṱanu, ḽa 26 Shundunthule 2023 nga awara ya 13:00, Minisṱa vha Muhasho wa Tshumisano dza Mavhusele na Mafhungo a Sialala (CoGTA), Mufumakadzi Vho Thembi Nkadimeng, vha ḓo ṋea muvhigo kha vhoramafhungo nga ha Vouthu ya Mugaganyagwama wa CoGTA une wa ḓo bvisela khagala maga o livhiswaho kha u khwaṱhisa mashumele a mimasipala..Nga Ḽavhuvhili, ḽa 30 Shundunthule 2023, Minisṱa vha Muhasho wa Mveledziso ya Matshilisano, Mufumakadzi Vho Lindiwe Zulu khathihi na Minisṱa Vha Vhulamukanyi na Tshumelo dza Dzidzhele, Vho Ronald Lamola, vha ḓo ḓivhadza Vouthu dza Migaganyagwama khathihi na zwiṅwe zwidodombedzwa zwa mivhigo yavho ya vhoramafhungo zwi ḓo anḓadzwa nga murahu..Vouthu ya Mugaganyagwama wa Ofisi ya Phresidennde i ḓo ṋetshedzwa nga Ḽavhuraru, ḽa 31 Shundunthule 2023 ngeno muvhigo wa vhoramafhungo wa nga ha mvelaphanḓa ya nga ha Tshanduko ya Milayo khathihi na Maga a zwa Mishumo ane a tshimbidzwa nga Operation Vulindlela u tshi ḓo farwa nga Ḽavhuvhili, ḽa 30 Shundunthule 20
",0.43160012
