src_text,tgt_text,cosine_score
"South Africa supported the adoption of the New Urban Agenda and subsequently implemented it through the country’s Integrated Urban Development Framework (IUDF).
","Kabinete neseditse pula dikgato tsa go phasaladiwa ga sekwalwa sa ntlha se se santseng se tlhoka gore se sekasekwe sa Leano la Lekala la Nama ya Diphologolo tsa Naga gore baagi ba ntshe se se mo mafatlheng bona ka ga ona.
",0.6875642
"The IUDF aims to guide the development of inclusive, resilient and liveable urban settlements.
","Maitlhomo leano leno ke go dira gore intaseteri ya nama ya diphologolo tsa naga amogelwe semmuso mmogo le go godisiwa.
",0.6843897
"The progress report was compiled in consultation with national, provincial and local spheres of government, and relevant NGOs.
","Maitlhomo mangwe lona ke go dira gore re se tlhaele dijo.
",0.4677354
"Integrated Youth Development Strategy (IYDS).
","Bogolo jwa intaseteri ya nama ya diphologolo tsa naga ke kgwebo e sa kwadisiwang semmuso mme dira ka tsela e sa tlhamalalang.
",0.52672374
"Cabinet approved the IYDS for implementation.
","Leano le le tshitshintsweng leno le neelana ka leano le le ka dirisiwang go tsenya tirisong dikgato tsa go dira gore nne kgwebo ya semmuso le go matlafatsa lekala leno gore le nne le lengwe la a samaganang le merero ya go dira gore re nne le dijo tse di sa tlhaeleng mmogo le mo go godiseng ikonomi gore le kgone go tlhola ditiro   Melaotlhomo.
",0.5852277
"The strategy gives effect to the National Youth Policy 2020-.
","Molaotlhomo o Kwalolotsweng Sešwa wa Merero Yotlhe ya Magosi Setso wa Ngwaga wa.
",0.5379444
"It outlines the actions, projects and programmes to be undertaken by various stakeholders from youth formations.
","Kabinete neseditse pula dikgato tsa go isa kwa Palamenteng Molaotlhomo o Kwalolotsweng Sešwa wa Merero Yotlhe ya Magosi Setso wa Ngwaga wa 2022 gore ye go sekasekiwa.
",0.6373586
"It also deals with minimising the duplication of government interventions and guides how civil society and the private sector can support young people from accessing opportunities.
","Maitlhomo dikarolo tse di kwalolotsweng sešwa ke go kwalola sešwa dikarolo tsa Molao wa Magosi Merafe ya go tloga ka ya maKhoi go fitlha ka ya maSan wa ngwaga wa, 2019 (Molao wa bo 03 wa 2019), yo tsentsweng tirisong ka la bo 01 Moranang.
",0.6417275
"The compilation of the strategy involved diverse inputs from various sectors of society.
","Molaotlhomo o Kwalolotsweng Sešwa wa Tshireletso ya Naga ya Temokerasi e Nang le Molaotheo mo Diatleng tsa Digongwana tsa Menolopuso le Ditiragalo tsa Mothale o Ntseng Jalo wa Ngwaga wa.
",0.6585431
"Draft White Paper on Conservation and Sustainable Use of South Africa’s Biodiversity.
","Kabinete neseditse pula dikgato tsa go isa kwa Palamenteng Molaotlhomo o Kwalolotsweng Sešwa wa Tshireletso ya Naga ya Temokerasi e Nang le Molaotheo mo Diatleng tsa Digongwana tsa Menolopuso le Ditiragalo tsa Mothale o Ntseng Jalo wa Ngwaga wa 2022 gore ye go sekasekiwa gape ka matsetseleko.
",0.6278356
"Cabinet approved the draft White Paper on Conservation and Sustainable Use of South Africa’s Biodiversity for public comments.
","Ka gang fa sena go letlelelwa gore nne molao, Molaotlhomo ono tla kwalola sešwa Molao yo dirisiwang ga jaanong wa Tshireletso ya Naga ya Temokerasi e Nang le Molaotheo mo Diatleng tsa Digongwana tsa Menolopuso le Ditiragalo tsa Mothale o Ntseng Jalo wa Ngwaga wa 2004, (Molao wa bo 33 wa 2004).
",0.64719605
"South Africa's biodiversity provides an important basis for economic growth and development, and is critical to people’s livelihoods..
","Molaotlhomo ono setse fetile mo dikgatong tse di matsetseleko tsa go batla maikutlo baagi go latela gore Kabinete ka Motsheganong 2021 letlelele go diragadiwa ga thulagnyo eno.
",0.5940293
"This White Paper gives effect to the recommendations made by the High-Level Panel of Experts appointed in 2019 to review our current policies, legislation and practices on matters relating to iconic species.
","Dikgato tseno tsa go kwalololwa sešwa maitlhomo tsona ke go lepalepanya melao ya ka fa nageng le ya lefatshe ka bophara ya go lwantshana le maiteko menolopuso jaaka go tsenngwa mo go ona dikgato tse di diragadiwang mo dinageng tsa boditšhaba.
",0.68336165
"The report recommended the development of an overarching policy on conservation and sustainable use of the country’s biodiversity.
","Mo go ona go baakantswe gape le dikarolo tsa molao tse di neng di sa kwalega sentle go tsamaisana le Molaotheo jaaka Kgotlatshekelo ya Molaotheo ne ya laela.
",0.60391915
"The policy will be implemented across all spheres of government.
","Jaaka le nngwe ya dinaga tse di saenileng melao ya Lekgotla la Pabalesego la Dinagakopano (UN), Aforika Borwa rwele maikarabelo go dira gore ka fa nageng go ikobelwa melao ya boditšhabatšhaba maitlhomo yona leng go gagamatsa dikgato tsa go lwantshana le ditiragalo tsa menolopuso   Ditiragalo tse di Tlang.
",0.55882025
"Conservation is important for the country’s drive to accelerate economic growth and job creation.
","Samiti ya bo 14 ya Dinaga tsa Brazil, Russia, India, China le Aforika Borwa (BRICS).
",0.484923
"Game Meat Strategy.
","Moporesitente Ramaphosa tla etelela kwa pele mo legatong la naga ya Aforika Borwa Samiti ya bo 14 ya Baeteledipele ba Dinaga tsa BRICS e tla bong tshwerwe ka Mafaratlhatlha Ditlhaeletsano tsa Dibidio e tla Tshwarwang ke Naga ya Rephaboliki ya Batho ba China e tla tshwarwang go tloga ka Labone, 23 go fitlha ka Labotlhano, 24 Seetebosigo.
",0.46701676
"Cabinet approved the publication of the draft Game Meat Strategy for public comments.
",".
",0.15749784
"The strategy seeks to formalise and transform the game meat industry.
","Go nneng tokololo ga rona mo go BRICS go tswelela go tswela naga ya rona mosola.
",0.58173114
"It also seeks to contribute towards food security in sustainable manner.
","Mo ngwageng yo fetileng dilwana tse di rekisediwang dinaga tsa kwa ntle tse leng karolo ya BRICS tse di tswang ka fa nageng ya Aforika Borwa di ne di le kwa godimonyana ga 17% bile dilwana tse di kwa godimonyana ga 29% tse re di rekang kwa dinageng tsa kwa ntle di ne di tswa mo go tsona dinaga tseno.
",0.4439671
"The game meat industry is predominately an informal industry that operates in fragmented manner.
","Boleng jwa dikgato tseno tsa go gwebisana bo tsweletse go gola, mo re bonang palo yotlhe ya go gwebisana ga Aforika Borwa le dinaga tsa BRICS tlhatloga go fitlha go Diranta di le Dibilione di le 702 mo ngwageng wa 2021 leng e oketsegileng go tloga mo Diranteng di le Dibilione di le 487 mo ngwageng wa.
",0.57601964
"The proposed strategy provides an implementation plan that will formalise and strengthen the sector as both provider of food security and an economic growth sector that can help create job opportunities     BILLS.
",".
",0.08347431
"Traditional Affairs General Amendment Bill of.
","Go dirisana mmogo le dinaga tse dingwe tsa BRICS mo maphateng tshwana le boitekanelo le go oketsa dikgato tsa go gwebisana go dirile gore diintaseteri tsa rona ka fa nageng di gole, mmogo le go unngwela dinaga tsotlhe tse leng tokololo ya BRICS.
",0.51133984
"Cabinet approved the submission of the Traditional Affairs General Amendment Bill of 2022 to Parliament for further processing.
","Maitlhomo dipeeletso tsa rona mo diporojekeng tsa tlhagiso ya mafaratlhatlha mmogo le maiteko rona go fedisa melao e kgoreletsang kgwebisano mo go sa tlhokagaleng ke go oketsa dilwana tse di tlhagisiwang ka fa nageng tse di rekisediwang dinaga tse leng tokololo ya BRICS.
",0.64831024
"The amendments seek to revise the Traditional and Khoi-San Leadership Act, 2019 (Act 3 of 2019), which came into effect on 1 April.
","Sekolo sa Mariga sa Merero ya Ikonomi mo Pusong.
",0.37182486
"Protection of Constitutional Democracy Against Terrorist and Related Activities Amendment Bill of.
","Go tloga ka la bo 27 Seetebosigo go fitlha ka la bo 01 Phukwi 2022 Sekolokatiso sa Puso ya Naga (NSG) se tla tshwarela kwa Johannesburg Letsholo la Sekolo sa Mariga sa Merero ya Ikonomi mo Pusong se se tla tsenelwang ke Batlhankedi ba Bagolo ba Dipolotiki.
",0.5351497
"Cabinet approved the submission of the Protection of Constitutional Democracy Against Terrorist and Related Activities Amendment Bill of 2022 to Parliament for further processing.
","Go tla bo go na le Ditona go tswa kwa nageng ya Côte d'Ivoire; ya South Sudan le ya Aforika Borwa; mmogo le Bakaedikakaretso ba mafapha dipuso go tswa kwa Lesotho, Zambia, Democratic Republic of Congo, Tanzania le Ghana tla tsenelwa gape le ke dimeyara tsa naga ya Aforika Borwa, mmogo le ditokololo tsa dikomiti tsa dimeyara le tsa maloko khuduthamaga..   Batlhankedi ba bagolo ba dipolotiki go tswa kwa dinageng tse di farologaneng go solofelwa gore ba tla neelana tshedimosetso le dikakanyo tse ba itemogetseng tsona ka ntlha ya maemo a farologaneng ba itemogelang ona letsatsi le lengwe le le lengwe mo tirong ya bona.
",0.6624981
"Once adopted, the Bill will amend the current Protection of Constitutional Democracy Against Terrorist and Related Activities Act, 2004 (Act 33 of 2004).
","NSG tlhomile letsholo leno la ngwaga le ngwaga ka ngwaga wa 2020 gore le tsenelwe ke batlhankedi ba khuduthamaga, mme dirile seno jaaka karolo ya maikano go ema nokeng puso gore kgone go tlhoma puso e dirang ka botswapelo.
",0.63276976
"The Bill went through an extensive public consultation process after it was approved by Cabinet in May.
","Gare ga dilo tse dingwe tse dintsi, maitlhomo letsholo leno ke tlhatlhelela batlhankedi ba bagolo mo maphateng otlhe mararo puso ka bokgoni jwa boeteledipele le jwa go ikemela mo maikarabelong bona gore ba kgone go mekamekana le dikgwetlho tsa puso tse di thibelang gore re nne le kgolo ya ikonomi e tla nnelang ruri batho botlhe ba nang le seabe mo go yona.
",0.6018796
"The amendments seek to align the country’s domestic instruments of fighting terrorism with the global measures that have been put in place.
","Letsatsi la Boditšhabatšhaba la Nelson Mandela.
",0.3547951
"They have also addressed the clauses that were deemed unconstitutional by the Constitutional Court.
","Monongwaga Letsatsi la Boditšhabatšhaba la Nelson Mandela le tla ketekiwa ka Mosupologo, 18 Phukwi 2022 ka moono yo reng: “Gongwe le gongwe koo leng gone, dira sengwe le sengwe se ka se kgonang ka bonnye jo nang le bona”.
",0.46490282
"As signatory to the UN Security Council, South Africa is duty-bound to domesticate the international laws that seek to strengthen measures to combat global terrorism     UPCOMING EVENTS.
","Jono ke boikuelo jo bo reng batho ba tshwanetse go ema nokeng le go nna le seabe mo letsholong leno ka go nna le seabe se se sa kgaotseng se se tla nnang le mosola wa go ya go ile nngwe ya dikao tseno tsa go nna le seabe se se sa kgaotseng ke Letsholo la ngwaga le ngwaga la Nelson Mandela le le ka ga Dipuisano tsa go Tlhabana Botlhale tsa Bašwa mo Mererong ya Boeteledipele jo bo Senang Dilabe le le samaganang le ditlhogo tse di botlhokwa thata mo bašweng ka fa nageng ya Aforika Borwa mmogo le mo lefatsheng ka bophara.
",0.6983323
"14th Brazil, Russia, India, China and South Africa (BRICS) Summit.
","Paka ya Lekgetho.
",0.250387
"President Ramaphosa will lead South Africa’s participation in the virtual 14th BRICS Leaders’ Summit hosted by the People’s Republic of China from Thursday, 23 to Friday, 24 June.
","Paka ya Lekgetho ya mo ngwageng wa 2022 tla bula ka la bo 01 Phukwi mme ya tswalela ka la bo 24 Diphalane.
",0.61025006
".
","Baduelalekgetho ba rotloediwa go tsenya ditlankana tsa bona tsa lekgetho ka inthanete mo go www.sarsefiling.co.za kgotsa ba di tsenye ka mogala wa seatla mo epeng ya Setheo sa Tirelo ya Lekgetho la Aforika Borwa (SARS)..   Monongwaga SARS tla tswelela go dirisa lenaneo le le tlhatlhobang baduelalekgetho ka go ba tlaletsa dintlha tsa bone tsotlhe tsa lekgetho gore thulaganyo ya lekgetho se ba tlhakatlhakanye tlhogo.
",0.0140078105
"Our BRICS membership   continues to benefit the country.
","Mo ngwageng yo fetileng wa 2021 thulaganyo eno dirisitswe go tlhatlhoba baduelalekgetho ba feta dimilione di le tharo.
",0.4868928
"Last year over 17 percent of South Africa’s exports were destined to other BRICS countries, and over 29 percent of our total imports came from these countries.
","Go tsenngwa ka nako ditokomane tsa lekgetho ga go thuse fela baduelalekgetho gore ba kgone go obamela molao wa tuelo ya lekgetho, gape go thusa puso gore kgone go diragatsa ditirelo tse maAforika Borwa di tlhokang tota   Melaetsa.
",0.5910676
"The value of this trade continues to grow, with total South African trade with other BRICS countries reaching R702 billion in 2021, up from R487 billion in.
","Melaetsa ya go AkgolaKabinete romela melaetsa ya yona ya go akgola le go eletsa masego kwa go: Moatlhodi Owen Lloyd Rogers go latela gore thapiwe go nna Moatlhodi mo Kgotlatshekelong ya Molaotheo ya Aforika Borwa.Kabinete le yona eme ka lefoko la ga Moporesitente Ramaphosa mo go eletseng Moporesitente wa mo malobeng Thabo Mbeki Letsatsi la Matsalo le le tletseng ka Boitumelo fa tshwara dingwaga di le 80, le le ketikileng ka la bo 18 Seetebosigo.
",0.6879015
".
","Rre Mbeki ne na le ponelopele ntle e itumedisang fa go tla mo maAforika Borweng otlhe   Go ThapiwaPele batho botlhe ba thapiwa go tla tlhatlhobiwa makwalo bona dithuto le ditlankana dingwe tse di tlhokagalang.Bakaedi bao Seng ba Khuduthamaga mo Botong ya Merero ya Difofane tsa Aforika Borwa:Rre Ernest Khosa;Mme Bulelwa Koyana;Rre Surendra Sooklal; leMme Rejoice Edith Phewa..     Ditokololo tsa Kantoro ya Setheo sa Merero ya go Abelana ka Tshedimosetso ya Dikoloto tsa Madi go Reka Dintlo  Mme Kenosi Pearl Louisa Selane (Monnasetulo)  Mme Catharina Maria Van der Sandt  Rre Errol Vincent Magerman  Moatefokate Mandla Dludlu  Rre Matsobane Gabriel Mello   Mme Palesa Mawasha   Mme Penelope Anne Beck-Paxton   Mme Sphiwe Dorris Mayinga   Mme Tshifhiwa Victor Mphigalale; lej.
",0.0028596981
"Issues in the Environment.
","Tshedimosetso ka Bolwetsi jwa Mogare wa Corona (COVID-19).
",0.5197446
"Update on the Coronavirus Disease (COVID-19).
","Kabinete akgotse batho botlhe ba Aforika Borwa ba ba tlhophileng go enta le go obamela diporotokholo tsotlhe tsa COVID-19 leng se se bakileng gore naga efoge dipalo tse di tlhatlhogang tsa dikgetse tse dintšhwa ka nako ya lekhubu la botlhano la leroborobo..     Fela, ga re tshwanela go itebala gonne COVID-19 sa ntse le teng.
",0.62137467
"Cabinet commended all people in South Africa who chose to vaccinate and observe all COVID-19 protocols that resulted in the country averting rising numbers of new cases during the fifth wave of the pandemic..
","Le fa naga sa tswa go phimola melawana e neng saletse ya go apara dimaseke fa re le fa gare ga batho, batho ba ba nang le malwetse mangwe a sa alafegeng le ba ba lwalang ba rotloediwa go tswelela go apara dimaseke.
",0.7156172
"However, we must not be complacent as COVID-19 is still in our midst.
","Re tshwanetse gape go tswelela go tlhapa diatla gongwe go dirisa sebolayaditwatsi, le go katogana le go dira gore mafelo re leng mo go ona tlhabiwe ke phefo..     Moento go ya ka bopaki jwa saense santse le ona o gaisang mo go re sireletseng mo bolwetseng jwa COVID-19 mme Kabinete rotloetsa batho botlhe ba ba sa entiwang gore ba se senye nako mme ba ye go enta mme ba ba entilweng bone ba ye go tlhabela moento wa go tsosolosa ba tlhabileng kwa lefelong le le gaufi nabo la go tlhabela moento ntle le go duelela tirelo eo..     Monkeypox.
",0.59039104
"Although the country recently scrapped the compulsory wearing of masks in public, people with comorbidities and those who are ill are encouraged to continue wearing mask.
","Kabinete reboletswe tshedimosetso e mabapi le bolwetsi jwa Monkeypox ya gore ka fa nageng go setse go fitlhetswe batho ba le babedi ba ba nang le bolwetsi jwa Monkeypox mo nageng go latela gore fa gautshwane go fitlhelwe motho wa bobedi.
",0.674243
"We must also continue to wash or sanitise our hands, and observe social distancing and proper ventilation.
","Batho bano ba itlhaotse mo setšhabeng mme ba kwa magaeng bona mme go samaganwe le dithulaganyo tsa go gata motlhala batho bao ba ka tswang ba kopane le batho bano go lekola gore ga ba tshwaetsega..     Lefapha la Boitekanelo le Setheo sa Bosetšhaba sa Malwetse a Tshelanwang ba dirisana le Mokgatlho wa Lefatshe wa Boitekanelo go sekaseka matshosetsi go tshelana ka bolwetse jono ka fa nageng gore tsamaisane le Melawana ya Boditšhabatšhaba ya Boitekanelo..     Mogare wa monkeypox ga tshelane bonolo mme gantsi tshelana fa batho ba ka tshwarana go tshwana le go sunana, go tlampurelana gongwe go kgoma dikarolo tsa mmele tse di nang le dintho tsa monkeypox.
",0.6460545
".
","Batho ba ba se nang matshwao monkeypox ba ka se ke ba tshela batho ba bangwe ka mogare ono..     Kabinete eletsa batho ba ba itemogelang matshwao letshoroma, matshwao a tshwanang le mokgotlhwane a latelwang ke boswata jo bo nang le metsi go ya kwa maokelong a gaufi gore ba bone thuso le kalafi ka bonako.
",0.0040956624
"Vaccination remains the scientifically proven defence against COVID-19 and Cabinet encourages all unvaccinated people to vaccinate without delay and vaccinated people to get their booster shots at their nearest vaccination sites, for free..  Monkeypox.
","Matlhotlhapelo thabene ya East London.
",0.3980779
"Cabinet was updated on the latest developments in the spread of Monkeypox disease in the country following the recent confirmation of second case in the country.
","Matlhotlhapelo kwa Thabeneng ya Enyobeni kwa East London kwa Kapa Botlhaba ka Latshipi, 26 Seetebosigo 2022 a tsereng matshelo bašwa ba le 21 hutsafaditse naga yotlhe.
",0.6655812
"The affected persons are isolating at home and contact tracing is being conducted to detect others who may have been exposed..
","Ga go bonolo go akanya ka manyaapelo malapa a latlhegetsweng ke bana ka tsela e botlhoko jalo..     Kabinete rometse matshediso go malapa a latlhegetsweng ke ba malapa mme ya leboga botlhe ka tshegetso ya setho e neilweng malapa a mo khutsafalong ka nako eno e boima..     Ke selo se se re tshwenyang gore bana ba bonnye jwa dingwaga tse 13 ba ne ba letleletswe go tsena mo lefelong leo gore ba tle go nwa notagi.
",0.6921414
"The Department of Health and the National Institute for Communicable Diseases are collaborating with the World Health Organisation to assess the risk for local transmission in line with the International Health Regulations..
","Re ikuela mo baaging botlhe go nna le seabe ka go dira gore bana ba rona ba babalesege ka dinako tsotlhe..     Bana ba ba nang le dingwaga tse di ka fa tlase ga di le 18 ga ba letlelelwa go tsena mo dithabeneng, dišabining, dibareng le kwa marekisetsong bojalwa.
",0.6465927
"The monkeypox virus is not easily spread and usually only occurs after close contact such as kissing, cuddling or touching parts of the body with monkeypox lesions.
","Barekisi ba nnotagi ba ba fitlhelwang ba tlola melao eno ba tla latofadiwa ka bosenyi mme ba tseelwa dilaesense tsa bona tsa go rekisa notagi..
",0.6328867
"People without monkeypox symptoms cannot spread the virus to others..
","Se se Tswileng mo Samiting ya Setlhopha sa Baeteledipele ba Dinaga tse Supa (G7).
",0.49031395
"Cabinet advised people who experience symptoms of fever, general flu-like signs, followed by blister-like rash to report to their nearest healthcare facility for early detection and treatment..  East London tavern tragedy.
","Moporesidente Cyril Ramaphosa nnile le seabe kwa Samiting ya Baeteledipele ba G7 e neng tshwaretswe kwa Bavaria, Jeremane ka Mosupologo, 27 Sedimonthole.
",0.6842046
"The devastating tragedy at the Enyobeni Tavern in East London in the Eastern Cape on Sunday, 26 June 2022 that claimed the lives of 21 teenagers, has shattered our entire country.
","Moporesidente – yo nnileng le seabe mo dikopanong tse mo go tsona go buisanweng ka merero ya tlelaemete, motlakase, boitekanelo, go nna teng ga dijo mo lefatsheng le merero ya tekatekano ya bong – ne laleditswe ke moamogelabaeng, Motšhanselara Olaf Scholz..     G7 ke foramo ya sepolotiki ya dipuso e gogwang kwa pele ke naga ya Canada, Fora, Jeremane, Itali, Japane, Borithane le Amerika     Ditshwetso tsa Kabinete.
",0.66651785
"It is hard to imagine the anguish of families who lost their children in such tragic manner..
","Sekwalwa se Iseng se Butswe sa Melao ya Lephata la Molao (LSC).
",0.35154647
"Cabinet expressed its condolences to the families who lost their loved ones and thanked everyone for their humanitarian support to the grieving families during this difficult time..
","Kabinete letleletse gore LSC ka phasaladiwa gore baagi ba ntshe se se mo mafatlheng bona ka go sona.
",0.55167454
"It is concerning that children as young as 13 were allowed to enter the venue and consume alcohol.
","Maikemisetso melawana eno ke go bebofatsa diphetogo mo lephateng la molao go dira gore ditheo tsa molao di nne le kemedi go ya ka sebopego sa baagi ka fa nageng.
",0.61192846
"We call on communities to play their part in keeping our children safe at all times..  Children under the age of 18 are not allowed to enter taverns, shebeens, pubs and bottle stores.
","Molao ono tla netefatsa gape le gore go dirwa setheo se se tla tlhagisang batlamedi ba ditirelo tsa molao ba ba katisitsweng go utlwagala le ba ba itseng tiro ya bona ka botlalo.
",0.6328543
"Liquor traders who are found to be contravening any of these laws must be criminally charged and have their operating licences revoked.
","Letsholo la go kwadiwa ga LSC le ne le okametswe ke Lekgotla la Tiro ya Molao, setheo sa semolao se se tlhamilweng go ya ka Karolo ya bo 4 ya Molao wa Tiro ya Molao, wa ngwaga wa 2014 (Molao wa bo 28 wa 2014) mmogo le go kaelwa ke Molao wa Matlafatso ya Maemo Ikonomi Bathobatsho (B-BBEE), wa ngwaga wa 2013 (Molao wa bo 46 wa 2013).
",0.61097294
".
","Molao wa B-BBEE wa 2013 rwesa Tona ya Kgwebisano, Indaseteri le Kgaisano maikarabelo go kwala melao ya tiro e tswileng diatla mo go diragatseng matlafatso ya maemo ikonomi mo bathobantshong mo maphateng a rileng.
",0.03869736
"Outcomes from the Group of Seven (G7) Leaders’ Summit.
","Ga jaana ditokololo tsa porofešene ya molao ga di na molao o di kaelang mo go samaganeng le go tlhoka tekatekano mo porofešeneng ya molao.
",0.4924265
"President Cyril Ramaphosa participated in the G7 Leaders’ Summit which took place in Bavaria, Germany on Monday, 27 June.
","LSC tla phatlaladiwa mo Kaseteng ya Puso matsatsi le 60 go letla gore baagi ba ntshe se se mo mafatlheng bona ka go sona..     Dipegelo tse di Rebolwang Gabedi mo Ngwageng tsa Kgatelopele ya Tiro e Dirilweng.
",0.6631596
"The President – who participated in working sessions where climate, energy, health, global food security and gender equality issues were discussed – was invited by the host, Chancellor Olaf Scholz..
","Kabinete neseditse pula dipegelo tse di rebolwang gabedi mo ngwageng tsa kgatelopele ya tiro e dirilweng tsa paka e akaretsang Diphalane 2021 go fitlha Mopitlwe.
",0.58928984
"The G7 is an intergovernmental political forum consisting of Canada, France, Germany, Italy, Japan, the United Kingdom and the United States  Cabinet Decisions.
","Dipegelo tseno ke karolo ya Leano la go Tsamaisa Tiro ya Pakagare (MSTF) 2019-.
",0.55569935
"Draft Legal Sector Code (Draft LSC).
","MTSF 2019-2024 ke leano la go diragatsa tiro bile gape le disa leano la go tsamaisa tiro ya go dira gore re diragatse Leano la Tlhabololo ya Naga leng Ponelopele ya 2030 e ka ga dilo tse di botlhokwa tse di tshwanetseng go fitlhelelwa mo pusong e busang ga jaanong ya borataro.
",0.58603394
"Cabinet approved the publication of the Draft LSC for public comment.
","Dipegelo tseno di bua ka dikarolo tse di botlhokwa di le supa tsa puso leng (1) Phetogo ya ikonomi le go tlhola ditiro; (2) Thuto, bokgoni le boitekanelo; (3) Go tiisa megolo ya go thusa baagi ka ditirelo tsa motheo tse di ikanyegang le tsa boleng; (4) Kgolaganyo ya dibaka, bonno le pusoselegae; (5) Go nna seoposengwe le go babalela baagi; (6) Mmuso o nang le bokgoni o nang le maitsholo a siameng le o tlisang tlhabologo; le (7) Aforika o botoka le lefatshe le le botoka, gammogo le dikgato tsa go tlisa tharabololo tse di tshwanang le tse di tlhalositsweng tsa pusong e busang ga jaanong ya borataro..     Kabinete itumedisitswe ke kgatelopele e dirilweng mo dintlheng tse di neng di beilweng tsa paka e sekasekwang.
",0.52843964
"The objectives of these codes are to facilitate the transformation of the legal sector to achieve representation as per the country’s demographics.
","Kabinete gape nopotse le dintlha tse go santseng go saletswe morago mo go tsona ka ntlha ya leroborobo la COVID-19 tse go tlhokwang gore go samaganwe le tsona..     Ditona di tla tshwara dikopano le bobegakgang mo dibekeng tse di tlang go tlhalosa ka botlalo se dipegelo tseno di buang ka sona mmogo le go neelana ka tshedimosetso e tseneletseng ka ga dintlha tse di santseng di tlhoka go gagamadiwa     Ditiragalo tse di Tlang.
",0.6510284
"The code will also ensure the development of the body that will produce well-trained and competent providers of legal services.
","Khonferense ya Bathobantsho ba Leng Beng ba Diintaseteri le Beng ba Dikgwebo tse di Gwebang le Dinaga tsa kwa Ntle (BIEC).
",0.50550103
"The development of the Draft LSC was overseen by the Legal Practice Council statutory body established in terms of Section 4 of the Legal Practice Act, 2014 (Act 28 of 2014) and guided by the Broad-Based Black Economic Empowerment Act (B-BBEE), 2013 (Act 46 of 2013).
","BIEC ya ntlha tla tshwarelwa kwa Tikwatikweng ya Boditšhabatšhaba ya Dikhonferense ya Sandton kwa Johannesburg ka Laboraro, 20 Phukwi.
",0.5909493
