src_text,tgt_text,cosine_score
"Mo matsatsing a le mabedi ao, bašwa ba tla neelwa tšhono ya go buisana le Ditona le Batlatsatona mmogo le ba bangwe ba bannaleseabe mo dikatisong tse di farologaneng tsa go itlhamela dikgwebo le go tlhatlhelelwa ka bokgoni go tswa mo pusong le mo badirisanimmogong ba bangwe mo mererong ya loago.
","Muvhuso, sa wone mutholi muhulwanesa, wo fhindula kha ṱhoḓea dza mveledziso ya zwikili na u maanḓafhadzwa ha vhaswa nga u ita uri vhaswa vho fhedzaho pfunzo dzavho dza dziyunivesithi vhane vha si vhe na mishumo vha kone u wana tshenzhemo ya mishumo nga kha Mbekanyamushumo ya zwa Vhugudi na Vhugudisi ha Mishumo ya avho vho fhedzaho pfunzo dza Yunivesithi ya Muhasho wa Tshumelo dza Muvhuso.
",0.6323025
"Kgwedi ya Bašwa e tla thankgololwa ka Labone wa la bo 1 Seetebosigo 2023 ke Tona mo Kantorong ya Moporesitente e e Rweleng Maikarabelo a Basadi, Bašwa le Batho ba ba Nang le Bogolofadi, e bong Ngaka Nkosazana Dlamini Zuma kwa Musiamong wa Hector Pieterson Memorial kwa Soweto.
","Muvhuso u khou dovha hafhu wa thoma u shumisa Tshikwama tsha Mishumo ya zwa Matshilisano, Social Employment Fund (SEF) khathihi na maga a u sika mishumo a Tshumelo dza Vhaswa dza Lushaka (NYS) o vusuluswaho nahone ane a kona u kungedzela vhaswa vha zwigidi na zwigidi ngomu kha ikonomi.
",0.71943116
"Kabinete e ikuetse mo baaging go gagamatsa matsapa a go netefatsa gore bašwa ba fitlhelela ditšhono tsa go nna le seabe mo ikonoming.
","Maga a Mishumo ya Vhaswa a Phresidennde na one o no ḓi kona u tikedza vhaswa kha u kona u swikela zwikhala zwi swikaho miḽioni zwine ngazwo vhaswa vha vha vha tshi khou kona u wana miholo ya tshifhinganyana, u vhewa ha vhaswa kha mishumo i swikaho miḽioni nthihi, zwikhala zwa u guda zwi katelaho na mishumo zwa 250 000 khathihi na zwiṅwe zwikhala zwa 250 000 zwa tshumelo dzi badelaho hu tshi katelwa na vhaswa vha swikaho 500 000 vhane vho dzheniswa kha zwikhala zwa muholo wa tshifhinga tshilapfu.
",0.4458077
"Puso, jaaka e le yona e e thapang batho ka bontsi, e tsibogetse botlhokwa jwa tlhatlhelelo ka bokgoni mmogo le go thapiwa ga bašwa ka go dira gore bašwa ba bantsi ba ba alogileng ba thapiwe mo matsholong a go ithutela tiro mo Lephateng la Ditirelo tsa Puso go tla go ithutela tiro teng.
","Musi ri tshi khou dzhena kha Ṅwedzi wa Vhaswa, muvhuso u khou eletshedza vhathu vhaswa uri vha ḓiṅwalise kha puḽatifomo ya WEBTOKEN , ine ya vha puḽatifomo ine khayo vha nga kona u swikela zwikhala zwa mishumo sa izwi vhaṅwe ngavho vha swikaho miḽioni nṋa vho no ḓiṅwalisa u swika zwino.
",0.5189006
"Puso e samagane gape le go tsenya tirisong Sekgwama sa Matlole a go Thapa Baagi (SEF) mmogo le go tsosolosa Setheo Naga sa Ditirelo tsa Bašwa (NYS) mo matsholo ano a tla tlholelang bašwa ba le diketekete ditiro mo ikonoming.
","U farwa ha Muṱangano wa zwa Ṱhoḓisiso dza zwa Vhulimi fhano Afrika (FARA), Khonifarentsi ya vhumalo (8) ya Mabindu a zwa Vhulimi a Afrika na Vhege ya Saintsi khathihi na Guvhangano ḽa Nnyi na Nnyi ḽa vhu.
",0.6573788
"Letsholo la Moporesidente la Kemonokeng ya Bašwa ka Ditiro le setse le atlegile mo go emeng nokeng ditšhono di le milione le halofo ka megolo ya letseno la nakwana, go tsenya tirong batho ba le milione o le mongwe, ditšhono di le 250 000 tsa go tlhatlhelelwa ka bokgoni o le mo tirong, ditšhono di le 250 000 tsa go lefelwa mabapi le ditirelo tse di abilweng mmogo le bašwa ba le 500 000 ba ba kgonang go itirela letseno le le tla gogang sebaka.
","Khabinethe yo ṱanganedza zwauri Afrika Tshipembe ḽi vhe ḽiṅwe ḽa mashango ane ha ḓo farelwa khaḽo Konifarentsi ya vhu8 ya Mabindu a zwa Vhulimi na Vhege ya zwa Saintsi khathihi na Guvhangano ḽa Nnyi na Nnyi ḽa vhu9 fhaḽa ḓoroboni ya Durban u bva nga ḽa 5 u swika 9 Fulwi 2023.
",0.6398983
"Jaaka re tsena mo Kgweding eno ya Bašwa, puso e gakolola bašwa gore ba ikwadise mo sefalaneng sa WEBTOKEN jaaka bankane ba bona ba le dimilione di le dine bona ba setse ba ikwadisitse, mme seno ke sefalana se ditiro di phasaladiwang teng.
","FARA ndi dzangano ḽihulwane ḽa fhano kha dzhango ḽa Afrika ḽine ḽa vha na vhuḓifhinduleli ha u dzudzanya na u tshimbidza ṱhoḓisiso dza zwa vhulimi khathihi na mveledziso ya vhukoni kha dzhango.
",0.17430432
"Go Tshwara Mmogo Foramo ya bo Robedi ya Dikgwebo tsa Temothuo tsa Aforika mo Dipatlisisong tsa Lephata la Temothuo (FARA) e e Leng Karolo ya Beke ya Saense Mmogo le Kopanokgothakgothe ya Yona ya Borobongwe
","Nga u fara vhuṱambo uvhu, Afrika Tshipembe ḽi ḓo vhuelwa vhukuma u bva kha tshumisano na vhufarisani na zwiimiswa zwa vhulimi na ṱhoḓisiso zwa fhano kha dzhango ḽa Afrika musi hu tshi vha na u kovhana ha nḓivho na maitele avhuḓi kha zwa saintsi ya vhulimi na ṱhoḓisiso.
",0.6022508
"Kabinete e neseditse pula dikgato tsa go tshwara mmogo FARA e e Leng Karolo ya Beke ya Saense Mmogo le Kopanokgothakgothe ya Yona ya Borobongwe gore e tshwarelwe kwa Durban go tloga ka la bo 5 go fitlha ka la bo 9 Seetebosigo 2023.
","Shango ḽa Afrika Tshipembe ḽi dzhiela nṱha ṱhoḓisiso dza zwa vhulimi u itela mveledziso, nga maanḓa zwino musi hu na thaidzo ya tshanduko ya kilima na zwiṅwe zwithu zwine zwa kwama vhukoni ha shango ha u kona u swikela nḓisedzo ya zwiḽiwa, mveledziso ya ikonomi na mishumo.
",0.62343407
"FARA ke mokgatlho o mogolo mo kontinenteng o o rwelelng maikarabelo a go disa le go tsamaisa dipatlisiso tsa merero ya temothuo mmogo le go godisa boitlhamedi ka fa kontinenteng.
","Khonifarentsi iyi i khou lavhelelwa uri i ḓo kunga vhurumelwa vhu swikaho 800 kha vunḓu ḽa KwaZulu-Natal na ḽa Gauteng, nahone hezwi zwi ḓo shela mulenzhe muhulwane vhukuma kha mishumo ya zwa ikonomi..Mafhungo a mbambadzo
",0.5566562
"Ka go tshwara kopano eno, naga ya Aforika Borwa e tla unngwelwa ke tirisanommogo eno mmogo le tirisanommogo magareng ga ditheo tsa dipatlisiso tsa temothuo ka fa kontinenteng gonne mo go yona go tla tlhabanwa botlhale ka tsa saense le dipatlisiso tse di mabapi le temothuo.
","Khabinethe yo ṱanganedza muvhigo une wa sumbedza uri hu khou vha na u khwinifhadzea ha mbekanyamushumo ya zwa mbambadzo na u rengisela nnḓa ya ḽino shango.
",0.5820832
"Aforika Borwa e tsaya dipatlisiso mo mererong ya temothuo jaaka selo se se botlhokwa fa go tla mo tlhabologong, segolo jang fa re lebelela maemo a phetogoloapi mmogo le mabaka a mangwe a a dirang gore naga e tlhoke dijo tse di lekaneng, e godise maemo a ikonomi le go tlhola ditiro.
","Muvhigo wo sumbedzisa uri Afrika Tshipembe ḽo rengisela nnḓa thundu dza mutengo u swikaho R300 biḽioni kha mashango a 12, zwe hezwi zwa sika mishumo ya vhukuma i anganyelwaho henefha kha 57 300.
",0.6226971
"Go solofelwa gore kopano eno e tla ngokela barongwa ba le 800 kwa porofenseng ya KwaZulu-Natal le ya Gauteng, mme seno se tla thusa ikonomi ya rona..Merero ya Kgwebisano
","U tholwa U tholwa hoṱhe hu ḓo khunyeledzwa nga murahu ha musi ho no khwaṱhisedzwa ndalukano khathihi na u ṱanzwa madzina ho teaho.
",0.44253427
"Kabinete e amogetse pegelo e e bontshang diphetogo mo letsholong la naga la kgwebisano le thekiso ya ditlhagisiwa tsa ka fa nageng kwa dinageng tsa kwa ntle.
","Vho Bernard Scelo Duma sa Muthusa Mulangi Muhulu: Mashumele a Mivhuso Yapo na Thikhedzo kha Muhasho wa Tshumisano dza Mavhusele..Bodo ya Vhalangi vha Khoro ya Thekhinoḽodzhi ya Minerala
",0.5396323
"Pegelo eno e bontsha gore naga ya Aforika Borwa e rekiseditse dinaga tsa kwa ntle ditlhagisiwa tsa boleng jwa dibilione di le 300 tsa diranta mo ngwageng wa 2022 mo dinaga di le 12 di rekileng, mme seno se dirile gore badiri ba le 57 300 ba se latlhegelwe ke ditiro tse di tobaneng le intaseteri eno.
","Mufumakadzi Vho Ntombifuthi Zikalala-Mvelase (Muthusamudzulatshidulo vha khou tou dovha u tholwa hafhu )
",0.5222554
"Bao ba Thapilweng Pele batho botlhe ba thapiwa go tla tlhatlhobiwa makwalo a bona a dithuto le ditlankana dingwe tse di tlhokagalang.
","Mufumakadzi Vho Pontsho Maruping (vha khou tou dovha u tholwa hafhu) Vho Rudolf Heydenrich (vha khou tou dovha u tholwa hafhu) Dokotela Vho Siyabonga Simayi Dokotela Vho Takalani Madzivhanḓila Mufumakadzi Vho Azwinndini Mavis Thomani Vho Livhuwani Nengovhela na Mufumakadzi Vho Faith Ntokozo Ngcwabe (Muhasho wa Zwiko zwa Minerala na muimeleli wa Fulufulu)..Bodo ya Vhalangi vha Khoro ya Saintsi ya Mupo
",0.26996952
"Rre Bernard Scelo Duma o thapilwe go nna Motlatsamokaedikakaretso (DDG): Lephata la Ditiro tsa Dipusoselegae le Kemonokeng mo Lefapheng la Pusotshwaraganelo..Mo Botong ya Bakaedi ba Lekgotla la Dithekenoloji tsa Dimenerale Mme Ntombifuthi Zikalala-Mvelase (Motlatsamonnasetulo e bile o thapilwe sešwa)
","Vho Kelepile Dintwe (Mudzulatshidulo) Vho Xolisa Mvinjelwa (Muthusamudzulatshidulo) Muambeli Vho Ntika Maake Dokotela Vho Mayshree Singh Dokotela Vho Siyanda Mngadi Dokotela Vho Ntombifuthi Nxumalo Mufumakadzi Vho Thobeka Njozela Vho Andries Moatshe Dokotela Vho Moloko Matlala Vho Mandla Malindisa
",0.4583185
"Mme Pontsho Maruping (o thapilwe sešwa) Rre Rudolf Heydenrich (o thapilwe sešwa) Ngaka Siyabonga Simayi Ngaka Takalani Madzivhandila Mme Azwinndini Mavis Thomani Rre Livhu Nengovhela le Mme Faith Ntokozo Ngcwabe (Moemedi wa Lefapha la Metswedi ya Dimenerale le Eneji (DMRE))..Mo Botong ya Bakaedi ba Lekgotla la Saense ya Ditikologo
","Dokotela Vho Mmboneni Muofhe na Vho Mosa Mabuza (CEO).
",0.72585166
"Rre Kelepile Dintwe (Monnasetulo) Rre Xolisa Mvinjelwa (Motlatsamonnasetulo) Moatefokate Ntika Maake Ngaka Mayshree Singh Ngaka Siyanda Mngadi Ngaka Ntombifuthi Nxumalo Mme Thobeka Njozela Rre Andries Moatshe Ngaka Moloko Matlala Rre Mandla Malindisa
","Milayotibe.
",0.5159788
"Ngaka Mmboneni Muofhe le Rre Mosa Mabuza (CEO).
","Mvetamveto ya Mulayotibe wa Khwiniso ya Khethekanyo ya Ṱhoḓisiso dza Mapholisa dzo Ḓiimisaho (IPID), ya ṅwaha wa 2023 Khabinethe yo ṱanganedza mvetamveto ya Mulayotibe wa Khwiniso ya IPID wa ṅwaha wa 2023 uri i rumelwe Phalamenndeni.
",0.5866038
"Melaotlhomo.
","Mulayotibe uyu u khwinisa Mulayo wa IPID, wa ṅwaha wa 2011 (Mulayo 1 wa 2011), nahone wa dovha wa ṋetshedza makumedzwa o livhiswaho kha u khwaṱhisa zwa u ḓiimisa nga ndoṱhe ha tshiimiswa na kha mashumele a IPID, zwine hezwi zwa khwaṱhisedza izwo zwine zwa ḓivhiwa sa “McBride judgement”.
",0.13302518
"Sekwalwa se Iseng se Butswe sa Molaotlhomo yo o Kwalolotsweng Sešwa wa Bothati jo bo Ikemetseng jwa Dipatlisiso tsa Dikgetse tse di ka ga go Tlola Molao ga Sepodisi (IPID) wa Ngwaga wa 2023 Kabinete e neseditse pula Sekwalwa se Iseng se Butswe sa Molaotlhomo yo o Kwalolotsweng Sešwa wa IPID wa 2023 gore o romelwe kwa Palamenteng.
","Khwiniso idzi dzi dovha hafhu dza lavhelesa kha fhungo ḽe ḽa ambiwa nga Khothe ya Ndayotewa ye ya ḓivhadza uri dziṅwe mbetshelwa dza Mulayo wa IPID wa ṅwaha wa 2011 a dziho mulayoni, zwine hezwi zwa ṋea maanḓa Minisṱa vha Muhasho wa Mapholisa uri vha imise u shuma Mulangi Muhulu, vha dzhie maga a khaidzo kha Mulangi Muhulu nga murahu ha u imiswa hawe u shuma, khathihi na u pandela Mulangi Muhulu mushumoni.
",0.597208
"Molaotlhomo yono o kwalola sešwa Molao wa IPID wa ngwaga wa 2011 (Molao wa bo 1 wa2011), mme e dira ditshitshinyo tse maitlhomo a tsona e leng go gagamatsa tiro le go ikemela ga setheo sa IPID, e leng go tsibogela “Katlholo ya Kgotlatshekelo e e ka ga Kgetse ya ga Rre McBride”.
","Mulayotibe u dzinginya uri hu vhe na maitele a re khagala nahone a pfalaho a u tholwa ha Mulangi Muhulu khathihi na maitele o fhelelaho nahone o itwaho nga vhuronwane hu tshi itelwa u kona u linga u fulufhedzea ha vhaofisiri vha IPIMulayotibe uyu u dovha hafhu wa ṋetshedza mbetshelwa ya u khwinifhadzwa ha dziṅwe mbetshelwa dza Mulayo Muhulwane, hu u itela uri IPID i kone u ita mushumo wayo nga nḓila yo fhelelaho nahone yavhuḓi.
",0.61213934
"Dikarolo tse di kwalolotsweng sešwa di samagana gape le dikarolo tsa Molao wa IPID wa 2011 tseo Kgotlatshekelo ya Molaotheo e di supileng gore ga di mo molaong, mme tsona ke tse di neelang Tona ya Mapodisi maatla a go emisa Tlhogo ya Setheo mo tirong ya gagwe, go tseela Tlhogo ya Setheo dikgato tsa go mo kgalema morago ga gore a mo emise kwa tirong, mmogo le go tebela Tlhogo ya Setheo mo tirong.
","Iyi mvetamveto ya Mulayotibe i nga wanala kha webusaithi ya WEBTOKEMvetamveto ya Mulayotibe wa Khwiniso ya Milayo ya zwa Vhusevhi nga u Angaredza (GILAB) ya ṅwaha wa 2023 Khabinethe yo ṱanganedza mvetamveto ya GILAB ya ṅwaha wa 2023 u itela uri i kone u rumelwa Phalamenndeni.
",0.6533643
"Molaotlhomo ono o tshitshinya gore dithulaganyo tsa go thapa Tlhogo ya Setheo e nne tse di senang lehunelo mme e nne e e tseneletseng le e e fatololang ka tsenelelo gore maitsholo a motlhankedi wa IPID gore go thapiwe yo a gagwe e leng a a siameng.
","GILAB i dzinginya uri hu vhe na khwiniso kha Mulayo wa Vhusevhi ha Maimo a Nṱha ha Lushaka, wa ṅwaha wa 1994 (Mulayo 39 wa 1994).
",0.53847086
"Molaotlhomo yono o tlhagisa gape le dikarolo tse di kwalolotsweng sešwa tsa Molao yo Mogolo, go dira bonnete jwa gore IPID e diragatsa tiro ya yona ka tshwanelo le ka botswapelo.
","Mulayotibe uyu u ṋea thendelo ya u thoma u shumiswa ha themendelo dza Phaneḽe ya Tsenguluso ya Maimo a Nṱha dza nga ha Zhendedzi ḽa Vhutsireledzi ha Shango (SSA) nga Phresidennde hu tshi katelwa na pulane dza u thoma u shumiswa ha themendelo dza Khomishini ya Ṱhoḓisiso ya zwa Vhulamukanyi kha Mavharivhari a Zwiito zwa u Dzhenelela ha Vhathu vha Nnḓa kha Muvhuso, Zwiito zwa Vhuaḓa na Vhufhura kha Sekhithara ya Muvhuso hu tshi katelwa na Zwiimiswa zwa Muvhuso.
",0.5298115
"Molaotlhomo yono o ka fitlhelwa mo go WEBTOKESekwalwa se Iseng se Butswe sa Molaotlhomo o o Kwalolotsweng Sešwa wa Melao ka Botlalo ya Twantsho ya Bosenyi (GILAB) wa Ngwaga wa 2023 Kabinete e neseditse pula sekwalwa se iseng se butswe sa GILAB sa ngwaga wa 2023 gore se romelwe kwa Palamenteng.
","Mulayotibe uyu u lingedza u:
",0.5352221
"GILAB e na le ditshitshinyo tsa gore Molao wa Naga wa Maano a Twantsho ya Bosenyi o kwalolwe sešwa, (Molao wa bo 39 wa 1994).
","vusulusa tshumelo dza zwa vhusevhi u itela u ṋetshedza mbonalo ya tshiimiswa tshine tsha ita uri hu vhe na mashumele avhuḓi nahone o khwaṱhaho nga u vhumba zhendedzi ḽa zwa vhusevhi ha ngomu hayani khathihi na tshumelo dza zwa vhusevhi ha mashango a nnḓa
",0.5470612
"Molaotlhomo ono o neela maatla ditshwaelo tse di dirilweng ke Phanele ya Moporesitente ya Maemo a a kwa Godimo ya go Sekaseka Maemo a Setho sa Phemelo ya Puso (SSA) mmogo le go diragatsa maano a go tsenya tirisong ditshwaelo tse di dirilweng ke Khomišene ya Diphuruphutso Mabapi le go Goga Puso ka Nko, Bogodu le Bonweenwee mo Ditheong tsa Puso mmogo le mo Ditlamong tsa Puso.
","u khakhulula vhukhakhi vhune ha vha hone kha Mashumele a Vhusevhi ha Vhurathisi sa zwe zwa khwaṱhisedzwa nga Khothe ya Ndayotewa
",0.56851745
"Gare ga tse dingwe tse dintsi maitlhomo a Molaotlhomo ono ke go:
","u tandulula thaidzo dza vhuṱudzeṱudze he ha ṱaluswa nga maitele a vha Tshigwada tsha u Shuma tsha Mishumo ya zwa Masheleni, hu tshi katelwa na maga a u fhelisa zwiito zwa u tshimbidzwa ha masheleni nga nḓila i siho mulayoni khathihi na zwa u ṋetshedzwa ha masheleni kha zwiito zwa vhutherorisi nga u maanḓafhadza zwiimiswa zwa vhutsireledzi ha lushaka u itela uri zwi kone u ita ṱhoḓisiso na u ita tsenguluso ya zwa vhusevhi arali muthu kana tshiimiswa itsho tshi tsha ndeme kha lushaka
",0.21740362
"go rulaganya sešwa ditirelo tsa go lwantshana le bosenyi gore go nne le sebopego sa setheo se se kgonang go dira tiro ka botswapelo le ka matshwanedi ka go tlhoma setheo sa go lwantshana le bosenyi se se tla samaganang le merero ya ka fa nageng mmogo le se se tla samagananang le merero ya boditšhaba
","U khwaṱhisa maga a u langa na u tshimbidza nḓowetshumo ya zwa vhutsireledzi ha phuraivethe sa tshipiḓa tsha maitele a tsireledzo ya lushaka nga u angaredza na
",0.6001332
"go baakanya diphoso tse di leng teng mo go direng ka tshwanelo ga Tiro ya go Lwantshana le Bosenyi jaka Kgotlatshekelo ya Molaotheo e laetse
","u vhea maga a u langa vhuḓifari ha miraḓo ya kale ya tshumelo khathihi na vhaṅwe vhane vha vha na tswikelo kha mafhungo a zwa vhusevhi.
",0.40131074
"go samagana le makoa a a nopotsweng ka go sola mosola dikgato tsa Sepodisi sa Ditirelo tsa Matlole, mmogo le dikgato tsa go lwantshana le ditiragalo tsa go timetsa motlhala wa tšhelete ya bogodu mmogo le tsa go tlamela ka matlole digongwana tsa menolopuso mme seno se ka diriwa ka go neela maatla ditheo tsa phemelo ya naga gore di kgone go batlisisa le go phuruphutsa motho kgotsa setheo seo se ka tswang se belaelwa gore se na le mofetsho tsa mothale oo
","Hoyu Mulayotibe u ḓo dovha hafhu wa vhona uri tshumelo dza SSA a dzi khou shumiswa nga nḓila i songo teaho hu tshi itelwa u vhuedza kana u bveledza ndivho dza vhaṅwe vhathu.
",0.6195822
"go gagamatsa dikgato tsa go laola ditlamo tsa phemelo tse di leng mo taolong ya maloko a poraefete jaaka seo e le karolo e kgolo ya go tlhokomela maemo a phemelo ya naga mme sa bofelo ke
","Khwiniso dzi ḓo dovha hafhu dza khwaṱhisa mushumo wa zwa vhulavhelesi ha mazhendedzi a zwa vhusevhi nga zwiimiswa zwi fanaho na Muṱolimuhulwane wa zwa Vhusevhi, Komiti ya Phalamennde yo Ṱanganelaho na Muṱolambalelano wa Afrika Tshipembe.
",0.61347854
"go tsenya tirisong dikgato tsa go laola maitsholo a bao mo nakong e e fetileng ba kileng ba direla setheo seno mmogo le a batho ba bangwe ba tiro ya bona e ba kgontshang go bona tshedimosetso e e tsamaisanang le twantsho ya bosenyi.
","Mulayotibe uyu u khou wanala kha webusaithi ya WEBTOKEN..Mvetamveto ya Mulayotibe wa Khomishimi ya Tshumelo dza Muvhuso (PSC) ya ṅwaha wa 2023 Khabinethe yo ṱanganedza u anḓadzwa ha mvetamveto ya Mulayotibe wa PSC wa ṅwaha wa 2023 u itela vhupfiwa ha nnyi na nnyi.
",0.573848
"Se sengwe gape se Molaotlhomo ono o samaganang le sona ke go dira bonnete jwa gore ditirelo tsa SSA ga di dirisiwe botlhaswa go tsweletsa maikaelelo a a rileng a batho ba ba rileng.
","Mulayotibe uyu u phumula Mulayo wa PSC, wa ṅwaha wa 1997 (Mulayo 46 wa 1997) wa Ndayotewa ya Riphabuḽiki ya Afrika Tshipembe, wa 1996.
",0.5453811
"Dikarolo tse di kwalolotsweng sešwa di tla matlafatsa dikgato tsa ditheo tse di jaaka Molekodimogolo wa Ditheo Tsotlhe tsa Twantsho ya Bosenyi, Komiti ya Maloko a a Kopaneng a Palamente mo Mererong ya go Lwantshana le Bosenyi mmogo le Motlhankedi yo Mogolo wa Ditiro tsa Boruni ka fa Nageng go lekola maemo a ditheo tsa go lwantshana le bosenyi.
","Mulayotibe u ṋetshedza tshikhala tsha u thomiwa ha khethekanyo ya vhuṅwaleli ho ḓiimisaho ha PSC hu tshi itelwa u khwaṱhisa zwa u ḓiimisa nga ndoṱhe na u sa dzhia sia ha dzangano.
",0.6014332
"Molaotlhomo ono o ka fitlhelwa mo go WEBTOKEN..Sekwalwa se Iseng se Butswe sa Molaotlhomo o o Kwalolotsweng Sešwa wa Khomišene ya Ditirelo tsa Puso (PSC) wa Ngwaga wa 2023 Kabinete e neseditse pula sekwalwa se iseng se butswe sa Molaotlhomo wa PSC wa ngwaga wa 2023 gore baagi ba ntshe se se mo mafatlheng a bona ka ga ona.
","Musi Mulayotibe wo no phasiswa uri u vhe mulayo, mushumo wa PSC u vho ḓo engedzwa u ya na kha mimasipala khathihi na zwiimiswa zwa muvhuso.
",0.64023024
"Molaotlhomo ono o tsena mo legatong la Molao wa PSC wa ngwaga wa 1997 (Molao wa bo 46 wa1997) jaaka e le karolo ya Molaotheo wa Rephaboliki ya Aforika Borwa wa 1996.
","Khwinifhadzo iyi i ḓo ṋea PSC tshikhala tsha u kona u tou lavhelesa lwa tshoṱhe kha zwa u shela mulenzhe hu pfadzaho ho livhiswaho kha u fhaṱa tshumelo ya muvhuso i sedzaho zwililo zwa vhathu, i re na mikhwa yavhuḓi nahone i langwaho nga maitele a tshumelo dzavhuḓi dza muvhuso.
",0.504562
"Molaotlhomo yono o laela gore go tlhomiwe setheo se se ikemetseng sa mokwaledi wa PSC go neela setheo seno maatla a go ikemela le a go se tseye letlhakore.
","Mulayotibe uyu u khou wanala kha webusaithi ya WEBTOKEN.
",0.52909505
"Ka gangwe fa molaotlhomo ono o setse o garetswe gore o ka nna molao, msikarabelo a PSC a tla okediwa gape go akaretsa a gore le dimasepala le dikgwebo tsa puso di tshwanetse go ikarabela mo go yona.
","Mvetamveto ya Mulayotibe wa Mulavhelesi wa Nyukilia ya Lushaka ya ṅwaha wa 2023.
",0.52150035
"Dikarolo tse di kwalolotsweng sešwa di tla neela PSC maatla a a bonagalang a go e kgontsha gore e kgone go dira diphetogo tse di utlwagalang mo go direng gore ditheo tsa puso tsa tirelo ya setšhaba di kgone go tsibogela ditlhokwa tsa baagi, di dire tiro ya tsona ka maitseo le ka maitshwaro a a siameng.
","Khabinethe yo ṱanganedza Mvetamveto ya Mulayotibe wa Mulavhelesi wa Nyukilia ya Lushaka uri u kone u rumelwa Phalamenndeni.
",0.61449075
"Molaotlhomo ono o ka fitlhelwa mo go WEBTOKEN.
","Mulayotibe uyu u khwinisa Mulayo wa Mulavhelesi wa Nyukilia ya Lushaka (NNR), wa ṅwaha wa 1999 (Mulayo 47 wa 1999).
",0.24999568
"Sekwalwa se Iseng se Butswe sa Molaotlhomo o o Kwalolotsweng Sešwa wa Ngwaga wa 2023 wa Taolo ya Motlakase wa Nyutlelia wa Naga Kabinete e neseditse pula sekwalwa se iseng se butswe sa Molaotlhomo o o Kwalolotsweng Sešwa wa Taolo ya Motlakase wa Nyutlelia gore o ka romelwa kwa Palamenteng.
","Mulayotibe u khou lingedza u fhelisa tshikhala tshine tsha vha hone zwazwino kha Mulayo wa NNR wa 1999.
",0.6293386
"Molaotlhomo yono o kwalola sešwa Molao wa Naga wa Taolo ya Motlakase wa Nyutlelia (NNR) wa ngwaga wa 1999 (Molao wa bo 47 wa 1999).
","Mulayo uyu kha tshivhumbeo tshawo tsha zwino, a u elani na maitele a mashumele avhuḓi a dzitshaka kha sia ḽa milayo ya tsireledzo ya nyukilia ngauri a u ambi tshithu nga ha u sa tsireledzea mishumoni ha vhashumi kha muhasaladzo wa tshikhalani.
",0.49617308
"Maitlhomo a molaotlhomo ono ke go samagana le go tswalela diphatlha tse ga jaana di leng teng mo molaong wa NNR wa 1999.
","Mulayotibe uyu wo dovha hafhu wa dzudzanyelwa uri u tshimbilelane na Mulayo wa NNR wa 1999 khathihi na milayo na maitele avhuḓi a Zhendedzi ḽa Fulufulu ḽa Athomiki ḽa Dzitshaka (IAEA).
",0.5888778
"Molao ono jaaka o le ga jaana ga o tsamaisane le maemo a boditšhabatšhaba a a tshwanetsweng go latelwa mo lephateng la pabalelo ya taolo ya motlakase wa nyutlelia gonne ga o samagane le go rarabolola matsapa a malwetse a badiri ba ba direlang ditheo tsa difofane a a tlhodiwang ke mogote wa dilo tse di leng kwa lefaufaung.
","Afrika Tshipembe ndi muraḓo wa IAEA.
",0.5729419
"Molaotlhomo ono o kwalolotswe sešwa ka maitlhomo a go dira gore Molao wa NNR wa ngwaga wa 1999 o tsamaelane le melao ya taolo e e matshwanedi ya Setheo sa Boditšhabatšhaba sa Motlakase wa Dikarolwana tsa Tlholego (IAEA).
","Vhuṱambo vhune ha khou ḓa.
",0.46097365
"Naga ya Aforika Borwa ke karolo ya IAEA.
","U Dzheniswa Tshiduloni ha Phresidennde wa Riphabuḽiki ya Federala ya Nigeria
",0.53864545
"Ditiragalo tse di Tlang.
","Nga Musumbuluwo, wa ḽa 29 Shundunthule 2023, Phresidennde Vho Ramaphosa vha ḓo ṱanganedza thambo ya u dzhenela vhuṱambo ha u Dzheniswa Tshiduloni ha Phresidennde Vho Bola Ahmed Tinubu vha Riphabuḽiki ya Federala ya Nigeria vhane vha kha ḓi tou bva u nangiwa.
",0.09160569
"Go Tlhomiwa mo Setulong ga Moporesitente wa Naga ya Nigeria
","U shela mulenzhe ha Phresidennde hu ḓo sumbedza u bvela phanḓa ha vhushaka ha ndeme vhu re hone vhukati ha shango ḽa Afrika Tshipembe na ḽa Nigeria.
",0.4606746
"Ka Mosupologo wa la bo 29 Motsheganong 2023 Moporesitente Ramaphosa o tla tsibogela taletso ya go ya moletlong wa go Tlhomiwa mo Setulong ga Moporesitente yo a Tlhophilweng Semmuso Rre Bola Ahmed Tinubu wa Naga ya Nigeria.
","Sango ḽa Nigeria ndi muvhambadzelani muhulwane vhukuma na shango ḽa Afrika Tshipembe kha tshipiḓa tsha mashango a re Vhukovhela ha dzhango ḽa Afrika.
",0.6686982
"Go tsibogeleng taletso eno ga Moporesitente go bontsha maikemisetso a go batla go tswelela go dirisana mmogo magareng ga dinaga ka bobedi e leng Aforika Borwa le Naga ya Nigeria.
","Mamaga manzhi o fhambanaho a ḽa Afrika Tshipembe a khou bindudza fhaḽa kha ḽa Nigeria, ngeno khamphani dza ḽa Nigeria na dzone dzi tshi khou thoma u vhonala fhano kha ḽa Afrika Tshipembe.
",0.5638599
"Naga ya Nigeria ke yona e kgolo go di gaisa kwa ntlheng ya Bophirima jwa kontinente ya Aforika e e gwebisanang le naga ya Aforika Borwa.
","Vhege ya Tsireledzo ya Vhana Afrika Tshipembe ḽi ḓo vha ḽi tshi khou fhululedza Vhege ya Tsireledzo ya Vhana u bva nga ḽa 28 Shundunthule u swika ḽa 4 Fulwi 2023 nga fhasi ha thero ine ya ri: “Kha ri Tsireledze Vhana nga Tshifhinga tsha Dwadze ḽa COVID-19 na u Fhira”.
",0.49336624
"Difeme di le ditsi tse di farologaneng tsa naga ya Aforika Borwa di beeleditse kwa nageng ya Nigeria, mme ka fa letlhakoreng le lengwe le dikgwebo tsa kwa Nigeria le tsona di setse di simolotse go itirela leina ka fa nageng ya Aforika Borwa.
","Fulo iḽi ḽi kuvhanganya sekhithara dzoṱhe na zwitshavha uri zwi aluse, zwi ṱhogomele na u tsireledza vhana.2 Houno ṅwaha, fulo iḽi ḽi ḓo sedzesa kha RISIHA, ine ya vha mbekanyamushumo ya u thivhela na u dzhenelela nga u ṱavhanya i wanalaho ngomu kha tshitshavha, ine muhumbulo wayo ha vha u bvisa vhana kha tshiimo tshine a vho ngo tsireledzea ya vha isa kha tshiimo tsha u kona u konḓelela.
",0.4912769
