src_text,tgt_text,cosine_score
"Mošomo wo mogolo o tšwela pele go dira diteko tsa methopo ka moka ye e kgonegago ya tšhilafatšo, e ka ba methopo ya meetse, ditanka tša go sepetša meetse, dipompi le Lenaneo la Tlhwekišo ya Meetse a Ditšhila la Rooiwal (WWTW).
","Ho etswa mosebetsi o moholo wa ho lekola mehlodi yohle e ka bang teng ya tshilafalo, e bang ke mehlodi ya metsi, ditanka tse tsamaisang metsi, dipompo le Tshebetso ya ho Hlwekisa Metsi a Ditshila ya Rooiwal (WWTW).
",0.9525439
"Go fihla ga bjale, ga go na bohlatse bja ditwatši tša kholera bjo bo hweditšwego methopong ye, se se fa tshepo ya gore go nale kgonagalo ya gore go phulega ga kholera go ka ba go tšwa tiragalong ya tšhilafatšo yeo e diregago gatee nakong ya go feta gomme ditiragalo tša bjale ke ditlamorago tša go fetetšana ka bolwetši gomme le bao ba feteditšwego le bona ba fetetša ba bangwe.
","Ho fihlela jwale, ha ho na bopaki ba ho fumanwa ha baktheria ya kholera mehloding ena, e leng se re kgodisang hore ho ka etsahala ebe kholera e bile ketsahalo ya nako e le nngwe feela ya tshilafalo, ka ditshwaetso tsa hajwale tseo e ka nna ya ba di bakilwe ke ba tshwaeditsweng mme le bona ba tshwaetsa ba bang.
",0.95945054
"Ge magato a a tšwelapele, badudi ba Hammanskraal ba hlohleletšwa gore ba bediše meetse a dipompi le go tšhela letswatšana pele ba a nwa.
","Ha mesebetsi ena e ntse e tswela pele, baahi ba Hammanskraal ba kgothaletswa hore ba bedise metsi a pompo mme ba tshele letswai le seng le kae pele ba a nwa.
",0.96421075
"Go tlaleletša, mang le mang yo a nago le letšhollo, go sellega goba dika tša go longwa ke mala o swanetše go ya ngakeng ya gagwe goba kliniking ya tikologo ka pela.
","Ho phaella moo, mang kapa mang ya nang le letshollo, ho nyekelwa ke pelo kapa matshwao a tshebetso ya mala o lokela ho potlakela ngakeng kapa tleliniking ya lehae.
",0.95799017
"Tona ya Meetse le Kelelatšhila, Morena Senzo Mchunu, o tla kopana le Meyara wa Toropokgolo ya Tshwane, Mokhanselara Cilliers Brink, ka Labohlano la di 26 Mopitlo 2023 ka maiteko a go tšweletša leano la mohlakanelwa la tsošološo ya WWTW ya Rooiwal yeo e šaletšego morago.
","Letona la Metsi le Bohlweki, Monghadi Senzo Mchunu, o tla kopana le Ramotse wa Toropo ya Tshwane, Mokhanselara Cilliers Brink, ka Labohlano la 26 Motsheanong 2023 boitekong ba ho theha moralo o kopanetsweng wa ntjhafatso e seng e siilwe ke nako ya Rooiwal WWTBakeng sa dintlha tse ding o ka letsetsa mohala wa mahala o sebetsang bosiu le motsheare wa Setsi sa Naha sa Mafu a Tshwaetsanang (NICD) ho 082 883 9920.
",0.88074493
"Go hwetša tshedimošo ka botlalo o ka leletša mogala wo o šomago bošego le mosegare wa Setheo sa Bosetšhaba sa Malwetši a Fetelago (NICD) go 082 883 9920.
","Tataiso ya phekolo ya Kholera e inthaneteng ho WEBTOKEPatlisiso ya Kotara ya Basebetsi (QLFS)
",0.64729893
"Melawana ya kalafo ya kholera e ka hwetšwa inthaneteng go WEBTOKEDinyakišišo tša Kotara ya Bašomi (QLFS)
","Kabinete e tiisitse hore QLFS ya pele ya 2023 e bontshitse keketseho ya botshelela ya kotara ka tatellano ho dipalo tsa mesebetsi le khiro ya batho ba dimilione tse e haufi haholo le ho fihla khiro ha batho ba dimilione tse pele ho matsatsi a Coronavirus (COVID-19).
",0.71419394
"Kabinete e hlohleletšwa ke gore QLFS ya mathomo ya 2023 e laeditše koketšego ya botshelela ka go latelana ya kotara ya palo ya mešomo le gore mešomo ya batho ba milione e batamela kgauswi le batho ba milione bao ba thwetšwego ka matšatšing a pele ga Coronavirus (COVID-19).
","Sena ke pontsho e hlakileng ya hore moruo wa Afrika Borwa o ntlafala ka matla ka mora ho angwa ke sewa sena.
",0.6576937
"Se ke sešupo se se kwagalago sa gore ikonomi ya Afrika Borwa e kaonafala go tšwa go khuetšo ya leuba leo.
","Kotara ya pele ya dipalopalo tsa khiro di bontsha hore ke mesebetsi e 209 000 e thehilweng e tlasa taolo ya mmuso mme e 107 000 e seng tlasa taolo ya mmuso nakong ya kotara ya pele ya selemo.
",0.5932051
"Dipalopalo tša mešomo ya kotara ya mathomo di laetša gore mešomo ye 209 000 e hlotšwe ka lekaleng la semmušo gomme mešomo ye 107 000 ka lekaleng leo e sego la semmušo mo kotareng ya mathomo ya ngwaga.
","Dikamano tsa Afrika Borwa le United States (US) Kabinete e tiisitse hore dikamano tse pakeng tsa Afrika Borwa le US e ntse e le tsa setswalle, tse matla mme di molemo bakeng sa dinaha ka bobedi ho latela seboka se neng se le dipakeng tsa Letona la Dikamano tsa Matjhaba le Tshebedisano, Ngaka Naledi Pandor le Lenqosa la US Afrika Borwa, Monghadi Reuben E Brigety, ya boletseng hore Afrika Borwa e fana ka dibetsa ho Russia.
",0.63978446
"Dikamano tša Afrika Borwa le United States (US)
","Kabinete e boletse hape hore metjha ya bodiplomate e thehilweng e fumaneha dinaheng tsohle, ho kenyeletsa US, ho phahamisa ditaba tse ka hlahang taolong ya dikamano tsa dinaha tse pedi.
",0.3721965
"Kabinete e netefaditše gore dikamano gare ga Afrika Borwa le US ke ye botse, e tiile ebile e hola dinaga ka bobedi morago ga kopano gare ga Tona ya Dikamano tša Boditšhabatšhaba le Tirišano, Ngaka Naledi Pandor le Motseta wa Amerika ka Afrika Borwa, Morena Reuben E Brigety, ka ga dipolelo tša gagwe tša go latofatša gore Borwa Afrika e abetše Russia dibetša.
","Kabinete e amohela phatlalatso ya Cyril Ramaphosa ya ho thehwa ha patlisiso e ikemetseng ho hlahloba diqoso tsa phano ya dibetsa tsa Afrika Borwa ho Russia.
",0.77211857
"Kabinete e boeleditše gore dikanale tša botseta tše di tiiletšeng di hwetšagala ditšhabeng ka moka, go akaretšwa US, go hlagiša ditaba ge di tšwelela ka taolong ya dikamano tša dinagamaloko tše pedi.
","Dintlha tsa patlisiso di tla phatlalatswa ka nako e loketseng.
",0.55811566
"Kabinete e amogetše tsebišo ya Mopresidente Cyril Ramaphosa ya go hlongwa ga nyakišišo ye e ikemetšego go nyakišiša ditatofatšo tša kabo ya dibetša go tšwa Afrika Borwa go ya Russia.
","Dikamano tsa Afrika Borwa le Singapore
",0.38747853
"Dintlha ka botlalo tša nyakišišo di tla tsebagatšwa ka nako ye e swanetšego.
","Mopresidente Ramaphosa o ile a amohela Tonakgolo Lee Hsien Loong wa Rephabliki ya Singapore ka Labobedi la 16 Motsheanong 2023.
",0.3460044
"Dikamano tša Afrika Borwa le Singapore
","Singapore ke motsetedi ya bohlokwa Afrika Borwa, ka letsete la dibilione tse fetang tse hlano tsa diranta ka kakaretso lefapheng le kang la tlhahiso, ditshebeletso tsa ditjhelete le thekiso ya matlo.
",0.377334
"Mopresidente Ramaphosa o amogetše Tonakgolo Lee Hsien Loong wa Repabliki ya Singapore ka Labobedi, la 16 Mopitlo 2023.
","Ditumellano tse saennweng dipakeng tsa dinaha tsena tse pedi di reretswe ho matlafatsa kgwebo, letsete, thuto le tshebedisano ya tshireletso..Imbizo ya Mopresidente ya Mohlala wa Ntlafatso ya Setereke (DDM) sa Kapa Bophirimela Mopresidente Ramaphosa o ile a isa DDM ya botshelela ya Imbizo ya Mopresidente Kapa Bophirimela, Masepaleng wa Lehae wa Drakenstein, Seterekeng sa Cape Winelands, ka Labohlano la 19 Motsheanong 2023.
",0.7249079
"Singapore ke mmeeletši yo bohlokwa ka Afrika Borwa, ka dipeeletšo tša palomoka ya go feta R5 pilione ka makaleng a go swana le tšweletšo, ditirelo tša ditšhelete le thekišo ya dithoto.
","Mopresidente o ile a etella pele moifo o tswang mafapheng ohle a mmuso a mararo tlasa sehlooho se reng: “Le se ke la Siya Mang kapa Mang ka Morao”.
",0.5922744
"Ditumelelano tše di saennwego gare ga dinaga tše pedi di ikemišeditše go matlafatša kgwebišano, peeletšo, tšhomišano ya thuto le tšhireletšo..Imbizo ya Mopresidente ya Mmotlolo wa Tlhabollo ya Selete sa Kapa Bodikela (DDM) Mopresidente Ramaphosa o swere Imbizo ya Mopresidente ya botshelela ya DDM go la Kapa Bodikela, Mmasepaleng wa Selegae wa Drakenstein, Seleteng sa Cape Winelands, ka Labohlano, la 19 Mopitlo 2023.
","Imbizo e ne e etelletswe pele ke ketelo ya Mopresidente sebakeng sa Ntlafatso ya Bodulo ba Batho Vlakkeland Catalytic e haufi, e leng ntshetsopele ya matlo a setjhaba e kgolo ka ho fetisisa ho fihle jwale Masepaleng wa Lehae wa Drakenstein.
",0.7764983
"Mopresidente o etile pele kemedi go tšwa maemong ka moka a mararo a mmušo ka fase ga kgwekgwe ye: “Se tlogele motho morago”.
","Ntlafatso e tswetseng pele ka 2017 ha e feela e tla fana ka matlo a 2 556 ho batho ba tshwanelehang.
",0.57395184
"Imbizo e etilwe pele ke ketelo ya Mopresidente go Tlhabollo ya Bodulo bja Batho Bjo bo Kopanyago bja Vlakkeland ya kgauswi, yeo e lego tlhabollo ye kgolo ya dintlo tša setšhaba go fihla ga bjale ka Mmasepaleng wa Selegae wa Drakenstein.
","Kaho ya matlo a 942 a Karolo ya Pele e ntse e tswela pele, a 454 a se a phethilwe mme a 301 a ntse a hahwa.
",0.6255588
"Tlhabollo yeo e thomilego ka 2017 ge e phethilwe e tla fa baholegi ba ba kgotsofatšago dinyakwa dintlo tše 2 556.
","Bohlokwa ba projeke ena ke hore e haha mefuta e fapaneng ya dikgetho tsa matlo ho tloha ho a batho ba fumanang moputso wa R0 ho ya ho R3 500 (tlasa Ho Qetella Motheo o Motjha), ho Lenaneo la Ditjhelete le Hokahaneng le Motho ka Mong, bakeng sa batho ba fumanang moputso o pakeng tsa R3 501 le R22 000 ka selemo.
",0.66997993
"Kago ya dintlo tše 942 mo Kgatong ya Pele e a tšwela pele, dintlo tše 454 di phethilwe gomme tše 301 di sa agwa.
","Monyetla wa Bodulo ba Setjhaba hammoho le wa Bahlabani ba Sesole e teng projekeng ena.
",0.5883774
"Bohlokwa bja protšeke ye ke gore e hlokomela dikgetho tša dintlo tša go fapafapana go tloga go bao ba nago le letseno la R0 go ya go R3 500 (ka fase ga Breaking New Ground), go fihla go Lenaneo la Thušo ya Motho ka Noši leo le Kgokagantšwego ka Tšhelete, go bao ba hwetšago mogolo wa gare ga R3 501 le R22 000 ka ngwaga.
","Ketelo ya Bolebedi ya Mmasepala wa Motsemoholo wa eThekwini le Mmasepala wa Setereke sa uMgungundlovu ka la 18 le la 19 Motsheanong 2023.
",0.69315255
"Bobedi menyetla ya Dintlo tša Leago gammogo le menyetla ya Bagale ba Sešole di gona ka gare ga protšeke ye.
","Motlatsi wa Mopresidente Paul Mashatile o ile a buisana le batshehetsi ba amehang ho tsa thuto le thupello, temo, kgwebo le diindasteri nakong ya leeto la bookamedi Mmasepaleng wa Motsemoholo wa eThekwini le Mmasepaleng wa Setereke sa uMgungundlovu e le karolo ya DDM ya ketelo ya bolebedi.
",0.70799184
"Ketelo ya Tlhokomedišo go Mmasepala wa Metropholithene wa eThekwini le Mmasepala wa Selete wa uMgungundlovu ka la 18 le la 19 Mopitlo 2023.
","Diprojeke tse ka sehloohong tse etetsweng e ne e le tsa sebaka sa Projeke ya Ntshongweni Catalytic, moo Smart City e ntse e ahwa pakeng tsa Durban le Pietermaritzburg.
",0.7496881
"Motlatšamopresidente Paul Mashatile o boledišane le bakgathatema thutong le tlhahlong, temong, kgwebong le intastering nakong ya ketelo ya tlhokomedišo go Mmasepala wa Metropholithene wa eThekwini le Mmasepala wa Selete wa uMgungundlovu bjalo ka karolo ya diketelo tša tlhokomelo ya DDE nngwe ya diprotšeke tše bohlokwa tšeo di etetšwego e bile lefelo la Protšeke ya Catalytic ya Ntshongweni, moo go agwago Smart City gare ga Durban le Pietermaritzburg.
","Projeke ena e tla tsosolosa mosebetsi wa moruo sebakeng seo, e tla ba le tlatsetso ya diranta tse dibilione tse ka bang 15 tsa letsete dilemo tse latelang tse 10 ho isa ho tse Tsamaiso ya Phepelo ya Metsi
",0.6286445
"Protšeke ye e tla tsošološa ikonomi ka lefelong leo, go ba le seabe go dipeeletšo tša boleng bja R15 pilione mo mengwageng ye 10 go ya go ye 15 ye e tlago.
","Mopresidente Ramaphosa o ile a etela Morero wa Metsi a Dihlaba tsa Lesotho ka Labobedi la 23 Motsheanong 2023 e leng moo a ileng a kenya letsoho moketeng wa ho fetola lekote la Mohato wa 2 wa projeke.
",0.6830187
"Mananeokgoparara a Meetse
","O saennwe dilemong tse mmalwa tse fetileng mme o ile wa dieha, mokete ona ke pontsho ya ho potlakisa mohato wa dinaha tsena tse pedi.
",0.32116207
"Mopresidente Ramaphosa o etetše Protšeke ya Meetse ya Dinagagodimo tša Lesotho ka Labobedi, 23 Mopitlo 2023 yeo a tšerego karolo moletlong wa yona wa go ribolla lekwate wa Kgato ya 2 ya protšeke.
","Morero wa Metsi a Dihlaba tsa Lesotho o bohlokwa bakeng sa ho netefatsa polokeho ya phepelo ya metsi Gauteng, Foreistata, Mpumalanga, Leboya Bophirima le Kapa Bophirima.
",0.6823727
"Bjalo ka ge o saenetšwe mengwaga ye mmalwa ye e fetilego le go diegišwa, moletlo wo o laeditše tšwelopele ya maitapišo a a bohlokwa a dinaga tše pedi.
","Letsete tsamaisong ya phepelo ya metsi bakeng sa ho ntlafatsa bophelo ba MaAfrika Borwa le ntse le tswela pele, ka phano ya diranta tse ka hodimo ho dibilione tse 14 ho bomasepala bakeng sa ho shebana le ditsamaiso tsa phepelo ya metsi tse saletseng morao, ka Thuso ya Infrastraktjha e Kgolo ya Mabatowa a Mangata (RBIG) le Thuso ya Infrastraktjha ya Ditshebeletso tsa Metsi (WSIG).
",0.6345093
"Protšeke ya Meetse ya dinagagodimo tsa Lesotho e bohlokwa kudu mo go kgonthišeng polokego ya kabo ya meetse ka Gauteng, Freistata, Mpumalanga, Leboa Bodikela le Kapa Leboa.
","RBIG e tla sebediswa diprojekeng tse 130 mme WSIG yona e abelwe diprojeke tse fetang 400 ho phatlalla le naha.
",0.6585155
"Peeletšo ya mananeokgoparara a meetse go kaonafatša maphelo a Maafrika Borwa e tšwela pele ka kabo ya go feta R14 pilione go mebasepala go rarolla tshalelonthago ya kabo ya maneokgoparara a meetse, ka Thušo ya Mananeokgoparara a Magolo a Selete (RBIG) le Thušo ya Mananeokgoparara a Ditirelo tša Meetse (WSIG).
","Kabinete e boetse e thabisitswe ke hore Lefapha la Metsi le Bohlweki (DWS) le nka mehato ya ho lwantsha bobodu ka ho busetswa ha dimilione tse ka bang R600 ke dikhamphani tse unneng molemo ka ho fumana dithendara tse sa tlwaelehang.
",0.81477547
"RBIG e tla šomišwa go diprotšeke tše 130 gomme WSIG e tla abelwa diprotšeke tša go feta 400 nageng ka bophara.
","Kabinete e boetse e hokometse mehato ya taolo ya thibelo e behilweng ke lefapha ho fedisa ditshenyehelo tse sa tlwaelehang, tse se nang ditholwana le tse se nang thuso.
",0.605671
"Gape kabinete e kgotsofaditšwe ke gore Kgoro ya Meetse le Kelelatšhila (DWS) e gatela pele mo twantšhong ya bomenetša ka go lefelwa ga tšhelete ye e nyakileng go ba R600 milione ke dikhamphani tšeo di holegilego go tšwa kamogelong ya dithendara tša go se sepetšwe ka tshwanelo.
","Kgau ya Tshireletso ya Setjhaba
",0.33748794
"Kabinete e lemogile gape magato a taolo ya thibelo ao a beilwego ke kgoro go fediša ditshenyegelo tše di sa sepetswego ka tshwanelo, tša tshenyo.
","Afrika Borwa e fumane Kgau ya Mokgatlo wa Matjhaba ya Tshireletso ya Setjhaba (ISSA) le Ditlwaelo tse Ntle ya maemo ho Tshireletso ya Setjhaba bakeng sa Afrika 2023, e elang hloko letsete la mmuso bophelong ba bana ba rona, haholo ba tswang malapeng a futsanehileng le a nang le mathata.
",0.6399574
"Sefoka sa Tšhireletšo ya Leago
","Tokelo ya ho kena ha Afrika Borwa bakeng sa kgau ena ya maemo e ne e na le sehlooho se reng: “Katoloso ya hanyane ka hanyane ya kakaretso ya tshireletso ho bana ba nang le mathata: Taba ya Krante ya Tlhokomelo ya Ngwana, Afrika Borwa”.
",0.3506958
"Afrika Borwa e amogetše Sefoka sa Mekgwa ye Mebotse ya Mokgatlo wa Boditšhabatšhaba wa Tšhireletšo ya Leago (ISSA) ka go Tšhireletšo ya Leago ya Afrika 2023, seo se amogelago peeletšo ya mmušo maphelong a bana ba rena, kudu bao ba tšwago malapeng a bohloki le ao a lego kotsing.
","Kakaretso ya dikenyeletso tse 138 e ile ya fumanwa ho tswa ho ditho tse 48 tsa mekgatlo e tswang dinaheng tse fetang 30 tse Afrika.
",0.64461184
"Kgopelo ya Afrika Borwa sefokeng se sa maemo a godimo e be e bitšwa: “Katološo ya kakaretšo ya tšhireletšo ya leago ka go nanya go bana bao ba lego kotsing: Taba ya Thušo ya Thekgo ya Bana, Afrika Borwa”.
","Thuso ya rona ya setjhaba ke motheo wa mmuso wa leano la ho fedisa tlala mme e ka sehlohong bakeng sa ho kgutlisa seriti sa batho ba habo rona.
",0.71966255
"Palomoka ya dikgopelo tše 138 di amogetšwe go tšwa go ditheo tše 48 tša maloko dinageng tša go feta tše 30 ka Afrika.
","Tsamaiso ya tshireletso ya Afrika Borwa e hara tse kgolo ka ho fetisisa lefatsheng, mme e na le baamohedi ba fetang dimilione tse.10.
",0.6887729
"Thušo ya rena ya leago ke lenaneo la bohlokwa la mmušo la phokotšo ya bohloki ebile le bohlokwa pušetšong ya seriti go batho ba gabo rena.
","Ditlhophiso tsa Bajete
",0.41625452
"Mokgwa wa tšhireletšo ya leago wa Afrika Borwa o magareng ga a mangwe a magologolo lefaseng, ka bathušegi ba go feta 18 milione..Dibouto tša Tekanyetšo
","Kabinete e thabisitswe ke hore Ditlhophiso tsa Bajete tsa mafapha a mmuso di tswela pele hantle.
",0.608392
"Kabinete e kgotsofatšwa ke gore Dibouto tša Tekanyetšo ka dikgoro tša mmušo di tšwela pele gabotse.
","Sejule ya Ditlhophiso tsa Bajete tse latelang le tshehetso ya dipuisano tsa boraditaba:.Ka Labohlano la 26 Motsheanong 2023 ka 13:00, Letona la Tsamaiso ya Tshebedisano le Ditaba tsa Setso (CoGTA), Mofumahadi Thembi Nkadimeng, o tla tsamaisa puisano le boraditaba e mabapi le Ditlhophiso tsa Bajete tsa CoGTA e tla bontsha mehato e reretsweng ho matlafatsa tshebetso ya bommasepala..Ka Labobedi la 30 Motsheanong 2023, Letona la Ntlafatso ya Setjhaba, Mofumahadi Lindiwe Zulu, le Letona la Toka le Tshokollo ya Batshwaruwa, Monghadi Ronald Lamola, ba tla tshwara seboka sa Ditlhophiso tsa Bajete mme dintlha tsa puisano ya bona le boraditaba di tla fanwa ka nako e loketseng.
",0.59413123
"Ka fase ke Lenaneo la Dibouto tša Tekanyetšo tše di tlago le dikopano tša boraditaba tša thekgo:.Labohlano la 26 Mopitlo 2023 ka 13:00, Tona ya Pušotirišano le Merero ya Setšo (CoGTA), Mohumagadi Thembi Nkadimeng, o tla swara kopano ya boraditaba ka ga Bouto ya Tekanyetšo ya CoGTA yeo e tlago hlaloša magato ao a lebanego le go matlafatša tshepedišo ya mebasepala..Ka Labobedi, la 30 Mopitlo 2023, Tona ya Tlhabollo ya Leago, Mohumagadi Lindiwe Zulu, le Tona ya Toka le Ditirelo tša Tshokollo, Morena Ronald Lamola, ba tla swara Dibouto tša bona tša Tekanyetšo gomme dintlha tša dikopano tša bona tša boraditaba di tla abelanwa mo sebakeng sa go se fetše pelo.
","Ditlhophiso tsa Bajete ya Mopresidente di tla tekwa ka Laboraro la 31 Motsheanong 2023, mme puisano le boraditaba mabapi le Kgatelopele ka Diphetoho tsa Moralo le Mehato ya Khiro ka kgokahano le Operation Vulindlela, di tla tshwarwa ka Labobedi la 30 Motsheanong 20
",0.80363977
"Bouto ya Tekanyetšo ya Mopresidente e tla alwa ka Laboraro, la 31 Mopitlo 2023 gomme kopano ya boraditaba ka ga Kgatelopele ka Dipeakanyoleswa tša Sebopego le Maitapišo a Mešomo ao a rulagantšwego ka lenaneo la Operation Vulindlela e tla swarwa ka Labobedi, la 30 Mopitlo 20
","Sehopotso sa Dilemo tse 20 sa Letsatsi la Afrika le Tsela ya Tekolo ya Semphato ya Afrika (APRM) Kabinete le maAfrika Borwa ohle a ikopantse le kontinente ya Afrika le lefatshe lohle ho keteka Letsatsi la Afrika ka Labone la 25 Motsheanong.
",0.7459346
"Letšatši la Afrika le Segopotšo sa Mengwaga ye 20 ya Mokgwa wa Tekolo ya Sethaka wa Afrika (APRM)
","Selemo sena se bohlokwa ka ho kgetheha kaha se tshwaya sehopotso sa bo-60 sa ho saenwa ha molao wa motheo wa Mokgatlo wa Kopano ya Afrika, e leng selelekela sa Kopano ya Afrika.
",0.7002487
"Kabinete le Maafrika Borwa ka moka ba kopana le kontinente ya Afrika le lefase ka bophara go keteka Letšatši la Afrika ka Labone, la 25 Mopitlo 2023.
","Mookotaba bakeng sa mekete ya 2023– “Ho kenngwa tshebetsong ha Potlakiso ya Sebaka sa Kgwebo e Lokolohileng Kontinenteng ya Afrika” – ho ela hloko mehato e nkilweng bakeng sa ho kenya tshebetsong sebaka se seholo ka ho fetisisa lefatsheng sa tokoloho ya kgwebo.
",0.6778683
"Ngwaga wo o bohlokwa kudu ka ge re keteka segopotšo sa bo60 sa go saenwa ga tšhatha ya go hlongwa ga Mokgatlo wa Botee bja Afrika, e lego makgoraditsela a Kopano ya Afrika.
","Sehopotso sa Kgwedi ya Afrika sa selemong sena se dumellanang le sehopotso sa bo-20 sa APRM, se reretswe ho sebedisa taolo e ntle ka hara kontinente ka thuto ya papiso e hlophisitsweng le boitekolo.
",0.7607685
"Morero wa meketeko ya 2023 – “Go akgofiša phethagatšo ya Lefelo la Kgwebišano ya go Hloka Ditšhitišo Magareng ga Dinaga tša Kontinente ya Afrika” – o amogela dikgato tše di dirwago ka go tliša tirišong ya lefelo le legolo la kgwebišano ya go hloka ditšhitišo.
","Diqeto tsa Kabinete.
",0.2598006
"Segopotšo sa Kgwedi ya Afrika sa ngwaga wo se sepelelana le segopotšo sa bo20 sa APRM, yeo e ikemišeditšego go godiša pušo ye botse ka khontinenteng ka thuto ya mphato ye e rulagantšwego le go itekola.
","Namakwa Special Economic Zone (SEZ)
",0.48938873
"Diphetho tša Kabinete.
","Kabinete e tjhaelletse monwana ho qollwa ha Namakwa SEZ e Aggeneys, Kapa Leboya.
",0.30103832
"Lefelo le le Kgethegilego la Ikonomi la Namakwa (SEZ)
","Tlhahiso ya ho qolla e etswa tumellanong le Molao wa Dibaka tse Kgethehileng tsa Moruo wa 2014 (Molao 16 wa 2014) mme SEZ e sisintsweng, ke karolo ya Tshebetso ya Matsete ya Mopresidente.
",0.60207444
"Kabinete e dumeletše go kgethwa ga SEZ ya Namakwa ka Aggeneys ka Kapa Leboa.
","Namakwa SEZ e tla ba senotlolo sa melemo ya morafo, tlhahiso ya hydrogen e tala, ntlafatso ya infrastraktjha, eneji e ka ntjhafatswang le tshebetso ya temo.
",0.7406479
"Kgetho ye e šišintšwego e dirwa go ya ka Molao wa Dilete tše di Kgethegilego tša Ikonomi, 2014 (Molao wa 16 wa 2014) le SEZ ye e šišintšwego ke karolo ya Lesolo la Peeletšo ya Mopresidente.
","Mafapha a bohlokwa bakeng sa tlhahiso ya mosebetsi le ntlafatso ya moruo wa Kapa Leboya le naha.
",0.6430137
"SEZ ya Namakwa e tla bulela dikholego tša meepo, tšweletšo ya haetrotšene ye tala, tlhabollo ya mananeokgoparara, enetši ye mpshafatšegago le tshepedišo ya temo.
","Matsete a fetang diranta tse dibilione tse 29 a se a ntse a behetswe thoko bakeng sa mohato wa pele wa SEOna a kenyeletsa boitlamo ho tswa ho Vedanta Zinc (Diranta tse dibilione tse 16), Frontier Rare Earth (Diranta tse dibilione tse 13), Hive Energy (Diranta tse dimilione tse 200) le RRS Trade and Investment (Diranta tse dimilione tse 100)..Kgatiso ya Boraro ya Leano la Mohlodi wa Metsi a Setjhaba (NWRS-3) 2023.
",0.794652
"Makala a a bohlokwa kudu mo go hlomeng mešomo le mo tlhabollong ya ekonomi ya Kapa Leboa le naga.
","Kabinete e tjhaelletse monwana NWRS-3 ya 2023, bakeng sa phethahatso, mme leano lena ke le tlamang ho bolaodi bohle le mekgatlo ho kenya tshebetsong Molao wa Naha wa Metsi wa 1998 (Molao 36 wa 1998).
",0.64659643
"Dipeeletšo tša go feta R29 pilione di šetše di dirilwe go kgato ya mathomo ya SETše di akaretša maitlamo go tšwa go Vedanta Zinc (R16 pilione), Frontier Rare Earth (R13 pilione), Hive Energy (R200 milione) le RRS Trade and Investment (R100 milione)..Leano la Bosetšhaba la Methopo ya Meetse Kgatišo ya Boraro (NWRS-3) 2023.
","Leano lena le susumeditswe ke tlhahlobo ya dilemo tse tharo ya NWRS-2, e qollotseng dibaka tsa katleho le dibaka tse ntseng di tobana le mathata.
",0.7259368
"Kabinete e dumeletše NWRS-3 2023 gore e phethagatšwe gomme leano le tlama balaodi ka moka le ditheo tšeo di phethagatšago Molao wa Bosetšhaba wa Meetse, 1998 (Molao wa 36 wa 1998).
","NWRS-3 e na le merero e meraro ya sehlooho, e leng ntlafatso ya metsi le bohlweki e lokelang ho tshehetswa, ho fediswa ha tlala le ho se lekalekane, tlatsetso moruong le tlhahiso ya mosebetsi, mme metsi a lokela ho sireletswa, ho sebediswa, ho ntlafatswa, ho hlokomelwa le ho laolwa ka tsela e tsitsitseng le ka ho lekana.
",0.7324878
"Leano le le thekgwa ke tshekatsheko ya mengwaga ye meraro ya NWRS-2, yeo e hlaotšego mafelo a katlego le mafelo ao a sa dutšego e le tlhohlo.
","Leano lena le etsa ditshisinyo tse tshwarehang bakeng sa ho eketsa phepelo ya metsi, ho fokotsa tlhokeho ya metsi, taolo e atlehang ya metsi le bohlweki, ho laola lefapha la metsi le bohlweki, ho aba metsi bakeng sa phetoho, ho kgothaletsa tshebedisano ya matjhaba, le ho laola metsi le bohloweki tlasa maemo a lehodimo a ntseng a fetoha.
",0.6906146
"NWRS-3 e akaretša dinepo tše tharo tša merero, gore meetse le kelelatšhila di swanetše go thekga tlhabollo, phedišo ya bohloki le go se lekalekane, di na le seabe ikonoming le tlholong ya mešomo, gomme meetse a swanetše go šireletšwa, go šomišwa, go hlabollwa, go hlokomelwa le go laolwa ka mokgwa wa go ya go ile le ka tekatekano.
","NWRS-3 e phatlaladitswe websaeteng ya DWS ho WEBTOKEN..Tlaleho ya Mehato e Kentsweng Tshebetsong ke Lefapha la Tshireletso (DoD) ho Sebetsana le Diketso le Boitshwaro ba Ditho tsa Sesole sa Naha sa Tshireletso sa Afrika Borwa (SANDF) tse Romelwang Mererong ya ho Boloka Kgotso
",0.74754244
"Leano le le dira ditšhišinyo tša go kwagala tša go oketša kabo ya meetse, go fokotša nyakego ya meetse, taolo ye e šomago gabotse ya meetse le kelelatšhila, go laola lekala la meetse le kelelatšhila, go aba meetse leswa bakeng sa phetogo, go tšwetša pele tšhomišano ya boditšhabatšhaba, le go laola meetse le kelelatšhila ka fase ga maemo a boso ao a fetogago.
","Kabinete e amohetse tlaleho mabapi le kgatelopele eo Afrika Borwa e e etsang ho sebetsana le boitshwaro ba ditho tse ding tsa SANDF tse rometsweng bakeng sa ho boloka kgotso ho phatlalla le kontinente.
",0.6716816
"NWRS-3 e phatlaladitšwe wepsaeteng ya DWS go WEBTOKEN..Pego ka ga Magato ao a Phethagaditšwego ke Kgoro ya Tšhireletšo (DoD) go Šogana le Maitshwaro le Mekgwa ya Maloko a Sešole sa Tšhireletšo ya Setšhaba sa Afrika Borwa (SANDF) ao a Rometšwego go Tliša Khutšo Dinageng tša Dintwa Kabinete e amogetše pego ka ga kgatelopele yeo Afrika Borwa e e dirago go šogana le maitshwaro a a mangwe a maloko a SANDF ao a rometšwego masolong a go hlola khutšo go ralala le kontinente.
","SANDF e se e hlokometse mohlodi wa boikgantsho ba naha ha e ntse e kenya letsoho mererong ya ho boloka kgotso kontinenteng, bakeng sa tshireletso e tsitsitseng le kgotso dinaheng tsa Afrika tse ruthuthilweng ke ntwa tse tlasa dithuso tsa Mokgatlo wa Matjhaba a Kopaneng (UN).
",0.8188163
