src_text,tgt_text,cosine_score
"Khabinete yi tlhela yi tsakisiwa hi leswi Ndzawulo ya Mati na Mbhasiso (DWS) yi endlaka matsahalatshala yo lwisana na vukungundzwana laha ku lava ku ringana R600 wa timiliyoni yi hakeriweke hi tikhamphani leti vuyeriweke hi ku kuma tithenda to ka ti nga tshamisekanga.
","Hovhu vhubindudzi ha kha themamveledziso ya maḓi vhune ha ḓo khwinifhadza matshilo a vhadzulapo vha Afrika Tshipembe vhu khou bvela phanḓa nga mukovho wa masheleni a fhiraho R14 biḽioni kha mimasipala u itela u tandulula thaidzo dza u salela murahu ha themamveledziso dza zwa maḓi, nga kha Gavhelo ḽa Themamveledziso ya Dzingu nga Vhunzhi (RBIG) khathihi na Gavhelo ḽa Themamveledziso ya Tshumelo dza zwa Maḓi (WSIG).
",0.55664086
"Khabinete yi tlhele yi amukela magoza yo lawula no sivela lama vekiweke hi ndzawulo ku herisa matirhiselo ya timali yo ka ya nga ri kahle, yo pfumala mbuyelo no tlangisa mali.
","Masheleni a RBIG a ḓo shumiswa kha thandela dzi swikaho 130 ngeno ayo a WSIG a tshi ḓo kovhelwa kha thandela dzi fhiraho 400 u mona na shango.
",0.556116
"Sagwadi ra Vuhlayiseki bya Vaaki
","Khabinethe i khou dovha hafhu ya pfa yo takadzwa nga fhungo ḽa uri Muhasho wa zwa Maḓi na Vhuthathazwitzhili (DWS) u khou vha na mvelaphanḓa khulwane kha nndwa ya u lwa na zwiito zwa vhuaḓa hune masheleni a swikaho R600 miḽioni a vha o no badelwa murahu nga khamphani dze dza vhuelwa nga u wana thendara dzi songo ḓaho nga ngona.
",0.25631255
"Afrika-Dzonga yi kumile Sagwadi ra ndhuma ra Matirhelo ya Kahle ra Nhlangano wa Vuhlayiseki bya Vaaki ra Matiko ya Tinxaka (ISSA) ra Afrika ra 2023, leri tekelaka enhlokweni vuvekisi bya mfumo eka vutomi bya vana va hina, ngopfu lava humaka eka mindyangu ya vusweti no ka yi nga sirhelelekanga.
","Khabinethe yo dovha hafhu ya dzhiela nṱha maga a ndangulo ya u thivhela e a vhewa nga muhasho u itela u fhelisa kushumisele kwa masheleni nga nḓila ine ya si vhe yavhuḓi, ine ya si vhe na mbuelo nahone nga nḓila ya u tambisea.
",0.6493497
"Ku nghena ka Afrika-Dzonga eka sagwadi leri ra ndhuma a ku nyikiwile nhlokomhaka leyi nge: “Ku Engeteleka hi Swintsongontsongo ka ku khavhara ku sirheleriwa ka vaaki eka vana lava nga sirhelelekangiki: Mhaka ya Nyiko ya Mpfuneto wa Vana, Afrika-Dzonga”.
","Pfufho ya Magavhelo a zwa Matshilisano
",0.5679131
"Ntsengo wo ringana 138 wa lava ngheneleke wu amukeriwile kusuka eka 48 wa mavandla lama nga swirho eka matiko yo tlula 30 eAfrika.
","Shango ḽa Afrika Tshipembe ḽo ṱanganedza Pfufho ya Maitele Avhuḓi ya Dzangano ḽa Magavhelo a zwa Matshilisano ḽa Dzitshaka (ISSA) kha zwa Magavhelo a zwa Matshilisano a Afrika kha ṅwaha wa 2023, ḽine ḽa dzhiela nṱha vhubindudzi ha muvhuso kha matshilo a vhana vhashu, nga maanḓa avho vhane vha bva kha miṱa yo shayaho nahone i songo tsireledzeaho.
",0.54641795
"Mpfuneto wa hina wa vaaki i wa nkoka eka nongonoloko wa mfumo wo herisa vusweti no va exivindzini xo vuyisela ndzhuti wa vanhu va ka hina.
","Zwa u dzhenela vhuṱambo uvhu ha pfufho idzi dza maimo a nṱha nga shango ḽa Afrika Tshipembe, zwo vha nga fhasi ha thero ine ya ri: “U engedzwa nga zwiṱuku ha magavhelo a zwa matshilisano uri a kone u katela na vhana vha songo tsireledzeaho: Fhungo ḽa Magavhelo a Thikhedzo ya Vhana, Afrika Tshipembe”.
",0.5140339
"Sisteme ya Afrika-Dzonga ya nsirhelelo wa vaaki hi yin’wana ya letikulu emisaveni, yi na vavuyeriwa vo tlula 18 wa timiliyoni..Tivhoti ta Mipimanyeto
","Ho ṱanganedzwa khumbelo dza u tama u dzhenela vhuṱambo uvhu u bva kha zwiimiswa zwine zwa vha miraḓo zwi swikaho 48 zwa mashango a fhiraho 30 a dzhango ḽa Afrika.
",0.56873095
"Khabinete ya tsaka hileswi Tivhoti ta Mipimanyeto ta tindzawulo ta mfumo ti nga eku fambeni kahle.
","Thuso yashu ya zwa matshilisano ndi tshone tshidziki tsha mbekanyamushumo dza u fhelisa vhushai dza muvhuso nahone ndi dza ndeme kha u vhuisa tshirunzi tsha vhathu vhashu.
",0.4773443
"Xedulu ya Tivhoti ta Mipimanyeto leti taka na tinhlengeletano to tivisa vahangalasi va mahungu leti ti seketelaka tivhoti:.Ravuntlhanu 26 Mudyaxihi 2023 hi 13:00, Holobye wa Mafumele ya Ntirhisano na Timhaka ta Ndhavuko (CoGTA), Manana Thembi Nkadimeng, u ta khoma nhlengelatano yo tivisa vahangalasi va mahungu hi Vhoti ya Mpimanyeto ya CoGTA leyi nga ta andlala magoza lama kongomisiweke eka ku tiyisa matirhelo ya timasipala..Hi Ravumbirhi, 30 Mudyaxihi 2023, Holobye wa Nhluvukiso wa Vaaki, Manana Lindiwe Zulu, na Holobye wa Vululami na Vukorhokeri bya Makhotso, Tatana Ronald Lamola, va ta khoma Tivhoti ta Mipimanyeto naswona vuxokoxoko bya tinhlengeletano to tivisa vahangalasi va mahungu ti ta tivisiwa hi nkarhi lowu faneleke.
","Sisṱeme ya magavhelo a matshilisano ya ḽa Afrika Tshipembe ndi iṅwe ya sisṱeme dzine dza vha khulwanesa ḽifhasini, lune ya vha na vhathu vhane vha khou tea u vhuelwa vha fhiraho 18 miḽioni..Vouthu dza Migaganyagwama
",0.72815883
"Vhoti ya Mpimanyeto ya Hofisi ya Presidente yi ta andlariwa hi Ravunharhu, 31 Mudyaxihi 2023 naswona nhlengeletano yo tivisa vahangalasi va mahungu hi ku humelela ka ku Cinca ka Matshamelo ya swilo na Matshalatshala ya Mitirho lama hlanganisiweke hi Operation Vulindlela yi ta khomiwa hi Ravumbirhi, 30 Mudyaxihi 20
","Khabinethe yo takadzwa nga fhungo ḽa uri Vouthu dza Migaganyagwama dza mihasho ya muvhuso dzi khou tshimbila zwavhuḓi.
",0.5667782
"Ku tlangela Siku ra Afrika na 20 wa Malembe ya Endlelo ro Kambisisa Tintangha ra Afrika (APRM)
","Sheduḽu ya Vouthu dza Migaganyagwama ine ya khou tevhela na nḓivhadzo dza u tikedza dza vhoramafhungo:.Ḽavhuṱanu, ḽa 26 Shundunthule 2023 nga awara ya 13:00, Minisṱa vha Muhasho wa Tshumisano dza Mavhusele na Mafhungo a Sialala (CoGTA), Mufumakadzi Vho Thembi Nkadimeng, vha ḓo ṋea muvhigo kha vhoramafhungo nga ha Vouthu ya Mugaganyagwama wa CoGTA une wa ḓo bvisela khagala maga o livhiswaho kha u khwaṱhisa mashumele a mimasipala..Nga Ḽavhuvhili, ḽa 30 Shundunthule 2023, Minisṱa vha Muhasho wa Mveledziso ya Matshilisano, Mufumakadzi Vho Lindiwe Zulu khathihi na Minisṱa Vha Vhulamukanyi na Tshumelo dza Dzidzhele, Vho Ronald Lamola, vha ḓo ḓivhadza Vouthu dza Migaganyagwama khathihi na zwiṅwe zwidodombedzwa zwa mivhigo yavho ya vhoramafhungo zwi ḓo anḓadzwa nga murahu..Vouthu ya Mugaganyagwama wa Ofisi ya Phresidennde i ḓo ṋetshedzwa nga Ḽavhuraru, ḽa 31 Shundunthule 2023 ngeno muvhigo wa vhoramafhungo wa nga ha mvelaphanḓa ya nga ha Tshanduko ya Milayo khathihi na Maga a zwa Mishumo ane a tshimbidzwa nga Operation Vulindlela u tshi ḓo farwa nga Ḽavhuvhili, ḽa 30 Shundunthule 20
",0.5054774
"Khabinete na MaAfrika-Dzonga hinkwavo va joyina tikonkulu ra Afrika na misava hinkwayo ku tlangela Siku ra Afrika hi Ravumune, 25 Mudyaxihi.
","Vhuṱambo ha vhu20 ha Ḓuvha ḽa Afrika na Maitele a Tsenguluso ya Vhuthihi ha Afrika (APRM)
",0.7025
"Lembe leri i lembe ra nkoka tanihileswi ri funghaka ku tlangeriwa ka vu60 ka ku sayiniwa ka chata yo sungula ya Nhlangano wa Vun’we bya Afrika, musunguri wa Nhlangano wa Afrika.
","Khabinethe khathihi na vhadzulapo vhoṱhe vha ḽa Afika Tshipembe i khou vha luthihi na dzhango ḽoṱhe ḽa Afrika khathihi na ḽifhasi ḽoṱhe nga u angaredza kha u pembelela Ḓuvha ḽa Afrika nga Ḽavhuṋa, ḽa 25 Shundunthule.
",0.60312414
"Nhlokomhaka ya ku tlangela ka 2023 – “Ku Hatlisisa ku tirhisiwa ka Ndhawu ya Mabindzu Lama Ntshuxekeke ya Tikonkulu ra Afrika” – yi amukela matshalatshala lama endliwaka ku tirhisa ndhawu leyikulu ya mabindzu lama ntshuxekeke emisaveni hinkwayo.
","Uno ṅwaha ndi wa ndeme vhukuma sa izwi u ṅwaha wa u pembelela miṅwaha ya 60 u bva tshe ha sainwa thendelanomviswa ya u tumbulwa ha Dzangano ḽa Vhuthihi ha Afrika, ḽine ḽa vha ḽone ḽo rangelaho Mbumbano ya Afrika.
",0.6431584
"Ku tsundzuka N’hweti ya Afrika ka lembe leri swi fambisana na ku tlangeriwa ka APRM ka vu20, leswi xikongomelo xa swona ku nga ku sindzisa mafumele lamanene eka tikonkulu hi ku tirhisa ku dyondza eka tintangha na ku tikambela hi wexe.
","Thero ya vhuṱambo ha ṅwaha wa 2023 ndi ine ya ri “U Ṱavhanyedza u Thoma u Shumiswa ha Vhupo ha Mbambadzo dzo Vhofholowaho ha Dzhango ḽa Afrika” – u dzhiela nṱha ndingedzo dzine dza khou itwa kha zwa u thoma u shuma ha vhupo ha mbambadzo yo vhofholowaho vhu hulwanesa ḽifhasini.
",0.66173935
"Swiboho swa Khabinete.
","Vhuṱambo ha u pembelela Ṅwedzi wa Afrika ha ṋaṅwaha, vhu khou vha hone nga tshifhinga tsha musi hu tshi khou pembelelwa miṅwaha ya 20 ya APRM, ine yo livhiswa kha u ṱuṱuwedza mavhusele avhuḓi kha dzhango ḽoṱhe nga kha maitele a u gudisana na u sengulusana nga tshashu.
",0.20855494
"Ndhawu ya Ikhonomi yo Hlawuelka (SEZ) ya le Namakwa
","Tsheo dza Khabinethe.
",0.6152061
"Khabinete yi pasisile ku thyiwa ka Namakwa SEZ eAggeneys eNorthern Cape.
","Vhupo ha zwa Ikonomi ho Khetheaho (SEZ) ha Namakwa Khabinethe yo ṱanganedza zwa u tiwa ha vhupo ha Namakwa SEZ vhu re ngei Aggeneys kha ḽa Kapa Devhula.
",0.6793253
"Ku thyiwa loku ringanyetiweke swi endliwa hi ku ya hi Nawu wa Tindhawu ta Ikhonomi yo Hlawuleka, 2014 (Nawu wa 16 wa 2014) naswona SEZ leyi ringanyetiweke i xiphemu xa Nsusumeto wa Presidente wa Vuvekisi.
","U tiiwa uhu hune ha khou dzinginywa hu khou itwa u ya nga Mulayo wa Vhupo ho Khetheaho ha zwa Ikonomi, wa ṅwaha wa 2014 (Mulayo 16 wa 2014) nahone iyo SEZ ine ya khou dzinginywa ndi tshipiḓa tsha Fulo ḽa zwa Vhubindudzi ḽa Phresidennde.
",0.6634396
"SEZ ya Namakwa yi ta pfula ku vuyeriwa eka migodi, ku kumiwa ka hayidrojeni leyi pfuxetekaka, Nhluvukiso wa switirhisiwa, eneji leyi pfuxetekaka na ku luamisiwa ka swikumiwa swa vurimi.
","Hovhu vhupo ha Namakwa SEZ vhu ḓo vula zwikhala zwa mbuelo kha zwa migodi, vhubveledzi ha geseluḓi dala, vhubveledzi ha themamveledziso, fulufulu ḽi vusuluseaho na zwa u shandukiswa ha zwibveledzwa zwa vhulimi zwa vha zwiḽiwa.
",0.634238
"Tisekitara leti ti na nkoka eka ku tumbuluxa mitirho na nhluvukiso wa ikhonomi eNorthern Cape na tiko hinkwaro.
","Hedzi sekhithara ndi dza ndeme kha u sikwa ha mishumo khathihi na mveledziso ya ikonomi ya vhupo ha Kapa Devhula khathihi na shango nga u angaredza.
",0.6054219
"Ku tlula R29 wa tibiliyoni ya vuvekisi se yi tiyisisiwile eka xiyenge xa n’we xa SELeswi swi katsa ku tiyimisela ku suka eka Vedanta Zinc (R16 wa tibiliyoni), Frontier Rare Earth (R13 wa tibiliyoni), Hive Energy (R200 wa timiliyoni) na RRS Trade and Investment (R100 wa timiliyoni)..Nkandziyiso wa Vunharhu wa Qhinga ra Xipfuno xa Mati ra Rixaka (NWRS-3) 2023.
","Vhubindudzi ha masheleni a fhiraho R29 biḽioni ho no ḓi fulufhedziswa u swika zwino kha luṱa lwa u thoma lwa SEHezwi zwi katela pfulufhedziso u bva kha vha Vedanta Zinc (R16 biḽioni), Frontier Rare Earth (R13 biḽioni), Hive Energy (R200 miḽioni) na RRS Trade and Investment (R100 miḽioni)..Luṱa lwa Vhuraru lwa Maano a Zwiko zwa Maḓi zwa Lushaka (NWRS-3) 2023.
",0.684705
"Khabinete yi pasisile NWRS-3 2023 ku va ri tirhisiwa naswona qhinga ri boheka ku tirhisiwa eka vulawuri honkwabyo na le ka mavandla lama tirhisaka Nawu wa Mati wa Rixaka, 1998 (Nawu wa 36 wa 1998).
","Khabinethe yo ṱanganedza NWRS-3 2023 uri ithome u shumiswa nahone maano aya ndi ane a vha mbofho kha maanḓalanga na zwiimiswa zwoṱhe zwine zwa khou shumisa Mulayo wa Maḓi wa Lushaka, wa 1998 (Mulayo 36 wa 1998).
",0.7771479
"Qingha leri ri landzela nkambisiso wa malembe manharhu wa NWRS-2, lowu nga kuma tindhawu ta ku humelela na tindhawu leti ta ha riki ntlhontlho.
","Haya maano o dzudzanywa hu tshi tevhedzwa tsenguluso ya miṅwaha miraru ya NWRS-2, ine ya vha yone ye ya ṱalusa masia ane ha vha na mvelaphanḓa khathihi na ayo ane a kha ḓi vha na khaedu.
",0.6296339
"NWRS-3 yi vumbiwa hi swikongomelo swinharhu, leswaku mati na mbhasiso swi fanele ku seketela nhluvukiso, ku herisiwa ka vusweti na ku pfumaleka ka ndzingano, ku hoxa xandla eka ikhonomi na ku tumbuluxiwa ka mitirho, naswona mati ma fanele ku sirheleriwa, ku tirhisiwa, ku hluvukisiwa, ku fambisiwa no lawuriwa hi ndlela leyi tiyiselaka nkarhi wo leha na hi ku ringana.
","NWRS-3 yo vhumbwa nga zwipikwa zwiraru zwine zwa elana, zwine masia a maḓi na vhuthathazwitzhili a tea u tikedza mveledziso yazwo, u fheliswa ha vhushai na tshayandingano, u shela mulenzhe kha ikonomi na u sika mishumo, na uri maḓi a tea u tsireledzwa, u shumiswa, u bveledziswa, u ṱhogomelwa na u langwa nga nḓila ine a nga vha hone lwa tshifhinga tshilapfu nahone nga nḓila i linganaho.
",0.65559983
"Qingha leri ri tisa swiringanyeto swo khomeka swo tlakusa mphakelo wa mati, ku hunguta ku laveka ka mati, Mafambiselo ya mati na mbhasiso lama tirhaka hi ku hetiseka, ku lawula sekitara ya mati na mbhasiso, ku hangalasiwa ka mati nakambe ku fikelela ku hundzuluxa, ku tlakusa ntirhisano na matiko ya misava, na ku lawula mati na mbhasiso ehansi ka maxelo lama nga eku cinceni.
","Haya maano a dzinginya makumedzwa a pfalaho a u engedza nḓisedzo ya maḓi, u fhungudza ṱhoḓea ya maḓi, ndangulo yavhuḓi ya maḓi na vhuthathazwitzhili, u langa sekhithara ya maḓi na vhuthathazwitzhili, u ṋetshedza hafhu maḓi hu tshi itelwa tshanduko, u ṱuṱuwedza tshumisano ya dzitshaka, u langa maḓi na vhuthathazwitzhili nga fhasi ha kilima ine ya khou shanduka.
",0.7167077
"NWRS-3 yi kandziyisiwile eka webusayiti ya DWS eka WEBTOKEN..Xiviko xa mayelana na magoza lama tirhisiweke hi Ndzawulo ya Vusirheleri (DoD) ku lulamisa matikhomelo ya swirho swa Vuthu ra Vusirheleri ra Afrika-Dzonga ra Rixaka (SANDF) leswi yisiweke eka vurhumiwa byo tisa ku rhula.
","Heyi NWRS-3 i anḓadzwa kha webusaithi ya DWS ine ya vha WEBTOKEN..Muvhigo wa nga ha maga o thomaho u shumiswa nga Muhasho wa zwa Vhupileli (DoD) hu tshi itelwa u tandulula thaidzo dza mikhwa na vhuḓifari ha miraḓo ya Mmbi ya Vhupileli ha Lushaka ya Afrika Tshipembe (SANDF) vhane vha vha vho rumelwa kha mishumo ya u ḓisa mulalo.
",0.69890493
"Khabinete yi amukerile xiviko mayelana na ku humelela loku Afrika-Dzonga yi ku endlaka ku lulamisa matikhomeleo ya swin’wana swa swirho swa SANDF leswi yisiweka eka vurhumiwa byo tisa ku rhula eka tikonkulu hinkwaro.
","Khabinethe yo ṱanganedza muvhigo wa nga ha mvelaphanḓa ine shango ḽa Afrika Tshipembe ḽa khou ita hu tshi itelwa u tandulula thaidzo dza vhuḓifari ha miṅwe miraḓo ya SANDF ine ya vha yo rumelwa kha mishumo ya u ḓisa mulalo u mona na dzhango ḽa Afrika.
",0.65799934
"SANDF yi vile xivangelo xa ku tinyubyisa ka tiko loko yi ri karhi yi nghenelela eka vurhumiwa byo tisa ku rhula eka tikonkulu ku hlayisa ntshamiseko na ku rhula eka matiko ya Afrika lama hlaseriweke hi timyimpi ehansi ka vuseketeri bya Nhlangano wa Tinxaka (UN).
","SANDF yo ḓi dzulela u vhonala sa tshiko tsha u ḓihudza ha lushaka sa izwi i tshi shela mulenzhe kha vhurumelwa ha u ḓisa mulalo kha dzhango ḽa Afrika u itela uri hu vhe na mulalo na vhudziki kha dzitshaka dzine dza vha dzo hoṱefhadzwa nga dzinndwa fhano kha dzhango ḽa Afrika i tshi khou shuma nga fhasi ha Dzangano ḽa Vhuthihi ha Dzitshakha (UN).
",0.34526372
"Hikuva ku vile na swihehlo swa milandzu ya swa masangu leyi khumbaka masocha yo hlayisa ku rhula hi 2015, ku tumbuluxiwile Ntlawa wo Tirha wa Holobye hi 2019 ku va wu lavisisa milandzu ya ku tirhisiwa hi ndlela yo biha na nxaniso eka swa masangu (SEA) eka DoKhabinete yi tsakisiwile hi ntlawa wa magoza lama vekiweke ku lulamisa timhangu ta SEA eka vurhumiwa bya SANDF byo hlayisa ku rhula.
","Musi hu tshi vha na mavharivhari a milandu ya zwa vhudzekani nga ṅwaha wa 2015, ho mbo ḓi vhumbwa Tshigwada tsha U shuma tsha Vhukati ha Dziminisṱa nga ṅwaha wa 2019 u itela uri hu kone u ṱoḓisiswa milandu iyi ya u sa fara zwavhuḓi na u tambudza lwa vhudzekani (SEA) ine ya bvelela ngomu kha DoKhabinethe yo fushea nga mutevhe wa maga e a vhewa u itela u tandulula thaidzo dza zwiito zwa SEA ngomu kha vhurumelwa ha u ḓisa mulalo ha SANDDzangano ḽa Vhuthihi ha Dzitshaka ḽi dzhia shango ḽa Afrika Tshipembe sa ḽine ḽa vha na maitele a khwinesa nahone ḽo fhululedza shango ḽashu kha mvelaphanḓa ye ḽa ita kha nndwa ya u fhelisa tshoṱhe zwiito zwa SEA ngomu kha SANDKhabinethe yo ombedzela uri zwiito zwa SEA a zwi nga ḓo konḓelelwa uri zwi bvele phanḓa na u tshinyadza rekhodo yavhuḓi ine SANDF ya vha nayo kha dzhango ḽa Afrika..Ṅwedzi wa Vhaswa wa ṅwaha wa 2023 Khabinethe yo ṱanganedza Mbekanyamushumo ya Ṅwedzi wa Vhaswa ya 2023 nga fhasi ha thero ine ya ri: “U engedza mbofholowo ya vhaswa kha zwa ikonomi hu tshi itelwa vhumatshelo ha tshifhinga tshilapfu”.
",0.6328814
"UN yi tekela enhlokweni mitolovelo ya kahle ya Afrika-Dzonga naswona yi ndhundhuzerile tiko eka ku humelela loku ri ku endleke ku herisa SEA eka SANDKhabinete yi tshikelerile leswaku ntolovelo wa SEA wu nge pfumeleriwi ku onha rhekhodo ya kahle ya SANDF eka tikonkulu..N’hweti ya vantshwa ya 2023 Khabinete yi pasisile Nongoloko wa N’hewti ya Vantshwa ya 2023 ehansi ka nhlokomhaka leyi nge: “ku hatlisisa ntshunxeko wa ikhonomi eka vantshwa ku fikelela vumundzuku lebyi tiyeke”.
","Muthusaphresidennde Vho Mashatile vha ḓo ṋetshedza tshipitshi nga Ḓuvha ḽa Lushaka ḽine kha uno ṅwaha ḽa ḓo pembelelwa lwa tshifhinga tsha maḓuvha mavhili u bva nga ḽa 16 u swika 17 Fulwi 2023 fhaḽa Sentharani ya zwa Mitambo ya nga Nnḓa ya Mangaung, Bloemfontein, kha ḽa Free State.
",0.7245922
"Xandla xa Presidente President Mashatile u ta vulavula hi Siku ra rixaka leri lembe leri ri nga ta tlangeriwa hi nkarhi wa masiku mambirhi ku sukela hi ti 16 kufikela ti 17 Khotavuxika 2023 eMangaung Outdoor Sport Centre, eMangaung, eBloemfontein, eFree State.
","Kha tshenetshi tshifhinga tsha maḓuvha mararu, hu ḓo vha na tshikhala tshine ngatsho vhaswa vha ḓo kona u shela mulenzhe kha nyambedzano na Dziminisṱa, Vhathusaminisṱa khathihi na vhaṅwe vhashelamulenzhe vha kwameaho nga ha vhugudisi ho fhambanaho, zwikhala zwa mabindu na zwa mveledziso zwine zwa vha hone kha muvhuso na vhashumisani kha zwa matshilele.
",0.6232098
"Eka masiku lamambirhi, ku ta va na xivandlanene xa leswaku vantshwa va nghenelela eka mivulavurisano na Vaholobye, Swandla swa Vaholobye na vatekaxiave van’wana hi vuleteri byo hambanahambana, swivandlanene swa mabindzu na nhluvukiso leswi nga kona eka mfumo na vatirhisani va mfumo.
","Ṅwedzi wa Vhaswa u ḓo rwelwa ṱari nga Ḽavhuṋa, ḽa 1 Fulwi nga Minisṱa Ofisini ya Phresidennde vho hweswaho maanḓa a Muhasho wa Vhafumakadzi, Vhaswa na Vhathu vha re na Vhuholefhali, Dokotela Vho Nkosazana Dlamini Zuma fhaḽa kha vhupo ha tshiga tsha Tshihumbudzi tsha Hector Pieterso na Muziamu tshi re fhaḽa kha ḽa Soweto.
",0.6481994
"N’hweti ya vantswa yi ta simekiwa hi Ravumune, 1 Khotavuxika hi Holobye eka Hofisi ya Presidente wa Vavasti, Vantshwa na Vatsoniwa, Dr Nkosazana Dlamini Zuma eka Xitsundzuxo na Muziyamu wa Hector Pieterson eSoweto.
","Khabinethe yo eletshedza tshitshavha uri tshi engedze mafulufulu u itela u vhona uri vhathu vhaswa vha khou kona u swikela zwikhala zwine zwa vha tendela uri vha kone u ḓidzhenisa kha zwa u shela mulenzhe kha ikonomi nga nḓila yo fhelelaho.
",0.40518177
"Khabinete yi hlohlotela vaaki ku tiyisa matshalatshala yo vona leswaku vanhu lavantsongo va fikelela swivandlanene leswi nga ta va pfumelela ku nghenelela eka ikhonomi hi nghingiriko.
","Muvhuso, sa wone mutholi muhulwanesa, wo fhindula kha ṱhoḓea dza mveledziso ya zwikili na u maanḓafhadzwa ha vhaswa nga u ita uri vhaswa vho fhedzaho pfunzo dzavho dza dziyunivesithi vhane vha si vhe na mishumo vha kone u wana tshenzhemo ya mishumo nga kha Mbekanyamushumo ya zwa Vhugudi na Vhugudisi ha Mishumo ya avho vho fhedzaho pfunzo dza Yunivesithi ya Muhasho wa Tshumelo dza Muvhuso.
",0.5671598
"Mfumo, tanihi muthori lonkulu, wu hlamurile eka swilaveko swa nhluvukiso wa swikili na ku thoriwa ka vantshwa hi ku pfuna lava thwaseleke mitirho lava nga tirhiki ku kuma ntokoto hi ku tirhisa Nongoloko wa Vukorhokeri bya Mfumo wa Ntirhodyondzo wa lava Thwaseleke mitirho no Dyondza ntirho.
","Muvhuso u khou dovha hafhu wa thoma u shumisa Tshikwama tsha Mishumo ya zwa Matshilisano, Social Employment Fund (SEF) khathihi na maga a u sika mishumo a Tshumelo dza Vhaswa dza Lushaka (NYS) o vusuluswaho nahone ane a kona u kungedzela vhaswa vha zwigidi na zwigidi ngomu kha ikonomi.
",0.66426396
"Mfumo wu tlhela wu tirhisa Nkwama wo Thola Vaaki (SEF) na Vukorhokeri bya Vantshwa lebyi Pfuxetiweke bya Rixaka (NYS), matshalatshala yo tumbuluxa mitirho lama nghenisaka magidigidi ya vanhu lavantsongo eka ikhonomi.
","Maga a Mishumo ya Vhaswa a Phresidennde na one o no ḓi kona u tikedza vhaswa kha u kona u swikela zwikhala zwi swikaho miḽioni zwine ngazwo vhaswa vha vha vha tshi khou kona u wana miholo ya tshifhinganyana, u vhewa ha vhaswa kha mishumo i swikaho miḽioni nthihi, zwikhala zwa u guda zwi katelaho na mishumo zwa 250 000 khathihi na zwiṅwe zwikhala zwa 250 000 zwa tshumelo dzi badelaho hu tshi katelwa na vhaswa vha swikaho 500 000 vhane vho dzheniswa kha zwikhala zwa muholo wa tshifhinga tshilapfu.
",0.6056313
"Ku nghenela ka Presidente eka ku thoriwa ka Vantshwa se ku kote ku seketela ku fikeleriwa ka wa timiliyoni ta swivandlanene swa miholo ya xinkarhana, ku nghenisiwa emitirhweni yo ringana miliyoni, 250 000 wa swivandlanene swo dyondza va ri karhi va tirha, 250 000 wa swivandlanene swa vukorhokeri lebyi hakeriwaka na 500 000 wa vanhu lavantsongo lava ngheleleke eka swivandlanene leswi tiyeke swo kuma miholo.
","Musi ri tshi khou dzhena kha Ṅwedzi wa Vhaswa, muvhuso u khou eletshedza vhathu vhaswa uri vha ḓiṅwalise kha puḽatifomo ya WEBTOKEN , ine ya vha puḽatifomo ine khayo vha nga kona u swikela zwikhala zwa mishumo sa izwi vhaṅwe ngavho vha swikaho miḽioni nṋa vho no ḓiṅwalisa u swika zwino.
",0.56017315
"Loko hi ri karhi hi nghena eka N’hweti ya vantshwa, Mfumo wu tsundzuxa vanhu lavantsongo ku tsarisa eka pulatifomo ya WEBTOKEN tanihileswi mune wa timiliyoni ta vaakatikokulobye se va tsariseke, laha swivandlanene swa mitirho swi nga fikeleriwaka.
","U farwa ha Muṱangano wa zwa Ṱhoḓisiso dza zwa Vhulimi fhano Afrika (FARA), Khonifarentsi ya vhumalo (8) ya Mabindu a zwa Vhulimi a Afrika na Vhege ya Saintsi khathihi na Guvhangano ḽa Nnyi na Nnyi ḽa vhu.
",0.6139216
"Ku rhurhela kun’we Foramu ya Ndzavisiso wa Vurimi (FARA) eka Nhlengeletano ya Afrika ya Vu8 ya Mabindzu ya Vurimi bya Afrika na Vhiki ra Sayense xikan’we na Nhlengeletano ya Mani na Mani ya vu.
","Khabinethe yo ṱanganedza zwauri Afrika Tshipembe ḽi vhe ḽiṅwe ḽa mashango ane ha ḓo farelwa khaḽo Konifarentsi ya vhu8 ya Mabindu a zwa Vhulimi na Vhege ya zwa Saintsi khathihi na Guvhangano ḽa Nnyi na Nnyi ḽa vhu9 fhaḽa ḓoroboni ya Durban u bva nga ḽa 5 u swika 9 Fulwi 2023.
",0.62922657
"Khabinete yi pasisile ku va Afrika-Dzonga yi rhurhela kun’we Nhlengelatano ya vu8 ya Mabindzu ya Vurimi bya Afrika ya FARA na vhiki ra Sayense xikan’we na Nhlengelatano ya Mani na Mani ya vu9 eDurban kusukela hi ti 5 kufikela ti 9 Khotvuxika 2023.
","FARA ndi dzangano ḽihulwane ḽa fhano kha dzhango ḽa Afrika ḽine ḽa vha na vhuḓifhinduleli ha u dzudzanya na u tshimbidza ṱhoḓisiso dza zwa vhulimi khathihi na mveledziso ya vhukoni kha dzhango.
",0.25113276
"FARA yi le maninginingini ya nhlangano wa tikonkulu lowu nga na vutihlamuleri byo kondletela no hlanganisa ndzavisiso wa vurimi no yisa emahlweni vutumbuluxi eka tikonkulu.
","Nga u fara vhuṱambo uvhu, Afrika Tshipembe ḽi ḓo vhuelwa vhukuma u bva kha tshumisano na vhufarisani na zwiimiswa zwa vhulimi na ṱhoḓisiso zwa fhano kha dzhango ḽa Afrika musi hu tshi vha na u kovhana ha nḓivho na maitele avhuḓi kha zwa saintsi ya vhulimi na ṱhoḓisiso.
",0.60385257
"Hi ku rhurhela ntirho lowu, Afrika-Dzonga yi ta vuyeriwa eka ku tirhisana na xinakulobye na mavandla ya tikonkulu ya vurimi na ndzavisiso hi ku avelana mitolovelo ya kahle eka sayense ya vurimi na ndzavisiso.
","Shango ḽa Afrika Tshipembe ḽi dzhiela nṱha ṱhoḓisiso dza zwa vhulimi u itela mveledziso, nga maanḓa zwino musi hu na thaidzo ya tshanduko ya kilima na zwiṅwe zwithu zwine zwa kwama vhukoni ha shango ha u kona u swikela nḓisedzo ya zwiḽiwa, mveledziso ya ikonomi na mishumo.
",0.584935
"Afrika-Dzonga yi lemuka nkoka wa ndzavisiso wa vurimi eka nhluvukiso, ngopfu eka mhaka ya ku cinca ka maxelo na swivangelo swin’wana leswi khumbaka vuswikoti bya tiko byo fikelela nsirhelelo wa swakudya, nhluvukiso wa ikhonomi na mitirho.
","Khonifarentsi iyi i khou lavhelelwa uri i ḓo kunga vhurumelwa vhu swikaho 800 kha vunḓu ḽa KwaZulu-Natal na ḽa Gauteng, nahone hezwi zwi ḓo shela mulenzhe muhulwane vhukuma kha mishumo ya zwa ikonomi..Mafhungo a mbambadzo
",0.5665017
"Nhlengelatano yi languteriwa ku tisa vayimeri va 800 kusuka eKwaZulu-Natal na Gauteng, naswona leswi swi ta hoxa xandla eka migingiriko ya ikhonomi..Timhaka ta mabindzu
","Khabinethe yo ṱanganedza muvhigo une wa sumbedza uri hu khou vha na u khwinifhadzea ha mbekanyamushumo ya zwa mbambadzo na u rengisela nnḓa ya ḽino shango.
",0.6645256
"Khabinete yi amukerile xiviko lexi kombaka ku antswa eka nongoloko wa tiko wa mabindzu na ku xavisela matiko ya le handle.
","Muvhigo wo sumbedzisa uri Afrika Tshipembe ḽo rengisela nnḓa thundu dza mutengo u swikaho R300 biḽioni kha mashango a 12, zwe hezwi zwa sika mishumo ya vhukuma i anganyelwaho henefha kha 57 300.
",0.55799425
"Xiviko xi komba leswaku Afrika-Dzonga yi xavisele matiko ya le handle ya 12 tinhundzu ta ntsengo wa R300 wa tibiliyoni hi 2022, yi hlayisa kwalomu ka 57 300 wa mitirho yo kongoma.
","U tholwa U tholwa hoṱhe hu ḓo khunyeledzwa nga murahu ha musi ho no khwaṱhisedzwa ndalukano khathihi na u ṱanzwa madzina ho teaho.
",0.3840329
