src_text,tgt_text,cosine_score
"Merero ye Bohlokwa Seemong sa Bjale.
","Ditiro tsa Tsamaiso ya Matlhotlhapelo tse go Samaganweng le Tsona go Latela gore go nne le Merwalela.
",0.5110406
"Taolo ya Masetlapelo Morago ga Mafula.
","Kabinete rometse matshediso go batho botlhe ba ba latlhegetsweng ke ba ba ba ratang mo merwaleleng ya fa gautshwane e tlisitseng ditshenyegelo tse di masisi e amileng dikarolo di le mmalwa tsa naga ya rona, bogolo segolo KwaZulu-Natala..     Dikgato tsa go Baya Dikarolo tseno mo Maemong Matlhotlhapelo Bosetšhaba mmogo le dikgato tsa go thusa baagi ka matlole a tlhokegang tse di itsisetsweng ke Moporesidente Cyril Ramaphosa fa gautshwane, maitlhomo tsona ke go netefatsa gore maphata otlhe puso tsaya dikgato tse di rulagantsweng sentle le tse di tla nnang mosola mo go samaganeng le maemo ano, mme seno se tla diriwa ka go dirisa Tikwatikwe ya Naga e Samaganang le Matlhotlhapelo..     Bilione ya diranta puso e abileng dirisediwa go tshegetsa dikgato tsa go ritibatsa maemo le tsa go busetsa maemo ditirelo tse di botlhokwa sekeng mmogo le go abelana ka ditirelo tsa botho tse di jaaka go ba rekela dijo, go ba tlela metsi le go ba batlela bodulo, dintlwanaboithusetso le diaparo..     Tirego ya go aga sešwa mafelo a amegileng setse simolotswe jaaka batho ba naga ya gaetsho ba kopane mo maikemisetsong bona go thusa ba ba latlhegetsweng ke magae le dithoto tsa bona.
",0.46253854
"Kabinete lebišitše mahloko yona go batho ka moka bao ba lobilego bao ba phelago le bona mo mafuleng go setla pelo malobanyana ao wetšego dikarolo tša naga ya gaborena, kudukudu KwaZulu-Natal..     Tsebagatšo ya Maemo Masetlapelo Bosetšhaba gotee le magato kimollo ya ikonomi maphelong batho ao tsebagaditšwego ke Mopresidente Cyril Ramaphosa malobanyana mo be nepile go netefatša kgato ye nago le mohola le ya go rulaganywa ka tsela ye maleba go potologa didiko ka moka ka mmušo, ka Senthara ya Bosetšhaba ya Taolo ya Masetlapelo..     R1 bilione ya go tlišwa ke mmušo gare šomišwa go thekga maitekelo kimollo le go boetša seemo sekeng, go bušetša ditirelo tša motheo sekeng le go fana ka thušo ya botho ka sebopego sa dijo, madulo, tlhwekišo le diaparo..     Tshepedišo ya go agaleswa mafelo ao amilwego ke mafula šetše thomile ka ge batho ba naga ya gaborena ba ipopa ngatana ye tee ka maikemišetšo go thuša bao ba lobilego magae le dithoto tša bona.
","Tshedimosetso ka Bolwetse jwa Mogare wa Corona (COVID-19).
",0.49541396
"Tsebišo ya Seemo sa Bolwetši bja Coronavirus (COVID-19).
","Kabinete tshwentswe ke go tlhatlhoga ga fa gautshwane ga ditshwaetso tsa COVID-19 mo dikarolong dingwe tsa naga mme ikuetse go batho botlhe go tsaya dikgato tsa go itshireletsa kgatlhanong le mogare o kotsi ono, bogolo segolo mo marigeng.
",0.6722518
"Kabinete hlobaetšwa ke tlhatlogo ya bjale ya diphetelo tša COVID-19 dikarolong tše dingwe tša naga ya gaborena ebile hlohleleditše batho ka moka go latela magato go ihlokomela gore ba itšhireletše kgahlanong le baerase ye ya go iša batho ga maotwanahunyela, kudukudu ka nako ye ya marega.
","Mogare ono sa ntse re tsenya tsebetsebe mme go tlhabela moento sale ntse le yona tsela e botoka go gaisa re ka itshireletsang ka yona.
",0.7141762
"Baerase ye santše le tlhobaboroko yeo tšwelago pele ebile meento sale sebetša sa go ba le mohola kudu sa go itšhireletša.
","Kabinete itumelela gore batho ba le bantsi ba tswelela go tsaya tshweetso ya go tlhabela moento go nna ona ba itshireletsang ka ona kgatlhanong le COVID-19 mme seno se latela gore dipalopalo tsa fa gautshwane di bontshe gore mo bathong botlhe ka fa nageng re setse re fitlheletse palo e fetang halofo ya bona ya batho ba ba tlhabetseng meento mo diporofenseng tse tlhano.
",0.7497152
"Kabinete thabišwa ke gore batho ba bantši ba tšea sephetho sa go hlaba meento bjalo ka mekgwa ya bona ya mathomo ya go itšhireletša kgahlanong le COVID-19 morago ga gore dipalopalo tša moragorago di laetše gore re fihleletše phenyo ya go feta seripa sa meento bathong ba bagolo diprofenseng tše tlhano..     Kabinete dira boipiletšo go bao ba sa kago ba hlaba meento go dira bjalo gore ba itšhireletše le go šireletša bao ba phelago le bona.
","Kabinete ikuela go ba ba iseng ba entiwe go ya go tlhabela moento gore ba tle ba itshireletse bona le ba ba tshelang mmogo le bona.
",0.77253854
"Re swanetše go tšwelapele go obamela magato ka moka thibelo ya COVID-19, go akaretšwa le go apara maseke wa go pipetša nko le molomo, go hlapa matsogo ka meetse le ka sesepe goba ka go šomiša sanithaesa sa diatla sa go tswakwa ka alekhohole ya go feta 70%, le go šielana sekgala sa go bolokega se ka bago mithara tee..     Thušo ya Tšhelete ya Kimollo ya Masetlapelo Leago (SRD).
","Gape rotlhe re tshwanetse go tswelela go obamela dikgato tsotlhe tsa thibelo ya COVID-19, go akarediwa go rwala mmaseke o tswalang nko le molomo, go tlhapa diatla ka metsi le sesepa, go tsikitletsa diatla ka sebolayamegare se 70% ya sona leng alekhoholo, le go katogana le batho ba bangwe..     Mogolo wa go Inola Batho mo Tshotlegong (SRD).
",0.9384577
"Kabinete hlohleleditše badudi bao ba amogelago Thušo ya tšhelete ya SRD ya R350 go dira dikgopelo gape morago ga gore go tsebagatšwe melao ye meswa ya go laola dikgopelo le maswanedi go hwetša thušo ye ya tšhelete.
","Kabinete rotloetsa baagi ba ba amogelang R350 ya madi thuso SRD go dira dikopo sešwa, go latela kitsiso ya melawana mentšhwa e laolang makwalokopo le go nna le tshiamelo ya madi thuso..     Dikopo di ka dirwa mo webosaeteng ya Setheo sa Aforika Borwa sa Tshireletso ya Loago (SASSA): https://srd.sassa.gov.za/.
",0.8924619
"Dikgopelo di ka dirwa wepsaeteng ya Etšensi ya Afrika Borwa ya Tšhireletšego ya Leago (SASSA) mo go https://srd.sassa.gov.za/.
","Tsamaiso ya go dira dikopo butswe ka la bo 23 Moranang 2022 mme dirisa fela mafaratlhatlha thekenoloji go kgontsha gore go direlwe ka bonako..     Mogolo ono botlhokwa thata mo go thuseng malapa a tlhokang lehuma le botlhokatiro di ka bong di sa bolo go itelekela mo go ona.
",0.63211715
"Peakanyo ya dikgopelo butšwe ka la 23 Moranang 2022 ebile ke tshepedišo yeo dirwago ka mokgwa wa titšithale ka moka ga yona go kgontšha gore dikgopelo di dirwe ka bonako..     Thušo ye ya tšhelete ya kimollo ke boikokotlelo bja go bolokega go malapa go ihlokela bao ge nkabe se ka yona ba ka be ba amilwe gampe ke lemena la bohloki le tlhokego ya mešomo.
","Puso tota ikemiseditse go thusa batho ba ba humanegileng ka megolo ya yona gore le bona ba kgone go nna le tse ba di tlhokang.
",0.7076863
"Mmušo ikgafetše go fana ka thušo ya leago go bao ba lego kotsing gore le bona ba kgone go fihlelela dinyakwa tša motheo.
","Pabalesego le Tshireletsego.
",0.22529905
"Polokego le Tšhireletšego.
","Kabinete tswelela go kgala ka mafoko a bogale dipolao tse di setlhogo tsa basadi mme lebogile dikgato tsa ka bonako tse mapodisi ba di tsereng mo go tshwareng babelaelwa mo kgetseng ya polao ya Mme Hillary Gardee (28), wa kwa Kamagugu kwa Mpumalanga.
",0.13618898
"Kabinete tšwelapele go sola ka bogale dipolao tša go setla pelo tša basadi ebile amogetše magato bonako ka bahlankedi ba phethagatšo ya molao ge ba kgonne go golega bagononelwa ba go amana le lehu la Mohumagatšana Hillary Gardee (28), wa kua Kamagugu gola Mpumalanga.
","Gape Kabinete kgadile ka mafoko a bogale polao ya batho ba le barataro kwa Khayelitsha, kwa Motsekapa.
",0.7630238
"Kabinete sotše gape le polao ya batho ba tshela kua Khayelitsha, Motsekapa.
","Dipolao tse di setlhogo di re gakolola gore re tshwanetse go dira go feta ga jaana jaaka setšhaba go fedisa tirisodikgoka le tirisodikgoka mo bathong ba bong jo bo rileng mmogo le polao ya basadi le bana (GBVF).
",0.646752
"Dipolao tše tša go setla pelo ke segopotšo go rena sa gore re swanetše go dira tšohle bjalo ka setšhaba go fediša dikgaruru ka kakaretšo le dikgaruru tša go ikala ka bong le polao ya basadi (GBVF)..     Kabinete hlohleleditše batho ka moka ka mo nageng go šomišana le mmušo go lwantšha bosenyi le GBVF.
","Kabinete ikuela mo bathong botlhe mo nageng go dira le puso mo ntweng kgatlhanong le bosenyi le GBVF.
",0.81022733
"Re le mmogo re ka netefatša gore setšhaba sa gaborena le mebila bolokegile bathong ka moka, go akaretšwa batšofadi, basadi le bana.
","Mmogo re ka dira bonnete jwa gore batho botlhe, go akarediwa bagodi, basadi le bana ba bona mafelo re nnang mo go ona le mebila ya ona babalesegile..     Ikonomi.
",0.9153769
"Ikonomi.
","Kabinete amogetse pulosemmuso ya feme ya tlhagiso ya ditena ya Corobrik kwa Kwastina kwa Driefontein kwa Gauteng mo tirelo eno neng tsenetswe ke Moporesidente Ramaphosa ka Laboraro, 4 Motsheganong.
",0.23946074
"Kabinete amogetše pulo ya semmušo ya fabriki ya go foroma ditena ya Corobrik Kwastina gola Driefontein profenseng ya Gauteng ka Mopresidente Ramaphosa ka Laboraro, 4 Mopitlo.
","Feme eno ya maemo a kwa godimo ke karolo ya peeletso ya R800 milione e tsamaelanang le R200 milione nngwe e beetsweng go atolosa ditiro tsa konkereite tsa Corobrik kwa KwaZulu-Natala.
",0.7596357
"Faporiki ye ye tšwago pele ka theknolotši ya sebjalebjale bopa karolo ya dipeeletšo tša R800 milione, tša go gata ka mošito tee le dipeeletšo tše dingwe gape tša go lekana R200 milione tšeo go lebeletšwego gore di tla oketša mešomo ya tšweletšo ya lekgwara ka Corobrik gola KwaZulu-Natal.
","Corobrik ke nngwe ya dikgwebo di le mmalwa tsa ka fa nageng tse di tsibogetseng boikuelo jwa ga Moporesidente Ramaphosa jwa gore dikgwebo tsa Aforika Borwa le tsa dinaga tsa boditšhabatšhaba di beeletse mo ikonoming.
",0.7409954
"Corobrik ke ye nngwe ya dikgwebo tše mmalwa tšeo di phethagaditšego kgoeletšo ya Mopresidente Ramaphosa dikgwebong tša Afrika Borwa le tša boditšhabatšhaba go beeletša ikonoming ye.
","Kabinete nopotse gore ditšhono tse dinnye tsa ikonomi mo mererong ya haeterojene di oketsegile ka ntlha ya go agiwa ga lori ya setlamo sa meepo sa Anglo American e tsamayang ka mafura haeterojene.
",0.709707
"Kabinete lemogile gore ikonomi ye fokolago ya haedrotšene tsošološitšwe ge Anglo American tsebagatša lori ya go sepela ka haedrotšene.
","Lori eno – e fetotsweng gore se tlhole dirisa mafura disele mme dirise haeterojene, mmogo le go neelwa maatla ke dibeterii tsa lithium-ion – ke ya ntlha ya mofuta oo mo lefatsheng.
",0.7399711
"Lori ye yeo go dirilwego diphetogo go yona gore sepele ka haedrotšene go tšwa go disele, le go sepela gape ka dipeteri tša mohuta wa lithium-ion ke ya mathomothomo lefaseng.
","Ditšhono tsa ikonomi mo mererong ya haeterojene di nopotswe jaaka tse di botlhokwa mo maanong a botlhokwa ikonomi e sa diriseng dilo tse di bolayang tlhago mo nageng ya rona, le mo go godiseng ikonomi le mo go tlhameng ditiro..     Gape kabinete amogetse peeletso nngwe mo ikonoming e tlang ka setlamo sa dijo sa Ireland, se se bidiwang Kerry Group, se se butseng polante ntšhwa e jeleng R650 milione kwa Hammarsdale, kwa KwaZulu-Natala se maikaelelo sona leng go tlhagisetsa kontinente dijo tse di tse di sa feleng.
",0.7717575
"Ikonomi ya haedrotšene hlaotšwe bjalo ka yeo tlago pele ga tšohle godimo ga ikonomi ya naga ya borena ya go ikala ka tlhago, le go sepetša kgolo ya ikonomi le tlhomo ya mešomo..     Kabinete amogetše dipeeletšo tše dingwe ka gare ga ikonomi ya gaborena ka khamphani ya dijo ya Ireland ya go bitšwa The Kerry Group, yeo butšego polante ye mpsha ya go bitša R650 milione kua Hammarsdale, KwaZulu-Natal yeo nepilego go tšweletša dijo tša go swarelela nako ye telele kontinenteng.
","Polante eno ga tshwane le tse dingwe gonne na le didirisiwa di le mmalwa tse di sa senyeng tikologo mmogo le tse di sa diriseng motlakase montsi, tse di dirisang motlakase o fetlhiwang ka letsatsi o tla dirang gore seelo sa go itshepele ka bontsi mo motlakaseng wa ka fa nageng se fokotsege, motlakase o tsewang mo mogoteng o tswang mo metšhining megolo mmogo le metsi a lekaneng, go selwa le go solwamosola gape le phokotso.
",0.80311084
"Polante ye ke ya moswananoši ka baka la gore thekga mekgwa ye mmalwa ya go swarelela lebaka le le telele go akaretšwa didirišwa tša tšhomišo ya fase ya enetši, go fehlwa ga mohlagase ka seetša sa letšatši go fokotša tirišo ya mohlagase go tšwa go tšweletšo ya mohlagase ya ka mo nageng, tšhomišo ya phišo ge go fišwa dilahlwa go fehla mohlagase, le mekgwa ya go šoma gabotse ya go ageletša meetse, go šomiša seswa le go fokotša tšhomišo ya ona.
","Setlamo sa Kerry Group sa le se le gona mo Aforika Borwa go tloga ka 2011 mme peeletso nngwe ya bona ke sesupo sa gore Aforika Borwa sa ntse le lefelo le le ratiwang la dipeeletso.
",0.6850787
"Khamphani ye ya Kerry Group fihlile ka mo Afrika Borwa ka 2011, le gona dipeeletšo tša yona tšeo di tšwelago pele ke sešupo sa gore Afrika Borwa santše le naga ya boikgethelo dipeeletšong.
","Dipeeletso tseno di latela go thankgololwa ga bene e tlhagisitsweng mo lapeng ya Isuzu D-Max kwa Gqeberha kwa Kapa Botlhaba kgwedi e fetileng.
",0.667297
"Dipeeletšo tše di gata mohlaleng wa tsebagatšo ya bene yeo dirilwego ka mo nageng ya Isuzu D-Max gola Gqeberha kua Kapa Bohlabela kgwedi ya go feta.
","D-MAX ya mofuta montšhwa bontsha maikemisetso Isuzu mo Aforika Borwa mme ke nngwe ya dilo tse di fitlheletsweng ka Letsholo la Tlhabololo ya Tlhagiso ya Dijanaga (APDP).
",0.7451514
"Mohuta wo moswa wa D-MAX ke seka sa go rweša kgare maikgafo Isuzu ka mo Afrika Borwa ebile ke ye nngwe ya dikatlego tšeo di fihleletšwego ka fase ga Lenaneotlhabollo la Tšweletšo ya Difatanaga (APDP).
","APDP ke sekema se se tlhotlheletsang tlhagiso ya dijanaga mo indaseteri ya dijanaga mme maikaelelo sona ke go dira gore indaseteri e tlhalositsweng ya dijanaga oketse tlhagiso ya yona ya dijanaga, go oketsa mosola wa indaseteri ya dikarolo tsa dijanaga mme seno se tla dira gore indaseteri ya dijana tlhole ditiro.
",0.72367376
"Lenaneo la APDP ke setlamo sa tlhohleletšo ya botšweletši intastering ya dikoloi leo nepokgolo ya lona lego go hlohleletša palo ya godimo ya dikoloi tšeo di tšweletšwago mo intastering ya difatanaga yeo go boletšwego ka yona, go tlhohleletša boleng bja tlaleletšo lefapheng la intasteri ya dikoloi gore go hlongwe mešomo go potologa makala le dikgwebokamano ka moka tša difatanaga.
","Go fopholediwa gore go tla tsenngwa R2,8 bilione ka ditlhagiswa tsa ka fa nageng fa APDP tswelela go dirisiwa.
",0.66172504
"Go tla dirwa tšhelete ya go balelwa R2,8 bilione go Makala le dikgwebokamano tša tšweletšo ya ka mo nageng ka magatotatelano APDP.
","Peeletso eno tla tlhola ditiro go tswa mo lephateng leno di feta di le 1 000 kwa polanteng eo mme tlhole gape le ditiro tse dingwe gape di le 24 000 mo ditlamong tse dingwe tse di dirisanang le lephata leno, mme seno se tla nna le mosola o bonalang mo go thuseng baagi ba kgaolo eo..     Pitsokgothakgothe ya Batlhankedi ba Meepo.
",0.77010405
"Dipeeletšo tše di tla hloma mešomo ya thwi ya go feta ye 1 000 polanteng le go thwala ka tsela ya go rarela batho ba go lekana 24 000 gomme se se tla thuša kudu go kaonafatša setšhaba mo seleteng se..     Indaba ya tša Meepo.
","Pitsokgothakgothe ya Peeletso mo Meepong ya Aforika ya 2022 e neng tshwaretswe kwa Tikwatikweng ya Boditšhabatšhaba ya Dikhonferense ya Motsekapa go tloga ka la bo 9 go fitlha ka la bo 12 Motsheganong ke nngwe ya dirala tse dikgolokgolo tsa dipuisano le ditirisanommogo magareng ga bannaleseabe botlhe mo indasetering ya meepo.
",0.7204459
"Tiragalo ya Indaba ya Meepo ya Afrika ya 2022 yeo bego swaretšwe kua Sentharengkgoparara ya Boditšhabatšhaba gola Motsekapa go thoma ka la 9 go fihla ka la 12 Mopitlo 2022 ke ye nngwe ya difala tše kgolokgolo tša dikopano le tša kgwerano magareng ga bakgathatema ka moka intastering ya meepo.
","Moono wa tiragalo ne le: “Diphetogo mo Meepong ya Aforika: Go beeletsa mo Tsamaisong ya Motlakase, ESG le Diikonomi”.
",0.70991886
"Morero wa tiragalo ye ke wo: “Mpshafatšo ya Meepo ka mo Afrika: Go Beeletša ka gare ga Diphetogo tša Enetši, ESG, le Diikonomi”.
","Kabinete dumela gore Pitsokgothakgothe ya Meepo tla thusa go bontsha le go tsweletsa Aforika Borwa jaaka lefelo le le ratiwang la dipeeletso.
",0.73209417
"Kabinete nale tshepho ya gore Indaba ye ya Meepo tla thuša go laetša le go hlohleletša Afrika Borwa go ba naga ya boikgethelo dipeeletšong.
","Aforika Borwa leboga dipeeletso mo nageng ya rona mme ikemiseditse go dira gore go nne le maemo a tla dirang gore re nne le kgolo botlhe ba nang le seabe mo go yona ya ikonomi le go tlisa diphetogo mo ikonoming.
",0.7942549
"Afrika Borwa amogela dipeeletšo tšeo di dirilwego ka mo nageng ya gaborena ebile ikgafetše go hlola maemo go kgontšha phethagalo ya kgolo ye akaretšago ya ikonomi le diphetogo ikonoming.
","Dikamano tsa Boditšhabatšhaba le tsa Kgaolo.
",0.29392195
"Dikamano tša Boditšhabtšhaba le tša Dilete.
","Kabinete amogetse gape ditherisano tsa fa gautshwane tsa ga Moporesidente Ramaphosa le Moporesidente Joe Biden wa Amerika, Moporesidente Emmanuel Macron wa Fora le Moporesidente Hakainde Hichilema wa Zambia mo diraleng tse di farologaneng.
",0.43391958
"Kabinete amogetše Kopano ya malobanyana mo ya Mopresidente Ramaphosa ge be kopana le Mopresidente Joe Biden wa Amerika, Mopresidente Emmanuel Macron wa Fora le Mopresidente Hakainde Hichilema wa Zambia difaleng tša go fapafapana.
","Ditherisano tseno di kgontshitse Moporesidente go maatlafatsa dikamano tsa sebedi le tirisanommogo magareng ga Aforika Borwa le mebuso ya balekane malebana le dintlha tsa botlhokwa tsa kgaolo le tsa boditšhabatšhaba, go akarediwa go bona tharabololo ya kagiso ya kgotlhang e kwa Ukraine     Ditshwetso tsa Kabinete.
",0.73621565
"Dikopano tše di kgontšhitše Mopresidente go matlafatša dikamano tša magareng ga dinaga magareng ga Afrika Borwa le mebušo ya dinaga tšeo gweranego le tšona mererong ye bohlokwa ya dilete le ya boditšhabatšhaba, go karetšwa le go tla ka tharollo ya go rena moya wa khutšo dithulanong tša Ukraine     Diphetho tša Kabinete.
","Ditekanyetsokabo.
",0.13590787
"Diboutu tša Tekanyetšokabo.
","Kabinete ikuela mo baaging botlhe go latela ditlhagiso tsa Ditekanyetsokabo tse di farologaneng tsa mafapha bosetšhaba puso le la Kantoro ya Moporesidente gore ba kgone go rwesa puso maikarabelo..     Ka nako ya ditlhagiso tsa Ditekanyetsokabo, mafapha otlhe thadisa ka botlalo dithulaganyo le ditlapele tsa ngwaga.
",0.48611552
"Kabinete dira boipiletšo go badudi ka moka go šala morago Diboutu tša go fapafapana tša Tekanyetšokabo tša go tla ka dikgoro tša mmušo tša bosetšhaba le ka Kantoro ya Mopresidente gore ba tle ba kgone go netefatša gore mmušo wa ikarabela diphethong tša ona..     Ka nako ya Diboutu tša Tekanyetšokabo, dikgoro ka moka di fana ka tlhalošo ye tseneletšego ya dithulaganyo tša ona le ka mananeo ao beilwego pele ngwaga.
","Maikaelelo tlhagiso ya Ditekanyetsokabo ke go netefatsa gore matlole setšhaba dirisiwa ka nonofo go fitlhelela ditlhokego tsa baagi..     Gape di neela Ditona serala se se maleba go tsharolola tiro ya puso, go akarediwa dikatlego le dikgwetlho..     Leano la go Anamisa Gase ya Peteroliamo e Fetoletsweng go nna Seedi (LPG).
",0.834566
"Diboutu tša Tekanyetšokabo di nepile go netefatša gore dikhwama tša mmušo di šomišwa ka pabalelo gore di tle di kgone go fihlelela dinyakwa tša batho setšhabeng..     Diboutu tše tša Tekanyetšokabo di fana gape le ka monyetla wo mobotse go Ditona gore ba kgone go hlatholla goya pele mošomo wa mmušo, go akaretšwa le dikatlego le ditlhotlo..     Phethagatšo ya Leanopeakanyo la Gase ya Petroleamo yeo Fetošeditšwego Diela (LPG).
","Kabinete amogetse go tsenngwa tirisong ga Leano la go Anamisa LPG, le le phasaladitsweng go batla maikutlo baagi ka Mopitlwe.
",0.7160035
"Kabinete dumeletše go hlongwa ga Phethagatšo ya Leanopeakanyo la LPG, leo le phatlaladitšwego ka Hlakola.
","Maikaelelo leano leno ke go atolosa indaseteri ya LPG mo nageng.
",0.7796759
"Leanopeakanyo le le nepile go oketša intasteri ya LPG ka mo nageng.
","LPG tla nna mosola mo go bonalang mo go direng gore re nne le metswedi e farologaneng ya motlakase..     Gareng ga ditsereganyo tse dingwe, leano leno le tla laola ditlhwatlhwa mo lephateng leno le go tshegetsa tlhagiso ya disilindara tsa LPG mo nageng.
",0.75358415
"LPG tla ba le mohola wo mogolo go fetošafetoša methopo ya enetši..     Leanopeakanyo le, magareng ga magatotharollo mangwe, le tla laola go bewa ga ditheko magatong dikgwebokamano le go thekga bohlami bja disilintere tša LPG ka mo nageng.
","Gape le tla ruta baagi ka mesola ya go dirisa LPG jaaka mofuta mongwe wa motlakase..     Leano leno go tla iponelwa lona fa le sena go phasaladiwa ke Lefapha la Ditlhagisiwa tsa Diminerale le Motlakase mo www.dmr.gov.za.
",0.8340982
"Le tla thuša gape go ruta batho setšhabeng ka mehola ya go šomiša LPG bjalo ka mokgwa wo mongwe wa enetši..     Leanopeakanyo le le tla thoma go hwetšagala morago ga ge le phatlaladitšwe ke Kgoro ya Methopo ya Diminirale le Enetši mo go www.dmr.gov.za.
","Letlhomeso la Naga le le Buang ka Leano la go Diragatsa Matsholo a Tsweletsang Temoso ya Ditshwanelo tsa Batho ba ba nang le Bogolofadi.
",0.63322353
"Tlhako ye Logetšwego Maano ya Bosetšhaba ka Temošo ya Ditokelo tša bao ba Phelago ka Bogole – Kwalakwatšo ya Masolo Batho ba go Phela ka Bogole.
","Kabinee amogetse Letlhomeso la Naga le le Buang ka Leano la go Diragatsa Matsholo a Tsweletsang Temoso ya Ditshwanelo tsa Batho ba ba nang le Bogolofadi.
",0.8227245
"Kabinete dumeletše Tlhako ye Logetšwego Maano ya Bosetšhaba godimo ga Temošo ya Ditokelo tša Digole – Go Hloma Masolo Batho ba go Phela ka Bogole.
","Maikaelelo letlhomeso ke go kaela maphata poraefete le setšhaba go netefatsa gore ditshwanelo tsa batho ba ba nang le bogole di sirelediwa jaaka go beilwe mo Molaotheong wa Rephaboliki ya Aforika Borwa wa.
",0.77291477
"Tlhako ye nepile go fa tlhahlo go bobedi mafapha praebete le setšhaba go netefatša gore ditokelo tša batho ba go phela ka bogole di šireletšwa, goya le ka fao di hlalošitšwego ka gare ga Molaotheo wa Rephabliki ya Afrika Borwa wa.
",".
",0.08965187
".
","Letlhomeso leno le tla ka dithulaganyo tse di tla thusang go fedis dikgoreletsi tse go itemogelwang tsona fa go tsewa ditshwetso, bogolo segolo tse di amanang le batho ba ba nang le bogole.
",0.4793143
"Tlhako ye fana ka setlabakelo seo se tla thušago go fediša mapheko semorafe ge go tšewa diphetho, kudukudu diphetho tša go amana le batho ba go phela ka bogole thuša gape le ka go lemoša batho ba go phela ka bogole go tseba ditokelo tša bona goya le ka fao di šireleditšwego ke Molaotheo.
","Gape le lemosa batho ba ba nang le bogole gore ba itse ditshwanelo tsa bona jaaka di sirelediwa ke Molaotheo.
",0.7709868
"Tlhako ye fana le ka tlhahlo, dipego tša babegaditaba le go lemoša batho setšhabeng ka ditokelo tša batho ba go phela ka bogole kgontšha Sengwalwa sa Makgoraditsela ka Ditokelo tša Batho ba go Phela ka bogole.
","Gape letlhomeso leno le tlamela ka katiso, pegelo ya bobegakang le tsweletso ya temoso mo setšhabeng malebana le ditshwanelo tsa batho ba ba nang le bogole.
",0.8946816
"Afrika Borwa ke ye nngwe ya dinaga tša go tsenela Kwanokgoparara ya Ditšhabakopano (UN) ka ditokelo tša Batho ba go Phela ka Bogole le Tshepedišo ya UN Kwanong ya Afrika ka Ditokelo tša Botho le Ditokelo tša Batho ba go Phela ka Bogole (Tshepedišo ya Afrika ya Ditokelo tša Digole).
","Letlhomeso leno le diragatsa Lekwalo la Matlhagolatsela la Ditshwanelo tsa Batho ba ba nang le Bogole.
",0.6465089
"Tlhako ye rerišanwe le bakgathatema ka moka, go akaretšwa le Khansele ya Bosetšhaba ya Bašomi le Tlhabollo ya Bosetšhaba.
","Aforika Borwa ke mosaeni wa Tumelano ya Ditšhabakopano (UN) ya Ditshwanelo tsa Batho ba ba nang le Bogole le Porothokholo ya UN ya Tšhata ya Aforika ya Ditshwanelo tsa Botho le Batho mo Ditshwanelong tsa Batho ba ba nang le Bogole (Porothokholo ya Aforika ya Ditshwanelo tsa Bogole).
",0.6281092
"Samiti ya Tsamaišo ya Naga le Pušetšo ya Naga Mafelong Dinagaborekwa.
","Go batlilwe maikutlo bannaleseabe ba ba maleba malebana le letlhomeso, go akarediwa Lekgotla la Bosetšhaba la Tlhabololo ya Ikonomi le Badiri.
",0.72350824
"Kabinete dumeletše go swarwa ga Samiti ya Tsamaišo ya Naga le Pušetšo ya Naga  Mafelong Dinagaborekwa ka Labohlano, 27 le ka Mokibelo, 28 Mopitlo 2022 gola Gauteng.
","Samiti ya Tsamaiso ya Mafatshe le Tsamaiso ya go nna le Lefatshe mo Mafelong Merafe.
",0.49882126
"Kabinete amogetše Pego ya Maikemišetšo ka Tsamaišo ya Naga le Pušetšo ya Naga Mafelong Dinagaborekwa ka Hlakola.
","Kabinete amogetse go tshwariwa ga Samiti ya Tsamaiso ya Mafatshe le Tsamaiso ya go nna le Lefatshe mo Mafelong Merafe ka Labotlhano, 27 le Lamatlhatso, 28 Motsheganong 2022 kwa Gauteng.
",0.7251475
"Kabinete file tlhahlo ya gore ditherišano tša goya pele di swarwe gotee le bakgathatema ba maleba.
","Kabinete amogetse Lekwalo la Ditshwetso tse go Enngweng ka Tsona la Tsamaiso ya Mafatshe le Tsamaiso ya go nna le Lefatshe mo Mafelong Merafe le go dumelanweng ka lona mo kgweding ya Mopitlwe kaetse gore go dirwe patlomaikutlo nngwe mo baameging ba ba maleba.
",0.7561138
"Samiti ye tla ba tatelano le pheletšo ya mošomo wo dirilwego ngwageng wa go feta, fao dikgopolo tša bakgathatema ba go fapafapana di tla akaretšwago     Ditiragalo tšeo di Tlago.
","Samiti eno tla tsenyeletsa gape le tiro e dirilweng mo ngwageng o fetileng mo go yona go batlilweng ditshwaelo go tswa kwa bannaleseabeng ba ba farologaneng     Ditiragalo tse di Tlang.
",0.85833156
"Khonferense ya Bohlano ya Lefase ka Bophara ya Phedišo ya Tšhomišo ya Bana Bokgoba.
","Khonferense ya Botlhano ya Lefatshe ya Phediso ya go Ja Bana Ntshu.
",0.81781423
