src_text,tgt_text,cosine_score
"Mehutahuta ya difeme tša Afrika Borwa e beeleditše ka Nigeria, mola dikhamphani tša Nigeria le tšona di oketša kgolo ya tšona ka Afrika Borwa.
","Lena ke lekgetlo la pele tlhodisano ena e tummeng e tshwarelwa mobung wa Afrika.3 Kabinete e ipiletsa ho bohle hore ba tshehetse letsholo la Netebolo la Labohlano, ka ho apara diaparo tsa batshehetsi kapa ho ikgabisa ka mebala ya naha bakeng sa ho etsa mokoloko ka mora Sehlopha sa Naha sa Netebolo sa Afrika Borwa.4 KSI ya Afrika Borwa e boetse e tla tshwara Mohope wa Bompodi ba Lefatshe ba Karate wa KSI wa bo-20 Cape Town ho tloha ka la 10 ho ya ka la 15 Phupu 2023, mme ditakaletso tse ntle di lebiswa ho Sehlopha sa Afrika Borwa ha se ntse se itokisetsa ketsahalo ena e tummeng ya lefatshe ka bophara.5 Afrika Borwa e motlotlo ka ho tshwara Dipapadi tsa ho qetela tsa Bompodi ba Table Tennis tsa 2023 Setsing sa Matjhaba sa Dikopano sa Durban.
",0.63287365
"Beke ya Tšhireletšo ya Bana Afrika-Borwa e tla keteka Beke ya Tšhireletšo ya Bana go tloga ka la 28 Mopitlo go fihla ka la 4 Phupu 2023 ka fase ga kgwekgwe ye: “A re šireletšeng Bana nakong ya COVID-19 le ka Morago ga moo”.
","Hoo e ka bang dibapadi tse 600 ho tswa dinaheng tse fapaneng lefatsheng ka bophara, hajwale di ntse di sebetsa mme tlhodisano ena e fa dibapadi monyetla wa hore di bontshe talente ya tsona.
",0.6363007
"Lesolo le le kgoboketša makala ka moka le ditšhaba go ya tlhabollong, tlhokomelong, le tšhireletšong ya bana.2 Ngwaga wo lesolo le tla lebiša tlhokomelo go RISIHA, lenaneo la thibelo le kgato ya ka pela le thibelo ye e theilwego setšhabeng, leo le lebišitšwego go šuthiša bana go tšwa kotsing go ya kgotlelelong.
","Tlhodisano e qadile ka la 20 Motsheanong 2023 mme e tla tswela pele ho fihlela ka la 28 Motsheanong 2023.Melaetsa.
",0.6081738
"Ketelo ya Tlhokomedišo ya DDM ya Kapa Bohlabela.1 Motlatšamopresidente, Morena Paul Mashatile ka la 26 le la 27 Mopitlo 2023 o tla dira Ketelo ya Tekolo ya DDM Seleteng sa OR Tambo le Toropo ya Metropholithene ya Buffalo, Kapa Bohlabela.2 Ketelo ye ke karolo ya maitapišo a mmušo a go kgonthiša gore tlhabollo ya ditšhaba e direga ka tsela ye e kopantšwego yeo e thekgwago ke mokgwa wa DDPalamente ya Botshelela ya Palamente ya Dinaga tša Afrika (PAP)4.1 Baetapele go tšwa go ralala le kontinente ba kgobokane go tloga ka Mošupologo, 15 Mopitlo 2023 go la Midrand, Afrika Borwa bakeng sa Palamente ya Botshelela ya PAKopano e tla fela ka la 02 Phupu 20 2 PAP e nyaka go šogana le ditlhohlo tše di swanago go ralala le kontinente gomme e emetšwe ke baetapele ba Afrika go tšwa kontinenteng ka bophara.
","MahlohonoloKabinete e lebisa mahlohonolo a yona le ditakaletso tse molemo ho: Letona la Ditjhelete, Monghadi Enoch Godongwana, ya ileng a fuwa kgau ya boemo bo hodimo ya African Banker 2023 ya Kgau ya Letona la Ditjhelete la Selemo ho Sharm El Sheikh, Egepeta ka Laboraro la 24 Motsheanong 2023, bakeng sa boiteko ba hae selemong se fetileng ka ho laola moruo wa Afrika Borwa nakong ya moruo le tikoloho ya lapeng tse rarahaneng.
",0.830184
"Khomišene ya Mawatle ya Magareng ga Mebušo (IOC)5.1 Afrika Borwa e tla kgatha tema kopanong ya bo56 ya lekgotlaphethiši yeo e tlago swarelwa Paris, France go tloga ka la 16 go fihla ka la 30 Phupu 20 2 IOC ya Mokgatlo wa Thuto, Mahlale le Setšo wa UN (IOC-UNESCO) ke mokgatlo wa UN wo o nago le maikarabelo a go thekga saense le ditirelo tša mawatle a lefase ka bophara.3 Afrika Borwa e amogela bohlokwa bja dinyakišišo le taolo ya mawatle a yona le ditikologo tša lebopong tša tlhabollo ya go ya go ile.
","Kgau e ile ya amohelwa ke Letona bakeng sa ho sebedisa leano la ditjhelete bakeng sa ho potlakisa matsete lefapheng la ntlafatso ya eneji.
",0.60363084
"Dinyakišišo tša mawatle gape di thuša go fa ditemošo tša ka pela malebana le dikotsi tšeo di theilwego lewatleng le go thuša mebušo go dira diphetho tše di nago le tsebo.
","Hana Gammon, e leng mongodi ya dilemo tse 20 wa Afrika Borwa bakeng sa ho hapa Kgau ya Dipale tse Kgutshwane tsa Commonwealth ya 2023, sebakeng sa Afrika le ho ba e monyenyane ka ho fetisisa nalaneng ya ho fumana kgau.
",0.6235311
"Afrika Borwa ke Monggae wa Dipapadi tše Kgolo tša Diphadišano.1 Barati ba dipapadi go tšwa lefaseng ka bophara ba ka letela kamogelo ye borutho ya Ubuntu le kamogelo ya baeng ya maemo a godimo ge ba e tla go bona Sebjana sa Lefase sa Kgwele ya Diatla le Phadišano ya Lefase ya Karate ba Kimura Shukokai International (KSI) ka Afrika Borwa.
","Sehlopha sa Stormers Rugby bakeng sa ho finyella ho makgaolakgang ho United Rugby Championship.
",0.694483
"Afrika Borwa e na le rekoto ye e hlatselegago ya go beakanya ditiragalo tše kgolo ka katlego.2 Lethabo le tšwela pele go oketšega ka matšatši a go fetanyana a masometshela (60) go ya go thomeng ga Sebjana sa Lefase sa Kgwele ya Diatla ka Motse Kapa go tloga ka la 28 Mosegamanye go fihla ka la 6 Phato 2023.
","Di-Stormers di tla bapala kgahlanong le sehlopha sa Irish Musters Lebaleng la Dipapadi la Cape Town ka Moqebelo wa la 27 Motsheanong 2023.
",0.73789644
"Le ke lekga la mathomo phadišano ye ya maemo a godimo e swarwa mmung wa Afrika.3 Kabinete e dira boipiletšo go bohle go thekga lesolo la Labohlano la Kgwele ya Diatla, ka go apara diaparo tša bathekgi goba go apara mebala ya bosetšhaba go thekga sehlopha sa Bosetšhaba sa Kgwele ya Diatla sa Afrika Borwa.4 KSI South Africa gape ke monggae wa Diphadišano tša Lefase tša Karati ya KSI ya bo20 ka Motse Kapa go tloga ka la 10 go fihla ka la 15 Mosegamanye 2023, gomme dikganyogo tša rena tše botse di romelwa go Team SA ge ba itokišeletša tiragalo ye ya maemo a godimo ya lefase ka bophara.5 Afrika Borwa e swere ka boikgantšho Diphadišano tša Makgaolakgang tša Phadišano ya Thenese ya Tafola tša 2023 ka Senthareng ya Dikopano ya Boditšhabatšhaba ya Durban.
","Monghadi Zakes Mda, sengodi sa dibuka sa Afrika Borwa le Moprofesara Tshilidzi Marwala, Motlatsi wa mehleng wa Motlatsi wa Mokhanselara le Mosuwehlooho Univesithing ya Johannesburg, bao ka bobedi ba ileng ba kgethwa bakeng sa Dikgau tsa Bahlalefi Afrika tsa 2023.
",0.7664393
"Dibapadi tše di ka bago 600 go tšwa dinageng tše di fapanego lefaseng ka bophara ka se sebaka di a bapala gomme phadišano ye e fa dibapadi tša rena sebaka sa go bontšha talente ya tšona.
","Monghadi Mda le Moprofesara Marwala ba kgethilwe hara maAfrika a mang a 19 a ipabotseng dikarolong tse fapaneng.
",0.6307549
"Phadišano ye e thomile ka la 20 Mopitlo 2023 gomme e tla tšwela pele go fihla ka la 28 Mopitlo 2023.Melaetša.
","MatshedisoKabinete e fetisitse matshediso ho malapa le metswalle ya: Leqosa la naha naheng ya Rephabliki ya Algeria, Monghadi Billy Masetlha, ya ileng a sebeletsa Afrika Borwa mesebetsing e fapaneng mmusong, e kenyeletsang ho ba Motsamaisi-Kakaretso wa ditshebeletso tsa mautlwela.
",0.52352846
"DitebogišoKabinete e rometše ditebogišo le melaetša ya yona ya takaletšo ya mahlatse go: Tona ya Ditšhelete, Morena Enoch Godongwana, yo a filwego Sefoka sa Tona ya Ditšhelete ya Ngwaga sa African Banker sa 2023 sa maemo a godimo go la Sharm El Sheikh, Egepeta ka Laboraro, la 24 Mopitlo 2023 ka maitapišo a gagwe mo ngwageng wo o fetilego go laola ikonomi ya Afrika Borwa ka tikologo ye e nago le mathata ya lefase ka bophara le ya ka mo nageng.
","O ne a amehile ka botebo Ntweng bakeng sa tokoloho ya Afrika Borwa, ho kenyeletsa ho ba setho sa Umkhonto we Sizwe.
",0.6205447
"Sefoka se lebogile tšhomišo ya Tona ya pholisi ya ikonomi go akgofiša dipeeletšo ka lekaleng la enetši ye mpshafatšegago.
","Murthi Naidoo, ya ileng a nehela bophelo ba hae ntweng ya tokoloho ya naha.
",0.6336025
"Hana Gammon, mongwadi wa mengwaga ye 20 wa Afrika Borwa ka lebaka la go thopa Sefoka sa Dikanegelokopana sa Kgweranaditšhaba sa 2023, seleteng sa Afrika le go ba yo monnyane mo historing ya sefoka.
","O ile a kwallwa ke mapolesa a tshireletso ho tloha ka Pudungwana 1965 ho ya ho Mmesa 1966 ntle le diqoso mme a bapala karolo e mafolofolo bophahamong ba boemo ba tshohanyetso qetellong ya dilemo tsa bo-1980.Barry Dwolatzky, e ne e le pulamadiboho lefapheng la tlhahisoleseding ya naha le theknoloji ya puisano.
",0.7830634
"Sehlopha sa Rakebii sa Stormers ka go fihlelela makgaolakgang a Phadisano ya Rakebii ye e Kopantšwego.
","E ne e le Moprofesara (Emeritus) thutong ya School of Electrical and Information Engineering Lefapheng la Boenjiniere le Kaho ya Tikoloho Univesithing ya Wits.
",0.6786383
"Stormers e tla bapala kgahlanong le Irish Musters lepatlelong la Motse Kapa ka Mokibelo, la 27 Mopitlo 2023.
","Batho ba 15 ba lahlehetsweng ke bophelo ka lebaka la kholera Hammanskraal Toropong ya Tshwane.
",0.65265036
"Cholera outbreak Management
","Cholera outbreak Management
",0.9806903
"Cabinet welcomed President Cyril Ramaphosa’s planned visit to and interaction with residents of Hammanskraal.
","Cabinet welcomed President Cyril Ramaphosa’s planned visit to and interaction with residents of Hammanskraal.
",0.98982644
"The visit did take place today, Thursday, 08 June, 2023, and this engagement gave the President the opportunity to hear directly from residents about the challenges they face.
","The visit did take place today, Thursday, 08 June, 2023, and this engagement gave the President the opportunity to hear directly from residents about the challenges they face.
",0.9907291
"The President, the Minister of Water and Sanitation and the Executive Mayor of Tshwane were able to assess government interventions in the area and provide relevant feedback to residents.
","The President, the Minister of Water and Sanitation and the Executive Mayor of Tshwane were able to assess government interventions in the area and provide relevant feedback to residents.
",0.99202466
"Government interventions include the field hospital operational in Kanana, Hammanskraal, and a multi-disciplinary team of experts to arrest the spread which has successfully treated hundreds of people.
","Government interventions include the field hospital operational in Kanana, Hammanskraal, and a multi-disciplinary team of experts to arrest the spread which has successfully treated hundreds of people.
",0.9937658
"Work is also underway to ensure that local councils use their water infrastructure grants effectively.
","Work is also underway to ensure that local councils use their water infrastructure grants effectively.
",0.99380094
"For the current financial year, over R14 billion has been set aside for municipalities to address water infrastructure backlogs.
","For the current financial year, over R14 billion has been set aside for municipalities to address water infrastructure backlogs.
",0.9904069
"Cabinet welcomes the cooperation between the City of Tshwane and Department of Water and Sanitation on the planned upgrade of the Rooiwal Water Treatment plant, which will be undertaken over three phases at a cost of R4 billion.
","Cabinet welcomes the cooperation between the City of Tshwane and Department of Water and Sanitation on the planned upgrade of the Rooiwal Water Treatment plant, which will be undertaken over three phases at a cost of R4 billion.
",0.9841736
"Cabinet calls on the affected communities to remain vigilant and to take special care of children.
","Cabinet calls on the affected communities to remain vigilant and to take special care of children.
",0.9903106
"Cholera can be prevented by using safe water.
","Cholera can be prevented by using safe water.
",0.9925746
"Treat the water first by boiling it for at least 1 minute and always wash your hands with clean water and soap.
","Treat the water first by boiling it for at least 1 minute and always wash your hands with clean water and soap.
",0.99491644
"For more information on prevention tips WEBTOKEN Government thanks those volunteer organisations and individuals who have stepped forward to lend a hand.
","For more information on prevention tips WEBTOKEN Government thanks those volunteer organisations and individuals who have stepped forward to lend a hand.
",0.989465
"Water Quality Report
","Water Quality Report
",0.99008256
"Cabinet welcomed the reintroduction of the Blue, Green and No Drop Watch which were last conducted in 2013 and 2015 respectively.
","Cabinet welcomed the reintroduction of the Blue, Green and No Drop Watch which were last conducted in 2013 and 2015 respectively.
",0.9904831
"The Green, Blue and No Drop Certification programmes are regulatory mechanisms of the Department of Water and Sanitation (DWS) as the water sector regulator in terms of both the National Water Act and Water Services Act, DWS
","The Green, Blue and No Drop Certification programmes are regulatory mechanisms of the Department of Water and Sanitation (DWS) as the water sector regulator in terms of both the National Water Act and Water Services Act, DWS
",0.9925975
"The aim of this uniquely South African regulatory tool is to improve municipal drinking water quality, wastewater management as well as water conservation and demand management.
","The aim of this uniquely South African regulatory tool is to improve municipal drinking water quality, wastewater management as well as water conservation and demand management.
",0.99262494
"Cabinet deliberated on the results and implications of the 2023, Blue, Green and No Drop Watch reports, which were made public on Tuesday, 6 June.
","Cabinet deliberated on the results and implications of the 2023, Blue, Green and No Drop Watch reports, which were made public on Tuesday, 6 June.
",0.98902893
"The Watch Reports indicate that there has been a decline in drinking water quality and an increase in non-revenue water since the last Drop reports were issued.
","The Watch Reports indicate that there has been a decline in drinking water quality and an increase in non-revenue water since the last Drop reports were issued.
",0.9919363
"Cabinet welcomes measures to be taken by the Department of Water and Sanitation to address the current state of affairs in relation to water and waste water management.
","Cabinet welcomes measures to be taken by the Department of Water and Sanitation to address the current state of affairs in relation to water and waste water management.
",0.9904684
"The Minister of Water and Sanitation will in the following weeks announce these measures per Province.
","The Minister of Water and Sanitation will in the following weeks announce these measures per Province.
",0.9921024
"Energy Cabinet welcomed the recent deliberations between the Minister of Electricity, Dr Kgosientsho Ramokgopa and the Mozambican Minister for Mineral Resources and Energy, Carlos Zacarias, to secure additional power from Mozambique to support our national grid.
","Energy Cabinet welcomed the recent deliberations between the Minister of Electricity, Dr Kgosientsho Ramokgopa and the Mozambican Minister for Mineral Resources and Energy, Carlos Zacarias, to secure additional power from Mozambique to support our national grid.
",0.9920509
"In the immediate term, Mozambique can provide 80MW and a further 1000MW over the medium term.
","In the immediate term, Mozambique can provide 80MW and a further 1000MW over the medium term.
",0.99112314
"Cabinet continues to urge South Africans to support the Winter Demand Management campaign launched by the Minister of Electricity, to save electricity to reduce strain on the national grid and help lower load shedding stages this winter.
","Cabinet continues to urge South Africans to support the Winter Demand Management campaign launched by the Minister of Electricity, to save electricity to reduce strain on the national grid and help lower load shedding stages this winter.
",0.99241614
"Cabinet received a report by the Minister of Electricity which detailed recent gains in the management of power stations and other operations which, for example, overcame the need for Eskom to burn diesel this past weekend and avoid load shedding.
","Cabinet received a report by the Minister of Electricity which detailed recent gains in the management of power stations and other operations which, for example, overcame the need for Eskom to burn diesel this past weekend and avoid load shedding.
",0.9923126
"The Minister of Electricity will brief media at 14h00 tomorrow, Friday, on these and other developments.
","The Minister of Electricity will brief media at 14h00 tomorrow, Friday, on these and other developments.
",0.9900951
"Operation Vulindlela
","Operation Vulindlela
",0.9836196
"Cabinet welcomed the progress under the operation Vulindlela as detailed by the Minister in the Presidency, Khumbudzo Ntshavheni, with regard to the implementation of structural reforms in the areas of energy supply, logistics network and infrastructure, digital communications and the visa regime.
","Cabinet welcomed the progress under the operation Vulindlela as detailed by the Minister in the Presidency, Khumbudzo Ntshavheni, with regard to the implementation of structural reforms in the areas of energy supply, logistics network and infrastructure, digital communications and the visa regime.
",0.98894143
"The number of completed reforms has risen from three to 11, while a further 14 reforms are on track.
","The number of completed reforms has risen from three to 11, while a further 14 reforms are on track.
",0.9940162
"The primary focus is on addressing the electricity crisis and improving the efficiency of freight rail, both of which are weighing heavily on economic growth.
","The primary focus is on addressing the electricity crisis and improving the efficiency of freight rail, both of which are weighing heavily on economic growth.
",0.9941778
"President’s Coordinating Council
","President’s Coordinating Council
",0.98229563
"Cabinet supported President Cyril Ramaphosa’s call during the meeting of the President’s Coordinating Council on 2 June 2023 to accelerate service delivery in response to the needs of communities.
","Cabinet supported President Cyril Ramaphosa’s call during the meeting of the President’s Coordinating Council on 2 June 2023 to accelerate service delivery in response to the needs of communities.
",0.99339277
"The President directed the Council to accelerate service delivery improvement and address challenges in relation to legislation, governance and capacity constraints.
","The President directed the Council to accelerate service delivery improvement and address challenges in relation to legislation, governance and capacity constraints.
",0.9918734
"The meeting also considered reforms to the Water Act and Water Services Act to provide for better service delivery of water.
","The meeting also considered reforms to the Water Act and Water Services Act to provide for better service delivery of water.
",0.992273
"Similarly, the Council was briefed on interventions by the Department of Transport for emergency work and routine maintenance, as well as primary road transfers from provincial authorities to the national road network for better management of provincial roads by the South African National Roads Agency Limited..Batyi Automotive Component Supply Facility
","Similarly, the Council was briefed on interventions by the Department of Transport for emergency work and routine maintenance, as well as primary road transfers from provincial authorities to the national road network for better management of provincial roads by the South African National Roads Agency Limited..Batyi Automotive Component Supply Facility
",0.99201614
"Cabinet welcomed the opening of the Batyi Automotive Component Supply (BACS) Facility in Pretoria which cements the country’s position as a global player in the automotive sector.
","Cabinet welcomed the opening of the Batyi Automotive Component Supply (BACS) Facility in Pretoria which cements the country’s position as a global player in the automotive sector.
",0.9931025
"BACS is a product of an incubation centre by Ford Motor Company and Motherson, a supplier of spray painting and components.
","BACS is a product of an incubation centre by Ford Motor Company and Motherson, a supplier of spray painting and components.
",0.99165255
"The centre supports black suppliers to be independent and globally competitive after graduating from the Automotive Industry Development Centre (AIDC’s) Incubation Programme.
","The centre supports black suppliers to be independent and globally competitive after graduating from the Automotive Industry Development Centre (AIDC’s) Incubation Programme.
",0.9933817
"The BACS facility currently employs 60 people, with 30 working the day shift, and 30 the night shift.
","The BACS facility currently employs 60 people, with 30 working the day shift, and 30 the night shift.
",0.9923473
"Moreover, it is looking at bringing in young trainees to further develop their skill sets.
","Moreover, it is looking at bringing in young trainees to further develop their skill sets.
",0.99115765
"Lufhereng Social Housing Project
","Lufhereng Social Housing Project
",0.97346103
"Cabinet welcomed the Department of Human Settlements’ launch of the Lufhereng Social Housing Project in Soweto, which consists of 407 units of rental stock for targeted beneficiaries.
","Cabinet welcomed the Department of Human Settlements’ launch of the Lufhereng Social Housing Project in Soweto, which consists of 407 units of rental stock for targeted beneficiaries.
",0.99147826
"Government’s social housing programme integrates mixed-income groups, curbs the housing backlog and brings backyard and informal settlement dwellers closer to economic opportunities.
","Government’s social housing programme integrates mixed-income groups, curbs the housing backlog and brings backyard and informal settlement dwellers closer to economic opportunities.
",0.99147654
"Road Infrastructure
","Road Infrastructure
",0.98561966
"The opening of the R56 million road project in Estcourt, KwaZulu- Natal, is part of government’s efforts to improve logistic connectivity in rural towns.
","The opening of the R56 million road project in Estcourt, KwaZulu- Natal, is part of government’s efforts to improve logistic connectivity in rural towns.
",0.9903199
"Work done on the road project included the upgrading of the D1252 from gravel to tar roads.
","Work done on the road project included the upgrading of the D1252 from gravel to tar roads.
",0.9926878
"The road links to the N3, which connects eThekwini and Johannesburg, opening opportunities for local unemployed youth and emerging contractors.
","The road links to the N3, which connects eThekwini and Johannesburg, opening opportunities for local unemployed youth and emerging contractors.
",0.9892688
"With more than 60 per cent of goods transported through the N3 corridor, the road upgrade will further facilitate the efficient movement of goods and services to the rest of South Africa and Sub-Saharan Africa..Social Partnership
","With more than 60 per cent of goods transported through the N3 corridor, the road upgrade will further facilitate the efficient movement of goods and services to the rest of South Africa and Sub-Saharan Africa..Social Partnership
",0.99228585
"Cabinet welcomed the partnership with mining company Impala Platinum in Rustenburg on the building of a clinic and early childhood development centre as part of its Social and Labour Plan.
","Cabinet welcomed the partnership with mining company Impala Platinum in Rustenburg on the building of a clinic and early childhood development centre as part of its Social and Labour Plan.
",0.9872303
"The Freedom Park Clinic and an Early Childhood Development Centre were handed over to the Departments of Health and Basic Education in the North West Province.
","The Freedom Park Clinic and an Early Childhood Development Centre were handed over to the Departments of Health and Basic Education in the North West Province.
",0.99439543
"Partnership between government and organised business
","Partnership between government and organised business
",0.99133784
"Cabinet welcomed the partnership initiative between Government and organised business to actively work towards removing obstacles to inclusive economic growth and job creation.
","Cabinet welcomed the partnership initiative between Government and organised business to actively work towards removing obstacles to inclusive economic growth and job creation.
",0.99037296
"The current priority areas are in energy, logistics and crime and corruption fighting, with further work being done in pursuit of the jobs agenda.
","The current priority areas are in energy, logistics and crime and corruption fighting, with further work being done in pursuit of the jobs agenda.
",0.99254584
"Safety and security
","Safety and security
",0.98804605
"To monitor and protect communities affected by crime, the SA Police Service has set aside nearly R2 billion to procure drones and vehicles to enhance visibility.
","To monitor and protect communities affected by crime, the SA Police Service has set aside nearly R2 billion to procure drones and vehicles to enhance visibility.
",0.9834473
"R65 million has also been allocated to the top 30 crime-intensive stations to address murder and other contact offences.
","R65 million has also been allocated to the top 30 crime-intensive stations to address murder and other contact offences.
",0.99334544
"In addition, Tactical Response Teams are being deployed at stations and districts in areas with high crime rates.
","In addition, Tactical Response Teams are being deployed at stations and districts in areas with high crime rates.
",0.9932999
