src_text,tgt_text,cosine_score
"Tataiso ya phekolo ya Kholera e inthaneteng ho WEBTOKEPatlisiso ya Kotara ya Basebetsi (QLFS)
","UMphathiswa wezaManzi noGutyulo, uMnu Senzo Mchunu, uza kubamba intlanganiso noSodolophu wesiXeko sase-Tshwane, uCeba u-Cilliers Brink, ngoLwesihlanu, umhla wama-26 kuCanzibe 2023 apho baza kupheka isicwangciso bobabini esiza kwenza umsebenzi ofanele ukuba wenziwe kudala wokulungiswa kwe-Rooiwal WWTXa ufuna iinkcukacha ezithe vetshe, tsalela umnxemba iZiko leSizwe leziFo ezoSulelayo (i-NICD) elisebenza imini nobusuku kule nombolo: 082 883 9920.
",0.681177
"Kabinete e tiisitse hore QLFS ya pele ya 2023 e bontshitse keketseho ya botshelela ya kotara ka tatellano ho dipalo tsa mesebetsi le khiro ya batho ba dimilione tse e haufi haholo le ho fihla khiro ha batho ba dimilione tse pele ho matsatsi a Coronavirus (COVID-19).
","Iindlela zokunyanga isifo sotyatyazo ziyafumena ku-intanethi apha: WEBTOKEUPhando lweKota lwezeMisebenzi (i-QLFS)
",0.698055
"Sena ke pontsho e hlakileng ya hore moruo wa Afrika Borwa o ntlafala ka matla ka mora ho angwa ke sewa sena.
","IKhabhinethi ichulumancile kukuba i-QLFS yokuqala yowama-2023 ibonakalise ukuba inani lemisebenzi linyuke iikota ezintandathu zilandelana futhi nelabantu abaqeshiweyo abazizigidi ezili-16.2 linyuke lasondela kwela nani lezizigidi ezili-16.4 zabantu ababephangela phambi kokufika kukabhubhane weNtsholongwane ye-Corona (i-COVID-19).
",0.68901455
"Kotara ya pele ya dipalopalo tsa khiro di bontsha hore ke mesebetsi e 209 000 e thehilweng e tlasa taolo ya mmuso mme e 107 000 e seng tlasa taolo ya mmuso nakong ya kotara ya pele ya selemo.
","Oku kubonisa ngokuphandle ukuba uqoqosho loMzantsi Afrika luyahluma kwakhona emva kokuba luthwaxwe ngula bhubhane.
",0.65808016
"Dikamano tsa Afrika Borwa le United States (US) Kabinete e tiisitse hore dikamano tse pakeng tsa Afrika Borwa le US e ntse e le tsa setswalle, tse matla mme di molemo bakeng sa dinaha ka bobedi ho latela seboka se neng se le dipakeng tsa Letona la Dikamano tsa Matjhaba le Tshebedisano, Ngaka Naledi Pandor le Lenqosa la US Afrika Borwa, Monghadi Reuben E Brigety, ya boletseng hore Afrika Borwa e fana ka dibetsa ho Russia.
","Iinkcukacha-mani zibonakalisa ukuba kudalwe imisebenzi engama-209 000 ngekota yokuqala kwicandelo lemisebenzi ebhaliswe ngokusesikweni yaze yangama-107 000 edalwe kwicandelo lemisebenzi engabhaliswanga ngokusesikweni kwikota yokuqala yalo nyaka.
",0.6670495
"Kabinete e boletse hape hore metjha ya bodiplomate e thehilweng e fumaneha dinaheng tsohle, ho kenyeletsa US, ho phahamisa ditaba tse ka hlahang taolong ya dikamano tsa dinaha tse pedi.
","Ubudlelwane phakathi koMzantsi Afrika ne-United States (i-US) IKhabhinethi ikubethelele ukuba ubudlelwane phakathi koMzantsi Afrika ne-US busebuhle, bungqingqwa futhi bululutho kuwo omabini la mazwe emva kwentlanganiso ibiphakathi koMphathiswa wezoBudlelwane baMazwe ngaMazwe neNtsebenziswano, uGq Naledi Pandor kunye noNozaku-zaku wase-US eMzantsi Afrika, uMnu Reuben E Brigety, emalunga nezityholo azenzileyo zokuba uMzantsi Afrika uthengisela i-Russia izixhobo.
",0.77551085
"Kabinete e amohela phatlalatso ya Cyril Ramaphosa ya ho thehwa ha patlisiso e ikemetseng ho hlahloba diqoso tsa phano ya dibetsa tsa Afrika Borwa ho Russia.
","IKhabhinethi ikubethelela ukuba amaqonga afanelekileyo asetyenziswa ngoonozaku-zaku avuleleke kuwo onke amazwe, kuquka ne-US, ukuba avakalise izinto angaziqondiyo eziza kuchaphazela ubudlelwane phakathi kwamazwe.
",0.7444192
"Dintlha tsa patlisiso di tla phatlalatswa ka nako e loketseng.
","IKhabhinethi isamkele isibhengezo esenziwe nguMongameli u-Cyril Ramaphosa sokuseka ikhomishoni yophando ezimeleyo ize iphande ezi zityholo zokuthengiselwa kwezixhobo kwe-Russia nguMzantsi Afrika.
",0.5194388
"Dikamano tsa Afrika Borwa le Singapore
","Iinkcukacha zale khomishoni yophando ziza kubhengezwa kungentsuku zatywala.
",0.33607006
"Mopresidente Ramaphosa o ile a amohela Tonakgolo Lee Hsien Loong wa Rephabliki ya Singapore ka Labobedi la 16 Motsheanong 2023.
","Ubudlelwane boMzantsi Afrika ne-Singapore
",0.41948944
"Singapore ke motsetedi ya bohlokwa Afrika Borwa, ka letsete la dibilione tse fetang tse hlano tsa diranta ka kakaretso lefapheng le kang la tlhahiso, ditshebeletso tsa ditjhelete le thekiso ya matlo.
","UMongameli Ramaphosa ebendwendwelwe yiNkulumbuso u-Lee Hsien Loong weRiphabhlikhi yase-Singapore ngoLwesibini, umhla we-16 kuCanzibe 2023.
",0.6433177
"Ditumellano tse saennweng dipakeng tsa dinaha tsena tse pedi di reretswe ho matlafatsa kgwebo, letsete, thuto le tshebedisano ya tshireletso..Imbizo ya Mopresidente ya Mohlala wa Ntlafatso ya Setereke (DDM) sa Kapa Bophirimela Mopresidente Ramaphosa o ile a isa DDM ya botshelela ya Imbizo ya Mopresidente Kapa Bophirimela, Masepaleng wa Lehae wa Drakenstein, Seterekeng sa Cape Winelands, ka Labohlano la 19 Motsheanong 2023.
","I-Singapore ityale imali eninzi apha eMzantsi Afrika, kangangokuba ingaphezulu kweebhiliyoni ezi-R5 iimali etyalwe leliya lizwe kumacandelo afana nelemizi-mveliso, iinkonzo zezimali kunye nezokuthengiselwana komhlaba nezindlu.
",0.7319384
"Mopresidente o ile a etella pele moifo o tswang mafapheng ohle a mmuso a mararo tlasa sehlooho se reng: “Le se ke la Siya Mang kapa Mang ka Morao”.
","Izivumelwano ezityikityiweyo ngala mazwe mabini zineenjongo zokuqinisa ubudlelwano bezorhwebo, utyalo-mali, imfundo kunye nokusebenzisana kwimiba yezokhuselo.
",0.5828381
"Imbizo e ne e etelletswe pele ke ketelo ya Mopresidente sebakeng sa Ntlafatso ya Bodulo ba Batho Vlakkeland Catalytic e haufi, e leng ntshetsopele ya matlo a setjhaba e kgolo ka ho fetisisa ho fihle jwale Masepaleng wa Lehae wa Drakenstein.
","Imbizo kaMongameli yaseNtshona Koloni yeNkqubo yoPhuhliso lweziThili (i-DDM)
",0.7180466
"Ntlafatso e tswetseng pele ka 2017 ha e feela e tla fana ka matlo a 2 556 ho batho ba tshwanelehang.
","UMongameli Ramaphosa ebebambe Imbizo kaMongameli yesithandathu ye-DDM eNtshona Koloni, kuMasipala weNgingqi wase-Drakenstein, kwiSithili sase-Cape Winelands, ngoLwesihlanu, umhla we-19 kuCanzibe 2023.
",0.59394765
"Kaho ya matlo a 942 a Karolo ya Pele e ntse e tswela pele, a 454 a se a phethilwe mme a 301 a ntse a hahwa.
","UMongameli ebekhokele igqiza lawo omathathu amaqoqo karhulumente phantsi komxholo othi: “Kungashiywa Namnye Ngasemva”.
",0.6072571
"Bohlokwa ba projeke ena ke hore e haha mefuta e fapaneng ya dikgetho tsa matlo ho tloha ho a batho ba fumanang moputso wa R0 ho ya ho R3 500 (tlasa Ho Qetella Motheo o Motjha), ho Lenaneo la Ditjhelete le Hokahaneng le Motho ka Mong, bakeng sa batho ba fumanang moputso o pakeng tsa R3 501 le R22 000 ka selemo.
","Le Mbizo ibanjwe emva kokuba uMongameli ebetyelele i-Vlakkeland Catalytic Human Settlement Development ekutshane phaya, elelona phulo likhulu likarhulumente lokwakhiwa kwezindlu oko wasekwayo lo Masipala weNgingqi wase-Drakenstein.
",0.72722983
"Monyetla wa Bodulo ba Setjhaba hammoho le wa Bahlabani ba Sesole e teng projekeng ena.
","Lo msebenzi wokwakha waqaliswa ngowama-2017 xa ugqityiwe uza kwakha izindlu ezingama-2 556 eziza kufunyanwa ngabantu abafanelekileyo.
",0.65431875
"Ketelo ya Bolebedi ya Mmasepala wa Motsemoholo wa eThekwini le Mmasepala wa Setereke sa uMgungundlovu ka la 18 le la 19 Motsheanong 2023.
","Umsebenzi wokwakhiwa kwezindlu ezingama-942 kwiSigaba sokuQala wona sele uqhuba, ezingama-454 zona sele zakhiwe zona ezingama-301 zisakhiwa.
",0.65895
"Motlatsi wa Mopresidente Paul Mashatile o ile a buisana le batshehetsi ba amehang ho tsa thuto le thupello, temo, kgwebo le diindasteri nakong ya leeto la bookamedi Mmasepaleng wa Motsemoholo wa eThekwini le Mmasepaleng wa Setereke sa uMgungundlovu e le karolo ya DDM ya ketelo ya bolebedi.
","Eli phulo libalulekile kuba lakha iintlobo zezindlu ezahlukeneyo ukusukela kwezo zabo bamkela umvuzo oyi-R0 ukuya kwabo bamkela i-R3 500 (phantsi komgaqo-nkqubo obizwa ngokuba yi-Breaking New Ground), ukuya kula nkqubo ibizwa ngokuba yi-Financed Linked Individual Subsidy Programme, yabo bamkela phakathi kwe-R3 501 ne-R22 000 ngonyaka.
",0.76242965
"Diprojeke tse ka sehloohong tse etetsweng e ne e le tsa sebaka sa Projeke ya Ntshongweni Catalytic, moo Smart City e ntse e ahwa pakeng tsa Durban le Pietermaritzburg.
","Le projekthi iza kwakha izindlu ezisiBonelelo sezeNtlalo kunye nezo zilungele amaGqala eeMfazwe.
",0.7241484
"Projeke ena e tla tsosolosa mosebetsi wa moruo sebakeng seo, e tla ba le tlatsetso ya diranta tse dibilione tse ka bang 15 tsa letsete dilemo tse latelang tse 10 ho isa ho tse Tsamaiso ya Phepelo ya Metsi
","UTyelelo lokuHlola oluya kuMasipala oMbaxa waseThekwini noweSithili saseMgungundlovu ngomhla we-18 no-19 kuCanzibe 2023.
",0.6657818
"Mopresidente Ramaphosa o ile a etela Morero wa Metsi a Dihlaba tsa Lesotho ka Labobedi la 23 Motsheanong 2023 e leng moo a ileng a kenya letsoho moketeng wa ho fetola lekote la Mohato wa 2 wa projeke.
","USekela-Mongameli u-Paul Mashatile ebebambe indibano yokufakana imilomo kunye namahlakani akwicandelo lezemfundo noqeqesho, ezolimo, ezorhwebo kunye nezoshishino ngethuba ekutyelelo lokuya kuhlola kuMasipala oMbaxa waseThekwini kunye noMasipala wesiThili saseMgungundlovu njengenxalenye yotyelelo lwe-DDM lokuya kuhlola.
",0.7629425
"O saennwe dilemong tse mmalwa tse fetileng mme o ile wa dieha, mokete ona ke pontsho ya ho potlakisa mohato wa dinaha tsena tse pedi.
","Ezinye zeeprojekthi ezingundoqo yile yase-Ntshongweni Catalytic Project, apho kuza kwakhiwa isiXeko Sale Mihla phakathi kweTheku noMgungundlovu.
",0.699776
"Morero wa Metsi a Dihlaba tsa Lesotho o bohlokwa bakeng sa ho netefatsa polokeho ya phepelo ya metsi Gauteng, Foreistata, Mpumalanga, Leboya Bophirima le Kapa Bophirima.
","Le projekthi iza kuvuselela uqoqosho lwale ngingqi, ize izale namathuba otyalo-mali axabisa imali ezibhiliyoni zeerandi ezili-15 kule minyaka ili-10 ukuya kweli-15 izayo.
",0.6744597
"Letsete tsamaisong ya phepelo ya metsi bakeng sa ho ntlafatsa bophelo ba MaAfrika Borwa le ntse le tswela pele, ka phano ya diranta tse ka hodimo ho dibilione tse 14 ho bomasepala bakeng sa ho shebana le ditsamaiso tsa phepelo ya metsi tse saletseng morao, ka Thuso ya Infrastraktjha e Kgolo ya Mabatowa a Mangata (RBIG) le Thuso ya Infrastraktjha ya Ditshebeletso tsa Metsi (WSIG).
","Iziseko ezingundoqo zamanzi
",0.39881188
"RBIG e tla sebediswa diprojekeng tse 130 mme WSIG yona e abelwe diprojeke tse fetang 400 ho phatlalla le naha.
","UMongameli Ramaphosa ebendwendwele i-Lesotho Highlinds Water Project ngoLwesibini, umhla wama-23 kuCanzibe 2023 ngethuba ethatha inxaxheba kumsitho wokuphethulwa kwesoyi wesiGaba 2 sale projekthi.
",0.69207233
"Kabinete e boetse e thabisitswe ke hore Lefapha la Metsi le Bohlweki (DWS) le nka mehato ya ho lwantsha bobodu ka ho busetswa ha dimilione tse ka bang R600 ke dikhamphani tse unneng molemo ka ho fumana dithendara tse sa tlwaelehang.
","Le projekthi yatyikitywa kule minyaka iliqela igqithileyo futhi nethe yalityaziswa zizinto ezininzi, lo msitho ubuluphawu olubonisa ukuqaliswa komsebenzi okhawulezileyo wale projekthi yamazwe amabini.
",0.6956612
"Kabinete e boetse e hokometse mehato ya taolo ya thibelo e behilweng ke lefapha ho fedisa ditshenyehelo tse sa tlwaelehang, tse se nang ditholwana le tse se nang thuso.
","I-Lesotho Highlands Water Project ibaluleke kakhulu kumalinge okuqinisekisa ukuba kukho amanzi oneleyo e-Gauteng, Freyistatha, Mpumalanga, Mntla Ntshona naseMntla Koloni.
",0.72431874
"Kgau ya Tshireletso ya Setjhaba
","Ukutyala imali kwiziseko ezingundoqo zamanzi ukwenzela ukuphucula iimpilo zabemi boMzantsi Afrika kuqhubelekile ngokuthi kwabelwe oomasipala imali ezibhiliyoni zeerandi ezili-14 eza kusetyenziswa kwiziseko ezingundoqo zamanzi ezisanqongopheleyo, kusetyenziswa isibonelelo esibizwa ngokuba yi-Regional Bulk Infrastructure Grant (i-RBIG) kunye nesibizwa ngokuba yi-Water Services Infrastructure Grant (i-WSIG).
",0.41480914
"Afrika Borwa e fumane Kgau ya Mokgatlo wa Matjhaba ya Tshireletso ya Setjhaba (ISSA) le Ditlwaelo tse Ntle ya maemo ho Tshireletso ya Setjhaba bakeng sa Afrika 2023, e elang hloko letsete la mmuso bophelong ba bana ba rona, haholo ba tswang malapeng a futsanehileng le a nang le mathata.
","Isibonelelo se-RBIG siza kusetyenziswa kwiiprojekthi ezili-130 yona ke i-WSIG iza kusetyenziswa kwiiprojekthi ezingaphezulu kwama-400 kulo lonke eli lizwe.
",0.71521914
"Tokelo ya ho kena ha Afrika Borwa bakeng sa kgau ena ya maemo e ne e na le sehlooho se reng: “Katoloso ya hanyane ka hanyane ya kakaretso ya tshireletso ho bana ba nang le mathata: Taba ya Krante ya Tlhokomelo ya Ngwana, Afrika Borwa”.
","IKhabhinethi ichulumancile kukuba iSebe lezaManzi noGutyulo lisenza umsebenzi obonakalayo kwidabi lokulwa urhwaphilizo kuba imali emalunga nezigidi zeerandi ezingama-600 sele ibuyiselwe kwisebe isuka kwiinkampani ebezixhamle ngokutyikitya izivumelwano nesebe ezingekho mthethweni.
",0.7294048
"Kakaretso ya dikenyeletso tse 138 e ile ya fumanwa ho tswa ho ditho tse 48 tsa mekgatlo e tswang dinaheng tse fetang 30 tse Afrika.
","IKhabhinethi ivile nangamanyathelo aqulunqwe lisebe okuthintela urhwaphilizo kunye nokulwa inkcitho engekho mthethweni neyilahleko.
",0.58151054
"Thuso ya rona ya setjhaba ke motheo wa mmuso wa leano la ho fedisa tlala mme e ka sehlohong bakeng sa ho kgutlisa seriti sa batho ba habo rona.
","IMbasa yeziBonelelo zeNtlalo
",0.5053889
"Tsamaiso ya tshireletso ya Afrika Borwa e hara tse kgolo ka ho fetisisa lefatsheng, mme e na le baamohedi ba fetang dimilione tse.10.
","UMzantsi Afrika uphumele imbasa ephezulu ebizwa ngokuba yi-Good Practice Award in Social Security for Africa 2023 ye-International Social Security Association (i-ISSA) eqhwabela izandla imali etyalwe ngurhulumente kubomi babantwana bethu, ingakumbi abo baphuma kumakhaya asokolayo nangathathi ntweni.
",0.7100433
"Ditlhophiso tsa Bajete
","UMzantsi Afrika ungenelele olu khuphiswano lwale mbasa phantsi kwesihloko esithi: “Ukwandiswa kancinci kwenani labantwana abasokolayo abaxhamla kwiinkonzo zentlalo: uPhando ngeMali-sibonelelo yaBantwana, eMzantsi Afrika”.
",0.4289189
"Kabinete e thabisitswe ke hore Ditlhophiso tsa Bajete tsa mafapha a mmuso di tswela pele hantle.
","Abebengenelele olu khuphiswano bebeli-138 bebonke bephuma kwimibutho engamalungu engama-48 yona evela kumazwe angaphezulu kwama-30 ase-Afrika.
",0.6019393
"Sejule ya Ditlhophiso tsa Bajete tse latelang le tshehetso ya dipuisano tsa boraditaba:.Ka Labohlano la 26 Motsheanong 2023 ka 13:00, Letona la Tsamaiso ya Tshebedisano le Ditaba tsa Setso (CoGTA), Mofumahadi Thembi Nkadimeng, o tla tsamaisa puisano le boraditaba e mabapi le Ditlhophiso tsa Bajete tsa CoGTA e tla bontsha mehato e reretsweng ho matlafatsa tshebetso ya bommasepala..Ka Labobedi la 30 Motsheanong 2023, Letona la Ntlafatso ya Setjhaba, Mofumahadi Lindiwe Zulu, le Letona la Toka le Tshokollo ya Batshwaruwa, Monghadi Ronald Lamola, ba tla tshwara seboka sa Ditlhophiso tsa Bajete mme dintlha tsa puisano ya bona le boraditaba di tla fanwa ka nako e loketseng.
","Izibonelelo zethu zezentlalo ziyinxalenye yenkqubo karhulumente yokulwa indlala kwaye zibaluleke kakhulu ekubuyiseleni abantu bakuthi izidima zabo.
",0.62812436
"Ditlhophiso tsa Bajete ya Mopresidente di tla tekwa ka Laboraro la 31 Motsheanong 2023, mme puisano le boraditaba mabapi le Kgatelopele ka Diphetoho tsa Moralo le Mehato ya Khiro ka kgokahano le Operation Vulindlela, di tla tshwarwa ka Labobedi la 30 Motsheanong 20
","Inkqubo yezibonelelo-mali yoMzantsi Afrika iyenye yezona zinkulu kwihlabathi jikelele, kuba inabantu abaxhamla kuyo abangaphezulu kwizigidi ezili-
",0.6377327
"Sehopotso sa Dilemo tse 20 sa Letsatsi la Afrika le Tsela ya Tekolo ya Semphato ya Afrika (APRM) Kabinete le maAfrika Borwa ohle a ikopantse le kontinente ya Afrika le lefatshe lohle ho keteka Letsatsi la Afrika ka Labone la 25 Motsheanong.
","IVoti zoHlahlo Lwabiwo-mali
",0.26974446
"Selemo sena se bohlokwa ka ho kgetheha kaha se tshwaya sehopotso sa bo-60 sa ho saenwa ha molao wa motheo wa Mokgatlo wa Kopano ya Afrika, e leng selelekela sa Kopano ya Afrika.
","IKhabhinethi ichulumancile zindaba zokuba iVoti zoHlahlo Lwabiwo-mali zamasebe karhulumente ziqhuba kakuhle.
",0.6697231
"Mookotaba bakeng sa mekete ya 2023– “Ho kenngwa tshebetsong ha Potlakiso ya Sebaka sa Kgwebo e Lokolohileng Kontinenteng ya Afrika” – ho ela hloko mehato e nkilweng bakeng sa ho kenya tshebetsong sebaka se seholo ka ho fetisisa lefatsheng sa tokoloho ya kgwebo.
","Isicwangciso seeVoti zoHlahlo Lwabiwo-mali ezisezayo kunye neentlanganiso noonondaba:10.
",0.64984363
"Sehopotso sa Kgwedi ya Afrika sa selemong sena se dumellanang le sehopotso sa bo-20 sa APRM, se reretswe ho sebedisa taolo e ntle ka hara kontinente ka thuto ya papiso e hlophisitsweng le boitekolo.
","NgoLwesihlanu, umhla wama-26 kuCanzibe 2023 ngentsimbi ye-13:00, uMphathiswa woLawulo lweNtsebenziswano neMicimbi yeMveli (i-CoGTA), uNksz Thembi Nkadimeng, uza kubamba intlanganiso namajelo eendaba ngeVoti yoHlahlo Lwabiwo-mali ye-CoGTA apho aza kucacisa ngamanyathelo aza kuthatyathwa okuphucula umsebenzi woomasipala.
",0.77976966
"Diqeto tsa Kabinete.
","NgoLwesibini, umhla wama-30 kuCanzibe, uMphathiswa woPhuhliso loLuntu, uNksz Lindiwe Zulu kunye noMphathiswa wezoBulungisa neeNkonzo zoLuleko, uMnu Ronald Lamola, baza kuqhuba iiVoti zoHlahlo Lwabiwo-mali zamasebe wabo.
",0.29045284
"Namakwa Special Economic Zone (SEZ)
","Iinkcukacha zeentlanganiso zabo namajelo eendaba ziza kukhutshwa kwalapha exesheni.
",0.48560962
"Kabinete e tjhaelletse monwana ho qollwa ha Namakwa SEZ e Aggeneys, Kapa Leboya.
","IVoti yoHlahlo Lwabiwo-mali ye-Ofisi kaMongameli iza kwenziwa ngoLwesithathu, umhla wama-31 kuCanzibe 2023 ize intlanganiso noonondaba engoTshintsho kwiNdlela Elimi Ngayo uQoqosho kunye namaPhulo oDalo-msebenzi aququzelelwa yi-Operation Vulindlela, ibanjwe ngoLwesibini, umhla wama-30 kuCanzibe 20
",0.6821318
"Tlhahiso ya ho qolla e etswa tumellanong le Molao wa Dibaka tse Kgethehileng tsa Moruo wa 2014 (Molao 16 wa 2014) mme SEZ e sisintsweng, ke karolo ya Tshebetso ya Matsete ya Mopresidente.
","USuku lwe-Afrika kunye nesikhumbuzo seminyaka engama-20 yeNkqubo yokuHlolana kwaMazwe ase-Afrika (i-APRM)
",0.6337085
"Namakwa SEZ e tla ba senotlolo sa melemo ya morafo, tlhahiso ya hydrogen e tala, ntlafatso ya infrastraktjha, eneji e ka ntjhafatswang le tshebetso ya temo.
","IKhabhinethi nabemi bonke boMzantsi Afrika baza kubhiyozela uSuku lwe-Afrika njengelizwekazi le-Afrika kunye nehlabathi, ngoLwesine, umhla wama-25 kuCanzibe.
",0.6610477
"Mafapha a bohlokwa bakeng sa tlhahiso ya mosebetsi le ntlafatso ya moruo wa Kapa Leboya le naha.
","Lo nyaka ubaluleke nangakumbi kuba ngunyaka wama-60 wesikhumbuzo sokutyikitywa koxwebhu olwaseka uMbutho woManyano lwe-Afrika (i-OAU), yona eyazala uMbutho weMbumba ye- Afrika (i-AU).
",0.6540258
"Matsete a fetang diranta tse dibilione tse 29 a se a ntse a behetswe thoko bakeng sa mohato wa pele wa SEOna a kenyeletsa boitlamo ho tswa ho Vedanta Zinc (Diranta tse dibilione tse 16), Frontier Rare Earth (Diranta tse dibilione tse 13), Hive Energy (Diranta tse dimilione tse 200) le RRS Trade and Investment (Diranta tse dimilione tse 100)..Kgatiso ya Boraro ya Leano la Mohlodi wa Metsi a Setjhaba (NWRS-3) 2023.
","Umxholo wemibhiyozo yowama-2023 othi – “Ukukhawulezisa ukuqaliswa koMmandla weLizwekazi le-Afrika ongaHlawulisani iRhafu yoRhwebelwano” – wakhela kulo msebenzi mkhulu sele wenziwe wokuseka nokuqinisekisa ukuba uyenza lo mmandla unguwona mkhulu ungahlawulisani irhafu yorhwebelwano.
",0.7673869
"Kabinete e tjhaelletse monwana NWRS-3 ya 2023, bakeng sa phethahatso, mme leano lena ke le tlamang ho bolaodi bohle le mekgatlo ho kenya tshebetsong Molao wa Naha wa Metsi wa 1998 (Molao 36 wa 1998).
","Imibhiyozo yeNyanga ye-Afrika yalo nyaka ibanjwe kanye ngeminyake engama-20 yesikhumbuzo se-APRM, eneenjongo zokuphucula iindlela zolawulo kweli lizwekazi ngokuthi amazwe alo afundisane aze ahlolane odwa.
",0.7354028
"Leano lena le susumeditswe ke tlhahlobo ya dilemo tse tharo ya NWRS-2, e qollotseng dibaka tsa katleho le dibaka tse ntseng di tobana le mathata.
","IziGqibo zeKhabhinethi.
",0.28976518
"NWRS-3 e na le merero e meraro ya sehlooho, e leng ntlafatso ya metsi le bohlweki e lokelang ho tshehetswa, ho fediswa ha tlala le ho se lekalekane, tlatsetso moruong le tlhahiso ya mosebetsi, mme metsi a lokela ho sireletswa, ho sebediswa, ho ntlafatswa, ho hlokomelwa le ho laolwa ka tsela e tsitsitseng le ka ho lekana.
","UMmandla oKhethekileyo wezoQoqosho (i-SEZ) wase-Namakwa
",0.5415707
"Leano lena le etsa ditshisinyo tse tshwarehang bakeng sa ho eketsa phepelo ya metsi, ho fokotsa tlhokeho ya metsi, taolo e atlehang ya metsi le bohlweki, ho laola lefapha la metsi le bohlweki, ho aba metsi bakeng sa phetoho, ho kgothaletsa tshebedisano ya matjhaba, le ho laola metsi le bohloweki tlasa maemo a lehodimo a ntseng a fetoha.
","IKhabhinethi ikuvumile ukuthiywa ngokusesikweni kwe-Namakwa SEZ e-Aggeneys eMntla Koloni.
",0.67617124
"NWRS-3 e phatlaladitswe websaeteng ya DWS ho WEBTOKEN..Tlaleho ya Mehato e Kentsweng Tshebetsong ke Lefapha la Tshireletso (DoD) ho Sebetsana le Diketso le Boitshwaro ba Ditho tsa Sesole sa Naha sa Tshireletso sa Afrika Borwa (SANDF) tse Romelwang Mererong ya ho Boloka Kgotso
","Le ndawo iza kubizwa ngokuba yi-SEZ ngokoMthetho weMimandla eKhethekileyo yezoQoqosho, wowama-2014 (uMthetho uNombl 16 wowama-2014) futhi le SEZ icetywayo iyinxalenye yePhulo likaMongameli loTyalo-mali.
",0.7496817
"Kabinete e amohetse tlaleho mabapi le kgatelopele eo Afrika Borwa e e etsang ho sebetsana le boitshwaro ba ditho tse ding tsa SANDF tse rometsweng bakeng sa ho boloka kgotso ho phatlalla le kontinente.
","I-Namakwa SEZ iza kuvula amathuba kwicandelo lokuxhamlisa kwezemigodi, elokuveliswa kwehaydrojini engeyongozi kokusingqongileyo, uphuhliso lweziseko zophuhliso, amandla ahlaziyekayo kunye nokucolwa kuhlelwa iimveliso zolimo.
",0.71396065
"SANDF e se e hlokometse mohlodi wa boikgantsho ba naha ha e ntse e kenya letsoho mererong ya ho boloka kgotso kontinenteng, bakeng sa tshireletso e tsitsitseng le kgotso dinaheng tsa Afrika tse ruthuthilweng ke ntwa tse tlasa dithuso tsa Mokgatlo wa Matjhaba a Kopaneng (UN).
","La macandelo abaluleke kakhulu kumalinge okudala imisebenzi kunye nophuhliso loqoqosho lwaseMntla Koloni nolwelizwe.
",0.7130472
"Ka diqoso tsa ditlolo tsa thobalano tse amang masole a bolokang kgotso tse qadileng ho hlahella ka 2015, Sehlopha sa Tshebetso sa Matona se ile sa thehwa ka 2019 bakeng sa ho etsa dipatlisiso ka diqoso tsa tlhekefetso ya peto le tlhekefetso (SEA) ka hare ho DoKabinete e kgotsofaditswe ke letoto la mehato e kentsweng tshebetsong ya ho sebetsana le diketsahalo tsa SEA mererong ya ho boloka kgotso ya SANDUN e nka Afrika Borwa e na le ditlwaelo tse ntle ka ho fetisisa mme e thoholeditse naha ka kgatelopele eo e e entseng ya ho hlakola SEA ka hare ho SANDKabinete e hatisitse hore ditlwaelo tsa SEA di ke ke tsa dumellwa ho senya tlaleho e ntle ya SANDF kontinenteng..Kgwedi ya Batjha ya 2023 Kabinete e tjhaelletse monwana Lenaneo la Kgwedi ya Batjha la 2023 tlasa mookotaba: “Ho potlakisa tokoloho ya moruo wa batjha bakeng sa bokamoso ba moshwelella”.
","Imali yotyalo-mali engaphezulu kweebhiliyoni zeerandi ezingama-29 sele ibekelwe bucala ukuncedisa kwisigaba sokuqala sale SELe mali iquka izithembiso ezazenziwe ngu-Vedanta Zinc (ezibhiliyoni zeerandi ezili-16), ngu-Frontier Rare Earth (ezibhiliyoni zeerandi ezili-13), Hive Energy (ezizigidi zeerandi ezingama-200) kunye no-RRS Trade and Investment (ezizigidi zeerandi ezili-100).
",0.7552305
"Motlatsi wa Mopresidente Mashatile o tla beha puo Letsatsing la Setjhaba leo selemong sena le tla ketekwa ka matsatsi a mabedi ho tloha ka la 16 ho isa ho la 17 Phuptjane 2023, Setsing sa Dipapadi sa Mangaung, Bloemfontein, Foreistata.
","UPapasho lwesiThathu lwesiCwangciso-qhinga seSizwe seMithombo yaManzi (i-NWRS-3) lowama-2023.
",0.7640715
"Matsatsing ao a mabedi, ho tla ba le monyetla wa hore batjha ba nke karolo puisanong le Matona, Batlatsi ba Matona le baamehi ba bang ho dithupello tse fapafapaneng, menyetla ya kgwebo le ntlafatso e fumanehang ka hara mmuso le balekane ba setjhaba.
","IKhabhinethi iyivumile i-NWRS-3 yowama-2023 ukuba iqalise ukusetyenziswa kwaye esi sicwangciso-qhinga sibophelela onke amaziko namagosa anamagunya ukuba aqalise ukusebenzisa uMthetho waManzi eSizwe, wowe-1998 (uMthetho 36 wowe-1998).
",0.74716055
"Kgwedi ya Batjha e tla thakgolwa ka Labone la 1 Phuptjane ke Letona la Kantoro ya Mopresidente wa Basadi, Batjha le Batho ba Nang le Boqhwala, ke Ngaka Nkosazana Dlamini Zuma a le Hector Pieterson Memorial le Musiamong wa Soweto.
","Esi sicwangciso-qhinga sisekelwe kuphononongo lweminyaka emithathu le-NWRS-2, oluthe lwabona iindawo eziqhube kakuhle kunye nezo kusekho ukuqhwalela kuzo.
",0.75040406
"Kabinete e ipileditse ho baahi hore ba matlafatse boiteko ba ho netefatsa hore batjha ba fumana menyetla e tla ba dumella ho ba le seabo moruong.
","I-NWRS-3 inemixholo engundoqo emithathu, owokuba kufuneka amanzi nogutyulo axhase uphuhliso, ukulwa indlala nokungalingani, ukufaka isandla kuqoqosho nokudala imisebenzi, nokuba amanzi kufuneka akhuselwe, asetyenziswe, aphuhliswe, aphathwe aze alawulwe ngendlela engazikuwatshabalalisa nelinganayo.
",0.69162345
