src_text,tgt_text,cosine_score
"MahlohonoloKabinete e lebisa mahlohonolo a yona le ditakaletso tse molemo ho: Letona la Ditjhelete, Monghadi Enoch Godongwana, ya ileng a fuwa kgau ya boemo bo hodimo ya African Banker 2023 ya Kgau ya Letona la Ditjhelete la Selemo ho Sharm El Sheikh, Egepeta ka Laboraro la 24 Motsheanong 2023, bakeng sa boiteko ba hae selemong se fetileng ka ho laola moruo wa Afrika Borwa nakong ya moruo le tikoloho ya lapeng tse rarahaneng.
","I-Nigeria ilelona lizwe liliqabane lezorhwebo likhulu loMzantsi Afrika eNtshona Afrika.
",0.6374937
"Kgau e ile ya amohelwa ke Letona bakeng sa ho sebedisa leano la ditjhelete bakeng sa ho potlakisa matsete lefapheng la ntlafatso ya eneji.
","Iinkampani ezahlukeneyo zoMzantsi Afrika zityale imali e-Nigeria, ngeli thuba likhulayo nenani leenkampani zase-Nigeria ezingena eMzantsi Afrika..IVeki yokuKhuselwa kwaBantwana UMzantsi Afrika uza kuphawula iVeki yokuKhuselwa kwaBantwana ukususela ngomhla wama-28 kuCanzibe ukuya kowesi-4 kweyeSilimela 2023 phantsi komxholo othi: “Masikhusele Abantwana ngeThuba le-COVID-19 naseMva Kwalo”.
",0.6638813
"Hana Gammon, e leng mongodi ya dilemo tse 20 wa Afrika Borwa bakeng sa ho hapa Kgau ya Dipale tse Kgutshwane tsa Commonwealth ya 2023, sebakeng sa Afrika le ho ba e monyenyane ka ho fetisisa nalaneng ya ho fumana kgau.
","Eli phulo likhuthaza onke amacandelo noluntu ngokubanzi ukuba bancedise ekukhuliseni baza bakhathalele futhi bakhusele abantwana.
",0.6350591
"Sehlopha sa Stormers Rugby bakeng sa ho finyella ho makgaolakgang ho United Rugby Championship.
","Iphulo lalo nyaka liza kugxila kwi-RISIHA, inkqubo yoluntu yokuthintela neyokungenelela kusengethuba, eneenjongo zokuxhobisa abantwana abasesichengeni batsho bakwazi ukuzimela..UTyelelo lokuHlola kwi-DDM yaseNtshona Koloni.1 USekela-Mongameli, uMnu Paul Mashatile uza kubamba uTyelelo lokuya kuHlola lwe-DDM kwiSithili sase-OR Tambo kunye noMasipala oMbaxa wase-Buffalo City, eMpuma Koloni, ngomhla wama-26 nowama-27 kuCanzibe 2023.
",0.66719735
"Di-Stormers di tla bapala kgahlanong le sehlopha sa Irish Musters Lebaleng la Dipapadi la Cape Town ka Moqebelo wa la 27 Motsheanong 2023.
","Olu tyelelo luyinxalenye yephulo likarhulumente lokuqinisekisa ukuba uphuhliso loluntu lwenziwa ngendlela ehlangeneyo njengoko i-DDM nayo isitsho.
",0.67027634
"Monghadi Zakes Mda, sengodi sa dibuka sa Afrika Borwa le Moprofesara Tshilidzi Marwala, Motlatsi wa mehleng wa Motlatsi wa Mokhanselara le Mosuwehlooho Univesithing ya Johannesburg, bao ka bobedi ba ileng ba kgethwa bakeng sa Dikgau tsa Bahlalefi Afrika tsa 2023.
","IPalamente yesiThandathu yePalamente yaMazwe e-Afrika (i-PAP)4.1 Iinkokeli eziphuma mbombo zone zeli lizwekazi zidibene ngoMvulo, umhla we-15 kuCanzibe 2023, e-Midrand, eMzantsi Afrika ziye kuthatha inxaxheba kwiPalamente yesiThandathu ye-PALe Palamente iza kuvala ngomhla wesi-2 kweyeSilimela 2023.
",0.7737225
"Monghadi Mda le Moprofesara Marwala ba kgethilwe hara maAfrika a mang a 19 a ipabotseng dikarolong tse fapaneng.
","Iinjongo ze-PAP kukulungisa iingxaki ezisihlupha sonke kweli lizwekazi kwaye imelwe zinkokeli zase-Afrika eziphuma mbombo zone zeli lizwekazi.
",0.71577215
"MatshedisoKabinete e fetisitse matshediso ho malapa le metswalle ya: Leqosa la naha naheng ya Rephabliki ya Algeria, Monghadi Billy Masetlha, ya ileng a sebeletsa Afrika Borwa mesebetsing e fapaneng mmusong, e kenyeletsang ho ba Motsamaisi-Kakaretso wa ditshebeletso tsa mautlwela.
","I-Intergovernmental Oceanographic Commission (i-IOC)5.1 UMzantsi Afrika uza kuthatha inxaxheba kwiseshoni yama-56 yebhunga lesigqeba eza kubanjelwa e-Paris, e-France, ukususela ngomhla we-16 ukuya kowama-30 kweyeSilimela 20 2 I-IOC yoMbutho wezeMfundo, ezeNzululwazi nezeNkcubeko weZizwe eziManyeneyo (i-IOC-UNESCO) liqumrhu le-UN elenza umsebenzi wokunika inkxaso kwiinkonzo nezenzululwazi yeelwandle zehlabathi.3 UMzantsi Afrika uyakuqonda ukubaluleka kophando nolawulo olufanelekileyo lweelwandle kunye namanxwema wawo ukwenzela uphuhliso oluzinzileyo.
",0.76093894
"O ne a amehile ka botebo Ntweng bakeng sa tokoloho ya Afrika Borwa, ho kenyeletsa ho ba setho sa Umkhonto we Sizwe.
","Uphando ngezaselwandle lukwanceda nokusilumkisa kwangethuba ngeentlekele ezenzeka elwandle luze luncede urhulumente akwazi ukuthatha izigqibo enolwazi olwaneleyo.
",0.68200564
"Murthi Naidoo, ya ileng a nehela bophelo ba hae ntweng ya tokoloho ya naha.
","UMzantsi Afrika uza kusingatha imidlalo emikhulu.1 Abalandeli bezemidlalo abaphuma kulo lonke elimiweyo kufanele balindele ukwamkelwa ngobubele obubonisa Ubuntu kunye nokutendwa ngothando xa beze kuzimasa eMzantsi Afrika iNdebe yeHlabathi yeBhola yoMnyazi kunye ne-Kimura Shukokai International (i-KSI) Karate World Championship.
",0.6514628
"O ile a kwallwa ke mapolesa a tshireletso ho tloha ka Pudungwana 1965 ho ya ho Mmesa 1966 ntle le diqoso mme a bapala karolo e mafolofolo bophahamong ba boemo ba tshohanyetso qetellong ya dilemo tsa bo-1980.Barry Dwolatzky, e ne e le pulamadiboho lefapheng la tlhahisoleseding ya naha le theknoloji ya puisano.
","UMzantsi Afrika wazenzela igama ngokugqwesa kwindlela oyisingatha ngayo imisitho emikhulu.2 Uyaqhubeleka nokuvakala umoya wochulumanco njengoko sele kushiyeke isithuba esingaphezudlwana nje kwiintsuku ezingama-60 phambi kokuba iqalise iNdebe yeHlabathi yeBhola yoMnyazi eKapa ukususela ngomhla wama-28 kweyeKhala ukuya kowesi-6 kweyeThupha 2023.
",0.8322637
"E ne e le Moprofesara (Emeritus) thutong ya School of Electrical and Information Engineering Lefapheng la Boenjiniere le Kaho ya Tikoloho Univesithing ya Wits.
","Oku iza kuba kokokuqala le tumante ingaka iza kubanjelwa e-Afrika.3 IKhabhinethi ihlaba ikhwelo kumntu wonke ukuba alixhase iphulo elibizwa ngokuba yi-Netball Friday, ngokuba bavathe izinxibo ezixhasa amaqela abo okanye banxibe isinxibo esifana neseqela lesizwe baxhase iqela leSizwe leBhola yoMnyazi loMzantsi Afrika.
",0.69196
"Batho ba 15 ba lahlehetsweng ke bophelo ka lebaka la kholera Hammanskraal Toropong ya Tshwane.
","I-KSI South Afrika nayo iza kubamba i-KSI Karate World Championship yama-20 eKapa ukususela ngomhla we-10 ukuya kowe-15 kweyeKhala 2023, kwaye silinqwenelela impumelelo iqela loMzantsi Afrika ngoku lenza amalungiselo okuthatha inxaxheba kolu khuphiswano lukhulu kangaka.5 UMzantsi Afrika uza kusingatha i-Table Tennis Championship Finals Championships yowama-2023 e-Durban International Convention Centre.
",0.6657058
"Cholera outbreak Management
","Cholera outbreak Management
",0.9693198
"Cabinet welcomed President Cyril Ramaphosa’s planned visit to and interaction with residents of Hammanskraal.
","Cabinet welcomed President Cyril Ramaphosa’s planned visit to and interaction with residents of Hammanskraal.
",0.983405
"The visit did take place today, Thursday, 08 June, 2023, and this engagement gave the President the opportunity to hear directly from residents about the challenges they face.
","The visit did take place today, Thursday, 08 June, 2023, and this engagement gave the President the opportunity to hear directly from residents about the challenges they face.
",0.9781626
"The President, the Minister of Water and Sanitation and the Executive Mayor of Tshwane were able to assess government interventions in the area and provide relevant feedback to residents.
","The President, the Minister of Water and Sanitation and the Executive Mayor of Tshwane were able to assess government interventions in the area and provide relevant feedback to residents.
",0.98894286
"Government interventions include the field hospital operational in Kanana, Hammanskraal, and a multi-disciplinary team of experts to arrest the spread which has successfully treated hundreds of people.
","Government interventions include the field hospital operational in Kanana, Hammanskraal, and a multi-disciplinary team of experts to arrest the spread which has successfully treated hundreds of people.
",0.98874366
"Work is also underway to ensure that local councils use their water infrastructure grants effectively.
","Work is also underway to ensure that local councils use their water infrastructure grants effectively.
",0.9907241
"For the current financial year, over R14 billion has been set aside for municipalities to address water infrastructure backlogs.
","For the current financial year, over R14 billion has been set aside for municipalities to address water infrastructure backlogs.
",0.9892328
"Cabinet welcomes the cooperation between the City of Tshwane and Department of Water and Sanitation on the planned upgrade of the Rooiwal Water Treatment plant, which will be undertaken over three phases at a cost of R4 billion.
","Cabinet welcomes the cooperation between the City of Tshwane and Department of Water and Sanitation on the planned upgrade of the Rooiwal Water Treatment plant, which will be undertaken over three phases at a cost of R4 billion.
",0.98414934
"Cabinet calls on the affected communities to remain vigilant and to take special care of children.
","Cabinet calls on the affected communities to remain vigilant and to take special care of children.
",0.9832659
"Cholera can be prevented by using safe water.
","Cholera can be prevented by using safe water.
",0.98565334
"Treat the water first by boiling it for at least 1 minute and always wash your hands with clean water and soap.
","Treat the water first by boiling it for at least 1 minute and always wash your hands with clean water and soap.
",0.99003583
"For more information on prevention tips WEBTOKEN Government thanks those volunteer organisations and individuals who have stepped forward to lend a hand.
","For more information on prevention tips WEBTOKEN Government thanks those volunteer organisations and individuals who have stepped forward to lend a hand.
",0.97876614
"Water Quality Report
","Water Quality Report
",0.9874965
"Cabinet welcomed the reintroduction of the Blue, Green and No Drop Watch which were last conducted in 2013 and 2015 respectively.
","Cabinet welcomed the reintroduction of the Blue, Green and No Drop Watch which were last conducted in 2013 and 2015 respectively.
",0.9839238
"The Green, Blue and No Drop Certification programmes are regulatory mechanisms of the Department of Water and Sanitation (DWS) as the water sector regulator in terms of both the National Water Act and Water Services Act, DWS
","The Green, Blue and No Drop Certification programmes are regulatory mechanisms of the Department of Water and Sanitation (DWS) as the water sector regulator in terms of both the National Water Act and Water Services Act, DWS
",0.98637295
"The aim of this uniquely South African regulatory tool is to improve municipal drinking water quality, wastewater management as well as water conservation and demand management.
","The aim of this uniquely South African regulatory tool is to improve municipal drinking water quality, wastewater management as well as water conservation and demand management.
",0.9890263
"Cabinet deliberated on the results and implications of the 2023, Blue, Green and No Drop Watch reports, which were made public on Tuesday, 6 June.
","Cabinet deliberated on the results and implications of the 2023, Blue, Green and No Drop Watch reports, which were made public on Tuesday, 6 June.
",0.98563284
"The Watch Reports indicate that there has been a decline in drinking water quality and an increase in non-revenue water since the last Drop reports were issued.
","The Watch Reports indicate that there has been a decline in drinking water quality and an increase in non-revenue water since the last Drop reports were issued.
",0.9895257
"Cabinet welcomes measures to be taken by the Department of Water and Sanitation to address the current state of affairs in relation to water and waste water management.
","Cabinet welcomes measures to be taken by the Department of Water and Sanitation to address the current state of affairs in relation to water and waste water management.
",0.98516405
"The Minister of Water and Sanitation will in the following weeks announce these measures per Province.
","The Minister of Water and Sanitation will in the following weeks announce these measures per Province.
",0.99074936
"Energy Cabinet welcomed the recent deliberations between the Minister of Electricity, Dr Kgosientsho Ramokgopa and the Mozambican Minister for Mineral Resources and Energy, Carlos Zacarias, to secure additional power from Mozambique to support our national grid.
","Energy Cabinet welcomed the recent deliberations between the Minister of Electricity, Dr Kgosientsho Ramokgopa and the Mozambican Minister for Mineral Resources and Energy, Carlos Zacarias, to secure additional power from Mozambique to support our national grid.
",0.9874572
"In the immediate term, Mozambique can provide 80MW and a further 1000MW over the medium term.
","In the immediate term, Mozambique can provide 80MW and a further 1000MW over the medium term.
",0.9875678
"Cabinet continues to urge South Africans to support the Winter Demand Management campaign launched by the Minister of Electricity, to save electricity to reduce strain on the national grid and help lower load shedding stages this winter.
","Cabinet continues to urge South Africans to support the Winter Demand Management campaign launched by the Minister of Electricity, to save electricity to reduce strain on the national grid and help lower load shedding stages this winter.
",0.9865657
"Cabinet received a report by the Minister of Electricity which detailed recent gains in the management of power stations and other operations which, for example, overcame the need for Eskom to burn diesel this past weekend and avoid load shedding.
","Cabinet received a report by the Minister of Electricity which detailed recent gains in the management of power stations and other operations which, for example, overcame the need for Eskom to burn diesel this past weekend and avoid load shedding.
",0.987128
"The Minister of Electricity will brief media at 14h00 tomorrow, Friday, on these and other developments.
","The Minister of Electricity will brief media at 14h00 tomorrow, Friday, on these and other developments.
",0.9861467
"Operation Vulindlela
","Operation Vulindlela
",0.98685
"Cabinet welcomed the progress under the operation Vulindlela as detailed by the Minister in the Presidency, Khumbudzo Ntshavheni, with regard to the implementation of structural reforms in the areas of energy supply, logistics network and infrastructure, digital communications and the visa regime.
","Cabinet welcomed the progress under the operation Vulindlela as detailed by the Minister in the Presidency, Khumbudzo Ntshavheni, with regard to the implementation of structural reforms in the areas of energy supply, logistics network and infrastructure, digital communications and the visa regime.
",0.97927976
"The number of completed reforms has risen from three to 11, while a further 14 reforms are on track.
","The number of completed reforms has risen from three to 11, while a further 14 reforms are on track.
",0.9914477
"The primary focus is on addressing the electricity crisis and improving the efficiency of freight rail, both of which are weighing heavily on economic growth.
","The primary focus is on addressing the electricity crisis and improving the efficiency of freight rail, both of which are weighing heavily on economic growth.
",0.9922708
"President’s Coordinating Council
","President’s Coordinating Council
",0.9748758
"Cabinet supported President Cyril Ramaphosa’s call during the meeting of the President’s Coordinating Council on 2 June 2023 to accelerate service delivery in response to the needs of communities.
","Cabinet supported President Cyril Ramaphosa’s call during the meeting of the President’s Coordinating Council on 2 June 2023 to accelerate service delivery in response to the needs of communities.
",0.9877877
"The President directed the Council to accelerate service delivery improvement and address challenges in relation to legislation, governance and capacity constraints.
","The President directed the Council to accelerate service delivery improvement and address challenges in relation to legislation, governance and capacity constraints.
",0.9888801
"The meeting also considered reforms to the Water Act and Water Services Act to provide for better service delivery of water.
","The meeting also considered reforms to the Water Act and Water Services Act to provide for better service delivery of water.
",0.9893975
"Similarly, the Council was briefed on interventions by the Department of Transport for emergency work and routine maintenance, as well as primary road transfers from provincial authorities to the national road network for better management of provincial roads by the South African National Roads Agency Limited..Batyi Automotive Component Supply Facility
","Similarly, the Council was briefed on interventions by the Department of Transport for emergency work and routine maintenance, as well as primary road transfers from provincial authorities to the national road network for better management of provincial roads by the South African National Roads Agency Limited..Batyi Automotive Component Supply Facility
",0.98048365
"Cabinet welcomed the opening of the Batyi Automotive Component Supply (BACS) Facility in Pretoria which cements the country’s position as a global player in the automotive sector.
","Cabinet welcomed the opening of the Batyi Automotive Component Supply (BACS) Facility in Pretoria which cements the country’s position as a global player in the automotive sector.
",0.98520744
"BACS is a product of an incubation centre by Ford Motor Company and Motherson, a supplier of spray painting and components.
","BACS is a product of an incubation centre by Ford Motor Company and Motherson, a supplier of spray painting and components.
",0.9869849
"The centre supports black suppliers to be independent and globally competitive after graduating from the Automotive Industry Development Centre (AIDC’s) Incubation Programme.
","The centre supports black suppliers to be independent and globally competitive after graduating from the Automotive Industry Development Centre (AIDC’s) Incubation Programme.
",0.987483
"The BACS facility currently employs 60 people, with 30 working the day shift, and 30 the night shift.
","The BACS facility currently employs 60 people, with 30 working the day shift, and 30 the night shift.
",0.98862183
"Moreover, it is looking at bringing in young trainees to further develop their skill sets.
","Moreover, it is looking at bringing in young trainees to further develop their skill sets.
",0.9859248
"Lufhereng Social Housing Project
","Lufhereng Social Housing Project
",0.9706322
"Cabinet welcomed the Department of Human Settlements’ launch of the Lufhereng Social Housing Project in Soweto, which consists of 407 units of rental stock for targeted beneficiaries.
","Cabinet welcomed the Department of Human Settlements’ launch of the Lufhereng Social Housing Project in Soweto, which consists of 407 units of rental stock for targeted beneficiaries.
",0.98584723
"Government’s social housing programme integrates mixed-income groups, curbs the housing backlog and brings backyard and informal settlement dwellers closer to economic opportunities.
","Government’s social housing programme integrates mixed-income groups, curbs the housing backlog and brings backyard and informal settlement dwellers closer to economic opportunities.
",0.9853381
"Road Infrastructure
","Road Infrastructure
",0.9771135
"The opening of the R56 million road project in Estcourt, KwaZulu- Natal, is part of government’s efforts to improve logistic connectivity in rural towns.
","The opening of the R56 million road project in Estcourt, KwaZulu- Natal, is part of government’s efforts to improve logistic connectivity in rural towns.
",0.98487484
"Work done on the road project included the upgrading of the D1252 from gravel to tar roads.
","Work done on the road project included the upgrading of the D1252 from gravel to tar roads.
",0.987424
"The road links to the N3, which connects eThekwini and Johannesburg, opening opportunities for local unemployed youth and emerging contractors.
","The road links to the N3, which connects eThekwini and Johannesburg, opening opportunities for local unemployed youth and emerging contractors.
",0.98789454
"With more than 60 per cent of goods transported through the N3 corridor, the road upgrade will further facilitate the efficient movement of goods and services to the rest of South Africa and Sub-Saharan Africa..Social Partnership
","With more than 60 per cent of goods transported through the N3 corridor, the road upgrade will further facilitate the efficient movement of goods and services to the rest of South Africa and Sub-Saharan Africa..Social Partnership
",0.9853634
"Cabinet welcomed the partnership with mining company Impala Platinum in Rustenburg on the building of a clinic and early childhood development centre as part of its Social and Labour Plan.
","Cabinet welcomed the partnership with mining company Impala Platinum in Rustenburg on the building of a clinic and early childhood development centre as part of its Social and Labour Plan.
",0.9820957
"The Freedom Park Clinic and an Early Childhood Development Centre were handed over to the Departments of Health and Basic Education in the North West Province.
","The Freedom Park Clinic and an Early Childhood Development Centre were handed over to the Departments of Health and Basic Education in the North West Province.
",0.9902459
"Partnership between government and organised business
","Partnership between government and organised business
",0.9856917
"Cabinet welcomed the partnership initiative between Government and organised business to actively work towards removing obstacles to inclusive economic growth and job creation.
","Cabinet welcomed the partnership initiative between Government and organised business to actively work towards removing obstacles to inclusive economic growth and job creation.
",0.9766477
"The current priority areas are in energy, logistics and crime and corruption fighting, with further work being done in pursuit of the jobs agenda.
","The current priority areas are in energy, logistics and crime and corruption fighting, with further work being done in pursuit of the jobs agenda.
",0.9909652
"Safety and security
","Safety and security
",0.98958594
"To monitor and protect communities affected by crime, the SA Police Service has set aside nearly R2 billion to procure drones and vehicles to enhance visibility.
","To monitor and protect communities affected by crime, the SA Police Service has set aside nearly R2 billion to procure drones and vehicles to enhance visibility.
",0.98620236
"R65 million has also been allocated to the top 30 crime-intensive stations to address murder and other contact offences.
","R65 million has also been allocated to the top 30 crime-intensive stations to address murder and other contact offences.
",0.98773164
"In addition, Tactical Response Teams are being deployed at stations and districts in areas with high crime rates.
","In addition, Tactical Response Teams are being deployed at stations and districts in areas with high crime rates.
",0.98954344
"The South African Police Service is also enhancing specialised tracking teams, who will be trained further at provincial and district level to effectively track and apprehend offenders.
","The South African Police Service is also enhancing specialised tracking teams, who will be trained further at provincial and district level to effectively track and apprehend offenders.
",0.9885053
"Independent Panel of Inquiry
","Independent Panel of Inquiry
",0.9823396
"Cabinet welcomed the appointment by President Cyril Ramaphosa of a three-member independent panel to enquire into the circumstances of the docking of the Russian vessel known as Lady The panel chaired by former Deputy Judge President of the South Gauteng High Court Justice Phineas Mojapelo has been given six weeks to evaluate whether constitutional, legal or other obligations were fulfilled or violated when the vessel docked in Simon’s Town, Cape Town, and will report their findings to the President..Envoys to G7 countries
","Cabinet welcomed the appointment by President Cyril Ramaphosa of a three-member independent panel to enquire into the circumstances of the docking of the Russian vessel known as Lady The panel chaired by former Deputy Judge President of the South Gauteng High Court Justice Phineas Mojapelo has been given six weeks to evaluate whether constitutional, legal or other obligations were fulfilled or violated when the vessel docked in Simon’s Town, Cape Town, and will report their findings to the President..Envoys to G7 countries
",0.97812855
"Cabinet welcomed President Cyril Ramaphosa’s decision to send ministerial envoys to meet Group of Seven (G7) countries to explain the country’s non-aligned stance on the Russia-Ukraine war.
","Cabinet welcomed President Cyril Ramaphosa’s decision to send ministerial envoys to meet Group of Seven (G7) countries to explain the country’s non-aligned stance on the Russia-Ukraine war.
",0.98730373
"The envoys will include International Relations & Cooperation Minister Naledi Pandor, Trade, Industry & Competition Minister Ebrahim Patel, Finance Minister Enoch Godongwana and Minister in the Presidency Khumbudzo Ntshavheni.
","The envoys will include International Relations & Cooperation Minister Naledi Pandor, Trade, Industry & Competition Minister Ebrahim Patel, Finance Minister Enoch Godongwana and Minister in the Presidency Khumbudzo Ntshavheni.
",0.98425853
"BRICS Summit Preparations
","BRICS Summit Preparations
",0.97205806
