src_text,tgt_text,cosine_score
"Pabalelo tloga le bohlokwa lesolong la naga ye la go akgofiša kgolo ya ikonomi le tlhomo ya mešomo.
","Maitlhomo mangwe lona ke go dira gore re se tlhaele dijo.
",0.6560577
"Leanopeakanyo la Nama ya Diphoofolo tša Lešoka.
","Bogolo jwa intaseteri ya nama ya diphologolo tsa naga ke kgwebo e sa kwadisiwang semmuso mme dira ka tsela e sa tlhamalalang.
",0.64534736
"Kabinete dumeletše go phatlalatšwa ga seakanywa sa Leanopeakanyo la Nama ya Diphoofolo tša Lešoka gore setšhaba se fe ditshwayotshwayo tša sona.
","Leano le le tshitshintsweng leno le neelana ka leano le le ka dirisiwang go tsenya tirisong dikgato tsa go dira gore nne kgwebo ya semmuso le go matlafatsa lekala leno gore le nne le lengwe la a samaganang le merero ya go dira gore re nne le dijo tse di sa tlhaeleng mmogo le mo go godiseng ikonomi gore le kgone go tlhola ditiro   Melaotlhomo.
",0.76180357
"Leanopeakanyo le le šeditše go botsefatša le go fetoša gabotse intasteri ya nama ya diphoofolo tša lešoka.
","Molaotlhomo o Kwalolotsweng Sešwa wa Merero Yotlhe ya Magosi Setso wa Ngwaga wa.
",0.59870195
"Le šetšane gape le go kgatha tema tšhireletšegong ya dijo ka mokgwa wo swarelelago.
","Kabinete neseditse pula dikgato tsa go isa kwa Palamenteng Molaotlhomo o Kwalolotsweng Sešwa wa Merero Yotlhe ya Magosi Setso wa Ngwaga wa 2022 gore ye go sekasekiwa.
",0.5995064
"Intasteri ya nama ya diphoofolo tša lešoka ka boati ke intasteri ya go se lefišwe metšhelo ya go šoma thokwana le noši.
","Maitlhomo dikarolo tse di kwalolotsweng sešwa ke go kwalola sešwa dikarolo tsa Molao wa Magosi Merafe ya go tloga ka ya maKhoi go fitlha ka ya maSan wa ngwaga wa, 2019 (Molao wa bo 03 wa 2019), yo tsentsweng tirisong ka la bo 01 Moranang.
",0.6511177
"Leanopeakanyo le le šišintšwego le fana ka leano la phethagatšo leo le tla botsefatšago le go matlafatša intasteri ye bjalo ka bobedi moabi wa tšhireletšego ya dijo le lefapha la kgolo ya ikonomi leo le tla thušago go hloma menyetla ya mešomo     Melaokakanywa.
","Molaotlhomo o Kwalolotsweng Sešwa wa Tshireletso ya Naga ya Temokerasi e Nang le Molaotheo mo Diatleng tsa Digongwana tsa Menolopuso le Ditiragalo tsa Mothale o Ntseng Jalo wa Ngwaga wa.
",0.7114476
"Molaokakanywaphetošwa ka Kakaretšo wa 2022 wa Merero ya Setšo.
","Kabinete neseditse pula dikgato tsa go isa kwa Palamenteng Molaotlhomo o Kwalolotsweng Sešwa wa Tshireletso ya Naga ya Temokerasi e Nang le Molaotheo mo Diatleng tsa Digongwana tsa Menolopuso le Ditiragalo tsa Mothale o Ntseng Jalo wa Ngwaga wa 2022 gore ye go sekasekiwa gape ka matsetseleko.
",0.72299147
"Kabinete dumeletše go hlagišwa Palamenteng ga Molaokakanywaphetošwa wa 2022 wa Merero ya Setšo gore Palamente go sekaseke goya pele.
","Ka gang fa sena go letlelelwa gore nne molao, Molaotlhomo ono tla kwalola sešwa Molao yo dirisiwang ga jaanong wa Tshireletso ya Naga ya Temokerasi e Nang le Molaotheo mo Diatleng tsa Digongwana tsa Menolopuso le Ditiragalo tsa Mothale o Ntseng Jalo wa Ngwaga wa 2004, (Molao wa bo 33 wa 2004).
",0.7516941
"Diphetošo tše di šetšane le go fetleka Molao wa Setšo le wa Boetapele bja maKhoi-San, 2019 (Molao 3 wa 2019), wo tsentšwego tirišong ka la 1 Moranang.
","Molaotlhomo ono setse fetile mo dikgatong tse di matsetseleko tsa go batla maikutlo baagi go latela gore Kabinete ka Motsheganong 2021 letlelele go diragadiwa ga thulagnyo eno.
",0.7304935
"Molaokakanywaphethošwa wa 2022 wa Tšhireletšo ya Temokrasi ya Molaotheo Kgahlanong le Ditiragalo tša Matšhošetši le tše dingwe tša go amana le tšona.
","Dikgato tseno tsa go kwalololwa sešwa maitlhomo tsona ke go lepalepanya melao ya ka fa nageng le ya lefatshe ka bophara ya go lwantshana le maiteko menolopuso jaaka go tsenngwa mo go ona dikgato tse di diragadiwang mo dinageng tsa boditšhaba.
",0.7208458
"Kabinete dumeletše go hlagišwa Palamenteng ga Molaokakanywaphetošwa wa 2022 ka Tšhireletšo ya Temokrasi ya Molaotheo Kgahlanong le Matšhošetši le tše dingwe tša go amana le ona gore Palamente go sekaseke goyapele.
","Mo go ona go baakantswe gape le dikarolo tsa molao tse di neng di sa kwalega sentle go tsamaisana le Molaotheo jaaka Kgotlatshekelo ya Molaotheo ne ya laela.
",0.7345929
"Ge šetše amogetšwe, Molaokakanywa wo tla fetoša Molao wa bjale wa Tšhireletšo ya Temokrasi ya Molaotheo Kgahlanong le Matšhošetši le Ditiragalo tša go Amana le ona, 2004 (Molao 33 wa 2004).
","Jaaka le nngwe ya dinaga tse di saenileng melao ya Lekgotla la Pabalesego la Dinagakopano (UN), Aforika Borwa rwele maikarabelo go dira gore ka fa nageng go ikobelwa melao ya boditšhabatšhaba maitlhomo yona leng go gagamatsa dikgato tsa go lwantshana le ditiragalo tsa menolopuso   Ditiragalo tse di Tlang.
",0.68090856
"Molaokakanywa wo fetile pele ditherišanong tšeo di tseneletšego tša setšhaba morago ga gore dumelelwe ke Kabinete ka Mopitlo.
","Samiti ya bo 14 ya Dinaga tsa Brazil, Russia, India, China le Aforika Borwa (BRICS).
",0.50564516
"Diphetošo tše di šetšane le go bea madulong didirišwa tšeo di tšweleditšwego ka nageng ye tša go lwantšha matšhošetši gotee le magato lefaseng ka bophara ao hlomilwego.
","Moporesitente Ramaphosa tla etelela kwa pele mo legatong la naga ya Aforika Borwa Samiti ya bo 14 ya Baeteledipele ba Dinaga tsa BRICS e tla bong tshwerwe ka Mafaratlhatlha Ditlhaeletsano tsa Dibidio e tla Tshwarwang ke Naga ya Rephaboliki ya Batho ba China e tla tshwarwang go tloga ka Labone, 23 go fitlha ka Labotlhano, 24 Seetebosigo.
",0.67575854
"Diphetošo tše di šogašogane gape le ditemana tšeo go tšeerwego sephetho ke Kgorotsheko ya Molaotheo sa gore ga di gate ka mošito tee le Molaotheo.
",".
",0.18525194
"Bjalo ka ye nngwe ya naga ye lego leloko la Khansele ya UN ya Tšhireletšego, Afrika Borwa tlamegile goya ka mohola wa yona go batametša kgauswi melao ya boditšhabatšhaba yeo šetšanego le go maatlafatša magato le go lwantšha matšhošetši lefaseng ka bophara     Ditiragalo tše di Tlago.
","Go nneng tokololo ga rona mo go BRICS go tswelela go tswela naga ya rona mosola.
",0.6275458
"Samiti ya bo-14 ya Brazil, Russia, India, China le Afrika Borwa (BRICS).
","Mo ngwageng yo fetileng dilwana tse di rekisediwang dinaga tsa kwa ntle tse leng karolo ya BRICS tse di tswang ka fa nageng ya Aforika Borwa di ne di le kwa godimonyana ga 17% bile dilwana tse di kwa godimonyana ga 29% tse re di rekang kwa dinageng tsa kwa ntle di ne di tswa mo go tsona dinaga tseno.
",0.61424315
"Mopresidente Ramaphosa tla eta pele go kgatha tema ga Afrika Borwa Samiting ya bo-14 ya go swarwa ka dikgokagano tša bidio ya Baetapele ba BRICS yeo swerwego ke Rephabliki ya Bohle ya China go thoma ka Labone, 23 go fihla ka Labohlano, 24 Phupu.
","Boleng jwa dikgato tseno tsa go gwebisana bo tsweletse go gola, mo re bonang palo yotlhe ya go gwebisana ga Aforika Borwa le dinaga tsa BRICS tlhatloga go fitlha go Diranta di le Dibilione di le 702 mo ngwageng wa 2021 leng e oketsegileng go tloga mo Diranteng di le Dibilione di le 487 mo ngwageng wa.
",0.69339556
".
",".
",0.14701417
"Maloko rena BRICS ba tšwelapele go hola naga ye.
","Go dirisana mmogo le dinaga tse dingwe tsa BRICS mo maphateng tshwana le boitekanelo le go oketsa dikgato tsa go gwebisana go dirile gore diintaseteri tsa rona ka fa nageng di gole, mmogo le go unngwela dinaga tsotlhe tse leng tokololo ya BRICS.
",0.69782454
"Ngwageng wa go feta, diromelwantle tša go feta 17% tša Afrika Borwa di be di nepišitšwe dinageng tše dingwe tša BRICS, le gona palomoka ya go feta 29% ya ditšwantle tša rena di be di tšwa go tšona dinaga tše.
","Maitlhomo dipeeletso tsa rona mo diporojekeng tsa tlhagiso ya mafaratlhatlha mmogo le maiteko rona go fedisa melao e kgoreletsang kgwebisano mo go sa tlhokagaleng ke go oketsa dilwana tse di tlhagisiwang ka fa nageng tse di rekisediwang dinaga tse leng tokololo ya BRICS.
",0.67839205
"Boleng bja theko ya kgwebišano ye bo tšwelapele go golela godimo, ka palomoka ya dikgwebišano tša Afrika Borwa le dinaga tše dingwe tša BRICS batamela R702 bilione ka 2021, morago ga gore golele godimo go tloga go R487 bilione ka.
","Sekolo sa Mariga sa Merero ya Ikonomi mo Pusong.
",0.33769673
".
","Go tloga ka la bo 27 Seetebosigo go fitlha ka la bo 01 Phukwi 2022 Sekolokatiso sa Puso ya Naga (NSG) se tla tshwarela kwa Johannesburg Letsholo la Sekolo sa Mariga sa Merero ya Ikonomi mo Pusong se se tla tsenelwang ke Batlhankedi ba Bagolo ba Dipolotiki.
",0.47164744
"Tšhomišanommogo gare ga dinaga tše lego maloko BRICS magorong go fapafapana go swana le maphelo le dikgwebišanong tše kaonafetšego godišitše intasteri ya ka mo nageng, le go hola dinaga ka moka tše lego maloko BRICS.
","Go tla bo go na le Ditona go tswa kwa nageng ya Côte d'Ivoire; ya South Sudan le ya Aforika Borwa; mmogo le Bakaedikakaretso ba mafapha dipuso go tswa kwa Lesotho, Zambia, Democratic Republic of Congo, Tanzania le Ghana tla tsenelwa gape le ke dimeyara tsa naga ya Aforika Borwa, mmogo le ditokololo tsa dikomiti tsa dimeyara le tsa maloko khuduthamaga..   Batlhankedi ba bagolo ba dipolotiki go tswa kwa dinageng tse di farologaneng go solofelwa gore ba tla neelana tshedimosetso le dikakanyo tse ba itemogetseng tsona ka ntlha ya maemo a farologaneng ba itemogelang ona letsatsi le lengwe le le lengwe mo tirong ya bona.
",0.76798797
"Dipeeletšo tša rena diprotšekeng tša tlhabollo ya mananeokgoparara le matsapa go fokotša go raragana ga magatotshepedišo mmušo ge go dirwa kgwebo di nepile go oketša diromelwantle go bagwebišani ba rena ba BRICS.
","NSG tlhomile letsholo leno la ngwaga le ngwaga ka ngwaga wa 2020 gore le tsenelwe ke batlhankedi ba khuduthamaga, mme dirile seno jaaka karolo ya maikano go ema nokeng puso gore kgone go tlhoma puso e dirang ka botswapelo.
",0.73566186
"Sekolo sa Marega sa Tshepedišo ya Ikonomi Mmušong.
","Gare ga dilo tse dingwe tse dintsi, maitlhomo letsholo leno ke tlhatlhelela batlhankedi ba bagolo mo maphateng otlhe mararo puso ka bokgoni jwa boeteledipele le jwa go ikemela mo maikarabelong bona gore ba kgone go mekamekana le dikgwetlho tsa puso tse di thibelang gore re nne le kgolo ya ikonomi e tla nnelang ruri batho botlhe ba nang le seabe mo go yona.
",0.42007643
"Sekolotlhahlo sa Bosetšhaba sa Mmušo (NSG) se tla be se swere Lenaneo la sona la Boraro la Balaodiphethiši ba tša Dipolotiki gola Johannesburg go thoma ka la 27 Phupu go fihla ka la 1 Mosegamanye.
","Letsatsi la Boditšhabatšhaba la Nelson Mandela.
",0.460985
"Thuto ye go yona go tla tla Ditona go tšwa Côte d'Ivoire; Borwa bja Sudan le Afrika Borwa gotee le Balaodipharephare ba go tšwa Lesotho, Zambia, DRC, Tanzania le Ghana.
","Monongwaga Letsatsi la Boditšhabatšhaba la Nelson Mandela le tla ketekiwa ka Mosupologo, 18 Phukwi 2022 ka moono yo reng: “Gongwe le gongwe koo leng gone, dira sengwe le sengwe se ka se kgonang ka bonnye jo nang le bona”.
",0.601608
"Dimeyara tša Afrika Borwa, gotee le maloko dikomiti tša meyara le makgotlaphethiši le bona ba tla ba gona..     Go letetšwe gore baetapelephethiši ba sepolotiki go tšwa dinageng tša go fapafapana ba ngwathelane dikgopolo le tšeo ba ithutilego go tšwa go tšona maemong go fapafapana ditiragalo ao ba itemogetšego ona mešomong ya bona ya tšatši ka tšatši.
","Jono ke boikuelo jo bo reng batho ba tshwanetse go ema nokeng le go nna le seabe mo letsholong leno ka go nna le seabe se se sa kgaotseng se se tla nnang le mosola wa go ya go ile nngwe ya dikao tseno tsa go nna le seabe se se sa kgaotseng ke Letsholo la ngwaga le ngwaga la Nelson Mandela le le ka ga Dipuisano tsa go Tlhabana Botlhale tsa Bašwa mo Mererong ya Boeteledipele jo bo Senang Dilabe le le samaganang le ditlhogo tse di botlhokwa thata mo bašweng ka fa nageng ya Aforika Borwa mmogo le mo lefatsheng ka bophara.
",0.7959652
"NSG hlamile lenaneo la ngwaga ka ngwaga go maloko lekgotlakhuduthamaga ka 2020, bjalo ka karolo ya thekgo ya lona ya boikgafo bja mmušo bja go hlola mmušo wo kgonago.
","Paka ya Lekgetho.
",0.2859999
"Lenaneo le, magareng ga tše dingwe, le šetšane le go tlabela lekgotlakhuduthamaga ka tsebo mo didikong tše tharo tša mmušo ka boetapele bjo bjo kaonafetšego le mabokgoni go bea leihlo mošomo wo dirilwego gore go kgonagale go lekolaleswa ditlhotlo tša pušo tšeo di šitišago go akaretšwa ga bohle le kgolo yeo swarelelago ya ikonomi.
","Paka ya Lekgetho ya mo ngwageng wa 2022 tla bula ka la bo 01 Phukwi mme ya tswalela ka la bo 24 Diphalane.
",0.54866517
"Letšatši la Boditšhabatšhaba la Nelson Mandela.
","Baduelalekgetho ba rotloediwa go tsenya ditlankana tsa bona tsa lekgetho ka inthanete mo go www.sarsefiling.co.za kgotsa ba di tsenye ka mogala wa seatla mo epeng ya Setheo sa Tirelo ya Lekgetho la Aforika Borwa (SARS)..   Monongwaga SARS tla tswelela go dirisa lenaneo le le tlhatlhobang baduelalekgetho ka go ba tlaletsa dintlha tsa bone tsotlhe tsa lekgetho gore thulaganyo ya lekgetho se ba tlhakatlhakanye tlhogo.
",0.33999962
"Letšatši la Boditšhabatšhaba la Nelson Mandela la lenyaga ka Mošupologo, 18 Mosegamanye le tla ketekelwa ka fase ga morero wa lefase ka bophara wo latelago: “Dira se se kgonago, ka seo nago le sona, kae goba kae mo lego gona”.
","Mo ngwageng yo fetileng wa 2021 thulaganyo eno dirisitswe go tlhatlhoba baduelalekgetho ba feta dimilione di le tharo.
",0.5609181
"Bjo ke boipiletšo bjo bo kwalakwaditšwego gore batho ba thekge le go kgatha tema lesolong le ka go logišana maano magato ao swarelelago nako ye telele go ba le ditlamorago tša go tšea telele.
","Go tsenngwa ka nako ditokomane tsa lekgetho ga go thuse fela baduelalekgetho gore ba kgone go obamela molao wa tuelo ya lekgetho, gape go thusa puso gore kgone go diragatsa ditirelo tse maAforika Borwa di tlhokang tota   Melaetsa.
",0.6791023
"Ye nngwe ya magato mohuta wo ke Dipoledišano tša Baswa tša Nelson Mandela le Lenaneo la Boetapele bja Potego leo le lebeletšego kudu merero ye diragalago gona bjale ya go ama baswa ka mo Afrika Borwa le go potologa lefase ka bophara.
","Melaetsa ya go AkgolaKabinete romela melaetsa ya yona ya go akgola le go eletsa masego kwa go: Moatlhodi Owen Lloyd Rogers go latela gore thapiwe go nna Moatlhodi mo Kgotlatshekelong ya Molaotheo ya Aforika Borwa.Kabinete le yona eme ka lefoko la ga Moporesitente Ramaphosa mo go eletseng Moporesitente wa mo malobeng Thabo Mbeki Letsatsi la Matsalo le le tletseng ka Boitumelo fa tshwara dingwaga di le 80, le le ketikileng ka la bo 18 Seetebosigo.
",0.7681093
"Sehla sa Metšhelo.
","Rre Mbeki ne na le ponelopele ntle e itumedisang fa go tla mo maAforika Borweng otlhe   Go ThapiwaPele batho botlhe ba thapiwa go tla tlhatlhobiwa makwalo bona dithuto le ditlankana dingwe tse di tlhokagalang.Bakaedi bao Seng ba Khuduthamaga mo Botong ya Merero ya Difofane tsa Aforika Borwa:Rre Ernest Khosa;Mme Bulelwa Koyana;Rre Surendra Sooklal; leMme Rejoice Edith Phewa..     Ditokololo tsa Kantoro ya Setheo sa Merero ya go Abelana ka Tshedimosetso ya Dikoloto tsa Madi go Reka Dintlo  Mme Kenosi Pearl Louisa Selane (Monnasetulo)  Mme Catharina Maria Van der Sandt  Rre Errol Vincent Magerman  Moatefokate Mandla Dludlu  Rre Matsobane Gabriel Mello   Mme Palesa Mawasha   Mme Penelope Anne Beck-Paxton   Mme Sphiwe Dorris Mayinga   Mme Tshifhiwa Victor Mphigalale; lej.
",0.24785984
"Tsebišo ka Seemo sa Bolwetši bja Coronavirus (COVID-19).
","Tshedimosetso ka Bolwetsi jwa Mogare wa Corona (COVID-19).
",0.9264293
"Kabinete lebogišitše batho ka moka mo Afrika Borwa ge ba tšeere sephetho sa go hlaba meento le go latela ditshepedišo ka moka tša COVID-19  tšeo pheletšo ya tšona kgontšhitšego naga ye go efoga palo ye hlatlogelago godimo ya diphetelo tše diswa ka nako ya leuba la bohlano la bolwetši bjo..
","Kabinete akgotse batho botlhe ba Aforika Borwa ba ba tlhophileng go enta le go obamela diporotokholo tsotlhe tsa COVID-19 leng se se bakileng gore naga efoge dipalo tse di tlhatlhogang tsa dikgetse tse dintšhwa ka nako ya lekhubu la botlhano la leroborobo..     Fela, ga re tshwanela go itebala gonne COVID-19 sa ntse le teng.
",0.89439154
"Le ge go le bjalo, ga se ra swanela go iketla kudu ka ge COVID-19 santše sale gona.
","Le fa naga sa tswa go phimola melawana e neng saletse ya go apara dimaseke fa re le fa gare ga batho, batho ba ba nang le malwetse mangwe a sa alafegeng le ba ba lwalang ba rotloediwa go tswelela go apara dimaseke.
",0.69119555
"Le ge le gore malobanyana mo naga fedišitše dinyakwa tša kgapeletšo tša go apara dimaseke mafelong bohle, batho ba go ba le malwetši mangwe le bao ba sa ntšego ba lwala ba hlohleletšwa go tšwelapele go apara dimaseke.
","Re tshwanetse gape go tswelela go tlhapa diatla gongwe go dirisa sebolayaditwatsi, le go katogana le go dira gore mafelo re leng mo go ona tlhabiwe ke phefo..     Moento go ya ka bopaki jwa saense santse le ona o gaisang mo go re sireletseng mo bolwetseng jwa COVID-19 mme Kabinete rotloetsa batho botlhe ba ba sa entiwang gore ba se senye nako mme ba ye go enta mme ba ba entilweng bone ba ye go tlhabela moento wa go tsosolosa ba tlhabileng kwa lefelong le le gaufi nabo la go tlhabela moento ntle le go duelela tirelo eo..     Monkeypox.
",0.80653465
"Re swanetše go tšwelapele go hlapa matsogo rena goba go sanithaesa, le gape go šielana sekgala le go netefatša gore go hlabela moya ka tsela ye maleba..  Meento santše le mokgwa wa go itšhireletša malwetšing wo hlatsetšwego ka sesaentshe kgahlanong le COVID-19 ebile Kabinete hlohleletša batho ka moka bao ba sa kago ba hlaba meento go ya go hlaba meento ya bona ya go tsošeletša mafelong kgauswi le bona go hlaba meento ntle le tefo..  Mabora dikgabo.
","Kabinete reboletswe tshedimosetso e mabapi le bolwetsi jwa Monkeypox ya gore ka fa nageng go setse go fitlhetswe batho ba le babedi ba ba nang le bolwetsi jwa Monkeypox mo nageng go latela gore fa gautshwane go fitlhelwe motho wa bobedi.
",0.75254166
"Kabinete sedimošitšwe ka seemo sa moragorago seo se gatetšego pele mabapi le go phatlalala ga Mabora Dikgabo ka mo nageng morago ga kgonthišišo ye lokolotšwego ya moragorago ya gore go na le motho wa bobedi yo nago le bolwetši bjo ka mo nageng.
","Batho bano ba itlhaotse mo setšhabeng mme ba kwa magaeng bona mme go samaganwe le dithulaganyo tsa go gata motlhala batho bao ba ka tswang ba kopane le batho bano go lekola gore ga ba tshwaetsega..     Lefapha la Boitekanelo le Setheo sa Bosetšhaba sa Malwetse a Tshelanwang ba dirisana le Mokgatlho wa Lefatshe wa Boitekanelo go sekaseka matshosetsi go tshelana ka bolwetse jono ka fa nageng gore tsamaisane le Melawana ya Boditšhabatšhaba ya Boitekanelo..     Mogare wa monkeypox ga tshelane bonolo mme gantsi tshelana fa batho ba ka tshwarana go tshwana le go sunana, go tlampurelana gongwe go kgoma dikarolo tsa mmele tse di nang le dintho tsa monkeypox.
",0.80889535
"Batho bao ba fetetšwego ba ipeetše thoko ka magaeng bona ebile lesolo la go lota mehlala ya batho bao ba ka bego ba kgokagane le bona le gare le kgatlampana go ba humana.
","Batho ba ba se nang matshwao monkeypox ba ka se ke ba tshela batho ba bangwe ka mogare ono..     Kabinete eletsa batho ba ba itemogelang matshwao letshoroma, matshwao a tshwanang le mokgotlhwane a latelwang ke boswata jo bo nang le metsi go ya kwa maokelong a gaufi gore ba bone thuso le kalafi ka bonako.
",0.8513211
".
","Matlhotlhapelo thabene ya East London.
",0.33642864
"Kgoro ya Maphelo le Setheo sa Bosetšhaba sa Malwetši ao Fetelanago se šomišana mmogo le Mokgatlo wa Lefase wa tša Maphelo go lekola kotsi ya diphetelo tša ka mo nageng ka go sepedišana le Melao ya Boditšhabatšhaba ya Maphelo..   Baerase ye ya Mabora Dikgabo ga phatlalale bonolo ebile phetelo ya gona gantši diragala morago ga go kgomana go swana le go atlana, go kgwathakgwathana goba go swaraswara ditho tša mmele tša go ba le dišo tša motho wa go swarwa ke mabora dikgabo.
","Matlhotlhapelo kwa Thabeneng ya Enyobeni kwa East London kwa Kapa Botlhaba ka Latshipi, 26 Seetebosigo 2022 a tsereng matshelo bašwa ba le 21 hutsafaditse naga yotlhe.
",0.7052229
"Batho bao ba se nago dika tša mabora dikgabo ga go kgonagale gore ba fetetše ba bangwe ka baerase ye..  Kabinete eleditše batho bao ba itemogelago dika tša letadi, dika tša go tlwaelega tša go swana le tša mokhohlane, le menyabidi ya mmala wo mohubitšwana go bega ditiragalo tše dikliniking tša maphelo tša kgauswi le bona gore bolwetši bjo bo humanwe ka bonako le go phekolwa..  Masetlapelo Thabeneng ya East London.
","Ga go bonolo go akanya ka manyaapelo malapa a latlhegetsweng ke bana ka tsela e botlhoko jalo..     Kabinete rometse matshediso go malapa a latlhegetsweng ke ba malapa mme ya leboga botlhe ka tshegetso ya setho e neilweng malapa a mo khutsafalong ka nako eno e boima..     Ke selo se se re tshwenyang gore bana ba bonnye jwa dingwaga tse 13 ba ne ba letleletswe go tsena mo lefelong leo gore ba tle go nwa notagi.
",0.8238168
"Masetlapelo go tšhabiša namana tša mmele kua Thabeneng ya Enyobeni gola East London Profenseng ya Kapa Bohlabela ka la 26 Phupu 2022 ao tšeerego maphelo batšwamahlalaging ba 21 tšhošitše kudu batho ka moka ka nageng.
","Re ikuela mo baaging botlhe go nna le seabe ka go dira gore bana ba rona ba babalesege ka dinako tsotlhe..     Bana ba ba nang le dingwaga tse di ka fa tlase ga di le 18 ga ba letlelelwa go tsena mo dithabeneng, dišabining, dibareng le kwa marekisetsong bojalwa.
",0.70683306
"Go tloga go le boima kudu go gopola ka tlalelo ya malapa bao ba lobilego bana ba bona ka mokgwa wo wo sehlogo..  Kabinete lebišitše melaetša ya yona ya mahloko go malapa ao lobilego bao ba phelago le bona le go leboga motho mang le mang ka thekgo ya bona ya moya wa botho go malapa ao llelago metswalle ya bona mo nakong ye ye boima..  Go hlobaetša gore bana ba bannyane ba mengwaga ya go lekana 13 ba ile ba dumelelwa go tsena lefelong leo le go gamola madila.
","Barekisi ba nnotagi ba ba fitlhelwang ba tlola melao eno ba tla latofadiwa ka bosenyi mme ba tseelwa dilaesense tsa bona tsa go rekisa notagi..
",0.70532835
"Re dira boipiletšo bathong ka moka setšhabeng go kgatha tema ya bona go dira gore bana ba dule ba bolokegile ka dinako tšohle..  Bana ba mengwaga ya ka fase ga ye 18 ga ba dumelelwe go tsena ka dipareng, ka dithebeneng, le ka mabenkeleng go rekiša madila.
","Se se Tswileng mo Samiting ya Setlhopha sa Baeteledipele ba Dinaga tse Supa (G7).
",0.506841
"Bagwebi ba madila bao go ka humanwago ba gataka ye mengwe ya melao ye ba swanetše go pharwa ka bosenyi le go tšeelwa dilaesense tša bona tša go rekiša madila..  Dipoelo go tšwa Samiting ya Baetapele ba Seboka sa Dinaga tše Šupa (G7).
","Moporesidente Cyril Ramaphosa nnile le seabe kwa Samiting ya Baeteledipele ba G7 e neng tshwaretswe kwa Bavaria, Jeremane ka Mosupologo, 27 Sedimonthole.
",0.69646597
"Mopresidente Cyril Ramaphosa kgathile tema Samiting ya Baetapele ba Seboka sa Dinaga tše Šupa (G7) yeo bego swaretšwe kua Bavaria, Germany ka Mošupologo, 27 Phupu.
","Moporesidente – yo nnileng le seabe mo dikopanong tse mo go tsona go buisanweng ka merero ya tlelaemete, motlakase, boitekanelo, go nna teng ga dijo mo lefatsheng le merero ya tekatekano ya bong – ne laleditswe ke moamogelabaeng, Motšhanselara Olaf Scholz..     G7 ke foramo ya sepolotiki ya dipuso e gogwang kwa pele ke naga ya Canada, Fora, Jeremane, Itali, Japane, Borithane le Amerika     Ditshwetso tsa Kabinete.
",0.7402557
"Mopresidente – yo kgathilego tema dikopanong tša mošomo fao go tšona go ahlaahlilwego merero ya klaemete, mohlagase, maphelo le tšhireletšego ya dijo lefaseng ka bophara – be memilwe ke moswarakopano ye, Mokhanseliri Olaf Scholz..  G7 ke foramo ya sepolotiki ya magareng ga didiko tša mmušo ya go hlangwa ke Canada, France, Germany, Italy, Japan, United Kingdom le Amerika  Diphetho tša Kabinete.
","Sekwalwa se Iseng se Butswe sa Melao ya Lephata la Molao (LSC).
",0.49161646
"Seakanywa sa Melao ya Lefapha la Semolao (Seakanywa sa LSC).
","Kabinete letleletse gore LSC ka phasaladiwa gore baagi ba ntshe se se mo mafatlheng bona ka go sona.
",0.6800933
"Kabinete dumeletšwe go phatlalatšwa ga Seakanywa sa LSC gore setšhaba se fe ditshwayotshwayo tša sona.
","Maikemisetso melawana eno ke go bebofatsa diphetogo mo lephateng la molao go dira gore ditheo tsa molao di nne le kemedi go ya ka sebopego sa baagi ka fa nageng.
",0.77807593
"Dinepo tša melao ye ke go kgontšha diphetogo ka lefapheng la semolao go fihlelela tekatekano ya batho goya le ka dipalopalo tša ka mo nageng.
","Molao ono tla netefatsa gape le gore go dirwa setheo se se tla tlhagisang batlamedi ba ditirelo tsa molao ba ba katisitsweng go utlwagala le ba ba itseng tiro ya bona ka botlalo.
",0.7924949
"Melao ye tla netefatša gape le gore go ba le setheo seo se tla tšweletšago baabaditirelo bao ba hlahlilwego gabotse le ba bokgoni ditirelong tša semolao.
","Letsholo la go kwadiwa ga LSC le ne le okametswe ke Lekgotla la Tiro ya Molao, setheo sa semolao se se tlhamilweng go ya ka Karolo ya bo 4 ya Molao wa Tiro ya Molao, wa ngwaga wa 2014 (Molao wa bo 28 wa 2014) mmogo le go kaelwa ke Molao wa Matlafatso ya Maemo Ikonomi Bathobatsho (B-BBEE), wa ngwaga wa 2013 (Molao wa bo 46 wa 2013).
",0.63749456
"Go hlangwa ga Seakanywa se sa LSC go lekotšwe ke Khansele ya Phethagatšo ya Semolao bago setheo sa mmušo seo se hlamilwego goya ka Karolo 4 ya Molao wa Phethagatšo ya Semolao, 2014 (Molao 28 wa 2014) le go hlahlwa ke Molao wa Matlafatšo ya Ikonomi ya Bathobaso yeo Nabilego (B-BBEE), 2013 (Molao 46 wa 2013).
","Molao wa B-BBEE wa 2013 rwesa Tona ya Kgwebisano, Indaseteri le Kgaisano maikarabelo go kwala melao ya tiro e tswileng diatla mo go diragatseng matlafatso ya maemo ikonomi mo bathobantshong mo maphateng a rileng.
",0.7708597
