src_text,tgt_text,cosine_score
"Khabinete yi pasise ku ringanyetiwa ePalemente ka Nongoloko wa Swihlohloteri swa Xibalo wa R&D eka malembe mambirhi lama hundzeke (2019/20 na 2020/21).
","Inkqubo yesibonelelo serhafu ijonge ukukhuthaza iinkampani zabucala ukuba zityale imali kwi-R&D ukuze zikhuthaze ukukhula kotyalo-mali.
",0.72357106
"Leswi swi fambisana na xiyenge xa 11D (17) xa Nawu wa Xibalo xa Malinghena, wa 1962 (Nawu wa 58 wa 1962), lowu wu lavaka ku andlariwa ka swiviko leswi ePalemente.
","Ivumela ukuqhubela-phambili kwenzululwazi kunye nobuchule bokuyilaobuza kunceda ekukhuleni koqoqosho, kwaye ikhuthaza ukhuphiswano.
",0.65735644
"Nongoloko wa swihlohloteri swa xibalo wu lava ku hlohlotela tikhamphani to ka ti nga ri ta mfumo ku vekisa eka R&D hi xikongomelo xo hlohlotela ku kula ka vuvekisi.
","IKhabhinethi ichulumancile kukuba le ngxelo ibonisa ukuba iinkampani ezintsha zifake izicelo zokufumana isibonelelo serhafu.
",0.7692814
"Wu pfumelela ku antswisiwa ka sayense na vutumbuluxi hi mayelana na ku kula ka ikhonomi, na ku kondletela vuphikizani.
","Ikhuthaza iinkampani ezininzi ukuba zifake izicelo zokuxhamla esi sibonelelo njengenxalenye yokukhulisa utyalo-mali lwazo kunye nokukhwezela ukukhula koqoqosho.
",0.77405226
".
","Iinkampani ezine eziphezulu ezithe zasifumana esi sibonelelo serhafu zikwicandelo lokucola iimveliso zolimo; elezokuxhamlisa kwizimbiwa; elezamichiza, elezithambiso, elezamayeza kunye nelezobugcisa bezombane kunye nelezobuchwepheshe bolwazi ethe iKhabhinethi yawamkela njengemacandelo ekufuneka akhokeliswe phambili kwisiCwangciso sokuSebenza soMgaqo-nkqubo wezoShishino.
",0.5404723
"Khabinete yi enerisiwa hileswaku xiviko lexi xi komba leswaku tikhamphani tintshwa ti endlile swikombelo swa xihlohloteri xa xibalo.
","Ingxelo epheleleyo inokufumaneka kwiwebhusayithi yeSebe lezeNzululwazi kunye noBuchule bokuYila:  www.dst.gov.za..     IQonga loMthetho lokuKhula kunye namaThuba ase-Afrika (i-AGOA) – yowama-.
",0.63401896
"Swi hlohlotela tikhamphani to tala ku fikelela xikimi lexi tanihi xiphemu xo kurisa vuvekisi bya vona na ku hlohlotela ku kula ka ikhonomi.
","IKhabhinethi ikuvumile ukusingathwa kweQonga le-AGOA ngowama-.
",0.6652926
"Tikhamphani ta mune ta xiyimo xa le henhla leti ti fikeleleke xihlohloteri xa xibalo ti le ka ku phurosesiwa ka swa vurimi; antswiso wa swa vucelamigodi; tikhemikali; swixongisi; tisekitara to endla mirhi na ta xithekiniki xa xielekitironiki na ta Thekinoloji ya Vuxokoxoko leti Khabinete yi ti amukeleke tanihi tindhawu ta swirhangana eka Kungu ra ya Pholisi ya Matirhelo ya Tiindasitiri.
","I-AGOA yaphunyezwa yiMelika (i-USA) ngowama-2000 ukuze yenze kube lula kumazwe amaninzi ase-Afrika akumazantsi e-Sahara ukurhweba ne-USA.
",0.6709378
"Xiviko hi vutalo xi nga fikeleriwa hi ku tirhisa webusayiti ya Ndzawulo ya Sayense na Vutumbuluxi eka: www.dst.gov.za.
","Iimveliso zorhwebo zoMzantsi Afrika ezithunyelwa e-USA phantsi kwe-AGOA ziquka iziqhamo ezityiwayo, amandongomane, izithuthi, iintsimbi zemoto, intsimbi, isinyithi kunye neemveliso zemichiza.
",0.66486025
"Foramu ya Nawu wa ku Kula na Swivandlanene ya Afrika (AGOA) –.
","Owona mhla nendawo zisaza kubhengezwa.
",0.51083386
"Khabinete yi pasisile ku rhurheriwa ka Foramu ya AGOA hi.
","Ingqungquthela yaBaphathiswa ye-Group on Earth Observations (i-GEO) –.
",0.69138944
"AGOA yi pasisiwile hi United States of America (USA) hi 2000 ku nyika mfikelelo wa ntsakelo wa bindzu ro tiyimela eka matiko mo tala ya xifundza xa Afrika xa le dzongeni wa Sahara na makete wa le matikweni ya le USA.
","IKhabhinethi ivumile ukuba uMzantsi Afrika usingathe iNgqungquthela yaBaphathiswa ye-GEO eKapa ngowama-.
",0.7315786
"Swirhumeriwa ematikweni mambe hi Afrika-Dzonga ehansi ka AGOA swi katsa mihandzu yo dyiwa, timanga, mimovha, michini yo tirha hi yoxe, ngwedi, nsimbhi, na swikumiwa swa khemikali.
","I-GEO liqumrhu eliphakathi koorhulumente elasekwa ngowama-2003 emva kweNgqungquthela yeHlabathi yowama-2002 yoPhuhliso oluZinzileyo.
",0.61322004
"Siku ra xiviri na ndhawu swa ha ta tivisiwa..     Samiti ya Vaholobye hi mayelana na Mixiyaxiyo ya Misava (GEO) – .
","Isebenza njengeqonga lamazwe ngamazwe apho amazwe anikela ngokuzithandela kwinjongo enye yokwakha iinkqubo ze-GEO.
",0.7942112
"Khabinete yi pasise leswaku Afrika-Dzonga yi rhurhela Samiti ya Vaholobye ya GEO eKapa hi.
","I-GEO ngoku inoorhulumente bamazwe abangaphezulu kwe-113, abangama-30 kubo bavela e-Afrika kunye nemibutho ethatha inxaxheba emalunga ne-140, kwaye i-11 lale mibutho livela e-Afrika.
",0.70014143
"GEO huvo ya le xikarhi ka mifumo leyi tumbuluxiweke hi 2003 endzhaku ka Samiti ya Misava ya 2002 hi mayelana na Nhluvukiso wa Vuyisekamahlweni.
","UMzantsi Afrika ube lilungu leKomiti Elawulayo elisebenzayo ukusukela ngowama-2005 kwaye iinzululwazi zethu ngoku zithatha inxaxheba kumaphulo ophando amaninzi akhokelwa yi-GEO.
",0.73814034
"Yi tirha tanihi pulatifomo ya mavandlanyingi laha matiko hi ku tinyiketela ma hoxaka xandla hi mayelana na xikongomelokulu xa nhlanganelo xa ku aka tisisiteme ta GEO.
","Inyanga yezoThutho yeDwarha (i-OTM) –.
",0.53367007
"Sweswi GEO yi na ku tlula 113 wa mifumo ya rixaka, leyi 30 ya yona yi humaka eAfrika na kwalomu ka 140 wa mihlangano leyi tekaka xiave, laha 11 wa leyi yi humaka eAfrika.
","IKhabhinethi ikuvumile ukusungulwa kwephulo le-OTM ngoMgqibelo, umhla woku-1 kweyeDwarha yowama-2022, phantsi komxholo othi:  “Sishov’ingolovane: sisonke sakha iziseko zophuhliso zezothutho ezakha nezigcina indlela yokuphila”.
",0.6784725
"Afrika-Dzonga yi vile xirho xa Vurhangerinkulu xo gingirika xa kusukela hi 2005 naswona van’watisayense va ka hina sweswi va le ku tekeni ka xiave eka mapfhumba ya ndzavisiso yo hlayanyana lama rhangeriweke  hi ku tirhisa GEO.
","I-OTM yonyaka isetyenziselwa ukwazisa ngezothutho njengenye yezinto ezibalulekileyo ekukhuleni koqoqosho kunye nophuhliso lweendawo ezihlala uluntu.
",0.6958611
"N’hweti ya Vutleketli ya Nhlangula (OTM) –.
","Imisebenzi emininzi iza kwenziwa ukubonisa imiba eyahlukeneyo yeziseko zophuhliso lothutho kwezophapho, kwezaselwandle, kwezothutho lukawonke-wonke kunye neendlela.
",0.5302595
"Khabinete yi pasise ku simekiwa ka pfhumba ra OTM hi Mugqivela, 1 Nhlangula 2022, ehansi ka nhlokomhaka: “Sishov’ingolovane: swin’we hi aka miako ya vutleketli leyi akaka na ku hlayisa vutihanyisi”..     OTM ya lembe na lembe yi tirhisiwa ku tlakusa vulemukisi hi mayelana na vutleketli tanihi xin’wana xa swiphemu swa nkoka eka kula ka ikhonomi na nhluvukiso wa tindhawu.
","Le misebenzi iza kwazisa uluntu malunga nokhuseleko kunye nokhuselo lwezothutho.
",0.68161356
"Migingiriko yo hlayanyana yi ta endliwa ku kombisa swiphemu swo hambanahambana swa switirhisiwakulu swa vutleketli eka swa vuhahisi, malwandle, swifambo swa mani na mani na mapatu.
","Iindibano zokubonisana namahlakani abachaphazelekayo nazo ziza kubanjwa ukuze kuxoxwe ngemiceli-mngeni eyahlukeneyo kwicandelo lezothutho.
",0.7594742
"Migingiriko leyi yi ta tlhela yi tlakusa vulemukisi hi mayelana na vuhlayiseki na vusirheleri bya vutleketli.
","Urhulumente usazibophelele ekuphuculeni iziseko zophuhliso zezothutho zeli lizwe, kwiindawo ezisemaphandleni kunye nasezidolophini, ukuze kube lula ukuthuthwa kweempahla kunye nabantu ngendlela esebenzayo nenempumelelo..     Intlanganiso yeZizwe Ezimanyeneyo (i-UN) neNkqubo yokuHlaliswa koLuntu (i-UN-HABITAT).
",0.7041914
"Miburisano ya vakhomaxiave yi ta tlhela yi khomiwa ku burisana hi mitlhontlho yo hambanahambana eka sekitara ya vutleketli.
","IKhabhinethi ikwamkele ukusingathwa kwentlanganiso yamalungu e-UN-HABITAT eRhawutini ngomhla we-16 nowe-17 kweyeDwarha ngowama-.
",0.6317796
"Mfumo wu tshama wa ha tibohile ku antswisa switirhisiwakulu swa vutleketli swa tiko, havumbirhi eka tindhawu ta le matikoxikaya na ta le madorobeni, hi xikongomelo xo humelerisa mafambafambelo lama tirhaka kahle na lama hatlisaka ma nhundzu na vanhu.
",".
",0.42766237
"Nhlengeletano ya Vutshamo wa Nongoloko wa Vutshamo bya Vanhu ya Vun’we bya Tinxaka (UN-HABITAT).
","ISebe lezokuHlaliswa koLuntu liza kuququzelela le ntlanganiso yeentsuku ezimbini eza kuzinyaswa ziintshatsheli zezopolitiko, iingcali kunye nabaphandi, kuquka namalungu abalulekileyo eKomiti yaBammeli abasiSigxina be-UN-HABITAT ezinze e-Nairobi, e-Kenya.
",0.5836416
"Khabinete yi pasisile ku rhurheriwa ka nhlengeletano ya swirho swa UN-HABITAT eJoni hi masiku ya 16 na 17 Nhlangula..     Ndzawulo ya Vutshamo bya Vanhu yi ta hlanganisa nhlengeletano leya masiku mambirhi leswaku yi ngheneleriwa hi tinghwazi ta tipolitiki, vatirhi na valavisisi, ku katsa na swirhonkulu swa Komiti ya Vayimeri va Nkarhi hinkwawo ya  UN-HABITAT leyi kumekaka eNairobi, eKenya.
","Imiba engundoqo eza kuxoxwa iza kuquka ukufuna amanyathelo okungenelela aza kuza notshintsho kwiindawo zoogob’ityholo kunye nakumatyotyombe..     Iziphumo zezi ngxoxo ziza kufikelela kuvuthondaba ngokusungulwa kweSicwangciso-nkqubo seSicwangciso sokuSebenza seHlabathi, esiza kuthiwa thaca kwiNdibano ye-UN-HABITAT ukuze sivunywe ngowama-     Imithetho eYilwayo.
",0.8152718
"Timhakakulu leti ku faneleke ku vulavuriwa hi tona ti ta katsa ku lava miphalalo yo cinca ya swidakana na tindhawu ta doroba to hlakala..     Mivuyelo ya miburisano leyi yi ta fika emakumu loko ku simekiwa Rimba ra Kungu ra Matirhelo ra Misava Hinkwayo, leri ri nga ta andlariwa eka Huvo ya UN-HABITAT leswaku yi amukeriwa hi   Milawumbisi      .
","Umthetho oYilwayo weBhunga leSizwe loBundlobongela obuSekwe kwiSini kunye nokuBulawa kwabaseTyhini (i-GBVF) wowama-..     IKhabhinethi ikuvumile ukungeniswa koMthetho oYilwayo weBhunga leSizwe le-GBVF wowama-2021 ePalamente ukuze uqwalaselwe.
",0.82166564
"Khansele ya Rixaka hi mayelana na Nawumbisi wa Madzolonga yo ya hi Rimbewu na ku Dlayeteriwa ka Vaxisati (GBVF) wa.
","Lo Mthetho uYilwayo unika ingcaciso ngomthetho oza kusetyenziswa xa kusekwa iqumrhu elimiselwe ngokomthetho eliza kungqala ngqo kule ngxaki ye-GBVF..     Ukwakhululela ukuba kusekwe iBhodi yeli Bhunga eza kukhokela ize ibeke iliso kumalinge okuphunyezwa kwesiCwangciso-qhinga seSizwe se-GBVF, esavunywa yiKhabhinethi kweyeDwarha yowama-2020 ukuba masiqalise ukusebenza.
",0.72711587
"Khabinete yi pasise ku ringanyetiwa ka Khansele ya Rixaka hi mayelana na Nawumbisi wa GBVF wa 2021 ePalamente leswaku wu langutisisiwa ku ya emahlweni.
","Le bhodi iza kuba namalungu angama-51% avela kwimibutho yoluntu aze wona angama-49% aphume kurhulumente.
",0.7140851
"Nawumbisi lowu wu nyika rimba ra nawu leswaku ku tumbuluxiwa huvo ya xinawu ku nyika mphalalo wa nkongomo eka ku tirhana na GBVF.
","Lo Mthetho uYilwayo sele ugwadliwe kwiindibano zovakaliso-zimvo zoluntu...     Umthetho oYilwayo woLawulo lweeMveliso zeCuba neMidiza e-Elektronikhi wowama-.
",0.76440585
"Wu tlhela wu lulamisela ku simekiwa ka Bodo ya Khansele leyi nga ta nyika vurhangeri bya xiqhinga ni ku vona ku angamela ka Kungu ra Xiqhinga ra Rixaka hi mayelana na GBVF, leri ri pasisiweke hi Khabinete hi Nhlangula 2020 leswaku ri tirhisiwa.
","IKhabhinethi ikuvumile ukungeniswa koMthetho oYilwayo woLawulo lweeMveliso zeCuba neMidiza e-Elektronikhi wowama-2018 ePalamente, ojonge ukurhoxisa lo Mthetho woLawulo lweeMveliso zeCuba ukhoyo, wowe-1993 (uMthetho wama-83 wowe-1993), njengoko ulungisiwe.
",0.77500355
"Bodo leyi yi ta na vuyimeri bya 51% kusuka eka vaaki lava nga na ku tsakela kun’we na 94% kusuka eka mfumo.
","Lo Mthetho uYilwayo ukwajonge ukuqinisa amanyathelo elizwe amalunga nezempilo yoluntu aze enziwe ukuba  ahambelane nesiVumelwano soMbutho wezeMpilo weHlabathi seSicwangciso-nkqubo soLawulo lweCuba kuLawulo lweCuba.
",0.63299656
"Nawumbisi lowu wu se wu hundzile eka ku nyikiwa ka mavonelo ya vanhu.
","Lo Mthetho uYilwayo uphakamisa, phakathi kwezinye izinto, ukuba kubhangiswe tu ukutshaya ngaphakathi kwizakhiwo nakwezinye iindawo ezingaphandle kwezakhiwo;; ukubhangiswa kokuthengiswa kwecuba ngoomatshini bokuthengisa, futhi ukwaphucula neendlela amaqokobhe ecuba enziwa ngayo kunye nemibhalo yokulumkisa ebhalwe kuwo.
",0.6044168
"Nawumbisi wa Vulawuri bya Swikumiwa swa Fole na Tisisiteme ta Mphakelo ta Xielekitironiki wa.
","Lo Mthetho uYilwayo uhliwe amahlongwane wade wacokiswa ngamahlakani achaphazelekayo ahlukeneyo, aquka amashishini ecuba, imibutho yoluntu kunye namasebe karhulumente afanelekileyo     Imisitho ezayo.
",0.7504936
"Khabinete yi pasise ku ringanyetiwa ka Nawumbisi wa Vulawuri bya Swikumiwa swa Fole na Tisisiteme ta Mphakelo ta Xielekitironiki wa 2018 ePalemente, lowu lavaka ku herisa Nawu wa Vulawuri bya Swikumiwa swa Fole wa sweswi, 1993 (Nawu wa 83 wa 1993), tanihilaha wu hundzuluxiweke hakona..     Nawumbisi lowu wu tlhela wu lava ku tiyisa magoza ya rihanyo ra vaaki ya tiko na ku ma fambelanisa na Ntwanano wa Rimba ra Nhlangano wa Rihanyo wa Misava hi mayelana na Vulawuri bya Fole.
","Iseshoni yama-77 yeNdibano Jikelele yeZizwe eziManyeneyo (i-UNGA77).
",0.5958551
"Nawumbisi lowu, exikarhi ka swin’wana, wu ringanyeta ku nga dzahiwi ka 100% endzeni ka miako na le ka tindhawu tin’wana ta le handle ka miako; ku yirisiwa ko xavisa tisigarete hi ku tirhisa michini yo xavisa, na ku tiyisa mapakatelelo ya tisigarete na mifungho yo lemukisa.
","UMzantsi Afrika uthatha inxaxheba kwi-UNGA77 eqhubeka kundlunkulu we-UN kwisiXeko saseNew York e-USA ukusuka ngomhla wama-20 ukuya kowama-27 kweyoMsintsi ngowama-2022 phantsi komxholo othi:  “Ixesha lesiganeko sokuphawula utshintsho olubalulekileyo lwembali:  Ukuvula izisombululo zenguqu kwimiceli-mngeni edibanayo”.
",0.6605154
"Nawumbisi lowu wu hundzile eka mbhurisano wo angarhela na le ka vakhomaxiave vo hambanahambana, ku katsa indasitiri ya fole, mihlangano ya vaaki lava nga na ku tsakela kun’we na tindzawulo ta mfumo leti faneleke     Swiendleko leswi Taka.
","Umonakalo owenziwe ngubhubhane weNtsholongwane ye-Corona kuqoqosho nentlalo yamazwe akumazantsi e-Ikweyitha awufani xa uthelekiswa nesantya sokubuyela kwimo yesiqhelo kumazwe atyebileyo asemantla e-Ikhweyitha kwaye ufuna amazwe ehlabathi ukuba abambisane ukuze kuqinisekiswe ukuba akukho mntu ushiyekelayo..     Ngaphambi kweNgxoxo-mpikiswano ye-UN, uNobhala-Jikelele we-UN, uMnu António Guterres, uza kubiza ingqungquthela ""ngoTshintsho lweMfundo"" kwaye abambe intlanganiso ekwinqanaba eliphezulu egxile kwiiNjongo zoPhuhliso oluZinzileyo (ii-SDGs).
",0.75593925
"Sexini ya vu77 ya Huvo yo Angarhela ya UN (UNGA77).
","Intlanganiso yee-SDGs kulindeleke ukuba iphonononge iindlela zokubuyela kula moya wodlamko wangaphambili kunye nokukhawulezisa ukuphunyezwa kwazo.
",0.5053993
"Afrika-Dzonga yi le ku tekeni ka xiave eka UNGA77 leswi endleriwaka eka tihofisikulu ta UN eka Dorobakulu ra New York eUSA kusukela hi siku ra 20 kufikela 27 Ndzati 2022 ehansi ka nkongomelo: “Xiendleko xa xicincamatimu: Ku tshunxa switshunxo leswi tisaka ku cinca eka mitlhontlho ya nhlanganelo”.
","Usuku lwezaMasiko.
",0.32918215
"Eka Dzonga wa misava hinkwayo, switandzhaku swa ikhonomi na vanhu leswi vangiweke hi ntungukulu wa Vuvabyi bya Khoronavhayirasi (COVID-19) swi ni ku hambana lokukulu hi mayelana na ku pfuxeleleka hi vuntshwa eka N’walungu leyi hluvukeke kutani leswi swi lava matshalatshala ya nhlanganelo kusuka eka tinxaka hinkwato ku tiyisisa leswaku ku nga vi na un’we loyi siyiwaka endzhaku..     Leswi nga ta rhangela Njhekajekisano wa , Matsalanankulu wa UN, Ttn António Guterres ta rhamba samiti hi mayelana na “Ku Cinca ka Dyondzo” na ku rhurhela nhlengeletano ya le henhla leyi kongomeke eka Swikongomelokulu swa Nhluvukiso leswi Yisekaka Emahlweni (SDGs).
","UMongameli Ramaphosa uza kuba sisithethi sembeko kwimibhiyozo yoSuku lwezaMasiko yeSizwe ngowama-2022 kwiZakhiwo zoMdibaniso ngoMgqibelo, umhla wama-24 kweyoMsintsi ngowama-.
",0.6748079
"Nhlengeletano ya tiSGD yi languteriwa ku valanga tindlela leti eka tona ku tlhelaka ku kumiwa matimba ni ku hatlisisa ku tirhisiwa ka tona.
","Lo Mnyhadala uza kubanjwa phantsi komxholo othi:  “UkuBhiyozela imiSebenzi kaSolomon Linda kunye noMculo weMveli waseMzantsi Afrika”..     Inyanga yaMasiko kulo nyaka igxile kumculo wemveli woMzantsi Afrika ize igxininisa kakhulu kumculo weSsicathamiya kunye negalelo lawo elikhulu kwimidlalo yethu, ubugcisa, inkcubeko kunye namasiko.
",0.6553099
"Siku ra Ndzhaka.
","Lo mxholo unika imbeko kwisikhumbuzo seminyaka engama-60 yokusweleka kwemvumi, umculi kunye nomqambi wengoma, uSolomon Popoli Linda (1909-1962), nowaziwa njengoSolomon Ntsele, nowaziwa kakhulu njengomqambi wengoma ethi, “Mbube”.
",0.32833117
"Phuresidente Ramaphosa ta andlala mbulavulo wa mhakakulu eka mitlangelo ya Siku ra Rixaka ra Ndzhaka ra 2022 eUnion Buildings hi Mugqivela, 24 Ndzati.
","UMnyhadala Onxuseneyo woSuku lwezaseLwandle weHlabathi wowama-2022 .
",0.7479434
"Xiendleko lexi xi ta khomiwa ehansi ka nkongomelo: “Ku Tlangela Ndzhaka ya Solomon Linda na Vunanga bya Xintu bya Afrika-Dzonga”.
","UMzantsi Afrika uza kusingatha uMnyhadala Onxuseneyo woSuku lwezaseLwandle weHlabathi ngowama-2022 e-Durban ukusuka ngomhla we-12 ukuya kowe-14 kweyeDwarha ngowama-.
",0.65221554
"N’hweti ya Ndzhaka ya lembe leri yi kongomisa eka vunanga bya xintu bya Afrika-Dzonga hi ku kongomisa eka vunanga bya Isicathamiya ku katsa na ku hoxa ka byona xandla lokukulu eka mitlangu ya hina, vutshila, mfuwo na ndzhaka.
","Lo Mnyhadala uza kubanjwa ngexesha le-OTM, nayo eza kuba yinxalenye yokufundisa ngecandelo lethu lezaselwandle.
",0.74398804
"Nkongomelo lowu wu xixima malembe ya vu60 ya ku hundza emisaveni ka n’wavunanga, xiyimbeleri tlhelo qambhi Solomon Popoli Linda (1909-1962), loyi tlhelaka tiveka tanihi Solomon Ntsele, loyi tivekaka ku antswa tanihi qambhi ya risimu ra “Mbube”.
","Lo msitho uza kuzinyaswa ngabathunywa abavela kumazwe ahlukeneyo abazakuzibonela ngokwabo icandelo lezaselwandle loMzantsi Afrika.
",0.6700355
"Xiendleko xo Fana xa Siku ra Malwandle ra Misava xa.
","UMzantsi Afrika ube lilungu loMbutho waMazwe ngaMazwe waseLwandle ukusukela ngowe-1995, oyi-arhente ekhethekileyo ye-UN enoxanduva lokulawula uthutho lweenqanawa.
",0.61425185
"Afrika-Dzonga ri ta va yi rhurhela Xiendleko xo Fana xa Siku ra Misava ra Malwandle wa 2022 eDurban kusuka hi siku ra12 kufika 14 Nhlangula.
",".
",0.41192412
"Xiendleko lexi xi ta rhurheriwa hi nkarhi wa OTM, lexi xi nga ta tlhela xi vumba xiphemu xo tlakusa vulemukisi bya sekitara ya hina ya malwandle.
","Inyanga yoKhenketho.
",0.40148556
"Xiendleko lexi xi ta tisa vurhumiwa byo huma eka matiko mo hambanahambana lava nga ta va na ntokoto wa sekitara ya malwandle ra Afrika-Dzonga.
","Inyanga yoKhenketho kulo nyaka ibhiyozelwa phantsi komxholo woSuku loKhenketho lweHlabathi (ngomhla wama-27 kweyoMsintsi) othi “Ukucinga ngokutsha uKhenketho”.
",0.66989255
"Afrika-Dzonga yi vile xirho xa Nhlangano wa Malwandle wa Matiko ya Misava kusukela hi 1995, lowu wu nga ejensi ya vukorhokeri byo kongomisa ya UN leyi nga na vutihlamuleri byo lawula vutleketli bya le lwandle.
","Ukhenketho lwasekhaya lubalulekile ekuvuseleleni icandelo lezokhenketho, elinegalelo elikhulu kwi-GDP yoMzantsi Afrika nakumalinge okudala imisebenzi.
",0.7175919
".
","IKhabhinethi ichulumancile kukuba icandelo lokwamkela iindwendwe libone ukunyuka kwenani labantu abangabatyeleli emva kwexesha le-COVID-.
",0.45093322
"N’hweti ya Vupfhumba.
","Aba bantu bazizigidi eziyi-.
",0.5019964
"Nan’waka N’hweti ya Vupfhumba yi le ku tlangeriweni ehansi ka nhlokomhaka ya Siku ra Vupfhumba ra Misava (27 Ndzati) ya “Ku Tsundzuka Nakambe Vupfhumba”.
","2 bathathe uhambo apha ngaphakathi elizweni kwisiqingatha sokuqala sowama-2022 babonakalisa ukuba inani labantu abathatha uhambo linyuke nge-114% xa kuthelekiswa neli xesha linye ngowama-.
",0.7071826
"Vupfhumba bya laha kaya byi ni nkoka eka ku pfuxelela sekitara ya vupfhumba, leyi nghenisaka xandla swinene eka GDP ya Afrika-Dzonga na ku tumbuluxiwa ka mitirho.
","Oku kubonise ukunyuka kakhulu kwenani labantu abathatha uhambo xa kuthelekiswa neli xesha linye ngowama-2019, apho ibingabantu abazizigidi eziyi-8,6 abathe bathatha uhamba apha ekhaya.
",0.6840415
"Khabinete yi enerisiwile hileswaku sekitara ya malwandla yi rhekodile ntlakuko wa vuendzi endzhaku ka nkarhi wa COVID-.
","Njengenxalenye yokubhiyozela iNyanga yoKhenketho, iKhabhinethi ikhuthaza abemmi boMzantsi Afrika ukuba bathabathe inxaxheba kwiphulo lokhenketho olubizwa nge-‘Shotleft’ batyelele amaphondo ethu ohlukeneyo.
",0.7577653
"Tendzo ta laha kaya ta.
","IKhabhinethi ikwasamkele isigqibo se-Air Belgium sokuba neenqwelo-moya  ngamaxesha athile onyaka eziza kuza eMzantsi Afrika, ukusukela kule nyanga (kweyoMsintsi), nto leyo eza kuphucula ukhenketho kwaye iqinise ngakumbi iwonga lethu njengendawo yokhenketho ethandwayo ngabakhenkethio.
",0.44042534
"2 wa timiliyoni leti fambiweke eka hafu yo sungula ya 2022 ti rhekodile ntlakuko hi 114% loko hi fananisa na nkarhi lowu fanaka hi.
","I-Air Belgium iza kuba neenqwelo-moya zeveki eziya eKapa naseRhawutini     Imiyalezo.
",0.58499575
"Leswi swi kombisa ku antswa loku nga erivaleni ka nkarhi lowu fanaka hi 2019, laha hi voneke.
","Amazwi okuvuyisana     Ikhabhinethi ithumela amazwi okuvuyisana kunye neminqweno emihle: kuMongameli William Samoei Ruto weRiphabliki yaseKenya, othe wabekwa ngokusesikweni ngoLwesibini, umhla we-13 kweyoMsintsi ngowama-2022, emva konyulo lukazwelonke olunoxolo obelubanjwe ngomhla we-9 kweyeThupha ngowama-.
",0.57285464
"6 wa timiliyoni ta tendzo leti fambiweke ta laha kaya.
","Usekela-Mongameli u-David Mabuza ubezimase lo msitho wokubekwa ngokusesikweni egameni likaMongameli Ramaphosa, kunye norhulumente kunye nabantu beRiphabhlikhi yoMzantsi Afrika.
",0.5912252
"Tanihi xiphemu xa ku tlangela N’hweti ya Vupfhumba, Khabinete yi hlohlotela MaAfrika-Dzonga ku sungula tendzo ta ‘Shotleft’ to ya eka swifundzakulu swa ka hina swo hambanahambana..     Khabinete yi tlhele yi amukela xiboho hi Air Belgium ku hahisa swihahampfhuka swa tinguva kuya eAfrika-Dzonga, kusukela n’hweti leyi (Ndzati), leswi nga ta nyika matimba eka vupfhumba na ku tiyisisiwa ku ya emahlweni xiyimo xa hina tanihi ndhawu ya vupfhumba leyi nga yi hlawulaka.
","kuMbutho woMbhoxo waseMzantsi Afrika kunye neSixeko saseKapa ngokusingatha ngempumelelo itumente yesibhozo yeNdebe yeHlabathi yoMbhoxo ye-Sevens phakathi komhla we-9 kunye nowe-11 kweyoMsintsi ngowama-.
",0.80007833
"Swi ta katsa swihahampfhuka swa vhiki na vhiki swo ya eKapa na le Joni     Mahungu.
","Oku ibikokokuqala ukuba lo mnyhadala ubalulekileyo usingathwe lilizwe lase-Afrika kwaye amawaka amaninzi abalandeli abebezimasile bayoliswa ngetheko lombhoxo kunye nobubele odume ngabo uMzantsi Afrika.
",0.6423167
"Ku hoyozelaKhabinete yi hundzisa vuhoyozeri bya yona na ku navelela leswinene eka:Phuresidente William Samoei Ruto wa Rhiphabuliki ya Kenya, loyi nga vekiwa exitulwini hi Ravumbirhi, 13 Ndzati 2022, endzhaku ka nhlawulo wa rixaka wo rhula lowu veke hi siku ra 9 Mhawuri.
","Amazwi ovelwano      IKhabhinethi ivakalisa amazwi ovelwano kusapho nakubahlobo: babantwana besikolo abali-18 kunye nabantu abadala ababini abasweleke kwingozi emanyukunyezi e-Pongola, KwaZulu-Natal ngoLwesihlanu, ngomhla we-16 kweyoMsintsi yowama-2022 emva kokuba ilori esisigadla esinamatroko ithe yangqubana okweenkunzi zegusha kunye neveni ebithwele abafundi     Izikhundla.
",0.8045554
"Xandla xa Phuresidente David Mabuza yile eka ntirho wa ku vekiwa exitulwini hi ku yimela Phuresidente Ramaphosa, na mfumo na vanhu va Rhiphabuliki ya Afrika-Dzonga.
","Zonke izikhundla zixhomekeke ekuqinisekisweni kwamabakala emfundo kunye nokuqinisekiswa okufanelekileyo kwezokhuseleko     UMnu Makgothi Samuel Thobakgale njengoMlawuli-Jikelele (i-DG):  UMkomishinala weSizwe weSebe leeNkonzo zoLuleko     UGq Malixole Percival Mahlati njengeSekela lika-DG: Iinkonzo zeMpilo zeziBhedlele zaMaziko eMfundo Ephakamileyo kunye noPhuhliso lwezaBasebenzi kwiSebe lezeMpilo     UMnu Siyabonga Blessing Mdubeki njengoNocanda-Jikelele oyiNtloko kwiSebe lezoLimo, uBuyekezo loMhlaba noPhuhliso lwasemaPhandleni     UMnu Phaswa Phineas Mamogale njengeGosa eliyiNtloko lezeziMali kwiSebe lezeMpilo..     IKhabhinethi ivume ukuqeshwa kwaba balandelayo     UMnu Tshediso Matona njengoMkomishinala weKomishoni yokuXhotyiswa kwabaMnyama ngokuBanzi kwezoQoqosho     Amalungu eSigqeba seziBheno seBhodi yeFilimu noPapasho:  UMnu Siyazi Tyamtyam (uSihlalo); UNksz Sohani Natasha Chundhur;UNksz Sisanda Nkoala;UNks Shandukani Mulaudzi;UNks Nomaswazi Rachel Shabangu-Mndawe;UGq Litheko Modisane;UMnu Phuti Nehemia Phukubje;UMnu James Shikwambana; kunyenoNksz Manko Thalitha Bufffel (uqeshiwe kwakhona).
",0.68546546
"Nsirhelelo wa mati.
","Ugcino lwamanzi.
",0.91155946
"Khabinete yi khense vanhu va Afrika-Dzonga eka ku landzelela swipimelo swa mati leswi tirhisiweke eka swiphemu swo karhi swa Joni, Tshwane na Ekurhuleni ku tshamisekisa ntalo wa vuhlayiselamati.
","IKhabhinethi ibulele abemi boMzantsi Afrika ngokuthobela izithintelo zokusebenzisa amanzi eziphunyezwe kwiindawo ezithile zaseRhawutini, eTshwane nase-Ekurhuleni ngeenzame zokuzinzisa umthamo omumethwe ngoovimba bamanzi.
",0.94494057
"Madamu na vuhlayiselamati swi tshama swi ri ehansi ka ntshikelelo hikwalaho ka mahiselo ya le henhla eGauteng, naswona ku laviwa loku tlakukeke ku sindzise Rand Water ku hunguta mphakelo wa mati eka timasipala hi mpimo lowukulu.
","Amadama kunye noovimba banomthamo ongaphantsi koxinzelelo ngenxa yobushushu obukwiqondo eliphezulu e-Gauteng, kwaye ukwanda kwemfuneko yamanzi kunyanzelise i-Rand Water ukuba icuthe ngesaquphe unikezelo lwamanzi kwaba masipala.
",0.9491679
"Vulawuri bya mati byi phakela mati yo nwa yo tala eka kutlula 11 wa timiliyoni ta vanhu eGauteng, swiphemu swa Mpumalanga, Free State na N'walungu-Vupeladyambu.
","Eli ziko lamanzi libonelela ngobuninzi bamanzi aselwayo kubantu abangaphezu kwezigidi ezili-11 e-Gauteng, kwiindawo zaseMpumalanga, eFreystata naseMntla Ntshona.
",0.9475657
